601,2025-05-25,"Warning To U.S. Stock Investors Issued By CDS Markets US CDS spreads suggest US debt is riskier than official ratings indicate, while equities remain complacent. Learn why the risk-reward in US stocks is poor now."
602,2025-05-27,"Nvidia Has A Demand Problem Nvidia Corporations Q1 FY 2026 earnings are highly anticipated, but the companys demand outlook is troubling. Click here to find out why NVDA stock is a Sell."
603,2025-05-27,"Meet the Monster Quantum Computing Stock That Continues to Crush the Market Several companies in the Magnificent Seven are investing heavily in quantum computing, but another player in the background boasts a better stock price return over the last year than all of them."
604,2025-05-28,AVEDA Launches In The U.S. Amazon Premium Beauty Store Amazon.com Inc: * AVEDA LAUNCHES IN THE U.S. AMAZON PREMIUM BEAUTY STORESource text:Further company coverage: ...
605,2025-05-28,Magnificent Seven ETF wobbles as Big Tech stocks trade mixed ahead of Nvidia earnings Magnificent Seven ETF wobbles as Big Tech stocks trade mixed ahead of Nvidia earnings
606,2025-05-28,"1 Growth Stock Down 15% to Buy Right Now Despite near-term uncertainty, Amazon is  poised to benefit from a major AI tailwind.  Amazons start-up mentality and massive financial resources make for a great combination.  Investors should not stick their heads in the sand and ignore Amazons challenges."
607,2025-05-28,"Amazons car software deal with Stellantis is ending, report says Amazon’s (AMZN) partnership with Stellantis (STLA) to build car software that was supposed to create “a sustainable, software-defined future” of driving is “winding down,” Reuters confirmed on Wednesday."
608,2025-05-29,"Analyzing the Current Earnings Outlook The Q1 reporting cycle is now effectively behind us, with results from less than two dozen S&P 500 members still awaited at this stage."
609,2025-05-29,The Mag 7 Aren’t Clones. How to Decide What to Buy Now. The Mag 7 Aren’t Clones. How to Decide What to Buy Now.
610,2025-05-29,"Meet Billionaire Bill Ackmans Newest Artificial Intelligence (AI) Stock, Which I Predict Will Become Wall Streets First $5 Trillion Company (Hint: Its Not Nvidia) Pershing Squares initial foray into artificial intelligence (AI) came when it opened a position in Alphabet.  Ackman has cited Alphabets unique ecosystem and attractive valuation as reasons his hedge fund invested in it.  Looking at these filings can be quite interesting for retail investors, as they show what Wall Streets high-profile investors have been up to recently."
611,2025-05-29,Nvidia Stocks Post-Earnings Bump Might Not Last Nvidia Corporation beats Q1 FY26 estimates but faces future challenges with China export restrictions. Check out my updated look at NVDA stock and its earnings.
612,2025-05-30,"Tracking Ray Dalios Bridgewater Associates 13F Portfolio - Q1 2025 Update See an update on Bridgewater Associates Q125 portfolio shifts, highlighting top stock changes in tech and retail, diversification strategies, & key holdings."
613,2025-05-30,"‘Time to Stock Up,’ Says Bill Ackman After Pulling the Trigger on Amazon Stock (AMZN) Bill Ackman is making waves again—his Pershing Square Capital Management just made a bold bet on Amazon (AMZN), snapping up nearly $1 billion in stock during Q1 2025. The blockbuster move comes at a time when Amazon is under pressure from tariffs, slowing AWS growth, and fierce AI competition—issues that have dragged the stock down year-to-date. Ackman’s aggressive play has reignited debate on whether now is the moment to buy into Big Tech’s most embattled giant. Despite macroeconomic headwinds"
614,2025-05-30,"Tesla: Sell The News Trade Could Increase As June 12 Robotaxi Launch Date Nears Tesla, Inc. is facing challenges surrounding sales and earnings, while it bets on robotaxi launch in June. Click for our updated look at TSLA stock."
615,2025-05-30,"bolttech integrates AWS Gen AI to enhance efficiency The platform, bolttech Gen AI Factory, was developed using Amazon Bedrock and enhances the existing call centre platform."
616,2025-05-31,"Marvell price target raised to $70 from $60 at TD Cowen TD Cowen raised the firm’s price target on Marvell (MRVL) to $70 from $60 and keeps a Buy rating on the shares. The firm said an in-line print/guide with strong language on 3nm engagement with Amazon (AMZN), but “multiple paths” commentary is likely to continue to concern investors who will be hoping for more detail at the June AI webinar. Long-term momentum is there, but lack of “upside” in a strong spending environment, and inherent limited visibility in custom is likely to keep the stock a ba"
617,2025-06-02,"Billionaire Bill Ackman Wants to Be the Next Warren Buffett, and He Is Buying an AI Stock Up 855% in 10 Years (Hint: Not Nvidia) Billionaire Bill Ackman will turn Howard Hughes Holdings into a modern-day Berkshire Hathaway in an effort to recreate Warren Buffetts success.  Ackmans hedge fund Pershing Square Capital Management recently took a stake in Amazon, an artificial intelligence stock up 855% in the last decade.  Amazon has three major growth opportunities in e-commerce, digital advertising, and cloud computing, and the company is using AI to boost revenue and improve margins."
618,2025-06-02,"German cartel office criticizes use of price control mechanisms by Amazon BERLIN -Germanys federal cartel office on Monday expressed concern about Amazons use of so-called price control mechanisms, saying in a statement that this could constitute an abuse under the..."
619,2025-06-02,"Lawsuit alleges Amazon denied leave to worker with ectopic pregnancy The worker claimed Amazon violated the PWFA, the ADA and the FMLA when it denied her request for leave and then fired her without engaging in any interactive process."
620,2025-06-02,"Amazon Stock Gets Price Target Hike As Analyst Sees Robotics, AI Boosting Retail Profits Amazon is early in a robotics push that could save billions annually, according to BofA Securities."
621,2025-06-03,"New York Times price target raised to $55 from $53 at Guggenheim Guggenheim analyst Curry Baker raised the firm’s price target on New York Times (NYT) to $55 from $53 and keeps a Neutral rating on the shares after updating the firm’s model to reflect the multi-year Amazon (AMZN) licensing agreement for editorial content from The New York Times, NYT Cooking, and The Athletic for AI-related uses and for real-time display of summaries/short excerpts of Times content within Amazon products. Though the company did not provide any financial details, the firm estima"
622,2025-06-03,"IVE: Value Has Been Lagging For A Decade IVE is the largest and most liquid S&P 500 Value Index ETF, with sector exposure in tech, financials, and healthcare. Read the report on its performance and other metrics."
623,2025-06-03,"Nvidia’s $1 trillion rally has traders primed to ramp back up (Bloomberg) -- Nvidia Corp. shares have staged a $1 trillion rebound in two months — and investors are betting the rally has further to go as fears about the firm give way to optimism. Most Read from BloombergWhere the Wild Children’s Museums AreBillionaire Steve Cohen Wants NY to Expand Taxpayer-Backed FerryThe Economic Benefits of Paying Workers to MoveAt London’s New Design Museum, Visitors Get Hands-On AccessLA City Council Passes Budget That Trims Police, Fire SpendingLast week’s earnings r"
624,2025-06-03,Commentary: Why businesses want to blame Trump for price hikes Businesses suffer when customers blame them for price hikes. Thats why theyre willing to call out Trumps tariffs as the cause.
625,2025-06-04,"Exclusive-SES $3.1 billion Intelsat deal to gain unconditional EU antitrust nod, sources say BRUSSELS -European satellite company SES is set to win unconditional EU antitrust approval for its $3.1-billion bid for rival Intelsat, people familiar with the matter said, creating a major European..."
626,2025-06-04,"Credo: Quietly Becoming AIs Favorite Cable Guy - Buy Call Credo Technology Group Holding Ltd targets two hyperscalers & diversifies beyond Amazon, driving Q4 growth. Click for more on CRDOs AI-driven datacenter trends."
627,2025-06-04,"Harbor Capital Appreciation Fund Q1 2025 Commentary During Q1 2025, the Harbor Capital Appreciation Fund returned -10.07%, underperforming its benchmark, the Russell 1000Â® Growth Index, which returned -9.97%."
628,2025-06-05,"Diamond Hill Select Strategy Q1 2025 Commentary Markets were mixed in Q1 as the new presidential administration made repeated waves with an avalanche of activity, which left markets uncertain of the likely path forward."
629,2025-06-05,"Amazon.com (AMZN) Turns Up the Heat in CTV Ad Wars With Fresh DSP Discounts We recently published a list of 10 AI Stocks on Wall Street’s Radar. In this article, we are going to take a look at where Amazon.com Inc. (NASDAQ:AMZN) stands against other AI stocks on Wall Street’s radar. On June 2, Citizens JMP analyst Nicholas Jones reiterated a “Market Outperform” rating on Amazon.com, Inc. (NASDAQ:AMZN) with […]"
630,2025-06-06,"Jobs report, consumer credit, Summer Games Fest: What to Watch Market Domination Overtime hosts Julie Hyman and Josh Lipton preview the top market stories and headlines Wall Street will be paying attention to tomorrow, Friday, June 6, including the May jobs report, Aprils consumer credit reading, and the 2025 Summer Games Fest kicks off, where many video game developers like Sony (SONY), Microsoft (MSFT), and Nintendo (NTDOY, 7974.T) will be in attendance. To watch more expert insights and analysis on the latest market action, check out more Market Domination Overtime here."
631,2025-06-06,"Amazon Launches Agentic AI Group to Enhance Its Warehouse Robots, Reports Say Amazon has assembled a research and development team to develop an agentic artificial intelligence framework for its robotics division, according to reports."
632,2025-06-06,"Amazon commits to stepping up fake-review fight after UK watchdogs investigation Amazon has pledged to beef up fight against fake reviews, Britains competition regulator said Friday after an investigation into whether big online platforms are doing enough to crack down on phony online ratings for products and services.  The Competition and Markets Authority said it secured the “undertakings” from Amazon, after getting a similar agreement earlier this year from Google to clamp down on rogue reviews plaguing the internet.  The company promised to strengthen its existing systems for fighting fake reviews."
633,2025-06-06,"Amazon pops on US-China talks, silver prices, Applied Digital gains Yahoo Finance host Brad Smith tracks todays top moving stocks and biggest market stories in this Market Minute, including Amazons (AMZN) stock boost following Presidents Trump and Xi Jinping phone call, silver (SI=F) prices move higher, and Applied Digital (APLD) extending its gains this week after signing a $7 billion AI infrastructure deal with CoreWeave (CRWV) Stay up to date on the latest market action, minute-by-minute, with Yahoo Finances Market Minute."
634,2025-06-07,"Digital ad budgets slowing in 2025, UBS finds Investing.com -- Growth in digital advertising budgets is set to slow in 2025, according to a UBS, signalling caution amid economic uncertainty and potential tariff impacts."
635,2025-06-07,2 No-Brainer Stocks Id Buy Right Now Without Hesitation Constellation Software is a growth machine that has a huge opportunity in the vertical software industry.  Buying stocks of companies benefiting from long-term industry trends can help you identify rewarding investment opportunities.  The following companies are serving growing demand in the semiconductor and software industries.
636,2025-06-08,"Why the tech trade is still alive and well Big Tech names keep leading market gains with double-digit earnings growth and ongoing investments in data centers and energy. Noel Dixon, State Street Global Markets senior macro strategist, joins Catalysts to explain why he expects tech earnings to stay resilient and why two Federal Reserve interest rate cuts are still likely this year. To watch more expert insights and analysis on the latest market action, check out more Catalysts here."
637,2025-06-09,Citi Lifts S&P 500 Estimate as Stocks Eye New Record Citi Lifts S&P 500 Estimate as Stocks Eye New Record
638,2025-06-09,"Want To Lose Money? Let Politics Rule Your Investment Decisions. Discover smart investment strategies: stay disciplined, manage cash reserves, and seize market opportunities while ignoring short-term political noise."
639,2025-06-09,"The Best ETF to Invest in the AI Boom Without Betting on Just One Stock The new IVES ETF gives you expert guidance for AI investing.  The AI revolution is here.  Over the next decade, many experts believe that the artificial intelligence market will grow from a few hundred billion dollars in value to nearly $5 trillion."
640,2025-06-10,"Want $1 Million in Retirement? Invest $100,000 in These 3 Stocks and Wait a Decade These technology giants have proven their staying power, yet still have the growth potential to lift your portfolio to breathtaking heights."
641,2025-06-10,"Fund manager who sold Tesla, just in time, says investors are overlooking these tech bargains Fund manager who sold Tesla, just in time, says investors are overlooking these tech bargains"
642,2025-06-10,"Dow Jones Futures: Amazon, Circle, Palantir, Tesla Rally Ahead Of Key Inflation Reports Dow Jones Futures: Amazon, Circle, Palantir, Tesla Rally Ahead Of Key Inflation Reports"
643,2025-06-10,"Amazons Next Leap Forward In Advertising Could Boost Market Cap Amazons push into TV advertising, especially via sports rights, is a bold strategy to unlock a $100B+ market opportunity. Read why I remain a buy on AMZN stock."
644,2025-06-11,Amazon Announces 3 AI-Powered Innovations To Get Packages To Customers Faster Amazon.com Inc: * AMAZON: ANNOUNCES 3 AI-POWERED INNOVATIONS TO GET PACKAGESTOCUSTOMERS FASTERFurther company coverage: ...
645,2025-06-11,"Talen Energy and Amazon, Urban Outfitters: Trending Tickers Talen Energy (TLN) expands its nuclear energy deal with Amazon (AMZN) to power the tech giants AI data centers. Shares of the energy stock get a boost Wednesday morning on this headline. Retailer Urban Outfitters (URBN) receives an upgrade to Outperform by Baird analysts. To watch more expert insights and analysis on the latest market action, check out more Wealth here."
646,2025-06-11,"Wall Street Lunch: Tariffs Impact On Inflation Muted In May Inflation dodged the tariff bullet again. The May Consumer Price Index rose +0.1% M/, less than the +0.2% consensus and the 0.2% increase in April."
647,2025-06-11,"IBD Stock Of The Day: Amazon Breaks Out Amid Tariff Relief, Cloud AI Push Amazon is the IBD Stock of the Day for Tuesday.  In its push to be an artificial intelligence leader, Amazon has pledged major U.S. investments into cloud infrastructure in recent days.  Amazon Web Services is the leading cloud provider."
648,2025-06-12,"Netflix co-CEO sees Warner split as part of broader ‘shakeout’ (Bloomberg) -- Warner Bros. Discovery Inc.’s decision to split into two independent companies is a sign of a broader “shakeout” across a media industry that has become increasingly dominated by streaming and on-demand services, Netflix Inc. co-Chief Executive Officer Greg Peters said.Most Read from BloombergShuttered NY College Has Alumni Fighting Over Its FutureTrump’s Military Parade Has Washington Bracing for Tanks and WeaponryNYC Renters Brace for Price Hikes After Broker-Fee BanNY Long Isla"
649,2025-06-12,"Can Shopifys Expanding Merchant Base Sustain Its Growth Momentum? SHOP expands its merchant base with tools like Shop Pay and new partnerships, but faces mounting pressure from AMZN and BABA."
650,2025-06-12,"New Findings from NSC Grant Recipients Help Tackle Americas Most Common Workplace Injury The National Safety Council released findings from 2023-2024 MSD Solutions Lab Research to Solutions (R2S) and MSD Solutions Pilot Grant programs. Results showed practical applications and measurable progress toward reducing musculoskeletal disorders (MSDs), the most common workplace injury."
651,2025-06-13,Walmart and Amazon have a shocking new plan Amazon and Walmart are reportedly mulling the launch of their own stablecoins.
652,2025-06-13,"Silent Giant TSMC Returns to the Peak of its Powers as the AI Boom Continues AI and U.S. growth stocks have rebounded to record highs after their slump in February and March, rewarding those who bought the dip, especially in the IT and AI sectors. At the heart of this resurgence is Taiwan Semiconductor Manufacturing (TSM), better known as simply “TSMC”, the silent powerhouse behind the AI boom. The stock is within grasp of yet another historic high around the $225 mark. TSMC produces the chips that drive everything from Nvidia’s GPUs to Apple’s iPhones, and it’s now expe"
653,2025-06-14,"2 Artificial Intelligence (AI) Stocks That Could Dominate the Rest of 2025 Advanced Micro Devices has reported three consecutive quarters of accelerating revenue growth, and the stock is starting to respond.  Amazon has a monster opportunity in robotics that isnt reflected in its current valuation.  After falling earlier this year, Advanced Micro Devices (NASDAQ: AMD) and Amazon (NASDAQ: AMZN) are starting to see their share prices rise."
654,2025-06-14,"Is Rokus Strategy for Devices Segment Holding Back Its Profitability? ROKUs Devices arm fuels user growth but drags on margins, despite strong unit sales and strategic importance."
655,2025-06-14,"Crypto Currents: Coinbase, Shopify partner for USDC payments As bitcoin, ethereum and other cryptocurrencies get increasing attention from investors, Wall Street and its traditional banks continue to adjust to the shift. Catch up on this week’s top stories highlighting the intersection of these old guard and new school areas of finance with this recap compiled by The Fly. COINBASE, SHOPIFY PARTNER FOR USDC PAYMENTS: On Thursday, Coinbase (COIN) announced a partnership with Shopify (SHOP). The company said, “We are working together to bring commerce onchai"
656,2025-06-14,Amazon Restructures Health Services Business By Katherine Hamilton Amazon.com is restructuring its health services business. The e-commerce giant is trying to simplify Amazon Health Services by reducing layers and hiring leaders for six...
657,2025-06-16,"I Would Put $5,000 Into These Stocks and Never Sell Amazons diversified business and multiple revenue streams help ensure its long-term success.  The company uses its e-commerce business to fund innovative, higher-margin ventures.  Visa enjoys organic growth from its global payments system because of the network effect."
658,2025-06-16,Big Tech ETF posts sharp rally to outperform S&P 500 Big Tech ETF posts sharp rally to outperform S&P 500
659,2025-06-17,SMH: Chips Are Still Hot And Owning The Sector Could Outperform The Market Again Explore long-term growth in the booming semiconductor sector with SMH.
660,2025-06-18,"Prediction: 2 Stocks Thatll Be Worth More Than Apple 5 Years From Now Apple is one of the largest companies in the world, but its growth has slowed, and it is lagging in AI.  Amazon, meanwhile, is an AI leader, using the technology to drive growth and efficiencies.  Meta Platforms is also at the forefront of AI, using the technology to increase user engagement on its platform and improve the effectiveness of its ads."
661,2025-06-18,Marvell Stock Surges. What Could Keep Its AI Chip Rally Going. Shares popped after the chip designer raised expectations for its total addressable market in the custom AI processor business.
662,2025-06-18,This Cathie Wood Stock Just Got a Ginormous Amazon Boost Shares of this growth stock gained 10% after linking up with tech giant Amazon.
663,2025-06-18,Amazon CEO says AI will mean fewer jobs at the company. Here’s his advice on how people can keep theirs. Amazon CEO says AI will mean fewer jobs at the company. Here’s his advice on how people can keep theirs.
664,2025-06-18,"Agentic AI Competition Heats Up. Analyst Sees Meta, Amazon Among Early Winners. BofA analysts say that Meta stock, Amazon and Booking Holdings could be early winners in the race to offer agentic AI."
665,2025-06-18,"Amazon: Bulls Were Wrong Before, And They Are Wrong Once Again Amazons stock underperformed the market during a time of unprecedented tailwinds for its e-commerce and AWS businesses. Click here to read why AMZN is a Hold."
666,2025-06-18,AI May Ultimately Tame Inflation. It Won’t Sideline the Fed. AI May Ultimately Tame Inflation. It Won’t Sideline the Fed.
667,2025-06-19,"Stablecoin Legislation Will Juice Demand for Treasurys—to a Point Issuers of digital currencies need Treasury bills for their reserves, but analysts say the consequences are uncertain."
668,2025-06-19,AWS Enhances Security Offerings Amazonâs AWS division clearly demonstrated at their recent re:Inforce event that security-based capabilities are the rock upon which future technology developments can be made
669,2025-06-20,"The Weekly Closeout: Authentic hires an Amazon vet, Dôen secures funding Tim Derner joined the brand management firm as the global head of marketplaces, while the apparel brand closed on a Series A funding round."
670,2025-06-20,Meta Wanted to Buy a $30 Billion AI Startup: Report. What It Is Trying Instead. Meta Wanted to Buy a $30 Billion AI Startup: Report. What It Is Trying Instead.
671,2025-06-21,Amazon Just Bet $4 Billion on South Koreas AI Boom -- Heres Why It Could Be a Game-Changer Massive $5B AI data center deal with SK Group sends Korean tech stocks soaring and reshapes Asias digital future
672,2025-06-21,"Nvidia Stock Prediction, From Someone Who Has Invested for Decades The big winner of the first phase of the artificial intelligence (AI) revolution has clearly been Nvidia.  As competition heats up in the AI chips market, cloud services providers could benefit.  In the span of only a few years, Nvidia (NASDAQ: NVDA) has become one of the largest stocks in the world."
673,2025-06-21,3 Life-Changing Stocks to Buy Today Amazon is the leader in two huge growth industries.  MercadoLibre still has a lot of room for growth in both e-commerce and fintech.  Anyone who regularly saves and invests their money in the stock market can build wealth.
674,2025-06-24,"Market Sentiment Is A Powerful Thing - Joe Albano, Tech Cache Tech Caches Joe Albano is thinking about todays market and what the next pullback looks like. 4 assets in focus and why valuation is not enough to get an edge."
675,2025-06-25,"Webscale Market Tracker Report, 1Q25: AI Hype Propels Capex to $97B, Sets New Spending Records for 1Q25 Big tech firms, including new entrant CoreWeave, broke records with $652B in revenue (+9.2% YoY) in 1Q25. Capex soared 67.2% due to AI trends, while employment was flat at 4.17M. Key growth players include Alphabet, Amazon, Meta, and Microsoft. Regional recovery is seen in Asia with a 7% YoY revenue increase.Dublin, June 25, 2025 (GLOBE NEWSWIRE) -- The Webscale Market Tracker, 1Q25: AI FOMO Pushes 12 Month Capex To $340B, Passing Telco Market report has been added to ResearchAndMarkets.coms"
676,2025-06-25,CoreWeave Vs Nvidia: Which AI Stock is the Better Investment Investors may be wondering if the hype for CoreWeaves stock is overdone or if the company is potentially a better AI investment than chip giant Nvidia.
677,2025-06-25,Nvidia Ruffles Tech Giants With Move Into Cloud Computing Nvidia Ruffles Tech Giants With Move Into Cloud Computing
678,2025-06-25,Why Meta’s $14.3 Billion Deal to Buy Scale AI Is Great News for Reddit Stock The massive $14.3 billion deal between Meta and Scale AI has sparked optimism for Reddit’s future.
679,2025-06-26,"By the numbers: What we know about Bezos wedding in Venice Its likely the most expensive wedding this year. Though details of the wedding between Amazon multi-billionaire Jeff Bezos and Lauren Sanchez are sketchy, its certainly causing a storm, not least in..."
680,2025-06-26,"The Magnificent 7 Is Splitting. Why Microsoft and Meta Are Top of the Heap. Both companies have bigger year-to-date gains than Nvidia, though the chipmaker has a larger market capitalization."
681,2025-06-26,"Prediction: 2 Stocks That Will Be Worth More Than Apple by 2030 Amazons operating income growth is a vital metric.  Alphabet is drastically undervalued for its performance.  Apple (NASDAQ: AAPL) was the defining stock of the late 2010s and into the early 2020s, but time is up for its leadership position."
682,2025-06-26,"Marvells AI Refresh: Wounded Tiger, Hidden Dragon Marvell Technology has long-term potential, but the valuation is questionable. Click here for a full investment analysis of MRVL stock."
683,2025-06-26,"Prologis Uncertain times are good for Prologis, the worlds largest industrial property company, whose 1.3 billion square feet of warehouse space in 20 countries serve 6,700..."
684,2025-06-27,"Amazon, Alphabet, Estee Lauder: Upgrades & Downgrades Market Catalysts Host Brad Smith is joined by ProShares global investment strategist Simeon Hyman to discuss some of the stocks that got upgrades and downgrades. Analysts at BNP Paribas Exane upgraded Amazon (AMZN) shares to OutPerform from Neutral on optimism for the e-commerce giants next earnings report. The firms analysts downgraded shares of Alphabet (GOOG, GOOGL) to Neutral from Outperform with analysts seeing short-term risks to the companys earnings. Share of Estée Lauder (EL) were upgraded to Buy from Hold optimism about the companys cost-cutting and turnaround efforts. To watch more expert insights and analysis on the latest market action, check out more Market Catalysts here."
