501,"US importers, whip-sawed by tariff uncertainty, move to sidelines So many U.S. companies rushed in goods to avoid President Donald Trumps many threatened tariffs that imports soared to near-record levels in recent weeks. Now, retailers and other importers are..."
502,"The Stock Market Has Crashed: My Top 5 Dirt Cheap Tech Stocks to Buy Now President Trumps announcement of tariffs on imports from countries worldwide has rocked the stock market -- and the tech-heavy Nasdaq Composite (NASDAQINDEX: ^IXIC) has led the decline, crashing more than 20% from its most recent high.  Why are tech stocks being hit so hard?  All this has prompted investors to worry about tech earnings ahead, fleeing shares of these companies."
503,"Amazon needs to stay the worlds largest startup, CEO says Amazon (AMZN) CEO Andy Jassy said the company needs to operate like the “world’s largest startup” on Thursday in his annual letter to shareholders — which means continuing to invest in AI, cutting bureaucracy, and expanding into different realms."
504,Amazon launches inbound-only LTL service Amazon has announced an inbound-only less-than-truckload service providing vendors that can’t fill a full trailer with a cheaper option to ship freight to its distribution centers. The post Amazon launches inbound-only LTL service appeared first on FreightWaves.
505,"Is Amazon.com Inc. (NASDAQ:AMZN) the Best Tech Stock to Buy For Long-Term Investment? We recently published a list of 12 Best Tech Stocks to Buy For Long-Term Investment. In this article, we are going to take a look at where Amazon.com Inc. (NASDAQ:AMZN) stands against other tech stocks to buy for long-term investment. On April 1, Chris Verrone, chief market strategist at Strategas Research Partners, appeared on CNBC’s […]"
506,"“Screw the Chinese or Get Screwed!” – Jim Cramer’s Bold Amazon.com (AMZN) Take We recently published a list of Jim Cramer Discussed These 12 Stocks. In this article, we are going to take a look at where Amazon.com, Inc. (NASDAQ:AMZN) stands against other stocks that Jim Cramer discussed. On Thursday, Jim Cramer, host of Mad Money, described the 145% duty on China as so extreme that it essentially […]"
507,"Amazon.com (AMZN) Sold Off in Q1 Along with Peers Investment management company Vulcan Value Partners recently released its first-quarter 2025 investor letter. A copy of the letter can be downloaded here. The first quarter experienced the return of volatility. The companies’ management teams expressed a more cautious view following the recent election. Optimism has given way to uncertainty about tariffs and potential impacts on earnings, inflation, […]"
508,"As beauty continues to grow, TikTok Shop and Amazon will gain share That comes at the expense of drugstores, department stores, mass merchandisers and even specialty beauty retailers, per TD Cowen."
509,"Reddit, Pinterest, and Other Stocks That Look Like Better Buys Than the Mag 7 Reddit, Pinterest, and Other Stocks That Look Like Better Buys Than the Mag 7"
510,"Amazon Asks Its Sellers About Tariff Impacts Amazon.com has emailed its third-party sellers in recent days asking how tariffs are impacting their businesses, from sourcing to pricing strategies and international sales, according to a copy viewed by The Wall Street Journal.  “We’re still dealing with the repercussions of various tariff policies, and I believe it’s crucial for us that you share current experiences and strategies,” the email says.  Amazon also asked in the email about the merchants’ use of the company’s logistics services, which many sellers use to pack and ship their products."
511,"NVIDIA Corp., Amgen share losses contribute to Dows 886-point drop NVIDIA Corp., Amgen share losses contribute to Dows 886-point drop"
512,"After surge to record highs, gold overtakes Magnificent 7 as the most crowded trade on Wall Street Gold bumped the Magnificent Seven tech stocks to take the top spot as a crowded trade, according to a BofA survey."
513,"Amazon.com, Inc. (AMZN) – “Amazon vs. China”: Jim Cramer Warns of a Coming Stock Shortage We recently published a list of Jim Cramer’s Game Plan: 15 Stocks to Watch. In this article, we are going to take a look at where Amazon.com, Inc. (NASDAQ:AMZN) stands against other stocks that Jim Cramer discusses. On Friday, Mad Money host Jim Cramer outlined what investors should focus on in the week, especially pointing […]"
514,"Crosswalk buttons play hoax Bezos message in Seattle Crosswalk buttons in Seattle were tampered with to play a spoof recording of Amazon founder Jeff Bezos voice, days after a similar prank occurred in California.The messages, which were reported at..."
515,"170 Million Users At Stake: Tim Stokelys Zoop Makes Last-Minute TikTok Bid, Promising Creators The Lions Share Of Ad Revenue Tim Stokely, the founder of subscription content platform OnlyFans, has submitted a last-minute bid to acquire TikToks U.S. operations. Stokelys offer comes through Zoop, a social media platform he helped launch. It is in partnership with the HBAR Foundation, which oversees the treasury of the Hedera cryptocurrency network. The bid promises to radically change how creators earn on the platform by distributing 80% of ad revenue directly to content creators and users, according to a press releas"
516,"Tech Leaders Who Backed Trump Have Lost $1.8 Trillion. Tariffs Described As Armageddon For The Sector Tech companies like Amazon, Meta, Google, Tesla, and Apple gave millions of dollars to Trump during his campaign and for his inauguration Now the businesses have lost a collective $1.8 trillion, thanks to reciprocal tariffs Wedbushs Dan Ives called the levies an economic armageddon for the tech sector Several Silicon Valley leaders were among President Donald Trumps biggest supporters during the election and his inauguration. Now, theyre seeing their wallets take a major hit thanks to his p"
517,Warning: These REITs Are A Dumpster Fire In 2025 We live in a highly challenging macro environment where many REITs are struggling with rising rates and weak demand. Learn which REITs to avoid right now.
518,"Dow Jones Slides 550 Points On China Trade Warning; Nvidia, Tesla Sell Off Dow Jones Slides 550 Points On China Trade Warning; Nvidia, Tesla Sell Off"
519,Amazon Stock Slips After Price Target Cut on China Tariff Warnings Analyst cites rising costs and exposure to China trade tensions as Amazons stock continues to lag in 2025
520,"Amazon Pushes Vendors on Price Hikes Amazon has “cost support agreements” in place with some vendors to ensure that it makes consistent margins on the products it buys from them and sells to customers, according to consultants who work with Amazon vendors.  Vendors that have tried to charge Amazon more for products it sells since President Trump’s tariff agreements are finding that they are responsible for paying the company to make up for the upcharge.  Vendors have been asked more frequently by Amazon in recent weeks to pay, the consultants said."
521,"Stock Market Today: Dow Jones Dives After Trump Does This; Netflix Tests Entry, Bill Ackman Stock Skids (Live Coverage) Stock Market Today: Dow Jones Dives After Trump Does This; Netflix Tests Entry, Bill Ackman Stock Skids (Live Coverage)"
522,"University of Groningen: How do you arm yourself against the power of Big Tech? How can we all become less dependent on Big Tech? A current and pressing question that also plays within the RUG. Recently, a petition was carried out by a group of staff members who advocate that the..."
523,Trump’s Powell Attack Put Stock Markets on Fed Alert. There’s Plenty More to Worry About and 5 Other Things to Know Today. Trump’s Powell Attack Put Stock Markets on Fed Alert. There’s Plenty More to Worry About and 5 Other Things to Know Today.
524,"Stock Market Sell-Off: The Best Warren Buffett Stock to Buy Now Warren Buffett is one of the most successful investors of all time, with a performance that easily surpasses  the S&P 500s average.  Below, Ill explore why e-commerce giant Amazon (NASDAQ: AMZN) could make an excellent long-term pick in this uncertain macroeconomic environment.  While Warren Buffett is a hugely successful investor, he isnt infallible."
525,"34.4% of Warren Buffetts $265 Billion Portfolio Is Invested in 4 Artificial Intelligence (AI) Stocks Warren Buffett has served as the CEO of the Berkshire Hathaway (NYSE: BRK.A)(NYSE: BRK.B) holding company since 1965.  Had you invested $1,000 in Berkshire stock when he took the helm, it would have been worth a whopping $44.7 million at the end of 2024.  Buffett and his team oversee a $265 billion portfolio of stocks and securities, in addition to several wholly owned subsidiaries."
526,"Here’s How Big the AI Revolution Really Is, in Four Charts It’s as transformative as the internet itself. Here are the key players in the generative-AI battle, and where they stand right now."
527,"Positioning your portfolio amid trade uncertainty: 3 stock picks Blanke Schein Wealth Management chief investment officer Robert Schein joins Market Domination Overtime with Julie Hyman and Roundhill Investments CEO Dave Mazza to discuss the latest market action and some of his stock picks. To watch more expert insights and analysis on the latest market action, check out more Market Domination Overtime here."
528,Whirlpool CEO: Call me pro tariff Whirlpool chair and CEO Mark Bitzer says tariffs from the Trump administration will help his company.
529,"Earnings Dominating But Dont Sleep On Economic Data Trump commentary on Powell. Fed rate cuts. Netflix up, backing off guidance. Important earnings coming."
530,Are Magnificent 7 stocks still worth the hype? Heres how readers voted Mag 7 earnings kick off and investors will be keen to see if they are still magnificent.
531,"Newsom Says California Is Now the World’s Fourth-Biggest Economy (Bloomberg) -- California Governor Gavin Newsom boasted that his state has become the world’s fourth-largest economy, following only the US, China and Germany in global rankings.Most Read from BloombergTrump Gives New York ‘One Last Chance’ to End Congestion FeeWhy Car YouTuber Matt Farah Is Fighting for Walkable CitiesBackyard Micro-Flats Aim to Ease South Africa’s Housing CrisisThe Racial Wealth Gap Is Not Just About MoneyTo Fuel Affordable Housing, This Innovation Fund Targets Predevelopment"
532,Hold Your Horses On Nvidia: Why Long-Term Risks Temper The AI Euphoria Nvidia Corporations soaring AI-driven growth faces export controls and valuation risks. Click here to find out why I rate NVDA stock a Hold.
533,"Mag 7 earnings, PCE data, April jobs report: What to Watch Heres what investors are watching during the week starting Monday, April 28. Magnificent Seven earnings will continue, with Microsoft (MSFT), Meta (META), Apple (AAPL), and Amazon (AMZN) set to release quarterly results throughout the week. The market will receive fresh economic data on Wednesday, when Personal Consumption Expenditure (PCE) data will be released, and on Friday, when the newest jobs report will be released. To watch more expert insights and analysis on the latest market action, check out more Market Domination Overtime here."
534,"Mag 7 Earnings Preview: What Can Investors Expect? We get into the heart of the Q1 earnings season this week, with more than 800 companies reporting results, including four Magnificent 7 members and 173 other S&P 500 members. How are expectations shaping up?"
535,"Dow drops nearly 450 points on losses in shares of Amazon.com Inc., Nike Dow drops nearly 450 points on losses in shares of Amazon.com Inc., Nike"
536,"Amazon.com, Inc. (AMZN): Among Billionaire Cliff Asness’ Stock Picks with Huge Upside Potential We recently published a list of Billionaire Cliff Asness’ 10 Stock Picks with Huge Upside Potential. In this article, we are going to take a look at where Amazon.com, Inc. (NASDAQ:AMZN) stands against other billionaire Cliff Asness’ stock picks with huge upside potential. Cliff Asness, the founder, managing principal, and chief investment officer of AQR Capital […]"
537,"Amazon to report first quarter earnings following White House tariff dustup Amazon will report its first quarter earnings after the bell on Thursday, just two days after the White House slammed the company over reported plans to show the impact of tariffs on consumer goods prices."
538,"Jeff Bezos Says An Employee Looked At Me Like I Was the Stupidest Person Theyd Ever Seen — Then Offered A Simple Idea That Changed Amazon Jeff Bezos is known for building Amazon (NASDAQ:AMZN) into a trillion-dollar force. But in the early days, even the founder of one of the worlds most disruptive companies had moments that could only be described as, well, a little embarrassing. Speaking at the Academy of Achievement Summit in 2001, Bezos shared a story that proves even the smartest guy in the room can sometimes miss the obvious. Back in 1995, Amazon was nothing more than a scrappy startup operating out of a 2,000-square-foot ba"
539,"Amazon makes bold move that the White House hates, then walks it back The e-commerce leader is denying claims of a bold new tariff strategy."
540,"Should You Buy the Invesco QQQ ETF During the Nasdaq Bear Market? Heres What History Says The Nasdaq-100 technology index hosts many of Americas largest companies.  The index is in the throes of a bear market after plunging by as much as 23% from its all-time high amid the growing economic uncertainty.  History suggests this could be a great time to buy the Nasdaq-100, and the Invesco QQQ Trust provides investors with a simple way to do so."
541,"Amazon Stock Retreats Ahead of Thursdays Earnings Shares of the tech and retail giant were recently down nearly 3%, outpacing broader markets’ Wednesday slide."
542,"Amazon.com, Inc. (AMZN): Jim Cramer Questions the Downgrade — “Too Much Value to Ignore?” We recently published a list of Jim Cramer Says AI Data Centers Have Potential & Discusses These 9 Stocks. In this article, we are going to take a look at where Amazon.com, Inc. (NASDAQ:AMZN) stands against other stocks that Jim Cramer discusses. In a recent appearance on CNBC’s Squawk on the Street, Jim Cramer commented […]"
543,"Big Techs fortunes diverge as AI powers cloud, tariffs hit consumer electronics (Reuters) -The fortunes of Big Tech are diverging in a rapidly changing business landscape, as demand for artificial intelligence fuels growth in cloud and digital ads while consumer electronics take a battering from President Donald Trumps global trade war.  AI came to the rescue of earnings at Microsoft and Google-parent Alphabet in their March quarter, offering investors hope that their billion-dollar bets on the technology would help them ride out the fallout from sweeping U.S. tariffs.Their upbeat commentary stood in stark contrast to gloomy predictions from companies more exposed to tightening consumer budgets: chipmakers Qualcomm, Samsung Electronics, and Intel warned that economic uncertainty caused by Trumps attempts to reorder global trade was hurting their businesses."
544,"UPS Stock Has Upside Despite Recession Fears UPS beats Q1 earnings estimates, with profit growth driven by cost cuts and domestic segment gains. Read why I rate UPS stock as a buy."
545,"Amazon Guides Q2 Softly, Analysts Unfazed Shares dip after weaker Q2 forecast, but bulls cite stable AWS growth and valuation gap"
546,Ukraine’s Minerals Won’t Help AI and Tech Companies for Years Ukraine’s Minerals Won’t Help AI and Tech Companies for Years
547,Amazon says its maniacally focused on lower prices Amazon says its maniacally focused on lower prices
548,AMAZON COM INC : Gets a Buy rating from DZ Bank Ingo Wermann from DZ Bank retains his positive opinion on the stock with a Buy rating.
549,"Transcript : Amazon.com, Inc., Q1 2025 Earnings Call, May 01, 2025 Presentation Operator MessageOperator Thank you for standing by. Good day, everyone, and welcome to the Amazon.com First Quarter 2025 Financial Results Teleconference. [Operator Instructions]"
550,Anthropic To Buy Back Employee Shares At $61.5 Billion Valuation - The Information May 3 - * ANTHROPIC TO BUY BACK EMPLOYEE SHARES AT $61.5 BILLIONVALUATION- THE INFORMATIONSource text: tinyurl.com/22df8tyrFurther company coverage: ...
551,"Amazon CEO Andy Jassy plays up his retail rivals’ worst nightmare: Trump’s tariffs may actually strengthen Amazon Jassy tried to persuade Wall Street that Amazon will be just fine, despite worries about a tariff war with China."
552,"The AI Trade Is Showing New Signs of Life. What We Learned From Big Tech Earnings. In the biggest surprise of tech earnings, Meta Platforms boosted its already hefty 2025 capex forecast to a range of $64 billion to $72 billion."
553,"Dogs Of The Dow Chase Mays Safer Buy Discover the top Dow Dogs for potential gains of 21%-45% by 2026, with Verizon leading in dividends. Read more on the price gainers for 2026 based on 1-year target prices."
554,"Big Tech Earnings Defy Fears of ‘Worst-Case Scenario’ for Stocks (Bloomberg) -- Investors in the US technology behemoths that dominate the S&P 500 Index are breathing a sigh of relief as last week’s earnings reports from the group show their outlooks remain mostly strong in the face of President Donald Trump’s shifting trade policies.Most Read from BloombergThe Battle Over the Fate of Detroit’s Renaissance CenterNYC Real Estate Industry Asks Judge to Block New Broker Fee LawNJ Transit Strike Would Be ‘Disaster’ for Region, Sherrill SaysNJ Transit Urges Commut"
555,"Dows 175-point drop led by losses for shares of Chevron, Apple Dows 175-point drop led by losses for shares of Chevron, Apple"
556,"Amazon Drops Plan To List Tariff Costs On Site After Trump Administration Calls The Move A Hostile And Political Action Amazon had plans to list tariff prices alongside item totals for some wares, it was reported by Punchbowl News on Tuesday Hours after the news broke, Amazon said the move was not going to happen The change of heart occurred after the White House called the move a hostile and political action, and President Donald Trump made a personal phone call to Amazon founder Jeff Bezos Hours after it was reported that Amazon was planning to include tariff costs on its site, the plan was scrapped entirel"
557,Nvidia Stock Falls. Here’s What’s Weighing on the Chip Maker. Nvidia Stock Falls. Here’s What’s Weighing on the Chip Maker.
558,"Netflix, Other Movie Stocks Fall After Trump Threatens Tariffs on Foreign-Made Films Shares of U.S. studios and entertainment companies dropped Monday, after President Trump called for a 100% tariff on movies produced overseas.  Warner Bros. Discovery stock recently stood 2.7% lower. The company is behind this year’s highest-grossing film, “A Minecraft Movie,” which was partly filmed in New Zealand and Canada."
559,"Fidelity Contrafund Q1 2025  Commentary For Q1 2025, Fidelity Contrafunds Retail Class shares returned -4.05%, versus -4.27% for the benchmark S&P 500Â® index. Click here to read the full commentary. "
560,Sun Country faces slight delays integrating additional Amazon cargo jets Amazon contract carrier Sun Country Airlines says finding parts is slightly slowing deployment of new Amazon freighter aircraft. The post Sun Country faces slight delays integrating additional Amazon cargo jets appeared first on FreightWaves.
561,Big Tech stocks drag down S&P 500 in late-afternoon trading Big Tech stocks drag down S&P 500 in late-afternoon trading
562,CRH Stock Falls Despite Solid Earnings. Nothing Bad Has Happened—Yet. CRH Stock Falls Despite Solid Earnings. Nothing Bad Has Happened—Yet.
563,Palantirs Post-Earnings Plunge: Still Too Pricey Palantir Technologies Inc.s Q1 earnings beat revenue expectations but led to a 13% stock drop. Explore why valuation concerns linger. Click for my PLTR update.
564,Hims & Hers Stock Is Higher After Earnings. The Sales Outlook Looks Low. Hims & Hers Stock Is Higher After Earnings. The Sales Outlook Looks Low.
565,Amazon faces dilemma after DoorDash deal to buy Deliveroo for $3.9 billion Amazon faces dilemma after DoorDash deal to buy Deliveroo for $3.9 billion
566,"Amazon Web Services to Launch Infrastructure Region in Chile By Dean Seal Amazon Web Services plans to invest $4 billion to launch an infrastructure cloud region in Chile by the end of next year. The cloud business of Amazon.com, better known as AWS,..."
567,"Amazon.com, Inc. (AMZN): Among Billionaire Louis Bacon’s Stock Picks with Huge Upside Potential We recently published a list of Billionaire Louis Bacon’s 10 Stock Picks with Huge Upside Potential. In this article, we are going to take a look at where Amazon.com, Inc. (NASDAQ:AMZN) stands against other stock picks with huge upside potential. Louis Moore Bacon is the founder, Chairman, and principal investment manager of Moore Capital Management, a […]"
568,"Walt Disney, Honeywell share gains lead Dows 234-point jump Walt Disney, Honeywell share gains lead Dows 234-point jump"
569,Amazon $84 Million Bet on AMD Signals AI Showdown with Nvidia Massive $84M Stake: Amazons Big Win on AMD Chips
570,"Temus Threat To U.S. Retailers Will Continue To Weaken From Tariff Hit: Analyst Customer engagement with the hit shopping app Temu has declined significantly in the face of President Donald Trumps 145% tariffs on Chinese goods, analysts with Morgan Stanley said Wednesday.  Parent company PDD Holdings stock was lower Wednesday as investors scrutinized how the tariffs will hit PDDs Amazon-challenging Temu business.  Morgan Stanley based its analysis on survey data that found customers shopping less often with the discount-focused Temu."
571,"This Week In E-Commerce - HF Foods Innovates With New Digital Platform And Brand Shift Recent developments in the e-commerce landscape have seen HF Foods Group Inc. launch an innovative platform aimed at enhancing accessibility to specialty products for the U.S. foodservice industry. This initiative is part of HF Foods broader transformation plan and introduces a seamless digital experience for restaurant employees and owners to purchase goods directly. The company also unveiled a new brand identity, signifying a shift towards greater technological integration in their..."
572,"Amazon.com (NasdaqGS:AMZN) Expands Global Presence With AWS Developments in Chile and New Collaborations Amazon.com (NasdaqGS:AMZN) experienced a 8% increase in its share price over the last month, potentially influenced by its strategic initiatives and market dynamics. Notably, the collaboration with Amplitude, enhancing data-driven customer experiences, and the expansive AWS infrastructure plan in Chile may have fortified investor confidence. The recent positive market trend, with tech stocks climbing alongside Bitcoins surge past $100,000, aligned with Amazons strong earnings report, could..."
573,"Amazon.com, Inc. (AMZN): Among Billionaire Larry Robbins’ Stock Picks with Huge Upside Potential We recently published a list of Billionaire Larry Robbins’ 10 Stock Picks with Huge Upside Potential. In this article, we are going to take a look at where Amazon.com, Inc. (NASDAQ:AMZN) stands against other stock picks with huge upside potential. Larry Robbins is an American hedge fund manager and philanthropist who founded Glenview Capital Management in 2000. […]"
574,"Microsoft, Amazon, Google, Palantir Poised to Win Big in AI Cloud Race AI Cloud Boom Puts Software Giants in Spotlight"
575,"Update: Market Chatter: Pledged US Investments of Tech Companies Depend on Research Tax Break, Industry Says (Updates with response from Taiwan Semiconductor Manufacturing in the fifth paragraph.) Tech indu"
576,"Tesla, Amazon, Nvidia stocks set to surge after U.S. and China agree to slash tariffs Tesla, Amazon, Nvidia stocks set to surge after U.S. and China agree to slash tariffs"
577,"US-China tariff agreement may add fuel to Magnificent 7 stock rally The Magnificent Seven trade looks to be on again, for now."
578,Prediction: This Artificial Intelligence (AI) Semiconductor Stock Will Soar After May 28 Most of the major players in the AI landscape have already delivered their Q1 earnings reports -- but Nvidias results are still to come.
579,Invesco Global Focus Fund Q1 2025 Commentary Class A shares outperformed the MSCI ACWI Growth Index and ranked in the 66th percentile of the Morningstar Global Large Stock Growth category for the first quarter.
580,"Microsoft is cutting 3% of its workforce with across-the-board layoffs Microsoft (MSFT) is laying off about 3% of its workforce, its largest headcount cut in more than two years."
581,"1 Incredible Stat About Amazons Business That Could Send Its Stock Soaring Amazon generates the bulk of its revenue from its online marketplace.  Its cloud business, Amazon Web Services, however, is what has been driving its profits.  Amazon (NASDAQ: AMZN) has an amazing and robust business that has enabled it to generate fantastic returns over the years for its shareholders."
582,"Amazon.com, Inc. (AMZN), Meta Platforms, Inc. (META) Delivered the Best Earnings Among the Mag 7, Prominent Investor Says Amazon.com, Inc. (AMZN) and Meta Platforms, Inc. (META) reported the best financial results during the current earnings season among the Mag 7, Stephanie Link, the Head of Investment Solutions at Hightower Advisors said yesterday on CNBC. What’s more, the strength of the companies’ financial results was not appreciated at the time, the well-known investor said. […]"
583,"Walmart: How Tariff Panic Created A Buy Window Ahead Of Earnings Walmart is well-positioned to beat guidance, with strong e-commerce growth and automation improvements. Click here to find out why WMT stock is a Buy."
