580,2025-05-17,"Tech Is Crushing Dividends - And I Love It Tech stocks are outperforming dividend stocks, and even as a dividend investor, I welcome it and explain why. Check out why techâs rise is good news."
581,2025-05-17,Prediction: This Magnificent Seven Stock Will Be the Most Valuable Company in the World in 10 Years This company stands to benefit from the advances in artificial intelligence more than any other business.
582,2025-05-18,"1 Monster Stock to Hold for the Next 5 Years Despite the company’s already massive size, investors should still be able to achieve solid returns going forward.  Heres why this monster stock is a smart buy right now to hold for the next five years.  Theres no question that investors have heard of e-commerce juggernaut Amazon (NASDAQ: AMZN)."
583,2025-05-18,"Anthropic closes $2.5B credit facility, CNBC reports Earlier this week, Anthropic received a $2.5B, five-year revolving credit line to amp up its liquidity in an ever-expanding – and expensive – competition in the artificial intelligence industry, CNBC’s Hayden Field reports. Anthropic, founded by former OpenAI research executives, launched its Claude chatbot in March 2023. The company closed its latest funding round in March at a $61.5B valuation, and the new credit facility adds to that, the author notes. The generative AI market is poised to to"
584,2025-05-19,"Choose France summit to bring 20 billion euros of new investment This years Choose Francebusiness summit hosted by President Emmanuel Macron is expectedto secure 20 billion euros of new investment,his office said on Monday, announcing projects in the..."
585,2025-05-19,Tracking Ken Fishers Fisher Asset Management Portfolio - Q1 2025 Update Fisher Asset Managementâs Q1 2025 portfolio shifts focus with mega-cap tech reductions and energy sector boosts. Check out the significant stake increases here.
586,2025-05-19,"Bear of the Day: United Parcel Service (UPS) UPS faces significant headwinds as it navigates a complex landscape marked by a significant shift in its Amazon relationship, persistent weakness in key international markets, and increasing labor costs."
587,2025-05-20,"Amazon: AWS Powers The Bullish Case In Space, Cloud, And AI Amazons Q1 results surpass expectations with AWS and advertising growth. Discover why AWS, AI, and satellite ventures make AMZN stock a strong buy."
588,2025-05-20,"Audientes to launch Companion on Amazon across 10 European markets in partnership with RMXdirect Press Release no. 06-2025Copenhagen, Denmark - 20 May 2025 - Audientes A/S, the Danish hearing technology company, is expanding its European reach through a strategic partnership with RMXdirect..."
589,2025-05-20,"Dows 260-point fall led by losses in NVIDIA Corp., Apple shares Dows 260-point fall led by losses in NVIDIA Corp., Apple shares"
590,2025-05-20,Janus Henderson Global Sustainable Equity (ADR) Managed Account Q1 2025 Commentary The Portfolio returned 1.05% (gross) and the MSCI World Gross TR returned -1.68%.
591,2025-05-22,Consumer Stocks Have Taken It on the Chin. Buy These 8. Consumer Stocks Have Taken It on the Chin. Buy These 8.
592,2025-05-22,"Amazon com : Technology Innovation Institute and AI71 Collaborate with Amazon Web Services to Scale AI Innovations in the UAE and Beyond Abu Dhabi, UAE - May 21, 2025: Abu Dhabis Technology Innovation Institute , the creator of the globally ranked Falcon series of AI models and security and privacy solutions, as well as AI71, a..."
593,2025-05-23,"Nike to sell to Amazon.com for first time in six years, The Information says Amazon (AMZN) plans to start selling Nike (NKE) products for the first time since 2019, with supplies coming directly from the company, according to The Information’s Theo Wayt and Sara Germano, citing an Amazon spokesperson. Published first on TheFly – the ultimate source for real-time, market-moving breaking financial news. Try Now>> See Insiders’ Hot Stocks on TipRanks >> Read More on NKE: Nike to raise prices on footwear and apparel this week, CNBC says Nike price target lowered to $65 from"
594,2025-05-23,AWS Says Opus 4 And Sonnet 4 Ai Models Are Now Generally Available In Amazon Bedrock - Blog Amazon.com Inc: * AWS: OPUS 4 AND SONNET 4 AI MODELS ARE NOW GENERALLYAVAILABLEIN AMAZON BEDROCK - BLOGSource text:Further company coverage: ...
595,2025-05-23,Big Techs spending drove Nvidias rise Bloomberg estimates that Microsoft spends roughly 47% of its capital expenditures directly on Nvidia’s chips and accounts for nearly 19% of Nvidia’s revenue on an annualized basis.
596,2025-05-23,"Anthropics New AI Models Could Be Positive Sign For Amazons Challenge To Nvidia. Heres Why. Amazons efforts to build an AI chips could be bolstered by Anthropics Claude 4 rollout, an analyst said."
597,2025-05-23,"Why a Veteran Investor Is Very Bullish on Amazon.com (AMZN) and Uber Technologies (UBER) Amazon.com, Inc. (NASDAQ:AMZN) is well-positioned to benefit from its cost cutting, and the latter initiative is likely to boost its bottom line, said Andrew Arons in a recent appearance on Schwab Network. Further, the company is “constantly innovating,” the veteran investor said. Arons, the managing partner of Synergy Advisory Management Group, is also quite upbeat […]"
598,2025-05-23,3 No-Brainer Artificial Intelligence (AI) Growth Stocks to Buy With $250 Right Now You can still find good values among AI stocks even after their strong price recovery in recent weeks.
599,2025-05-23,‘Tariff Man’ Is in a Bad Mood Ahead of the Memorial Day Weekend ‘Tariff Man’ Is in a Bad Mood Ahead of the Memorial Day Weekend
600,2025-05-25,"Truist Reiterates Buy on Amazon.com (AMZN) as Q2 Revenue Tracks Ahead We recently published a list of 10 AI Stocks on Wall Street’s Radar. In this article, we are going to take a look at where Amazon.com Inc. (NASDAQ:AMZN) stands against other AI stocks on Wall Street’s radar. Amazon.com Inc. (NASDAQ:AMZN) is an American technology company offering e-commerce, cloud computing, and other services, including digital streaming […]"
