501,2025-04-11,"My 2 Favorite Stocks to Buy Right Now At the same time, investors might want to be a little cautious given the uncertainty over the effects that the Trump administrations on-again, off-again tariffs might have on the global economy.  As the leading e-commerce retailer in the world, Amazon (NASDAQ: AMZN) will no doubt be affected by tariffs.  In May, the Trump Administration will also close the de minimus loophole that these companies have used to avoid duties."
502,2025-04-12,Mark Zuckerbergs empire at stake as Meta prepares to battle Trumps antitrust cops in court Meta is preparing for the start of a courtroom battle Monday with the US government in an antitrust case that could force Mark Zuckerberg to break up his $1.3 trillion empire and sell one of its crown jewels: Instagram.
503,2025-04-12,"Is Amazon.com Inc. (NASDAQ:AMZN) a NASDAQ Stock with the Highest Upside Potential? We recently published a list of the 13 NASDAQ Stocks with the Highest Upside Potential. In this article, we are going to take a look at where Amazon.com Inc. (NASDAQ:AMZN) stands against other NASDAQ stocks with high upside potential. On April 7, Dan Ives of Wedbush Securities joined CNBC’s ‘Squawk on the Street’ to discuss […]"
504,2025-04-12,"2 Reasons to Avoid Amazon Stock as Tariffs Escalate While President Donald Trump paused most of the tariffs that went into effect last week, tariffs on Chinese goods not only remain in place but are escalating, as I write this.  Most companies are exposed to tariffs on Chinese goods in one way or another, either because they source products and supplies from China, or because theyre susceptible to weakening consumer and business spending as economic uncertainty ramps up.  Amazon (NASDAQ: AMZN) is facing multiple headwinds from the tariffs on Chinese products, and the retail and cloud giant may be more exposed than many of its peers."
505,2025-04-14,3 Beaten-Down Magnificent Seven Stocks to Buy and Hold Google parent Alphabet (NASDAQ: GOOG) (NASDAQ: GOOGL) appears to be in a strong position to weather the current storm.  Its cash position is nearly $96.7 billion.  Alphabet makes most of its money from advertising on Google Search and other apps.
506,2025-04-14,Apple leads tech stocks higher on Trumps temporary tech tariff reprieve Apple led the Magnificent Seven stocks higher Monday as investors cheered the Trump administrations temporary tariff exemptions for tech products announced over the weekend.
507,2025-04-14,"Safran and AWS Announce Strategic Collaboration to Accelerate Innovation in the Aeronautics Industry PARIS - - Amazon Web Services , an Amazon.com, Inc. company , and Safran , a global leader in aeronautics, defense, and space, have announced a strategic collaboration aimed at accelerating Safrans..."
508,2025-04-15,How This Simple Indicator Revealed True Strength In Amazon Stock How This Simple Indicator Revealed True Strength In Amazon Stock
509,2025-04-16,"Anthropic forms a new team to grow its AWS business In a sign of Anthropics increasingly cozy relationship with Amazon, Anthropic has formed a new team to recruit AWS customers to use its AI products. The team, which Anthropic appears to have begun hiring several months ago, aims to accelerate the adoption of Anthropics AI among AWS accounts by building programs that [...] scale across global markets and segments. Thats according to job listings on Anthropics website and job boards around the web. [Y]ou will own and scale one of our most"
510,2025-04-16,"Should You Buy Amazon Stock Right Now and Hold for the Next 20 Years? Amazon (NASDAQ: AMZN) started out in the 1990s selling books online.  Should you buy Amazon stock now and hold for the next 20 years?  Jeff Bezos, Amazons billionaire founder, always wanted the company to prioritize the customer above anything else."
511,2025-04-17,"Is Amazon.com Inc. (NASDAQ:AMZN) the Best Machine Learning Stock to Buy Now? We recently published a list of the 10 Best Machine Learning Stocks to Buy Now. In this article, we are going to take a look at where Amazon.com Inc. (NASDAQ:AMZN) stands against other machine-learning stocks. Grand View Research reported that the global machine-learning market was valued at $36.73 billion in 2022. It’s now expected to […]"
512,2025-04-17,"AmazonSellerAgency: Empowering Sellers to Navigate the Amazon Marketplace AmazonSellerAgency, a full-service agency dedicated to Amazon marketplace solutions, is transforming how businesses manage their Amazon accounts. With an emphasis on data-driven strategies and expert..."
513,2025-04-17,"Tariff Tsunami Leaves Amazon Stock (AMZN) Trading at a Discount Amazon (AMZN), the global e-commerce and cloud giant, has seen its share price hit in recent weeks, mainly due to its layered exposure to the ongoing trade war and tariff schedule between the U.S and China. On one hand, suppliers are expected to pass on the added costs, meaning consumers could end up footing the bill. This raises concerns about a potential drop in global demand and possible bumps in Amazon’s growth trajectory. While the real impact may take time to materialize, several analysts"
514,2025-04-18,"President Trumps 145% China Tariffs Will Hurt Amazon. Heres Why Im Still Buying the Stock. Few companies are as harmed by the escalating trade war between the U.S. and China as Amazon (NASDAQ: AMZN).  While some may think that Amazon will be a casualty in this trade war, other facts dispute this claim.  As a result, I think using the weakness on the tariff fears to buy Amazon stock is the smart move, as there are far more factors to Amazon than just its e-commerce business."
515,2025-04-19,"Prediction: 1 Stock That Will Be Worth More Than Nvidia 5 Years From Now Nvidia (NASDAQ: NVDA) has been one of the hottest stocks on the market in the past five years, delivering remarkable gains of 1,300% to investors during this period and significantly outpacing the tech-laden Nasdaq Composites returns of about 100%.  Nvidias market capitalization of $2.5 trillion makes it the third-largest company globally.  The good part is that Nvidia could deliver more gains in the future thanks to a sizable addressable market that could allow it to sustain healthy revenue and earnings growth for years to come."
516,2025-04-20,Tariff Turmoil: One Artificial Intelligence (AI) Stock Down 26% to Buy Hand Over Fist Right Now This company is built to survive through all market environments.
517,2025-04-21,"Agent 007 – Mission Amazon: Jeff Bezos Buys The Rights To Ian Flemings Character On 20 February, Jeff Bezos celebrated the purchase of the creative control of the 007 film franchise with a post on Instagram in which he asked: Whod you pick as the next Bond? Four years after..."
518,2025-04-21,"3 No-Brainer Artificial Intelligence (AI) Stocks to Buy Before Earnings Season Heats Up Earnings season is here once again, offering us a look into our favorite companies latest performance and view of the future.  Investors may feel particularly eager to hear the thoughts of chief executive officers, considering the challenge facing U.S. companies today: President Trumps import tariff plan.  Trumps tariff announcement earlier this month dragged indexes lower as investors worried about higher prices on imports eating into corporate profits."
519,2025-04-21,"Big Tech ETF posts big drop, as Tesla sees steep slide Big Tech ETF posts big drop, as Tesla sees steep slide"
520,2025-04-22,"Delegate Unveils Solutions to Common Fulfillment Challenges Facing Modern E-commerce Brands Managing product storage, order processing, and shipping from a fulfillment center in Canada can be complex. While third-party providers help businesses grow, many encounter repeated issues that slow..."
521,2025-04-23,"Stock Market Sell-Off: The Best Warren Buffett Stock to Buy Now Warren Buffett is one of the most successful investors of all time, with a performance that easily surpasses  the S&P 500s average.  Below, Ill explore why e-commerce giant Amazon (NASDAQ: AMZN) could make an excellent long-term pick in this uncertain macroeconomic environment.  While Warren Buffett is a hugely successful investor, he isnt infallible."
522,2025-04-23,"Amazon, Netflix, FTAI Aviation, and Tesla Shares Are Soaring, What You Need To Know A number of stocks jumped in the afternoon session after investor sentiment improved on renewed optimism that the US-China trade conflict might be nearing a resolution."
523,2025-04-23,"Why Shares of Amazon, Walmart, and Home Depot Are Rebounding Today The stocks of big-box retailers and large e-commerce companies rebounded today, as news reports hinted at progress on negotiations between the Trump administration and trade partners.  U.S. Treasury Secretary Scott Bessent also reportedly expressed more positive sentiment regarding the United States frayed relationship with China.  Shares of Amazon (NASDAQ: AMZN) traded roughly 3.3% higher, as of 1:34 p.m. ET today."
524,2025-04-24,"E-Commerce Update - Saudi Arabias Digital Shift Drives Robust Market Growth The Saudi Arabian eCommerce market is experiencing robust growth driven by factors such as increasing internet and smartphone penetration, government initiatives under Vision 2030, and the adoption of digital payment methods. With a young, tech-savvy population and improvements in logistics infrastructure, the markets value is projected to rise significantly from $24.67 billion in 2024 to $68.94 billion by 2033, reflecting a compound annual growth rate of 12.1%. Challenges remain,..."
525,2025-04-24,"AI Play Vertiv Soars On Strong Earnings Vertiv Holdings posted 24% revenue growth and benefits from AI-driven demand and solid financials, enhancing its investment case. Learn why VRT stock is a buy."
526,2025-04-24,"Is Amazon.com, Inc. (AMZN) the Best Stock to Buy and Hold for 20 Years? We recently published a list of 10 Best Stocks to Buy and Hold for 20 Years. In this article, we are going to take a look at where Amazon.com, Inc. (NASDAQ:AMZN) stands against other best stocks to buy and hold for 20 years. As per Ameriprise Financials, the initial months of 2025 were tough for investors. […]"
527,2025-04-25,"Amazon: Ignore The Noise, This Stock Is Ridiculously Cheap (Rating Upgrade) Amazon will produce more market-beating returns because of its e-commerce scale advantage and the booming AI cloud demand. Read why AMZN stock dip offers long-term gains."
528,2025-04-26,"How to play Microsoft, Amazon earnings using options Four of the Magnificent Seven report earnings the week of April 28: Apple (AAPL), Amazon (AMZN), Microsoft (MSFT), and Meta (META). For some investors, the options market can be the best way to play those numbers. OptionsPlay senior options strategist Brian Overby shares options plays for Microsofts and Amazons results. To watch more expert insights and analysis on the latest market action, check out more Market Domination Overtime here."
529,2025-04-26,"Mag 7 Earnings Preview: What Can Investors Expect? We get into the heart of the Q1 earnings season this week, with more than 800 companies reporting results, including four Magnificent 7 members and 173 other S&P 500 members. How are expectations shaping up?"
530,2025-04-27,"Tech Executives Are Starting to Talk Tariffs. What It May Mean for Apple, Amazon Earnings. Amazon, Apple, Meta, and Microsoft will need to address tariffs on earnings calls next week. Tech executives are sounding alarms."
531,2025-04-29,"White House Blasts Amazon on Report It Will Publish Tariff Hit to Products. The Stock Drops. Amazon.com  stock was down Tuesday after a report said the company would show how much of an item’s cost comes from tariffs.  The stock has dropped 16% this year, mostly on tariff worries.  At a news briefing, White House press secretary Karoline Leavitt responded to the report by saying: “This is a hostile and political act by Amazon.”"
532,2025-04-29,Stock Market Today: Dow Jones Shows Leadership As Nasdaq Hangs On; Amazon Takes Heat From White House (Live Coverage) The Dow Jones led the major indexes Tuesday midday as the S&P 500 lagged. Amazon.com retreated on White House comments.
533,2025-04-29,"Honeywell outlook, Adidas, Amazon & Trump: Trending Tickers Madison Mills and Explosive Options technical analyst Bob Lang examine some of the days trending tickers on Yahoo Finances platform during the trading session. Honeywell (HON) lifts its full-year outlook after its first quarter results beat expectations. Adidas (ADS.DE, ADDYY, ADS.HM) warns that tariffs will increase prices, opting not to raise its guidance despite a strong first quarter. Amazon (AMZN) is in the White Houses crosshairs, as President Trumps Press Secretary Karoline Leavitt reacted to reports that the e-commerce giant will display the price increase associated with tariffs, saying it is a hostile and political act. The Washington Post later reported that the company had debated making the move on its low-cost Amazon Haul site, not its main website. To watch more expert insights and analysis on the latest market action, check out more Catalysts here. This post has been updated to reflect new reporting."
534,2025-04-29,"Amazon Wants to Be a Satellite-Internet Powerhouse. It Has a Long Way to Go. The company sent 27 Kuiper satellites into orbit Monday, but it needs to get thousands more to space to rival SpaceX’s Starlink."
535,2025-04-30,"UPS Will Fire 20,000 Workers. It Isn’t Why You Think. UPS Will Fire 20,000 Workers. It Isn’t Why You Think."
536,2025-04-30,"Big Price Hikes Mean Americans Pay For Trumps Tariffs, Not China Multiple e-commerce giants including Temu and Shein have seen prices soar in the US, with a set of kitchen towels setting the outer limit with a 377% jump. On Tuesday, Amazon said it will not..."
537,2025-04-30,"White House Pushed Job Cuts at Agency That’s Clashed With Musk (Bloomberg) -- The White House is privately urging the federal labor board to reduce staff, despite pushback by Trump-appointed officials warning that further cuts would imperil the agency’s functions.Most Read from BloombergNew York City Transit System Chips Away at Subway Fare EvasionNYC’s Congestion Toll Raised $159 Million in the First QuarterThe Last Thing US Transit Agencies Should Do NowAt Bryn Mawr, a Monumental Plaza Traces the Steps of Black HistoryAt the National Public Housing Museum"
538,2025-04-30,"Trump’s temper has CEOs running scared. They’re missing a huge opportunity America’s CEOs have spent much of second Trump administration cutting million-dollar checks for his inauguration fund, putting out press releases touting their “new” investments in domestic production, and generally keeping quiet about the administration’s defiance of democratic norms. Any pushback against the White House’s trashing of the global economic order has been handled behind closed doors."
539,2025-04-30,"UPS (UPS) to Cut 20,000 Jobs, Citing Amazon Volume Drop and Tariff Pressures Shares slip as company warns tariffs could trigger historic trade disruption"
540,2025-05-01,"Microsoft (MSFT), Amazon (AMZN), Meta Platforms (META) to Keep Getting Boosts From the AI Revolution, Renowned Analyst Says Spending on AI “is holding up like the Rock of Gibraltar,” and Microsoft (MSFT), Amazon (AMZN), and Meta (META) are all still benefiting from the AI Revolution, Dan Ives, a Managing Director and Senior Equity Research Analyst at Wedbush Securities, said recently on CNBC. Ives specializes in the tech sector. Why Ives Remains Largely Bullish […]"
541,2025-05-01,"Magnificent Seven Stocks: Nvidia, Tesla Rally; Meta, Microsoft Surge On Earnings Magnificent Seven Stocks: Nvidia, Tesla Rally; Meta, Microsoft Surge On Earnings"
542,2025-05-02,"What Big Tech Has Going for It in the Trade War Apple and Amazon’s exposure remains a worry, but tariffs haven’t yet hobbled the trillion-dollar tech giants."
543,2025-05-02,"Stock Market Powers Higher On Microsoft, Meta, Trump Tariff Hopes: Weekly Review Stock Market Powers Higher On Microsoft, Meta, Trump Tariff Hopes: Weekly Review"
544,2025-05-02,Amazon is spending a lot more on property and equipment than it was a year ago Amazon is spending a lot more on property and equipment than it was a year ago
545,2025-05-02,"AMAZON COM INC : RBC remains its Buy rating In a research note published by Brad Erickson, RBC advises its customers to buy the stock. Previously set at USD 235, the target price has been slightly modified to USD 230."
546,2025-05-03,"Earnings Remain Resilient, but Outlook Softens Q1 earnings overall reflect resiliency, but estimates for full-year 2025 have come under increasing pressure in recent weeks."
547,2025-05-03,"Apple, Anthropic Team Up to Build AI-Powered ‘Vibe-Coding’ Platform (Bloomberg) -- Apple Inc. is teaming up with startup Anthropic PBC on a new “vibe-coding” software platform that will use artificial intelligence to write, edit and test code on behalf of programmers.Most Read from BloombergNYC Lost $9 Billion of Income to Miami, Palm Beach in Five YearsNJ Transit Urges Commuters to Work Remotely If Union StrikesNew York City Transit System Chips Away at Subway Fare EvasionNYC’s MTA to Cut Costs Instead of Borrowing More to Fund UpgradesNYC’s Congestion Toll Rai"
548,2025-05-04,"Prediction: This Magnificent Seven Stock Will Be the Most Valuable Company in the World by the End of the Year Among the worlds most valuable companies, seven of them are artificial intelligence stocks."
549,2025-05-04,"3 Soaring Retail Stocks to Hold for the Next 20 Years Kroger, Amazon, and Walmart are all evergreen retail investments."
550,2025-05-05,Amazon.com First Quarter 2025 Earnings: EPS Beats Expectations Amazon.com ( NASDAQ:AMZN ) First Quarter 2025 Results Key Financial Results Revenue: US$155.7b (up 8.6% from 1Q 2024...
551,2025-05-05,Nvidia Can Survive ‘Tough Regulations’ on China. Here’s Why. Nvidia Can Survive ‘Tough Regulations’ on China. Here’s Why.
552,2025-05-05,Big Tech stocks drag down S&P 500 in late-afternoon trading Big Tech stocks drag down S&P 500 in late-afternoon trading
553,2025-05-05,"JCE: Difficult To Recommend This Fund At The Current Price Nuveen Core Equity Alpha Fund offers attractive 8.82% yield, appealing to income-seeking investors. Read what makes JCE CEF difficult to recommend today."
554,2025-05-05,Nvidia Stock Falls. Here’s What’s Weighing on the Chip Maker. Nvidia Stock Falls. Here’s What’s Weighing on the Chip Maker.
555,2025-05-06,"UTG Yields Almost 7%, And This CEF Will Benefit From The A.I. Infrastructure Buildout Discover how UTGs utility-focused strategy and 7% distribution yield offer stable income amidst rising energy demands and AI-driven infrastructure growth."
556,2025-05-06,"Swiss Bank Remains Upbeat on Amazon.com, Inc. (AMZN) Stock Swiss bank UBS on Friday tweaked its price target on Amazon.com Inc (AMZN) stock to $249 from $253 but kept a Buy rating on the shares, The bank indicated that AMZN stock should be bought on its current weakness. Estimates for the E-Commerce Business Have Probably Bottomed, UBS Says Amazon’s guidance for a 5% increase […]"
557,2025-05-07,Temus Threat To U.S. Retailers Will Continue To Weaken After Tariff Hit: Analyst Temus Threat To U.S. Retailers Will Continue To Weaken After Tariff Hit: Analyst
558,2025-05-07,"Walt Disney, Nike share gains lead Dows 119-point jump Walt Disney, Nike share gains lead Dows 119-point jump"
559,2025-05-07,"Jeff Bezos Says He Won the Lottery With His Teen Mom—She Had Him at 17, Took Him to Night School, Then Invested Her $245K Savings In Amazon Before Amazon (NASDAQ:AMZN) became a $2 trillion tech giant, it was just an idea—and Jeff Bezos had something better than venture capital: his mom. I won the lottery with my mom. Thanks for literally everything, Bezos declared in a heartfelt X post on Mothers Day 2017. Jacklyn Bezos had Jeff when she was only 17, defying the odds from day one. Pressured to drop out of high school, she stayed the course, graduated, and supported herself and her infant son on just $190 a month working as a secr"
560,2025-05-07,Amazons Zoox To Scale Up Robotaxi Production For US Expansion - FT May 7 - * AMAZON’S ZOOX TO SCALE UP ROBOTAXI PRODUCTION FOR USEXPANSION -FTSource text: https://tinyurl.com/yrdb94n8Further company coverage: ...
561,2025-05-07,"Donald Trump Vows To Call Up CEOs Who Make Business Moves That Displease Him, Explains Why He Phoned Jeff Bezos To Scrap Amazons Tariff Disclosure President Donald Trump says he will personally phone chief executives who make business moves he dislikes, a tactic he deployed last week with Amazon (NASDAQ:AMZN) founder Jeff Bezos over planned tariff disclosures on the e‑commerce giants site. What Happened: In an interview on NBCs Meet the Press, Trump recounted calling Bezos after Punchbowl News reported Amazon might label import fees tied to the administrations new 145% tariff on Chinese goods. Hes just a very nice guy, Trump said."
562,2025-05-07,"Amazon unveils robot with ‘a sense of touch’ The tech giant said the new robot could understand pressure and force using new sensors and AI, enabling it to grip things without damaging them."
563,2025-05-08,"UPS Stands by Call to Scale Back Amazon Business Despite New Tariff Challenges Cutting more than half of its Amazon deliveries is good for UPS’s business in the long run, its CFO says."
564,2025-05-08,"Invesco Equity And Income Fund Q1 2025 Commentary We added new holdings in the industrials, health care and energy sectors, purchases that were funded by sales across several different sectors, including one IT holding."
565,2025-05-09,"What Does Cramer Think of Amazon.com (AMZN)’s $100 Billion AI Bet? We recently published a list of 10 Jim Cramer Stocks to Watch as US-China Prepare to Begin Talks. In this article, we are going to take a look at where Amazon.com, Inc. (NASDAQ:AMZN) stands against other stocks that Jim Cramer discussed. The optimism over US-China trade talks is increasing as the US Treasury Secretary is […]"
566,2025-05-09,Amazon: Buying Opportunity Knocking At The Front Door Again Amazon trades near late-2023 lows but is poised to rebound as macro fears fade and fundamentals stay strong. Find out why AMZN stock is a buy.
567,2025-05-11,"Is Amazon Stock a Long-Term Buy? The market for Amazons biggest moneymaker could more than quintuple over the next two decades.  Investors might be looking elsewhere in the AI space even though Amazons AI business is growing at a triple-digit pace.  If you invested in Amazon (NASDAQ: AMZN) at the start of any year over the last 20 years, youd be up on your investment five years later, every time."
568,2025-05-12,"US-China trade reprieve buys Shein and Temu time to restock US inventory An agreement between theUnited States and China to temporarily slash tariffs stoppedshort of reinstating the U.S. de minimis duty exemption forecommerce packages from China, but still gives online..."
569,2025-05-12,"Amazon-Backed Glaciers $16M Funding Boosts AI Robots Capable Of Sorting 30+ Material Types, Transforming Recycling Industry Glacier, the San Francisco-based AI robotics startup, announced a $16 million Series A funding round on Tuesday to expand deployment of its waste-sorting robots across U.S. recycling facilities. The round was led by Ecosystem Integrity Fund, with participation from the Amazon Climate Pledge Fund and other investors. According to GeekWire, Amazon (NASDAQ:AMZN), which is already working with Glacier to test plant-based plastic sorting at its Seattle sustainability lab, has included the startup in"
570,2025-05-13,Funds Kept Shifting Out of U.S. Stocks as Rally Picked Up Funds Kept Shifting Out of U.S. Stocks as Rally Picked Up
571,2025-05-13,"Alphabet In 2025 Is Spelled MOS Alphabet remains a digital advertising giant despite AI spending and rising competition, offering a strong margin of safety. Read why GOOGL is a Strong Buy at current prices."
572,2025-05-13,Amazon taps FedEx for big-and-bulky residential deliveries Amazon will outsource delivery of large packages to FedEx in a deal that should prove more profitable on a per-shipment level than shipments under the companies’ partnership that ended six years ago. The post Amazon taps FedEx for big-and-bulky residential deliveries appeared first on FreightWaves.
573,2025-05-14,"Zacks Value Investor Highlights: DFH, KO, AMZN DFH, KO, AMZN have been highlighted in this Value Investor article."
574,2025-05-14,"Top Stock Reports for Microsoft, Amazon.com & Mastercard Todays Research Daily features new research reports on 16 major stocks, including Microsoft Corp. (MSFT), Amazon.com, Inc. (AMZN) and Mastercard Inc. (MA), as well as a micro-cap stock CBL & Associates Properties, Inc. (CBL)."
575,2025-05-14,"Tracking Christopher Davis Davis Selected Advisers 13F Portfolio - Q1 2025 Update Davis Selected Advisersâ 13F portfolio value increased to $17.35B, with the number of holdings rising from 100 to 104. Learn more about the portfolio here."
576,2025-05-14,"The Zacks Analyst Blog Highlights Microsoft, Amazon.com, Mastercard and CBL & Associates Microsoft, Amazon.com, Mastercard and CBL & Associates are included in this Analyst Blog."
577,2025-05-15,"BlackRock Large Cap Focus Growth Fund Q1 2025 Commentary The fund posted returns ofÂ -10.98%Â (Institutional shares) andÂ -10.98%Â (Investor A shares, without sales charge) for the first quarter of 2025."
578,2025-05-16,"Exclusive: Stord raises $200 million in equity and debt to empower brands competing with Amazon Stord, now valued at $1.5 billion, has raised $80 million in equity and $120 million in debt, Fortune has exclusively learned."
579,2025-05-16,"Tracking Warren Buffetts Berkshire Hathaway Portfolio - Q1 2025 Update See more on Berkshire Hathaways Q1 2025 portfolio changes. Explore key investments, major disposals, and the dominance of Apple, AmEx, Coca-Cola & more."
