584,"BlackRock Large Cap Focus Growth Fund Q1 2025 Commentary The fund posted returns ofÂ -10.98%Â (Institutional shares) andÂ -10.98%Â (Investor A shares, without sales charge) for the first quarter of 2025."
585,"Amazon.com (NasdaqGS:AMZN) Teams With Demandbase To Launch AI Agents On AWS Platform In May 2025, Demandbase launched Agentbase in collaboration with Amazon Web Services, aiming to enhance campaign performance through AI. Meanwhile, Amazon.com (NasdaqGS:AMZN) saw its stock rise by 14% over the past month. Significantly contributing to this growth were strong quarterly earnings, with a notable 8% revenue increase and improved financial guidance. Additionally, Amazon announced future infrastructure expansions, likely supporting longer-term growth prospects. While major tech..."
586,"Mag 7 gains, fairly valued market, risk: Trading Takeaways AI chip stocks are pushing the tech rally higher, much to the benefit of the Nasdaq Composite index (^IXIC). Yahoo Finance markets reporter Josh Schafer lays out several of the sessions key trading themes, including the serious upside Magnificent Seven stock — comprised of tech leaders Meta Platforms (META), Microsoft (MSFT), Alphabet (GOOGL, GOOG), Amazon (AMZN), Apple (AAPL), Nvidia (NVDA), Tesla (TSLA) — are seeing. To watch more expert insights and analysis on the latest market action, check out more Asking for a Trend here."
587,"Tracking Warren Buffetts Berkshire Hathaway Portfolio - Q1 2025 Update See more on Berkshire Hathaways Q1 2025 portfolio changes. Explore key investments, major disposals, and the dominance of Apple, AmEx, Coca-Cola & more."
588,"3 Top Stocks to Buy With $5,000 Today and Hold Forever Amazons forward-thinking culture will continue to win for shareholders.  MercadoLibre is reporting high growth, but 85% of retail sales in its market are still offline, offering a long growth runway.  Shopify continues to innovate and deliver superior growth."
589,Nvidia-backed CoreWeave soars 100% since IPO as investors see AI demand outweighing risky business model Nvidia-backed AI cloud company CoreWeave has seen shares soar over 100% since its IPO in March as investors hopes for the AI boom outweigh concerns over its Nvidia-reliant business model.
590,"Retail Earnings Continue: Target, Home Depot on Deck In addition to Target, Home Depot, and Lowes, the notable companies reporting this week include Ralph Lauren, TJX Companies, Toll Brothers, and Chinas Baidu. What can investors expect?"
591,3 Tech Stocks Destined to Drive Wealth Now and for Years to Come Amazons advertising business alone generated over $56 billion in revenue last year.  The current success of AI is not possible without Taiwan Semiconductor.  The market is overly pessimistic on Alphabet (Google).
592,3 Reasons to Buy Nvidia Stock Hand Over Fist Before May 28 Nvidia has a history of beating Wall Streets earnings estimates.  Hints from several major customers are encouraging about the demand for Nvidias GPUs.  Strong Blackwell demand could boost Nvidias Q1 results and its outlook for the rest of the year.
593,Warner Bros. continues hot streak as ‘Final Destination: Bloodlines’ tops box office Warner Bros. continues hot streak as ‘Final Destination: Bloodlines’ tops box office
594,"INFO: New Active ETF With A Good Start Discover the Harbor PanAgora Dynamic Large Cap Core ETF (INFO) â an actively managed ETF with strong fundamentals, outperforming peers."
595,"Choose France summit to bring 20 billion euros of new investment This years Choose Francebusiness summit hosted by President Emmanuel Macron is expectedto secure 20 billion euros of new investment,his office said on Monday, announcing projects in the..."
596,Wall Street Lunch: Nvidias Huang Previews Next-Gen Tech Nvidia (NVDA) CEO Jensen Huang announced a wave of new technologies and partnerships at the Computex 2025 conference in Taiwan to reinforce the companyâs dominance in AI computing space.
597,"FLQL: Multi-Factor Vs. Single Factors FLQL implements a strategy combining quality, value and momentum factors in the Russell 1000. Read why FLQL ETF is a Hold."
598,Walmart stock slips as Trump takes aim at retail giant over tariff-fueled price hikes Walmart shares slip after the retailer draws the ire of President Trump.
599,"Dow Jones Slides 250 Points On U.S. Credit Downgrade; Apple, Nvidia, Tesla Sell Off Dow Jones Slides 250 Points On U.S. Credit Downgrade; Apple, Nvidia, Tesla Sell Off"
600,"Innovation Minds and Amazon Business Collaborate to Enhance Employee Rewards and Recognition Innovation Minds is reducing workplace rewards by integrating Amazon Business directly into its platform. Now, employees can seamlessly redeem points earned through engagement activities for reward..."
