685,2025-06-27,"This AI CEO just doubled his wealth to $10 billion in 12 days—that’s over 100x faster than other billionaires, despite having zero tech background Forget Apple, Amazon, or Microsoft—this year’s breakout tech stock comes from a company few had even heard of six months ago, CoreWeave. And its founder has just seen a near-record-breaking increase in his net worth."
686,2025-06-27,"Bezos and Sanchez to exchange wedding vows in star-studded Venice party Amazon founder JeffBezos and journalist Lauren Sanchez were set to exchangemarriage vows at a ceremony in Venice on Friday, part of athree-day wedding extravaganza that has attracted dozens..."
687,2025-06-28,Think Costco Wholesale Is Expensive? This Chart Might Change Your Mind. Is Costco really worth its premium price tag? These two business trends can justify the retailers lofty valuation.
688,2025-06-29,"5 Artificial Intelligence (AI) Stocks Are Worth Over $2 Trillion. Here Are the 2 Most Likely to Join the Club Next. Nvidia, Microsoft, Apple, Amazon, and Alphabet make up the $2 trillion club right now.  Meta Platforms and Broadcom could be the next to join the club.  To be a member, a company must have a market cap of at least $2 trillion."
689,2025-06-29,"Calamos Long/Short Equity & Dynamic Income Trust Q1 2025 Commentary For the quarter ending March 31, 2025, Calamos Long/Short Equity & Dynamic Income Trustâs total return was 1.69% on NAV and 6.82% on market price. Read more here."
690,2025-06-30,"Should You Forget Sirius XM? This Stock Has Made Far More Millionaires. Despite Berkshire Hathaways massive stake in the business, Sirius XM is losing subscribers, with revenue and net income falling.  Amazon has soared 12,000% in the past two decades.  Growth potential, soaring earnings, and a reasonable valuation make Amazon a smart buy."
691,2025-06-30,"APLD Stock Significantly Beats Industry So Far in June: Is It a Buy? APLD shares jumped 52% in June on AI tailwinds and a $7 billion CoreWeave deal, outpacing industry gains by a wide margin."
692,2025-06-30,"Stock Market News for Jun 30, 2025 U.S. stock markets closed sharply higher at record-high level on Friday."
693,2025-06-30,"Basis Technologies Names Mike Hoyle as Executive Vice President of Artificial Intelligence Software Industry Veteran and Amazon Product Leader Joins Basis to Grow Company’s Holistic Implementation of AICHICAGO, June 30, 2025 (GLOBE NEWSWIRE) -- Basis Technologies (https://basis.com), the industry’s leading advertising automation platform, announced today Mike Hoyle as Executive Vice President of Artificial Intelligence (AI). In his newly appointed position, Mike will drive the holistic implementation of AI into the company’s flagship technology offering across key features such as med"
694,2025-07-01,Best-performing tech stocks for July 2025 Here’s a look at the top technology stocks.
695,2025-07-01,"Nvidia: Everything Good Is Priced In And More Nvidia Corporations record-breaking rally pushes its market cap near $4T, but AI spending challenges loom. Click for our NVDA stock update."
696,2025-07-01,"Shein, Temu Sales Slide After Losing US Duty-Free Loophole In May, POTUS scrapped the “de minimis” exemption that allowed Shein and Temu to ship packages worth less than $800 to the US duty-free."
697,2025-07-01,"HPE Stock Soars as Juniper Merger Gets Regulatory Approval. There’s Just 1 Catch. Investors are cheering the news of HPE’s deal with the U.S. government, bringing its Juniper merger closer to fruition."
698,2025-07-02,"Jeff Bezos sold Amazon shares worth about $737 million in June Amazon founder and executive chair Jeff Bezos sold shares worth almost $737 million in the e-commerce giant in June, according to a regulatory filing on Tuesday. Bezos, who founded Amazon in 1994, sold 3.3 million shares for $736.7 million, after adopting a 10b5-1 trading plan in March, showed the filing, made after the market closed. After the sale, Bezos will own about 905 million Amazon shares."
699,2025-07-03,"BofA sees improving ad market boosting Roku’s outlook as it lifts target Investing.com -- Bank of America said improving macroeconomic sentiment and a deepening partnership with Amazon (NASDAQ:AMZN) could support stronger second-half results for Roku (NASDAQ:ROKU) Inc, as it raised its price target on the stock to $110 from $100."
700,2025-07-03,"Bliss to Hold Second-Annual Block Party on Amazon with Major $4 Promotion on Mineral SPF Honoring July 4th Bliss (https://www.blissworld.com/), the spa-founded skincare brand renowned for its innovative self-care products, announced today that the brand will hold its successful 4th of July Block Party promotion on Amazon for a second year in a row."
