688,2025-06-28,"GE Vernova Inc. (GEV) Continues To Shine, Says jim Cramer GE Vernova Inc. (NYSE:GEV) is one of the Jim Cramer Says Trump’s Angry At Everybody & Discusses These 11 Stocks. GE Vernova Inc. (NYSE:GEV) is an American industrial equipment company that has benefited from investor attention due to its ability to manufacture nuclear power generation equipment. Nuclear power has emerged as a source of power […]"
689,2025-06-29,The Stock-Market Rally Is Moving Beyond Big Tech and Investors Are Thrilled The Stock-Market Rally Is Moving Beyond Big Tech and Investors Are Thrilled
690,2025-06-29,"AVL: Could Be Of Use For Nimble Investors To Gain Exposure To Broadcom, But Carries High Risk AVL offers 2x daily exposure to AVGO, ideal for short-term trades on catalysts like earnings, but comes with high risk due to leverage. Learn why AVL ETF is a buy."
691,2025-06-30,"Nvidias market dominance leaves it with only one way to go Nvidia (NVDA) is dominating the artificial intelligence (AI) chip market, but its lead could shrink as rivals ramp up. Gil Luria, D.A. Davidson head of technology research, joins Market Domination to explain how players like Advanced Micro Devices (AMD), Broadcom (AVGO), and Huawei are positioned to chip away at Nvidias market share. To watch more expert insights and analysis on the latest market action, check out more Market Domination here."
692,2025-06-30,"Vietnams Viettel Group Excels at the Prestigious Global Technology Awards Recently, Viettel Group, a Vietnam state-owned corporation, won 19 awards at the Globee Awards for Technology 2025, one of the most prestigious international awards in the field of information technology and innovation. Viettels total awards surpass global tech giants such as Amazon, IBM, Meta, Broadcom, Ivanti, Cisco, and more."
693,2025-06-30,"This Dark-Horse AI Stock Has Doubled Since April, and It Still Looks Like a Buy Micron delivered another strong round of revenue growth in its fiscal third quarter.  The stock fell modestly as prices fell slightly on a sequential basis.  One stock that still seems undervalued even after doubling since the market dip in April is Micron Technology (NASDAQ: MU), a leading maker of memory chips, including high-bandwidth chips that are used for AI applications."
694,2025-07-01,"Stocks Pressured as Bond Yields Climb on Strong US Economic News The S&P 500 Index ($SPX ) (SPY ) today is down -0.28%, the Dow Jones Industrials Index ($DOWI ) (DIA ) is up +0.51%, and the Nasdaq 100 Index ($IUXX ) (QQQ ) is down -0.80%. September E-mini S&P futures (ESU25 ) are down -0.28%, and September E-mini Nasdaq futures..."
695,2025-07-01,"Arista Networks Expands AI-Driven Campus and Branch Networking Offerings SANTA CLARA, Calif., July 01, 2025--Arista Networks (NYSE: ANET), a leading provider of cloud and artificial intelligence (AI) networking solutions, today announced several AI-driven enterprise products that deliver an expanded set of switching, Wi-Fi 7 access point, and WAN capabilities. In conjunction, Arista acquired the VeloCloud® SD-WAN portfolio from Broadcom. This combination of innovations will bring operational ease through zero touch operations, proactive monitoring, and automated trou"
696,2025-07-01,"1 Semiconductor Stock Worth Your Attention and 2 to Turn Down Semiconductors are the core infrastructure powering the Information Age. The amount of data we ingest is also increasing exponentially, leading to elevated demand for chips with more processing power. This secular trend has buoyed the industry, which has posted a six-month return of 4.9%, almost identical to the S&P 500."
697,2025-07-02,"Nvidia, AMD, Broadcom Lead Chip Sell-Off as H2 Kicks Off AI Chip Stocks Come Under Pressure in Sharp H2 Start"
698,2025-07-02,Arista Purchase Of VeloCloud From Broadcom Gets Good Reviews Arista Networks acquisition of VeloCloud from Broadcom won good reviews from analysts. But Arista stock dipped amid the news.
699,2025-07-02,"Will Aristas VeloCloud Buyout to Boost SD-WAN Unit Aid ANET Stock? ANETs VeloCloud buyout adds 20K clients and proven SD-WAN tech, boosting its edge in secure cloud networking."
700,2025-07-02,First-Half 2025 Stock Review And Second-Half Picks S&P 500 surges in H1 2025; explore AI leaders & ETFs for H2. Click to learn more about stocks to avoid and tips to navigate market volatility.
