601,2025-05-28,"Nvidia earnings highlighting AI demand could lift these stocks Ahead of Nvidias first quarter earnings report, Rational Equity Armor Fund portfolio manager Joe Tigay joins Morning Brief with Brad Smith and Madison Mills to discuss which artificial intelligence (AI) sub-sector plays could react to the chipmakers results. Tune in to Yahoo Finances special live coverage of Nvidias first quarter earnings here, beginning at 4:15 p.m. on Wednesday, May 28. To watch more expert insights and analysis on the latest market action, check out more Morning Brief here."
602,2025-05-28,"Jim Cramer on Broadcom Inc (AVGO): “This Stock Has Been a Horse” We recently published a list of Jim Cramer Had These 21 Stocks on His Radar. In this article, we are going to take a look at where Broadcom Inc. (NASDAQ:AVGO) stands against other stocks that Jim Cramer discusses. When a caller expressed bullishness toward Broadcom Inc. (NASDAQ:AVGO), Cramer commented: “Broadcom is good, my friend. It’s […]"
603,2025-05-28,Credo: Dont Keep On Chasing The Highs (Rating Downgrade) Credo Technologyâs EBITDA multiple surged to 45x and a 0.84 forward PEG ratio lends credence to its valuation profile. Click to know the risks and opportunities for CRDO.
604,2025-05-28,"Advanced Micro Devices: Growth Catalyst From Data Center Focus And Current Momentum AMDs strong presence in data centers, AI, and gaming makes it a Buy. Read here for details."
605,2025-05-28,Broadcom: Here Comes The Earnings Boom Broadcom remains an underappreciated AI leader with strong growth prospects and a dominant position in the ASIC market. Check out my analysis of AVGO stock.
606,2025-05-28,"Lam Research Gains 18% in a Month: Should You Buy the Stock Now? AI boom and trade truce spark an 18% surge in LRCX shares in the past month. Strong margins, solid earnings and reasonable valuation make the stock worth buying."
607,2025-05-28,"Broadcom Stock Is Rising. Shares Can Soar Past Their Record, Says Analyst. Chip maker Broadcom is a “must-own” artificial-intelligence stock, says Melius Research, which raised the price target to $289 from $198."
608,2025-05-29,"Mizuho Lifts Broadcom Target Amid Strong AI Market Prospects Mizuho Securities raised its price target for Broadcom Inc. (NASDAQ:AVGO) from $250 to $300, while maintaining its Outperform rating, on May 27. The update followed a detailed examination of Broadcom’s market position, particularly its AI Custom Silicon, the company’s biggest source of income. According to the analysis, Broadcom Inc. (NASDAQ:AVGO) is expected to experience substantial […]"
609,2025-05-29,"Trees Dont Grow To The Sky, But Nvidia Does Nvidia Corporation beats Q1 expectations with AI-driven growth and strong gaming results. Click for my look at NVDA earnings and a look at the competition."
610,2025-05-29,"Broadcom Inc. (AVGO) Gains As Market Dips: What You Should Know The latest trading day saw Broadcom Inc. (AVGO) settling at $239.43, representing a +1.6% change from its previous close."
611,2025-05-30,Broadcom Stock Today: Why This Long-Term Covered Call In AVGO Might Deliver A 26% Return Or More Broadcom Stock Today: Why This Long-Term Covered Call In AVGO Might Deliver A 26% Return Or More
612,2025-05-30,"ETB: Hard To Recommend This Fund In A Bull Market Read about ETBs 9.2% yield, its performance limits in bull markets, and why ETY might be a better choice for long-term growth."
613,2025-05-30,"Well-Known Investor Is Bullish on Broadcom (AVGO) Stock Joe Terranova, who frequently appears on CNBC, confirmed on the network recently that he has a Buy rating on Broadcom (AVGO) stock. Terranova is a Senior Managing Director and the Chief Market Strategist for Virtus Investment Partners. Why Terranova Is Bullish on AVGO AVGO’s acquisition of VMware has turned out to be “an excellent” move […]"
614,2025-05-30,"Melius Research Lifts Broadcom (AVGO) PT, Keeps Buy Rating On May 28, Melius Research raised its price target on Broadcom Inc. (NASDAQ:AVGO) from $198 to $238, while keeping its Buy rating on the stock. The stock has surged more than 70% in the past year, however, the firm still sees accelerating sales for the company. Broadcom Inc. (NASDAQ:AVGO) is expected to benefit from its […]"
615,2025-05-30,"2 Growth Stocks with Impressive Fundamentals and 1 to Question Growth is a hallmark of all great companies, but the laws of gravity eventually take hold. Those who rode the COVID boom and ensuing tech selloff in 2022 will surely remember that the market’s punishment can be swift and severe when trajectories fall."
616,2025-05-30,Marvell Earnings Are Solid but Not Enough for Wall Street Marvell Earnings Are Solid but Not Enough for Wall Street
617,2025-06-02,"Broadcoms Q2: Get Ready For An AI Eruption Broadcoms Q1 AI revenue soared ~77% YoY ($4.1B), fueling a strong beat. Check out why Im now reiterating my buy rating before AVGOs Q2 FY25 earnings."
618,2025-06-02,"Broadcom Announces New CloudHealth User Experience for Greater Cloud Spend Management Across Enterprise Teams New AI-powered Features Deliver Actionable Insights and Enhanced CollaborationPALO ALTO, Calif., June 02, 2025 (GLOBE NEWSWIRE) -- Broadcom (NASDAQ: AVGO) today announced the general availability of the newest investment made to VMware Tanzu CloudHealth, a comprehensive new user experience that delivers a suite of feature enhancements and new AI-powered features like Intelligent Assist and Smart Summary. The new CloudHealth experience brings more accurate data and actionable insights to the enti"
619,2025-06-02,"Dow Jones Futures Fall Amid New Trump Tariffs; Palantir In Buy Zone As Tesla, Nvidia Fall Back Dow Jones Futures Fall Amid New Trump Tariffs; Palantir In Buy Zone As Tesla, Nvidia Fall Back"
620,2025-06-03,"Broadcom Ships Tomahawk 6: World’s First 102.4 Tbps Switch Unmatched Performance for Scale-Up and Scale-Out AI Networks with Support for Co-Packaged OpticsPALO ALTO, Calif., June 03, 2025 (GLOBE NEWSWIRE) -- Broadcom Inc. (NASDAQ:AVGO) announced today that it is now shipping the Tomahawk® 6 switch series, delivering the world’s first 102.4 Terabits/sec of switching capacity in a single chip – double the bandwidth of any Ethernet switch currently available on the market. With unprecedented scale, energy efficiency, and AI-optimized features, Tomahawk 6 i"
621,2025-06-03,2 No-Brainer Artificial Intelligence (AI) Stocks to Buy Right Now Share prices of Broadcom and Lam Research registered impressive gains in the past month.  The lucrative end markets the companies serve should allow them to sustain their healthy growth rates.  Artificial intelligence (AI) is set to play a key role in driving global economic growth in the long run.
622,2025-06-03,Broadcom’s stock shoots for record high as excitement builds ahead of earnings Broadcom’s stock shoots for record high as excitement builds ahead of earnings
623,2025-06-03,Is Broadcom Stock a Smart Buy Before Q2 Earnings Report? AVGO rides AI momentum into fiscal Q2 with expected 19.5% revenue growth and strength from VMware and semiconductor gains.
624,2025-06-04,"MORNING BID AMERICAS-Global stocks hit record highs What matters in U.S. andglobal markets today Despite all the trade and geopolitical tensions, marketshave a spring in their step today, due to hopes that U.S.bilateral..."
625,2025-06-04,"Palantir Investors Unfazed by Sky-High Valuation as Stock Surges (Bloomberg) -- Palantir Technologies Inc.’s breakneck rally shows no sign of letting up as investors remain captivated by its artificial intelligence promise despite one of the most expensive valuations among US stocks. Most Read from BloombergWhere the Wild Children’s Museums AreBillionaire Steve Cohen Wants NY to Expand Taxpayer-Backed FerryThe Global Struggle to Build Safer CarsAt London’s New Design Museum, Visitors Get Hands-On AccessLA City Council Passes Budget That Trims Police, Fire Spe"
626,2025-06-04,Broadcom (AVGO) Stock Hits All-Time High on AI Chip Breakthrough Broadcom Jumps on Breakthrough Chip; Street Eyes $15B Quarter
627,2025-06-04,"Stock Market Today: Indexes Up Despite Jobs Surprise, Trump Warning; Nvidia Rises, Apple Falls (Live Coverage) The Dow rose along with the S&P 500 and Nasdaq in the stock market today as investors digested a jobs report."
628,2025-06-04,Broadcom (AVGO) Gets Citi Price Target Boost Ahead of Q2 Earnings Citi raises price target to $276 from $210; maintains Buy rating
629,2025-06-05,"This Artificial Intelligence (AI) Stock Could Be the Best Bargain in the Market Right Now The rise in spending on data centers and chipsets bodes well for semiconductor businesses.  While Nvidia and its peers remain tempting buys, Taiwan Semiconductor Manufacturing is my top choice.  Just two months ago, the Nasdaq Composite was down over 20% year to date following President Trumps Liberation Day tariff announcement on April 2."
630,2025-06-05,"Broadcom earnings, Fed, Nintendo Switch 2: What to Watch Market Domination Overtime hosts Julie Hyman and Josh Lipton preview the top market stories and headlines Wall Street will be paying attention to tomorrow, Thursday, June 5, including earnings from Broadcom (AVGO), Lululemon Athletica (LULU), and Victorias Secret (VSCO), commentary from Federal Reserve officials, and the release of Nintendos (NTDOY, 7974.T) widely anticipated Switch 2 game console at midnight. To watch more expert insights and analysis on the latest market action, check out more Market Domination Overtime here."
631,2025-06-05,Broadcom headlines company earnings slate Broadcom headlines company earnings slate
632,2025-06-06,Strong jobs report and a bit of FOMO are driving Fridays rally: Globalt Strong jobs report and a bit of FOMO are driving Fridays rally: Globalt
633,2025-06-06,"Astera Labs Leads in PCIe 6.0 & AI Connectivity: More Upside Ahead? Astera Labs is emerging as a leading name in AI data center connectivity with a full PCIe 6.0 stack and strong OEM ties, raising investor hopes for more upside ahead."
634,2025-06-06,"Harbor Long-Term Growers ETF Q1 2025 Commentary During Q1, the Harbor Long Term Growers ETF returned -10.09% (at NAV), underperforming the benchmark, the Russell 1000Â® Growth Index, which returned -9.97%."
635,2025-06-06,"Broadcom Inc. (AVGO) Q2 2025 Earnings Call Transcript Broadcom Inc. (NASDAQ:AVGO) Q2 2025 Earnings Conference Call June 5, 2025 5:00 PM ETCompany ParticipantsHock E."
636,2025-06-06,"Broadcom Reports AI-Fueled Sales Growth In its second fiscal quarter, Broadcom reported better-than-expected results on the top and bottom lines.  CEO Hock Tan believes AI revenue will accelerate in the next quarter.  For its fiscal second quarter, Broadcom beat expectations (slightly) on both the top and bottom lines."
637,2025-06-06,The Simple Path To Wealth With 2 Buy And Hold Forever ETFs Discover the best long-term investment strategy for wealth building. Click as I share two alternative dividend ETFs that could be good picks for income investors.
638,2025-06-07,"Watch These Broadcom Stock Price Levels After Post-Earnings Slide Broadcom shares fell sharply Friday, one day after the chip giant delivered quarterly results and an outlook that were largely in line with Wall Street estimates. Monitor these key post-earnings chart levels."
639,2025-06-07,Broadcom Latest AI Chipmaker To Outperform With Quarterly Results Broadcom Latest AI Chipmaker To Outperform With Quarterly Results
640,2025-06-08,"Why Broadcom Inc. (AVGO) Crashed On Friday We recently published a list of 10 Stocks Took a Shocking Nosedive. In this article, we are going to take a look at where Broadcom Inc. (NASDAQ:AVGO) stands against other Friday’s worst-performing stocks. Broadcom dropped its share prices for a second day on Friday, shedding 5 percent to finish at $246.93 apiece as investors appeared to […]"
641,2025-06-09,"CSQ: Continuing To Outperform And Good Wealth Protection Against Dollar Devaluation CSQ combines equity and convertible exposure to outperform peers, offer inflation protection, and deliver a 7.01% yield. See why CSQ CEF is a buy."
642,2025-06-09,"Broadcom, Nvidia, and AMD Could Help This Unstoppable ETF Turn $250,000 Into $1 Million in 10 Years Data center spending could top $1 trillion per year by 2028 to meet surging demand for computing capacity driven by artificial intelligence (AI).  Suppliers of data center chips and components, such as Nvidia, Broadcom, and Advanced Micro Devices, could be poised for significant growth.  The iShares Semiconductor ETF holds those three stocks along with 27 others, and it could turn $250,000 into $1 million over the coming decade."
643,2025-06-10,American Century Focused Dynamic Growth Fund Q1 2025 Commentary Our process uses bottom-up financial analysis aimed at identifying large-cap companies that we think have the potential to produce attractive long-term earnings growth.
644,2025-06-10,"Thornburg Summit Fund Q1 2025 Commentary Global markets experienced substantial volatility during the quarter, largely driven by escalating trade tensions initiated by the United States."
645,2025-06-11,Prediction: Nvidia Stock Will Get a Boost From an Increase in Acquisition Activity CFO Colette Kress made statements last December suggesting the company is on the lookout for smart acquisitions.  Nvidias job ads suggests the company is beefing up its mergers and acquisitions (M&A) capabilities.  Nvidias mighty balance sheet and massive free cash flow generation give it an advantage over competitors in the acquisition realm.
646,2025-06-12,"S&P 500 Gains and Losses Today: Nucor Stock Falls as US, Mexico Negotiate on Steel Tariffs The S&P 500 slipped 0.3% on Wednesday, June 11, as investors weighed softer-than-expected inflation data and progress on U.S.-China trade talks."
647,2025-06-12,Nvidia Stock Is Rising. What’s Curbing Its Gains. Nvidia Stock Is Rising. What’s Curbing Its Gains.
648,2025-06-13,"Impax Ellevate Global Womens Leadership Fund Q1 2025 Commentary During the first quarter, the Global Womenâs Leadership portfolio lagged global developed market equities overall in the period."
649,2025-06-13,Nvidia Stock Falls. What’s Behind the Latest Drop. Nvidia Stock Falls. What’s Behind the Latest Drop.
650,2025-06-13,"This Incredibly Cheap Artificial Intelligence (AI) Chip Stock Wants to Become the Next Broadcom Broadcom is currently the leading player in the market for custom AI processors, but its about to get a new competitor very soon.  This competitor recently announced its intention to re-enter the data center chip market, and it just made a move to ensure that it can make a dent.  Broadcom has become one of the leading players in the artificial intelligence (AI) semiconductor market thanks to its expertise in application-specific integrated circuits (ASICs), which are custom processors designed for performing specific tasks."
651,2025-06-13,"Credo Expects Revenues to Top $800M in FY26: Is the Growth Sustainable? CRDO guides FY26 revenues to exceed $800 million, fueled by AEC, retimer and optical business growth amid soaring AI data-center demand."
652,2025-06-14,"5 Ideal Safer Dividend Buys From Bloombergs June Watch List Read here for an analysis of 15 dividend stocks with safer criteria, yielding solid returns by 2026. Learn strategic picks, ideal for income investors."
653,2025-06-14,Broadcom Has Quietly Become a Top Tech Stock. AI Chips Are Driving Its Growth. The company has climbed to No. 7 in market value and is just behind Nvidia in AI chips. The source of its growth? Leading-edge AI chips for specific applications.
654,2025-06-17,"Broadcom: The AI Premium Is Looking Dangerous Broadcoms Q2 earnings impressed, but overreliance on hyperscalers and overvaluation raise concerns. Click here to read an analysis of AVGO stock now."
655,2025-06-18,The Best Trillion-Dollar Stock to Buy Right Now? Wall Street Has a Clear Answer for Investors. Target prices set by Wall Street analysts imply Nvidia is the best trillion-dollar stock to buy right now.  Nvidia reported strong first-quarter financial results despite headwinds related to export restrictions.  Nvidia stock trades at a very reasonable valuation compared to Wall Street’s forward earnings forecast.
656,2025-06-19,"What Drives Stock Outperformance? Finding big-time winners is much easier said than done, but investors can still deploy a basic framework that puts them on the path to reaping outsized returns."
657,2025-06-19,Marvell Technology Raises Its Custom AI Chip Prospects Marvell stock jumped after the chipmaker increased its addressable market for custom chips for artificial intelligence applications.
658,2025-06-19,"Move Over Nvidia. This AI Juggernaut Really Wows Wall Street. Outshining Magnificent Seven stocks Nvidia and Meta Platforms, artificial intelligence powerhouse Broadcom dominated the latest list of new buys by the best mutual funds. Broadcom stock raked in $24.49 billion from these leading money managers."
659,2025-06-19,"The Stock Market Doesnt Care About The Israel-Iran War (Unless This One Thing Happens) Discover how geopolitical turmoil impacts markets, uncover a potential black swan event, and explore expert insights on current market trends. Click for more."
660,2025-06-20,"Synopsys Establishes PCIe 6.x Compatibility with Broadcom (AVGO) Switch Broadcom Inc. (NASDAQ:AVGO) is one of the best stocks to buy. On June 11, software giant Synopsys, Inc. (NASDAQ:SNPS) reported seamless compatibility between its PCIe 6.x IP and Broadcom’s PEX90000 series switch. The demonstration, operating at 64 GT/s, showcases compatibility between the two companies’ PCIe 6.x technologies, which are designed for high-performance computing and AI […]"
661,2025-06-20,"Trump-Musk Drama Costs Tesla Stacey Vanek Smith, co-host of Everybodys Business, joins Ricky for a look at the tough job market facing college grads.  To catch full episodes of all The Motley Fools free podcasts, check out our podcast center."
662,2025-06-20,"Stocks Erase Early Gains on Weakness in Chip Makers The S&P 500 Index ($SPX ) (SPY ) today is down -0.26%, the Dow Jones Industrials Index ($DOWI ) (DIA ) is up +0.09%, and the Nasdaq 100 Index ($IUXX ) (QQQ ) is down -0.59%. September E-mini S&P futures (ESU25 ) are down -0.16%, and September E-mini Nasdaq futures..."
663,2025-06-20,"15 AI stocks to watch outside of the Magnificent 7 Some investors may be wondering if they missed out on Nvidias (NVDA) artificial intelligence (AI) run. Futurum CEO Daniel Newman joins Morning Brief to highlight 15 alternative AI plays, including Broadcom (AVGO), Palantir (PLTR), and Oracle (ORCL), that could benefit from the next wave of custom chip demand. To watch more expert insights and analysis on the latest market action, check out more Morning Brief here."
664,2025-06-21,"Nvidia, AI Chip Stocks Pull Back As Investors Turn Cautious Semiconductor stocks tied to the AI megatrend dipped on Friday as the second quarter nears its end. Nvidia stock was among the decliners."
665,2025-06-21,"Markets mixed, chip stocks fall, meme stocks: Market Takeaways US stocks (^DJI, ^IXIC, ^GSPC) ended Fridays session mixed. Yahoo Finance Markets and Data Editor Jared Blikre outlines some takeaways of the trading day, including equity market weakness, chip stock moves, and the rise of meme stocks. To watch more expert insights and analysis on the latest market action, check out more Asking for a Trend here."
666,2025-06-22,"10 No-Brainer Artificial Intelligence (AI) Stocks to Buy Right Now Nvidia, AMD, Broadcom, TSMC, and ASML are all strong plays on expanding AI infrastructure.  Amazon, Alphabet, and Meta Platforms are three tech titans set to benefit from AI.  Palantir and Salesforce are two leading software companies that have big AI opportunities ahead."
667,2025-06-23,Astera Labs AI Infrastructure Demand Accelerates: More Upside Ahead? ALAB stock rises 26.2% in three months as AI interconnect demand and first-mover innovations boost its 2025 outlook.
668,2025-06-24,"Buy Broadcom Stock, HSBC Says. Its AI Chip Prospects Are Improving. Broadcom  stock is an attractive buying opportunity, even after its rally this year, according to HSBC.  On Tuesday, analyst Frank Lee raised his rating for the company’s stock to Buy from Hold and increased his price target to $400 from $240.  Broadcom’s semiconductors compete in several categories, including networking, broadband, server storage, wireless, and industrial."
669,2025-06-24,"Stocks Rally on a Tentative Ceasefire in the Israel-Iran War The S&P 500 Index ($SPX ) (SPY ) today is up +0.85%, the Dow Jones Industrials Index ($DOWI ) (DIA ) is up +0.89%, and the Nasdaq 100 Index ($IUXX ) (QQQ ) is up +1.10%. September E-mini S&P futures (ESU25 ) are up +0.80%, and September E-mini Nasdaq futures..."
670,2025-06-24,"Why Synaptics Is A Long-Term Stock To Hold Synaptics is a good stock to own, given ongoing IoT momentum and expected rebounds in automotive and PC segments. Read the full analysis here."
671,2025-06-24,"Broadcom Unveils VMware Cloud Foundation 9.0, Revolutionizes Private Cloud for AI Applications Broadcom Inc. (NASDAQ:AVGO) is one of the best QQQ stocks to buy according to hedge funds. On June 17, Broadcom announced the general availability of VMware Cloud Foundation/VCF 9.0, which marked a significant advancement in its private cloud platform. VCF 9.0 aims to provide a consistent operating model across data centers, edge environments, and managed cloud […]"
672,2025-06-24,"Email Encryption Market worth $23.33 billion by 2030- Exclusive Report by MarketsandMarkets™ The Email Encryption Market is projected to reach USD 23.33 billion by 2030 (forecast year) from USD 9.30 billion in 2025 (estimated year), at a CAGR of 20.2% during 2025–2030, according to a new report by MarketsandMarkets™."
673,2025-06-24,3 Phenomenal AI Stocks That Investors Should Load Up On Nvidias GPUs have built most of the AI technology we experience today.  Broadcoms connectivity switches and XPUs are slated to grow as inference becomes more common.  Artificial intelligence (AI) investing doesnt have to be hard.
674,2025-06-24,"Lyft upgraded, Block assumed: Wall Streets top analyst calls Lyft upgraded, Block assumed: Wall Streets top analyst calls"
675,2025-06-25,"Broadcom, AMD Lead Chip Stocks Rally Tuesday Shares of Advanced Micro Devices, Broadcom, and other semiconductor-related companies surged Tuesday."
676,2025-06-25,"Oil prices & defense stocks fall, Broadcom upgraded to Buy Here are stories Wall Street is watching on Tuesday, June 24. Stocks (^DJI, ^GSPC, ^IXIC) are trading higher while oil prices (CL=F) are falling on hopes that tensions between Iran and Israel are cooling. Those hopes are also sending shares of defense stocks lower. Broadcom (AVGO) is trading higher after being upgraded to Buy from Hold at HSBC. Stay up to date on the latest market action, minute-by-minute, with Yahoo Finances Market Minute."
677,2025-06-25,"Broadcom’s (AVGO) Trillion-Dollar Comeback Reinforces Bullish Outlook Broadcom (AVGO) has rejoined the elite group of trillion-dollar market cap companies, rebounding over 70% since April’s peak in trade-related bearish sentiment. Much of this volatility stemmed from Broadcom’s substantial exposure to China, as a large share of its semiconductor revenue—still more than half of total sales—remains vulnerable to tariffs, unlike its more insulated software segment, including VMware. Broadcom’s stock had already been under pressure as excitement around DeepSeek—a Chin"
678,2025-06-25,"Chip stocks are beating software stocks this year, but here’s why both stand to win as AI demand grows Chip stocks are beating software stocks this year, but here’s why both stand to win as AI demand grows"
679,2025-06-25,Sector Update: Tech Stocks Climb Late Afternoon Tech stocks gained late Tuesday afternoon with the Technology Select Sector SPDR Fund (XLK) rising 1
680,2025-06-26,Nvidia stock notches fresh record high in remarkable 2025 turnaround Nvidia stock hit a new all-time high on Wednesday.
681,2025-06-26,Dont Miss The 2025 AI Wave - Dividend Investors Edition AIs growth sparks new opportunities! Explore a compelling thesis for dividend investors in this market cycle. Click for my favorite dividend picks now.
682,2025-06-26,"Insiders At Broadcom Sold US$301m In Stock, Alluding To Potential Weakness In the last year, many Broadcom Inc. ( NASDAQ:AVGO ) insiders sold a substantial stake in the company which may have..."
683,2025-06-26,Why Super Micro (SMCI) Stock Is Soaring Again Super Micro Leads AI Stock Surge After Geopolitical Tensions Ease
684,2025-06-27,"Micron Sells Out 2025 HBM Supply: Can It Meet Soaring Demand in 2026? With MUs HBM supply for 2025 sold out, the spotlight shifts to whether it can scale to meet the soaring demand in 2026."
685,2025-06-27,"Zacks Market Edge Highlights: SEI, MRVL, AVGO, ORCL and PGY Zacks names five rising AI stocks beyond NVIDIA, featuring SEI, MRVL, AVGO, ORCL, and PGY, with strong growth potential."
686,2025-06-27,"Broadcoms Semiconductor Solutions Accelerate: What Lies Ahead? AVGOs AI-fueled chip growth hits $8.4B in Q2, with margins climbing and hyperscale demand boosting momentum."
687,2025-06-27,"Corning (NYSE:GLW) Announces US$0.28 Quarterly Dividend Payment Corning (NYSE:GLW) has reaffirmed its commitment to shareholders by declaring a quarterly dividend of $0.28 per share, set for payment on September 29, 2025. This announcement aligns with the company’s 10% share price increase over the last quarter. The rise can be viewed in the context of broader market trends, where an overall 12% market uptick in the past year frames Cornings performance. Notably, collaborations with Broadcom and Samsung, as well as a strategic share buyback plan, have..."
