501,"Why Tech Stocks Crashed on Wednesday The tech market took it on the chin on Wednesday as the trade war picked up steam and the Federal Reserve sounds like its not going to bail out the market.  Big tech in both the U.S. and China were hit hard today.  Broadcom (NASDAQ: AVGO) fell as much as 6.7%, Alibaba Group (NYSE: BABA) dropped 5.6%, and JD.com (NASDAQ: JD) fell 6.4%."
502,"This chip stock ’is clearly the most popular long’, Citi says (not Nvidia) Investing.com -- Broadcom, not Nvidia (NASDAQ:NVDA), is currently the top pick among semiconductor investors, according to a new note from Citi analysts following meetings with clients."
503,"AMD, Micron, Broadcom Stocks Drop as U.S. Tightens Chip Export Rules AMD, Micron, Broadcom Stocks Drop as U.S. Tightens Chip Export Rules"
504,Technology Down on Trade War Implications - Tech Roundup Shares of technology companies fell as traders continued to fret about the implications of a trade war. Taiwan Semiconductor Manufacturing shares rose after the chip fabricator reported a surge in...
505,Nvidia stock falls as Chinas Huawei reportedly boosts AI chip production after Trumps export ban Nvidia and other chip stocks fell Monday as Chinas Huawei is reportedly boosting production of its leading AI chips following Trumps new export rules announced last week.
506,"Why Broadcom Stock Is Tumbling Today Shares of Broadcom (NASDAQ: AVGO), a semiconductor designer, are falling Monday as investors grow increasingly concerned about President Donald Trumps tariffs and economic decisions.  On Monday, Trump again called on Federal Reserve Chairman Jerome Powell to lower interest rates.  The Fed operates independently from the White House and the rest of the federal government, but Trump has ratcheted up his expressions of displeasure with Powell, and presidential aides are reportedly looking for ways that the administration might be able to fire Powell legally before his term as chairman is up in 2026."
507,"Better AI Chip Stock: Nvidia vs. Broadcom When it comes to designing semiconductor chips used to power artificial intelligence (AI) workloads, two companies stand head and shoulders above the rest: Nvidia (NASDAQ: NVDA) and Broadcom (NASDAQ: AVGO).  Nvidia has been the biggest early winner in AI chips, but Broadcom has been gaining momentum.  Nvidia and Broadcom are taking two very different approaches to the AI chip market."
508,"Is Broadcom Inc. (AVGO) the Most Promising Long-Term Stock According to Analysts? We recently published a list of the 11 Most Promising Long-Term Stocks According to Analysts. In this article, we are going to take a look at where Broadcom Inc. (NASDAQ:AVGO) stands against other promising long-term stocks. On March 31, Banrion’s Shana Sissel recently appeared on CNBC’s ‘Power Lunch’ to discuss that buying at lower valuations […]"
509,"Tech giants to plow $500 billion cash hoard into more buybacks (Bloomberg) -- While many investors have been scared away from tech giants at the center of this year’s equity rout, the companies are likely to continue plowing money into buybacks that will offer at least one source of continuing support for the stocks.Most Read from BloombergTrump Gives New York ‘One Last Chance’ to End Congestion FeeDOGE Visits National Gallery of Art to Discuss Museum’s Legal StatusThe Racial Wealth Gap Is Not Just About MoneyBackyard Micro-Flats Aim to Ease South Africa’s"
510,"Nvidia, Other Chip Stocks Rally as Trump Says China Tariffs Will Come Down Chip stocks including Nvidia and Broadcom rose sharply Wednesday, a day after President Donald Trump reportedly said the administrations tariffs on China will come down substantially."
511,"Nvidia, AMD, and Other Chip Stocks Rally. Tariffs Fears Are Lifting—but There Is Another Concern to Watch. Nvidia, AMD, and Other Chip Stocks Rally. Tariffs Fears Are Lifting—but There Is Another Concern to Watch."
512,"Miners, Insurers — And Netflix — Lead 33 Perfect Stocks In Damaged Market While action in the market indexes makes risk management a top priority, Netflix leads 33 stocks to watch in the top-ranked industries."
513,"2 Top-Ranked Dividend Stocks That Boast Solid Growth Potential Investors have become defensive, raising the appeal of dividend stocks. Broadcom and Primoris are two stocks with solid growth prospects."
514,Nvidia Stock Climbs. It’s Headed for Its 3rd Straight Day of Gains. Nvidia Stock Climbs. It’s Headed for Its 3rd Straight Day of Gains.
515,"1 Semiconductor Stock Worth Your Attention and 2 to Keep Off Your Radar Semiconductors are the silicon backbone of the digital revolution. Still, they’re subject to swings in the broader economy because customers often stockpile chips ahead of demand, and investors seem to believe that inventory levels are correcting - over the past six months, the industry has shed 24.2%. This drop was noticeably worse than the S&P 500’s 5.7% fall."
516,"2 Unstoppable Stocks Destined to Achieve a $1 Trillion Valuation The $1 trillion stock club has been getting a bit thinner amid the stock market sell-off, as a handful of companies have fallen out of this prestigious club.  Taiwan Semiconductor (NYSE: TSM) and Broadcom (NASDAQ: AVGO) are two companies that are destined to join the $1 trillion valuation club.  Broadcom and TSMC arent that far away from joining the $1 trillion club, as Broadcom and TSMC are currently valued at around $800 billion and $770 billion, respectively."
517,"Broadcom (NasdaqGS:AVGO) Announces Ambitious US$10 Billion Share Repurchase Program In recent developments, Broadcom (NasdaqGS:AVGO) introduced innovative products like Incident Prediction and expanded its optical solutions, which align with rising industry interests in cybersecurity and AI. Additionally, Broadcoms $10 billion share repurchase program highlights confidence in its financial standing. These strategic moves could have played a role in the companys 10% price increase over the past week. The overall market also saw gains, with the Nasdaq Composite up 0.4%..."
518,"These 2 Artificial Intelligence (AI) Chip Stocks Could Soar 50% to 112% in the Next Year, According to Wall Street This has been a difficult year for semiconductor stocks, which is evident from the 23% decline in the PHLX Semiconductor Sector index so far.  Also worth noting here is that 89% of analysts covering Broadcom recommend buying it."
519,"Broadcom Inc. (AVGO) Price Target Trimmed to $215 on Tariff, Trade War, and China Risk Concerns We recently compiled a list of the 12 AI Stocks Analysts Are Talking About Right Now. In this article, we are going to take a look at where Broadcom Inc. (NASDAQ:AVGO) stands against the other AI stocks. Latest reports from the IMF reveal that economic gains from artificial intelligence are likely to outweigh the costs of […]"
520,"Tariffs Wont Stop The AI Revolution Despite recent tariff setbacks, AI-related growth remains robust, with Amazon and Nvidia executives optimistic about the segments future in todays uncertain market. Read the latest here."
521,"Analysis: Corporate America boosts security spending after UnitedHealth murder, filings show (Reuters) -U.S. corporations have been ramping up their security spending, but following the murder of UnitedHealth executive Brian Thompson that expenditure is set to rise further in 2025 as more companies see heightened threats to their top brass.  At least a dozen S&P 500 companies have flagged an increase in security risks, a Reuters analysis of the proxy statements - or annual disclosures to shareholders - showed.  Blue-chip companies such as Walmart, General Motors, American Express and chipmaker Broadcom have disclosed new or increased security expenses from previous years."
522,"Best Growth Stocks to Buy for April 28th LMB, APELY and AVGO made it to the Zacks Rank #1 (Strong Buy) growth stocks list on April 28, 2025"
523,"CGGR: The ETF If You Cant Stomach Volatility But Still Want Tech Exposure CGGR is a diversified ETF focusing on superior growth companies, with a 6.6% YTD decline presenting an attractive long-term accumulation opportunity. Read why I rate CGGR as a buy."
524,"The Best Tech ETF to Invest $250 in Right Now If youre feeling overwhelmed by the stock market right now, youre not alone.  The S&P 500 had one of its fastest drops on record in early April, and the Nasdaq Composite hurtled into a bear market, falling more than 20% from its high just in February."
525,"The Zacks Analyst Blog Highlights Microsoft, Broadcom, McDonalds and Kingsway Financial Services Microsoft, Broadcom, McDonalds and Kingsway Financial Services are included in this Analyst Blog."
526,Chip Design Hits AI Crossover Point AI-powered tools can drive impressive improvements in chip performance and energy efficiency. This has also led to significant growth in use of AI-powered capabilities in chip design tools.
527,"Top Analyst Reports for Microsoft, Broadcom & McDonalds Todays Research Daily features new research reports on 16 major stocks, including Microsoft Corporation (MSFT), Broadcom Inc. (AVGO) and McDonalds Corporation (MCD), as well as a micro-cap stock Kingsway Financial Services Inc. (KFS)."
528,5 Reasons to Buy Broadcom Stock Like Theres No Tomorrow Too many investors look right past the resilient -- and fast-growing -- demand for this telecom technology companys solutions.
529,"Broadcom, No. 1 Ranked Artificial Intelligence Stock, Gets Rating Upgrade, Showing Rising Strength On Monday, AI chip leader Broadcom got an upgrade for its IBD SmartSelect Composite Rating from 94 to a near-best 97."
530,"Logitechs Q4 Earnings Surpass Estimates, Revenues Match Higher promotional spending and increased operating expenses weigh on LOGIs Q4 earnings."
531,Franklin Growth Fund Q1 2025 Commentary Franklin Growth Fund underperformed its S&P 500 Index benchmark in the ï¬rst quarter of 2025. Read more here.
532,ClearBridge Dividend Strategy Portfolios Q1 2025 Commentary The S&P 500 Index declined 4.3% in the first quarter due to two distinct factors. Strategy outperformance (gross and net of fees) stemmed from several factors.
533,Kolanovic Flags Nvidia as AI Capex Risks Rise Former JPM strategist warns cracks in Nvidias AI buildout could unsettle markets
534,"Is Broadcom Inc. (AVGO) the Worst-Performing Blue Chip Stock So Far in 2025? We recently published a list of 11 Worst-Performing Blue Chip Stocks So Far in 2025. In this article, we are going to take a look at where Broadcom Inc. (NASDAQ:AVGO) stands against other worst-performing blue chip stocks so far in 2025. Blue chip stocks are under immense pressure amid the evolving trade tensions and tariff […]"
535,"Is Broadcom Inc. (NASDAQ:AVGO) a Stock That Should Double in 3 Years? We recently published a list of the 30 Stocks That Should Double in 3 Years. In this article, we are going to take a look at where Broadcom Inc. (NASDAQ:AVGO) stands against other stocks that should double in 3 years. On April 25, Kari Firestone, Aureus Asset Management executive chairman and co-founder, joined CNBC’s ‘Squawk […]"
536,Nvidia Stock Rises. The AI Trade Is So Back. Nvidia Stock Rises. The AI Trade Is So Back.
537,"Seaport starts coverage of chip stocks, says sell Nvidia, buy Broadcom, AMD Investing.com -- Seaport Research started coverage of the semiconductor sector with a cautious view, downgrading Nvidia (NASDAQ:NVDA) and Intel (NASDAQ:INTC) to Sell while rating buy on stocks like Broadcom (NASDAQ:AVGO) and AMD (NASDAQ:AMD)."
538,Broadcom and JinkoSolar have been highlighted as Zacks Bull and Bear of the Day Broadcom and JinkoSolar have been highlighted as Zacks Bull and Bear of the Day.
539,"ALAB Set to Report Q1 Earnings: Buy, Sell or Hold the Stock? Astera Labs first-quarter 2025 results are expected to reflect strong demand for AI-enabled servers and data center infrastructure amid stiff competition."
540,"3 High-Growth Tech Stocks That Are Screaming Buys in May Broadcom, Meta, and CrowdStrike are still worth buying in this rough market."
541,Nvidia CEO Jensen Huang gets first salary boost in 10 years Nvidia CEO Jensen Huang got his first major salary bump since 2015 — but it’s still less than half of the salaries of executives at Microsoft and Apple.
542,"ClearBridge Appreciation ESG Portfolios Q1 2025 Commentary Despite a fast start to the year, a broad-based rally propelled the S&P 500 Index +2.8% in January, the market struggled for traction in the first quarter of 2025."
543,"Best Growth Stocks to Buy for May 5th LMB, AVGO and BGC made it to the Zacks Rank #1 (Strong Buy) growth stocks list on May 5, 2025."
544,"Franklin U.S. Focused Growth SMA Q1 2025 Commentary Stock markets worldwide were turbulent over 1Q25, with major US equity indexes, the S&P 500 Index, Dow Jones Industrial Average and NASDAQ Composite Index, sustaining overall declines."
545,"Franklin Income SMA Q1 2025 Commentary The 10-year UST noteâs yield decreased 36 bps during the quarter, reaching 4.21% by period-end. Read more here."
546,"LMP Capital And Income Fund Inc. Q1 2025 Commentary For the quarter, the fund returned 1.96% at NAV, while the benchmark, the 65% S&P 500, 35% Bloomberg US Aggregate, returned 0.49%. Read more here."
547,"Fidelity Blue Chip Growth Fund Q1 2025 Commentary For Q1 2025, the Fidelity Blue Chip Growth Funds Retail Class shares returned -13.06%, lagging the benchmark. Click here to read the full commentary. "
548,"Broadcom Inc. to Announce Second Quarter Fiscal Year 2025 Financial Results on Thursday, June 5, 2025 Broadcom Inc. (NASDAQ: AVGO), a global technology leader that designs, develops and supplies semiconductor and infrastructure software solutions, today announced it will report its second quarter fiscal year 2025 financial results and business outlook on Thursday, June 5, 2025 after the close of the market. Broadcoms management will host a conference call at 2:00 p.m. Pacific Time on the same day to discuss these results and business outlook."
549,Nvidia Stock Falls. Here’s What’s Weighing on the Chip Maker. Nvidia Stock Falls. Here’s What’s Weighing on the Chip Maker.
550,"Meet the Monster Stock that Continues to Crush the Market Broadcom is still a great long-term play on the cybersecurity, cloud, and AI markets."
551,"Broadcom Inc. (AVGO) Reaffirmed as Buy – Analysts “Relieved” by Unwavering AI Capex Spending We recently published a list of 10 AI Stocks in the News Today. In this article, we are going to take a look at where Broadcom Inc. (NASDAQ:AVGO) stands against other AI stocks in the news today. The Trump administration may soon abandon the tiered approach to accessing advanced AI chips and replace it with […]"
552,"Baron Opportunity Fund Q1 2025 Shareholder Letter Baron Opportunity Fund declined in the first quarter of 2025, underperforming its benchmark, the Russell 3000 Growth Index. Read more here."
553,"Heres Why Broadcom Inc. (AVGO) Fell More Than Broader Market In the most recent trading session, Broadcom Inc. (AVGO) closed at $200.94, indicating a -1.32% shift from the previous trading day."
554,Marvell Stock Falls Sharply. What’s Hurting the Former AI Chip Favorite. Marvell Stock Falls Sharply. What’s Hurting the Former AI Chip Favorite.
555,"Nvidia CEO Jensen Huang on AI: Every job will be affected, some will be lost Nvidia founder and CEO Jensen Huang served up a blunt take on the job market as AI permeates society."
556,2024 Total Dividend Income And Portfolio Update 2024 also saw some changes to some of my holdings as the author shuttled several dividend income payers for higher return crypto plays. Click to read.
557,"Invesco Dividend Income Fund Q1 2025 Commentary The fund outperformed the Russell 1000 Value Index due to strong stock selection in several sectors, despite underperformance in information technology, materials and financials."
558,"Invesco EQV Asia Pacific Equity Fund Q1 2025 Commentary Stock selection in consumer discretionary, health care and information technologyÂ were among the largest detractors from relative performance. Read more here."
559,Nvidia Stock Wavers as Trump Plans to Scrap Biden’s Chip-Export Rules Nvidia Stock Wavers as Trump Plans to Scrap Biden’s Chip-Export Rules
560,Hartford Capital Appreciation Fund Q1 2025 Commentary Hartford Capital Appreciation Fund (I Share) (-6.26%) underperformed the Russell 3000 Index (-4.72 %) during the quarter. Read more here.
561,"Wall Street Lunch: Fed Holds Rates, In No Hurry To Cut Fed keeps rates on hold amid stagflation concerns. Chairman Powell stresses the Fed can wait to see how tariffs shake out. White House ready to kill the AI diffusion rule."
562,Hartford Growth Opportunities Fund Q1 2025 Commentary The Hartford Growth Opportunities Fund (I Share) underperformed the Russell 3000 Growth Index during the quarter. Read more here.
563,Nvidia Stock Wobbles On Uncertainty Over Trump AI Chip Policy Uncertainty over the Trump administrations policy on the export of AI chips weighed on Nvidia stock and others on Thursday.
564,"Apple Is Developing Specialized Chips for Glasses, New Macs and AI Servers (Bloomberg) -- Apple Inc.’s silicon design group is working on new chips that will serve as the brains for future devices, including its first smart glasses, more powerful Macs and artificial intelligence servers. Most Read from BloombergIs Trump’s Plan to Reopen the Notorious Alcatraz Prison Realistic?Vail to Borrow Muni Debt to Ease Ski Resort Town Housing CrunchAs Trump Reshapes Housing Policy, Renters Face Rollback of RightsIceland Plans for a More Volcanic FutureNYC Warns of 17% Drop in For"
565,Palantir and 29 Other Stocks for the Next Phase of the AI Trade Palantir and 29 Other Stocks for the Next Phase of the AI Trade
566,"Synaptics Inc (SYNA) Q3 2025 Earnings Call Highlights: Strong IoT Growth and Wi-Fi 7 Launch ... Synaptics Inc (SYNA) reports a 12% revenue increase and a 70% rise in EPS, driven by robust IoT sales and strategic product launches."
567,"The Score: Disney, Berkshire Hathaway, Ford and More Stocks That Defined the Week Investors celebrated  Disney’s  plans for a new theme park.  Disney also posted strong earnings, saying that its U.S. theme parks attracted more guests and higher spending from visitors in the March quarter.  Disney and its rivals continue to face issues such as declining cable-TV usage and underperformance at the box office."
568,"Heres How Much Youd Have If You Invested $1000 in Broadcom Inc. a Decade Ago Why investing for the long run, especially if you buy certain popular stocks, could reap huge rewards."
569,"Now that trade deals are getting done, this out-of-favor stock-market strategy may shine UBS strategists led by Sean Simonds have a timely note about how now the questions will be less on policy uncertainty and more on outcome uncertainty."
570,"Meta, Walmart, and Other Stocks This AI Trader Is Selling Amid the Market Uncertainty Meta, Walmart, and Other Stocks This AI Trader Is Selling Amid the Market Uncertainty"
571,"SMH: The Growth Story Remains Incredibly Mispriced SMH ETF has shown a robust bottoming signal, maintaining a bullish uptrend, and investors should consider adding exposure to semiconductor shares now. See more."
572,"Credo: Be Fearful When Others Are Greedy Discover why Credo Technology (CRDO) faces risks like intense competition, limited scale, and stagnating margins, which hinder its ability to drive growth."
573,"AI chips will likely find their way to China despite export controls President Trump is expected to ease restrictions and artificial intelligence (AI) chip exports to Saudi Arabia while meeting with Saudi Prince Mohammed bin Salman on his trip to the Middle East. This has raised concerns that the technology could be resold to China. Brian McCarthy, Macrolens managing principal and chief strategist, explains the difficulties in containing the trade flows of semiconductors. To watch more expert insights and analysis on the latest market action, check out more Morning Brief here."
574,"Nvidia, Broadcom, AMD Rally as U.S. and China Ease Trade Barriers Chip Sector Spikes as Tariffs Fall to 30% for Three Months"
575,"Nvidia, AMD help the chip sector to its highest close since February Nvidia, AMD help the chip sector to its highest close since February"
576,"Nvidia, AMD extend stock gains. Why the AI trade is roaring back. Nvidia, AMD extend stock gains. Why the AI trade is roaring back."
577,"Parnassus Growth Equity Fund Q1 2025 Commentary Parnassus Growth Equity Fund (Investor Shares) returned -8.59% (net of fees) for the quarter, faring better than the Russell 1000 Growth Indexâs -9.97%."
578,"Broadcom vs. Marvell: Which Semiconductor Stock Has Greater Upside? Both AVGO and MRVL offer semiconductor solutions that power AI, Cloud and Data centers. Which one of them is a better buy for investors amid a challenging macro backdrop?"
579,"Broadcom Announces Third-Generation Co-Packaged Optics (CPO) Technology with 200G/lane Capability Key partner milestones with CPO switches demonstrate ecosystem readiness for next-generation AI scale-up and scale-out networksPALO ALTO, Calif., May 15, 2025 (GLOBE NEWSWIRE) -- Broadcom Inc. (NASDAQ: AVGO) today announced significant advancements in its co-packaged optics (CPO) technology with the launch of its third-generation 200G per lane (200G/lane) CPO product line. In addition to the 200G/lane breakthrough, Broadcom demonstrated the maturity of its second-generation 100G/lane CPO product"
580,Nvidia Stock Falls. Why CoreWeave Results Are Weighing on AI Trades. Nvidia Stock Falls. Why CoreWeave Results Are Weighing on AI Trades.
581,Broadcom Inc. Announces Third-Generation Co-Packaged Optics Technology with 200G/Lane Capability Broadcom Inc. announced significant advancements in its co-packaged optics technology with the launch of its third-generation 200G per lane CPO product line. In addition to the 200G/lane...
582,"BlackRock Large Cap Focus Growth Fund Q1 2025 Commentary The fund posted returns ofÂ -10.98%Â (Institutional shares) andÂ -10.98%Â (Investor A shares, without sales charge) for the first quarter of 2025."
583,Nvidia-backed CoreWeave soars 100% since IPO as investors see AI demand outweighing risky business model Nvidia-backed AI cloud company CoreWeave has seen shares soar over 100% since its IPO in March as investors hopes for the AI boom outweigh concerns over its Nvidia-reliant business model.
584,"Our Top 10 High-Growth Dividend Stocks -- May 2025 We provide a methodology for selecting high-growth dividend stocks, focusing on dividend growth and sustainability rather than high current yield. Read the full list of stock picks here."
585,"If I Had To Start Over, This Is How Id Invest My First $100,000 A 50/50 split between ETFs and top stocks balances income, growth, and risk in a long-term strategy. Learn why this portfolio approach is built to compound."
586,Nvidia stock wavers as market turmoil eclipses AI chip announcements Nvidia stock pared losses Monday as market turmoil overshadowed AI chip news during the Computex Taipei tech expo.
587,Janus Henderson Balanced Fund Q1 2025 Commentary The Fund returned -2.05% and the S&P 500Â®Index returned -4.27%. The Bloomberg U.S. Aggregate Bond Index returned 2.78%. The Balanced Index returned -1.45%.
588,"Zacks Investment Ideas feature highlights: Moodys, Broadcom, Microsoft and CoreWeave Moodys, Broadcom, Microsoft and CoreWeave are part of the Zacks Investment Ideas article."
589,"2 Unstoppable AI Stocks That Just Joined the $1 Trillion Club Taiwan Semiconductor expects massive growth over the next few years from AI-related chips.  Broadcoms XPUs will challenge Nvidias GPUs over the next few years.  Two of the latest members to join the club are Taiwan Semiconductor (NYSE: TSM) and Broadcom (NASDAQ: AVGO), although theyre not exactly new members."
590,"Broadcom Q2 Preview: Continuing CAPEX Spendings Among Hyperscalers Broadcom Inc. is a Strong Buy with a $247 fair value, driven by AI & cloud demand, innovative solutions, and clear growth strategies. Click for my AVGO update."
591,"Dow Jones Futures: Amazon, Broadcom, Meta, Palantir In Or Near Buy Zones Dow Jones Futures: Amazon, Broadcom, Meta and Palantir stock are among the best stocks to buy and watch today."
592,"Nvidia’s AI Chip Revenue to More Than Double to $262 Billion by 2030, Analyst Says Nvidia’s AI Chip Revenue to More Than Double to $262 Billion by 2030, Analyst Says"
593,"Celestica - Finally An AI Play That Is Not Trading At Too Elevated Valuations Celestica could be a hidden gem in AI hardware and supply chains, which enjoy strong growth, low valuation, and reduced risk. Read more about CLS and why its a good bet."
594,"Prediction: 1 Data Center Stock That Could Join Nvidia, Broadcom, and Taiwan Semiconductor Manufacturing as a Trillion-Dollar Business by 2030 Nvidia, Broadcom, and Taiwan Semiconductor are currently the only chip stocks that boast a valuation of $1 trillion or more."
595,"What the Era of ‘Sovereign AI’ Means for Chip Makers As Nvidia and others strike deals with sovereign nations, their business will become politicized as never before."
596,Nvidia Stock Slumps. Tariffs Make Everyone Forget Earnings Are Coming Next Week. Nvidia Stock Slumps. Tariffs Make Everyone Forget Earnings Are Coming Next Week.
597,"Qualcomm vs. Broadcom: Which Chip Giant is the Better Buy Now? Broadcom eyes 2025 gains with 35.9% EPS growth and 62.5% stock surge, outpacing Qualcomms 15.6% EPS rise and 30.9% decline."
598,"1 Dark Horse Candidate for Best-Performing AI Stock Over the Next Five Years Nvidia has been a huge winner in the AI arms race.  Broadcom trades at a high valuation, but that may be deserved.  Nvidia makes graphics processing units (GPUs) that are widely used to train AI models, but there could be a shift occurring."
