987,"Morgan Stanley Raises AMD Price Target to $246 on Strong AI Datacenter Outlook Advanced Micro Devices, Inc. (NASDAQ:AMD) is one of the Trending AI Stocks on Wall Street’s Radar. On October 7, Morgan Stanley analyst Joseph Moore raised the price target on the stock to $246.00 (from $168.00) while maintaining an Equal Weight rating. The firm lifted its 2027 datacenter GPU estimates for AMD from $13 billion to $20 […]"
988,CRDO Surges 289% in Six Months: Is it Still a Buying Opportunity? Credos 289% surge in six months reflects booming AI-driven demand and hyperscaler adoption. Can the rally keep going?
989,This Analyst’s Prediction About Broadcom (AVGO) Was Right Harsh Kumar from Piper Sandler discussed Broadcom Inc (NASDAQ:AVGO) results in December 2024 and made some bullish comments about the company. The analyst at the time said investors should be comfortable based on the company’s strong visibility through 2027 and rising CapEx in the industry. He said a surge in CapEx would be able to […]
990,"Celestica Introduces New Family of 1.6TbE Data Center Switches to Power AI/ML Clusters TORONTO, Oct. 10, 2025 (GLOBE NEWSWIRE) -- Celestica Inc. (TSX: CLS) (NYSE: CLS), a leader in design, manufacturing, supply chain and platform solutions for the world’s most innovative companies, today introduced two new 1.6TbE data center switches, the DS6000 and DS6001. These advanced switches are engineered to support high-bandwidth, AI/ML data center applications. Celestica plans to contribute the DS6000/DS6001 spec to the OCP Community and list them on the OCP Marketplace with the OCP Inspi"
991,Jim Cramer Defends NVIDIA (NVDA) After AMD’s OpenAI Deal We recently published 16 Stocks Jim Cramer Mentioned In An Episode Where He Said OpenAI Could Beat All Big Tech Giants. NVIDIA Corporation (NASDAQ:NVDA) is one of the stocks Jim Cramer recently discussed. NVIDIA Corporation (NASDAQ:NVDA)’s shares slipped after AMD and OpenAI announced a deal through which the latter would buy chips from the former. […]
992,1 Super Artificial Intelligence (AI) Stock to Buy Before It Skyrockets (Hint: Its Not Nvidia or Broadcom) The improving demand for this chip designers architecture could send its revenue and profits soaring in the long run.
993,"iShares Semiconductor ETF: Bull vs. Bear This high-flying ETF has nearly tripled in five years, but some tech stock valuations are becoming overextended."
994,Equities Slide After Trumps China Tariffs Threat; Nasdaq Posts Worst Day Since April US equities plummeted Friday after President Donald Trump threatened China with steep tariff increas
995,Does Billionaire Ken Griffin Know Something Wall Street Doesnt? The Citadel Chief Sold More than 80% of His Broadcom Stock and Is Piling Into Another Artificial Intelligence (AI) Stock-Split Stock Instead Ken Griffin runs one of the biggest hedge funds in the world.
996,AI Bubble: Circular Funding And Intense Competitive Rivalry Circular financing in AI infrastructure is fueling a bubble risk reminiscent of past tech booms. Industry profits currently accrue to suppliers. See more here.
997,Semiconductor Sales Could Keep Soaring in 2026: 1 Top Stock to Buy Hand Over Fist Before That Happens Taiwan Semiconductor Manufacturing remains a genius way for investors to play the AI trend.
998,"Equities, Oil Slump Intraday After Trumps China Tariffs Threat US benchmark equity indexes and oil prices tumbled intraday after President Donald Trump threatened"
999,"IPG Photonics, Analog Devices, Applied Materials, Broadcom, and KLA Corporation Shares Plummet, What You Need To Know A number of stocks fell in the afternoon session after President Donald Trump threatened to impose massive new tariffs on Chinese goods, a response to Beijings decision to tighten export controls on rare earth metals."
1000,"QGRW: Leading Growth ETF With A Caveat Discover QGRW ETF: blending growth & quality in large-cap stocks, outperforming peers but with higher volatility."
