301,2025-01-28,"Broadcom Stock: A Golden Buying Opportunity On The DeepSeek Drama Broadcom Inc.s strong stock gains, dividend growth, and strategic acquisitions make it a long-term investment opportunity. Learn more on AVGO stock here."
302,2025-01-28,"As Nvidia Stock Rises, Here’s Why DeepSeek AI Worries Are Overblown As Nvidia Stock Rises, Here’s Why DeepSeek AI Worries Are Overblown"
303,2025-01-28,"As DeepSeek Ravages Nvidia, This AI Stock Conjures A Breakout As DeepSeek Ravages Nvidia, This AI Stock Conjures A Breakout"
304,2025-01-28,"Nvidia, AI Chip Peers Tumble On DeepSeek Implications Nvidia, AI Chip Peers Tumble On DeepSeek Implications"
305,2025-01-30,"Franklin Rising Dividends SMA Q4 2024 Commentary US equities collectively rose in the fourth quarter of 2024, with the S&P 500 Index reaching new record highs. Read more here."
306,2025-01-30,Nvidia Stock Falls. What Microsoft and Meta Earnings Mean for the AI Chip Maker. Nvidia Stock Falls. What Microsoft and Meta Earnings Mean for the AI Chip Maker.
307,2025-01-30,Why DeepSeeks Progress May Actually Be Good News For AI Chipmakers Why DeepSeeks Progress May Actually Be Good News For AI Chipmakers
308,2025-01-30,Broadcom Stock Gains. Why the AI Chip Maker Got a Boost From Meta. Broadcom Stock Gains. Why the AI Chip Maker Got a Boost From Meta.
309,2025-02-01,"DeepSeek Crashes The AI Party: Story Break, Change Or Shift? DeepSeeks abrupt entry into the AI conversation has the potential to change the AI narrative. Read more here."
310,2025-02-01,"5 Relatively Secure And Cheap Dividend Stocks, Yields Upto 8% (February 2025) See top dividend-paying stock picks offering discounts and yields ranging from 3.67% to 8% in our monthly article for conservative investors. Click for the picks."
311,2025-02-02,"Market Outlook: Valuations Get Higher, And So Does Our Income There isnt a lot of room for valuations to go up more, leading to lower future returns for investors. Read more to see my thoughts."
312,2025-02-04,"Stocks That May Benefit From An AI Evolution This Year Tech stocks are in focus as many of the bellwethers report results, but also because of the potential impact of DeepSeek on the AI sector. Morningstar Researchs David Sekera discusses."
313,2025-02-04,Horizon Kinetics Q4 2024 Commentary Horizon Kinetics have published their Q4 2024 Commentary. Howâd we do? Howâd the market do? What to expect now? Click here to find out.
314,2025-02-04,"Baron Opportunity Fund Q4 2024 Shareholder Letter Baron Opportunity Fund increased in the fourth quarter of 2024, outperforming its benchmark, the Russell 3000 Growth Index."
315,2025-02-04,"Baron Durable Advantage Fund Q4 2024 Shareholder Letter Baron Durable Advantage Fund advanced during the fourth quarter of 2024, outpacing its benchmark, the S&P 500 Index."
316,2025-02-05,Stock Market Today: Dow Jones Gains As Nvidia Rises; Google Dives On Massive AI Spending Plan (Live Coverage) Stock Market Today: Dow Jones Gains As Nvidia Rises; Google Dives On Massive AI Spending Plan (Live Coverage)
317,2025-02-05,"Nvidia Stock Rises. Why AMD, Alphabet Earnings Are Boosting the AI Chip Maker. Nvidia Stock Rises. Why AMD, Alphabet Earnings Are Boosting the AI Chip Maker."
318,2025-02-05,Franklin Income SMA Q4 2024 Commentary US stocks collectively rose in the fourth quarter of 2024 despite retreating in December. Read more here.
319,2025-02-06,"The Golden Age Of Customized AI Chips Nvidiaâs AI GPUs have long been the standard for training large-language AI models in centralized data centers, thanks to their immense computational power and parallel-processing chops."
320,2025-02-06,Tracking William Von Muefflings Cantillon Capital Management Portfolio - Q4 2024 Update William von Muefflingâs 13F portfolio value increased to $16.55B. Check out the holdings of Cantillon Capital Management Portfolio here.
321,2025-02-06,Skyworks Stock Crashes as ‘Nightmare’ Becomes Reality. Why Apple Is to Blame. Skyworks Stock Crashes as ‘Nightmare’ Becomes Reality. Why Apple Is to Blame.
322,2025-02-06,"Dow Jones Futures Rise; AI Chip Leader Arm Falls, Tesla Skids As Rival Soars Dow Jones Futures Rise; AI Chip Leader Arm Falls, Tesla Skids As Rival Soars"
323,2025-02-07,Why Microchip would rather borrow money to pay its high dividend than cut it Why Microchip would rather borrow money to pay its high dividend than cut it
324,2025-02-07,PEY: Reconstitution Could Make This ETF More Effective During Market Slowdown Invesco High Yield Equity Dividend Achievers (PEY) is a defensive fund with strong dividend growth and potential value enhancements. See more on the ETF here.
325,2025-02-07,"Model Portfolio For Capital Appreciation, February 25 Discover top stock picks for capital appreciation and outperformance, with a focus on profits, dividends, and long-term viability."
326,2025-02-07,"SPHB: Not The Right Time For High Beta Equities High beta stocks underperformed in 2024 and when they typically excel, along with the current market conditions to watch for. Click here to read why SPHB is a Hold."
327,2025-02-07,AI Chip Stocks Rise On Latest Data Center Spending Plans AI Chip Stocks Rise On Latest Data Center Spending Plans
328,2025-02-10,"Baron Technology Fund Q4 2024 Shareholder Letter During Q4, Baron Technology Fund rose 15.85%, outperforming MSCI ACWI Information Technology Index, which increased 4.28%, and broader S&P 500 Index, which rose 2.41%."
329,2025-02-10,"Fidelity Balanced Fund Q4 2024 Review For the fourth quarter of 2024, the funds Retail Class shares gained 0.59%, topping the 0.21% advance of the Fidelity Balanced Hybrid Composite Index."
330,2025-02-10,"Broadcom: Huge AI Beneficiary Despite DeepSeek Broadcom is a global tech leader in semiconductors and enterprise software, benefiting significantly from the AI boom. See why I rate AVGO stock as a hold."
331,2025-02-11,"Invesco Dividend Income Fund Q4 2024 Commentary The fund is balanced across sectors and industries, with a focus on long-term growth areas and companies with sustainable free cash flow and healthy balance sheets."
332,2025-02-11,Invesco EQV Asia Pacific Equity Fund Q4 2024 Commentary Stock selection in consumer discretionary and information technology were among the largest contributors to relative performance.
333,2025-02-11,"Invesco EQV International Equity Fund Q4 2024 Commentary Class A shares underperformed the MSCI ACWI ex USA Index. During the quarter, we initiated four new positions and exited one stock based on our EQV fundamentals."
334,2025-02-12,Invesco Main Street Fund Q4 2024 Commentary Underperformance mainly resulted from stock selection in health care and communication services. Consumer discretionary led all sectors. Read more here.
335,2025-02-12,"Invesco Core Plus Bond Fund Q4 2024 Commentary Bond yields, though down from their highs, are still at attractive levels compared to the last 10 years, in our view. Read more here."
336,2025-02-12,Janus Henderson Balanced Fund Q4 2024 Commentary The Fund returned 0.07% and the S&P 500Â® Index returned 2.41%. The Bloomberg U.S. Aggregate Bond Index returned -3.06%. The Balanced Index returned 0.21%.
337,2025-02-13,"Top Semiconductor Companies To Watch In 2025 The semiconductor industry remains a critical pillar of technological innovation, powering everything from AI to high-performance computing. Click to read."
338,2025-02-13,Janus Henderson Global Technology And Innovation Fund Q4 2024 Commentary The Janus Henderson Global Technology And Innovation Fund returned 3.20% and the S&P 500Â® Index returned 2.41%. Click here to read the full commentary. 
339,2025-02-14,Applied Materials Earnings: Why Its Dropping And Why Im Buying Applied Materials shows strong long-term potential despite Q1 2025 earnings dip. Click here to explore AMAT stocks margin improvements and growth insights.
340,2025-02-14,Nvidia Stock Rises. Its Next Big Product Will Require Patience. Nvidia Stock Rises. Its Next Big Product Will Require Patience.
341,2025-02-15,"SMH: Buy For The Long Haul VanEck Semiconductor ETF (SMH) is a top long-term investment in the booming AI-driven semiconductor industry, with 785% growth over a decade. See more here."
342,2025-02-15,"Undercovered Dozen: Celanese, NovaGold Resources, Granite Ridge, Plains GP + Discover 12 undercovered stocks with unique growth potential and strategic insights."
343,2025-02-16,"Broadcom, TSMC Weigh Possible Intel Deals That Would Split Storied Chip Maker Broadcom, TSMC Weigh Possible Intel Deals That Would Split Storied Chip Maker"
344,2025-02-16,If I Could Only Pick 4 Investments To Buy And Hold Forever Buying and holding outstanding investments for very long periods is the ideal way to compound wealth. Check out my 4 favorite buy-and-hold forever investments.
345,2025-02-16,"Stock Market At Pivotal Level; AI Giants Amazon, Broadcom Near Buy Points Stock Market At Pivotal Level; AI Giants Amazon, Broadcom Near Buy Points"
346,2025-02-17,"Parnassus Growth Equity Fund Q4 And 2024 Annual Investment Commentary The Parnassus Growth Equity Fund returned 4.85% (net) for Q4 2024, underperforming the Russell 1000 Growth Indexâs 7.07%. Click here to read the full commentary."
347,2025-02-17,"Intel Break Up Considered By Broadcom, TSMC. How That Would Play Out. Intel Break Up Considered By Broadcom, TSMC. How That Would Play Out."
348,2025-02-17,"Dow Jones Futures: Stock Market Eye Record Highs; AI Giants Amazon, Broadcom Near Buy Points Dow Jones Futures: Stock Market Eye Record Highs; AI Giants Amazon, Broadcom Near Buy Points"
349,2025-02-17,"Analog Devices: A Signal For Strength - Q1 Earnings Preview Analog Devices excels in data conversion, signal processing, and power management technologies. Click here to read an analysis on ADI stock now."
350,2025-02-17,"Mar Vista U.S. Quality Select Q4 2024 Commentary Mar Vistaâs U.S. Quality Select strategy returned +0.39% net-of-fees in the fourth quarter of 2024. The Russell 1000Â® Index and the S&P 500Â® Index returned +2.74% and +2.41%, respectively."
351,2025-02-18,Janus Henderson Growth And Income Managed Account Q4 2024 Commentary The Portfolio returned 0.65% (gross) and the S&P 500Â® Index returned 2.41%. Read more here.
352,2025-02-18,Intel’s stock is rising again. Will Broadcom swoop in with a deal? Intel’s stock is rising again. Will Broadcom swoop in with a deal?
353,2025-02-18,Broadcom’s Deal Magic Would Get Its Biggest Test With Intel Broadcom’s Deal Magic Would Get Its Biggest Test With Intel
354,2025-02-18,"Intels Takeover Tantrum Is Gathering Speed Taiwan Semiconductor is exploring a JV with Intelâs Foundry business, but regulatory approvals are still pending. See why INTC stock is a Hold."
355,2025-02-18,Intel Shares Gain After Report on Potential Break Up Intel Shares Gain After Report on Potential Break Up
356,2025-02-18,Wall Street Lunch: GameStop Raises Eyebrows With International Store Sales GameStop (GME) announced that it intends to pursue a sale of its operations in France and Canada.
357,2025-02-18,American Century Focused Dynamic Growth Fund Q4 2024 Commentary The reelection of former President Donald Trump initially pleased investors who had worried about another protracted legal battle regarding the electionâs results.
358,2025-02-19,Intel’s Future Is Still Murky. Don’t Chase the Stock. Intel’s Future Is Still Murky. Don’t Chase the Stock.
359,2025-02-19,"Intel: Dont Risk Your Money On These Uncertain Moves Intels turnaround relies heavily on execution, technological advancements, and government support. Read why I rate INTC stock as hold."
360,2025-02-19,Intel Breakup Mulled As Vultures Circle Struggling Chipmaker Intel Breakup Mulled As Vultures Circle Struggling Chipmaker
361,2025-02-19,"IWLG: A Good Growth ETF, But Not The Best Discover key insights on IWLG, an actively managed ETF with tech focus. Explore its performance vs. SCHG and Russell 1000 Growth."
362,2025-02-19,"My Dividend Stock Portfolio: New January Dividend Record - 100 Holdings With 14 Buys January hits new highs with $814 in dividend income, up 21% Y/Y. See how BDC investments drive growth toward $11,000 annual dividends."
363,2025-02-19,"Mairs & Power Balanced Fund Q4 2024 Commentary The Fund lagged the benchmark composite index, which was up 15.01%, while the Fund underperformed the Morningstar Moderate Allocation peer group, which rose 11.29%."
364,2025-02-19,Mairs & Power Growth Fund Q4 2024 Commentary The Mairs & Power Growth Fund had another positive year and finished 2024 up 19.62%. Read more here.
365,2025-02-19,"Aristotle Atlantics Core Equity Q4 2024 Commentary For Q4 2024, Aristotle Atlanticâs Core Equity Composite posted a total return of 4.11% gross of fees (4.00% net of fees). Click here to read the full commentary. "
366,2025-02-19,"Dow Jones Futures Fall After S&P 500 Hits High Despite Meta, Amazon Slide; This Leader Breaks Out Dow Jones Futures Fall After S&P 500 Hits High Despite Meta, Amazon Slide; This Leader Breaks Out"
367,2025-02-20,Lattice Semiconductor Stock Sees RS Rating Jump To 84 Lattice Semiconductor Stock Sees RS Rating Jump To 84
368,2025-02-20,Broadcom: Intels Assets May Add Tremendous Value Broadcomâs solid performance and AI-driven growth stand out. Learn why AVGO stockâs expanding margins and potential acquisition make it a buy for investors.
369,2025-02-20,"Intel Stock: Elemental Analysis Of An Acquisition (Rating Upgrade) As long as the rumors of deal making remain in the news, Intels stock should remain at materially higher levels than the 50 day moving average. See more here."
370,2025-02-20,"HACK: A Solid Cybersecurity Play, But Not My Top Choice Invest in cybersecuritys growth with HACK ETF, but consider mixed performance and risks. Learn how it compares to CIBR and current market trends."
371,2025-02-21,JHML: Multi-Factor Vs. Single Factors John Hancock Multifactor Large Cap ETF uses a multifactor strategy but lags in returns. Learn why JHML underperforms compared to single factor ETFs.
372,2025-02-21,Past Week Dominated By Corporate Earnings Stories Past week dominated by good news and a few corporate earnings.
373,2025-02-22,Allspring Diversified Capital Builder Fund  The Allspring Diversified Capital Builder Fund  outperformed the Diversified Capital Builder Blended Index during Q4 2024. Click here to read the full commentary. 
374,2025-02-22,"How To Invest $100,000 In A Near-Perfect Portfolio Discover why its still a good time to invest despite overvalued markets. Click for my selection process to find the absolute best choices for your portfolio."
375,2025-02-22,Allspring Core Bond Fund Q4 2024 Commentary The Bloomberg U.S. Aggregate Bond Index fell 3.06% for the fourth quarter of 2024. Click here to read the full commentary. 
376,2025-02-23,"AVGX: This Leveraged Play On Broadcom Just Isnt Hacking It, Heres Why Defiance Daily Target 2X Long AVGO ETF boosts AVGOs daily returns but faces volatility drag. See why AVGX underperforms during unstable market conditions."
377,2025-02-24,Broadcom Stocks Competitive Edge Is CEO Hock Tans Leadership (Rating Upgrade) Broadcoms subscription model and streamlining boost margins but add risk. Click here to find out why AVGO stock is a Hold.
378,2025-02-24,Columbia Dividend Income Fund Q4 2024 Commentary Institutional Class shares of Columbia Dividend Income Fund returned -1.34% for Q4 2024. Click here to read the full commentary. 
379,2025-02-26,"Voya Balanced Large Cap Core-Value SMA (Merrill Lynch) Q4 2024 Commentary For the quarter ended December 31, 2024, the SMA outperformed the Index on a gross-of-fees basis due to favorable stock selection. Read more here."
380,2025-02-26,"AMDs AI Gamble: Bullish Management Vs. Market Skepticism Advanced Micro Devices, Inc.s stock surged to $220 by March 2024 due to AI GPU optimism but halved as gaining market share from NVIDIA proved difficult. Learn more on AMD stock here."
381,2025-02-27,Nvidia’s Earnings Were Strong. These 6 Stocks Will Benefit. Nvidia’s Earnings Were Strong. These 6 Stocks Will Benefit.
382,2025-02-28,"Nvidias Solid Earnings, Jobs Expectations And Fighting Inflation Nvidias solid earnings, jobs expectations and fighting inflation."
383,2025-02-28,"Tracking Chase Colemans Tiger Global Portfolio - Q4 2024 Update Tiger Globals 13F reveals a $26.46B portfolio with top holdings in Meta, Microsoft & Alphabet. Read here for an update on additions and decreases."
384,2025-02-28,Why Nvidia earnings report is good news for its Big Tech rivals Why Nvidia earnings report is good news for its Big Tech rivals
385,2025-02-28,Chip and Software Stocks Are Below Key Levels. How Low They Could Go. Chip and Software Stocks Are Below Key Levels. How Low They Could Go.
386,2025-03-01,"Broadcom, CrowdStrike To Report Results As Investors Look To Jobs Report Broadcom, CrowdStrike to report results as investors eye jobs report. EU inflation data for last month will be out on Monday. Stay updated on the week ahead with this release."
387,2025-03-03,Intel’s stock is rising — and this time it’s not because of sale rumors Intel’s stock is rising — and this time it’s not because of sale rumors
388,2025-03-03,"These Stocks Are Moving the Most Today: Nvidia, Intel, Tesla, MicroStrategy, Super Micro, Palantir, AppLovin, Sunnova, and More These Stocks Are Moving the Most Today: Nvidia, Intel, Tesla, MicroStrategy, Super Micro, Palantir, AppLovin, Sunnova, and More"
389,2025-03-03,"Intel Stock Rises. Nvidia, Broadcom Are Potential Customers—Report. Intel Stock Rises. Nvidia, Broadcom Are Potential Customers—Report."
390,2025-03-03,Alger Capital Appreciation Fund Q4 2024 Commentary Class A shares of the Alger Capital Appreciation Fund outperformed the Russell 1000 Growth Index during the fourth quarter of 2024. Read more here.
391,2025-03-04,"U.S. Chipmaking Industry In Focus With TSMC, Intel News U.S. Chipmaking Industry In Focus With TSMC, Intel News"
392,2025-03-04,TSMC Faces Pressure to Keep Some Chip Tech in Taiwan. What That Means for Intel. TSMC Faces Pressure to Keep Some Chip Tech in Taiwan. What That Means for Intel.
393,2025-03-04,"Broadcom: A Nice Opportunity Prior To Earnings Discover why Broadcom Inc.s fundamentals, fair valuation, and low RSI signal exciting opportunities ahead of its Q1 earnings. Click for more on AVGO."
394,2025-03-04,"Broadcom: I Was Wrong, But Im Sticking To The Sidelines Ahead Of Earnings (Rating Upgrade) With its stock plunging -20% YTD, Broadcoms investors must be a nervous bunch heading into its Q1 2025 report. See why I upgrade AVGO from sell to hold."
395,2025-03-05,Broadcom Q1 Preview: Real Trade War Threats Broadcoms heavy reliance on Apple and China poses substantial risks to future revenues. Read more to see why AVGO stock is a Strong Sell.
396,2025-03-05,AI Stocks Continue Retreat. Credo Stock Latest To Fall. AI Stocks Continue Retreat. Credo Stock Latest To Fall.
397,2025-03-06,"Nvidia’s stock selloff deepens after Marvell earnings: ‘Boy, sentiment is rough.’ Nvidia’s stock selloff deepens after Marvell earnings: ‘Boy, sentiment is rough.’"
398,2025-03-07,"Broadcom: More Upside Ahead Broadcom shares soared 13% on strong Q1 results, driven by AI hardware demand. Revenue grew 25% YoY and free cash flow grew 28%. See more on AVGO stock here."
399,2025-03-07,"Broadcom forecasts second-quarter revenue above estimates Broadcom forecast second-quarter revenue above Wall Street expectations on Thursday, bolstered by strong demand for its custom artificial intelligence chips from companies looking to process big..."
400,2025-03-07,CET: This Outperforming Fund Can Complement A Portfolio Well Central Securities Corporation offers strong growth despite a lower yield. See why CET CEFs low expense ratio and market performance make it a top choice.
