901,"AI Spending Could Soar 500%: 3 Brilliant AI Stocks to Buy (Hint: Not Nvidia) Broadcom, AMD, and TSMC are all poised to be AI winners."
902,"If You Had Invested in These 3 Growth Stocks 15 Years Ago, You Would’ve Become a Millionaire If you had invested just $4,000 into any of the below three stocks back in 2010, you would have $1 million today."
903,Use These Stock Chart Signals to Find Winning Options Trades Gavin McMaster explains how to screen for options trades using bearish and bullish engulfing candlestick patterns layered on top of options flow.
904,"ALAB Benefits From Expanding Partner Base: A Sign for More Upside? Astera Labs is riding AI demand, key partnerships, and new PCIe 6 innovations, but faces stiff competition in the connectivity race."
905,"Nvidia: The Oracle Earnings Are Not Bullish Nvidia Corporation stock faces risks from unsustainable GPU demand, high valuation, and reliance on AI customers. Click here to read why NVDA is a Strong Sell."
906,Broadcom and Oracle Just Catapulted the Ten Titans to 39% of the S&P 500. Heres What It Means for Your Investment Portfolio Broadcom and Oracle are crushing the S&P 500 and the Magnificent Seven in 2025.
907,"Bloomberg Dividend Watchlists 4 Ideal Safer September Sizzlers 50 Companies to Watch for 2025 spotlight AI, EVs & dividends. See why 13 safer stocks may offer 17.63% gains & ideal yields for smart investing."
908,"Broadcom Stock: Hold Rating Maintained On Valuation Concerns Broadcoms AI revenue surge positions it as a top NVIDIA rival, but learn why now may not be the best time to invest. Learn more about AVGO stock here."
909,"MRVLs Carrier Infrastructure Segment Recovering: What Lies Ahead? Marvell Technologys carrier infrastructure revenues surge 71.4% y/y as product refreshes, inventory normalization and strong adoption fuel recovery momentum."
910,Palantir Stock Has Done This For Five Straight Months. Trumps UK Visit Could Extend That. Palantir Stock Has Done This For Five Straight Months. Trumps UK Visit Could Extend That.
911,"Broadcom, Lloyds Banking Group Expand Partnership to Accelerate Digital Transformation with VMware, Mainframe Solutions Broadcom Inc. (NASDAQ:AVGO) is one of the best innovative stocks to buy now. On September 17, Lloyds Banking Group (NYSE:LYG) and Broadcom announced an expansion of their long-standing partnership with a new multi-year agreement during the VMware Explore on Tour event in London. The extension is set to accelerate Lloyds Banking Group’s ambitious digital transformation […]"
912,TSMC: Dont Simply Ignore The Warning Signs Amid AI Euphoria Taiwan Semiconductors stock is surging on AI demand and upcoming tech advances. Click here to see what investors should consider before buying TSM stock.
913,Broadcom: High-Stakes AI And The VMware Gamble Broadcoms AI semiconductor and VMware software segments drive impressive growth. Click here to see why AVGO stock is a Hold.
914,Nvidias $100 Billion OpenAI Pact Buys Time in the Custom Chip Race The AI infrastructure deal locks in near-term dominance while both companies hedge their bets.
915,"The Best Stocks to Invest $10,000 in Now The market is ripe with several great long-term investment opportunities available."
916,"Top Research Reports for Broadcom, Oracle & Cisco Systems Todays Research Daily features new research reports on 16 major stocks, including Broadcom Inc. (AVGO), Oracle Corporation (ORCL), and Cisco Systems, Inc. (CSCO). as well as a micro-cap stock United-Guardian, Inc. (UG)."
917,The Stock Market Is Suffering an AI Hangover. What to Do Now. The pullback is a sign that investors might want to consider broadening their portfolios beyond the frothiest tech plays. Consider industrials and healthcare stocks.
918,Prediction: These Supercharged Growth Stocks Will Soar by 2028 These three stocks have huge growth opportunities ahead.
919,What Is One of the Best Chip Stocks to Own for the Next 5 Years? Nvidia is not the only stock to play the AI boom.
920,Potentially 12%-15% Consistent Income: Monthly Options Series (Oct. 2025) Writing or selling options is not highly complicated. Read why selling cash-covered puts and covered calls is a relatively safe choice for earning a high income.
921,"Model Portfolio For Capital Appreciation, September 2025 Discover 20 top stocks & 2 ETFs for capital appreciation."
922,"Dont Fear AI Bubble, There Will Be Winners - Tech Contrarians Tech ContrariansÂ on pretty fishy levels and not giving China enough credit."
923,"3 Reasons to Buy (and 2 Reasons to Sell) the Only Ten Titans Stock Thats Underperforming the S&P 500 Over the Last 5 Years Amazon Web Services faces its biggest hurdles in years as competition mounts from Microsoft, Alphabet, and Oracle."
924,Broadcom and Nvidia Executives Cash Out Shares After Big Rally Chipmakers insiders take profits as semiconductor stocks soar in 2025
925,Elevated P/E Ratios: Get Used To It (And Embrace It) Elevated S&P 500 P/E ratios signal a shift to cash-rich tech stocks. Click here for more information on Market Outlook.
926,"Micas Networks Achieves 4 Million Link Flap-Free Hours in Testing of Industry’s First 51.2T Co-Packaged Optics Switch Micas CPO Switch Micas Networks’ 51.2T Co-Packaged Optics (CPO) switch system has achieved a major milestone. During testing, the CPO switch achieved 4 million cumulative 400G equivalent port device hours of link flap-free operation, which underscores the reliability of CPO and validates its role as the foundation for next-generation network infrastructure. SAN JOSE, Calif., Oct. 01, 2025 (GLOBE NEWSWIRE) -- Micas Networks, a pioneer in open networking solutions, today announced a major mileston"
927,Meet the Monster Chip Stock Crushing Nvidia on the Market (Hint: Its Not Broadcom) The improving demand for chipmaking equipment has given this semiconductor companys business a nice shot in the arm.
928,All The Focus Is On A.I. The significance of the A.I. definition is the fact these tasks require a large amount of computer memory and electrical power to process the data quickly and efficiently. Read more here.
929,"Why Nvidia, Broadcom and other high-flying stocks are especially risky now Momentum stocks in highflying sectors are vulnerable to a downturn, even if the market doesn’t crash."
930,"Chip stocks rise as OpenAI’s Stargate project fuels AI memory demand hype Investing.com -- Chip stocks gained ground on Thursday following reports that South Korea’s largest companies signed initial agreements to supply chips to OpenAI’s Stargate project, boosting optimism for artificial intelligence memory demand."
931,"AI stock rally: OpenAI valuation lifts Nvidia, AMD, Intel & more OpenAIs (OPAI.PVT) valuation has soared to $500 billion, according to The Wall Street Journal and other sources, replacing Elon Musks SpaceX (SPAX.PVT) as the most valuable startup. This bullish artificial intelligence (AI) news is sending stocks like Samsung (005930.KS), AMD (AMD), Super Micro Computer (SMCI), and Nvidia (NVDA) higher on Thursday. Yahoo Finance Senior Reporter Brooke DiPalma outlines the details. To watch more expert insights and analysis on the latest market action, check out more Morning Brief."
932,"Microsoft and 7 Other Stocks That Could Benefit From OpenAI’s $500B Valuation The ChatGPT-developer is now valued at about the same as oil giant  Exxon Mobil  and a raft of stocks are set to benefit from its enormous spending on artificial-intelligence infrastructure.  OpenAI, which is privately held, was valued at $500 billion in a deal that saw existing investors  SoftBank Group  and United Arab Emirates-based MGX pay around $6.6 billion to buy shares owned by some of the company’s employees, The Wall Street Journal reported Thursday, citing people familiar with the matter.  OpenAI didn’t immediately respond to a request for comment Thursday morning."
933,"SMH: AI Bubble? Chip Stocks Are Rewriting History The VanEck Semiconductor ETF remains a Buy as semiconductor demand surges, with inventory levels dropping and sales outpacing supply. Learn more about SMH ETF here."
934,"Stocks to Watch Thursday: Fair Isaac, Tesla, Fermi, Stellantis ? Fair Isaac (FICO): The credit-analytics company said it would license its scores used for assessing mortgage borrowers creditworthiness, allowing resellers to bypass credit bureaus. ↘️ Equifax (EFX), TransUnion (TRU): Shares of the two U."
935,"Why Is Broadcom Stock Surging Thursday? Broadcom (NASDAQ:AVGO) capitalized on Wall Street’s artificial intelligence boom Thursday, fueled by billions in chip investments from Microsoft (NASDAQ:MSFT), Meta Platforms (NASDAQ:META), and other technology giants. Broadcom has emerged as one of the biggest beneficiaries of the generative AI boom, carving out a strategic niche in the rapidly evolving chip market. While competitors like Nvidia (NASDAQ:NVDA) offer off-the-shelf, high-performance GPUs, Broadcom focuses on designing custom AI ch"
936,"Entegris, Applied Materials, Photronics, and Impinj Stocks Trade Up, What You Need To Know A number of stocks jumped in the afternoon session after OpenAI announced partnerships with South Korean firms SK Hynix and Samsung for its ambitious Stargate AI infrastructure project, signaling massive future demand for advanced chips."
937,"Move Over, Mag 7. Buy This 1 Missing AI Winner Instead. As the AI trade remains defined by other stocks, Broadcom is silently up by almost 45% so far this year."
938,"Technology Helps Push S&P 500, Nasdaq Composite to Fresh Records as Partial Shutdown Enters 2nd Day US equity indexes traded mixed after the S&P 500 and Nasdaq Composite scaled new peaks in midday tra"
939,"Stocks to Watch Friday: Applied Materials, Chevron, Broadcom, Nvidia ↘️ Applied Materials (AMAT): The semiconductor-equipment maker expects a $710 million hit to revenue from new U.S. rules it says will curb its ability to export to China-based customers. Shares fell roughly 4% in premarket trading."
940,"Magnificence beyond the Magnificent 7? Here’s the next generation of AI winners powering the stock market. Wall Street’s tech darlings are losing their shine in 2025, as a new class of large-cap companies — particularly Broadcom, Oracle and Palantir — is rewriting the S 500 leaderboard and powering the next phase of the AI boom."
941,"3 Market-Beating Stocks to Own for Decades Companies that consistently increase their sales, margins, or returns on capital are usually rewarded with the best returns, and those that can do all three for years on end are almost always the legendary stocks that return 100 times your money."
942,"Etsy, Snap, The RealReal, Instacart, and Teladoc Shares Skyrocket, What You Need To Know A number of stocks jumped in the afternoon session after the technology sector climbed as an OpenAI share sale catapulted the firm to the worlds most valuable startup, bolstering optimism for artificial intelligence."
943,"Dow Futures, Chip Stocks Rise as Shutdown Enters Day Three STOCKS  Stocks look poised for more gains on Friday, even as the government shutdown enters a third day. The September jobs report, originally slated for this morning, will likely be delayed due to the shutdown."
944,"Astera Labs Faces a Major Opportunity in Scaling AI Through its Connectivity Chips, BofA Says Astera Labs (ALAB) addresses a multi-billion-dollar market opportunity in scaling AI through its ret"
945,"Astera Labs Battles Nvidia And Broadcom As AI Chip Market Heats Up Astera Labs, Inc. (NASDAQ:ALAB), an AI connectivity specialist, faces a critical market juncture as competition intensifies and lofty valuations test investor patience. While the company is positioned to tap multi-billion-dollar opportunities with next-generation PCIe and UALink chips, potentially driving billions in content revenue from major cloud clients, its shares have pulled back amid concerns that much of this growth is already priced in. Bank of America analyst Vivek Arya initiated cover"
946,"Jim Cramer Was Right About Broadcom (AVGO) We recently published 10 Stocks Wall Street is Watching Heading into October. Broadcom Inc. (NASDAQ:AVGO) is one of the stocks Wall Street is watching. Near the end of May, Jim Cramer said in a program on CNBC that the market was not paying attention to the potential of Broadcom. He said at the time that his […]"
947,"KeyBanc Capital Lifts Broadcom Inc. (AVGO) Price Target amid Growing AI Opportunity Broadcom Inc. (NASDAQ:AVGO) is one of the best stocks to buy right now, according to Nancy Pelosi. On September 30, KeyBanc Capital Markets reiterated an ‘Overweight’ rating on the stock and raised its price target to $420 from $400. The price target hike comes on the research firm being impressed by the upward revisions in […]"
948,"Meet the Unstoppable Semiconductor Stock Crushing Nvidia, AMD, and Broadcom Right Now Data center networking equipment and components are just as important as chips when it comes to powering the artificial intelligence revolution."
949,"Silvaco’s new CFO to prioritize predictability Chris Zegarelli is looking to improve sentiment and make the business “more predictable” as he settles into Silvaco’s CFO seat, he told CFO Dive."
950,Marvell: Significant AI Win Coming Soon (Double Upgrade) Discover why Marvell Technologiesâ exclusive AI chip partnership with Microsoft boosts its 2026 outlook.
951,"How Much Longer Can the AI Bubble Last? Inside Wall Street’s Great Debate. The same appears to be true for investors witnessing tech stocks’ increasingly stretched valuations, thanks to the artificial-intelligence revolution.  The market knows the AI bubble has to burst eventually, but the question is how much longer it can inflate before the chewing gum splatters on traders’ faces.  Nvidia  the world’s most valuable company, now has a market value of $4.5 trillion."
952,"A Fresh Look at Broadcom (AVGO) Valuation as Investor Confidence Builds Broadcom (AVGO) stock has been drawing investor attention lately, thanks in part to steady gains over the past month and eye-catching returns this year. Some are now re-examining the company’s track record and growth outlook. See our latest analysis for Broadcom. Broadcoms latest share price climb reflects steady investor confidence, with momentum building throughout the year as the company continues delivering strong fundamentals. The stock’s one-year total shareholder return of nearly 1%..."
953,3 Top Growth Stocks to Buy in October These three companies offer distinct paths to growth as Q3 earnings reveal which businesses can sustain momentum in the shifting global economy.
954,"ChatGPT Parent OpenAI, AMD Partner In Landmark AI Deal Advanced Micro Devices (NASDAQ:AMD) shares surged premarket Monday following a landmark agreement with OpenAI to deploy up to 6 gigawatts of AMD Instinct GPU power for the tech giants next-generation AI infrastructure. The initial phase will see a 1-gigawatt rollout of AMD Instinct MI450 GPUs in the second half of 2026, with plans for subsequent expansions across multiple generations of AMDs data center chips. Under the agreement, OpenAI will designate AMD as a core compute partner, leveraging"
955,These 2 AI Stocks Are Money-Printing Machines These companies are cashing in on AI.
956,"MRVL Surges 31% in a Month: Should You Hold or Fold the Stock? Marvell Technologys 31% surge rides on booming AI and data center demand, but lofty valuation and fierce rivals keep investors cautious."
957,"TSM Soars 18% in a Month: Should You Buy, Sell or Hold the Stock? Taiwan Semiconductors 18% surge underscores its AI-fueled momentum and dominant chipmaking edge. However, near-term headwinds suggest holding may be the wiser move."
958,"Oracle vs JPMorgan Chase: Which Will Be the Next $1 Trillion Stock? Both Oracle and JPMorgan Chase have large market caps, but operate in very different sectors."
959,"Chip rally lifts markets, but Citi warns of profit-taking risk US stock futures (ES=F, NQ=F, YM=F) inched higher ahead of Tuesdays opening bell, led by chipmaker stocks. In particular, AMD (AMD) stock is extending gains while Nvidia (NVDA) and Broadcom (AVGO) stocks also rise. Citi analysts warn that the tech-driven rally may pull back, saying profit-taking risks have rapidly risen. Yahoo Finance Senior Reporter Allie Canal examines the latest market moves. To watch more expert insights and analysis on the latest market action, check out more Market Domination."
960,"Broadcoms Big AI Move In Japan Could Slash Data Center Power Use By Half Broadcom (NASDAQ:AVGO) is expanding its footprint in Japans artificial intelligence chip ecosystem through a new partnership with NTT to develop optical semiconductor devices designed to cut data center power use by up to 50%. Broadcom is strengthening its global AI leadership as it teams with Japans NTT to produce advanced optical chips by 2026, aiming to tackle the soaring energy demands of AI data centers while boosting processing speed and efficiency. NTT aims to produce an advanced optica"
961,"By 2030, These AI Leaders Could Outperform Nvidia. Heres Why Broadcom and AMDs stock both have the potential to outperform."
962,"Is Broadcom’s Valuation Justified After OpenAI AI Chip Partnership Announcement? Let’s be honest, if you’re debating your next move with Broadcom stock, you’re not alone. With shares jumping an impressive 93.5% over the past year and a staggering 881.6% over the last five, plenty of investors are asking if the best gains are already behind us or if there’s more in store. In just the past week alone, Broadcom climbed 2.3%, shrugging off minor volatility and reminding us it is still a force to be reckoned with in the tech sector. But what’s really driving these moves? Some..."
963,"Global Glass Substrates for Semiconductors Market Report 2026-2036: Technical and Economic Hurdles Amid Strategic Opportunities Through Quantum-Neuromorphic-Edge Convergence The glass substrate for semiconductors market is revolutionizing the packaging industry due to the growing demands of AI, high-performance computing (HPC), and advanced networking. This market transition is shifting glass from a background material to a core substrate, supporting next-gen chip architectures. Recent speculation about notable industry partnerships—such as SKCs potential collaboration with major AI chip manufacturers, which boosted its stock by 44.4% in 2025—demonstrates increasin"
964,The Third Quarter Was Tranquil. The Fourth Might Not Be. Some strategists worry any seasonal weakness that usually happens in the third quarter may have been simply delayed into the fourth.
965,The Bad News for Broadcom in OpenAI’s AMD Deal The suppliers that OpenAI chooses can also serve as a positive signal for the rest of the industry to follow.
966,"Could Broadcom Benefit from the OpenAI AMD Deal? AVGO Stock Could Be Cheap Here Broadcom could benefit from OpenAIs diversification away from its sole reliance on Nvidia with its new AMD deal. Its possible, especially after the Sept. 4 OpenAI deal with Broadcom. AVGO stock could be an alternative play."
967,"Nvidia, IBD Stock Of The Day, Seen Unscathed By OpenAIs AMD Deal Nvidia is seen largely unaffected by major customer OpenAI securing secondary supply deals with other AI chip vendors."
968,"Broadcom Delivers the Future of AI Infrastructure with End-to-End AI Networking Solutions at 2025 OCP Global Summit Company to Feature Industry’s Leading Open, Scalable and Power Efficient Solutions for Scale-up and Scale-out AI NetworksPALO ALTO, Calif., Oct. 08, 2025 (GLOBE NEWSWIRE) -- Broadcom Inc. (NASDAQ: AVGO) today announced it will showcase major advancements in its scale-up and scale-out AI networking solutions at the 2025 Open Compute Project (OCP) Global Summit. Featuring innovations such as the Tomahawk® 6, Tomahawk Ultra, Jericho4 Ethernet switches, and its third-generation TH6-Davisson Co-packa"
969,"Marvell: The Market Wont Ignore Its Coming AI Boom For Long Marvell Technologyâs stock has AI infrastructure growth, an AWS partnership, and market potential. Learn why MRVL stock offers value in the evolving AI landscape."
970,"Broadcoms Silent Grip On AI Compute Broadcomâs record $10B XPU order boosts AI chip revenue and backlog, but high client concentration poses risks. See more on AVGO stock here."
971,"Nvidia Stock Rises on Report It’s Investing in Elon Musk’s xAI Nvidia  stock was rising early Wednesday.  The leading AI chip maker was on track to snap a three-day losing streak after a report that it could invest in Elon Musk’s xAI.  Nvidia is one of the backers, and could invest as much as $2 billion in the privately held AI start-up, according to Bloomberg, citing people with knowledge of the matter."
972,KQQQ: Is This Tech-Focused Covered Call Fund A Hidden Gem Kurv Technology Titans Select ETF outperforms peers with momentum-driven growth and high 18.8% yields. Read here for an analysis of KQQQ ETF here.
973,"OpenAI & other AI deals driven by 3 performance improvements OpenAI (OPAI.PVT) has signed a total of $1 trillion worth of deals this year. The worlds most valuable private company is partnering with names like AMD (AMD), Nvidia (NVDA), Microsoft (MSFT), Alphabet (GOOG, GOOGL), Oracle (ORCL), CoreWeave (CRWV), Broadcom (AVGO), and Amazon (AMZN). Spear Invest founder and chief investment officer, Ivana Delevska, joins Market Catalysts host Julie Hyman to discuss the sustainability of the artificial intelligence (AI) trades momentum and what OpenAI and other AI companies will be looking for in future partnerships. To watch more expert insights and analysis on the latest market action, check out more Market Catalysts."
974,"Meet the Low-Cost Vanguard ETF That Has 20% of Its Holdings in Nvidia, Broadcom, and AMD This index fund has a rock-bottom fee structure and exposure to the hottest stocks in the market."
975,"Inside Intel’s big bet to save US chipmaking — and itself At Intel’s new 700-acre factory in the Arizona desert, the company has started large-scale production on the most advanced chips it has ever..."
976,"Nvidia–xAI boosts chip stocks, Equifax strikes back against FICO Yahoo Finance anchor Julie Hyman outlines three of Wednesdays top stories on Wall Street as part of Yahoo Finances Market Minute. Chip stocks continue to rise on Bloomberg reports — now confirmed by Nvidia (NVDA) CEO Jensen Huang — that Nvidia is among the investors financing the latest funding round for Tesla (TSLA) CEO Elon Musks artificial intelligence (AI) company, xAI (XAAI.PVT). Equifax (EFX) stock surges after the company cut its credit score data prices, striking back against FICO (FICO). AST Spacemobile (ASTS) stock skyrockets on news of the companys deal with Verizon (VZ). Stay up to date on the latest market action, minute-by-minute, with Yahoo Finances Market Minute."
977,"FQAL: 2 Competitors Are More Compelling FQAL offers solid quality exposure with 128 stocks and stable dividends, but lags peers like JQUA and SPHQ in key metrics. Find out why FQAL ETF is a hold."
978,Josh Brown Explains Why NVIDIA (NVDA) ‘Still The Most Obvious’ Stock to Play AI Trade We recently published Top 10 Stock Recommendations You Can’t Miss Amid Growing AI Bubble Fears. NVIDIA Corp (NASDAQ:NVDA) is one of the top recommended stocks. Josh Brown from CNBC recently said in a program that NVIDIA Corp (NASDAQ:NVDA) remains the best way to play the AI trade despite the stock’s bull run. He said most […]
979,These Hidden AI Infrastructure Plays Could Surprise Long-Term Investors Investors should consider picking stakes in hidden AI infrastructure players for long-term gains.
980,"Dow Jones Futures: Nvidias Huang Spurs AI-Led Market To Highs; Tesla Has New Buy Point Nvidia CEO Jensen Huang lifted the S&P 500 to highs, with several AI stocks in buy areas. Tesla has a new entry. Taiwan Semi sales loom."
981,"Where Will Intel Stock Be in 1 Year? Chipzilla stock has surged remarkably in the past three months, but are the good times here to stay?"
982,These AI stocks could be the next winners Transcript: Caroline Woods: So lets talk. You say not all companies are created equal in the AI space. So lets talk about which ones are poised to continue to be long term gainers and then which ones are overhyped at this point. So start with the names that youre still bullish on? Daniel Newman: ...
983,"KeyBanc Reaffirms Buy on Broadcom (AVGO) Ahead of Earnings, Citing Strong AI Demand Broadcom Inc. (NASDAQ:AVGO) is one of the Trending AI Stocks on Wall Street’s Radar. On October 6, KeyBanc reiterated an Overweight rating and $420.00 price target on the stock. The rating affirmation comes ahead of the company’s fiscal fourth-quarter 2025 earnings report. KeyBanc anticipates Broadcom to deliver higher results for the October quarter and provide stronger […]"
984,Chip Stocks Take Hit From Trump Threat to Ramp Up China Tariffs Semiconductor stocks tumbled Friday morning after President Trump threatened to increase tariffs on China. The Philadelphia Semiconductor Index fell 4% after Trump posted the tariff threat in response to Chinas recent decision to restrict rare-earth materials.
985,"Can the AI rally push on higher? Investing.com -- UBS told investors in a note Friday that the artificial intelligence rally “remains underpinned by solid fundamentals, accelerating adoption, and a still-favorable macro environment,” even as concerns grow over a potential bubble in AI-related stocks."
986,"Despite A Cautious CEO, This Major Bank Is Trending Higher Ahead Of Earnings Report JPMorgan stock is outperforming the S&P 500 this year, as Wall Street gets ready for an avalanche of earnings reports in the financial sector."
