51,"AMD: Its Like 2017 All Over Again AMDs growth in AI data center GPUs, driven by strong product launches and a robust roadmap, positions it to challenge Nvidias dominance."
52,"Top Analyst Reports for Broadcom, Merck & Qualcomm Todays Research Daily features new research reports on 16 major stocks, including Broadcom Inc. (AVGO), Merck & Co. (MRK) and Qualcomm (QCOM), as well as a micro-cap stock, Natural Health Trends Corp. (NHTC)."
53,"SIXG: The Next Big Tech Wave Invest in the Defiance Connective Technologies ETF (SIXG) for exposure to leading 5G, IoT, and cloud companies in the tech revolution. Read more here."
54,"VMware’s first contentious year under Broadcom drives customers to weigh other options The chipmaker consolidated the ubiquitous virtualization product suite into one big private cloud platform, leaving customers with a difficult business decision."
55,Broadcom Inc. stock underperforms Tuesday when compared to competitors despite daily gains Broadcom Inc. stock underperforms Tuesday when compared to competitors despite daily gains
56,Meet This Artificial Intelligence (AI) Giant Billionaires Are Buying Hand Over Fist That One Wall Street Analyst Thinks Could Soar Nearly 50% Next Year Retail investors today have access to a large amount of information about public companies.  Two of the more useful types of information are analysts stock price targets and the reports that show what assets hedge funds have been buying and selling.  One stock that has recently caught my eye -- as well as the eyes of analysts and hedge funds -- is Broadcom (NASDAQ: AVGO).
57,These 2 Computer and Technology Stocks Could Beat Earnings: Why They Should Be on Your Radar Finding stocks expected to beat quarterly earnings estimates becomes an easier task with our Zacks Earnings ESP.
58,"What To Expect in the Markets This Week Coming up: November CPI and wholesale inflation data, small business optimism, earnings from GameStop, Broadcom, Adobe, Costco"
59,"EQIN: A Good Value ETF, But Value Still Is Out Of Style EQIN is diversified, well-balanced across sectors and doesnât sacrifice growth for value. Learn more about EQIN ETF and my recommendation."
60,"Tracking Ole Andreas Halvorsens Viking Global Portfolio - Q3 2024 Update Viking Globals 13F portfolio value increases to $27.44B with top holdings in U.S. Bancorp, Adobe, Apple, Philip Morris, and Visa. Check out the holdings in Q3."
61,"Dow Jones Falls As AI Giant Broadcom Soars 21% On Earnings; Nvidia, Tesla Rally Dow Jones Falls As AI Giant Broadcom Soars 21% On Earnings; Nvidia, Tesla Rally"
62,"These Stocks Are Moving the Most Today: Broadcom, Tesla, Costco, RH, Upstart, ServiceTitan, and More Broadcom stock surges and its market cap surpasses $1 trillion for the first time after CEO Hock Tan says the company’s artificial-intelligence opportunity over the next three years is ‘massive,’ while Tesla shares rise and the stock heads for a record closing high."
63,"Analysts overhaul Broadcom stock price targets after Q4 earnings Broadcom shares topped the $1 trillion level, in terms of market value, in early Friday trading."
64,"Apples 2025 Chip Transition Targets New Wireless Edge, Broadcom To Retain Key Role Apple Inc’s (NASDAQ:AAPL) upcoming switch to in-house chips for Bluetooth and Wi-Fi connections from 2025 will likely impact its partner Broadcom Inc (NASDAQ:AVGO). The Wi-Fi and Bluetooth chips will enable Apple devices to go online via wireless networks, pair with headphones, and more. Taiwan Semiconductor Manufacturing Co (NYSE:TSM) manufactured Proxima, which will power Apple’s first products in 2025, Bloomberg cites familiar sources. Also Read: STMicroelectronics and Qualcomm Launch New IoT"
65,"8 Funds For Potential $5,000 Monthly Income And Financial Freedom Learn how to build a diversified fund-based portfolio for passive income and potential market-matching growth, generating $5,000 monthly income."
66,"Broadcom AI demand outlook gives investors reason to dream: Analyst In its fiscal fourth quarter performance, semiconductor manufacturer Broadcom (AVGO) forecasts booming AI demand in the year to come and beyond. Bernstein Managing Director and Senior Analyst Stacy Rasgon sits down with The Morning Briefs Seana Smith and Brad Smith to talk more about Broadcoms earnings print, the artificial intelligence landscape at large, and what this could even mean for competitor Nvidia (NVDA). Over the longer term, they really gave people a reason to dream, right? So they were talking about... over the next, say, 3 or 4 years... they have three primary hyperscaler customers today that they sell AI chips to. And they pointed like sort of visions of a very large opportunity. They said sort of $60 to $90 billion potential opportunity over that time frame just with those three guys, Ragson says to Yahoo Finance. To watch more expert insights and analysis on the latest market action, check out more Morning Brief here. This post was written by Luke Carberry Mogan."
67,"Dow Jones Futures Rise, Bitcoin Hits High; Palantir Reverses Lower Dow Jones Futures Rise, Bitcoin Hits High; Palantir Reverses Lower"
68,"VMware And Custom AI Chips: Broadcoms Recipe For Explosive Growth Broadcoms Q4 FY2024 earnings report shows strong revenue growth, driven by custom AI chip demand, pushing its market cap past $1 trillion. Read more here."
69,"Nvidia’s stock may have lost its luster, but the rest of tech can still shine Nvidia’s stock may have lost its luster, but the rest of tech can still shine"
70,"Analyst Remains Upbeat on Nvidia (NVDA) Stock Despite Recent Pullback Although Nvidia (NVDA) stock had fallen more than 10% from its all-time high as of yesterday, entering correction territory, KeyBanc analyst John Vinh remains bullish on the chip maker’s outlook. Vinh, who has an Overweight rating and a $180 price target on the shares, noted that Nvidia has continued to surpass the average expectations of […]"
71,"BATMMAAN! The stock market evolves with trends and buzzwords. First there were the GAFAMs, then investors referred to the tech giants as the Magnificent 7. But a wind of renewal is blowing through Wall Street:..."
72,"What The AI Accelerator Industry Will Become, And Who Wins, If Anyone AI accelerators saw significant advancements begin in 2012, paving the way for the hyper-growth phase starting in 2022. Click for more on AI accelerators."
73,"Why Broadcom’s stock is this analyst’s top chip pick for 2025, with 37% upside Why Broadcom’s stock is this analyst’s top chip pick for 2025, with 37% upside"
74,"Broadcom : Annual Report for Fiscal Year Ending November 3, 2024 (Form 10-K) avgo-20241103 Table of Contents UNITED STATES SECURITIES AND EXCHANGE..."
75,"2 Artificial Intelligence (AI) Stocks That Have Roughly Doubled or More in 2024 and Could Soar Even Higher in 2025, According to Wall Street Broadcoms (NASDAQ: AVGO) share price has nearly doubled year to date.  Actually, the stock had more than doubled for the year until a few days ago, when the Feds hesitancy to forecast as many rate cuts for 2025 as investors are hoping for led to a stock market sell-off.  The interesting thing about Broadcoms impressive performance is that its recent quarterly results havent been spectacular if we exclude the impact of its acquisition of VMware."
76,"Better Artificial Intelligence (AI) Stock: Broadcom vs. Marvell Technology Semiconductor stocks Broadcom (NASDAQ: AVGO) and Marvell Technology (NASDAQ: MRVL) have delivered outstanding gains in 2024, with shares of both companies more than doubling as of this writing thanks to the rapidly growing demand for their application-specific integrated circuits (ASICs) and networking chips that are being deployed in data centers for tackling artificial intelligence (AI) workloads.  Broadcom stock is up 124% this year, and Marvell stock has logged gains of 93% as of this writing.  This is where Broadcom steps in; it is reportedly manufacturing custom chips for major names such as Alphabets Google, TikTok parent ByteDance, and Meta Platforms."
77,"Top Stock Movers Now: Broadcom, AMD, ResMed, and More Major U.S. indexes were mixed at midday Monday to start the holiday-shortened trading week."
78,"Prediction: 2 Stocks That Will Be Worth More Than Nvidia 5 Years From Now Nvidia is soaring now, but could its dominance fade in the next few years? Two tech titans could outshine Nvidia by 2029."
79,"JGRO: Losing Steam Compared To Its Peers JGROs performance was promising in its first 20 months, but it has lagged passive large-cap growth ETFs for six months. Read why JGRO ETF is a Hold."
80,Artificial Intelligence Made These Stocks the Market Darlings of 2024 Artificial intelligence continued to be a driving force behind stock market returns in 2024. Here are some of the stocks that have benefited the most.
81,"Elon Musk, Jensen Huang, and the other billionaires who made bank in 2024 2024 was a major year for the world’s wealthiest Americans as the stock market continued to notch new highs. The S&P 500 hit more than 50 record highs over the past 12 months, with its first occurring as early as Jan. 19."
82,"AMD: This Stock Is Way Too Cheap (Rating Upgrade) AMDÂ is currently struggling againstÂ NvidiaÂ and Broadcom in the data center GPU market, but this doesnt mean the company is doomed. Click for this AMD update."
83,"The AI Arms Race: Can Broadcom (AVGO) Compete with Nvidia? We recently published a list of Wall Street Is Focusing on These 10 AI Stocks as New Year Begins. In this article, we are going to take a look at where Broadcom Inc. (NASDAQ:AVGO) stands against other stocks Wall Street is focusing on as the new year begins. Dan Niles, Niles Investment Management founder, recently […]"
84,"Nvidias Blackwell could propel 2025 revenue to $200B: Strategist Nvidia (NVDA) is at the front and center of conversations concerning the AI trade as investors eye the chipmakers early 2025 deliveries for its Blackwell GPUs (graphic processing units). We see significant upside once the delivery numbers ramp up. We think theyre going to be able to exceed $200 billion in revenue just from this product launch for this year, Spear Invest Founder and CIO Ivana Delevska forecasts. Delevska joins Madison Mills in the Yahoo Finance studio to talk about this years prospects for the artificial intelligence landscape, including her bull cases for semiconductor competitors Broadcom (AVGO) and Marvell Technology (MRVL). Now we are getting into a phase where we need physical build-out of data centers and power associated with them. And the US has gone through a period of time where the power infrastructure has not really been upgraded, both on the grid and the generation side, Delevska says about the role energy providers like Vistra (VST) and Constellation Energy (CEG) will play in powering AI data center infrastructure. So as weve brought more renewables to market, the reliability is much lower of the grid. So what were going to see is power prices spike up in order to incentivize new supply coming to market. To watch more expert insights and analysis on the latest market action, check out more Catalysts here. This post was written by Luke Carberry Mogan."
85,"Tech Stocks Look Overvalued, With 1 Surprising Exception A new entrant in the Big Tech club of stocks means it’s time for a new name to describe tech’s largest companies.  The new group consists of  Broadcom Apple Tesla Microsoft Meta Platforms Alphabet Amazon  and  Nvidia  All of them carry market values above $1 trillion.  The eight stocks were up by an average of 66% in 2024 versus the S&P 500 index performance of 23%."
86,"Broadcom Stock More Than Doubled In 2024, This Is Just The Beginning (Rating Upgrade) Broadcom shares more than doubled in 2024 amid market excitement around the âcustom siliconâ wave ahead. Read why I upgrade AVGO stock from hold to buy."
87,Nvidia Almost Became the Largest Company Again as Stock Hits New Record Nvidia Almost Became the Largest Company Again as Stock Hits New Record
88,"Microsoft CEO Satya Nadella Said Something That Could Be Bad News for Nvidia but Great News for This AI-Powered Stock in 2025 Nvidia (NASDAQ: NVDA) has already been one of the major beneficiaries of this fast-evolving trend, driven by extensive adoption of its AI-optimized chips.  In a recent interview with the BG2Pod podcast, Nadella talked about the initial AI boom created by OpenAIs launch of ChatGPT in 2022 and Microsofts efforts to catch up in anticipation of the higher demand for AI services.  Nadella was asked about Microsofts constraints right now and said, Power yes ... I am not chip supply constrained."
89,Meet the 5 Generative AI Stocks on the Cutting Edge of a $1.3 Trillion Opportunity by 2032 These companies arent Magnificent for nothing. The looming growth in generative AI is a game changer.
90,"Prediction: This Artificial Intelligence (AI) Company Will Join Nvidia, Alphabet, Tesla, Amazon, Apple, and Broadcom as the Next Trillion-Dollar Stock-Split Stock Among these companies, Apple, Nvidia, Alphabet, Amazon, Tesla, and Broadcom completed stock splits in recent years.  Besides each of these companies playing a pioneering role in the artificial intelligence (AI) revolution, each had big run-ups in their respective share prices before splitting their stocks."
91,"Why Tesla, Broadcom, and Rivian Fell Today as Treasury Yields Shot Higher Treasury yields continued to surge on sticky inflation data, dragging the market down today.  Tech and artificial intelligence (AI) stocks bore the brunt of the sell-off, as the Nasdaq Composite fell nearly 2%, more than the other major market indexes.  Shares of electric vehicle makers Tesla (NASDAQ: TSLA) and Rivian Automotive (NASDAQ: RIVN) fell roughly 4% and 5%, respectively."
92,"This Stock-Split Stock Is Up 40% in a Month. Is It Too Late to Buy? Few stocks had an end to 2024 like Broadcom (NASDAQ: AVGO).  In November, Broadcom had already crossed the $800 billion mark.  After the stocks recent surge, many might wonder if it can keep the momentum going in 2025."
93,"As Nvidia Clings To Support, This IBD 50 Stock Eyes An AI-Fueled Breakout While Nvidia fights for support, Interactive Brokers joins the AI giant on this breakout screen as it rides strong demand."
94,"Despite Struggles, Palantir Secures Spot Among 25 Perfect Stocks Palantir, Netflix and three high-flying apps maintain their spot among 25 highly rated stocks in the top-ranked industries."
95,"Madison Investments 2024 Year-End U.S. Equity Letter The stock market had another strong year in 2024, led by the S&P 500 Indexâs 25% return. Click here to read the full fund letter."
96,Starboard Builds Big Stake in Chip Maker Qorvo Starboard Builds Big Stake in Chip Maker Qorvo
97,2025 Analyst Outlook: Joe Albano On Thinking Outside The AI Box Should investors stay cautious on tech stocks in 2025? Click here to read about robotics and smaller mid-cap names that may present some upside for tech investors.
98,XNTK: Technology Dashboard For January XNTK offers balanced exposure to technology stocks and has outperformed XLK over the last 12 months. Read more to see my recommendation for the fund.
99,"BUZZ Investing: Markets React To Fed Rate Cut As Renewed Inflation Risks Emerge Markets recently faced volatility driven by Fed cuts, resilient economic data, and persistent inflation concerns, leading to subdued sentiment. Click to read."
100,Qorvo Stock Rises on an Upgrade. How an Activist Could Boost Shares by 20%. Qorvo Stock Rises on an Upgrade. How an Activist Could Boost Shares by 20%.
