301,2025-07-03,"Biopharmaceuticals Manufacturing Consumables Testing Market 2025-2030: Thermo Fisher Scientific, Danaher Corporation, and Merck Lead Demand for validated consumables and innovative testing methods like PCR and chromatography persists, driven by regulatory needs and environmental considerations Biopharmaceuticals Manufacturing Consumables Testing Market Biopharmaceuticals Manufacturing Consumables Testing Market Dublin, July 03, 2025 (GLOBE NEWSWIRE) -- The Biopharmaceuticals Manufacturing Consumables Testing Market by Product Type, Testing Type, Technology, Application, End User - Global Forecast to 2030 has been added to R"
302,2025-07-05,"Jim Cramer Says “Danaher Can Make a Comeback” Danaher Corporation (NYSE:DHR) is one of the 22 stocks Jim Cramer recently talked about. A caller inquired if Cramer thinks it is time to get back into the stock, and here’s what Mad Money’s host had to say in response: “Okay, well, let me tell you, we never left it for the Charitable Trust because […]"
303,2025-07-06,"Spectris: Takeover Highlights Hidden Value In U.K. Small-Cap Stocks Spectris takeover offers highlight how deeply undervalued UK small- and mid-cap stocks are, especially versus US peers. Read why SEPJF stock is a Hold."
304,2025-07-08,"Johnson Controls: Portfolio Transformation And Megatrends Support Re-Rating Johnson Controls trades at a premium vs. historical avg., but valuation is justified by exposure to secular growth trends and a stronger, recurring revenue mix. Learn more on JCI stock here."
305,2025-07-08,"Liquid Handling Systems Market Insights Report 2025-2030 | Advancements in Microplate Reagent Dispensers, Transformation in Genomics, Importance in Drug Discovery & Development, Lab Automation The Liquid Handling Systems Market is anticipated to grow from USD 4.34 billion in 2024 to USD 6.75 billion by 2030, with a CAGR of 7.64%. Key drivers include the increased focus on lab automation and its role in drug discovery. The pipettes segment leads by product share in 2024, while the manual method segment shows the highest growth. The pharma and biotech sector is the primary end-user, and North America holds the largest regional market share. Major players include Agilent Technologies, Da"
306,2025-07-10,ClearBridge Sustainability Leaders Strategy Q2 2025 Commentary The ClearBridge Sustainability Leaders Strategy outperformed its Russell 3000 Index benchmark in the second quarter. Read more here.
307,2025-07-11,"CoreWeave initiated, Texas Instruments upgraded: Wall Streets top analyst calls CoreWeave initiated, Texas Instruments upgraded: Wall Streets top analyst calls"
308,2025-07-11,Danaher Corp. stock underperforms Thursday when compared to competitors despite daily gains Danaher Corp. stock underperforms Thursday when compared to competitors despite daily gains
309,2025-07-13,"Danaher (DHR) Teams Up to Advance Precision Medicine Diagnostics Danaher Corporation (NYSE:DHR) is one of the 13 Best Large Cap Stocks to Buy Right Now. On May 29, Danaher Corporation (NYSE:DHR) announced a new partnership with AstraZeneca to scale precision medicine. This partnership aims to create and commercialize novel diagnostic tools and tests, including the new generation of AI-powered diagnostics. These tools and tests […]"
310,2025-07-15,"Harding Loevner Global Equity Q2 2025 Report The Global Equity composite rose 10.3% gross of fees in the second quarter, lagging the 11.7% gain in the MSCI ACWI Index."
311,2025-07-16,"Saudi Arabia In-Vitro Diagnostics Market Report 2025-2030 Featuring Abbott, BD, Bio-Rad Laboratories, Biomerieux, Danaher, Nihon Kohden, Roche, Siemens Healthineers, Sysmex, Thermo Fischer Scientific Saudi Arabias in-vitro diagnostics market is set to grow from USD 734.7M in 2024 to USD 932.3M by 2030, driven by a rising elderly population and chronic disease prevalence. Saudi Arabia leads the GCC region in IVD, benefiting from government initiatives like Vision 2030 and healthcare sector advances.Dublin, July 16, 2025 (GLOBE NEWSWIRE) -- The Saudi Arabia In-Vitro Diagnostics (IVD) Market (By Segment, Application, Product, End User), Size, Share, Major Deals, Key Company Profiles, Revenue,"
312,2025-07-17,"Danaher (DHR) Q2 Earnings on the Horizon: Analysts Insights on Key Performance Measures Evaluate the expected performance of Danaher (DHR) for the quarter ended June 2025, looking beyond the conventional Wall Street top-and-bottom-line estimates and examining some of its key metrics for better insight."
313,2025-07-18,"Medical Filtration Company Benchmark Report 2025 | Merck KGaA, 3M, and Danaher Strengthen Medical Filtration Market Leadership Through Strategic Expansions, Spin-Offs, and Mergers The Medical Filtration Companies Quadrant offers a detailed analysis of the global medical filtration market, spotlighting key players, technological advancements, and market trends. This report categorizes the top 15 companies, including leaders like Merck KGaA, 3M, and Danaher, each excelling in areas such as healthcare and life sciences. Medical filtration is crucial for removing contaminants from fluids, ensuring safety and purity in applications like dialysis and drug delivery. Techniques i"
314,2025-07-19,"Dividend Champion, Contender, And Challenger Highlights: Week Of July 20 Stay informed with this weeks dividend updates for Dividend Champions, Contenders, and Challengers. Read the latest updates here."
315,2025-07-19,"‘Too Cheap to Ignore’: Scotiabank Says There’s an Opportunity Brewing in These 2 Large Cap Healthcare Stocks President Donald Trump’s new second term is young, but some of its patterns are already clear. The President has no interest in keeping the government’s sacred cows intact, and large swaths of Federal spending are on the chopping block. Healthcare funding, long a third rail in politics, is among those endangered sectors. The Trump Administration has already cut back on funding for various academic research institutions and government agencies. Uncertainty around trade and tariff policy, and the"
316,2025-07-19,"Alphabet and Tesla Earnings, Powell Speech and More: What to Watch Next Week Earnings season rolls on next week with the first of the Magnificent Seven tech names to report, Tesla and Alphabet. New economic data will shed more light on how tariffs are affecting U.S. consumer and business spending."
317,2025-07-21,"India In Vitro Diagnostics (IVD) Industry Analysis & Forecast (2025-2034) Featuring Roche, Transasia Bio-Medicals, Bio-Rad Labs, BioMerieux, Sysmex, Abbott, Thermo Fisher Scientific, QIAGEN, Quidel, Danaher The markets 6.10% CAGR reflects advances in molecular diagnostics, healthcare infrastructure expansion, and personalized medicine. Key trends include companies like Sysmex enhancing local operations and WHO expanding diabetes-related IVDs. Abbott, Qiagen, Quidel, and Danaher lead the markets innovation-driven growth.Dublin, July 21, 2025 (GLOBE NEWSWIRE) -- The India In Vitro Diagnostics Market Report and Forecast 2025-2034 has been added to ResearchAndMarkets.coms offering. The India in vi"
318,2025-07-21,"Alphabet and Tesla Earnings, Powell Speech and More: What to Watch This Week Earnings season rolls on this week with the first of the Magnificent Seven tech names to report, Tesla and Alphabet. New economic data will shed more light on how tariffs are affecting consumer and business spending, and Federal Reserve Chair Jerome Powell is slated to speak on bank regulation."
319,2025-07-21,Danaher (DHR) Reports Q2: Everything You Need To Know Ahead Of Earnings Diversified science and technology company Danaher (NYSE:DHR) will be reporting earnings this Tuesday before market hours. Here’s what to look for.
320,2025-07-21,Donald Trump faces frosty reception on Aberdeen golf trip Hello and welcome to the working week.I must start with a thank you to my colleague Harvey for stepping in for me last week while I took an early...
321,2025-07-22,"Stocks Down Pre-Bell Ahead of Key Earnings, Fed Chair Powells Speech US equity futures were trending downwards on Tuesday as traders await the latest batch of corporate"
322,2025-07-22,"Stocks to Watch Tuesday: RTX, Lockheed Martin, Coca-Cola, GM ? Coca-Cola (KO): The soda maker reported mixed quarterly results, but nudged up its annual earnings outlook. The company confirmed it will roll out a cane-sugar Coke option. ↘️ RTX (RTX): Results from the aerospace and defense company beat projections, but it sliced its earnings outlook, as tariffs sting."
323,2025-07-22,"Exchange-Traded Funds, Equity Futures Lower Pre-Bell Tuesday as More Corporate Earnings Awaited The broad market exchange-traded fund SPDR S&P 500 ETF Trust (SPY) was down 0.2% and the actively tr"
324,2025-07-22,"Danaher: Q2 Earnings Snapshot The results beat Wall Street expectations. The average estimate of 10 analysts surveyed by Zacks Investment Research was for earnings of $1.64 per share. The industrial and medical device maker posted revenue of $5.94 billion in the period, which also topped Street forecasts."
325,2025-07-22,"Danaher Q2 Earnings Beat Estimates, Life Sciences Sales Up Y/Y DHR tops Q2 estimates with strong sales across segments, lifting its 2025 EPS outlook amid mixed margin trends."
326,2025-07-22,"Danaher shares slip despite Q2 beat, annual profit outlook hike Investing.com -- Danaher (NYSE:DHR) delivered stronger-than-expected second-quarter results and lifted its full-year profit outlook. Still, the company’s shares fell over 2% in premarket trading on Tuesday."
327,2025-07-22,"Danaher’s (NYSE:DHR) Q2 Sales Top Estimates But Quarterly Revenue Guidance Slightly Misses Expectations Diversified science and technology company Danaher (NYSE:DHR) beat Wall Street’s revenue expectations in Q2 CY2025, with sales up 3.4% year on year to $5.94 billion. On the other hand, next quarter’s revenue guidance of $5.94 billion was less impressive, coming in 1% below analysts’ estimates. Its non-GAAP profit of $1.80 per share was 9.5% above analysts’ consensus estimates."
328,2025-07-22,"Danaher Announces Transition Plan for Chief Financial Officer Danaher Corporation (NYSE: DHR), a leading global life sciences and diagnostics innovator, today announced that Matthew Gugino, currently Group Chief Financial Officer of the Companys Life Sciences Innovations Group and Vice President of Financial Planning & Analysis, will succeed Matthew McGrew as Danahers Chief Financial Officer effective February 28th, 2026. Following the transition and consistent with past practice, Mr. McGrew will continue thereafter as an Executive Vice President of the"
329,2025-07-23,"Steven Cohens Strategic Moves: A Closer Look at Danaher Corps Impact on His Portfolio Insights from Steven Cohen (Trades, Portfolio)s First Quarter 2025 13F Filing"
330,2025-07-23,"Danaher Corp (DHR) Q2 2025 Earnings Call Highlights: Strong Cash Flow and Bioprocessing Growth ... Danaher Corp (DHR) reports robust free cash flow and bioprocessing growth, while navigating global trade tensions and Life Sciences segment challenges."
331,2025-07-23,"Thermo Fisher beats quarterly estimates on resilient demand for its tools and services Shares of the medical equipment maker were up 2.5% in premarket trading.  The company joins peers such as Danaher in beating quarterly profit estimates, citing strong demand from the industry for tools and services used to make vaccines and therapies.  Danaher said on Tuesday it is seeing a robust number of clinical trials and therapies under development, with steady demand from its pharmaceutical clients."
332,2025-07-23,Heres Why Danaher (DHR) is a Strong Growth Stock The Zacks Style Scores offers investors a way to easily find top-rated stocks based on their investing style. Heres why you should take advantage.
333,2025-07-24,Danaher Corp. stock underperforms Wednesday when compared to competitors despite daily gains Danaher Corp. stock underperforms Wednesday when compared to competitors despite daily gains
334,2025-07-24,"Danaher Q2 2025 Update While S&P 500 is at its all-time high, Danaher is still ~34% below its peak from late 2021. Click to read."
335,2025-07-24,Akre Focus Fund Q2 2025 Commentary Akre Focus Fund Q2 update highlights quality-driven compounding over bounce-driven gains. Learn why patience and selectivity pay off long term.
336,2025-07-25,"Contract research firms strong earnings signal stabilizing biotech, pharma spending (Reuters) -Contract research organizations are reporting better-than-expected second-quarter profit, a sign that Wall Street analysts say reflects a rebound in biotech and pharmaceutical spending after a cautious stretch driven by tighter sector financing.  Danaher, Medpace, IQVIA, ICON and Thermo Fisher have posted strong results owing to steady demand from the industry for tools and services that are used in the development of novel medicines.  Biotech funding has started to tick up month over month from April to June, and perhaps our biggest takeaway from IQVIA results as well as Medpace is that the macro environment, while still challenged, has perhaps stabilized, said TD Cowen analyst Charles Rhyee."
337,2025-07-25,NZS Capital Q2 2025 Shareholder Letter NZS Capital reports a 19.39% Q2 gain for its Growth Equity strategy. See how resilient tech picks and smart reallocation drove results. Review the playbook.
338,2025-07-25,"Are You a Momentum Investor? This 1 Stock Could Be the Perfect Pick Whether youre a value, growth, or momentum investor, finding strong stocks becomes easier with the Zacks Style Scores, a top feature of the Zacks Premium research service."
339,2025-07-27,"MCN: The Yield Is Nice, But This Fund Is Hard To Recommend Discover insights on the XAI Madison Equity Premium Income Funds 11.5% yield, NAV performance, and sustainability challenges."
340,2025-07-27,"Danaher Corporation (DHR)’s Been A Disaster, Says Jim Cramer We recently published 10 Stocks Jim Cramer Talked About As He Said Everyone Won From Trump’s Japan Deal. Danaher Corporation (NYSE:DHR) is one of the stocks Jim Cramer recently discussed. Danaher Corporation (NYSE:DHR) is an American life sciences, diagnostics, and biotechnology equipment provider. Its shares have lost 11% year-to-date, and Cramer isn’t a fan of […]"
341,2025-07-27,"Built To Last: My 16-Stock Dividend Pyramid Portfolio Discover how restructuring a dividend portfolio into Albanian real estate and applying the pyramid method enhances diversification, risk balance, and the future."
342,2025-07-28,"Revvity Q2: Headwinds From China And Customers, Buy On Weakness Revvity, Inc. targets high-growth markets like cell and gene therapies and precision medicine. Click for more on RVTY stock and why Im bullish."
343,2025-07-28,International Markets and Danaher (DHR): A Deep Dive for Investors Explore how Danahers (DHR) revenue from international markets is changing and the resulting impact on Wall Streets predictions and the stocks prospects.
344,2025-07-29,"Where this large cap portfolio manager see opportunity now Looking for a large-cap stock to invest in? In the video above, Macquarie Large Cap Growth Team senior portfolio manager Brad Klapmeyer shares some of the sectors and stocks hes taking a closer look at. To watch more expert insights and analysis on the latest market action, check out more Market Domination Overtime here."
345,2025-07-29,"5 Revealing Analyst Questions From Danaher’s Q2 Earnings Call Danaher’s second quarter results came in ahead of Wall Street’s revenue and profit expectations, with steady growth in its bioprocessing business and disciplined cost management highlighted by management as key contributors. CEO Rainer Blair pointed to “strong growth in our bioprocessing business, paired with disciplined cost management,” as drivers behind the quarter’s performance. Despite ongoing global trade tensions and a soft environment for academic and government research, the company saw"
346,2025-07-29,"Veralto lifts annual profit forecast on water treatment demand Veralto raised its full-year profit forecast and beat quarterly estimates on Monday, helped by strong demand for its industrial water treatment services. Shares of the company rose 1.4% in extended trade. The Waltham, Massachusetts-based company provides water treatment solutions to industrial customers that help ensure quality, alongside packaging and quality control services."
347,2025-07-30,"Danaher Corporation (DHR): Maybe It Can Be Great Again, Says Jim Cramer We recently published 11 Stocks That Jim Cramer Recently Talked About. Danaher Corporation (NYSE:DHR) is one of the stocks Jim Cramer recently discussed. Danaher Corporation (NYSE:DHR) is a stock that Jim Cramer has a bittersweet relationship with. His trust has continued to hold the shares despite the fact that they have lost 11.7% year-to-date. The […]"
348,2025-07-30,"Rapid Expansion and Innovation Drive $36 Billion Global Point-of-Care Diagnostics Market, Says New Kalorama Report A new report from Kalorama Information reveals that the global point-of-care (POC) diagnostics market surged past $36 billion in 2024, with projections pointing to continued growth through 2029. The twelfth edition of Worldwide Market for Point-of-Care Diagnostic Tests, 12th Edition highlights how decentralization of healthcare, rapid innovation, and consumer-driven demand are reshaping how and where diagnostic tests are performed—from traditional clinical settings to homes, workplaces, and remo"
349,2025-07-30,"Drug Abuse Testing Market Forecast and Company Analysis Report 2025-2033 Featuring Danaher, LabCorp, Abbott, Quest Diagnostics, Thermo Fisher Scientific, F. Hoffmann-La Roche, Bio-Rad, Medtronic The global Drug Abuse Testing Market is set to surge, reaching $12.77 billion by 2033 from $6.64 billion in 2024, experiencing a CAGR of 7.54% between 2025-2033. This growth is driven by rising drug abuse rates, enhanced public awareness, and strict laws. Technological advancements in testing and an increased emphasis on preventative healthcare further boost the market. Key product and service segments include analyzers, rapid testing devices, and laboratory services, with urine tests dominating"
350,2025-07-30,"Aldevron Launches New Innovation Center in Waltham, MA FARGO, N.D. & WALTHAM, Mass., July 30, 2025--Aldevron is expanding into Waltham, MA, a strategic move to help grow its innovation capabilities in gene editing and mRNA."
351,2025-07-30,Got $500? 3 Blue Chip Dividend Stocks to Buy and Hold Forever Being a great investor doesnt have to be complicated or expensive.
352,2025-08-01,"Danaher Appoints Jonathan Leiken as General Counsel Danaher Corporation (NYSE: DHR), a leading global life sciences and diagnostics innovator, today announced that Jonathan Leiken has been appointed Senior Vice President and General Counsel, effective August 25, 2025. Mr. Leiken will report directly to President and Chief Executive Officer Rainer Blair and will serve as an executive officer and a member of the Danaher Leadership Team."
353,2025-08-02,"Buy Graham Holdings Stock. Its Parts Are Worth More Than the Whole. Graham owns an array of businesses including Kaplan test prep, and has family ties to Berkshire Hathaway. The stock looks cheap."
354,2025-08-02,"Markels Q2 Earnings Surpass Estimates, Premiums Rise Y/Y MKL tops Q2 earnings and revenue estimates, but profits dip as rising expenses weigh on margins."
355,2025-08-04,Janus Henderson Concentrated Growth Managed Account Q2 2025 Commentary Janus Henderson Concentrated Growth Managed Account returned 18.47% (gross) and the Russell 1000Â® Growth Index returned 17.84%. Read more here.
356,2025-08-05,Janus Henderson Forty Fund Q2 2025 Commentary Janus Henderson Forty Fund returned 19.34% and the Russell 1000Â® Growth Index returned 17.84%. Read more here.
357,2025-08-05,Danaher Insiders Sold US$250m Of Shares Suggesting Hesitancy The fact that multiple Danaher Corporation ( NYSE:DHR ) insiders offloaded a considerable amount of shares over the...
358,2025-08-05,Bio-Techne: Coveted Life Sciences Asset On Sale Due To Academic Pressures Headwaters Capital sees deep value in Bio-Techne as academic cuts weigh on shares. Learn why this life sciences leader could rebound in 2027âread the thesis.
359,2025-08-06,"Bio-Techne beats quarterly estimates on strength in protein sciences unit Bio-Techne reported better-than-expected fourth-quarter revenue and profit on Wednesday, helped by steady demand for its proteins, antibodies and other products for research. The Minneapolis, Minnesota-based company develops and makes products used in medical research, drug development and diagnostics. Larger peers Thermo Fisher and Danaher last month flagged robust demand across regions for their drug development products such as instruments and analytical tools after two years of weak biotech funding."
360,2025-08-06,"Charles River raises profit forecast on growing demand for drug development services The Wilmington, Massachusetts-based contract drug developer raised its 2025 adjusted profit forecast to $9.90 to $10.30 per share, compared with its previous projection of $9.30 to $9.80.  Contract research organizations, which reported quarterly results over the last month, have all posted better-than-expected profit, reflecting a rebound in spending from pharmaceutical and biotech clients after a cautious stretch driven by tighter sector financing.  We are continuing to see clear signs that the biopharmaceutical demand is stabilizing, and in this environment, we are making gradual progress to return to organic revenue growth, Charles River CEO James Foster said."
361,2025-08-08,Precipio: Cash Flow Positivity May Remove Going Concern Language Deep Sail Capital highlights Precipioâs path to cash flow positivity and niche growth in cancer diagnostics. See why its turnaround story deserves a closer look.
362,2025-08-08,"Hologics Diagnostics Arm Set for Long-Term Upside: Whats Behind It? HOLXs Diagnostics arm eyes long-term growth with new assays, platform expansion and oncology test adoption despite headwinds."
363,2025-08-08,"Agilent: A Lean, Focused Play In Life Sciences Tools Amid Tariff Turbulence Agilent remains a strong life science leader with solid financials and strategic resilience, but near-term headwinds temper upside. See why A stock is a hold."
364,2025-08-12,"STD Diagnostic Market Forecast and Company Analysis Report 2025-2033 Featuring Siemens, Abbott, MedMira, QIAGEN, Danaher, F. Hoffmann-La Roche, Diasorin, BioMeriuex, Hologic, Bio-Rad Laboratories The STD Diagnostic Market is projected to reach $17.93 billion by 2033, growing from $9.82 billion in 2024 at a CAGR of 6.92% during 2025-2033. Key growth drivers include increased STD prevalence, technological advancements in diagnostics, and enhanced accessibility to healthcare. Government initiatives and improved public awareness also bolster the market. Segments analyzed include products, testing types, and global regions, emphasizing the demand for point-of-care testing and at-home kits. Si"
365,2025-08-12,"Genedata Next-Gen Software to Power GMP-Compliant NGS in Biopharma Manufacturing Genedata, a Danaher company, and the leading provider of enterprise software solutions for biopharmaceutical R&D, today announced a new release of Genedata Selector®. This end-to-end solution automates next-generation sequencing (NGS) data processing and analysis, accelerating decision-making for more efficient quality control of advanced therapies. The new version of Genedata Selector further enhances data integrity by seamlessly connecting systems, facilitating efficient transfer of data, proj"
366,2025-08-13,"Saudi Arabia Clinical Chemistry Analyzer Market Forecast and Company Analysis Report 2025-2033 Featuring Thermo Fisher Scientific, Abbott, Siemens, Danaher, J&J, Sysmex ADR, HORIBA, Hitachi The Saudi Arabia Clinical Chemistry Analyzer Market is set to reach US$ 249.11 million by 2033, growing from US$ 170.98 million in 2024 at a 4.27% CAGR. Market growth is fueled by government healthcare investments under Vision 2030, alongside rising chronic diseases and an aging population demanding precise diagnostics. Technological advancements in automation, AI integration, and point-of-care testing further enhance accessibility, especially in underserved areas. With increasing involvement fr"
367,2025-08-13,"Mexico Microcarrier Market Trends and Company Analysis Report 2025-2033 Featuring BD, Thermo Fisher Scientific, Merck, Eppendorf, Danaher, Sartorius, Bio Rad, Corning, Lonza Group, Getinge The Mexico Microcarrier Market is poised for significant growth, projected to reach US$ 77.65 million by 2033 from US$ 39.96 million in 2024, achieving a CAGR of 7.66% from 2025 to 2033. Key drivers include increased investment in regenerative medicine and cell therapy, rising demand for cell-based vaccines and biologics, and technological advancements in cell culture efficiency. Mexico’s biopharmaceutical sector expansion, supported by enhanced bioprocessing infrastructure and strategic public-"
368,2025-08-13,"[Latest] US Personalized Medicine Market Size/Share Worth USD 252.93 Billion by 2034 at a 17.32% CAGR: Custom Market Insights (Analysis, Outlook, Leaders, Report, Trends, Forecast, Segmentation, Growth Rate, Value, SWOT Analysis) [220+ Pages Latest Report] According to a market research study published by Custom Market Insights, the demand analysis of US Personalized Medicine Market size & share revenue was valued at approximately USD 56.37 Billion in 2024 and is expected to reach USD 66.13 Billion in 2025 and is expected to reach around USD 252.93 Billion by 2034, at a CAGR of 17.32% between 2025 and 2034. The key market players listed in the report with their sales, revenues and strategies are Illumina Inc., Precision"
