101,2024-12-13,"ENPH, NextEnergy Ink Deal to Boost Solar Savings in Netherlands ENPH teams up with NextEnergy in the Netherlands to help customers get valuable returns from their solar and battery investments."
102,2024-12-14,"Investor Alert: Kessler Topaz Meltzer & Check, LLP Files a Securities Fraud Class Action Lawsuit Against Enphase Energy, Inc. and Encourages Investors With Losses to Contact the Firm The law firm of Kessler Topaz Meltzer & Check, LLP informs investors that the firm has filed a securities fraud class action lawsuit against Enphase Energy, Inc. (..."
103,2024-12-16,"DEADLINE ALERT: Faruqi & Faruqi, LLP Investigates Claims on Behalf of Investors of Enphase Energy Faruqi & Faruqi, LLP Securities Litigation Partner James Wilson Encourages Investors Who Suffered Losses Exceeding $100,000 In Enphase Energy To Contact Him Directly To Discuss Their OptionsIf you..."
104,2024-12-17,"Enphase Energy Begins Shipments of IQ Battery 5Ps in India FREMONT, Calif., Dec. 17, 2024 (GLOBE NEWSWIRE) -- Enphase Energy, Inc. (NASDAQ: ENPH), a global energy technology company and the worlds leading supplier of microinverter-based solar and battery systems, today announced initial shipments of its most powerful home battery to-date, the IQ® Battery 5P, for customers in India. Enphase announced pre-orders of IQ Battery 5Ps in September 2024. India’s power grid faces frequent challenges, with outages disrupting numerous households daily. The IQ Bat"
105,2024-12-17,SolarEdge Stock Jumps After Goldman Double Upgrade. Solar Can Shine Again in 2025. SolarEdge Stock Jumps After Goldman Double Upgrade. Solar Can Shine Again in 2025.
106,2024-12-17,Enphase: Ready To Shine Again Enphase dominates the microinverter segment and benefits from favorable long-term solar energy trends. See why I rate ENPH stock a strong buy.
107,2024-12-17,"ENPH Investors Have Opportunity to Lead Enphase Energy, Inc. Securities Fraud Lawsuit with the Schall Law Firm The Schall Law Firm, a national shareholder rights litigation firm, reminds investors of a class action lawsuit against Enphase Energy, Inc. for violations of §§10 and 20 of the Securities..."
108,2024-12-18,"Investor Notice: Robbins LLP Informs Stockholders of the Class Action Lawsuit Filed Against Enphase Energy, Inc. SAN DIEGO, Dec. 18, 2024 /PRNewswire/ -- Robbins LLP announces that a shareholder filed a class action on behalf of all investors who purchased or otherwise acquired Enphase Energy, Inc. securities..."
109,2024-12-18,"ENPH Robbins Geller Rudman & Dowd LLP Announces that Enphase Energy, Inc. Investors with Substantial Losses Have Opportunity to Lead Class Action Lawsuit The law firm of Robbins Geller Rudman & Dowd LLP announces that purchasers or acquirers of Enphase Energy, Inc. common stock between April 25, 2023 and October 22, 2024, both dates inclusive , have..."
110,2024-12-18,"Rosen Law Firm Urges Enphase Energy, Inc. (NASDAQ: ENPH) Stockholders with Large Losses to Contact the Firm for Information About Their Rights Rosen Law Firm, a global investor rights law firm, announces that a shareholder filed a class action on behalf of all purchasers of common stock of Enphase Energy, Inc. between April 25, 2023 and..."
111,2024-12-18,This Clean Energy Stock Surges On Upgrade Despite Trump Uncertainty This Clean Energy Stock Surges On Upgrade Despite Trump Uncertainty
112,2024-12-19,"ENPH Investor Alert: Kessler Topaz Meltzer & Check, LLP Has Filed a Securities Fraud Class Action Lawsuit Against Enphase Energy, Inc. (ENPH) December 19, 2024 - The law firm of Kessler Topaz Meltzer & Check, LLP informs investors that the firm has filed a securities fraud class action lawsuit against Enphase Energy, Inc. on behalf of all..."
113,2024-12-21,"Is SolarEdge At Its Final Edge? Analyzing SolarEdges downfall in 2023-2024, its uncertain future, and whether it is still a viable investment option for investors."
114,2024-12-21,"Pomerantz Law Firm Reminds Shareholders with Losses on their Investment in Enphase Energy, Inc. of Class Action Lawsuit and Upcoming Deadlines - ENPH NEW YORK, Dec. 20, 2024 /PRNewswire/ -- Pomerantz LLP announces that a class action lawsuit has been filed against Enphase Energy, Inc.  . Such investors are advised to contact Danielle Peyton at..."
115,2024-12-21,"ENPH Bronstein, Gewirtz & Grossman LLC Announces that Enphase Energy, Inc. Investors with Substantial Losses Have Opportunity to Lead Class Action Lawsuit Attorney Advertising--Bronstein, Gewirtz & Grossman, LLC, a nationally recognized law firm, notifies investors that a class action lawsuit has been filed against Enphase Energy, Inc. and certain of..."
116,2024-12-23,"Enphase Energy, Inc. (ENPH): A Bull Case Theory We came across a bullish thesis on Enphase Energy, Inc. (ENPH) on The Finance Corner’s Substack by Kostadin Ristovski, ACCA. In this article, we will summarize the bulls’ thesis on ENPH. Enphase Energy, Inc. (ENPH)’s share was trading at $71.45 as of Dec 20th. ENPH’s trailing and forward P/E were 155.33 and 20.53 respectively according to Yahoo […]"
117,2024-12-24,"Charged: Analyst sees Tesla Q4 deliveries just above expectations Institutional investors and professional traders rely on The Fly to keep up-to-the-second on breaking news in the electric vehicle and clean energy space, as well as which stocks in these sectors that the best analysts on Wall Street are saying to buy and sell. From the hotly-debated high-flier Tesla (TSLA), Wall Street’s newest darling Rivian (RIVN), traditional-stalwarts turned EV-upstarts GM (GM) and Ford (F) to the numerous SPAC-deal makers that have come public in this red-hot space, The Fl"
118,2024-12-25,"Enphase Energy (ENPH) Rises Yet Lags Behind Market: Some Facts Worth Knowing Enphase Energy (ENPH) closed at $73.28 in the latest trading session, marking a +0.38% move from the prior day."
119,2024-12-25,"Why Enphase Energy (ENPH) Is One of the Best Solar Energy Stocks to Buy Now? We recently published a list of 10 Best Solar Energy Stocks To Buy Now. In this article, we are going to look at where Enphase Energy, Inc. (NASDAQ:ENPH) stands against other best solar energy stocks to buy now. During Joe Biden’s presidency, the U.S. solar industry experienced a significant boost, primarily driven by the Inflation […]"
120,2024-12-27,Emeren Divests 2.8 MWdc Solar Project in Maine to Altus Power SOL announces the sale of a 2.8 MWdc solar project in Maine to Altus Power.
121,2024-12-28,Emeren & Arpinge Complete 162 MW Battery Storage Project in Italy SOL announces that it has closed the second phase of its BESS portfolio under the DSA with Arpinge.
122,2024-12-29,"Class Action Announcement for Enphase Energy, Inc. Investors: Kessler Topaz Meltzer & Check, LLP Has Filed a Securities Fraud Class Action Lawsuit Against Enphase Energy, Inc. December 28, 2024 - The law firm of Kessler Topaz Meltzer & Check, LLP informs investors that the firm has filed a securities fraud class action lawsuit against Enphase Energy, Inc. on behalf of all..."
123,2024-12-29,"Enphase: Top Contrarian Pick With Blood In The Streets Enphase upgraded to strong buy - with technological edge over competitors and profitability in a tough solar market, strong growth is on the horizon."
124,2024-12-30,"ENPH Announcement: Kessler Topaz Meltzer & Check, LLP Announces the Firm Has Filed a Securities Fraud Class Action Lawsuit Against Enphase Energy, Inc. (ENPH) RADNOR, Pa., Dec. 30, 2024 /PRNewswire/ -- The law firm of Kessler Topaz Meltzer & Check, LLP informs investors that the firm has filed a securities fraud class action lawsuit against Enphase Energy,..."
125,2024-12-30,"Is Enphase Energy (ENPH) Among the Best Renewable Energy Stocks to Buy Now? We recently published a list of the 11 Best Renewable Energy Stocks To Buy Now. In this article, we are going to take a look at where Enphase Energy, Inc. (NASDAQ:ENPH) stands against the other best renewable energy stocks to buy now. The future of President Joe Biden’s landmark climate legislation, the Inflation Reduction Act […]"
126,2024-12-31,"The S&P 500s most volatile stocks in 2024 Looking back on 2024, the year saw monumental gains across the major indexes (^DJI, ^IXIC, ^GSPC) while still proving to be a roller coaster ride of volatility for several individual stocks. The Morning Brief anchors Seana Smith and Madison Mills take a look at several of the S&P 500s most volatile names in 2024, including Palantir Technologies (PLTR), Tesla (TSLA), Enphase Energy (ENPH), and Super Micro Computer (SMCI) after its shares plummeted, tied to the resignation of its auditor. To watch more expert insights and analysis on the latest market action, check out more Morning Brief here. This post was written by Luke Carberry Mogan."
127,2024-12-31,"Enphase: Floor Yet To Be Found - More Uncertainties Ahead (Rating Downgrade) Read here for a discussion of Enphases challenges in renewable energy market, underwhelming stock performance, and potential for improved margin of safety."
128,2025-01-02,"Enphase Energy, Inc. Sued for Securities Law Violations - Contact the DJS Law Group to Discuss Your Rights - ENPH LOS ANGELES, Jan. 2, 2025 /PRNewswire/ -- The DJS Law Group reminds investors of a class action lawsuit against Enphase Energy, Inc. for violations of the federal securities laws. ..."
129,2025-01-04,"Enphase Energy (ENPH) Advances But Underperforms Market: Key Facts In the most recent trading session, Enphase Energy (ENPH) closed at $72.15, indicating a +1.11% shift from the previous trading day."
130,2025-01-06,"Trump Tariffs Shift? Trump Denies, But Nucor, Enphase, Ford, FCX Lead S&P 500 Rally President-elect Trump denied a report that his tariffs may focus on strategic industries. But the S&P 500, Nucor, FCX, Enphase and Ford rose."
131,2025-01-06,"Kessler Topaz Meltzer & Check, LLP Encourages Enphase Energy, Inc. Investors with Losses to Contact the Firm The law firm of Kessler Topaz Meltzer & Check, LLP informs investors that the firm has filed a securities fraud class action lawsuit against Enphase Energy, Inc. on behalf of all persons and..."
132,2025-01-07,"Zacks Industry Outlook Highlights Enphase Energy, Nextracker and Canadian Solar Enphase Energy, Nextracker and Canadian Solar are part of the Zacks Industry Outlook article."
133,2025-01-07,"3 Solar Stocks to Watch Amid Solid Installation Trend in US The US solar industry should benefit from IRA-induced investments amid cost competition with China. You may keep ENPH, NXT & CSIQ in your portfolio."
134,2025-01-07,"Enphase Energy IQ8 Microinverters Selected for Belgium Radioactive Waste Facility Enphase IQ8 Microinverters selected for safer AC system architecture, emphasis on cybersecurity, and superior reliability and performanceFREMONT, Calif., Jan. 07, 2025 (GLOBE NEWSWIRE) -- Enphase Energy, Inc. (NASDAQ: ENPH), a global energy technology company and the worlds leading supplier of microinverter-based solar and battery systems, today announced that IQ8™ Microinverters were selected for a 2.2 MW solar project at the Belgoprocess radioactive waste facility in Dessel, Belgium. Earth, a"
135,2025-01-08,"A Closer Look At Enphase Energy, Inc.s (NASDAQ:ENPH) Uninspiring ROE One of the best investments we can make is in our own knowledge and skill set. With that in mind, this article will..."
136,2025-01-09,"ROSEN, A LEADING LAW FIRM, Encourages Enphase Energy, Inc. Investors to Secure Counsel Before Important Deadline in Securities Class Action - ENPH WHY: Rosen Law Firm, a global investor rights law firm, reminds purchasers of common stock of Enphase Energy, Inc. between April 25, 2023 and October 22, 2024, both dates inclusive , of the important..."
137,2025-01-11,"Jim Cramer on Enphase Energy, Inc. (ENPH): ‘I Think It’s Amazing That Enphase Was Only Down 48% For The Year’ We recently compiled a list of the 10 S&P 500 Stocks on Jim Cramer’s Radar. In this article, we are going to take a look at where Enphase Energy, Inc. (NASDAQ:ENPH) stands against the other S&P 500 stocks. Jim Cramer, host of Mad Money, recently discussed the current state of the market and also discussed both […]"
138,2025-01-13,"Enphase Energy Introduces IQ Battery 5P with FlexPhase, Delivering Three-Phase Backup Power in Germany, Austria, and Switzerland FREMONT, Calif., Jan. 13, 2025 -- Enphase Energy, Inc. , a global energy technology company and the worlds leading supplier of microinverter-based solar and battery systems, today announced..."
139,2025-01-13,"Kessler Topaz Meltzer & Check, LLP Reminds Investors of Deadline for Securities Fraud Class Action Lawsuit Filed Against Enphase Energy, Inc. RADNOR, Pa., Jan. 13, 2025 /PRNewswire/ -- The law firm of Kessler Topaz Meltzer & Check, LLP informs investors that the firm has filed a securities fraud class action lawsuit against Enphase Energy,..."
140,2025-01-13,The Challenges Of The Energy Transition And 26 Companies That Might Benefit From It Areas such as grids and storage are crucial to the success of the energy transition. Check out the various challenges posed by the energy transition.
141,2025-01-16,Enphase Energy : Which solar tax credits and incentives are available in 2025 State-level solar incentives State-level solar incentives may further help you reduce the costs of installing solar on your home or business. Though most states have incentives in place-though not...
142,2025-01-17,"Kirby McInerney LLP Urges Investors in Enphase Energy, Inc. (ENPH) to Inquire About Their Rights in Class Action Lawsuit The law firm of Kirby McInerney LLP reminds investors that a class action lawsuit has been filed in the U.S. District Court for the Northern District of California on behalf of those who acquired..."
143,2025-01-20,Enphase: Challenges Mount As Solar Industry Could Face More Headwinds In 2025 Enphase operates in a landscape that seems to be negatively affected by policy regulators on both sides of the Atlantic. Read why ENPH stock is a Strong Sell.
144,2025-01-21,"Enphase Energy Announces Conference Call to Review Fourth Quarter and Full Year 2024 Financial Results FREMONT, Calif., Jan. 21, 2025 -- Enphase Energy, Inc. , a global energy technology company and the worlds leading supplier of microinverter-based solar and battery systems, announced today that..."
145,2025-01-23,"Enphase Energy Announces U.S.-Produced IQ8 Microinverter Compliance with Build America, Buy America (BABA) Act FREMONT, Calif., Jan. 23, 2025 -- Enphase Energy, Inc. , a global energy technology company and the worlds leading supplier of microinverter-based solar and battery systems, today announced that..."
146,2025-01-24,"Enphase Energy : Understanding solar incentives, tax credits, and rebates in Ohio State-level solar incentives and rebates The ECO-Link program provides homeowners in Ohio with the opportunity to get a reduced-rate loan for home-energy-efficiency upgrades, including solar panel..."
147,2025-01-27,"Enphase Energy Announces Technology Integration into Octopus Energy Smart Tariff Program in the United Kingdom FREMONT, Calif., Jan. 27, 2025 -- Enphase Energy, Inc. , a global energy technology company and the worlds leading supplier of microinverter-based solar and battery systems, announced today that..."
148,2025-01-30,Nextracker: Riding The Solar Boom With Industry-Leading Innovation Nextracker reported $679 million in Q3 revenue with significant free cash flow growth and a record backlog exceeding $4.5 billion. Learn more on NXT stock here.
149,2025-01-30,"Enphase Energy Expands in Southeast Asia with Market Entry in Vietnam and Malaysia FREMONT, Calif., Jan. 30, 2025 -- Enphase Energy, Inc. , a global energy technology company and the worlds leading supplier of microinverter-based solar and battery systems, today announced that..."
150,2025-02-03,"Enphase: Buy When Others Question If Sunny Days Will Ever Reappear Enphase Energys stock price is down 85%, but its fundamentals remain strong. Read why ENPH stock is a compelling buy with potential for recovery."
151,2025-02-05,"Enphase Energy Shares Rise After 4Q Results, 1Q Outlook Beat Estimates Enphase Energy Shares Rise After 4Q Results, 1Q Outlook Beat Estimates"
152,2025-02-05,"Enphase Energy, Inc. (ENPH) Q4 2024 Earnings Call Transcript Enphase Energy, Inc. (NASDAQ:ENPH) Q4 2024 Earnings Conference Call February 4, 2024 4:30 PM ETCompany ParticipantsZach Freedman - IRBadri Kothandaraman -..."
153,2025-02-05,"Enphase calls for better times ahead, but Europe is still a worry for solar-power company Enphase calls for better times ahead, but Europe is still a worry for solar-power company"
154,2025-02-05,"Enphase Energy: Good Quarter But Limited Near-Term Catalysts - Hold (Rating Upgrade) Enphase Energys Q4 results exceeded expectations with strong cash flow, but disappointing Q1 guidance may keep shares range-bound. Read why ENPH stock is a Hold."
155,2025-02-05,"Alphabet and AMD shares under pressure, and other movers Alphabet and AMD shares under pressure, and other movers"
156,2025-02-05,Enphase Earnings Are Lifting Solar Stocks. What Wall Street Thinks. Enphase Earnings Are Lifting Solar Stocks. What Wall Street Thinks.
157,2025-02-06,Enphase Energy: Struggles Ahead Enphase Energy struggles despite strong technology and potential. Learn why ENPH stock faces volatility due to competition and legal challenges.
158,2025-02-07,3 Renewable-Energy Stocks That Could Thrive Under Trump 3 Renewable-Energy Stocks That Could Thrive Under Trump
159,2025-02-07,"Enphase Energy: While Waiting For A Sale Rebound, The Cash Flow Remains Elevated Enphase Enegy generated a strong cash flow despite recording a stunning 40% revenue decline YoY. Check out why I continue to rate ENPH stock as a buy."
160,2025-02-07,Enphase Energy Inc. stock outperforms competitors on strong trading day Enphase Energy Inc. stock outperforms competitors on strong trading day
161,2025-02-13,Enphase Energy Inc. stock underperforms Wednesday when compared to competitors Enphase Energy Inc. stock underperforms Wednesday when compared to competitors
162,2025-02-14,Trump Anxiety Could Boost Sales at These Renewables Companies Trump Anxiety Could Boost Sales at These Renewables Companies
163,2025-02-20,SolarEdge Spikes 16% As Improved Margins Offset Wider Loss SolarEdge Technologies missed earnings estimates as losses widened. But SEDG stock spikes as margins improve.
164,2025-02-21,"SolarEdge Technologies Q4 Loss Wider Than Expected, Revenues Down Y/Y SEDGs Q4 revenues of $196.2 million surpass the Zacks Consensus Estimate by 5.3%. However, the top line declines 37.9% from the year-ago quarters level."
165,2025-02-22,Enphase Energy Inc. stock outperforms competitors despite losses on the day Enphase Energy Inc. stock outperforms competitors despite losses on the day
166,2025-02-24,"Enphase Energy, Inc. (ENPH): Among the Technology Stocks with Insider Buying in 2024 We recently compiled a list of the 10 Technology Stocks with Insider Buying in 2024. In this article, we are going to take a look at where Enphase Energy, Inc. (NASDAQ:ENPH) stands against the other technology stocks. Tracking insider buying activity can provide valuable insights into potential investment opportunities. Corporate insiders, such as named executive officers, […]"
167,2025-02-26,Enphase Energy Inc. stock underperforms Tuesday when compared to competitors Enphase Energy Inc. stock underperforms Tuesday when compared to competitors
168,2025-02-27,"Enphase Energy (ENPH) Stock Slides as Market Rises: Facts to Know Before You Trade The latest trading day saw Enphase Energy (ENPH) settling at $63.71, representing a -1.73% change from its previous close."
169,2025-03-01,"Enphase Energy, Inc. (ENPH): Among the Worst Performing Solar Stocks to Buy Now We recently compiled a list of the 10 Worst Performing Solar Stocks to Buy Now. In this article, we are going to take a look at where Enphase Energy, Inc. (NASDAQ:ENPH) stands against the other solar stocks. Solar electricity is a renewable energy source that is produced by converting sunlight into usable power. This conversion occurs […]"
170,2025-03-02,"Why Enphase Energy, Inc. (ENPH) Went Down On Friday? We recently published a list of 10 Battered Stocks on Friday. In this article, we are going to take a look at where Enphase Energy, Inc. (NASDAQ:ENPH) stands against other battered stocks on Friday. The stock market ended the trading week in the green territory, with all major indices gaining more than 1 percent after […]"
171,2025-03-03,"Enphase Energy Increases Deployments of Legacy NEM System Expansion Solution in California California utilities streamline approval process for legacy NEM system expansionsFREMONT, Calif., March 03, 2025 (GLOBE NEWSWIRE) -- Enphase Energy, Inc. (NASDAQ: ENPH), a global energy technology company and the worlds leading supplier of microinverter-based solar and battery systems, today announced increased deployments of its solution for expanding legacy net energy metering (NEM) solar energy systems in California as utilities streamline their approval process. Homeowners can now expand th"
172,2025-03-04,Enphase Energy Inc. stock underperforms Monday when compared to competitors Enphase Energy Inc. stock underperforms Monday when compared to competitors
173,2025-03-04,"Super Micro, Nvidia Among S&P 500s Biggest Losers Amid Market Rout: Heres Why Super Micro Computer was the S&P 500s worst performer Monday, with Nvidia close behind, amid a probe into illegal AI chip shipments to China."
174,2025-03-04,"Enphase Energy, Inc. (ENPH): Among the Cash-Rich Mid Cap Stocks to Buy Now We recently compiled a list of the 10 Cash-Rich Mid Cap Stocks To Buy Now. In this article, we are going to take a look at where Enphase Energy, Inc. (NASDAQ:ENPH) stands against the other cash-rich mid cap stocks. Cash flow is the money moving in and out of a business over a set period. It […]"
175,2025-03-04,The 10 Stocks Hedge Funds Love—and Hate—the Most BofA Securities compiled a list of least and most shorted stocks by hedge funds. They appear to be betting blue chips can keep delivering solid returns.
176,2025-03-05,"Technology Shares Inch Higher, Defying Selloff -- Tech Roundup Technology Shares Inch Higher, Defying Selloff -- Tech Roundup"
177,2025-03-06,"Why Enphase Energy, Inc. (ENPH) Soared on Tuesday We recently published an article titled These 10 Stocks Defied Tuesday’s Bloodbath. In this article, we are going to take a look at where Enphase Energy, Inc. (NASDAQ:ENPH) stands against the other stocks. The stock market fell further into negative territory on Tuesday as trade tensions between the US and its largest trading partners continued. The […]"
178,2025-03-06,"Fidelity Growth Strategies Fund Q4 2024 Review For the quarter, the funds Retail Class shares gained 7.36%, underperforming the 8.14% advance of the benchmark Russell MidcapÂ® Growth Index. Read more here."
179,2025-03-06,"Enphase Energy (ENPH) Outperforms Broader Market: What You Need to Know Enphase Energy (ENPH) concluded the recent trading session at $58.65, signifying a +1.37% move from its prior days close."
180,2025-03-06,"Enphase Energy (NasdaqGM:ENPH) Sees 7% Dip As Latest Earnings Report Shows Sales and Income Drop Enphase Energy (NasdaqGM:ENPH) recently announced an increase in the deployment of solutions for legacy NEM solar systems and launched the IQ Battery 5P, yet its stock price fell by 7% over the last month. The decline comes despite Enphases initiative to support homeowners with energy demands in California and its expansion of grid services programs. The companys latest earnings report showed a drop in sales and net income compared to the previous year, which might have impacted investor..."
181,2025-03-07,ClearBridge Sustainability Leaders Strategy Q4 2024 Commentary The ClearBridge Sustainability Leaders Strategy underperformed its Russell 3000 Index benchmark in the fourth quarter. Click here to read the full commentary. 
182,2025-03-07,"1 Small-Cap Stock with Solid Fundamentals and 2 to Turn Down Small-cap stocks can be incredibly lucrative investments because their lack of analyst coverage leads to frequent mispricings. However, these businesses (and their stock prices) often stay small because their subscale operations make it harder to expand their competitive moats."
183,2025-03-09,"Enphase: The Solar King Will Return Enphases microinverters are technologically superior, but Teslas Powerwall poses significant competition. Read why ENPH stock is a Strong Buy."
184,2025-03-10,"Enphase: Great Disjoint In Execution & Sentiments - Pending Policy Clarity Enphase has already lost most of its value since the December 2022 peak, effectively returning all of its 2021/ 2022 gains. Read my ENPH analysis."
185,2025-03-11,"Enphase Energy Launches Next-Generation IQ EV Charger across Europe FREMONT, Calif., March 11, 2025 (GLOBE NEWSWIRE) -- Enphase Energy, Inc. (NASDAQ: ENPH), a global energy technology company and the worlds leading supplier of microinverter-based solar and battery systems, today announced production shipments of its newest electric vehicle (EV) charger, the IQ® EV Charger 2, in 14 European markets. The IQ EV Charger 2 is a smart charger designed to work seamlessly with Enphase solar and battery systems or as a powerful standalone charger. With advanced energy m"
186,2025-03-11,Why Clean-Energy Stocks Jumped as the S&P 500 Dropped Why Clean-Energy Stocks Jumped as the S&P 500 Dropped
187,2025-03-12,Invesco Equally-Weighted S&P 500 Fund Q4 2024 Commentary The fundâs underweights and stock selection in the information technology and consumer discretionary sectors had the largest negative effect on relative return.
188,2025-03-14,"Enphase Energy (ENPH) Stock Moves -0.8%: What You Should Know Enphase Energy (ENPH) closed at $58.01 in the latest trading session, marking a -0.8% move from the prior day."
