382,2025-06-30,"Stocks to Watch: Meta, Tesla, Wells Fargo, Boeing ↗️ GMS (GMS): The building-products distributor will be bought for about $4.3 billion by Home Depot (HD), which won a bidding war over QXO (QXO). GMS shares jumped 12% early Monday. ↗️ Goldman Sachs (GS), Wells Fargo (WFC): Both stocks rallied in after the Federal Reserve said late Friday that America’s large banks cleared its annual stress test."
383,2025-06-30,"Renewables Slide as Senate Bill Takes Aim at Clean Energy (Bloomberg) -- Republican lawmakers are debating a bill that ramps up President Donald Trump’s assault on wind and solar power, a worse-than-expected jolt to clean energy while providing aid for fossil fuels.Most Read from BloombergPhiladelphia Transit System Votes to Cut Service by 45%, Hike FaresSqueezed by Crowds, the Roads of Central Park Are Being ReimaginedSprawl Is Still Not the AnswerSao Paulo Pushes Out Favela Residents, Drug Users to Revive Its City CenterStruggling Downtowns Are Looki"
384,2025-06-30,"Solar stocks, Moderna, HPE: Trending Tickers Solar stocks such as Enphase (ENPH), SunRun (RUN), and SolarEdge (SEDG) are in focus as changes to the big beautiful bill could introduce new taxes on the industry. Moderna (MRNA) sees promising drug trial results for its combination flu shot and COVID-19 vaccine. HPE (HPE) has reached a settlement with the Department of Justice to allow it to proceed with its $14 billion acquisition of Juniper Networks (JNPR). Check out Yahoo Finances interview with HPE CEO Antonio Neri here. To watch more expert insights and analysis on the latest market action, check out more Morning Brief here."
385,2025-06-30,"Big Beautiful Bill Weighs On Hospitals, Renewables Before Vote; S&P 500 Futures Rise President Donald Trumps One Big Beautiful Bill Act is expected to come to a vote in the Senate today and clear the House as soon as Wednesday.  The Senate also took a tougher line on renewable energy tax credits, which prompted Tesla CEO Elon Musk to weigh in against the bill.  The reality of the bills tough trade-offs burst into the open on Sunday night, as Sen. Thom Tillis (R-N.C.) denounced Medicaid provisions that he said would cost his state $26 billion in support and kick 663,000 North Carolinians off their health plans."
386,2025-06-30,"Jim Cramer on Enphase: “A Roughed Up Solar Company” Enphase Energy, Inc. (NASDAQ:ENPH) is one of the top 10 S&P 500 winners of the day that Jim Cramer highlighted. During the episode, Cramer called it a “roughed up solar company,” as he said: “At the top of that list, that sainted list today, Enphase Energy, oh boy, a roughed up solar company. Oh, it’s […]"
387,2025-06-30,"Senate budget plan ’very bearish’ for renewables, says Morgan Stanley Investing.com -- The latest draft of the Senate’s budget reconciliation bill could deal a significant blow to the renewable energy sector, with Morgan Stanley calling the changes “very bearish for renewables.”"
388,2025-07-01,Late tweaks to Trump tax bill create green power winners and losers Renewable power shares whipsawed on Monday as new revisions to Donald Trump’s spending plan created a division of haves and have-nots in the...
389,2025-07-01,"These Stocks Moved the Most Today: Sunrun, GMS, Oracle, HPE, Juniper Networks, Robinhood, Palantir, and More Sunrun is rising sharply after the Senate’s latest version of the tax-and-spending megabill includes some relatively positive changes for some companies in the solar industry, while GMS jumps after reaching an agreement to be acquired by Home Depot."
390,2025-07-01,"Enphase Energy Board of Directors Affirms Re-election of Thurman John Rodgers as Director of the Board FREMONT, Calif., June 30, 2025 (GLOBE NEWSWIRE) -- Enphase Energy, Inc. (NASDAQ: ENPH), a global energy technology company and the worlds leading supplier of microinverter-based solar and battery systems, today announced that its Board of Directors, excluding Thurman John (T.J.) Rodgers, unanimously voted to retain Mr. Rodgers as a member of the Board of Directors. The decision followed a recommendation of the Nominating and Corporate Governance Committee of the Board, also conducted without Mr"
391,2025-07-02,"What to Expect From Enphase Q2 2025 Earnings Report Enphase is slated to report its fiscal second-quarter earnings later this month, with analysts forecasting a triple-digit increase in profits."
392,2025-07-02,"Enphase Energy, Inc. Launches Next-Generation Iq Ev Charger 2 in Australia and New Zealand Enphase Energy, Inc. announced production shipments of its newest electric vehicle charger, the IQ®? EV Charger 2, in Australia and New Zealand. The IQ EV Charger 2 is a smart charger built to work..."
393,2025-07-02,"Renewables stocks rally as U.S. Senate drops excise tax Investing.com -- Renewable energy stocks surged after the U.S. Senate removed a widely criticized excise tax from its sweeping GOP tax bill, offering relief to a sector that had feared significant headwinds under the Trump administration."
394,2025-07-02,"Enphase: Big Beautiful Bill Act Triggers Growth Risks - Bottom Not Found ENPHs pain has yet to end, as observed in the consistently discounted valuations and the -87.6% stock price meltdown since the December 2022 peaks."
395,2025-07-02,"Sunrun, SolarEdge, and Other Solar Stocks Jump as Republicans Strip Excise Tax From Spending Bill Sunrun  surged 13%,  SolarEdge Technologies  rose 9.7%, and  Enphase Energy  was up 7.3%.  Shares of  First Solar  the largest solar manufacturer in the U.S., were up 1.5%, while  NextEra Energy  a leading provider of wind and solar power, gained 2.9%."
396,2025-07-02,"These 3 Stocks Have Been the Worst Performers in the S&P 500 This Year. Have They Bottomed Out? The S&P 500 has recovered from a tough start to 2025, but the stocks listed here are all down more than 35%.  Many stocks are now trading near their all-time highs, and so is the S&P 500, which is up around 5.5% through the first six months of the year.  The three biggest losers in the index at the halfway point of the year are Deckers Outdoor (NYSE: DECK), Enphase Energy (NASDAQ: ENPH), and UnitedHealth Group (NYSE: UNH)."
397,2025-07-02,S&P 500 Rallies 5% In June To Close Month At Record High The S&P 500 extended its now two-and-a-half-month rally through June to end the month at a record high.
398,2025-07-02,"Solar Firms Surge as Senate Drops Excise Tax From Trump Bill (Bloomberg) -- Shares for solar companies rose on Tuesday on the Senate’s decision to remove an excise tax on wind and solar projects from President Donald Trump’s tax and spending bill.Most Read from BloombergStruggling Downtowns Are Looking to Lure New CrowdsPhiladelphia Transit System Votes to Cut Service by 45%, Hike FaresSprawl Is Still Not the AnswerCalifornia Exempts Building Projects From Environmental LawShares in Sunrun Inc. were up about 11%, Enphase Energy Inc. was up about 4% and So"
399,2025-07-02,"Solar stocks jump, casino names surge, Ford Q2 sales increase Yahoo Finance anchor Josh Lipton covers the trading days top stories in this segment of Market Minute. Solar stocks Sunrun (RUN), SolarEdge (SEDG), and Enphase (ENPH) climb as President Trumps tax and spending bill clears the Senate. Casino stocks, including Las Vegas Sands (LVS), Wynn Resorts (WYNN), and MGM Resorts (MGM), surge after Macaus June gaming revenue beats expectations. Ford (F) stock gains after the company reported a 14.2% increase in second quarter US sales, driven by strong demand for trucks, hybrids, and SUVs. Stay up to date on the latest market action, minute-by-minute, with Yahoo Finances Market Minute."
400,2025-07-03,"Obvious Losers, Unexpected Winners As Tax Bill Passes Senate Hydrogen, battery storage, coal (for steelmaking), and nuclear stocks rose on incentives, tax credit extensions, and domestic sourcing carveouts."
