189,2025-03-18,"S&P 500 Gains and Losses Today: Index Ticks Higher Ahead of This Weeks Fed Decision The S&P 500 edged up 0.6% on Monday, March 17, after a report showed retail sales recovered in February but fell short of expectations."
190,2025-03-18,"Enphase Energy Applauds New Rapid Shutdown Standard for Solar Installations in Brazil FREMONT, Calif., March 18, 2025 (GLOBE NEWSWIRE) -- Enphase Energy, Inc. (NASDAQ: ENPH), a global energy technology company and the worlds leading supplier of microinverter-based solar and battery systems, today commended the introduction of Brazils new fire safety standard, Brazilian Association of Technical Standards (ABNT) NBR 17193, which outlines stringent recommendations like rapid shutdown functionality requirements for solar installations in all buildings. The new standard emphasizes t"
191,2025-03-20,"Enphase Energy (ENPH) Surpasses Market Returns: Some Facts Worth Knowing In the latest trading session, Enphase Energy (ENPH) closed at $62.31, marking a +1.52% move from the previous day."
192,2025-03-21,Canadian Solar to Supply 100 MW Battery Energy Storage in Arizona CSIQ inks a contract to deliver 576 MWh DC of Battery Energy Storage in Arizona.
193,2025-03-23,"Is Enphase Energy (ENPH) The Best Alternative Energy Stock to Buy Now? We recently published a list of 11 Best Alternative Energy Stocks to Buy Now. In this article, we are going to take a look at where Enphase Energy, Inc. (NASDAQ:ENPH) stands against other best alternative energy stocks to buy now. The global energy market is going through a massive change as alternative energy sources are […]"
194,2025-03-25,"Enphase Energy Inc. stock rises Monday, still underperforms market Enphase Energy Inc. stock rises Monday, still underperforms market"
195,2025-03-25,"Is Enphase Energy, Inc. (ENPH) the Most Profitable Lithium Stock to Invest In? We recently published a list of 8 Most Profitable Lithium Stocks to Invest In. In this article, we are going to take a look at where Enphase Energy, Inc. (NASDAQ:ENPH) stands against other most profitable lithium stocks to invest in. The lithium market has proven to be a crucial driver as the world moves toward […]"
196,2025-03-25,"ICLN: Stuck Between A Rock And A Hard Place ICLN ETF faces challenges despite clean energy trends, with 48.5% losses since 2021."
197,2025-03-26,"Enphase Energy (ENPH) Rises Higher Than Market: Key Facts Enphase Energy (ENPH) closed at $62.77 in the latest trading session, marking a +0.98% move from the prior day."
198,2025-03-26,"Is Enphase Energy Inc. (ENPH) the Best Solar Stock to Buy in 2025? We recently published a list of 10 Best Solar Stocks to Buy in 2025. In this article, we are going to take a look at where Enphase Energy Inc. (NASDAQ:ENPH) stands against other best solar stocks to buy in 2025. Solar energy has become a key driver in the global shift toward sustainable power. It […]"
199,2025-03-26,"A Look At The Intrinsic Value Of Enphase Energy, Inc. (NASDAQ:ENPH) Key Insights Using the 2 Stage Free Cash Flow to Equity, Enphase Energy fair value estimate is US$58.24 Enphase..."
200,2025-03-26,"Allspring Global Long/Short Equity Fund Q4 2024 Commentary With a return of -3.20%, the Allspring Global Long/Short Equity Fund underperformed its Index benchmark in Q4 2024. Click here to read the full commentary. "
