1,Enphase Energy to Post Q3 Earnings: Whats in Store for the Stock? ENPHs Q3 results are expected to reflect dismal top-line performance due to continued weak demand in the United States and Europe. Restructuring and impairment charges might have hurt earnings.
2,"Is Enphase Energy, Inc. (ENPH) the Best High Growth Lithium Stock to Invest In? We recently compiled a list of 10 High Growth Lithium Stocks to Invest In. In this article, we will look at where Enphase Energy, Inc. (NASDAQ:ENPH) ranks among high growth lithium stocks to invest in. Lithium Prices Drop but Demand Signals Long-Term Gains Rio Tinto announced its acquisition of U.S.-based Arcadium for $6.7 billion, positioning […]"
3,"Heres Why Enphase Energy (ENPH) Gained But Lagged the Market Today Enphase Energy (ENPH) reachead $91.64 at the closing of the latest trading day, reflecting a +0.08% change compared to its last close."
4,Tuesdays Earnings Slate Tuesdays Earnings Slate
5,"Enphase reports weaker quarter, and this time its U.S. business is not the problem Enphase reports weaker quarter, and this time its U.S. business is not the problem"
6,"Social Buzz: Wallstreetbets Stocks Mostly Lower Premarket Wednesday; Enphase Energy, McDonalds to Decline Social Buzz: Wallstreetbets Stocks Mostly Lower Premarket Wednesday; Enphase Energy, McDonalds to Decline"
7,"Top Stock Movers Now: Enphase Energy, AT&T, Coca-Cola, and More U.S. equities lost ground at midday after several companies reported weaker-than-expected results and bond yields continued to rise."
8,"Enphase Energy Sales Plunge on Weak European Demand Enphase Energy was the biggest decliner in the S&P 500 Wednesday, a day after missing third-quarter profit and sales forecasts as demand in Europe slumped."
9,"Enphase Energy Reports Financial Results for the Third Quarter of 2024 FREMONT, Calif., Oct. 22, 2024 (GLOBE NEWSWIRE) -- Enphase Energy, Inc. (NASDAQ: ENPH), a global energy technology company and the world’s leading supplier of microinverter-based solar and battery systems, announced today financial results for the third quarter of 2024, which included the summary below from its President and CEO, Badri Kothandaraman. We reported quarterly revenue of $380.9 million in the third quarter of 2024, along with 48.1% for non-GAAP gross margin. We shipped 1,731,768 micr"
10,"Enphase Stock Dives After Earnings Miss. Sunrun, SolarEdge Hit as Sector Struggles. While the companys revenue in the U.S. increased from the previous quarter, it was hit by a decrease in Europe."
11,Wall Street Lunch: Boeing Loses $6 Billion Is all the bad news priced in now for Boeing? (Stocks slump on chip weakness. Nvidia mea culpa.
12,"McDonalds stock slips, Starbucks dips, and other movers McDonalds stock slips, Starbucks dips, and other movers"
13,"Enphase Stock Dives After Earnings—and Takes Sunrun, SolarEdge With It Enphase Stock Dives After Earnings—and Takes Sunrun, SolarEdge With It"
14,Why have solar stocks have been so volatile? One reason: The specter of  a Republican victory in November. The Invesco Solar ETF (TAN) is down 28% since the start of 2024 amid a difficult year for solar. Investors are worried about the election and interest rates.
15,"Jim Cramer on Enphase Energy, Inc. (ENPH): ‘I Don’t Want You To Sell It All The Way Down Here’ We recently compiled a list of the Jim Cramer on Tesla and Other Stocks. In this article, we are going to take a look at where Enphase Energy, Inc. (NASDAQ:ENPH) stands against the other stocks Jim Cramer is talking about. Jim Cramer, host of Mad Money, emphasized the ongoing significance of fossil fuels in supporting technological […]"
16,"Enphase Energy price target lowered to $129 from $144 at Seaport Research Seaport Research lowered the firm’s price target on Enphase Energy (ENPH) to $129 from $144 and keeps a Buy rating on the shares. The company provided a surprisingly negative update on Europe, which the firm believes is due to the company struggling to navigate some of the regulatory/economic challenges for its core market trio and its inability to ramp new products/territory fast enough elsewhere to compensate, the analyst tells investors. The firm maintains its Buy rating on the stock, believi"
17,"First Solars Q3 Earnings Miss Estimates, 24 Sales View Revised FSLRs third-quarter earnings and revenues miss the Zacks Consensus Estimate by 6.1% and 17%, respectively."
18,Clean-Energy Stocks Rally as Poll Raises Hope for Harris Win First Solar shares jumped on Monday morning. They also rallied after the Harris-Trump debate in September.
19,Renewable-energy stocks tank after Trump wins White House Renewable-energy stocks tank after Trump wins White House
20,Now Is an Opportune Time To Consider Enphase Stock The company is reasonably and sustainably valued prior to 2025s solar power upcycle commencing
21,Sharp drops in solar stocks translate to sizable paper gains for short sellers Sharp drops in solar stocks translate to sizable paper gains for short sellers
22,"Trump win fuels stock rally: Nasdaq up 400 points, gold plunges Yahoo Finance Anchor Rachelle Akuffo breaks down the top market stories of the day. All major indexes are in the green as investors react positively to the results of the US presidential election. The Nasdaq Composite (^IXIC) is up a notable 400 points today. The race for control of the House of Representatives remains in focus. The Democrats have won 181 seats while the Republicans have 199 seats, with 55 seats yet to be called. However, the Republicans have secured a majority in the Senate. Meanwhile, gold (GC=F) prices are falling as investors shift away from the traditional safe-haven asset and embrace the Trump trade instead. Stocks in the green energy sector that were previously buoyed by the prospect of a Democratic victory are now plummeting in the wake of Trumps win. Another stock in the spotlight is Meta Platforms (META) as the Supreme Court is set to hear an appeal from the tech giant regarding a securities fraud lawsuit today. To watch more expert insights and analysis on the latest market action, check out more Wealth here. This post was written by Angel Smith"
23,"SolarEdge Technologies: Weak Quarter, Disappointing Outlook - Sell SolarEdge Technologies reported another set of disappointing quarterly results. Find out why SEDG stock is a Sell."
24,"Enphase Energy to lay off 17% of workforce Enphase will also streamline its operations by focusing contract manufacturing in four existing locations – two in the United States, one in India and one in China.  The company will cease its contract manufacturing operations in Guadalajara, Mexico, it added."
25,Enphase to lay off workers and end some operations in Mexico Enphase to lay off workers and end some operations in Mexico
26,"Enphase Energy Unveils AI-Powered DIY Permitting Feature for Solargraf, Slashing Solar Permit Plan Creation Times by up to 95% FREMONT, Calif., Nov. 11, 2024 (GLOBE NEWSWIRE) -- Enphase Energy, Inc. (NASDAQ: ENPH), a global energy technology company and the worlds leading supplier of microinverter-based solar and battery systems, announced today a new do-it-yourself (DIY) permit plan feature on Solargraf®, its cloud-based design, proposal, and permitting software platform for solar installers in the United States. The DIY permitting feature uses artificial intelligence and machine learning to automate the complex solar"
27,"Solar Leader Enphase Energy Cutting 500 Jobs California-based Enphase Energy, a company known for its solar power and electric vehicle (EV) charging technology, announced it is laying off about 500 workers. The company in a Nov. 8 […]"
28,The Trump Trade Is Putting Clean Energy Stocks On Sale The AI revolutions massive energy demands create additional growth opportunities for clean energy technologies. Click here for a detailed analysis.
29,Trumps Election Caused a Sell-Off in Clean Energy Stocks. But Is It an Opportunity for These 2 Industry Leaders? Trumps election has caused renewable and electric vehicle (EV) stocks to crash. But these industry leaders could be bargains.
30,"Enphase Energy Powers Up with US-Made IQ Batteries: Unlocking Bonus Tax Credits Enphase Energy, Inc. (NASDAQ:ENPH), a microinverter-based solar and battery system supplier, announced its first shipments of the U.S.-produced IQ Battery 5Ps. These new units are expected to help solar projects qualify for the Domestic Content Bonus Credit, a tax incentive under the Inflation Reduction Act (IRA) designed to boost domestic manufacturing and promote clean energy. The bonus credit targets commercial asset owners, including businesses installing solar systems and PPA/lease provider"
31,"Emerens Q3 Earnings In Line With Estimates, Revenues Fall Y/Y SOLs third-quarter earnings align with the Zacks Consensus Estimate. However, the quarterly revenues miss the consensus estimate by 51%."
32,"Enphase Energy Unveils IQ PowerPack in the United States and Canada ENPH unveils its IQ PowerPack 1500, a portable energy system, which is now available for pre-order in the United States and Canada."
33,What Moved Markets This Week Stay informed with the latest financial news in this Wall Street Breakfast podcast.
34,S&P 500 Rises 5.7% In November To Log Best Month Of 2024 The S&P 500 posted its best one-month performance in November as a post-election stock bump lifted markets broadly. Click to read.
35,"Biggest Winners And Losers Since The Election Of the 13 biggest stock winners, most of them were already big winners leading up to the election, and all but four are currently up over 40% YTD. Click to read."
36,"Enphase Energy Announces Collaboration with Frank Energie in the Netherlands FREMONT, Calif., Dec. 05, 2024 (GLOBE NEWSWIRE) -- Enphase Energy, Inc. (NASDAQ: ENPH), a global energy technology company and the worlds leading supplier of microinverter-based solar and battery systems, announced today a collaboration with Frank Energie, an energy provider in the Netherlands. This strategic relationship will enable Frank Energie customers with Enphase solar and battery systems to participate in the grid imbalance energy marketplace in the Netherlands, which can help maximize"
37,"Why Enphase Energy (ENPH) Is Among the Best Wind Power and Solar Stocks to Invest in Now We recently published a list of 10 Best Wind Power and Solar Stocks To Invest In Now. In this article, we are going to take a look at where Enphase Energy, Inc. (NASDAQ:ENPH) stands against other best wind power and stocks to invest in now. According to a report by the World Economic Forum published […]"
38,Equities Fall Intraday as Traders Await Official Inflation Data US benchmark equity indexes were lower after midday Monday as markets evaluated an inflation survey
39,Sector Update: Energy Stocks Rise in Monday Afternoon Trading Energy stocks climbed Monday afternoon with the NYSE Energy Sector Index rising 1.1% and the Energy
40,"Enphase Energy (ENPH) Stock Drops Despite Market Gains: Important Facts to Note The latest trading day saw Enphase Energy (ENPH) settling at $74.23, representing a -0.3% change from its previous close."
41,Canadian Solar to Supply 315 MWh Battery Energy Storage in Texas CSIQ plans to deliver 315 MWh DC of battery storage solutions in Texas and sell up to 2 GWp of high-efficiency solar modules for various Sunraycer projects.
42,Enphase: Ready To Shine Again Enphase dominates the microinverter segment and benefits from favorable long-term solar energy trends. See why I rate ENPH stock a strong buy.
43,SolarEdge Stock Jumps After Goldman Double Upgrade. Solar Can Shine Again in 2025. SolarEdge Stock Jumps After Goldman Double Upgrade. Solar Can Shine Again in 2025.
44,"Investor Notice: Robbins LLP Informs Stockholders of the Class Action Lawsuit Filed Against Enphase Energy, Inc. SAN DIEGO, Dec. 18, 2024 /PRNewswire/ -- Robbins LLP announces that a shareholder filed a class action on behalf of all investors who purchased or otherwise acquired Enphase Energy, Inc. securities..."
45,"Is SolarEdge At Its Final Edge? Analyzing SolarEdges downfall in 2023-2024, its uncertain future, and whether it is still a viable investment option for investors."
46,"Enphase Energy, Inc. (ENPH): A Bull Case Theory We came across a bullish thesis on Enphase Energy, Inc. (ENPH) on The Finance Corner’s Substack by Kostadin Ristovski, ACCA. In this article, we will summarize the bulls’ thesis on ENPH. Enphase Energy, Inc. (ENPH)’s share was trading at $71.45 as of Dec 20th. ENPH’s trailing and forward P/E were 155.33 and 20.53 respectively according to Yahoo […]"
47,"Why Enphase Energy (ENPH) Is One of the Best Solar Energy Stocks to Buy Now? We recently published a list of 10 Best Solar Energy Stocks To Buy Now. In this article, we are going to look at where Enphase Energy, Inc. (NASDAQ:ENPH) stands against other best solar energy stocks to buy now. During Joe Biden’s presidency, the U.S. solar industry experienced a significant boost, primarily driven by the Inflation […]"
48,Emeren Divests 2.8 MWdc Solar Project in Maine to Altus Power SOL announces the sale of a 2.8 MWdc solar project in Maine to Altus Power.
49,"Enphase: Top Contrarian Pick With Blood In The Streets Enphase upgraded to strong buy - with technological edge over competitors and profitability in a tough solar market, strong growth is on the horizon."
50,"Why Enphase Energy (ENPH) Is One of the Best Environmental Stocks to Invest in Right Now? We recently published a list of the 10 Best Environmental Stocks To Invest In Right Now. In this article, we are going to take a look at where Enphase Energy, Inc. (NASDAQ:ENPH) stands against the other best environmental stocks to invest in right now. The United Nations Climate Change Conference (COP29), held in Baku, Azerbaijan, […]"
