151,Sector Update: Energy Stocks Climb Late Afternoon Energy stocks rose late Tuesday afternoon with the NYSE Energy Sector Index gaining 2.2% and the Ene
152,Supercharging Solar With Quantum Dots Supercharging Solar With Quantum Dots
153,"First Solar, Inc. to Announce Second Quarter 2025 Financial Results on July 31, 2025 TEMPE, Ariz., July 15, 2025--First Solar, Inc. (NASDAQ: FSLR) (the Company) will report financial results for the second quarter ended June 30, 2025, after the market closes on Thursday, July 31, 2025."
154,"This Week In Energy Transition - Innovative Solutions Propel Solar Expansion in Italy Solargik has announced new developments in Italys solar energy sector by signing 85 megawatts (MW) of utility-scale solar projects, aimed at harnessing solar power in regions previously considered unsuitable due to steep or complex terrains. Collaborating with Revalue and Free Ingegneria, the initiative includes projects that employ terrain-adaptive and AgriPV-compatible solar trackers, enabling solar deployment on challenging landscapes and agricultural areas. This expansion is expected to..."
155,"First Solar And 2 Additional Stocks That May Be Priced Below Estimated Value In the last week, the United States market has been flat, though it has risen by 10% over the past 12 months, with earnings forecast to grow by 15% annually. In this context, identifying stocks that may be priced below their estimated value can offer potential opportunities for investors looking to capitalize on undervaluation amidst stable market conditions."
156,Why First Solar (FSLR) Stock Is Up Today Shares of solar panel manufacturer First Solar (NASDAQ:FSLR) jumped 3.1% in the morning session after analysts at Susquehanna raised their price target on the stock.
157,"China’s Stealthy Solar Exports Stay One Step Ahead of US Tariffs (Bloomberg) -- The hum of solar panel factories in this steamy island city doesn’t sound like much. But to American trade officials, it’s the muffled noise of rules being bent — or broken.Most Read from BloombergTrump Awards $1.26 Billion Contract to Build Biggest Immigrant Detention Center in USThe High Costs of Trump’s ‘Big Beautiful’ New Car Loan DeductionCan This Bridge Ease the Troubled US-Canadian Relationship?Salt Lake City Turns Winter Olympic Bid Into Statewide Bond BoomIn recent months"
158,"Mizuho Nudges First Solar Target to $278, Highlights Policy Edge Amid Solar Sector Shake-Up First Solar, Inc. (NASDAQ:FSLR) is one of the stocks that look extremely cheap on paper. On July 14, 2025, Mizuho Securities reiterated its Outperform rating on First Solar and nudged up its price target from $275 to $278, spotlighting the company as a standout beneficiary of U.S. clean‑energy policy despite broader headwinds. Mizuho emphasized that […]"
159,"First Solar Stock Earns Relative Strength Rating Lift In a welcome move, First Solar stock saw its Relative Strength Rating rise from 70 to 76 on Thursday.    When To Sell Stocks To Lock In Profits And Minimize Losses  IBDs unique RS Rating identifies technical performance by showing how a stocks price action over the last 52 weeks compares to that of the other stocks in our database."
160,"First Solar, Inc. Announces Second Quarter 2025 Financial Results and Updates Guidance TEMPE, Ariz., July 31, 2025--First Solar, Inc. (Nasdaq: FSLR) (the Company) today announced financial results for the second quarter ended June 30, 2025, and updated its 2025 guidance."
161,"First Solar Stock Jumps After Q2 Beat and Raised Full-Year Outlook First Solar Lifts 2025 Sales and Earnings Targets, Shares Jump"
162,"5N Plus Enters into New and Expanded Supply Agreement with First Solar; Comes After Q2 Earnings and Revs Beat, and Annual Guidance Increase 5N Plus (VNP.TO), a global producer of specialty semiconductors and performance materials, on Tuesda"
163,First Solar (NASDAQ:FSLR) Strong Profits May Be Masking Some Underlying Issues NasdaqGS:FSLR 1 Year Share Price vs Fair Value Explore First Solars Fair Values from the Community and select yours...
164,5N Plus Outperform Rating Confirmed and Target Raised at National Bank National Bank of Canada on Tuesday maintained its outperform rating on the shares of 5N Plus (VNP.TO
165,"First Solar’s Q2 Earnings Call: Our Top 5 Analyst Questions First Solar’s second quarter results were positively received by the market, as the company delivered above-consensus revenue and profit, and management credited policy tailwinds and effective backlog management for the outcome. CEO Mark Widmar emphasized that strong U.S. module sales, contract termination payments, and higher domestic content contributed to the quarterly performance. The company also benefited from increased demand following federal legislation that tightened restrictions on fo"
166,"Macquarie Climate Solutions Fund Q2 2025 Commentary For 2Q25, Macquarie Climate Solutions Fund Institutional Class shares had positive absolute performance, but underperformed the Funds benchmark, the MSCI ACWI IMI."
167,"First Solar: A Cash-Generative Asset In The Energy Transition First Solar aims for 25GW capacity by 2027, backed by innovative CdTe tech and US incentives. Read here for an analysis of FSLR stock."
168,"First Solar: A Profitable Solar Stock That Gets More Compelling, Risks Remain Discover why FSLRs risk-reward is stronger with 45x tax credits boosting profits, funding U.S. expansions, and driving recovery despite global headwinds."
169,"Energy Transition Today - Streetleaf Expands Team to Boost Sustainable Infrastructure Nationwide Streetleaf, a prominent provider of solar-powered streetlighting services in the U.S., is continuing to strengthen its operations by appointing Brandy Potter and Kristen Proud as new Account Managers to serve customers in Texas and Florida. These appointments aim to enhance Streetleafs customer service and support its mission to advance sustainable infrastructure across communities nationwide. Through the growth of its expert team, the company seeks to accelerate the transition to renewable..."
170,Stock Market Today: Alls quiet on the Wyoming front The Feds premier event is set for later this week
171,"Sunrun and Other Clean-Energy Stocks Rise, Extending Relief Rally Danish wind-turbine maker Vestas was also among the gainers, climbing 15% on Monday.  Fridays Treasury guidance helped spell out when projects will count as “under construction,” which determines which wind and solar farms can claim tax credits.  The Trump administration is phasing out tax credits early, and after a tough year for the sector, some feared the rules could be changed retroactively."
172,"Top Stock Movers Now: Enphase Energy, Zoom, Intuit, and More U.S. equities took off at midday as Fed Chair Jerome Powell indicated interest-rate cuts may be appropriate now."
173,"Canadian Solar Q2 Earnings Miss Estimates, Revenues Rise Y/Y CSIQs Q2 earnings and revenues miss estimates, but rising storage and module sales support year-over-year gains."
174,"2 Mid-Cap Stocks Worth Your Attention and 1 We Ignore Mid-cap stocks often strike the right balance between having proven business models and market opportunities that can support $100 billion corporations. However, they face intense competition from scaled industry giants and can be disrupted by new innovative players vying for a slice of the pie."
175,ICLNs Surge Despite US Rollbacks: Will It Last? Discover if ICLN is right for your portfolio amid US policy shifts and global demand.
176,"Guggenheim Raises First Solar, Inc. (FSLR)’s Price Target First Solar, Inc. (NASDAQ:FSLR) is among the 11 Best Green Stocks to Buy According to Hedge Funds. Guggenheim analyst Joseph Osha upgraded First Solar, Inc. (NASDAQ:FSLR) price objective to $287 from $202 on August 22, keeping a Buy rating. The updated value reflects Guggenheim’s revised analysis, which is supported by recent policy developments and industry […]"
177,"FSLR Outperforms Market Over the Past Month: How to Play the Stock? First Solar lifts its 2025 sales outlook after beating Q2 earnings and revenue estimates, fueling investor optimism despite industry risks."
178,"ICLN: Renewable Energy Set For Growth Before Tax Credits Expire The iShares Global Clean Energy offers diversified exposure to global clean energy producers, with a focus on wind, solar, and geothermal sectors. Learn more on ICLN stock here."
179,"ICLN: Favorable Rate Environment, AI Expansion Present An Attractive Buying Opportunity Discover why ICLN is a top renewable energy ETF with strong dividends and AI-driven growth"
180,Trump Offers New Dawn For Solar Stocks. This Is The Next Growth Driver. Solar stocks surged in August after President Donald Trumps administration released tax credit guidance.
181,"Tracking George Soross 13F Portfolio - Q2 2025 Update Read here for an update on Soros Fund Managements Q2 2025 portfolio changes, top holdings, new stakes, and market strategies."
182,"Optimize Financial Raises First Solar, Inc. (FSLR) Stake by 76.7% First Solar, Inc. (NASDAQ:FSLR) is among the most undervalued solar stocks to buy now. According to the recent disclosure with the SEC, Optimize Financial Inc. has increased its position in First Solar, Inc. (NASDAQ:FSLR) by 76.7% in the first quarter. With the purchase of 6,392 shares, the wealth management firm now owns 14,724 shares of […]"
183,"3 Stocks That Could Be Undervalued By As Much As 29.5% As the Nasdaq and S&P 500 reach record highs, investors are closely watching the Federal Reserves upcoming interest rate decision, which could influence market dynamics. In this environment of heightened anticipation and economic shifts, identifying undervalued stocks becomes crucial for those looking to capitalize on potential opportunities in the U.S. market."
184,"Here’s Why Ariel Global Fund Initiated a Position in First Solar (FSLR) Ariel Investments, an investment management company, released its “Ariel Global Fund” second-quarter 2025 investor letter. A copy of the letter can be downloaded here. The second quarter marked a period of extremes. The stocks fell after the “Liberation Day” tariff announcement in early April and rebounded following the pause in tariff implementation. Enthusiasm for artificial […]"
185,"First Solar vs. Emeren: Who Shines Brighter in the Solar Surge? FSLR and SOL are riding the solar surge with contrasting strengths in scale, pipelines and growth strategies."
186,"Renewable energy investing: How to play solar & nuclear RBC Capital Markets analyst Chris Dendrinos sits down with Julie Hyman on Market Catalysts to discuss the best ways to invest in renewable energy as the space loses support under the Trump administration. To watch more expert insights and analysis on the latest market action, check out more Market Catalysts."
187,"First Solar (FSLR) Sees a More Significant Dip Than Broader Market: Some Facts to Know First Solar (FSLR) concluded the recent trading session at $215.73, signifying a -1.58% move from its prior days close."
188,"5 Best AI Revolution Stocks With Room To Run To find the best AI stocks with room to run, we dug deep and beyond the pure plays to find value and price momentum. Click here for 5 Top Stocks."
189,First Solar: Solar Made In US Meets AI-Driven Load Growth Discover why First Solar (FSLR) is set to thrive amid rising US electricity demand. Learn about market growth and challenges.
190,"How the Narrative Around First Solar Is Evolving After Recent Analyst and Policy Shifts First Solar stock has recently seen its consensus analyst price target rise modestly, climbing from $220.16 to $224.13. This uptick comes as Wall Street sentiment shifts in response to new growth drivers and changing policy landscapes. Read on to discover what is fueling this narrative change and how you can stay informed as the story continues to unfold. What Wall Street Has Been Saying Recent analyst commentary on First Solar reflects a noticeable shift toward a more constructive long-term..."
191,"Wall Street’s Hottest Clean-Energy Bet Hits a Ceiling Wood Mackenzie projects community solar to shrink 12% annually through 2030, with only limited upside from favorable state policies."
192,"US Renewable Energy Industry Analysis Report 2025-2033 Featuring GE, First Solar, Sunrun, NextEra Energy, Vestas Wind Systems, Mitsubishi, Siemens, Canadian Solar, Trina Solar, and JinkoSolar The United States Renewable Energy Market is projected to soar to 1,002.13 GW by 2033 from 429.55 GW in 2024, reflecting a CAGR of 3.64% from 2025 to 2033. This robust growth is fueled by technological advancements, investor interest, and supportive governmental policies. Key drivers include federal and state incentives like Renewable Portfolio Standards and tax credits, alongside falling costs and technological innovations in solar PV and wind turbines. The Edison & Sanborn Solar + Energy Stora"
193,Is First Solar (FSLR) Stock Outpacing Its Oils-Energy Peers This Year? Here is how First Solar (FSLR) and Cheniere Energy (LNG) have performed compared to their sector so far this year.
194,"First Solar: Political Overhang Keeps Shares Range-Bound First Solar, Inc. remains a hold due to heavy reliance on government tax credits and policy-driven profitability. Learn more on FSLR stock here."
195,"Buy First Solar Stock Now for AI Energy Growth and Value The largest U.S. solar manufacturer is an AI energy stock investors should consider buying in October for great value, breakout potential, and long-term upside."
196,"First Solar, Inc. to Announce Third Quarter 2025 Financial Results on October 30, 2025 TEMPE, Ariz., October 09, 2025--First Solar, Inc. (NASDAQ: FSLR) (the Company) will report financial results for the third quarter ended September 30, 2025, after the market closes on Thursday, October 30, 2025."
197,"Analysis-Every electron counts: Why renewables stocks are back in play MILAN (Reuters) -A return of fund inflows into renewable energy stocks is helping to breath new life into these companies shares, powering their strongest quarterly rise since the sustainability boom early this decade.  U.S. President Donald Trumps One Big Beautiful Bill and the subsequent move to direct the U.S. Treasury to restrict tax credit rules have hit the renewables industry.  With the outlook improving, Bishop said outflows from BlackRocks active clean-energy strategies had slowed."
198,"How Investors May Respond To First Solar (FSLR) Q3 Results Amid Surging Utility-Scale Solar Demand First Solar recently announced it will report financial results for the third quarter ended September 30, 2025, after the market closes on October 30, 2025, followed by a conference call to discuss the results. Growing anticipation surrounds the upcoming results as industry momentum, policy incentives, and utility-scale solar demand continue to support optimism in the U.S. solar sector. Well explore how analyst expectations for utility-scale solar growth and policy support may impact First..."
199,"Heres Why First Solar (FSLR) Fell More Than Broader Market First Solar (FSLR) closed the most recent trading day at $226.08, moving 3.51% from the previous trading session."
200,"First Solar (FSLR): Assessing Valuation After Analyst Upgrades and Sector Tailwinds First Solar (FSLR) has been attracting attention following a series of upbeat analyst moves, positive sector policy developments, and its impressive year-to-date stock gains. Investors seem increasingly focused on the company’s ongoing momentum. See our latest analysis for First Solar. First Solar has surged to fresh highs after a wave of upbeat sector developments and analyst actions, with its 30-day share price return of 15.4% and a standout year-to-date gain of 25.7%. Behind that momentum..."
