201,"Intuitive Surgical (NasdaqGS:ISRG): New Studies Highlight Robotic Surgerys Role In Expanding Patient Access Intuitive Surgical (NasdaqGS:ISRG) recently published studies highlighting the benefits of Robotic-Assisted Surgery (RAS), but its stock price saw a modest decline of 1.53% over the past month. During this period, the company also secured FDA clearance for a new surgical stapler, which could play a part in enhancing minimally invasive surgeries. Despite these significant announcements, the slight downward price movement aligns broadly with market trends observed in major indexes like the Dow,..."
202,Earnings To Watch: Intuitive Surgical (ISRG) Reports Q1 Results Tomorrow Medical technology company Intuitive Surgical (NASDAQ:ISRG) will be reporting results tomorrow after market close. Here’s what investors should know.
203,Tesla kicks off Mag 7 results as earnings season picks up speed Tesla kicks off Mag 7 results as earnings season picks up speed
204,"Intuitive Surgical warns of tariff impact after upbeat quarterly earnings Investors and analysts are closely monitoring how medical device makers will handle tariffs and whether they expect benefits from foreign currency fluctuations.  Intuitive suggested that an increase in costs for its robotic systems could impede its ability to win future tenders.  The surgical robot maker is considering operational changes to counter tariff impacts on sales and demand but foresees no substantial benefits this year, Jamie Samath, chief financial officer, said in a post-earnings call."
205,"Intuitive Surgical (NASDAQ:ISRG) Surprises With Strong Q1 But Stock Drops Medical technology company Intuitive Surgical (NASDAQ:ISRG) reported Q1 CY2025 results beating Wall Street’s revenue expectations, with sales up 19.2% year on year to $2.25 billion. Its non-GAAP profit of $1.81 per share was 4.4% above analysts’ consensus estimates."
206,"Intuitive Surgical Inc. stock rises Tuesday, still underperforms market Intuitive Surgical Inc. stock rises Tuesday, still underperforms market"
207,Intuitive Surgical Plunges After Saying Tariffs Impact Could Be Material Intuitive Surgical Plunges After Saying Tariffs Impact Could Be Material
208,"Intuitive Announces First Quarter Earnings SUNNYVALE, Calif., April 22, 2025 (GLOBE NEWSWIRE) -- Intuitive (the “Company”) (Nasdaq: ISRG), a global technology leader in minimally invasive care and the pioneer of robotic-assisted surgery, today announced financial results for the quarter ended March 31, 2025. Q1 Highlights Worldwide da Vinci procedures grew approximately 17% compared with the first quarter of 2024.The Company placed 367 da Vinci surgical systems, compared with 313 in the first quarter of 2024. The first quarter 2025 da Vi"
209,"Why Intuitive Surgical, Inc. (ISRG) is Among the Best Stocks That Will Always Grow We recently published a list of 10 Best Stocks That Will Always Grow. In this article, we are going to take a look at where Intuitive Surgical, Inc. (NASDAQ:ISRG) stands against other best stocks that will always grow. The Looming Risk of a Recession in the US Threats of an impending recession are looming over […]"
210,"Dow Jones Futures Jump On Trumps China, Powell Comments; Tesla Rises On Bullish Elon Musk Dow Jones Futures Jump On Trumps China, Powell Comments; Tesla Rises On Bullish Elon Musk"
211,Q1 2025 Intuitive Surgical Inc Earnings Call Q1 2025 Intuitive Surgical Inc Earnings Call
212,Intuitive Surgical Reverses Bullishly As Investors Digest Its Conservative Tariffs-Tied View Intuitive Surgical stock reversed bullishly Wednesday after investors digested the robotic surgery titans conservative outlook.
213,"Stocks to Watch Wednesday: Shopify, Intuitive Surgical, Boeing ↗️ Intuitive Surgical (ISRG): The maker of robotic-surgical systems reported higher profit and revenue but warned that tariffs could hurt its gross margin going forward. Shares rose 5%. ↗️ Shopify (SHOP; CA:SHOP): Shares in the e-commerce platform and other tariff-sensitive Canadian stocks rallied, after the Trump administration pared back some of its trade rhetoric."
214,"Enphase earnings, bullish Duolingo call, Intuitive Surgical outlook Stocks (^GSPC, ^IXIC, ^DJI) rose as President Trump took a softer tone on Fed Chairman Jerome Powell and China tariffs. Enphase Energy (ENPH) shares sank after missing first quarter earnings and revenue expectations, while Duolingo (DUOL) rallied on a bullish $435 price target from Morgan Stanley. Intuitive Surgical (ISRG) trimmed its full-year gross margin outlook, pointing to tariff-related pressure. Stay up to date on the latest market action, minute-by-minute, with Yahoo Finances Market Minute."
215,"Stocks to Watch Recap: IBM, Shopify, Intuitive Surgical, Boeing ? After-Hours Earnings: Shares of IBM, Chipotle Mexican Grill and Las Vegas Sands fell in afterhours trading following post-close earnings announcements. Shares of Texas Instruments, ServiceNow and Whirlpool rose in response to their postmarket earnings."
216,Intuitive Surgical sees FY25 capital expenditures $650M-$750M Sees FY25 tax rate 22%-23%. Says saw particular strength in the U.S. Says rollout of da Vinci five has went according to expectations. Says remains in the regulatory process in Japan and expects feedback from Europe in 2025. Says expects impact to additional cost of sales 1.7% of revenue +/- 30 basis points. Says impact of tariffs to increase each quarter for remainder of the year. Sees FY25 gross margin 65%-66.5% of revenue. Says considering implementation of range of mitigating actions. Says d
217,"Closing Bell Movers: Tesla jumps on Musk plans to pare back his DOGE work In the opening hour of the evening session, U.S. equity futures are sharply higher, tacking on to broad-based gains seen during Tuesday’s regular hours. S&P 500 futures are up 1.6% above 5,400, Nasdaq 100 is up 2% above 18,700, and Dow Industrials are up 1.4% just shy of 40,000. Comments from President Trump that he has no intention of firing Fed Chairman Powell, but rather only prefers him to move faster on cutting rates, are helping restore constructive sentiment and reverse concerns that capi"
218,"Healthcare sector under pressure as market weighs Trump impact The S&P Biotech sector (XBI) has outperformed the S&P 500 (^GSPC) since 2021. Yahoo Finance Senior Health Reporter Anjalee Khemlani sits down with Catalysts host Madison Mills to take a closer look at the healthcare sector (XLV), specifically Medpace Holdings (MEDP) and Intuitive Surgical (ISRG), as uncertainty grows on the impact of President Trumps policy changes. To watch more expert insights and analysis on the latest market action, check out more Catalysts here."
219,"2 Growth Stocks to Buy on the Dip if the Market Crashes Again Earlier this month, the S&P 500 index quickly sank more than 10% after President Donald Trump unveiled tariff rules that threatened the U.S. economy.  The White House held firm to its commitment for nearly a week before the bond market started to crack and a tariff pause was implemented.  The stock market has recovered somewhat, because now we know theres a limit to the amount of economic devastation the present administration is willing inflict in its attempt to bring back manufacturing jobs and force other countries to do what it wants."
220,"Intuitive Surgical, Inc. (ISRG): Among Billionaire Ken Fisher’s Healthcare Stock Picks with Massive Upside Potential We recently published a list of Billionaire Ken Fisher’s 10 Healthcare Stock Picks with Massive Upside Potential. In this article, we are going to take a look at where Intuitive Surgical, Inc. (NASDAQ:ISRG) stands against other Billionaire Ken Fisher’s healthcare stock picks with massive upside potential. The healthcare industry, an essential component of global well-being […]"
221,Baron Health Care Fund Q1 2025 Top Net Purchases And Sales Baron Health Care Fund declined 2.54% in Q1 2025. What were the top net purchases and sales? Click here to find out. 
222,How to Play Defense in the Market if You’re Worried About a Recession How to Play Defense in the Market if You’re Worried About a Recession
223,Franklin Growth Fund Q1 2025 Commentary Franklin Growth Fund underperformed its S&P 500 Index benchmark in the ï¬rst quarter of 2025. Read more here.
224,"Trumps Tariffs Could Impact This Top Growth Stock. Heres Why Its Still a Buy Intuitive Surgicals latest quarterly update was excellent.  President Donald Trumps macroeconomic policies are creating significant uncertainty.  One of them is Intuitive Surgical (NASDAQ: ISRG), a leader in medical devices."
225,Intuitive Announces FDA Clearance Of Da Vinci Single Port For Transanal Local Excision/Resection Intuitive Surgical Inc: * INTUITIVE ANNOUNCES FDA CLEARANCE OF DA VINCI SINGLE PORTFORTRANSANAL LOCAL EXCISION/RESECTIONSource text:Further company coverage: ...
226,"If A Recession Hits, Will Medical Stocks Be A Safe Haven For Investors — Again? Medical stocks could see a resurgence if the economy hits a speed bump due to tariffs. But which health care stocks are worth watching?"
227,"Intuitive Announces FDA Clearance of da Vinci Single Port for Transanal Local  Excision/Resection SUNNYVALE, Calif., May 01, 2025 (GLOBE NEWSWIRE) -- Intuitive (NASDAQ: ISRG), a global technology leader in minimally invasive care and the pioneer of robotic-assisted surgery, announced today that the U.S. Food and Drug Administration (FDA) cleared the da Vinci Single Port (SP) surgical system for transanal local excision/resection, a form of minimally invasive surgery performed through a natural orifice to avoid abdominal surgical incisions for select procedures. This clearance extends the da"
228,"Teslas Rough Quarter, Alphabets Resilience, Chipotles Burrito Slowdown, and More Alphabets ad business keeps putting up huge numbers, but a DOJ breakup, generative AI threats, and potential macro slowdown loom."
229,"Jim Cramer on Intuitive Surgical, Inc. (ISRG): ‘As Relevant As Ever’ We recently published an article titled Jim Cramer Listed 20 Best Performing Stocks of the Last 20 Years. In this article, we are going to take a look at where Intuitive Surgical, Inc. (NASDAQ:ISRG) stands against the other stocks. Discussing two decades of Mad Money, Jim Cramer took a moment to highlight the top-performing stocks since […]"
230,"FDA Expands Intuitive Surgical (NasdaqGS:ISRG) da Vinci SP System for Advanced Colorectal Surgeries Intuitive Surgicals (NasdaqGS:ISRG) recent FDA clearance of the da Vinci Single Port surgical system for transanal local precision marks a significant enhancement in their product lineup for colorectal procedures. This latest advancement complements positive earnings results, which showed a year-over-year increase in both revenue and net income, reflecting solid operational performance. The companys shares rose 3.92% over the past month, closely aligning with market trends driven by overall..."
231,"Prediction: 2 Stocks Will Be Worth More Than Palantir Technologies in 2026 Palantir is currently worth $269 billion, but certain Wall Street analysts think Intuitive Surgical and ServiceNow can top that figure in 2026.  ServiceNow is a leader in IT service management and IT operations software, and recently released AI products are driving revenue growth.  Intuitive Surgical is a technology leader in robotics-assisted surgical systems, and it recently won new approvals from the FDA."
232,Wolfpack Research Says Long Intuitive Surgical May 5 - * WOLFPACK RESEARCH - WE ARE LONG INTUITIVE SURGICALSource text: [https://tinyurl.com/3tj8a4c9]Further company coverage: ...
233,Stock Market Selloff: 4 No-Brainer Stocks to Buy Right Now Now may be a smart time to buy small stakes in these fundamentally robust companies.
234,"Intuitive Surgical Boosts Stock Repurchase Program To $4 Billion Intuitive Surgical Inc: * INTUITIVE SURGICAL INC - ON MAY 1, BOARD AUTHORIZED STOCKREPURCHASE PROGRAM INCREASED TO $4 BILLION - SEC FILINGSource text:Further company coverage: ..."
235,"2 Growth Stocks with Explosive Upside and 1 to Keep Off Your Radar Growth is a hallmark of all great companies, but the laws of gravity eventually take hold. Those who rode the COVID boom and ensuing tech selloff in 2022 will surely remember that the market’s punishment can be swift and severe when trajectories fall."
236,"Franklin U.S. Focused Growth SMA Q1 2025 Commentary Stock markets worldwide were turbulent over 1Q25, with major US equity indexes, the S&P 500 Index, Dow Jones Industrial Average and NASDAQ Composite Index, sustaining overall declines."
237,"Baron Fifth Avenue Growth Fund Q1 2025 Shareholder Letter Baron Fifth Avenue Growth Fund declined during the first quarter of 2025, underperforming its benchmark, the Russell 1000 Growth Index. Read more here."
238,"Stock Picks From Seeking Alphas April 2025 New Analysts In April, Seeking Alpha welcomed 20 new analysts. This article introduces them and showcases some of their top picks. Click here for more quick picks and lists."
239,"2 Stocks I Cant Wait to Buy During the Next Market Correction Intuitive Surgicals lead in the robot-assisted surgery niche appears unassailable.  Sportradar Group is the leading data provider in a rapidly growing market for sports-related information.  Investors never know when the next market correction -- a drop of from 10% to 20% in an index -- is coming, but we know that it will eventually happen."
240,"Got $5,000? 2 Unstoppable Growth Stocks to Buy Now and Hold Forever Investing in stocks, even in this current environment, could pay off in the long run.  With $5,000, investors can buy nine shares of Intuitive Surgical or one of Booking Holdings.  Equity markets have been volatile, the near term looks somewhat uncertain, and President Donald Trumps international trade policies might lead to more severe economic problems down the line."
241,"Intuitive Surgical, Inc. (ISRG): Among the Most Promising Future Stocks According to Hedge Funds We recently published a list of 11 Most Promising Future Stocks According to Hedge Funds. In this article, we are going to take a look at where Intuitive Surgical, Inc. (NASDAQ:ISRG) stands against other most promising future stocks to buy now. The past year has seen investors pour money into futuristic trends such as electric […]"
242,"3 Market-Beating Stocks with Solid Fundamentals Stocks that outperform the market usually share key traits such as rising sales, expanding margins, and increasing returns on capital. The select few that can do all three for many years are often the ones that make you life-changing money."
243,"Q1 Earnings Highlights: Teleflex (NYSE:TFX) Vs The Rest Of The Surgical Equipment & Consumables - Specialty Stocks As the Q1 earnings season wraps, let’s dig into this quarter’s best and worst performers in the surgical equipment & consumables - specialty industry, including Teleflex (NYSE:TFX) and its peers."
244,Q1 Earnings Highs And Lows: LeMaitre (NASDAQ:LMAT) Vs The Rest Of The Surgical Equipment & Consumables - Specialty Stocks Let’s dig into the relative performance of LeMaitre (NASDAQ:LMAT) and its peers as we unravel the now-completed Q1 surgical equipment & consumables - specialty earnings season.
245,"With Competition Rising, Should Investors Give Up On This Top Growth Stock? Intuitive Surgical has had little competition for its famous da Vinci system in the U.S.  Intuitive Surgical (NASDAQ: ISRG) has delivered market-crushing returns over the past two decades, thanks to its leadership in the robotic-assisted surgery (RAS) market.  Part of the companys appeal is that its crown jewel has had little competition."
246,"Intuitive Surgical (ISRG) Fell Due to Investor Rotation Baron Funds, an investment management company, released its “Baron Health Care Fund” first quarter 2025 investor letter. A copy of the letter can be downloaded here. The fund returned 2.54% (Institutional Shares) in the quarter compared to a 3.87% gain for the Russell 3000 Health Care Index (benchmark) and a 4.72% decline for the Russell […]"
247,"Prediction: 3 Stocks That Will Be Worth More Than Palantir Technologies 5 Years From Now Intuitive Surgical is smaller than Palantir, but could be the bigger winner by the end of the decade.  Alibaba could widen its market cap gap with Palantir thanks to artificial intelligence (AI) tailwinds.  Google parent Alphabets challenges shouldnt diminish its current huge size advantage over Palantir."
248,"Invesco Summit Fund Q1 2025 Commentary Equity markets reacted to uncertainty caused by tariff policy, US government upheaval and concerns about overspending on artificial intelligence."
249,"BlackRock Health Sciences Opportunities Fund Q1 2025 Commentary BlackRock Health Sciences Opportunities Fund posted returns of 3.66% (Institutional shares) and 3.60% (Investor A shares, without sales charge) for the first quarter of 2025."
250,"IXJ: Healthcare Sector Dashboard For May This article provides a top-down analysis of the healthcare sector using value, quality, and momentum metrics. Read the full analysis here on Seeking Alpha, updated for May 2025."
251,"Intuitive Announces CEO Transition Effective July 1, 2025 President Dave Rosa promoted to CEOCurrent CEO Gary Guthart to become executive chair of Intuitive’s boardCurrent Board Chair Craig Barratt to become lead independent director SUNNYVALE, Calif., May 15, 2025 (GLOBE NEWSWIRE) -- Intuitive (NASDAQ: ISRG), a global technology leader in minimally invasive care and the pioneer of robotic-assisted surgery, today announced the promotion of President Dave Rosa to chief executive officer, effective July 1, 2025. At that time, current CEO Gary Guthart wil"
252,"Intuitive Surgical Dips After CEO Gary Guthart Unexpectedly Steps Down Intuitive Surgical stock dipped Thursday after the robotic surgery behemoth said CEO Gary Guthart will step down, effective July 1."
253,"Baird says CEO ‘well-equipped’ to further Intuitive Surgical position After Intuitive Surgical (ISRG) announced this morning that President Dave Rosa will be promoted to Chief Executive Officer, Baird said the firm believes Rosa has long been slated to take over the CEO role, given his 29-plus years at the company. The firm, which expects Rosa to be “well-equipped to continue to further ISRG’s position as a best-in-class MedTech growth story,” keeps an Outperform and $575 price target on Intuitive Surgical shares. Published first on TheFly – the ultimate source fo"
254,These 19 stocks at the intersection of AI and robotics could see big sales boosts These 19 stocks at the intersection of AI and robotics could see big sales boosts
255,"2 Stocks That Turned $1,000 Into More Than $8,000 in 10 Years to Buy and Hold Intuitive Surgical and Veeva Systems have crushed the market since 2015.  The average stock market return over the past few decades (without accounting for inflation) is around 10%.  Two examples are Intuitive Surgical (NASDAQ: ISRG) and Veeva Systems (NYSE: VEEV)."
256,Why Is Penumbra (PEN) Down 10.6% Since Last Earnings Report? Penumbra (PEN) reported earnings 30 days ago. Whats next for the stock? We take a look at earnings estimates for some clues.
257,Building Americas Tomorrow: 3 Long-Haul Investments to Consider Berkshire Hathaway should continue its success even after Warren Buffett steps down as CEO.  Enterprise Products Partners plays a critical role in the U.S. energy industry.  Intuitive Surgical has strong long-term growth prospects in the robotic surgical systems market.
258,"Intuitive Surgical, Inc. (ISRG) Stock Moves -0.58%: What You Should Know Intuitive Surgical, Inc. (ISRG) closed at $539.54 in the latest trading session, marking a -0.58% move from the prior day."
259,"30 years of Innovation and Impact: Dan Larsons Inspiring Story Intuitive Patient Day Drs. Baiya Krishnadasan and Abhishek Biswas tour Intuitive facilities with their patient Dan Larson and his wife Cindy Larson. Intuitive employees Robert Du and Darrin Sudaria explain the robotic technology. L to R Abhishek Biswas, MD, Federico Barbagli, and Dan Larson view an Ion Endoluminal System Dr. Biswas, one of Dans physicians, explains to patient Dan Larson and to Federico Barbagli of Intuitive, how he was able to use Intuitives Ion Endoluminal System to support t"
260,"3 Nasdaq 100 Stocks to Research Further The Nasdaq 100 (^NDX) is packed with high-growth companies, and while the market is competitive, some are pulling ahead. A handful of standout businesses are continuing to scale, delivering strong financials and market leadership."
261,"Intuitive Surgical: Moat, Resilience But High Market Expectations Intuitive Surgical (ISRG) remains a robotic surgery leader with strong growth, but high valuation concerns make it a Hold. Read an analysis here."
262,Intuitive Surgical (NASDAQ:ISRG): Strongest Q1 Results from the Surgical Equipment & Consumables - Specialty Group The end of an earnings season can be a great time to discover new stocks and assess how companies are handling the current business environment. Let’s take a look at how Intuitive Surgical (NASDAQ:ISRG) and the rest of the surgical equipment & consumables - specialty stocks fared in Q1.
263,ISRG vs. MDT: Which Robotic Surgery Stock Is a Smarter Buy Now? Intuitive Surgical or Medtronic -- who leads the future of robotic surgery? Heres a comparative analysis to help you make a smart choice for 2025.
264,"Boston Scientific: Old, Reliable; Buy For Their Consistent Growth Boston Scientific leads in MedSurg and Cardiovascular with strong Q1 growth, solid margins, and smart acquisitions. Find out why BSX stock is a buy."
265,"2 Profitable Stocks Worth Investigating and 1 to Think Twice About A company with profits isn’t always a great investment. Some struggle to maintain growth, face looming threats, or fail to reinvest wisely, limiting their future potential."
266,"Intuitive Surgical: More Than Robots - Why Its AI-Powered Platform Deserves A Premium Discover how Intuitive Surgicals innovation, AI integration, and recurring revenue fuel long-term growth in robotic surgery."
267,"Two biopharma stocks to consider outside of Moderna Moderna (MRNA) shares are seeing a boost on Monday after the US Food and Drug Administration (FDA) gave the pharmaceutical giant limited approval for its lower-dose COVID-19 vaccine. Morgan Stanley Investment Management portfolio manager Jason Kritzer shares his perspective on the pharmaceutical industry amid pushback from the Trump administrations Department of Health and Human Services (HHS) Secretary Robert F. Kennedy, Jr. Kritzer also weighs in on pet drug manufacturer Zoetis (ZTS). To watch more expert insights and analysis on the latest market action, check out more Catalysts here."
268,"Surgical Equipment & Consumables - Specialty Stocks Q1 In Review: Integra LifeSciences (NASDAQ:IART) Vs Peers Wrapping up Q1 earnings, we look at the numbers and key takeaways for the surgical equipment & consumables - specialty stocks, including Integra LifeSciences (NASDAQ:IART) and its peers."
269,"Intuitive Surgicals da Vinci 5: Gaining Precision, Power and Potential ISRGs da Vinci 5 is gaining momentum with key innovations like Force Feedback and strong Q1 placements boosting adoption."
270,"Intuitive Surgical, Inc. (ISRG) Outpaces Stock Market Gains: What You Should Know Intuitive Surgical, Inc. (ISRG) closed the most recent trading day at $557.95, moving +1.11% from the previous trading session."
271,"Harbor Health Care ETF Q1 2025 Commentary During the first quarter, the Harbor Health Care ETF returned 2.18% (NAV), outperforming the Russell 3000Â® Growth Health Care Index, which returned 1.99%."
272,Healthcare companies are hiring. Is it time to look for growth stocks in this beaten-down sector? Healthcare companies are hiring. Is it time to look for growth stocks in this beaten-down sector?
273,"Prediction: 2 Nasdaq Stocks Will Be Worth More Than Palantir Technologies in 3 Years Palantir Technologies is currently worth $300 billion, but Shopify and Intuitive Surgical are growing quickly enough to top that figure within three years.  Shopify is the second-largest e-commerce company in the United States and Western Europe as measured by gross merchandise volume.  Intuitive Surgical is the leader in robotic-assisted surgery, and the midyear launch of its da Vinci 5 system should drive continued strength in the business."
274,Intuitive Surgical Stock Falls. The MedTech Company Gets Its First Sell Rating. Deutsche Bank is the first group on Wall Street to issue a Sell rating on shares of Intuitive Surgical.
275,"Tesla, Intuitive Surgical downgraded: Wall Street’s top analyst calls The most talked about and market moving research calls around Wall Street are now in one place. Here are today’s research calls that investors need to know, as compiled by The Fly. Top 5 Upgrades: Redburn Atlantic upgraded Charles Schwab (SCHW) to Neutral from Sell with a price target of $82, up from $65. Schwab is the dominant player in the two fastest growing segments of the U.S. retail wealth management market – the self-directed market and the independent registered investment advisor custod"
276,3 Monster Stocks -- including Nvidia -- to Hold for the Next 10 Years Nvidia has been growing by an average of more than 70% annually.  Intuitive Surgical is the 800-pound gorilla in the robotic surgery world.  Microsoft is huge and getting bigger -- while paying a dividend.
277,"Intuitive Surgical cut to sell at Deutsche Bank Investing.com -- In a note to clients Monday, analysts at Deutsche Bank cut their rating for Intuitive Surgical (NASDAQ:ISRG) to Sell from Neutral, lowering their price target for the stock to $440 from $515 a share."
