188,"U.S. FDA clears first stapler designed for single-port robotic surgery Intuitive’s SureForm 45 stapler available for thoracic, colorectal, and urology proceduresSUNNYVALE, Calif., April 10, 2025 (GLOBE NEWSWIRE) -- Intuitive (Nasdaq: ISRG), a global technology leader in minimally invasive care and the pioneer of robotic-assisted surgery, today announced that the U.S. Food & Drug Administration (FDA) cleared the company’s fully wristed SP SureForm 45 stapler for use with its da Vinci SP surgical system in thoracic, colorectal, and urologic procedures. Like its multi"
189,"AI-Powered Service Robots Redefine Hospitality as Industry Innovators Lead the Charge Facing ongoing labor shortages and rising consumer demands, the hospitality and food service sectors are increasingly turning to artificial intelligence (AI)-driven service robots. These cutting-edge technologies are helping hotels, restaurants, and cafes streamline operations, lower costs, and elevate customer experiences. As the hospitality robotics market is expected to surge to $65.4 billion by 2032 (https://ibn.fm/WxsRw), robotic innovations are swiftly becoming central to addressing workfo"
190,"Nasdaq Market Whiplash: 3 Stocks to Buy Hand Over Fist and Hold for Decades Only a few days ago, the Nasdaq was in a bear market (down 20%-plus from recent all-time highs).  What should investors who are experiencing Nasdaq market whiplash do now?  Alphabet is now quite reasonably valued with a price-to-earnings-to-growth (PEG) ratio of 1.04, based on data from LSEG."
191,"Why Intuitive Surgical (ISRG) Is Among the Best Medical Stocks to Buy According to Billionaires We recently published a list of 10 Best Medical Stocks to Buy According to Billionaires. In this article, we are going to take a look at where Intuitive Surgical, Inc. (NASDAQ:ISRG) stands against other best medical stocks to buy according to billionaires. Why are Healthcare Stocks Under Pressure? Some experts view medical, healthcare, and big […]"
192,"Intuitive Surgical Shares May Rise as FDA Clears SureForm 45 Stapler ISRG secures FDA clearance for the first stapler designed for single-port robotic surgery, advancing minimally invasive procedures and enhancing surgical precision."
193,"Spotting Winners: Teleflex (NYSE:TFX) And Surgical Equipment & Consumables - Specialty Stocks In Q4 The end of the earnings season is always a good time to take a step back and see who shined (and who not so much). Let’s take a look at how surgical equipment & consumables - specialty stocks fared in Q4, starting with Teleflex (NYSE:TFX)."
194,"Intuitive Surgical, Inc. (ISRG) Reports Next Week: Wall Street Expects Earnings Growth Intuitive Surgical (ISRG) possesses the right combination of the two key ingredients for a likely earnings beat in its upcoming report. Get prepared with the key expectations."
195,Penumbra (PEN) Earnings Expected to Grow: Should You Buy? Penumbra (PEN) possesses the right combination of the two key ingredients for a likely earnings beat in its upcoming report. Get prepared with the key expectations.
196,"Gear Up for Intuitive Surgical (ISRG) Q1 Earnings: Wall Street Estimates for Key Metrics Looking beyond Wall Streets top -and-bottom-line estimate forecasts for Intuitive Surgical (ISRG), delve into some of its key metrics to gain a deeper insight into the companys potential performance for the quarter ended March 2025."
197,"Intuitive Surgical, Inc. (ISRG): Among the Innovative Healthcare Stocks to Watch in 2025 In the US, healthcare costs and prices have been increasing. According to the Centers for Medicare & Medicaid Services, U.S. healthcare spending increased 7.5% from 2022 to $4.9 trillion in 2023. In 2023, the healthcare industry made up 17.6% of the US economy, an increase of 17.4% from 2022. The growth of Medicare and private […]"
198,"New Research Explores Access to Minimally Invasive Care and the Impact of Robotic-Assisted Surgery Studies show robotic-assisted procedures enable increased access to minimally invasive careSUNNYVALE, Calif., April 17, 2025 (GLOBE NEWSWIRE) -- Intuitive (NASDAQ: ISRG), a global leader in minimally invasive care and the pioneer of robotic-assisted surgery (RAS), today announced the publication of two studies showing how the availability of RAS helps enable access to high-quality care, improve patient outcomes, particularly in medical deserts, and contributes to the overall growth of minimally"
199,"Q4 Earnings Highlights: LeMaitre (NASDAQ:LMAT) Vs The Rest Of The Surgical Equipment & Consumables - Specialty Stocks Quarterly earnings results are a good time to check in on a company’s progress, especially compared to its peers in the same sector. Today we are looking at LeMaitre (NASDAQ:LMAT) and the best and worst performers in the surgical equipment & consumables - specialty industry."
200,Prediction: 5 Surefire Stocks That Can Generate Life-Changing Wealth by 2035 Historic stock market volatility is a blessing in disguise for opportunistic long-term investors.
