278,"Health Care Down on Medicaid Fears -- Health Care Roundup Health-care companies ticked down amid concerns about potential changes to Medicaid. Drug giant Merck said a new cholesterol-lowering pill worked well in two late-stage trials, boosting the stock..."
279,"Why Intuitive Surgical (ISRG) Shares Are Trading Lower Today Shares of medical technology company Intuitive Surgical (NASDAQ:ISRG) fell 6.2% in the afternoon session after Deutsche Bank cut the stocks rating from Hold to Sell and slashed its price target to $440 from $515, after identifying accelerating competition from lower-cost remanufactured instruments in the Instruments & Accessories segment."
280,"AMD price target, Intuitive Surgical downgrade: Trending Tickers Citi analysts lifted their price target for Advanced Micro Devices (AMD) to $120 from $100, highlighting potential positive catalysts in the second half of the year. Deutsche Bank downgraded Intuitive Surgical (ISRG) to Sell from Neutral and cut its price target for the company to $440. To watch more expert insights and analysis on the latest market action, check out more Wealth here."
281,"ISRG Margin Outlook Dips on Tariffs, Demand Signals Stay Strong Intuitive Surgical trims margin outlook on tariff headwinds, but strong procedure growth and financial resilience bolster its long-term case."
282,"Institutional investors in Intuitive Surgical, Inc. (NASDAQ:ISRG) lost 6.4% last week but have reaped the benefits of longer-term growth Key Insights Institutions substantial holdings in Intuitive Surgical implies that they have significant influence over..."
283,"Healthcare Sector Taps AI Boom via Intuitive Surgical Stock (ISRG) When investors think of artificial intelligence (AI), names like Nvidia (NVDA), Palantir (PLTR), and Alphabet (GOOGL) typically come to mind. But AI’s impact extends well beyond the traditional tech sector. A standout example is Intuitive Surgical (ISRG), the clear global leader in robotic surgery, now making significant strides in integrating AI into healthcare. The company’s latest system, the da Vinci 5, incorporates AI capabilities that could unlock a powerful new and recurring revenue strea"
284,"ISRGs Minimally Invasive Ecosystem Powers Surgical Precision ISRGs robotic platforms, led by da Vinci and Ion, are transforming surgical precision and driving strong stock gains."
285,"Intuitive Surgical (ISRG): Buy, Sell, or Hold Post Q1 Earnings? Over the past six months, Intuitive Surgical’s stock price fell to $516.25. Shareholders have lost 5.3% of their capital, disappointing when considering the S&P 500 was flat. This may have investors wondering how to approach the situation."
286,"ISRG vs BSX: Which Medical Device Stock Has More Room to Run? Boston Scientific offers steady growth with broader exposure, while Intuitive Surgical leads in robotics but faces margin and tariff headwinds."
287,"Virtual Incision Appoints Jim Alecxih as Chief Executive Officer LINCOLN, Neb., June 18, 2025--Virtual Incision Corporation, the developer of the MIRA Surgical System authorized by the FDA through the De Novo regulatory pathway, today announced the appointment of Jim Alecxih as chief executive officer. Alecxih, a recognized commercial leader in the medical device industry, brings more than 30 years of experience advancing transformative surgical technologies worldwide, including a distinguished tenure at Intuitive Surgical, where he played a pivotal role in t"
288,"Weekly Picks: ? VLS Solvable Headwinds, VOS Multi-Year Growth, and ISRGs Valuation Concerns Why Vita Life Science’s is a solid business with solvable headwinds, how 2 massive tailwinds will drive multi-year growth for Vossloh, and why Intuitive Surgical’s strengths don’t outweigh the valuation risks."
289,"Why This Beaten Down Biotech Stock Might Be a Hidden Gem Alphatec stock is risky, but if held for the long term, shares could prove to be a lucrative opportunity."
290,"Deutsche Bank Slashes Intuitive Surgical (ISRG) To Sell from Neutral Intuitive Surgical, Inc. (NASDAQ:ISRG) is one of the best stocks to buy. On June 9, Deutsche Bank slashed its rating for ISRG from Neutral to Sell, trimming the price target from $440 to $515. Deutsche Bank announced that it will hold an investor webinar with Jon Reuter, COO of Keck Hospitals of USC, on June […]"
291,"cultivate(MD) Announces Portfolio Company, Virtual Incision Corporation, Appoints Jim Alecxih as Chief Executive Officer cultivate(MD), a leading medical device venture capital company, is pleased to announce that its portfolio company, Virtual Incision Corporation, the developer of the MIRA Surgical System authorized by the FDA through the De Novo regulatory pathway, has appointed Jim Alecxih as Chief Executive Officer. Alecxih, a recognized commercial leader in the medical device industry, brings more than 30 years of experience advancing transformative surgical technologies worldwide, including a distinguished"
292,"Intuitive Surgical, Inc. (ISRG) Surpasses Market Returns: Some Facts Worth Knowing In the latest trading session, Intuitive Surgical, Inc. (ISRG) closed at $515.09, marking a +1.12% move from the previous day."
293,"Is ISRGs Procedure Growth Enough to Offset Margin Pressures in 2025? Intuitive Surgical raises 2025 procedure outlook after strong Q1 growth, but rising costs and tariff pressure weigh on margins."
294,"ForSight Robotics Secures $125M in Series B Funding, Addressing Global Surgeon Shortage and Exploding Demand for Ophthalmic Surgery YOKNEAM ILLIT, Israel - ForSight Robotics, the pioneer in ophthalmic robotic surgery, announced today it completed a $125M Series B round, led by Eclipse. The investment accelerates the next growth..."
295,"ForSight Robotics raises $125M for cataract surgery platform Anticipating rising demand for ophthalmic surgery but a shortage of surgeons, the Israel-based company said it is developing the world’s first robotic surgery platform for cataracts and other eye diseases."
296,"Intuitive Surgical, Inc. (ISRG) Rises Higher Than Market: Key Facts In the closing of the recent trading day, Intuitive Surgical, Inc. (ISRG) stood at $534.38, denoting a +2.44% move from the preceding trading day."
297,Intuit Hits All-Time High of $775.36; Analyst Upgrades Fuel Rally Shares rose to $775.36; one-year return now at 19.41%.
298,Wolfe upgrades Medtronic as pulsed field ablation may jolt near term growth Investing.com -- Wolfe Research upgraded Medtronic plc to Peer Perform from Underperform saying that an expected ramp‑up of its Affera pulsed‑field ablation (PFA) system could add up to two percentage points to organic revenue and help the medical‑device maker exceed its own 5% growth target in fiscal 2026.
299,"What to Expect From Intuitive Surgicals Next Quarterly Earnings Report Intuitive Surgical is set to release its second-quarter results next month, with analysts projecting single-digit growth in earnings."
300,"Intuitive Surgical, Inc.(NasdaqGS: ISRG) dropped from Russell 1000 Dynamic Index Intuitive Surgical, Inc. dropped from Russell 1000 Dynamic Index..."
