101,Intuitive Surgical Breaks Out After Robotic Surgery Giant Crushes Quarterly Forecasts Intuitive Surgical Breaks Out After Robotic Surgery Giant Crushes Quarterly Forecasts
102,"Stock Market Rises On Tame Inflation, Bank Earnings: Weekly Review Stock Market Rises On Tame Inflation, Bank Earnings: Weekly Review"
103,"Netflix, Procter & Gamble, Johnson & Johnson Report Results In Holiday-Shortened Week Stay ahead of the market with Seeking Alphas Wall Street Week Ahead newsletter."
104,"The Week Ahead Get ready for a busy week on Wall Street! Earnings reports from big names like Netflix, Procter & Gamble, and Johnson & Johnson are on the horizon."
105,Wall Street Week Ahead Stay informed with the latest financial news on Wall Street Breakfast.
106,IYH: Healthcare Dashboard For January iShares U.S. Healthcare ETF has higher fees and lower performance. See why IYH is a top choice and learn about 10 cheaper healthcare stocks this January.
107,"Becton, Dickinson: Hold, Momentum Is Gaining, Just Need More Growth Financial writer rates Becton Dickinson and Co as a hold due to low growth and valuation concerns, despite positive indicators for future growth."
108,"Intuitive Surgical: Second Half 2025 Guidance Is Critical To Maintaining Current Euphoria Intuitive Surgicals strong revenue growth and new product rollouts drive share price surge, but investors should be cautious of extreme valuation. Read my ISRG review."
109,"Intuitive to Establish Direct Presence in Europe With Acquisition By Connor Hart Intuitive Surgical is buying out its technology distributors in Europe. The Sunnyvale, Calif., medical-technology company on Tuesday said it has entered an agreement with Ab..."
110,"Intuitive Announces Plans to Establish Direct Presence in Italy, Spain, Portugal Acquisition of distributor business expands Intuitive’s investment and footprint in EuropeSUNNYVALE, Calif., Jan. 21, 2025 -- Intuitive , a global technology leader in minimally invasive care and..."
111,"Trump is a ‘wild card’ for the stock market, this trader says. He’s buckling up. Trump is a ‘wild card’ for the stock market, this trader says. He’s buckling up."
112,"Baron Health Care Fund Q4 2024 Shareholder Letter Baron Health Care Fund retreated in the fourth quarter of 2024, in line with its benchmark, the Russell 3000 Health Care Index. Read more here."
113,"Intuitive Surgical Posts Higher 4Q Profit, Revenue on Continued Procedure Growth By Connor Hart Intuitive Surgical logged higher profit and revenue in the fourth quarter, boosted by a continued uptick in the use and installation of its robotic surgery system. The..."
114,"Intuitive Announces Fourth Quarter Earnings SUNNYVALE, Calif., Jan. 23, 2025 -- Intuitive , a global technology leader in minimally invasive care and the pioneer of robotic-assisted surgery, today announced financial results for the quarter..."
115,"Intuitive Surgical, Inc. (ISRG) Q4 2024 Earnings Call Transcript Intuitive Surgical, Inc. (NASDAQ:ISRG) Q4 2024 Earnings Conference Call January 23, 2025 4:30 PM ETCompany ParticipantsBrandon Lamm - IRGary Guthart -..."
116,"Dow Jones Futures: S&P 500 Hits High; New Tesla Model Y Launches In U.S., Europe Dow Jones Futures: S&P 500 Hits High; New Tesla Model Y Launches In U.S., Europe"
117,Franklin Growth Fund Q4 2024 Commentary Franklin Growth Fund underperformed its S&P 500 Index benchmark in the fourth quarter. US stocks collectively rose in the fourth quarter of 2024.
118,Dow Jones Falls After Inflation Data; 5 Tech Giants To Buy And Watch Dow Jones Falls After Inflation Data; 5 Tech Giants To Buy And Watch
119,Intuitive Surgical Stock Drops After Earnings Beat. Wall Street Is Still Optimistic. Intuitive Surgical Stock Drops After Earnings Beat. Wall Street Is Still Optimistic.
120,"Stock Market Today: Indexes Close Near Days Lows; Nvidia Ends Winning Streak, Tesla Reverses Lower (Live Coverage) Stock Market Today: Indexes Close Near Days Lows; Nvidia Ends Winning Streak, Tesla Reverses Lower (Live Coverage)"
121,Why Intuitive Surgical Crumbled Despite Its Upbeat Fourth-Quarter Report Why Intuitive Surgical Crumbled Despite Its Upbeat Fourth-Quarter Report
122,"Stryker: A Cool Name For An Awesome Company, But Is It A Buy Ahead Of Earnings? Stryker Corporations innovation and market leadership justify a premium. See why SYK stock is a solid hold with long-term growth potential despite high valuations."
123,"Intuitive Announces $45 Million Donation to the Intuitive Foundation to Promote Health and Advance Education Latest donation brings total contribution to more than $170 millionSUNNYVALE, Calif., Jan. 27, 2025 -- Intuitive , a global technology leader in minimally invasive care and the pioneer of..."
124,NIE: Quarterly Update On An Excellent Equity And Convertible Fund The Virtus Equity & Convertible Income Fund is attracting income-focused investors with its high yield and strong performance. Learn more on NIE CEF here.
125,Intuitive Surgical: The Robot Is Well-Oiled Intuitive Surgical enjoys a great competitive position in minimally invasive surgery. Read why I cannot rate ISRG stock a buy but also not a sell.
126,"Summers Value Partners Q4 2024 Partner Letter In 2024, the Summers Value Fund LP (âthe Fundâ) delivered a net1 return of 27.4%. Click here to read the full letter."
127,"Top Robotics Companies Transforming The Industry In 2025 The robotics industry is experiencing an unprecedented transformation driven by advancements in artificial intelligence, automation, and machine learning."
128,Tracking Jeremy Granthams GMO Capital Portfolio - Q4 2024 Update GMOs portfolio update highlights key stock adjustments and forecasts a promising 9.6% return for International Deep Value assets. See more here.
129,"The Ultimate Healthcare Robotics Stock to Buy With $600 Right Now What is the da Vinci surgical robot?  As mentioned, Intuitive is the maker of the da Vinci, a robotics system used for many minimally invasive procedures, from hernia repair to hysterectomy and gastric bypass surgeries, just to name a few.  The latest version, the da Vinci 5, has been used for more than 40 different procedure types so far."
130,BNY Mellon Global Stock Fund Q4 2024 Commentary The BNY Mellon Global Stock Fund underperformed the MSCI World Index for the fourth quarter of 2024. Read more here.
131,"Why 2025 is a key year for the surgical robotics market Long-time dominator of robotic surgery, Intuitive, is facing a US challenge in the form of Medtronic’s Hugo."
132,"Intuitive Surgical is Known for Selling $1 Million Surgical Robots. But Heres How it Actually Makes Most of its Revenue. Intuitive Surgical (NASDAQ: ISRG), best known for its flagship da Vinci robot, is the global leader in the robotic surgery market.  The da Vinci, available in several versions including the latest da Vinci 5, generates billions of dollars of revenue annually, and this performance has helped the companys stock soar over the near term and the long term.  Considering da Vinci models cost more than $1 million, you would expect this robotic surgery giant to generate most of its revenue through the sales of these platforms."
133,"Intuitive Surgical (ISRG) Rose as its Revenue And Earnings Surpassed Street Expectations Baron Funds, an investment management company, released its “Baron Health Care Fund” fourth quarter 2024 investor letter. The Fund performed roughly in line with the Benchmark, during a challenging quarter for the larger health care industry. A copy of the letter can be downloaded here. The fund declined 9.58% (Institutional Shares) in the quarter compared […]"
134,"Stock-Split Watch: Is Intuitive Surgical Next? Investors are always on the lookout for the next stock split -- for a couple of reasons.  How do you identify the next potential stock-split company?  Today, one that could be next on the list is Intuitive Surgical (NASDAQ: ISRG), the worlds leading robotic surgery company."
135,"Intuitive Surgical, Inc. (ISRG) Stock Moves -0.13%: What You Should Know In the latest trading session, Intuitive Surgical, Inc. (ISRG) closed at $591.01, marking a -0.13% move from the previous day."
136,Hartford Healthcare Fund Q4 2024 Commentary The Hartford Healthcare Fund (I share) underperformed the S&P Composite 1500 Health Care Index during the quarter. Read more here.
137,"Trump Tariff Fears Dent Intuitive Surgical Stock, But Shares Remain In Base Intuitive Surgical sits in a flat base with a Relative Strength Rating at a high level on its weekly chart."
138,"Li Auto, PayPal, Intuitive Surgical: Market Minute Yahoo Finance Host Brad Smith examines the top stories impacting investors as part of todays Market Minute. Li Auto (LI) shares surge after the Chinese automaker unveiled its first all-electric SUV. PayPal Holdings (PYPL) stock is in focus after the fintech company provided insight into its earnings expectations at its investor day Intuitive Surgical (ISRG) shares are under pressure, extending losses for the fourth consecutive day as investors weigh tariff impacts. Stay up to date on the latest market action, minute-by-minute, with Yahoo Finances Market Minute. This post was written by Naomi Buchanan."
139,"Under The Microscope: Looking For Opportunity Among Healthcares Underperformers Many stocks in the healthcare sector have trailed the wider markets, but are there pockets of opportunity? TD Asset Managements Ram Sampath discusses."
140,"Jim Cramer on Intuitive Surgical, Inc. (ISRG): ‘Put That One on the Buy List’ We recently published a list of Jim Cramer Said These 13 Stocks Can Hold Their Value Amid Tariffs. In this article, we are going to take a look at where Intuitive Surgical, Inc. (NASDAQ:ISRG) stands against other stocks that Jim Cramer discussed. Jim Cramer, the host of Mad Money, on Thursday, shared his thoughts on […]"
141,"Intuitive Surgical : 2024 Intuitive ESG Report 2024 Environmental, Social, and Governance Report Transforming the future of healthcare, together. ..."
142,"Intuitive Surgical, Inc. (ISRG) Stock Moves -1.08%: What You Should Know Intuitive Surgical, Inc. (ISRG) closed at $566.98 in the latest trading session, marking a -1.08% move from the prior day."
143,"Astera Labs Appoints Dr. Craig Barratt to Board of Directors Dr. Barratt brings leadership experience in scaling high-growth public and private technology companiesSANTA CLARA, Calif., March 03, 2025 (GLOBE NEWSWIRE) -- Astera Labs, Inc. (Nasdaq: ALAB), a global leader in semiconductor-based connectivity solutions for AI and cloud infrastructure, today announced the appointment of Dr. Craig Barratt to its Board of Directors. Dr. Barratt is a seasoned technology industry veteran with decades of experience as an impactful leader and board member at networki"
144,Nvidias CEO Said The Robotics Era Is Coming. This Company Looks To Lead It. Nvidias CEO Said The Robotics Era Is Coming. This Company Looks To Lead It.
145,ClearBridge All Cap Growth Strategy Q4 2024 Commentary The ClearBridge All Cap Growth Strategy underperformed its Russell 3000 Growth Index benchmark in the fourth quarter. Click here to read the full commentary. 
146,"Intuitive Surgical: Getting Closed To Its Fair Value Intuitive Surgical is investing heavily in AI, AR, leading to future profitability. Learn why ISRG stock may present a buying opportunity."
147,Why Intuitive Surgical Is A Sell Despite Monopoly-Like Business Discover why Intuitive Surgicals monopoly-like position is under threat from emerging competitors like Medtronic and J&J. Explore more details here.
148,"2 Top Growth Stocks to Buy Hand Over Fist in the Nasdaq Correction The Nasdaq has been a surefire winner over the past two years, soaring in the double digits annually.  Investors were optimistic about the potential for a lower interest rate environment ahead and the fact that such a backdrop could benefit high-growth companies.  All of this has fueled revenue growth, and investors have particularly favored companies in the hot areas of artificial intelligence and quantum computing."
149,BMEZ: Recession Fears Making You Sick? Buy This High-Yield Healthcare Fund BlackRock Health Sciences Term Trust is a top pick for high-yield dividends in healthcare. Click here to find out why BMEZ stock is a Buy.
150,"Intuitive Surgical (NasdaqGS:ISRG) Sees 10% Dip Despite Q4 Revenue Surge To US$2 Billion In recent developments, Intuitive Surgical (NasdaqGS:ISRG) experienced a 10% price decline last quarter, a period that included substantial corporate activities and broader market volatility. The companys fourth-quarter results showed impressive growth, with a revenue increase to $2.4 billion and net income rising to $685.7 million. However, market sentiment was likely pressured by a lack of share repurchase activities and changes in executive leadership, which might have unsettled..."
151,Steris Stock Gets Relative Strength Rating Lift A Relative Strength Rating upgrade for Steris shows improving technical performance. Will it continue?
152,"2 Large-Cap Stocks with Solid Fundamentals and 1 to Avoid Large-cap stocks have the power to shape entire industries thanks to their size and widespread influence. With such vast footprints, however, finding new areas for growth is much harder than for smaller, more agile players."
153,Healthcare Sector Trying To Bounce Back ValuEngine features stocks rated buy or strong buy in highly rated sectors. Click to read.
154,"Prediction: These 2 Stocks Will Outperform the Market Through 2030 The more we extend our horizon, the more likely it is that stocks will provide juicy returns.  Leading drugmaker Amgen could have several growth drivers through the end of the decade.  Tepezza remains the only treatment for TED approved in the U.S., and Amgen has also been launching it in other countries."
155,"Is Intuitive Surgical (ISRG) a Buy as Wall Street Analysts Look Optimistic? According to the average brokerage recommendation (ABR), one should invest in Intuitive Surgical (ISRG). It is debatable whether this highly sought-after metric is effective because Wall Street analysts recommendations tend to be overly optimistic. Would it be worth investing in the stock?"
156,"The best areas in the market for retail investors Dakota Wealth Management senior portfolio manager Robert Pavlik joins Wealth host Brad Smith to discuss how retail investors should focus on high-quality companies with strong management and stability, especially during uncertain times. Pavlik suggests Boston Scientific (BSX), Intuitive Surgical (ISRG), and Fair Isaac (FICO) as solid long-term investments. To watch more expert insights and analysis on the latest market action, check out more Wealth here."
157,"Intuitive Surgical, Inc. (ISRG): The Best Biotech Stock to Buy According to Billionaires We recently compiled a list of the 15 Best Biotech Stocks to Buy According to Billionaires. In this article, we are going to take a look at where Intuitive Surgical, Inc. (NASDAQ:ISRG) stands against other best biotech stocks. Although biotech stocks had a “challenging” year in 2024, JPMorgan believes that some of the industry’s companies […]"
158,Will ISRG Stock Drop Continue After da Vinci 5 Recall? Intuitive Surgical faces a Class 2 recall for its da Vinci 5 system due to a pedal issue. Will this affect its 2025 rollout? Investors watch closely!
159,"Intuitive Surgical, Inc. (ISRG) Stock Moves -0.99%: What You Should Know Intuitive Surgical, Inc. (ISRG) reachead $483.95 at the closing of the latest trading day, reflecting a -0.99% change compared to its last close."
160,"Invesco Health Care Fund Q4 2024 Commentary Stock selection in life science tools & services, pharmaceuticals and distributors detracted from relative performance, as did an overweight in health care facilities."
161,"Tracking Philippe Laffonts Coatue Management Portfolio - Q4 2024 Update Coatue Managements 13F portfolio increased from $26.92B to $29.68B. Read here for latest updates like new stakes, top holdings, and major changes in tech giants."
162,"Q4 Earnings Review: Surgical Equipment & Consumables - Specialty Stocks Led by Intuitive Surgical (NASDAQ:ISRG) As the Q4 earnings season comes to a close, it’s time to take stock of this quarter’s best and worst performers in the surgical equipment & consumables - specialty industry, including Intuitive Surgical (NASDAQ:ISRG) and its peers."
163,"Is Intuitive Surgical Stock a Buy? The company has returned 24,000% over its lifetime and has declined 20% from its high. However, investors should read this before buying the dip."
164,"Is Intuitive Surgical Inc. (ISRG) the High-Valuation Stock to Buy According to Billionaires? We recently published a list of 10 High-Valuation Stocks to Buy According to Billionaires. In this article, we are going to take a look at where Intuitive Surgical Inc. (NASDAQ:ISRG) stands against other high-valuation stocks to buy according to billionaires. High-valuation stocks are typically characterized by metrics such as high price-to-earnings (P/E) ratios, price-to-sales ratios, […]"
165,"How Tariffs Are Rocking The Bubblegum And Shoestring Medical Supply Chain Tariff uncertainty has cast a pall over medical stocks. Re-shoring is possible, but expensive, leaving them in a wait-and-see pattern."
166,"Peer-Reviewed Studies on Intuitive’s Force Feedback Technology Demonstrate its Potential to Reduce Force on Tissue and Enhance Surgeon Performance SUNNYVALE, Calif., March 27, 2025 (GLOBE NEWSWIRE) -- Intuitive (NASDAQ: ISRG), a global leader in minimally invasive care and the pioneer of robotic-assisted surgery, announced the publication of two peer-reviewed studies in Surgical Endoscopy, on its first-of-its-kind Force Feedback technology incorporated in the da Vinci 5 surgical system. Force Feedback technology allows surgeons to feel the forces applied to tissue during surgery, such as pushing and pulling. These studies - conducted in th"
167,"Prediction: 3 Stocks That Could Be Worth More Than Tesla 10 Years From Now Tesla (NASDAQ: TSLA) is sporting a market capitalization of $888 billion as I write this.  Tesla may do well from here on out, but its brand and reputation have taken a hit that might last a while.  Here are three stocks I think will have bigger market caps than Tesla in a decade."
168,"Intuitive Surgical, Inc. (ISRG) Stock Moves -0.22%: What You Should Know Intuitive Surgical, Inc. (ISRG) reachead $507.90 at the closing of the latest trading day, reflecting a -0.22% change compared to its last close."
169,"Intuitive Surgical, Inc. (NASDAQ:ISRG): Among the Best Robotics Stocks to Buy According to Billionaires We recently published a list of the 10 Best Robotics Stocks to Buy According to Billionaires. In this article, we are going to take a look at where Intuitive Surgical, Inc. (NASDAQ:ISRG) stands against the other robotics stocks held by billionaires. Robotics Market Outlook The robotics industry has grown modestly over the past few years. […]"
170,"Want $1 Million in Retirement? 3 Stocks to Buy Now and Hold for Decades. Building a retirement portfolio of $1 million or more is within reach for many Americans.  AbbVie (NYSE: ABBV) is a great example of a company that has proved such a capability.  A few years ago, some wondered what would happen to AbbVie after key patents expired for Humira, the companys top-selling drug."
171,TransMedics: The Financial Tipping Point That Will Drive Mass Adoption TransMedics NOP advances organ transplantation with improved outcomes & cost reductions. See why I rate TMDX stock a strong buy right now.
172,The MaM Portfolio: 2025 Q1 Update Discover our focused portfolio of 12 global high-quality stocks & Bitcoin.
173,Impax Global Social Leaders Fund Q4 2024 Commentary Impax Global Social Leaders Fund underperformed the benchmark during the quarter. Positive performance came from Industrials. Read more here.
174,"1 Healthcare Stock with Exciting Potential and 2 to Ignore Healthcare companies are pushing the status quo by innovating in areas like drug development and digital health. Despite the rosy long-term prospects, short-term headwinds such as COVID inventory destocking have harmed the industry’s returns - over the past six months, healthcare stocks have collectively shed 9.5%. This drop was worse than the S&P 500’s 2.3% loss."
175,"2 Unstoppable Stocks That Could Grow More Than 200% in 10 Years Netflix (NASDAQ: NFLX) and Intuitive Surgical (NASDAQ: ISRG) are leaders in their respective industries, and have produced market-beating returns over long periods.  Netflix is a pioneer in the streaming industry, but it now faces a very different landscape than it did in the 2010s when its stock produced life-changing results.  Netflix estimates a $650 billion revenue opportunity where it does business, and its barely scratched the surface of this large market."
176,"Weekly Picks: ⛏️ Barrick Golds Prospects, Intuitive Surgicals Moat, and Tullow Oils Potential Upside This week’s picks cover: why even Tullow Oil’s base case looks decent, how Intuitive Surgical built a Med-Tech powerhouse, and why Barrick Gold cant wait for a commodity super-cycle."
177,"Is Intuitive Surgical (ISRG) One of the Best Healthcare Stocks to Buy According to Billionaires? We recently published a list of 10 Best Healthcare Stocks to Buy According to Billionaires. In this article, we are going to take a look at where Intuitive Surgical, Inc. (NASDAQ:ISRG) stands against other best healthcare stocks to invest in. Healthcare stocks experienced a challenging year in 2024, lagging behind high-growth sectors like tech and […]"
178,"Worried About the Economy? 2 No-Brainer Buys to Shield Your Portfolio. The Nasdaq Composite (NASDAQINDEX: ^IXIC) and the S&P 500 (SNPINDEX: ^GSPC) sank, shifting in and out of correction territory in the first quarter of the year for one big reason: investors have been worried about the economy.  President Donald Trump is putting tariffs on imports, and economists predict this could lead to higher inflation and a slowdown in growth.  Healthcare companies, for example, may excel since people need their medicines or procedures regardless of the economic backdrop."
179,"Medical device stocks slide on Trump tariff news Medical devices, or the medtech sector, are not immune from the reciprocal tariffs announced by Trump yesterday."
180,"Medical device stocks, oil futures, Lamb Weston: Market Minute Josh Lipton goes over some of the top stories on this segment of Market Minute. Medical device stocks like GE Healthcare (GEHC) and Intuitive Surgical (ISRG) saw losses, while pharmaceutical companies remained unaffected by country-specific tariffs. Oil futures (CL=F, BZ=F) are dropping after OPEC Plus announced an unexpected supply increase. Lamb Weston (LW) stock surges after the company exceeded third-quarter earnings expectations. Stay up to date on the latest market action, minute-by-minute, with Yahoo Finances Market Minute."
181,"Down 18%, Should You Buy the Dip on Intuitive Surgical Stock? Intuitive Surgical (NASDAQ: ISRG) was a pioneer in minimally invasive robotic-assisted surgery technology, and its leadership in the field has long been a key edge for the company.  At the time of this writing, global economic concerns and Intuitive Surgicals mixed outlook have caused shares of the medical device giant to drop by about 18% from the all-time high they set in January.  Surgeons performed nearly 2.7 million procedures using Intuitive Surgicals da Vinci system in 2024 alone -- twice as many as five years ago."
182,"Intuitive Surgical Gets Rating Upgrade. No. 1 In Its Industry; Profits, Sales Climbing. Intuitive Surgical shows improving price performance, earning an upgrade to its IBD Relative Strength Rating."
183,"Trump Tariffs Trigger Bear Market. Investor Focus Shifts Here. A bear market takes hold as Trump tariffs hammer stocks. With IBD Leaderboard trimmed to just seven names, safety and preparation are in focus."
184,These 7 Stocks Are Analyst Favorites For Magnificent Earnings Growth These 7 Stocks Are Analyst Favorites For Magnificent Earnings Growth
185,"5 Top Growth Stocks to Buy in the Stock Market Sell-Off Equity markets may be struggling because of President Donald Trumps current economic policies, but that doesnt mean investors should avoid buying stocks right now -- quite the contrary.  History tells us that equities tend to experience strong runs following downturns, so its worth putting money into excellent companies that are being dragged down with along with the broader market.  To that end, lets consider five excellent growth-oriented companies to invest in on the dip: Novo Nordisk (NYSE: NVO), Eli Lilly (NYSE: LLY), Vertex Pharmaceuticals (NASDAQ: VRTX), Intuitive Surgical (NASDAQ: ISRG), and Shopify (NASDAQ: SHOP)."
186,"2 High-Flying Stocks with Exciting Potential and 1 to Ignore You get what you pay for often applies to expensive stocks with best-in-class business models and execution. While their quality can sometimes justify the premium, they typically experience elevated volatility during market downturns when expectations change."
187,Intuitive Surgical (ISRG) Moves 14.3% Higher: Will This Strength Last? Intuitive Surgical (ISRG) saw its shares surge in the last session with trading volume being higher than average. The latest trend in earnings estimate revisions could translate into further price increase in the near term.
