684,2025-06-25,"Eli Lilly Mounjaro Sees Strong Reception in India, Rising Demand Amid Obesity, Diabetes Rates Eli Lilly and Company (NYSE:LLY) is one of the best Fortune 500 stocks to buy according to billionaires. On June 20, Eli Lilly reported a positive reception for its blockbuster drug Mounjaro in India and is now prioritizing meeting the demand in the world’s most populous country, with a population of 1.4 billion. Eli Lilly […]"
685,2025-06-25,"The Weight Loss Drug Market Has Gotten Messy. What to Know. Compounded weight loss drugs have been mostly off the market for about a month, but the weight loss drug industry remains as unsettled as ever.  Earlier this week,  Novo Nordisk   tore up a partnership with the telehealth storefront  Hims & Hers Health  which had allowed Hims to sell the Novo weight loss drug Wegovy at a lower price for cash-paying patients."
686,2025-06-25,"NKTR Stock Soars as Lead Drug Meets Goal in Atopic Dermatitis Study Nektars lead candidate, rezpeg, hits key targets in a phase IIb eczema study, sending shares soaring 156.3% on Tuesday."
687,2025-06-26,"VKTX Initiates Phase 3 Study on Obesity Candidate VK2735 Viking begins phase III VANQUISH program for VK2735, targeting weight loss in obese adults with or without type II diabetes."
688,2025-06-26,"Eli Lilly and Company (LLY) Is Going To Be A “Trillion-Dollar Market Cap,” Says Jim Cramer Eli Lilly and Company (NYSE:LLY) is one of the Jim Cramer Reveals Potential US Rare Earth Trump Card & Discusses These 11 Stocks. Eli Lilly and Company (NYSE:LLY) is one of the most frequently discussed stocks on Cramer’s morning show. He is a fan of the firm not only due to its lead in the […]"
689,2025-06-26,"Eli Lilly: FDA expands Amyvid indication in the US Eli Lilly announces that the Food and Drug Administration has approved updated labeling for Amyvid , an injectable agent used in brain imaging to estimate the density of amyloid plaques in patients..."
690,2025-06-26,"Why Viking Therapeutics, 67% Off Its Recent Highs, Could Still Have An Edge In Obesity Viking Therapeutics stock remains under pressure, but analysts said Wednesday the companys strategy for its Phase 3 studies could pay off."
691,2025-06-26,"Victory Diversified Stock Fund Q1 2025 Commentary In the first quarter, the Victory Diversified Stock Fund A-Shares (without sales charge) underperformed its S&P 500Â®Index benchmark by 95 basis points."
692,2025-06-27,"Touchstone Sands Capital Select Growth Fund Q1 2025 Commentary The Touchstone Sands Capital Select Growth Fund (Class A) outperformed its benchmark Index for Q1 ended March 31, 2025. Click here to read the full commentary. "
693,2025-06-28,"Truist Reiterates Eli Lilly (LLY) Buy Rating on Orforglipron Diabetes Drug Data Eli Lilly and Company (NYSE:LLY) is one of the 12 stocks that will make you rich in 10 years. On June 23, Truist Securities reiterated its “Buy” rating on Eli Lilly stock. The firm also maintained the price target of $1,038.00. Truist’s move followed Eli Lilly’s presentation at the American Diabetes Association (ADA) 85th Annual […]"
694,2025-07-01,Can Protagonist Take On Eli Lillys Next-Generation Obesity Treatment? Protagonist Therapeutics is taking aim directly at Eli Lillys obesity treatment with a newly announced drug that uses the same mechanism.
695,2025-07-01,"Chinas Innogen expects to complete weight-loss drug trials next year Chinese drugmaker Innogenexpects to complete a late-stage clinical trial of itsexperimental weight-loss drug candidate next year, its CEO saidon Tuesday, the latest Chinese company to join the race..."
696,2025-07-02,"Wall Street Bulls Look Optimistic About Lilly (LLY): Should You Buy? The average brokerage recommendation (ABR) for Lilly (LLY) is equivalent to a Buy. The overly optimistic recommendations of Wall Street analysts make the effectiveness of this highly sought-after metric questionable. So, is it worth buying the stock?"
697,2025-07-02,Will AbbVies Acquisition Spree Aid Pipeline Growth? ABBVs $2.1 billion Capstan deal and 20+ recent acquisitions sharpen its pipeline edge across immunology and beyond.
698,2025-07-02,"This GLP-1 Stocks Bad News Could Be a Big Win for Eli Lilly and Novo Nordisk Amgen recently released the full data from a trial involving its GLP-1 drug, MariTide.  More than one-quarter of the participants on the highest dosage of the drug had to stop taking it due to adverse side effects.  There are a lot of healthcare companies that are investing in GLP-1 weight loss drugs."
699,2025-07-03,"Pfizer Trades Above 50-Day Average for a Month: Time to Buy? PFE trades above its 50-day average for over a month, signaling bullish momentum despite COVID revenue declines and patent risks."
700,2025-07-04,"Lilly and Novo Are the Kings of Weight-Loss Drugs. The Companies Coming for Their Crowns. Both well-established and small, clinical-stage pharma companies are investing heavily to be able to someday compete with Lilly and Novo."
