201,2024-12-15,"Meta Platforms, Inc. (META) is Among Billionaire David Tepper’s Top Stock Picks Heading into 2025 We recently published a list of Billionaire David Tepper’s Top 10 Stock Picks Heading into 2025. In this article, we are going to take a look at where Meta Platforms, Inc. (NASDAQ:META) stands against other Billionaire David Tepper’s top stock picks heading into 2025. David Tepper is one investor who stands out in squeezing and […]"
202,2024-12-16,"Meta Can Deliver Big EPS Surprises In 2025, As Competitive Landscape Improves Metas profit margin could soar with diverted TikTok traffic. Find out why META stock is a great buy, with modest valuation and high-growth prospects."
203,2024-12-17,"Why Meta Platforms (META) Is One of the Most Held Stocks by Hedge Funds? We recently published a list of 12 Stocks Most Held by Hedge Funds. In this article, we are going to look at where Meta Platforms, Inc. (META) stands against other most held stocks by hedge funds. On December 12, President-elect Donald Trump rang the opening bell at the New York Stock Exchange, an event rich […]"
204,2024-12-17,"Meta asks California attorney general to block OpenAI’s conversion to for-profit Facebook’s parent company, Meta, is supporting Elon Musk’s effort to block OpenAI’s conversion from a nonprofit company into a for-profit one. As reported by The Wall Street Journal, Meta sent a letter to California attorney general Rob Bonta, arguing that allowing the shift would have “seismic implications for Silicon Valley. And while the company asked Bonta to take “direct action,” it also said Musk and former OpenAI board member Shivon Zilis “are qualified and well-positioned to represent t"
205,2024-12-17,EU privacy regulator fines Meta 251 million euros for 2018 breach DUBLIN (Reuters) -The lead European Union data privacy regulator for Meta fined the social media giant 251 million euros ($263.5 million) on Tuesday for a 2018 Facebook security breach that affected 29 million users.  Meta notified Irelands Data Protection Commission at the time that cyber attackers had exploited a vulnerability in Facebooks code that impacted the View As feature that lets users see what their own profile looks like to someone else.
206,2024-12-18,Meta Price Target Hiked To 700. Social King That Keeps Reinventing Itself. Analysts with Truist Securities raised their price target on Meta stock to 700 and named the company among their top picks.
207,2024-12-18,"Meta Platforms price target raised to $700 from $650 at Truist Truist analyst Youssef Squali raised the firm’s price target on Meta Platforms (META) to $700 from $650 and keeps a Buy rating on the shares as part of a broader research note previewing Internet services for 2025. The firm notes that while its estimates for the stock remain unchanged, it is extending its discount cash flow model by an extra year to capture Meta’s higher growth prospects in the outer years as the company continues to grow faster for longer, the analyst tells investors in a resea"
208,2024-12-18,"2024 Has Been a Year of Extremes in the Stock Market. Can It Last? As extended as some trends have become this year, investors shouldn’t assume that they are about to revert to the mean."
209,2024-12-18,"Meta: Its Time To Sell, Several Reasons To Be Concerned (Downgrade) Metaâs sharp rally and premium valuation justify a downgrade. Find out why META stock faces risks from rising capex, slowing ad growth, and regulatory issues."
210,2024-12-19,"The BATMMAAN tech stocks this strategist has his eye on Step aside Magnificent Seven, the BATMMAAN is here! No, not everyones favorite dark and brooding caped crusader, but the latest rebranding of the top tech stock leaders and outperformers, now including a rising favorite in the AI chip space: Broadcom (AVGO), Apple (AAPL), Tesla (TSLA), Microsoft (MSFT), Meta Platforms (META), Amazon (AMZN), Alphabet (GOOG, GOOGL), and Nvidia (NVDA). Freedom Capital Markets chief global strategist Jay Woods speaks with Yahoo Finance about his position on several of the BATMMAAN components. The one stock in this group that no ones really talking about too much is Apple. Apple is at $3.8 trillion [market cap]. Its the third biggest in the XLK (XLK) now because theyve repositioned that in July, Woods tells Catalysts host Madison Mills. And to me that is a utility stock that just continues to climb. Its AI story is really just coming to our phones as every upgrade comes to our phone. The potential on that upgrade cycle and the utility factor that its been, leads me to believe this could be a $5 trillion company by the end of 2025. Also catch Freedom Capital Markets chief global strategist Jay Woods why the sudden downturn in Nvidia shares and the Dow Jones Industrial Average (^DJI) may not be such a cause for alarm as investors think: To me, this is just a pause. To watch more expert insights and analysis on the latest market action, check out more Catalysts here. This post was written by Luke Carberry Mogan."
211,2024-12-19,"TikTok Ban Headed For Supreme Court. What To Watch For With Meta, Snap Stock. The Supreme Court will hear arguments on the TikTok ban, setting up a showdown with implications for Meta, Oracle."
212,2024-12-19,"3 Top Tech Stocks That Could Make You a Millionaire These companies are already proven winners, but their dominant business models and long-term prospects still make them arguably safe long-term bets for building life-changing wealth for investors."
213,2024-12-19,Amazon Stock Is a 2025 ‘Best Idea’ for Several Analysts. Meta Is Also a Top Pick. Bernstein analyst Mark Shmulik and J.P. Morgan analyst Doug Anmuth both name Amazon stock as a Best Idea for 2025.
214,2024-12-20,"Apple and Meta Are Squabbling Again. This Is Why. The companies have been arguing over user privacy since 2021, when the iPhone maker launched App Tracking Transparency."
215,2024-12-20,"Meta Platforms, Inc. (META): Among Tiger Global Management’s Long-Term Stock Picks We recently compiled a list of the Tiger Global’s 15 Long-Term Stock Picks. In this article, we are going to take a look at where Meta Platforms, Inc. (NASDAQ:META) stands against the other stock picks. Even as the venture capital efforts of Tiger Global Management come under increased scrutiny on the back of reportedly disappointing post-pandemic […]"
216,2024-12-22,Hartford Capital Appreciation Fund Q3 2024 Commentary Hartford Capital Appreciation Fund (I Share) outperformed the Russell 3000 Index during the quarter. Read more here.
217,2024-12-23,Wall Street Lunch: Nordstrom To Go Private Department store chain Nordstrom (JWN) has accepted a $6.25 billion all-cash buyout offer to end its 53-year run as a publicly traded company.
218,2024-12-24,How a Telecom Bureaucrat Learned to Speak Trump FCC regulator Brendan Carr parlayed cell-tower climbs and social-media acumen to become a leading figure in the next administration.
219,2024-12-24,"Will Big Tech Remain Committed to Their Climate Goals in 2025? Big Tech races to meet AI-driven energy demands, with Amazon, Alphabet, Microsoft, and Meta pushing to hit ambitious climate goals by 2025."
220,2024-12-24,UTF: The Decline Sent Distribution To Around 8% Creating A Better Opportunity UTF has established a multi-decade track record of generating income for its shareholders. Read why UTF CEF is a strong investment opportunity.
221,2024-12-24,"Meta, Amazon, DoorDash Shine as Citis Top Internet Stocks for 2025 Citi raises price targets for Meta, Amazon, and DoorDash, highlighting AI innovation and expansion in key sectors."
222,2024-12-25,"AI will be viewed as a national asset for the US under Trump, says one trade group CEO The tech industry is bracing for changes as President-elect Donald Trump returns to the White House in 2025. Chamber of Progress CEO and founder Adam Kovacevic joins Brad Smith and Josh Lipton on Market Domination Overtime to discuss his tech industry outlook. One of the, I think, good pieces of news is that President-elect Trump has appointed a number of people from the tech world, venture capitalists, people with tech experience to prominent positions, Kovacevic says, noting that this is a good sign for the industry. He adds that Trumps second term will likely lead to a shift in the US governments attitude toward AI. The Biden administrations main approach to artificial intelligence was to say, This is an area where we ought to tread carefully, put up guardrails, and focus on safety, Kovacevic says. What I think you are going to see with Trump is a pivot from safety to really [seeing] AI as an economic asset for the United States, a national asset for the United States, where we should go out and beat other countries, particularly China in AI. Watch the video above to hear more about the expected tech landscape in 2025, including the possible TikTok ban, Big Tech execs courting Trump, Musks role in the US government, and more. To watch more expert insights and analysis on the latest market action, check out more Market Domination Overtime here. This post was written by Naomi Buchanan."
223,2024-12-25,Meta Platforms (META) is a Top-Ranked Momentum Stock: Should You Buy? The Zacks Style Scores offers investors a way to easily find top-rated stocks based on their investing style. Heres why you should take advantage.
224,2024-12-25,"Carillon ClariVest Capital Appreciation Fund Q3 2024 Commentary During the third quarter of 2024, stock selection contributed the most to Fund performance, while sector allocation detracted."
225,2024-12-26,"AI Is Reshuffling the Ranks of Utilities Stocks. Here Are the Likely Winners. Once known as safety plays, shares of electricity suppliers are getting a jolt from AI data centers."
226,2024-12-26,Meta: I Missed The Boat But Still Hesitant To Jump In Now Meta may have to deal with a more scrutinizing FTC Chairman. Advertising impressions are slowing down. See why we are cautious on META stock despite recent gains.
227,2024-12-27,Stock Market Today: SoundHound AI Crushes Bears With New High; Heres Why Boeing Is A Blue Chip To Watch (Live Coverage) The stock erased early mild losses and SoundHound AI blistered the bears with a new high. Boeing made five-month highs.
228,2024-12-27,"Prediction: Wall Streets Most Unique Member of the Magnificent Seven Will Become the Hottest Stock-Split Stock of 2025 Among Apple, Nvidia, Microsoft, Alphabet, Amazon, Meta Platforms, and Tesla, theres a dominant company waiting to captivate investors with a historic stock-split announcement."
229,2024-12-27,The AI stock trade is starting to shift beyond the Magnificent 7 Strategists expect the artificial intelligence trade will mature in 2025 to benefit companies beyond those buying and creating new AI chips.
230,2024-12-31,Stocks on Pace for Best Two Years in a Quarter-Century Some investors caution against thinking that the rapid pace of gains can continue because interest rates may remain higher than anticipated.
231,2024-12-31,How major tech stocks could perform in 2025 Tech stocks including Nvidia and Apple continued to have a big influence on market performance this year. Heres how experts think they could perform next year.
232,2025-01-01,"The Peak Hiking a 14er can teach invaluable lessons for investing and life, emphasizing the importance of balancing financial freedom with personal fulfillment. See more."
233,2025-01-02,TikTok Adds More Gen AI Features TikTok continues to add AI options that enhance the user experience.
234,2025-01-03,The 1 Tech Stock That’s Actually a Bargain The 1 Tech Stock That’s Actually a Bargain
235,2025-01-03,Where to Invest Your Money in 2025 Where to Invest Your Money in 2025
236,2025-01-03,"New Orleans Attacker Acted Alone, Authorities Believe Federal and local officials sought to reassure the city after the New Year’s Day rampage, while new details emerged in a separate Las Vegas explosion."
237,2025-01-03,"VONG: Time To Take Some Gains Vanguard Russell 1000 Growth Index Fund ETF holds 394 large- and mid-cap stocks, heavily concentrated in technology and top holdings. Explore more details here."
238,2025-01-03,"Meta’s Clegg to Exit; Kaplan Promoted to Global Affairs Chief (Bloomberg) -- Meta Platforms Inc. said Nick Clegg will step down as the social media company’s president of global affairs. Joel Kaplan, Clegg’s deputy, was named to replace him as policy chief.Most Read from BloombergIs This Weird Dome the Future of Watching Sports?NYPD Seeking Gunmen After 10 People Wounded Outside Queens VenueDetroit’s Michigan Central Is the Building Revival Story of 2024Burned Out Parents Need Better Public SpacesA Commuting Resolution for 2025: Ride Your Local Subway or B"
239,2025-01-03,"Nvidia stock jumps, leads Magnificent 7 gains to start 2025 after end-of-year tech sell-off Nvidia stock led the so-called “Magnificent 7” tech stocks higher to start the year after a group-wide selloff in the last days of 2024."
240,2025-01-03,"Nick Clegg banked £24m from Facebook owner before exit Sir Nick Clegg has made at least £24m in share sales while working at Meta, filings from the social media giant have revealed."
241,2025-01-03,"The scary incentive companies have given Trump Major corporations — including the likes of Amazon (AMZN), Meta (META), and Uber (UBER) — have each committed at least $1 million to President-elect Donald Trumps inauguration fund. Gautam Mukunda, Yale School of Management executive fellow and author of Picking Presidents, joins Market Domination Overtime to analyze the growing corporate support for Trumps second term. Mukunda asserts that companies are being pragmatic in their support for Trump, pointing out Trumps historical willingness to use federal government power against those he perceives as political enemies or threats. He references Trumps previous conflicts with Jeff Bezos during his first term, when Trump targeted Bezos over his ownership of the Washington Post. Mukunda observes, Trump is very transactional, and these companies are making a transaction. However, he warns, When you have said I will pay up if you threaten me, the incentive you have created is to keep threatening you in order to get more payouts, adding that these companies will learn the hard way. To watch more expert insights and analysis on the latest market action, check out more Market Domination Overtime here. This post was written by Angel Smith"
242,2025-01-04,"TikTok offers early 2025 test for Supreme Court The Supreme Court will hear several cases in 2025 with dramatic implications for corporate America, starting with the question of a looming US ban of the TikTok app."
243,2025-01-05,"Facebook parent Meta faces increased scrutiny over alleged Palestinian censorship Meta Platforms, the parent company of Facebook and Instagram, is facing increased scrutiny and attention over its censorship of pro-Palestinian and anti-Israeli content as the war goes on from human..."
244,2025-01-06,"Is Meta Platforms Inc (NASDAQ:META) Among Israel Englander’s Top Stock Picks Heading Into 2025? We recently compiled a list of the Billionaire Israel Englander’s Top 10 Stock Picks Heading Into 2025. In this article, we are going to take a look at where Meta Platforms Inc (NASDAQ:META) stands against the other stock picks. Israel Englander has always inspired the investment world by founding and managing the second-most profitable hedge fund […]"
245,2025-01-06,"Big Tech Comes Of Age – These Three Big Tech Stocks Began Paying Shareholder Dividends For The First Time In 2024 Every publicly traded company passes several important milestones on the road to success. Examples of those milestones for Big Tech companies include getting seed funding, successfully exiting from the startup stage and having an IPO. In 2024, three ..."
246,2025-01-07,Are ‘Magnificent Seven’ bonds now worth buying after months-long selloff? Are ‘Magnificent Seven’ bonds now worth buying after months-long selloff?
247,2025-01-07,"Meta Ends Fact-Checking on Facebook, Instagram in Free-Speech Pitch Meta Ends Fact-Checking on Facebook, Instagram in Free-Speech Pitch"
248,2025-01-07,Facebook dumps fact-checkers in attempt to ‘restore’ free speech Facebook is to scrap its fact-checking programme after founder Mark Zuckerberg pledged to “restore free expression” on the social network.
249,2025-01-07,Stock Market Today: Dow Jones Firm As Jensen Huang CES Speech Looms; Palantir Mauled On This (Live Coverage) The Dow Jones fell on the stock market today amid Trump tariff news. Nvidia rallied ahead of a CES appearance by CEO Jensen Huang.
250,2025-01-07,"AppLovin, Nvidia, Tesla, Broadcom, and Meta Lead Nasdaqs Tech Surge in 2024 Nvidia stock rose 180% in 2024, fueled by demand for AI chips and new software offerings."
251,2025-01-07,"Meta Gets Price Target Hike. Analyst Says Facebook Parent Could Be Best Consumer AI Play. Meta stock could offer 2025s best AI play in the consumer space, according to Jefferies analysts, who hiked their Meta price target."
252,2025-01-08,Trump Threatens Greenland and the Panama Canal. DJT Stock Is Falling. Trump Threatens Greenland and the Panama Canal. DJT Stock Is Falling.
253,2025-01-08,"We do not censor social media, EU says in response to Meta The European Commission rejected on Wednesday Meta chief Mark Zuckerbergs assertion that European Union data laws censored social media and said they only required large platforms to remove illegal..."
254,2025-01-08,Brazil prosecutors question Meta over changes to fact-checking program Brazilian prosecutors on Wednesday ordered that social media platform Meta clarify whether recently announced changes to its fact-checking program in the United States will also be applied to the...
255,2025-01-09,"Dividend Harvesting Portfolio Week 201: $20,100 Allocated, $1,932.03 In Projected Dividends Read here for an analysis of S&P 500 performance in 2024 and Dividend Harvesting Portfolio growth, setting goals for 2025 and sector focus."
256,2025-01-09,"How claims of Left-wing bias threaten to crush the fact-checking machine When Mark Zuckerberg announced an overhaul of fact-checking on Facebook this week, he was damning in his assessment of independent verifiers."
257,2025-01-10,"Fact-Check - Meta Fights For Money, Not Speech Meta CEO Mark Zuckerberg said that he pulled the companyâs fact-checking program in the United States and instead will leave it to community members to flag contentious posts. Read more here"
258,2025-01-11,"Trump, Zuckerberg meet at Mar-a-Lago, Semafor reports Meta CEO Mark Zuckerberg met with U.S. President-elect Donald Trump at Mar-a-Lago on Friday, Semafor news website reported, citing a source familiar with the matter. ..."
259,2025-01-11,"Social media stocks Snap, Meta gain after Supreme Court hearing on TikTok Shares in social media companies Snap Inc (NYSE:SNAP), Meta Platforms Inc (NASDAQ:META) rose after a Supreme Court hearing on Friday, signaling support for upholding a potential ban on TikTok in the United States."
260,2025-01-11,"A Dozen Stocks Im Buying As Rising Interest Rates Break The Market Financial writer discusses the impact of interest rates on S&P 500 and REITs, Baby Boomers economic influence, and dividend growth stock choices."
261,2025-01-13,Meta Stock Falls. Why Analysts Are Being ‘More Cautious.’ Meta Stock Falls. Why Analysts Are Being ‘More Cautious.’
262,2025-01-13,A TikTok Ban Won’t Make Snap a Winner. Take It From This Social Media Editor A TikTok Ban Won’t Make Snap a Winner. Take It From This Social Media Editor
263,2025-01-14,"Franklin DynaTech Fund Q4 2024 Commentary As a result of stock selection and allocation decisions, the fund underperformed its benchmark as seven out of 11 equity sectors detracted. Read more here."
264,2025-01-14,Snap and Meta Stocks Fall as TikTok Attracts Last-Minute Takeover Talk Snap and Meta Stocks Fall as TikTok Attracts Last-Minute Takeover Talk
265,2025-01-14,"Communications Services Down Amid TikTok Concerns - Communications Services Roundup Communications services companies ticked down as traders awaited the fate of TikToks U.S. operations. If it is an outright ban, this begs another question: which companies benefit from the 175..."
266,2025-01-14,GreensKeeper Value Fund Q4 2024 Letter The GreensKeeper Value Fund finished the year 2024 +23.6% net of fees and expenses. Click here to read the full fund letter. 
267,2025-01-14,"Dow Jones Rises On Surprise Inflation Report; Nvidia, Tesla Rally Dow Jones Rises On Surprise Inflation Report; Nvidia, Tesla Rally"
268,2025-01-15,"Franklin Global Equity Fund Q4 2024 Commentary The fund outperformed the benchmark for the last quarter of 2024 primarily due to strong stock selection results, with selection in the United States notably positive. Read more here."
269,2025-01-15,ClearBridge Dividend Strategy Fund Q4 2024 Commentary US equities delivered positive gains in the fourth quarter and finished the 12-month period up 25% for the second year in a row. Read more here.
270,2025-01-16,"Biden warns US faces oligarchy as Trump looms over legacy STORY: President Joe Biden capped his half-century political career on Wednesday with a final Oval Office speech. In it, he warned of a nascent American oligarchy. Today,..."
271,2025-01-17,Nvidia Stock Rises. Guess Who’s Not Going to Trump’s Inauguration. Nvidia Stock Rises. Guess Who’s Not Going to Trump’s Inauguration.
272,2025-01-17,"Beware Rotation - S&P 500 Top 10 Stocks YTD Performance; Top 10 Client Holdings YTD through January 15, 2025, none of the top 3 names by market cap (Microsoft, Nvidia, Apple) are beating the S&P 500. Read more here..."
273,2025-01-17,2025 Analyst Outlook: Joe Albano On Thinking Outside The AI Box Should investors stay cautious on tech stocks in 2025? Click here to read about robotics and smaller mid-cap names that may present some upside for tech investors.
274,2025-01-18,"Mayar Capital Q4 2024 Letter To Partners Mayar Capital offers investment management services and believes in high-quality, value stocks for long-term outperformance in global markets."
275,2025-01-20,"Facebook, X, YouTube to do more against online hate speech, EU says Metas Facebook, Elon Musks X, Googles YouTube and other tech companies have agreed to do more to tackle online hate speech under an updated code of conduct that will now be integrated into EU tech..."
276,2025-01-21,"Google: Why Im Not Buying More Now (Downgrade) Financial writer discusses Alphabet Inc.s recent high stock surge, concerns about DoJ headwinds, and the need for stock consolidation."
277,2025-01-21,"Meta Makes Intense Year Forecast And Big Layoffs Meta Platforms is looking to cut its headcount by 5%, which shows the efficiency drive by the management. Read why META stock is a Buy."
278,2025-01-22,Meta backs data analytics firm Databricks as AI boom attracts investors Databricks said on Wednesday Meta Platforms had joined as an investor in a $10 billion funding round intended to fuel the data analytics startups expansion plans and new product development. ...
279,2025-01-22,Meta: Why Ill Buy Aggressively On Any Pullback Meta Platforms investors celebrate another momentous year of outperforming the market. Click here to read an analysis of META stock now.
280,2025-01-22,"Harding Loevner Global Equity Q4 2024 Report The Global Equity composite fell 0.86% gross of fees in the fourth quarter, in line with the 0.89% decline of the MSCI ACWI Index."
281,2025-01-23,Meta Stock Had a Great 2024. These Analysts Are Still Upbeat. Meta Stock Had a Great 2024. These Analysts Are Still Upbeat.
282,2025-01-23,How Oracle Plays Cheaply in AI How Oracle Plays Cheaply in AI
283,2025-01-23,Meta: $750 Is Possible In 2025 Meta Platforms has a massive catalyst in smart glasses with an aim to replace smartphones in the future. Find out why I am bullish on META stock prospects.
284,2025-01-23,India tribunal puts antitrust order on WhatsApp-Meta data sharing ban on hold An Indian appeals tribunal on Thursday put on hold the antitrust authoritys five-year data sharing ban between WhatsApp and Meta for advertising purposes. ...
285,2025-01-24,"Despite Trump order, abandoning DEI could land companies in legal trouble U.S. companies that scale back workplace diversity efforts to avoid scrutiny from the Trump administration may be exposing themselves to more discrimination lawsuits by workers, experts said. ..."
286,2025-01-24,"Interesting Earnings Action Coming NetflixsÂ post earnings pop, and why next week looms large in earnings. Contextualizing recent AI news."
287,2025-01-25,"Dow Jones Futures: Huge Earnings Due; Meta, Tesla, Microsoft Near Buy Points Dow Jones Futures: Huge Earnings Due; Meta, Tesla, Microsoft Near Buy Points"
288,2025-01-26,"Wall Street Brunch: Sparks Could Fly At Fed Presser Expect questions about Fed independence at the chairmans Q&A. Apple, Microsoft, Met and Tesla report results. Alphabet may be sitting on an Nvidia rival."
289,2025-01-26,"ASML: Its No Longer Dead In The Water An analysis of the latest developments in the AI compute industry, including ASMLs potential for growth and the impact of President Trumps partnership..."
290,2025-01-26,"Conestoga Capital Advisors Q4 2024 Quarterly Commentary U.S. equity indices generated modest returns in the fourth quarter of 2024, and closed out the full year with double digit returns for the second year in a row."
291,2025-01-27,PBP: Dont Get Hypnotized By This 9% Yield Discover why Invesco S&P 500 BuyWrite ETF (PBP) may not be the best choice for income generation compared to other ETFs with similar strategies.
292,2025-01-27,Chinas DeepSeek sparks AI market rout Technology shares around the world slid on Monday as a surge in popularity of a Chinese discount artificial intelligence model shook investors faith in the AI sectors voracious demand for high-tech...
