701,2025-07-04,"Ilya Sutskever will lead Safe Superintelligence following his CEO’s exit OpenAI co-founder Ilya Sutskever says he stepping into the CEO role at Safe Superintelligence, the AI startup he launched in 2024."
702,2025-07-07,Instagram user says he was banned with no right of appeal Meta wiped out a business account and all contacts without warning for not abiding by community guidelines
703,2025-07-09,"Nvidia Stock Hit the $4 Trillion Mark. The Mag 7 Is Back. Nvidia became the first company to cross a $4 trillion market capitalization on Wednesday.  Shares need to close above $163.93 to be the first firm to end a session with a market cap of $4 trillion or more.  Aside from Nvidia, Amazon.com, Microsoft, Meta Platforms, and Alphabet were all up nearly 2% on Wednesday."
704,2025-07-09,"CoreWeave-Core Scientific deal pushes AI merger tally over $65 billion as M&A market thaws As the market enters the second half of the year, AI is primed to remain the darling of dealmaking for 2025."
705,2025-07-10,"Blok is using AI personas to simulate real-world app usage AI-powered coding tools like Cursor, Replit, Claude Code, and Lovable are helping developers write many lines of code every day to ship products faster. However, app makers still have to rely on either shipping full beta versions of their apps or using simulation software to gauge how upcoming features will work. Blok, a company that […]"
706,2025-07-10,EUs top court adviser sides with Italy in Meta Platforms dispute EU member states have theright to impose their own measures to strengthen the position ofpublishers in their dealings with large online platforms as longas these do not undermine freedom of...
707,2025-07-10,"Meta faces scrutiny in France over advertising practices The French competition authority accused Meta of restricting access to ad verification partnerships under terms that are reportedly opaque, discriminatory, and unfair."
708,2025-07-10,"Only 35% of Americans Feel on Track For Retirement. Here Are 2 Stocks to Buy Now and Hold For Decades. Only about one-third of all Americans believe their retirement plan is on track, which is down from 40% in 2021.  Amazon and Meta Platforms could serve as building blocks for investors willing to adopt a buy-and-hold strategy.  Do you feel on track for retirement?"
709,2025-07-10,"Dow Jones Futures: Nvidia Chipmaker Rises, Delta Flies; AI Plays Rubrik, Astera Labs Flash Buy Signals Dow Jones Futures: Nvidia Chipmaker Rises, Delta Flies; AI Plays Rubrik, Astera Labs Flash Buy Signals"
710,2025-07-10,BWX Technologies Is a Nuclear Power Stock That’s Ready to Run: Technical Analysis The pick-and-shovels company’s shares look to be breaking out amid strong fundamentals for the industry.
711,2025-07-10,"Is Metas $14.3 Billion Bet on Scale AI Too Little, Too Late? Meta just invested more than $14 billion into data labeling start-up Scale AI, acquiring a 49% equity stake in the process."
712,2025-07-10,Big Tech ETF rises as Tesla sees large jump Big Tech ETF rises as Tesla sees large jump
713,2025-07-10,"Apple Needs To Get Bold on AI, Says iPod Co-Inventor The co-inventor of the iPod, Tony Fadell, now Build Collective Principal says that Apple needs to get bold when it comes to AI and make some key decisions. He adds that with Meta poaching some AI talent from Apple that the iPhone-maker will have to do more, and that talent competition is heating up. He spoke with Bloombergs Tom Mackenzie at the Bank of Americas Breakthrough Technology Dialogue in Goodwood, UK."
714,2025-07-11,Warren Buffett Doesnt Own Nvidia — But His 3 Picks Are Better Its tempting to look enviously at investors who own Nvidia. But Warren Buffett can take comfort that hes doing on some S&P 500 picks.
715,2025-07-11,"Musk Vs Zuckerberg: Two Richest Men Battle Over Daily Social Media Users Billionaires Elon Musk and Mark Zuckerberg almost ended up in a cage fight over their competing social media platforms. Musk may not want to look at the latest metrics from X rival Threads, or he could be proposing a cage match again. What Happened: Meta Platforms Inc (NASDAQ:META) launched Threads in 2023 and was viewed as a potential X killer and a new social media platform to lure users from Musks platform. Threads has grown to more than 350 million registered users and according to new metr"
716,2025-07-11,"Meta: Hire Away, Zuckerberg Metas aggressive AI investments aim to dominate the personalized AI assistant space. Click here to find out why META stock is a Buy."
717,2025-07-11,"ClearBridge Appreciation Strategy Q2 2025 Commentary The ClearBridge Appreciation Strategy underperformed the benchmark S&P 500 Index in the second quarter. On an absolute basis, the Strategy had gains in seven of 11 sectors."
718,2025-07-11,"Meta Shares Updated Reels Ads Guide, Including Creative Tips Some pointers for your Facebook and IG Reels approach."
719,2025-07-12,"7 Stocks Im Buying As Tariffs And Deportations Prowl Behind The Rally Read here for key economic risks from tariffs and slowing population growth, renewables resilience, and top REIT picks for defensive growth."
720,2025-07-12,"EU plans new tax on big corporates to boost budget -FT The draft documents indicated that the European Commission, the bloc’s executive arm, had dropped plans to target US Big Tech groups like Apple and Meta with a tax on digital services, though they would still be hit by the proposed new broader levy.  News of the plans came as the EU braced for a possible letter from U.S. President Donald Trump outlining planned duties on the United States’ largest trade and investment partner after widening his tariff war in recent days.  Trump has railed against what he sees as the EU’s heavy-handed regulation of Big Tech."
721,2025-07-12,"Trump’s America Inc. Is Open. He Needs to Act Like Its CEO. The economy has performed better than critics expected, but Trump’s personal vendettas and assaults on the Fed present serious risks."
722,2025-07-12,"Five Themes for Investors to Watch as Earnings Season Kicks Off (Bloomberg) -- In just three months, US stocks have swung from a dramatic April selloff to new heights. Now, traders are about to see if Corporate America’s report cards justify the optimism priced into equity markets.Most Read from BloombergSinger Akon’s Failed Futuristic City in Senegal Ends Up a $1 Billion ResortWhy Did Cars Get So Hard to See Out Of?Can Americans Just Stop Building New Highways?How German Cities Are Rethinking Women’s Safety — With TaxisPhiladelphia Trash Piles Up as Garbage"
723,2025-07-12,"Meta Acquires Voice AI Startup PlayAI, Continuing to Add Talent (Bloomberg) -- Meta Platforms Inc. has completed a deal to acquire PlayAI, a small artificial intelligence startup focused on voice technology. Most Read from BloombergSinger Akon’s Failed Futuristic City in Senegal Ends Up a $1 Billion ResortWhy Did Cars Get So Hard to See Out Of?Can Americans Just Stop Building New Highways?How German Cities Are Rethinking Women’s Safety — With TaxisPhiladelphia Trash Piles Up as Garbage Workers’ Strike Drags OnThe “entire PlayAI team” is set to join Meta next"
724,2025-07-13,"Machine Learning Engineer Interview Preparation Course 2025 - Top ML Jobs and Salary at Google Amazon Facebook Netflix Microsoft Updated Santa Clara, July 12, 2025 (GLOBE NEWSWIRE) -- Interview Kickstart, a leading platform for technical interview preparation, offers an Advanced Machine Learning Course designed to equip professionals with the skills needed to excel in ML roles, particularly within the cybersecurity domain. In an era where cyber threats are escalating in complexity and frequency, the integration of machine learning (ML) into cybersecurity has become imperative. Recent reports indicate that adversaries are leveragi"
725,2025-07-13,"Trumps FTC Chairman Is Becoming MAGA’s Answer to Lina Khan (Bloomberg) -- To American business leaders who hoped that Donald Trump’s return to the White House would immediately usher in an era of unfettered deal-making, Andrew Ferguson seemed like a cold shower.Most Read from BloombergSinger Akon’s Failed Futuristic City in Senegal Ends Up a $1 Billion ResortWhy Did Cars Get So Hard to See Out Of?How German Cities Are Rethinking Women’s Safety — With TaxisPhiladelphia Trash Piles Up as Garbage Workers’ Strike Drags OnPhiladelphia Reaches Pact With Worke"
726,2025-07-14,"Oracle: Moving Into The Big Leagues, But Shares Look Frothy (Downgrade) Oracle is forging ahead on its partnership with OpenAI to drive home the point that its ready to play with the biggest US hyperscalers in the game. Learn more on ORCL stock here."
727,2025-07-15,"Meta to Spend Hundreds of Billions on AI, Says Zuckerberg Bloombergs Kurt Wagner discusses Metas plans to invest in compute power to build out AI superintelligence. He joins Jackie Davalos on Bloomberg Tech."
728,2025-07-15,"Recovery.com Announces New Advertiser Certification Partnership with LegitScript Recovery.com, a leading platform connecting individuals with trusted addiction treatment resources, today announced a new partnership with LegitScript, an independent certification organization. This partnership expands Recovery.coms existing advertiser verification processes to require LegitScript certification for certain advertisers, aligning its standards with those enforced by major platforms, including Google, Meta, and Microsoft."
729,2025-07-16,"S&P 500 Falters as 30-Year Yield Hits 5%. Nasdaq, Nvidia Eye Record Levels. The S&P 500–a benchmark for the stock market–has spent much of the day wavering between small gains and losses.  Meanwhile, the tech-heavy Nasdaq, higher by 0.4%, is trying to etch a new all-time high today.  The Dow is down 359 points, or 0.8%."
730,2025-07-16,"Meta fixes bug that could leak users’ AI prompts and generated content The tech giant fixed the security flaw, netting a security researcher $10,000 for privately disclosing the bug."
731,2025-07-16,"Google to Spend $3 Billion for Hydropower from Brookfield (Bloomberg) -- Google agreed to spend more than $3 billion to buy power for its data centers from Brookfield Asset Management hydroelectric plants, with plans to potentially quadruple the amount of supply. Most Read from BloombergThe Dutch Intersection Is Coming to Save Your LifeAdvocates Fear US Agents Are Using ‘Wellness Checks’ on Children as a Prelude to ArrestsLA Homelessness Drops for Second YearManhattan, Chicago Murder Rates Drop in 2025, Officials SayThe power will come from the Holtwoo"
732,2025-07-16,Trump Media Wants In on AI. Can Truth Social Start Making More Money? Trump Media Wants In on AI. Can Truth Social Start Making More Money?
733,2025-07-16,"Alphabet Is Diving Feet First Into AI Coding See more on Alphabets Q225 earnings preview with forecasts of $93.75B revenue, key growth drivers like AI & Cloud, and why GOOG is rated HOLD at $185/share."
734,2025-07-17,"TSMC Raises 2025 Outlook in a Big Boost for AI Demand Hopes (Bloomberg) -- Taiwan Semiconductor Manufacturing Co. raised its outlook for 2025 revenue growth, shoring up investors’ confidence in the momentum of the global AI spending spree.Most Read from BloombergThe Dutch Intersection Is Coming to Save Your LifeAdvocates Fear US Agents Are Using ‘Wellness Checks’ on Children as a Prelude to ArrestsLA Homelessness Drops for Second YearManhattan, Chicago Murder Rates Drop in 2025, Officials SayThe world’s biggest contract chipmaker on Thursday forecast sal"
735,2025-07-18,Larry Ellison tops Mark Zuckerberg as worlds 2nd richest — heres the top 10 Meta CEO Mark Zuckerberg is no longer the second-richest person in the world. That title now belongs to Oracle founder Larry Ellison.
736,2025-07-20,"Zuck Reached Out And We Chatted: Meta Lures Seattle AI Founder With $100M-Plus Offer To Join Its Superintelligence Dream Team Matt Deitke, co-founder of Seattle-based AI startup Vercept, has joined Metas (NASDAQ:META) Superintelligence Lab after receiving a direct offer from CEO Mark Zuckerberg. Deitke described the initiative as the most exciting bet Ive seen in tech history, signaling Metas bold ambitions in artificial general intelligence, GeekWire reports. Deitke brings advanced expertise in embodied AI and 3D computer vision, having previously worked at the Allen Institute for AI and studied at the University"
737,2025-07-21,"Meta investors settlement with Zuckerberg takes heat off Delaware WILMINGTON, Delaware (Reuters) -A last-minute settlement between Meta Platforms shareholders and the companys leadership last week ended an $8 billion trial and spared Mark Zuckerberg from testifying about alleged violations of Facebook users data.  It also took the heat off the state of Delaware, which has been plagued by criticism from technology and business leaders.  The second day of the eight-day trial in Delawares Court of Chancery was about to start on Thursday when the legal team for the shareholder plaintiffs announced they had reached a deal to resolve the case."
738,2025-07-21,"Market Chatter: Meta, X and LinkedIn Challenge Italys VAT Claim Meta Platforms (META), X, and LinkedIn have filed appeals against a VAT claim by Italian authorities"
739,2025-07-21,"Amazon Investors Search for Signs of AI Lift With Shares Lagging (Bloomberg) -- Aggressive spending on artificial intelligence is mostly being rewarded in the stock market these days. But when it comes to Amazon.com Inc., not so much.Most Read from BloombergWhy the Federal Reserve’s Building Renovation Costs $2.5 BillionMilan Corruption Probe Casts Shadow Over Property BoomHow San Jose’s Mayor Is Working to Build an AI CapitalAmazon’s shares have gained about 3% this year despite the company’s heavy outlays on AI, which it is touting as a path to greater effi"
740,2025-07-21,Russia indicates possible ban on WhatsApp Putin is pushing for a state-backed messaging app that aims to integrate with government services and reduce reliance on foreign platforms.
741,2025-07-21,Metas AI Gambit Offers High AI-Specific Free Cash Flow By 2030 Meta is spending aggressively on AI talent after already outlaying and committing hundreds of billions of dollars for infrastructure.
742,2025-07-22,"ReelTimes Reel Intelligence RI Featured in Green Stock Journal as Greener than any AI on the Planet RLTR surpasses tech heavyweights Microsoft (MSFT), NVIDIA (NVDA), Alphabet (GOOGL), Amazon (AMZN), Meta (META), AMD, and Palantir (PLTR), in sustainability. BOTHELL, WASHINGTON / ACCESS Newswire / July 22, 2025 / ReelTime Media (OTC PINK:RLTR) is ..."
743,2025-07-22,"Mag 7 Components Turning Value? The Russell Shuffle Alphabet and Meta began paying dividends in 2024, making them eligible for WisdomTrees dividend-focused Indexes."
744,2025-07-22,"Deep-dive into Meta’s AI strategy Investing.com -- MoffettNathanson reaffirmed its Buy rating on Meta and raised its price target from $605 to $810 per share in a note Tuesday, citing a stronger advertising outlook and weakening U.S. dollar as tailwinds for future earnings."
745,2025-07-22,"Canadas Enbridge to invest $900 million in Texas solar project Clear Fork demonstrates the growing demand for renewable power across North America from blue-chip companies who are involved in technology and data center operations, said Matthew Akman, Enbridges executive vice president of corporate strategy and president of power.  Project construction is already underway and Enbridge expects the project to be accretive to its cash flow and earnings starting 2027."
746,2025-07-22,Magnificent 7s AI Spend Accelerates: Can it Push INOD Stock Higher? Innodatas GenAI platform and Big Tech contracts position it to tap the Magnificent 7s AI spending boom.
747,2025-07-23,"How AI Earnings Could Make or Break the S&P 500’s Rally The stock market’s most powerful bullish theme faces a series of litmus tests over the next two weeks that could define broader performance over the second half of the year, starting with Google parent  Alphabet  second-quarter earnings update on Wednesday.  The  stocks, which include major tech firms Alphabet,  Microsoft Tesla Meta Platforms Amazon.com Apple  and  Nvidia  comprise around a third of the  total market value.  Nearly a third of the estimated $536.3 billion in collective profit from S&P 500 companies in the second quarter will come from just two sectors: information technology and communications services."
748,2025-07-23,"The Ithaka Group Q2 2025 Commentary Amid Q2 chaos, Ithaka outperformed by backing resilient growth stocks like Nvidia and Microsoft. See how theyâre navigating volatility with conviction."
749,2025-07-24,"Q2 Earnings Results Show an Improving Growth Picture A positive picture is emerging from the Q2 earnings season, with an above-average proportion of companies beating consensus estimates. With the reporting docket remaining stacked for weeks to come, can the trend persist?"
750,2025-07-25,"Why Generative AI Is Powering Demand In This Often Ignored Sector Generative AIs power demands provide a good wind at your back for energy-related investments, this expert says."
751,2025-07-25,"Should You Forget Palantir and Buy These 3 Tech Stocks Instead? Palantir has been executing incredibly well, but its overvalued and could be vulnerable to a correction."
752,2025-07-25,3 Breakout Growth Stocks You Can Buy and Hold for the Next Decade Meta Platforms is investing heavily in GPUs and its data center to take advantage of artificial intelligence.  TSMC has more than a 50% market share in fabricating GPUs.  Netflix changed its business model to set the company up for continued success.
753,2025-07-25,"Googles AI Push Hits 2 Billion—But Metas Next Move Could Flip The Script Alphabet Inc‘s (NASDAQ:GOOGL) (NASDAQ:GOOG) Google just dropped a show-stopping stat: 2 billion users are now engaging with its AI features across products like Gmail, Android, and Docs. Thats a huge leap from last year—and a clear signal that Googles AI integration is scaling fast and wide. GOOGL stock is moving fast. Check the latest price here. At first glance, it appears that Google is running laps around Meta Platforms Inc. (NASDAQ:META), whose last reported figure—1 billion monthly activ"
754,2025-07-26,He’s seen enough bull markets to be worried now. But this veteran investor still likes these stocks. He’s seen enough bull markets to be worried now. But this veteran investor still likes these stocks.
755,2025-07-26,"Oasis ticket scam: ‘My Instagram was hijacked for a £1,400 fraud’ A fan was shocked when scammers used her identity to sell fake Wembley Stadium tickets to her friends"
756,2025-07-26,Fidelity Balanced Fund Q2 2025 Commentary Fidelity Investments reports a 2.74% Q1 loss for its Balanced Fund. See how equity picks and bond strategy shaped results. Review the full update.
757,2025-07-26,"5 Stocks Im Buying As Retail Investors Take Over The Market Meme stock mania returns as market shifts to AI giants. Explore dividend growth picks, tariff concerns, and Iron Mountains data center potential. See more here."
758,2025-07-26,"Sector Update: Tech Stocks Mixed in Afternoon Trading Tech stocks were mixed Friday afternoon, with the Technology Select Sector SPDR Fund (XLK) gaining 0"
759,2025-07-27,"Data Science Course FAANG Interview Prep 2025 - Data Scientist Jobs at Google Amazon Meta Apple Netflix Updated Santa Clara, July 26, 2025 (GLOBE NEWSWIRE) -- In 2025, AI-driven data analytics is transforming industries by enabling real-time decision-making, predictive modeling, and automation. Companies like Google and SAS are leading this revolution with platforms like BigQuery and SAS Viya, which integrate AI to process complex data and support advanced analyses in real-time. This shift underscores the growing demand for professionals skilled in AI and data science, particularly in roles that require n"
760,2025-07-29,"According to Analysts, This Tech Stock Has the ‘Longest Runway.’ Should You Buy It Here? Spotify stock has increased by nearly 800% since the start of 2023 and continues to trade at a discount to consensus price targets as of July 2025."
761,2025-07-30,"Nashville Songwriter and Radio Host Lindsay Lawler Launches New Show We Should Write On Wednesday, July 23rd, singer, songwriter, and radio personality Lindsay Lawler debuted her new radio show We Should Write. Produced from RadioNemos New Orleans studios inside the historic Degas House, the show will blend sarcasm and soul into deep dive conversations with songwriters, authors, and creatives of all kinds about the healing power of writing."
762,2025-07-30,"PRC Enhances VoicesAI™ with Metas LLaMA to Deliver Predictive Comment Intelligence for Healthcare Professional Research Consultants, Inc. (PRC), a leader in the experience improvement space, announced today a major enhancement to its VoicesAI™ solution, now enhanced with LLaMA—Metas cutting-edge open-source language model. The upgrade boosts speed, accuracy, and predictive capabilities in comment analysis, helping healthcare organizations act faster on patient, employee, and physician feedback."
763,2025-07-30,"US Equity Indexes Decline in Midday Trading US equity indexes fell in midday trading on Tuesday, a day ahead of the release of quarterly results"
764,2025-07-31,Markets Surge. A Look Ahead Shows Pullbacks May Be on the Horizon Markets Surge. A Look Ahead Shows Pullbacks May Be on the Horizon
765,2025-07-31,"Metas hefty AI CapEx spend is already paying off, analyst says Its been a busy week for Big Tech. Not only did Microsoft (MSFT) and Meta (META) both beat big on earnings this quarter, but Microsoft officially reached a $4 trillion market cap. Additionally, Apple (AAPL) and Amazon (AMZN) are getting ready to report quarterly results on Thursday after the markets close. Jefferies senior analyst Brent Thill and Yahoo Finance Technology Editor Dan Howley join Market Catalysts with Julie Hyman to discuss Metas artificial intelligence (AI) capital expenditure (CapEx) spending and whether the numbers are showing a return on investment (ROI) yet. To watch more expert insights and analysis on the latest market action, check out more Market Catalysts."
766,2025-07-31,Meta Faces Italy Probe Over WhatsApp AI Regulators warn of forced bundling risk
767,2025-07-31,How To Retire In 2025 On Dividends Ready to retire? Read more on how those preparing for retirement can develop a portfolio of dividend stocks.
768,2025-07-31,Meta Is Betting Its Future on ‘Personal Superintelligence.’ Here’s What That Means. Meta Is Betting Its Future on ‘Personal Superintelligence.’ Here’s What That Means.
769,2025-07-31,"Meta’s ‘superintelligence’ isn’t here yet. But its AI bets are already paying off If Meta investors had concerns about the company’s huge spending on artificial intelligence infrastructure and talent, they’re likely to be assuaged by its blockbuster earnings report on Wednesday. The results, as one analyst put it, indicates that “AI is becoming a real revenue driver, not just hype.”"
770,2025-07-31,"Cora Restaurants Enhances the Guest Experience Offering Online Reservations Powered by Libro MONTREAL, July 31, 2025--Cora restaurants now offer online reservations through Libro."
771,2025-08-01,"Top Stock Movers Now: Microsoft, Meta Platforms, Carvana, and More U.S. equities were mostly higher at midday, with the S&P 500 and Nasdaq trading at record highs, on strong tech earnings."
772,2025-08-01,"U.S. stocks stall as early enthusiasm ebbs STORY: U.S. stocks closed lower on Thursday, with the Dow dropping about three-quarters of a percent, the S&P 500 falling more than a third of a percent, and the Nasdaq finishing essentially flat but in the red.Blockbuster earnings results from Meta Platforms and Microsoft had initially lifted Wall Street, but early gains faded following the latest U.S. economic data.A report from the Commerce Department showed inflation picked up in June, with new tariffs pushing prices higher and stoking expectations that prices could climb further in the coming months.Robert Conzo, Chief Executive Officer & Managing Director at The Wealth Alliance, said investors have a lot of data to digest this week.This is a unique week. You had GDP that just came out, it was annualized at 3%. In the first quarter it was -5. Both those numbers are skewed. PCE just came out, saw it tick up a little, year to date flat. Very interesting to understand what the Feds going to do as a result of that. And then lets not forget jobs on Friday. Big big big number. ADP jobs by the way, just came out this week, and we were expecting 74,000; it came out at 104. That was a big surprise to the upside. That is an interesting number. Lets see how that plays out on the jobs number on Friday. After the closing bell, shares of Amazon fell in extended trading after the company forecast third-quarter sales that beat estimates but failed to live up to lofty expectations for its AWS cloud computing unit.Shares of Apple jumped in after-hours trading, as the iPhone maker reported sales and profit that far surpassed expectations.AI-related names were weaker on the session, with chipmakers Broadcom and Nvidia ending lower.And shares of drugmakers were also weaker after the White House said Trump sent letters to the CEOs of 17 major pharmaceutical companies, urging immediate action to lower the cost of prescription drugs for Americans."
773,2025-08-01,"Earnings live: Exxon, Chevron oil output boosts profits, Moderna stock tumbles, Amazon sinks Second quarter earnings season is in full swing, and the results have been largely positive so far, with more positive surprises than negative ones."
774,2025-08-01,Big Tech’s $400 Billion AI Spending Spree Just Got Wall Street’s Blessing Big Tech’s $400 Billion AI Spending Spree Just Got Wall Street’s Blessing
