293,2025-01-28,Broadcom Stock: Why Im Buying The DeepSeek Dip And You Should Too Broadcom stock sold off on Monday following DeepSeeks release. Read why I think AVGO represents a solid short-term and long-term Buy.
294,2025-01-28,QGRO: Sophisticated Growth ETF With Average Return American Century U.S. Quality Growth ETF holds a portfolio of 199 stocks divided into pure growth and stable growth subsets. See why QGRO is a Hold.
295,2025-01-28,"Arista Networks: AI Capex Will Only Expand Arista Networks, citing increased AI capex from top clients like Microsoft and Meta Platforms, upgrading PT to $139. Read why I reiterate my Buy on Arista Networks."
296,2025-01-28,"DeepSeek And LLM Commoditization: Understanding The Palantirs Bull Case Financial writer bullish on Palantir Technologies Inc., raising target to $250/share due to AI growth and Trump administration ties. Click for this PLTR update."
297,2025-01-28,"Meta Platforms : Reflecting on Meta’s $8 Billion Investment in Privacy Meta Reflecting on Metas $8 Billion Investment in Privacy January 28, 2025January 28, 2025 By Michel Protti, Chief Privacy and Compliance Officer,..."
298,2025-01-30,Meta Platforms : Fourth Quarter 2024 Earnings Slides Meta Earnings Presentation Q4 2024 investor.atmeta.com Advertising Revenue by User Geography ...
299,2025-01-30,Giverny Capital Asset Management Q4 2024 Letter Giverny Capital Asset Management enjoyed market-beating returns in 2024 from an eclectic group of companies. Click here to read the full letter. businesses
300,2025-01-30,"Meta Reports Fourth Quarter and Full Year 2024 Results MENLO PARK, Calif., Jan. 29, 2025 /PRNewswire/ -- Meta Platforms, Inc. today reported financial results for the quarter and full year ended December 31, 2024. ..."
