351,"Why Meta Platforms, Inc. (META) is Among the Best Augmented Reality Stocks to Buy According to Hedge Funds We recently published a list of 11 Best Augmented Reality Stocks to Buy According to Hedge Funds. In this article, we are going to take a look at where Meta Platforms, Inc. (NASDAQ:META) stands against other best augmented reality stocks to buy according to hedge funds. According to a report by Mordor Intelligence, the global […]"
352,"Big Tech: Microsoft, Meta beat forecasts, calm investor jitters STORY: Tech giants Microsoft and Meta have shaken off fears of an unsteady economy or AI slowdown, for now at least. Both of them beat analyst forecasts on Wednesday. ..."
353,"Threads tops 350M monthly users after adding 30M in the quarter Instagram Threads, Metas X competitor, has now grown to over 350 million monthly active users, CEO Mark Zuckerberg revealed during the companys Q1 2025 earnings call on Wednesday. Thats an increase of 30 million users since the prior quarter, where Meta reported that Threads had 320 million users. The new figure represents increased growth, as Threads added 30 million in the first quarter of this year, compared with 20 million in Q4 2024. Its also worth noting that in a single quarter, Threa"
354,Meta Rallies As Tech Giant Boosts AI Spending As Advertising Outlook Looks Healthy Despite Tariffs Meta Rallies As Tech Giant Boosts AI Spending As Advertising Outlook Looks Healthy Despite Tariffs
355,"Meta Platforms, Inc. (META) Q1 2025 Earnings Call Transcript Meta Platforms, Inc. (NASDAQ:META) Q1 2025 Earnings Conference Call April 30, 2025 5:00 PM ETCompany ParticipantsKenneth Dorell - Director, Investor..."
356,Reddit Stock Surges Near 20% As Social Media Player Crushes Q1 Estimates Reddit Stock Surges Near 20% As Social Media Player Crushes Q1 Estimates
357,"Mark Zuckerberg wants Meta to be something it isnt Mark Zuckerberg may see the world through AI-powered Ray-Bans, but Wall Street just sees it through his company’s ad dollars. And while he’s trying to look beyond the feed to a future with talking glasses and immersive virtual worlds, investors are hoping he’ll stick with what his company does best."
358,"Why Meta and Microsoft are drawing investors back to Big Tech Meta (META) and Microsoft (MSFT) have issued forecasts that are reigniting interest in large-cap tech. Melissa Brown, SimCorp managing director of investment decision research, explains how size and resilience may help these companies navigate uncertainty. To watch more expert insights and analysis on the latest market action, check out more Market Domination here."
359,These 3 Stocks Soared Following Strong Quarterly Results The 2025 Q1 earnings cycle is in full swing. And these three companies posted results that had investors pleased.
360,Judge in Meta case warns AI could obliterate market for original works A skeptical federal judge in SanFrancisco on Thursday questioned Meta Platformsargument that it can legally use copyrighted works withoutpermission to train its artificial intelligence models. ...
361,Earnings Dilute Tariff Concerns Most important earnings reports this week dilute tariff concerns.
362,"Amazon: Q1 Earnings Beat, Weak Guidance, Tariff Threat--Is It A Buy? Amazon.com, Inc. Q1 earnings beat estimates, but Q2 guidance impacted shares. Explore revenue growth, AWS performance & its valuation. Click for my AMZN update."
363,"The influencer election that wasnt: amid Trump trauma, Australian voters logged off When Australian podcast hostNigel Marsh booked Prime Minister Anthony Albanese for aninterview on his show, Five of My Life, he expected a surge oflisteners due to his guests high profile and the..."
364,Nvidia Can Survive ‘Tough Regulations’ on China. Here’s Why. Nvidia Can Survive ‘Tough Regulations’ on China. Here’s Why.
365,"Amazon: Managing Tariff Impact Through AI Automation And Pricing Power Explore AMZNs 1Q FY2025 earnings, AI-driven cost strategies, and AWS growth. Cautious outlook ahead amid tariffs and trade talks."
366,"Dont Get Caught In The Bull Trap Understand market fundamentals, technical analysis, and Fed policy which impact the current market rally on SPX and Magnificent Seven. Read why Im not on-board with the stock upsurge."
367,3 Cheap Magnificent Seven Stocks to Load Up On New uncertainty over the direction of the economy has sent these stocks downward.  Alphabet and Meta Platforms should see ad revenue remain strong in the long run.  The Magnificent Seven group of stocks hasnt really been known for being called cheap.
368,"User Engagement & AI Fuel Blockbuster Q1 Results for META Platforms Stock I’ve been pounding the table on Meta Platforms (META) for years, writing several articles about why it’s a screaming buy. Following the stock’s steep sell-off last month as tariff-driven fears overwhelmed the market, I took advantage of the situation and continued adding to my long META position. Buying the dip was a great idea, as the social media giant’s Q1 earnings blew the doors off expectations last week, forcing analysts to scramble and reprice the stock. Yet, the core story hasn’t changed"
369,Nuveen CIO Saira Malik decodes the stock markets post-Liberation Day rally Nuveen chief investment officer Saira Malik makes the case for not having too much of an allocation to cash despite Trump tariff unknowns.
370,"Fidelity Large Cap Stock Fund Q1 2025 Commentary For Q1 2025, Fidelity Large Cap Stock Fund returned -2.29%, outpacing the -4.27% result of the benchmark, the S&P 500Â® index. Click here to read the full commentary. "
371,"New court filing shows that Meta execs agreed that Facebook was losing to TikTok Meta CEO Mark Zuckerberg, Instagram head Adam Mosseri, and other Meta execs thought that TikTok was beating Meta at its own game. Thats according to a new filing in the U.S. Federal Trade Commissions antitrust lawsuit against the tech giant, published on Monday. The document, dated February 2022, includes conversations among a number of Meta execs discussing Facebook and Instagrams strategy and market position. In one message, Zuckerberg called Facebook a challenger that has lost the minds"
372,Trumps FTC antitrust cops just got a loud warning about blocking tech tie-ups President Trumps antitrust cops just received a loud warning about attempts to block any future technology mergers as the FTC lost an attempt to undo Microsofts $69 billion acquisition of gaming giant Activision Blizzard.
373,Cathie Wood Goes Bargain Hunting. 1 Dirt Cheap Artificial Intelligence (AI) Chip Stock She Just Bought (Hint: Its Not Nvidia) Cathie Wood has quietly been building a position in one of Nvidias chief rivals in the chip space.
374,"Meta Platforms And TikTok: Dont Let A Crisis Go To Waste Since my last writing, Meta Platforms has delivered a strong FQ1 earnings report and updated its AI growth strategy. Click to find out why META is a Strong Buy."
375,"Meta Platforms, Inc. (META) Reported the Best Results Among Mag 7, Prominent Investor Says During the current earnings season, Meta Platforms, Inc. (META) reported the best quarterly financial results of any Mag 7 stock, well-known investor Stephanie Link said recently on CNBC Link, who is the Chief Investment Strategist at Hightower, owns Meta Platforms, Inc. (META) stock, and she recommended that investors buy the name. AI Has Helped META, […]"
376,"2 Tech Stocks You Can Buy and Hold for the Next Decade Meta Platforms and PayPal stocks are affordably priced, especially among stocks in the tech sector.  AI investments have paid off for Meta, helping the stock outperform in recent years.  PayPals stock has been in a slump, but new company leadership and expansion into digital advertising have the potential to stimulate growth."
377,"BlackRock Large Cap Focus Growth Fund Q1 2025 Commentary The fund posted returns ofÂ -10.98%Â (Institutional shares) andÂ -10.98%Â (Investor A shares, without sales charge) for the first quarter of 2025."
378,"Lone Pine Capital Raises Share Stake In Amazon, Cuts Share Stake In Meta Lone Pine Capital: * LONE PINE CAPITAL CUTS SHARE STAKE IN META BY 13.7% TO 1.8MILLION CLASS A SHARES * LONE PINE CAPITAL RAISES SHARE STAKE IN MICROSOFT BY 19.6%TO..."
379,"Meta delays release of flagship AI model, Behemoth: WSJ Meta Platforms (META) shares are under pressure after The Wall Street Journal reported the tech giant is delaying the rollout of its flagship AI model, Behemoth. Julie Hyman and Josh Lipton break down the latest on Market Domination. To watch more expert insights and analysis on the latest market action, check out more Market Domination here."
380,"How Will Dow Jones Futures Open After U.S. Debt Rating Downgrade Hits QQQ; Broadcom, Meta Eye Buy Points The stock market has entered a power trend, but Moodys cut the U.S. debt rating late Friday. Meta, Broadcom lead stocks setting up."
381,"Artificial Intelligence (AI) Infrastructure Spend Could Hit $6.7 Trillion by 2030, According to McKinsey. 4 Data Center Stocks to Load Up on Right Now Like Theres No Tomorrow. McKinsey expects that AI chips and related hardware will receive the largest allocation of infrastructure spend over the next five years.  Global management consulting firm McKinsey & Company recently published a report detailing compelling trends in research and development (R&D) and capital expenditure (capex) related to artificial intelligence (AI) investments over the next five years.  Per McKinseys analysis, spending on AI infrastructure could reach $6.7 trillion by 2030."
382,"Why Buy The Azure Effect: Update From The Microsoft Build Conference Discover why Microsoft Corporations cloud innovations, Azure growth, and strategic investments make it a solid pick for growth. Click for more on MSFT stock."
383,"Tariff-Driven Dollar Woes Help Brighten First-Quarter Earnings (Bloomberg) -- Tariffs unexpectedly devaluing the US dollar — and in turn boosting corporate earnings — was one of the few bright spots of the first-quarter earnings season in North America. Most Read from BloombergAmerica, ‘Nation of Porches’NJ Transit Train Engineers Strike, Disrupting Travel to NYCNJ Transit Makes Deal With Engineers, Ending Three-Day StrikeContrary to what analysts and executives had expected at the beginning of the year, a Bloomberg gauge of the dollar has collapsed in rece"
384,TQQQ Has Been Beaten Down Enough (Rating Upgrade) TQQQ ETF has also taken a beating this year as US markets plunge from its steep valuations. See how TQQQ recent performance justifies a rating upgrade from bearish to hold.
385,"Teslas Texas Plan B if Delaware won’t reinstate Elon Musks pay. Its not about the money, says Elon. Texas to the rescue? Tesla is exploring alternative ways to pay its CEO, Elon Musk, in a new deal that, if approved, would be the first time the EV maker’s pay proposal for the world’s richest man would be subject to Texas rather than Delaware law."
386,Magnificent 7 Shareholder Meetings On Tap: Taking Stock Of The Economy Major tech-related companies host Annual General Meetings in the weeks ahead.
387,Sam Altman and Jony Ive Are Planning a Device for the AI Era. It Won’t Be Easy. Sam Altman and Jony Ive Are Planning a Device for the AI Era. It Won’t Be Easy.
388,Meta: A Grab Bag Of Potential Problems Trading At A High Price (Rating Downgrade) Meta Platforms has so far been able to offset slowing impressions growth via higher ad pricing. Read why Im downgrading META stock.
389,"German rights group fails in bid to stop Metas data use for AI The court in the western city of Cologne said it did not grant an injunction sought by state-funded consumer rights group Verbraucherzentrale NRW.  Meta said last month it would train its AI models in the European Union with public posts of adults across its platforms, as well as with interactions that users have with its artificial intelligence."
390,"Nvidia Stock (NVDA) Maintains Bullish Tempo as Earnings Day of Reckoning Looms Nvidia (NVDA), the trailblazing AI-tech stock, has staged a remarkable comeback, surging 33% over the past month. While investor concerns around rising competition, escalating global tariffs, and macroeconomic uncertainties have weighed on NVDA’s performance, the company’s underlying growth trajectory, driven by AI innovation and data center expansion, remains robust. Given this foundation, NVDA presents an attractive buying opportunity at current levels. Moreover, with a keenly anticipated earn"
391,"Nvidia has lost its shock power to investors, for now Nvidias quarter may be tougher than normal to assess. Heres why."
392,"Billionaire Ole Andreas Halvorsen Just Bought Nvidia, Tesla, and Meta Platforms, but Dumped His Entire Stake in the Cheapest Magnificent Seven Stock Viking Global Investors billionaire chief sold the most fundamentally attractive member of the Magnificent Seven in favor of a trio of foundational artificial intelligence (AI) stocks."
393,"2 Internet Stocks to Research Further and 1 to Ignore Whether it be online shopping or social media, secular forces are propelling consumer internet businesses forward. But it’s not all sunshine and rainbows as consumer purchasing power can make or break demand. Unfortunately, the market seems to believe stormy skies are ahead as the industry has shed 2.2% over the past six months. This drop was almost identical to the S&P 500’s decline."
394,Market Chatter: Meta Platforms Reorganizing AI Teams to Speed Up Product Development Meta Platforms (META) is reorganizing its artificial intelligence teams to speed up product developm
395,"Billionaires Philippe Laffont, Chase Coleman, Terry Smith, and Stephen Mandel All Share the Same No. 1 Holding -- and Its Not Nvidia This Magnificent stock that all four prominent billionaires have as their top holding has surged 1,570% since its initial public offering."
396,"Meta Fired Palmer Luckey. Now, They’re Teaming Up on a Defense Contract. The Facebook and Instagram parent is partnering with Luckey’s Anduril Industries to develop combat VR headsets for the Army."
397,"As An Investor, I Wish It Was 1999 Explore why todays market risks surpass those of 1999s Internet Boom with insights on economic, geopolitical & market conditions. Click to read why stocks are more overbought now."
398,"Microsoft And Meta: Post-Earnings Updates To The Outlook For Microsoft and Meta Platforms, this earnings season demonstrated the resilience of their core businesses, despite uncertainty from tariffs."
399,"Meta Hits 1 Billion Monthly AI Users, Eyes Future With Subscriptions Meta Platforms, Inc (NASDAQ:META) artificial intelligence assistant now has one billion monthly active users, CEO Mark Zuckerberg said Wednesday at the companys annual shareholder meeting. Zuckerberg emphasized focus on making Meta AI the leading personal AI, emphasizing personalization, voice conversations, and entertainment, CNBC reported on Wednesday. In April, Meta launched a stand-alone AI app to compete with the likes of OpenAIs ChatGPT, Alphabet Inc (NASDAQ:GOOG) (NASDAQ:GOOGL) Googles"
400,"The Amazon Paradox: Growth Potential, But Stalling Stock Price Amazon stock consolidates as growth faces challenges from retail tariffs and economic uncertainty. Read here for AMZNs long-term opportunities in AWS & AI."
