185,2024-12-10,"Advertising Industry To Hit $1 Trillion, Dominated By The New Big 5 Just five companies are set to grab more than half of global advertising revenue. The rise of Big Tech is seen behind a big ad agency merger."
186,2024-12-10,"Pioneer Balanced ESG Fund Q3 2024 Performance And Market Commentary Pioneer Balanced ESG Fundâs Class Y shares returned 4.09% in the third quarter, underperforming the Fundâs equity and fixed income benchmarks. Read more here."
187,2024-12-10,"Meta Platforms : Test Content With Non-Followers Using Trial Reels Instagram Test Content With Non-Followers Using Trial Reels December 10, 2024December 10, 2024 Takeaways ..."
188,2024-12-10,Oracle Stock Is Dropping. Why Wall Street Is OK With an Earnings Miss. Oracle Stock Is Dropping. Why Wall Street Is OK With an Earnings Miss.
189,2024-12-11,Trump Aims to Remake Federal Trade Commission With Two Picks The president-elect says he will elevate Andrew Ferguson to succeed Lina Khan as chair and nominate Mark Meador as a commissioner.
190,2024-12-11,"The AI Researchers Pushing Computers to Launch Nightmare Scenarios It’s largely up to companies to test whether their AI is capable of superhuman harm. At Anthropic, the Frontier Red Team assesses the risk of catastrophe."
191,2024-12-11,"Pioneer Disciplined Value Fund Q3 2024 Performance And Market Commentary Pioneer Disciplined Value focuses on mispriced quality, sustainable US large-cap companies trading at attractive valuations with the goal of maximizing risk-adjusted returns."
192,2024-12-11,"Tracking Ole Andreas Halvorsens Viking Global Portfolio - Q3 2024 Update Viking Globals 13F portfolio value increases to $27.44B with top holdings in U.S. Bancorp, Adobe, Apple, Philip Morris, and Visa. Check out the holdings in Q3."
193,2024-12-12,"Wall Street Breakfast Podcast: Big Tech Drives Nasdaq Rally Behind the monster rally that drove the Nasdaq to 20,000. Nvidia increases headcount in China to boost AI-driven car technology - report. Kroger launches $7.5B stock buyback."
194,2024-12-12,AI Stocks Face a New Test. Here Are the 3 Big Questions Hanging Over Tech in 2025. AI Stocks Face a New Test. Here Are the 3 Big Questions Hanging Over Tech in 2025.
195,2024-12-12,"Stock Market Today: Sellers Take Profits After Nasdaq 20,000 Milestone But Meta, Microsoft Rally; Arm Works On New Base (Live Coverage) Stock Market Today: Sellers Take Profits After Nasdaq 20,000 Milestone But Meta, Microsoft Rally; Arm Works On New Base (Live Coverage)"
196,2024-12-12,"Dow Jones Futures Fall After Tesla, Titans Push Nasdaq Above 20,000; What To Do Now Dow Jones Futures Fall After Tesla, Titans Push Nasdaq Above 20,000; What To Do Now"
197,2024-12-12,"Trending tickers: Uber, Tesla, Meta, SThree and Currys The latest investor updates on stocks that are trending on Thursday."
198,2024-12-13,"Prediction: These Will Be Wall Streets 2 Most-Prominent Stock-Split Stocks of 2025 Stock-split euphoria took over Wall Street in 2024, and two brand-name companies could continue this trend in the new year."
199,2024-12-14,"Here Are My Top 10 Stocks for 2025 If I had to buy just one stock from this list for 2025, Id pick Taiwan Semiconductor Manufacturing (NYSE: TSM).  Taiwan Semi is the worlds leading contract chip manufacturer and makes chips for nearly every company that produces anything related to high technology or AI.  With Wall Street expecting 25% revenue growth in 2025, Id expect Taiwan Semis stock to excel next year."
200,2024-12-15,The final Fed meeting of 2024 awaits: What to know this week Investors will be closely watching for any hints on how much further the Federal Reserve plans to lower interest rates in 2025.
