775,2025-08-01,"Microsoft briefly becomes the second company to hit $4 trillion in market value Shares of tech giants Meta and Microsoft were soaring Thursday, with the two companies adding a combined $400 billion to their market values"
776,2025-08-01,"Amazon and Apple post strong earnings but tariffs dampen investor appetite Tariffs and the AI race have made tech investors more cautious, with Amazon and Apple’s second quarter results showing that the market is no longer betting on Big Tech as a whole — only on those with a clear edge.View on euronews"
777,2025-08-03,Nvidia CEO Jensen Huang Just Gave Meta Investors Great News -- or Did He? Jensen Huang made some interesting comments related to Metas recent hiring spree.
778,2025-08-03,"Mag 7 Plans to FOMO Into $650B Tech Investment Despite Trumps U.S. Manufacturing Push The Mag 7 firms are expected to spend $650 billion in capex and R&D this year, an amount bigger than the U.K. government’s annual public investments."
779,2025-08-04,Veteran fund manager turns heads with new Meta Platforms stock price target TheStreet Pro portfolios lead manager reviews the Facebook parent companys latest earnings.
780,2025-08-04,"AI Glasses Could Replace Smartphones, Zuckerberg Says Personal superintelligence push forces rethink of mobile hub"
781,2025-08-04,"Beat the Market the Zacks Way: Oracle, Credo Tech, Palantir in Focus Oracle, Credo Tech, and Palantir shine in volatile markets, leading Zacks portfolios with standout gains and upgraded outlooks."
782,2025-08-04,"Detroit Free Press transitions printing to Ohio Starting with the Aug. 5 edition, newsprint copies of the Detroit Free Press will be printed in Canton, Ohio, and trucked to Michigan."
783,2025-08-05,"Stock market today: Dow jumps 580 points, S&P 500, Nasdaq have best day since May as Wall Street bounces back US stock futures were little changed following a week of sharp declines."
784,2025-08-05,"Vertex Announces Results from Phase 2 Study of VX-993 for the Treatment of Acute Pain BOSTON, August 04, 2025--Vertex Pharmaceuticals Incorporated (Nasdaq: VRTX) today announced topline results from its recently completed Phase 2, randomized, double-blind, placebo-controlled dose-ranging study evaluating the safety and efficacy of its investigational selective NaV1.8 pain signal inhibitor, VX-993, in treating acute pain after bunionectomy surgery. Treatment with VX-993 did not result in a statistically significant improvement on the primary endpoint of the time-weighted Sum of th"
785,2025-08-05,"Tech ETFs at the Forefront of the Market Rebound on Monday Tech ETFs like DAPP, ARKQ and IBLC surged on Monday as strong earnings and rate cut hopes reignited investor confidence."
786,2025-08-05,"AMD Aims To Dethrone Nvidia In AI Race—Heres How Nvidia Corps (NASDAQ:NVDA) AI chip empire is built on H100s, which cost up to $40,000. It is the go-to for tech titans like Microsoft Corp (NASDAQ:MSFT) and Meta Platforms Inc (NASDAQ:META). But with supply shortages and U.S. export bans choking sales to China, startups and sovereign AI dreamers in India and the UAE are increasingly turning to Advanced Micro Devices Inc (NASDAQ:AMD). AMD’s secret sauce lies in its cheaper alternative in the MI300 chips, and its open-source ROCm software. Track"
787,2025-08-05,"The Earnings Party Hits A Wall: Strong Q2 Profits Cant Overcome Macro Fears As we enter the second week of peak earnings season for Q2, S&P 500 EPS growth continues to improve, now at 10.3% YoY."
788,2025-08-05,"Morgan Stanley Boosts Meta Target to $850—Here’s Why Meta Platforms, Inc. (NASDAQ:META) is one of the AI Stocks Making Waves on Wall Street. On July 31, Morgan Stanley analyst Brian Nowak raised the price target on the stock to $850.00 (from $750.00) while maintaining an “Overweight” rating. According to the firm, improvements in GPU-enabled algorithmic are helping drive better-than-expected engagement and monetization metrics. This is, […]"
789,2025-08-05,"Are Wall Street Analysts Predicting Meta Platforms Stock Will Climb or Sink? Due to Meta Platformss outperformance relative to the broader market over the past year, Wall Street analysts maintain a bullish outlook about the stock’s prospects."
790,2025-08-06,"AMD Reports Second Quarter 2025 Financial Results SANTA CLARA, Calif., Aug. 05, 2025 (GLOBE NEWSWIRE) -- AMD (NASDAQ:AMD) today announced financial results for the second quarter of 2025. Second quarter revenue was a record $7.7 billion, gross margin was 40%, operating loss was $134 million, net income was $872 million and diluted earnings per share was $0.54. On a non-GAAP(*) basis, gross margin was 43%, operating income was $897 million, net income was $781 million and diluted earnings per share was $0.48. As previously announced, our second"
791,2025-08-06,"BofA Raises Meta Target to $900, Calls It a Top AI Beneficiary Meta Platforms, Inc. (NASDAQ:META) is one of the AI Stocks Analysts Are Watching Closely. On July 31, BofA Securities analyst Justin Post raised the price target on the stock to $900.00 (from $775.00) while maintaining a “Buy” rating. Post’s optimism stems from Meta being a top AI beneficiary. The price target for the stock has been raised […]"
792,2025-08-08,"Meta Expands Aggressively on Data Centers Metas is partnering with Pimco and Blue Owl in the race for AI infrastructure to expand on the need for land and power, reports Bloombergs Mandeep Singh."
793,2025-08-09,"Microsoft, Apple, Amazon, and Meta Just Gave Nvidia Investors Great News Theres a lot of room for optimism as Nvidia is set to report earnings on Aug. 27."
794,2025-08-11,"Exclusive: Former Intel CEO Craig Barrett outlines plan to save Intel and America’s advanced chip manufacturing Intel needs a cash infusion of roughly $40 billion to remain at the leading edge of chip manufacturing, according to former CEO Craig Barrett. The U.S. government is unlikely to be the main savior—instead cash rich chip customers like Nvidia, Apple, and Google need to step up."
795,2025-08-11,"The computer science dream has become a nightmare Well, the coding-equals-prosperity promise has officially collapsed. Fresh computer science graduates are facing unemployment rates of 6.1% to 7.5% — more than double what biology and art history majors are experiencing, according to a recent Federal Reserve Bank of New York study. A crushing New York Times piece highlights what’s happening on the ground. The […]"
796,2025-08-12,Stock Market Today: Dow Jones Futures Rally On CPI Inflation Data; Tesla Extends Gains (Live Coverage) Stock Market Today: Dow Jones futures rallied Tuesday on mixed CPI inflation data. Tesla stock looked to extend its win streak.
797,2025-08-12,"Catalysts Powering The Nuclear Comeback In 2025 U.S. nuclear policy is accelerating, with 2025 Executive Orders targeting a 4x increase in capacity by 2050 and streamlining the regulatory process."
798,2025-08-12,"OpenAI, Palantir, and Meta execs join fight for America’s tech edge You can catch Warrior Money on Apple Podcasts, Spotify, Amazon Music, or wherever you get your podcasts. The future of war and work is tech, and veterans are in demand for high-paying tech careers. On this episode of Warrior Money, Patrick Murphy and Dan Kunze reveal how Detachment 201 is bringing C-suite leaders from OpenAI (OPAI.PVT), Palantir (PLTR), and Meta (META) into military service to strengthen America’s tech edge. Learn how veterans can transition into AI, cybersecurity, and robotics roles, use VA benefits to upskill, and position themselves for the most in-demand jobs of the future before the competition does. Hosted by former Congressman Patrick Murphy and veteran investor Dan Kunze, Yahoo Finance’s Warrior Money is a weekly podcast dedicated to uplifting military veterans transitioning into civilian life. Through insights from fellow veterans and high-ranking officials, Murphy and Kunze are helping set vets up for success through financial education and inspiration. This post was written by Langston Sessoms."
799,2025-08-12,"In the time of tariffs, Nvidia and AMD cut unusual deals with Trump Two chipmakers make revenue-sharing pledges, OpenAI reveals GPT-5 and AOL bids dial-up adieu"
800,2025-08-12,"Anteriad Celebrates Four-Year Streak on    Inc. 5000’s Fastest-Growing Companies List Rye Brook, New York, Aug. 12, 2025 (GLOBE NEWSWIRE) -- Inc., revealed today that Anteriad made the 2025 Inc. 5000, its annual list of the fastest-growing private companies in America. With a three-year revenue growth rate of 140%, Anteriad secured spot #2942 on this prestigious ranking and #234 for companies headquartered in NY. The list provides a data-driven snapshot of the most successful companies within the economy’s most dynamic segment— independent, entrepreneurial businesses. Past honore"
