101,2024-11-07,"Meta Platforms, Inc. (META) Expands Llama AI Models to U.S. Government and Defense, Partnering with Top Tech Firms We recently compiled a list of the 10 AI News You Shouldn’t Miss. In this article, we are going to take a look at where Meta Platforms, Inc. (NASDAQ:META) stands against the other AI stocks you shouldn’t miss. John Lovelock, Chief of Research for Global IT Forecasting at Gartner, joined CNBC’s Worldwide Exchange to discuss the […]"
102,2024-11-07,"Trump’s Victory Boosts Billionaires’ Wealth. Musk and Bezos Are Winners, Too. Trump’s Victory Boosts Billionaires’ Wealth. Musk and Bezos Are Winners, Too."
103,2024-11-07,"Trump win fuels stock rally: Nasdaq up 400 points, gold plunges Yahoo Finance Anchor Rachelle Akuffo breaks down the top market stories of the day. All major indexes are in the green as investors react positively to the results of the US presidential election. The Nasdaq Composite (^IXIC) is up a notable 400 points today. The race for control of the House of Representatives remains in focus. The Democrats have won 181 seats while the Republicans have 199 seats, with 55 seats yet to be called. However, the Republicans have secured a majority in the Senate. Meanwhile, gold (GC=F) prices are falling as investors shift away from the traditional safe-haven asset and embrace the Trump trade instead. Stocks in the green energy sector that were previously buoyed by the prospect of a Democratic victory are now plummeting in the wake of Trumps win. Another stock in the spotlight is Meta Platforms (META) as the Supreme Court is set to hear an appeal from the tech giant regarding a securities fraud lawsuit today. To watch more expert insights and analysis on the latest market action, check out more Wealth here. This post was written by Angel Smith"
104,2024-11-08,Families Battle Tech Giants as Australia Pushes for an Under-16 Social-Media Ban Families Battle Tech Giants as Australia Pushes for an Under-16 Social-Media Ban
105,2024-11-08,"Can Meta actually prevent fraud cases on its platforms? After expanding its Fraud Intelligence Reciprocal Exchange with UK Banks, will users see any improvement in fraud cases on Meta platforms?"
106,2024-11-09,Heard on the Street: Tesla at $1 Trillion Finally Clears Its Twitter Discount Tesla is a $1 trillion company again.  The EV maker’s stock jumped more than 8% Friday to put the company’s closing market cap over that threshold for the first time since April 2022.  Worries among Tesla investors about the boss’s growing list of distractions and controversial behavior online sparked a selloff on the stock--one that was even harsh enough to get Musk to reconsider his plans and try to get out of the deal.
107,2024-11-10,This Magnificent Artificial Intelligence (AI) Stock Could Hit a $2 Trillion Valuation in the Next 3 Years The growing adoption of AI in the digital ad market should help this social media giant deliver robust earnings growth and stock upside over the next three years.
108,2024-11-10,Inflation and retail sales data greet a roaring stock market rally: What to know this week A key inflation reading is set to greet investors amid a roaring post-election rally in markets.
109,2024-11-11,"The Election Is Over: Heres What Really Matters For Investors Now Despite short-term risks, the fundamentals of the economy are robust. Find out my thoughts on what really matters for investors now."
110,2024-11-12,"IBD Stock Of The Day: Meta Forms New Base Amid AI Spending Debate Meta Platforms is the IBD Stock of the Day for Monday.  Shares of the Facebook parent company have formed a flat base pattern after bouncing back last week from a slight earnings letdown.  Meta stock has traded between a high of 602.95 — its flat base buy point, according to MarketSurge — and 555 since early October."
111,2024-11-12,Auxier Asset Management Fall 2024 Market Commentary US stocks in the third quarter were boosted broadly by a combination of a Federal Reserve interest rate cut and a 17% drop in oil. Read more here.
112,2024-11-12,"We May Not Get Our Recession Until The AI Spending Bubble Implodes AI-related spending on the income statement that pushes down earnings includes salaries of AI-related staff, additional office space, software services, etc."
113,2024-11-12,3 Technology Stocks to Buy Hand Over Fist in November These three tech giants are poised to deliver future returns with the help of artificial intelligence.
114,2024-11-13,"Baidu Unveils AI-Powered Smart Glasses to Compete with Meta Platforms, Inc. (META) in Expanding AI Wearable Market We recently compiled a list of the 13 AI News You Probably Missed. In this article, we are going to take a look at where Meta Platforms, Inc. (NASDAQ:META) stands against the other AI stocks. Artificial intelligence has penetrated every aspect of our lives. The latest indication of this comes from the Vatican, which recently revealed […]"
115,2024-11-13,"Top 10 Quant Stocks Of 2024: Up Over 120% AI innovation, interest rate shifts, and political changes reshaped the investment landscape in 2024. Discover how our top stocks outperformed the market."
116,2024-11-13,"Weitz Large Cap Equity Fund Q3 2024 Commentary The Large Cap Equity Funds Institutional Class posted strong absolute and relative results for the third quarter, returning +7.84% compared to +6.08% for the Russell 1000 Index."
117,2024-11-14,"Trump’s second term will have enormous implications for Big Tech. Heres why. When President-elect Trump takes office in January, hell be forced to tackle a slew of major tech policy questions."
118,2024-11-14,Facebook Switches to ‘Views’ As its Primary Metric Facebooks following Instagrams lead in making Views its focus metric.
119,2024-11-14,EU fines Meta £660m for competition rule breaches over Facebook Marketplace The European Commission said Meta had acted illegally in tying the Marketplace to the social network arm of the platform.
120,2024-11-15,Vertiv Stock Is Up 150%. Next Week Could Bring More Gains. Vertiv Stock Is Up 150%. Next Week Could Bring More Gains.
121,2024-11-15,AI Spending Remains a Focus. How Cisco Is Benefiting. AI Spending Remains a Focus. How Cisco Is Benefiting.
122,2024-11-16,"Meta Platforms, Inc. (NASDAQ:META): Among the Best Metaverse Stocks To Buy According to Hedge Funds We recently compiled a list of the 10 Best Metaverse Stocks To Buy According to Hedge Funds. In this article, we are going to take a look at where Meta Platforms, Inc. (NASDAQ:META) stands against the other Best Metaverse Stocks to Buy According to Hedge Funds. What is the Metaverse? According to McKinsey & Company, the […]"
123,2024-11-18,"Nvidia Looks Poised To Beat Q3 Earnings Financial writer sees another earnings beat for Nvidia Corporation in Q3 despite AI CAPEX growth, but has valuation concerns. Click for my NVDA earnings preview."
124,2024-11-18,"Tracking Mario Gabellis Gabelli Funds 13F Portfolio - Q3 2024 Update Gabelli Funds 13F portfolio value grows to $13.87B, with top holdings in Microsoft and Lennar. Click here to read more about the trades and holdings in Q3."
125,2024-11-18,"Nasdaq 100 Infighting Makes QQQM, QQQ Risky Bets (Technical Analysis) Technical analysis is crucial for understanding market trends and assessing probabilities and possibilities. Here is an analysis of Nasdaq 100s current charts."
126,2024-11-18,"Meta Platforms, Inc. (META) Spends Big on Azure OpenAI Services We recently published a list of 15 AI News That Broke The Internet This Week. In this article, we are going to take a look at where Meta Platforms, Inc. (NASDAQ:META) stands against other AI news that broke the internet this week. AI trends are sweeping markets globally. On November 14, TikTok, the popular social […]"
127,2024-11-18,"Fidelity Select Communication Services Portfolio Q3 2024 Review For Q3 2024, Fidelity Select Communication Retail Class shares gained 3.51%, lagging its benchmark Index. Click here to read the full commentary."
128,2024-11-19,"Judge tosses Huckabee lawsuit against Meta over ads suggesting he endorsed marijuana gummies A federal judge in Delaware on Monday dismissed a lawsuit filed by former Arkansas Gov. Mike Huckabee against social media giant Meta over advertisements using his name and image to sell CBD products.  Huckabee, a Baptist minister and President-elect Donald Trump’s nominee to be U.S. ambassador to Israel, claimed Meta allowed and profited from the advertisements that falsely claimed he used and endorsed CBD gummies.  CBD, or cannabidiol, is one the main active ingredients in marijuana but does not, by itself, provide the high caused by psychoactive THC."
129,2024-11-19,"Meta to appeal Indian order that curbs data-sharing between WhatsApp, other apps Meta Platforms said on Tuesday it plans to appeal an order by Indias competition watchdog that restricts the U.S. tech firm from sharing data for advertising between WhatsApp and its other..."
130,2024-11-19,"Meta disagrees with India antitrust ruling on WhatsApp, to mount legal challenge The Competition Commission of India (CCI) directed WhatsApp to refrain from sharing user data for advertising purposes with other Meta-owned applications for five years and fined the U.S. tech giant $25.4 million on Monday over antitrust violations related to the messaging applications 2021 privacy policy.  The CCI had begun an investigation into WhatsApps 2021 privacy policy in March that year.  The policy allowed data sharing between Meta and its units, sparking a global backlash."
131,2024-11-19,"Italian lawmakers urge government to scale back crypto, web tax plans Italian ruling-coalition lawmakers are urging the government to scale back plans to increase taxes on cryptocurrency capital gains and expand the number of firms forced to pay a digital tax, a..."
132,2024-11-19,"Billionaire Mark Zuckerberg Has Transformed Meta into a Generative AI Leader. But Is the Stock a Buy? Perhaps no company in history has burned more cash on a project than Meta Platforms (NASDAQ: META).  The social media giant has spent tens of billions of dollars on Reality Labs, its business that encompasses Metas version of the metaverse (which looks like a failure at this point), and its Quest VR headsets (which have struggled to gain traction).  Meta started doing research in AI more than 10 years ago, initially working on facial recognition technology."
133,2024-11-20,There Are More Billionaires Than Ever. And They Keep Getting Richer. There Are More Billionaires Than Ever. And They Keep Getting Richer.
134,2024-11-20,Big Tech stocks fall sharply as investors await Nvidia earnings Big Tech stocks fall sharply as investors await Nvidia earnings
135,2024-11-21,"Meta Platforms : Cracking Down On Organized Crime Behind Scam Centers Meta Cracking Down On Organized Crime Behind Scam Centers November 21, 2024November 21, 2024 Takeaways ..."
136,2024-11-21,"Making Sense Of Nvidias $3.6 Trillion Market Cap Analyzing Nvidia Corporations stock surge and valuation based on growth expectations, revenue projections, margins, and market trends. Click for my NVDA update."
137,2024-11-21,"RiverPark Long/Short Opportunity Fund Q3 2024 Investor Letter The RiverPark Long/Short Opportunity Fund returned 0.66% in Q3 24 vs. the S&P 500 Total Return Index, which returned 5.89%. Click here to read the full fund letter. "
138,2024-11-21,3 Unstoppable Stocks With Competitive Moats That Appear Poised to Become Wall Streets Next Stock-Split Stocks in 2025 Three brand-name businesses are perfectly positioned to become Wall Streets premier stock splits in the new year.
139,2024-11-22,"Meta Platforms (META) Hosts Llama Impact Hackathon: AI Innovations in Healthcare, Clean Energy, and Social Mobility We recently published a list of 14 AI Stocks to Watch According to Latest News and Ratings. In this article, we are going to take a look at where Meta Platforms, Inc. (NASDAQ:META) stands against other AI stocks to watch according to latest news and ratings. Artificial intelligence businesses have taken Wall Street by storm […]"
140,2024-11-23,"Meta Must Face Investor Suit After Supreme Court Drops Case (Bloomberg) -- The US Supreme Court dismissed an appeal by Meta Platforms Inc., leaving it to face a multibillion-dollar lawsuit that accuses the company of misleading shareholders about the data-harvesting scandal involving political consulting firm Cambridge Analytica.Most Read from BloombergNYCs Underground Steam System May Be Key to a Greener FutureNYC Gets Historic Push for 80,000 Homes With $5 Billion PledgeTrump Promises Could Have Seismic Impact on Washington EconomyNYC Mayor Adams Name"
141,2024-11-24,"After Nvidia earnings, is the AI trend still investors’ friend? When it comes to investing, AI is very much about the potential. Recent earnings illustrate why."
142,2024-11-24,"Google: Buying Opportunity Knocking On The Front Door Googles core business remains robust, driven by growth in Google Cloud, YouTube monetization, and Generative AI integration. Read why GOOG stock is a Buy."
143,2024-11-24,Nvidias Results Reveal 2 Major Flaws With The Stock Nvidias predictable revenue and guidance patterns make it difficult to surprise the market. Click here to find out more about NVDA stock here.
144,2024-11-24,"1 Unstoppable Growth Stock That Could Join Nvidia, Apple, Amazon, Alphabet, Meta Platforms, and Microsoft in the Trillion-Dollar Club By 2040 In 2018, Apple famously became the first publicly traded company in the U.S. to hit a $1 trillion valuation.  Since then, several more have hit that milestone, including several of Apples peers in the tech industry: Microsoft, Alphabet, Amazon, Nvidia, and Meta Platforms.  One of them could be Shopify (NYSE: SHOP), an e-commerce specialist currently sporting a market cap of $135 billion."
145,2024-11-27,Update: Meta Platforms Threads Reportedly Major Beneficiary of Recent Exodus by Former X Users (Adds company response confirming increase in new users in second and third paragraphs.
146,2024-11-27,Why Chrome Divestiture Worries Are Exaggerated - Google Remains A Strong Buy Googleâs strong Q3 earnings offset regulatory challenges. See why GOOG stock remains a buy with 21% annual return potential despite antitrust risks.
147,2024-11-27,"Metas Day in Court: The Trial That Could Rewrite Big Techs Playbook FTC vs. Meta: A showdown over Instagram, WhatsApp, and the future of tech monopolies."
148,2024-11-28,Meta’s Mark Zuckerberg dines with Trump at Mar-a-Lago Meta’s Mark Zuckerberg dines with Trump at Mar-a-Lago
149,2024-11-28,"It’s Getting Even More Expensive to Buy a European Ski Home Europe’s top-tier ski homes are concentrated in Switzerland and France, with the addition of Austria’s Kitzbühel, according to an analysis provided to The Wall Street Journal by Knight Frank, the U.K.-based real-estate company.  Favorable tax policies and old-fashioned quaintness have helped make Switzerland’s Gstaad Europe’s most expensive ski town, with high-end sales now averaging $4,131 per square foot, according to Knight Frank’s price index of premium residential sales."
150,2024-11-28,"Want $1 Million in Retirement? 3 Stocks to Buy Now and Hold for Decades. Amazon (NASDAQ: AMZN) CEO Andy Jassy often predicts in his companys quarterly conference calls what he thinks will happen with the cloud market.  Jassy will first note that at least 85% of global IT spending is still on-premises with the rest in the cloud.  Interestingly, Jassy had a similar forecast in Amazons latest quarterly call."
151,2024-11-29,QQQ: Dont Let The Skeptics Fool You Invesco QQQ Trust ETF is a tech-focused ETF that has demonstrated its outperformance over time. Click here to find out why I maintain a buy rating on QQQ.
152,2024-11-29,"The 25 Best Tech Gifts of 2024, According to Our Gadget Gurus PERSONAL TECHNOLOGY When tech gifts solve problems and improve lives, they’re not just for the geeks, they’re for everyone. The proof is in this guide, which features only gear we tested ourselves and loved."
153,2024-11-29,FPA Crescent Fund Q3 2024 Commentary The FPA Crescent Fund - Institutional Class gained 3.70% in Q3 2024 and 21.27% in the trailing twelve months.
154,2024-11-30,"Meta Platforms (META) Chief Scientist Predicts AGI Within 10 Years We recently published a list of 15 AI News Updates That Investors Are Watching. In this article, we are going to take a look at where Meta Platforms, Inc. (NASDAQ:META) stands against the other AI stocks. The chip wars between the United States and China are in full swing. After reports that the US was […]"
155,2024-12-02,Trump’s pick to run FCC is an ominous sign for Big Tech The country’s tech titans might need to start fortifying defenses against the agenda of incoming Federal Communications Commission chair Brendan Carr.
156,2024-12-02,"Tracking Ray Dalios Bridgewater Associates 13F Portfolio - Q3 2024 Update Bridgewater Associates 13F portfolio decreased to ~$17.66B. Read more to see the portfolios Q3, 2024 update."
157,2024-12-02,Musk’s Rivals Fear He Will Target Them With His New Power OpenAI’s Sam Altman ranks high on the billionaire’s list of enemies; car companies and tech giants scramble for allies in the incoming Trump administration.
158,2024-12-03,"Tracking Dan Loebs Third Point Portfolio - Q3 2024 Update Read here for an update on Dan Loebs Third Point 13F portfolio changes, including new stakes, disposals, and major stake increases and decreases."
159,2024-12-03,Should Your Long-Term Goal Be To Live Off Dividends? Dividend investing comes in many forms. Why Dividendology focuses long-term on dividend growth investing.
160,2024-12-04,"Meta Platforms : Get Closer to Your Community With Replies, Prompts and Insights Instagram Get Closer to Your Community With Replies, Prompts and Insights December 4, 2024December 4, 2024 Takeaways ..."
161,2024-12-04,Tech Giant Meta Seeking Nuclear Power to Support Data Centers Facebook parent Meta wants to find developers that can provide nuclear reactors to support electricity demand from the tech company’s data centers and artificial intelligence (AI) efforts. The group said […]
162,2024-12-04,"Reddit: Looking For More Massive Growth (Rating Upgrade) Reddit stock has soared 225% this year, fuelled by user and revenue growth, outperforming the S&P 500. See why I am upgrading RDDT stock to Hold."
163,2024-12-04,"Meta Sets a Record High. Why the Stock Is on a Roll. The tighter range for the stock came around the time Meta disclosed its third-quarter earnings, which raised concern among investors about decelerating growth on Meta’s top line.  Shares are up by almost 8% since CEO Mark Zuckerberg dined with President-elect Donald Trump on Nov 27.  The analyst consensus price target for Meta is $653.57, implying a 6.5% gain from Tuesday’s close."
164,2024-12-04,Meta Announces Interactive Updates for Broadcast Channels New ways to utilize your one-to-many chats.
165,2024-12-05,"Meta Platforms Inc. stock rises Wednesday, still underperforms market Meta Platforms Inc. stock rises Wednesday, still underperforms market"
166,2024-12-05,"Traders Game Out TikTok Scenarios for Meta, Alphabet, Oracle (Bloomberg) -- Tech investors are girding for the latest development in TikTok’s legal saga. Social media and search companies like Meta Platforms Inc. have a lot at stake, as does Oracle Corp., which counts TikTok as a big customer.Most Read from BloombergAs Wars Rage, Cities Face a Dark New Era of Urban DestructionKansas City Looks Back on its Long, Costly Ride With MicrotransitRiyadh Metro Partially Opens in Bid to Ease City’s Traffic JamsThe US Court of Appeals in Washington is due to issue"
167,2024-12-05,The UC Berkeley Project That Is the AI Industry’s Obsession Chatbot Arena ranks the world’s best AI models on a leaderboard based on user voting in head-to-head competitions between bots.
168,2024-12-05,Trump just gave a new signal he isnt going to let up on Big Tech President-elect Donald Trump is making it clear he doesnt intend to ease up on the nations technology giants once he is back in the Oval Office.
169,2024-12-06,"Columbia Large Cap Growth Fund Q3 2024 Commentary Columbia Large Cap Growth Fundâs Institutional Class shares returned 2.20% for the 
three months ending September 30, 2024. Click here to read the full commentary. "
170,2024-12-06,TikTok Ban Upheld by U.S. Appeals Court. Meta and Snap Stocks Are Rising. TikTok Ban Upheld by U.S. Appeals Court. Meta and Snap Stocks Are Rising.
171,2024-12-06,"Meet the Unstoppable Artificial Intelligence (AI) Stock That Could Join Apple, Nvidia, and Microsoft in the $3 Trillion Club by 2028 This tech giant could ultimately be the biggest beneficiary from artificial intelligence."
172,2024-12-07,This Is The Latest Utility Stock Riding The AI Wave With $10 Billion Meta Project This Is The Latest Utility Stock Riding The AI Wave With $10 Billion Meta Project
173,2024-12-07,"How to play the software sector in AI age: Adobe, Oracle, Salesforce Ahead of Adobe (ADBE) and Oracle (ORCL) reporting earnings, BNP Paribas Exane global head of software research Stefan Slowinski joins Julie Hyman and Josh Lipton on Market Domination to discuss his strategy for navigating software stocks in 2025, which he expects to be the year of artificial intelligence (AI) agents. Slowinski says the software sector has made a 180-degree turn in the last six months of 2024, with a turn in sentiment that AI agents are finally the killer app that allows companies to monetize Gen AI. Among the software players, Slowinski names Salesforce (CRM) and Oracle (ORCL) as stocks still trading at reasonable valuations that are positioned to gain from the adoptions of AI agents and copilots. On the other hand, Adobe (ADBE) is one he has worries about. Part of our concern around Adobe is just the increasing competition from the hyperscalers, like Alphabet (GOOG, GOOGL), Meta (META), Amazon (AMZN), and Microsoft (MSFT). To watch more expert insights and analysis on the latest market action, check out more Market Domination here. This post was written by Naomi Buchanan."
174,2024-12-07,"UnitedHealth Backlash Signals Possible Shift in Washington and on Wall Street Investors have been counting on a deregulatory surge in the health insurance business, but it might not be so simple in the wake of the fatal shooting of a UnitedHealth Group executive."
175,2024-12-07,"Nvidia Remains AWOL, But Palantir Stock Strikes Again — Big Time Nvidia Remains AWOL, But Palantir Stock Strikes Again — Big Time"
176,2024-12-07,Appeals Court Upholds U.S. Ban of TikTok A three-judge panel ruled Congress has the power to shut down the Chinese-backed app in the U.S. because of national security concerns.
177,2024-12-08,Meta’s Biggest-Ever Data Center Could Lift These 5 Companies Louisiana utility Entergy has already submitted plans to build three natural gas plants that can serve the data center campus with 2.2 gigawatts of capacity.
178,2024-12-08,"Metas AI CAPEX Fears, Regulatory Concerns Are Overblown Meta Platformsâ current roadmap is centered on making glasses the form factor for AI in the coming years. Read why I remain bullish on META stock."
179,2024-12-09,Reddit Stock Is on the Rise. Analysts Expect ‘Outsized Returns.’ Reddit Stock Is on the Rise. Analysts Expect ‘Outsized Returns.’
180,2024-12-09,"Covert Facebook Network Found to Be Targeting Romanian Voters (Bloomberg) -- Meta Platforms Inc. allowed a network of Facebook pages to post more than 4,100 political ads attacking Romania’s pro-EU presidential candidate Elena Lasconi and promoting far-right figures, including Calin Georgescu, in the run-up to the country’s elections, a report showed.Most Read from BloombergA Chicago Skyscraper Cements the Legacy of a Visionary Postmodern ArchitectBrace for a Nationwide Shuffle of Corporate HeadquartersNYC’s Run-Down Bus Terminal Gets Approval for $10 Bill"
181,2024-12-09,"Trump aides contact Google, Meta, Snap over online drug sales, The Information reports A representative for Jim Carroll, the drug czar during Trumps first term, and Trumps transition team emailed staffers from the three tech giants on Thursday, as well as those from Snap and TikTok, to invite them to a call, the report added, citing a person with direct knowledge of the correspondence.  The transition officials want to hear from the companies about their priorities and any barriers to addressing issues around the sales of drugs online, the person told the Information."
182,2024-12-09,"Interpublic Stock Soars on Omnicom Deal. Why It’s All About Meta and Google. Omnicom  and  Interpublic Group  appear to have decided that they’d be better off together as they try to stop Big Tech giants like  Alphabet  and  Meta Platforms  from eating their lunch.  The longtime rivals announced on Monday that Omnicom will buy Interpublic in a stock-for-stock transaction, creating the world’s largest advertising agency.  Under the terms of the deal, Omnicom shareholders will own 60.6% of the new combined company."
183,2024-12-09,"Meta Platforms (META) Announces $10 Billion AI Data Center in Louisiana, Expands Renewable and Nuclear Energy Initiatives We recently compiled a list of the 12 AI News and Ratings Investors Probably Missed. In this article, we are going to take a look at where Meta Platforms, Inc. (NASDAQ:META) stands against the other AI stocks that investors probably missed. AI is increasingly shaping diverse industries, from healthcare and website design to cybersecurity. Companies are […]"
184,2024-12-09,"Advertising Firms Omnicom and Interpublic Nearing Merger That Would Reshape Industry A deal would create the world’s largest advertising company, with net revenue of more than $20 billion, topping WPP’s $15.1 billion."
