301,"Is NextEra Energy, Inc. (NEE) the Best Energy Stock to Invest in According to Billionaires? We recently published a list of 12 Best Energy Stocks to Invest in According to Billionaires. In this article, we are going to take a look at where NextEra Energy, Inc. (NYSE:NEE) stands against other best energy stocks to invest in according to billionaires. After significantly lagging behind in 2024, the broader energy sector finally […]"
302,Highly Rated Low Volatility Stocks And ETFs For Todays Market Market volatility last week was the highest it has been in 2025. Click to read.
303,"NextEra Energy (NEE) Stock Sinks As Market Gains: Heres Why In the most recent trading session, NextEra Energy (NEE) closed at $70.07, indicating a -1.14% shift from the previous trading day."
304,"NextEra Energy : FPL’s continued grid investments lead to best overall service reliability in 2024 The latest: In a recent filing with the Florida Public Service Commission, Florida Power & Light Company reported 2024 as the best year ever for the companys overall system reliability according to..."
305,"UTF: Recent Investment Announcements Into The U.S. Will Provide Tailwinds For Infrastructure UTFs diverse holdings in utilities, industrials, and energy sectors are poised to benefit from increased infrastructure spending. Read why UTF is a Strong Buy."
306,"Is NextEra Energy Inc. (NEE) The Best Defensive Stock Amid Market Volatility? We recently published a list of 15 Best Defensive Stocks Amid Market Volatility In this article, we are going to take a look at where NextEra Energy Inc. (NYSE:NEE) stands against other best defensive stocks amid market volatility. With ongoing inflation, economic uncertainty, and global tensions, more investors are looking for ways to protect their […]"
307,"Strategically Building A $100,000 Dividend Portfolio For Attractive Income And Strong Risk-Adjusted Returns The Dividend Income Accelerator Portfolio focuses on financially healthy companies with strong balance sheets. Check out the recent additions to the portfolio."
308,abrdn Global Infrastructure Fund Q4 2024 Commentary The abrdn Global Infrastructure Fund underperformed its benchmark in the fourth quarter of 2024. Click here to read the full commentary.
309,3 Magnificent S&P 500 Dividend Stocks Down 20% to 33% to Buy and Hold Forever Buy these beaten-down S&P 500 dividend stocks today and hold them for big returns in the long run.
310,"ClearBridge All Cap Growth Portfolios Q4 2024 Commentary Despite inklings of a market broadening sparked by Donald Trumpâs election victory and further interest rate cuts from the Fed, the post-election rally proved short-lived."
311,"Janes February 2025 Retirement Income Update: Buying The Broadcom Dip Discover investment insights on Broadcom, Concentrix, and strategic portfolio reallocation for growth, income, and AI exposure."
312,"Otter Tail: Returning To More-Normal Levels Of Manufacturing Profitability Otter Tail Corporationâs electric utility business stays strong. See why OTTR stock is stable for existing investors, even with manufacturing weakness."
313,"NextEra Energy, Inc. (NEE): Jim Cramer Bullish on Growth Utility Potential We recently published a list of Jim Cramer Commented on These 8 Stocks Recently. In this article, we are going to take a look at where NextEra Energy, Inc. (NYSE:NEE) stands against other stocks that Jim Cramer commented on recently. On Wednesday, Jim Cramer, the host of Mad Money, shared his thoughts on a few […]"
314,"NextEra Energy (NEE): Among the Best Dividend Aristocrat Stocks with Over 3% Yield We recently published a list of the 15 Best Dividend Aristocrat Stocks with Over 3% Yield. In this article, we are going to take a look at where NextEra Energy, Inc. (NYSE:NEE) stands against other best dividend aristocrats with a high yield. Dividend Aristocrats are the companies that have raised their payouts for 25 consecutive […]"
315,"NextEra Energy: Buy Ahead Of Tariff Day NextEra Energy stands out among utility companies with its energy infrastructure, modest valuation, and high-growth potential. Click to read why NEE is a Buy."
316,"Best Dividend Aristocrats For April 2025 Dividend Aristocrats in 2025 show resilience, outperforming the S&P 500. Click here to read what investors need to know."
317,AES vs. NEE: Which Stock Should Value Investors Buy Now? AES vs. NEE: Which Stock Is the Better Value Option?
318,"My Top 10 High-Yield Dividend Stocks For April 2025 Q1 2025 ended negatively for SPY and VYM, but my watchlist outperformed. Check out the April 2025 watchlist that includes ten stocks."
319,"NextEra Energy, Inc. (NEE): Among the Best Climate Change Stocks to Buy Now? We recently published a list of 10 Best Climate Change Stocks to Buy Now. In this article, we will look at where NextEra Energy, Inc. (NYSE:NEE) stands against other best climate change stocks to buy now. Investors are focusing on companies driving the transition to a low-carbon economy. Climate change stocks, as defined by the Climate […]"
320,"Texas Attempt to Kickstart New Gas-Fired Power Is Stumbling (Bloomberg) -- A Texas experiment to fund new natural gas-burning power plants with $5 billion in public loans is faltering as several of the proposed facilities drop out, threatening the state’s efforts to meet growing electricity demand. Most Read from BloombergHousing Agency Aims to Relocate Its DC HeadquartersLocal Governments Vie for Fired Federal WorkersMetro-North Is Faster Than Acela on NYC-New Haven Route After Signal UpdatesWhat Would ‘Transportation Abundance’ Look Like?Hochul Says Tr"
321,Keep Calm And Dividend On: 3 Future Proof Stocks To Buy Amid Market Chaos Navigate market uncertainties with a bullish outlook on US equities.
322,Trump Tariff Crash: 3 Magnificent Stocks to Buy at a Discount Right Now Short-term tariff uncertainty paves the way for opportunistic long-term investors to go shopping.
323,"Is NextEra Energy, Inc. (NEE) the Best Clean Energy Stock to Buy According to Billionaires? We recently published a list of the 10 Best Clean Energy Stocks to Buy According to Billionaires. In this article, we are going to take a look at where NextEra Energy, Inc. (NYSE:NEE) stands against other top clean energy stocks according to billionaires. The current overall bearish trend has also dealt a massive blow to […]"
324,"ClearBridge Global Infrastructure Income Strategy Q1 2025 Commentary Infrastructure delivered positive returns in Q1, outpacing both global equities and U.S. equities, which were weaker amid higher policy uncertainty, specifically around tariffs."
325,"NextEra Energy announces date for release of first-quarter 2025 financial results NextEra Energy, Inc. (NYSE: NEE) today announced that it plans to report first-quarter 2025 financial results before the opening of the New York Stock Exchange on Wednesday, April 23, 2025, in a news release to be posted on the companys website at www.NextEraEnergy.com/FinancialResults. The company will issue an advisory news release over PR Newswire the morning of April 23, with a link to the financial results news release on the companys website. As previously communicated, the company will"
326,"NextEra Energy (NEE) Stock Moves -1.54%: What You Should Know NextEra Energy (NEE) closed the most recent trading day at $64.06, moving -1.54% from the previous trading session."
327,"Exxon Vs. NextEra Energy: Fossil Fuels Vs. Renewable Energy, Which Is The Better Investment? ExxonMobil and NextEra Energy serve the U.S. energy market but diverge in strategy. Click here to find out why XOM stock is a Buy."
328,Buy 2 April Aristocrats Out Of 38 Safer Discover Aprils top Dividend Aristocrats with predicted gains up to 98% by 2026.
329,"Artificial Intelligence: Think Outside the AI Box With This Vanguard ETF Artificial intelligence (AI) is expanding its use case throughout the economy at a rapid clip.  The AI industry responsible for this expansion is something of a battleground, however, and it isnt exactly clear which companies are going to end up as winners and losers over the long term.That makes it tough to know which stocks might be worth investing in to take advantage of the significant growth going on.  Heres why it may be worth thinking outside the box when it comes to AI and ETFs."
330,Returns On Capital At NextEra Energy (NYSE:NEE) Have Hit The Brakes What are the early trends we should look for to identify a stock that could multiply in value over the long term...
331,"Concerned About a Recession? These Dividend Stocks Deliver Durable Growth During Downturns. One of the first cuts many economically cyclical companies make is to their dividends.  Through its various local utilities, Consolidated Edison provides electricity and natural gas services to the New York City region and surrounding areas."
332,"NextEra Energy, Inc. (NEE): Among the High Growth Forever Dividend Stocks to Invest In We recently published a list of the 10 High Growth Forever Dividend Stocks to Invest In. In this article, we are going to take a look at where NextEra Energy, Inc. (NYSE:NEE) stands against other high growth forever dividend stocks. Dividend stocks have trailed the broader market over the past two years, largely due to investors […]"
333,"3 Utility Stocks to Buy With $250 and Hold Forever These utility stocks offer substantial dividend income, a smoother ride for shareholders, and sneaky long-term growth potential."
334,"5 Nuclear Energy Stocks in Focus Amid AI-Powered Data Center Growth Watch five nuclear energy stocks amid massive power demand. These are: CEG, BWXT, PCG, AEP, NEE."
335,"Tariff Turmoil Got Your Portfolio Down? All It Takes Is $5,000 Invested in This Rock-Solid Vanguard ETF to Help Generate $150 in Passive Income Per Year. Its been a rough start to 2025, with the S&P 500 having its worst quarter since 2022 followed by escalating trade tensions in April.  Investors looking for broad-based exposure to the utilities sector might want to consider an exchange-traded fund (ETF) like the Vanguard Utilities ETF (NYSEMKT: VPU).  Utilities are the second-best-performing sector year to date and one of just two sectors that are up slightly compared to the S&P 500s more than 8% drop."
336,"Countdown to NextEra (NEE) Q1 Earnings: Wall Street Forecasts for Key Metrics Evaluate the expected performance of NextEra (NEE) for the quarter ended March 2025, looking beyond the conventional Wall Street top-and-bottom-line estimates and examining some of its key metrics for better insight."
337,"DOGE Comes for Clean Energy, Putting Exxon and Occidental Projects at Risk Thousands of Energy Department jobs are expected to be eliminated as Trump goes after a favorite target."
338,Want Better Returns? Dont Ignore These 2 Utilities Stocks Set to Beat Earnings The Zacks Earnings ESP is a great way to find potential earnings surprises. Why investors should take advantage now.
339,"Is NextEra Energy, Inc. (NEE) the Best Long Term Stock to Buy According to Billionaires? We recently published a list of the 10 Best Long Term Stocks to Buy According to Billionaires. In this article, we are going to take a look at where NextEra Energy, Inc. (NYSE:NEE) stands against other best long term stocks. Dividend-paying stocks have traditionally been seen as a solid foundation for investment portfolios, offering steady income […]"
340,"3 Top Dividend Stocks Yielding Over 3% to Buy With $500 Right Now Dividend stocks can be fantastic investments.  The best ones pay an attractive and growing stream of dividend income while also delivering healthy stock price appreciation over the long term.  While there are lots of dividend stocks out there, Johnson & Johnson (NYSE: JNJ), Invitation Homes (NYSE: INVH), and NextEra Energy (NYSE: NEE) are three of the best."
341,"If the Stock Market Continues Sinking, Heres How Id Invest My Next $500 The stock market is having a rough start to the year.  The S&P 500 is down about 15% from its recent peak.  Topping that list are NextEra Energy (NYSE: NEE), Broadcom (NASDAQ: AVGO), and Invitation Homes (NYSE: INVH)."
342,"3 Dirt Cheap Dividend Stocks to Buy During the Stock Market Sell-Off Tariff tensions have rippled through the stock market, pushing the S&P 500 (SNPINDEX: ^GSPC) and Nasdaq Composite (NASDAQINDEX: ^IXIC) into correction territory.  One way to remedy volatility is by investing in dividend stocks.  Quarterly dividend payouts can be a great way to boost your passive income stream amid stock market volatility and build up some dry powder without having to sell stock."
343,"Nvidia Is Expensive. Here Are 3 High-Yield Artificial Intelligence Plays That Arent. Nvidia (NASDAQ: NVDA) has been one of the early beneficiaries of the artificial intelligence (AI) megatrend.  While Nvidias stock has fallen more than 30% from its recent peak over concerns about Deepseek and tariffs, its still expensive at nearly 35 times earnings."
344,NextEra Energy Set to Report Q1 Earnings: How to Play the Stock? NEE stock will benefit from the increasing demand for clean energy in its service territories. Increasing clean energy generation capacity will assist it in meeting rising demand.
345,"3 No-Brainer Energy Stocks to Buy Right Now Demand drivers such as artificial inteligence (AI) data centers, the onshoring of manufacturing, and the electrification of everything will power a 55% surge in electricity demand by 2040, according to some estimates.  Given the continued concerns surrounding climate change, this power will need to come from cleaner sources, including renewables, natural gas, and nuclear.  This forecast makes energy companies focused on supporting growing electricity demand look like no-brainer investments right now."
346,"NextEra beats profit estimates on robust power demand U.S. utility NextEra Energy beat Wall Street estimates for first-quarter profit on Wednesday, boosted by increased electricity demand and strong momentum in its renewable energy business. ..."
347,NextEra Energy Posts Lower 1Q Profit; Outlook Unchanged By Katherine Hamilton NextEra Energy posted a lower profit in the first quarter but expects its yearly outlook to remain the same. The nuclear-energy company on Wednesday posted a profit of...
348,"NextEra: Q1 Earnings Snapshot NEE) on Wednesday reported first-quarter profit of $833 million. The Juno Beach, Florida-based company said it had profit of 40 cents per share. Earnings, adjusted for non-recurring costs, were 99 cents per share."
349,NextEra Energy Expects to See Minimum Tariff Exposure NextEra Energy CEO John Ketchum put the renewable energy unit’s exposure to tariffs at less than $150 million through 2028 on more than $75 billion in expected capex.
350,"NextEra (NEE) Reports Q1 Earnings: What Key Metrics Have to Say Although the revenue and EPS for NextEra (NEE) give a sense of how its business performed in the quarter ended March 2025, it might be worth considering how some key metrics compare with Wall Street estimates and the year-ago numbers."
351,"Is NextEra Energy, Inc. (NEE) the Best Value Dividend Stock to Invest in According to the Media? We recently published a list of the 10 Best Value Dividend Stocks to Invest in According to the Media. In this article, we are going to take a look at where NextEra Energy, Inc. (NYSE:NEE) stands against other best value dividend stocks. In just a few weeks, investor sentiment has shifted dramatically—from optimism after the elections […]"
352,"NextEra beats profit estimates as power company skirts trade risk (Reuters) -NextEra Energy beat Wall Street estimates on Wednesday on rising electricity demand as the giant U.S. power provider works to maneuver around intensifying global trade risks, its CEO said.  Rising costs brought by U.S. President Donald Trumps tariff fight threaten to slow a recent surge in electricity demand and dent expansion plans by the countrys power companies.  NextEra, which is among the largest renewable energy companies in the world, said that by shifting its tariff exposure to suppliers and contracting with domestic battery manufacturers, it has brought its trade risk to $150 million on $75 billion capital expenditures, or less than 0.2%."
353,NextEra Energy: Visible Earnings Growth Outlook NextEra Energys storage sourcing strategy reduces cost risk versus peers reliant on Chinas supply chain. See why I rate NEE stock a Buy now.
354,"1 Magnificent Dividend Stock Down 30% to Buy and Hold Forever The stock offers a 3.4% yield, accompanied by double-digit dividend growth and a decades-long growth opportunity."
355,"NextEra Energy CEO urges ‘energy pragmatism’ amid rising costs, demand Plans for new natural gas generation could be harder hit by tariffs than solar or storage projects, CEO John Ketchum said."
356,"NextEra Energy first-quarter 2025 financial results available on companys website JUNO BEACH - NextEra Energy, Inc. has posted its first-quarter 2025 financial results in a news release available on the companys website by accessing the following link:..."
357,"CMS Energy Q1 Earnings Miss Estimates, Revenue Increase Y/Y CMS first-quarter earnings miss the Zacks Consensus Estimate by 2.9%. However, its top line increases 12.5% from the year-ago quarter."
358,"PG&E Q1 Earnings Lower Than Expected, Revenues Increase Y/Y PCGs first-quarter earnings lag the Zacks Consensus Estimate, while revenues grow year over year. The companys 2025 adjusted EPS guidance remains unchanged."
359,"CenterPoint Energy Q1 Earnings Miss Estimates, Revenues Improve Y/Y CNPs first-quarter earnings miss estimates, while revenues rise year over year by 11.5%. The companys 2025 EPS outlook remains unchanged."
360,"How to Play NextEra Energy Stock After Q1 Earnings Beat NEE continues to gain from the decline in interest rates, low-cost strategically located assets, and increasing clean energy generation capacity to meet demand from its expanding customers."
361,"NextEra Energy (NYSE:NEE) Reports Q1 Sales Increase But Net Income Decline NextEra Energy (NYSE:NEE) announced its earnings for Q1 2025, revealing a significant 63% drop in net income despite a 9% increase in sales. This mixed financial performance coincided with a 2.48% rise in the companys share price over the past week. The price movement remained in line with the broader market, where indexes like the Nasdaq saw gains driven by investor enthusiasm around earnings reports and potential tariff news from Washington. While the declining net income might have..."
362,"3 Megatrends Are Creating A Once-In-A-Generation Boom For Infrastructure Stocks Markets are volatile, but infrastructure shines under todayâs macro conditions. See which stocks picked offer lasting dividend growth and real wealth."
363,"6 Dividend Growth Stocks Im Buying As The Trade War Hits Stalemate See here for insights on tariffs, recession risks, and dividend growth stocks. Click for my top dividend growth stocks in the current macroeconomic climate."
364,"Renewables Emerge as Key to Meet AI-Driven Energy Demand NextEra Energy asserts that renewable energy sources are crucial for addressing the increasing U.S. power demand driven by AI and manufacturing growth, positioning them as a vital bridge until new gas and nuclear capacities are developed."
365,"The Market May Be About To Get Turned Upside Down With the rise of AI, traditional index funds like SPY and QQQ could face challenges. Read why infrastructure and farmland could become the biggest winners."
366,"Is NextEra Energy, Inc. (NEE) Among the Most Profitable Utility Stocks to Buy Now? We recently published a list of 10 Most Profitable Utility Stocks to Buy Now. In this article, we are going to take a look at where NextEra Energy, Inc. (NYSE:NEE) stands against other most profitable Utility stocks to buy now. Utility companies supply basic utilities like water, gas, and electricity. The demand for these stocks’ […]"
367,"Here Are My Top 3 High-Yield Dividend Stocks to Buy Now My top three high-yielders to buy right now are Brookfield Renewable (NYSE: BEPC)(NYSE: BEP), Enbridge (NYSE: ENB), and NextEra Energy (NYSE: NEE).  Brookfield Renewable is a leading global renewable energy producer and sustainable solutions company."
368,"Entergys Q1 Earnings Surpass Estimates, Revenues Increase Y/Y ETRs first-quarter earnings beat the Zacks Consensus Estimate by 32.3%. Its top line increases 1.9% from the year-ago quarter."
369,"Stock Market Crash: 3 High-Yielding Dividend Stocks Near Their 52-Week Lows to Buy Right Now The three stocks listed here below all pay more than a 3% dividend yield.  Many stocks have been falling this year, and if youre a dividend investor, you know that means yields are rising as a result.  Three stocks that offer yields of more than 3% and which are trading near their 52-week lows today are Merck (NYSE: MRK), NextEra Energy (NYSE: NEE), and Comcast (NASDAQ: CMCSA)."
370,The Davenport Insider Buying Fund Q1 2025 Commentary The Davenport Insider Buying Fund (DBUYX) generated a -5.96% total return in the first quarter of 2025. Click here to read the full commentary. 
371,"The Davenport Balanced Fund Q1 2025 Commentary The Davenport Balanced Fund generated a 2.88% total return in the first quarter of 2025, outperforming its Index. Click here to read the full commentary. "
372,"The Davenport Value & Income Fund Q1 2025 Commentary The Davenport Value & Income Fund generated a 3.83% total return in Q1 2025, outperforming the Russell 1000 ValueÂ® Index. Click here to read the full commentary. "
373,"Constellation Energy: Too Expensive At Too High Risks Constellation Energy is overvalued with poor profitability and growth compared to peers, making it an inefficient investment. Read why CEG stock is a sell."
374,"NextEra Energy, Inc. (NEE): One of the Cheap Quarterly Dividend Stocks to Buy Now We recently published a list of the 10 Cheap Quarterly Dividend Stocks to Buy Now. In this article, we are going to take a look at where NextEra Energy, Inc. (NYSE:NEE) stands against other overlooked dividend stocks. In the current market environment, investors are looking to seek stable income as a way to protect themselves against […]"
375,"Best Dividend Aristocrats For May 2025 Dividend Aristocrats lag behind the S&P 500 in April, but 25 are undervalued with 10% returns potential. Click to read about promising Aristocrats."
376,Dominion Energys Q1 Earnings & Revenues Surpass Estimates Ds first-quarter earnings are better than expected. The company benefits from the rising load from data centers.
377,"Consolidated Edison Q1 Earnings Miss Estimates, Revenues Rise Y/Y EDs first-quarter earnings miss estimates, and revenues grow 12.1% year over year. The companys operating income rises during the same period."
378,"This Is the Quintessential Energy Stock to Buy for the Coming Power Surge The U.S. will need to add an estimated 450 gigawatts of power-generating capacity by 2030.  Given the limitations of gas and nuclear, renewables will play a leading role in the near term.  NextEra Energy is in an ideal position to meet the countrys power needs."
379,"5 Stocks Im Buying As The Economy Dims And Dividends Shine Read my two-cents on the mixed US economic signals, 2025 dividend stock outperformance, and what, I believe, are top buys for growth, income, and market resilience."
380,2 No-Brainer Dividend Stocks to Buy for Income This May NextEra Energy has grown its dividend at a 10% compound annual rate over the past 20 years.  Realty Income has increased its dividend 130 times since its public market listing in 1994.  NextEra Energy (NYSE: NEE) and Realty Income (NYSE: O) are two such dividend stocks.
381,"5 Top Stocks to Buy in May Walmart continues to show resilience amid tariff turmoil.  Micron Technology is an underappreciated growth stock at a compelling value.  Boost your passive income stream with Starbucks, NextEra Energy, and Enbridge."
382,"American Electrics Q1 Earnings Beat Estimates, Revenues Increase Y/Y AEPs Q1 earnings beat the Zacks Consensus Estimate by 10.8%. The top line increases 8.7% from the year-ago level."
383,"3 Top Dividend Stocks to Buy in May NextEra Energy is a dividend stock offering an attractive yield and rapid dividend growth.  Chevron is a long-term survivor in the oil patch with an attractive yield.  Enbridge is a reliable, high-yield dividend stock thats focused on changing with the world."
384,"Fidelity Select Utilities Portfolio Q1 2025 Commentary For Q1 2025, Fidelity Select Utilities Portfolio gained 2.50%, lagging the 5.24% advance of the MSCI U.S. IMI Utilities 25/50 Index. Click here to read the full commentary. "
385,"March/April Readers Tagged 7 Ideal Dividend Dogs From 12 Safer Of 36 Discover the top 10 ReFa/Ro investments with impressive net gains, dividend yields, and target price upsides."
386,"NextEra Energy, Inc. (NEE): Among Stocks That Will Make You Rich In 3 Years We recently published a list of 10 Stocks That Will Make You Rich In 3 Years. In this article, we are going to take a look at where NextEra Energy, Inc. (NYSE:NEE) stands against other stocks that will make you rich in 3 years. Is the Bull Market Over? The stock market has been facing […]"
387,"FPL trains and tests employees during annual storm drill, emphasizes preparedness for 2025 hurricane season The latest: This week, FPL employees are training in a mock hurricane scenario to prepare for storm season, which begins in less than one month.This annual storm drill allows employees to test and..."
388,"NRG Energy: For Those Who Know About Long-Term Investments NRG Energyâs valuation, natural gas investments, and tech-driven efficiency underscore long-term upside. Find out why NRG stock is a buy."
