389,"NextEra Energy, Inc. (NEE): Among the Undervalued Dividend Aristocrats to Buy Now We recently published a list of the 11 Undervalued Dividend Aristocrats to Buy Now. In this article, we are going to take a look at where NextEra Energy, Inc. (NYSE:NEE) stands against other undervalued dividend aristocrats. Dividend-paying stocks are regaining popularity this year as investors look for ways to soften the blow of current market […]"
390,"NextEra Energy, Inc. (NEE): Among the Best Income Stocks to Invest in Now We recently published a list of the Best Income Stocks to Invest in Now. In this article, we are going to take a look at where NextEra Energy, Inc. (NYSE:NEE) stands against other best income stocks. Amid concerns over trade restrictions and a weakening economy, some investors are seeking stability in dividend-paying stocks—a traditional defensive […]"
391,"Janes March 2025 Retirement Income Update: Tariff Turmoil Creates A Buying Opportunity With AVGO buys, 10 dividend hikes, and a shift to preferreds, March trading balanced income growth and downside protection. Find out what drove the changes."
392,"The Zacks Analyst Blog Highlights Texas Instruments, Boeing, NextEra Texas Instruments, Boeing, NextEra are included in this Analyst Blog."
393,"Top Research Reports for Texas Instruments, Boeing & NextEra Energy Todays Research Daily features new research reports on 16 major stocks, including Texas Instruments Incorporated (TXN), The Boeing Company (BA) and NextEra Energy, Inc. (NEE)."
394,"GUT: Utilities Are Decent In A Recession, But This Fund Has Flaws The Gabelli Utility Trust offers an 11.26% yield, significantly higher than peers, but its high premium and distribution sustainability are concerns. Read the full analysis on this CEF here."
395,"Hoping For Gains? Im Buying Quality Utilities For Steady Growth. I prioritize quality utilities and ETFs with growing earnings and net worth for combined capital gains and income, rather than high-yielding income stocks with high expense ratios. Read on."
396,EXC vs. NEE: Which Stock Is the Better Value Option? EXC vs. NEE: Which Stock Is the Better Value Option?
397,"Here Are My Top 2 High-Yield Dividend Growth Stocks to Buy Now The Vanguard Dividend Appreciation Index ETF tracks dividend growers, but has a tiny yield of 1.8%.  Two attractive and higher-yielding dividend growth stocks today are PepsiCo and NextEra Energy.  The Vanguard Dividend Appreciation Index ETF (NYSEMKT: VIG) is a popular exchange-traded fund (ETF)."
398,Nextera Energy Inc Unit Sold $875 Million In Debentures Nextera Energy Inc: * NEXTERA ENERGY INC - UNIT SOLD $875 MILLION IN DEBENTURES- SECFILINGFurther company coverage: ...
399,NextEra Outperforms Industry in Three Months: How to Play the Stock? NEE stock continues to gain from strengthening economic conditions in its service territories and rising demand driven by its expanding customer base.
400,"NextEra Energy (NYSE:NEE) Issues US$875 Million Series U Debentures Maturing in 2085 NextEra Energy (NYSE:NEE) recently issued Series U Junior Subordinated Debentures worth $875 million, bolstering its financial position with a long-term maturity and a favorable interest rate. This capital raise aligns with broader market trends, as the S&P 500 is extending its winning streak. Although the companys net income decline contrasts with broader market gains, its recent capital strategies could have stabilized its position amidst the positive market sentiment, contributing to its..."
