901,ESC 2025: real-world evidence shows efficacy of semaglutide in Swiss T2D patients Improved patient compliance for this injectable therapy will likely lead to increased prescribing by physicians.
902,"Novo Nordisk Vs Eli Lilly: Novo A Clear Winner Many investors favour Eli Lilly (LLY), but I will argue in this report that Novo stock outperforms Lilly in almost every aspect, while trading at a significantly lower price. Read on here."
903,"Novo Nordisk: Keep It Low So I Can Keep Accumulating (Rating Upgrade) Novo Nordisks Q2 growth, strong market share, and innovative drug pipeline make it a top stock pick. Click here to find out why NVO stock is a Strong Buy."
904,Eli Lilly: Why Wall Street Still Loves Its GLP-1 Agonist Drugs Eli Lilly dominates obesity and diabetes treatments with soaring tirzepatide sales and promising oral drug data. Find out why LLY stock is rated a Buy now.
905,"Wall Street Lunch: US Labor Market Sees Big Downward Revisions The U.S. added 911,000 fewer jobs in the 12 months through March 2025, the Bureau of Labor Statisticsâ preliminary benchmark revision showed."
906,Our H2 2025 Top Ideas US economic slowdown heightens stagflation risks and limits market upside. Check out top investment picks to navigate headwinds.
907,"Synopsys China slowdown, Novo Nordisk job cuts, Chewy earnings Morning Brief host Julie Hyman examines three of Wednesdays trending stories: Synopsys (SNPS) stock falling after the company warned of a slowdown in China, Novo Nordisks (NVO) workforce cuts and lowered profit forecast, and Chewys (CHWY) weak second quarter profit despite its sales growth. To watch more expert insights and analysis on the latest market action, check out more Morning Brief."
908,"Novo Nordisk: Job Cuts, Profit Guidance Shock - Why Investors Should Hold Firm Discover why Novo Nordisk A/Sâs 2025 restructuring and staff cuts shouldnt deter investors. Click to explore the long-term NVO growth potential and outlook."
909,"Novo Nordisk: Priced Like Best Days Are Over (Upgrade) Novo Nordisk is deeply undervalued despite stellar fundamentals: 18% sales growth, a 29% OP jump, and a rock-solid balance sheet. See why NVO stock is a buy."
910,"Novo Nordisk Cuts 9,000 Jobs and Slashes Guidance. Why the Stock Is Rising. Novo Nordisk  stock rose in overseas trading after the maker of Ozempic and Wegovy said it would slash about 9,000 jobs as part of a cost-cutting effort.  Novo’s  Danish-listed shares climbed 2.1% to just under 344 Danish kroner, while its American depositary receipts were 0.3% lower shortly after the U.S. opening bell.  The moves came after Novo said it would reduce its global workforce by 11%, with around 5,000 of the job cuts expected in Denmark."
911,"Wegovy and Ozempic maker to cut 9,000 jobs amid stiff competition from Eli Lilly Novo Nordisk, the maker of weight loss drug Wegovy, will lay off about 9,000 people as it grapples with rising competition in the obesity market."
912,Metsera: An Emerging Contender In The GLP‑1 Arena Discover Metseras potential in the obesity drug market. Learn why I rate it a HOLD amid upcoming trial results.
913,"Wegovy maker Novo Nordisk says its cutting 9,000 workers Novo Nordisk said the job cuts will eliminate about 11% of its workforce, with 5,000 of the reductions in Denmark."
914,"Novo Nordisk to lay off 9,000 workers in major restructuring The drugmaker’s new CEO said the moves will help the company be more agile as it deals with competition in the obesity market and a declining stock price."
915,"NVS to Acquire TRML, Add Phase III Cardiovascular Drug to Pipeline Novartis is set to acquire Tourmaline Bio for $1.4B, adding late-stage anti-IL-6 candidate pacibekitug to its cardiovascular pipeline."
916,"Dewpoint Therapeutics Closes Series D Financing to Advance First-in-Class Condensate Modulator (c-mod) into Clinical Development for Gastric Cancer Series D extends runway into 2027, advancing first-in-class c-mod DPTX3186 toward proof-of-concept in gastric cancer.Strong support from leading investors and global pharma partners continues to validate the innovative potential of Dewpoint’s platform. BOSTON, Sept. 10, 2025 (GLOBE NEWSWIRE) -- Dewpoint Therapeutics, the leading biotechnology company in transforming condensate biology into medicine, today announced the closing of its Series D financing to advance DPTX3186, a first-in-class conde"
917,"Rate of employers covering weight-loss drugs is flat, Cigna says (Reuters) -Cigna said on Wednesday the percentage of employers paying for obesity drugs has remained flat year-over-year, though the health insurer still sees an uptick in demand for the wildly popular treatments.  More than 50% of its Evernorth units clients, a group that includes large employers and health plans, cover the drugs for weight management, Chief Financial Officer Brian Evanko said at the Morgan Stanley Healthcare Conference.  Within Cigna Healthcare, its health benefits only segment, which caters more to smaller employers, only about 15% to 20% of clients offer coverage of the medications, he said."
918,Ascletis’ GLP-1RA shows promise with quarterly dosing schedule The Chinese biotech will now pursue the further development of ASC30 in obesity for use as a maintenance and treatment therapy.
919,"Novo Nordisk Tightens Its Belt, Cutting 9,000 Jobs And Its Profit Outlook Novo Nordisk announced a sweeping transformation Wednesday as the drugmaker contends with knockoffs chipping away at its blockbuster drugs."
920,"Hims & Hers Looks Like Hyper Growth At A Reasonable Price Hims & Hers scalable model, product launches, and global expansion plans support its ambitious 2030 revenue and EBITDA targets. Read why HIMS stock is a Buy."
921,"Novo Just Fired 9,000 People--And Investors Are Buying the Dip Mass layoffs, a slashed profit forecast, and a CEO on a mission to reclaim the obesity drug throne"
922,"Wegovy And Zepbound Cost Effective But They Could Break Drug Budgets The Institute for Clinical and Economic Review (ICER) on Tuesday released a Draft Evidence Report assessing the comparative clinical effectiveness and value of Novo Nordisk A/S’ (NYSE:NVO) semaglutide (Wegovy) and Eli Lilly and Co.’s (NYSE:LLY) tirzepatide (Zepbound) for obesity management. ICER is also assessing how these treatments affect additional obesity-related outcomes. In a draft report, the ICER determined that the drugs are cost-effective because, when added on to lifestyle modificatio"
923,"What Looms Ahead After The Dow Jones Topped A Record Of 46,000 Dow Jones hits record 46,000 amid tech and AI gains. What does this mean for investors for the rest of this year? Read the full analysis here."
924,BDC Weekly Review: BDCs Busy Bringing Bonds To Market BDCs dipped slightly as bond issuance rises and leverage builds to support income amid rate shifts. Read why these trends matter for the sector outlook.
925,The GLP-1 Oral Frontier: Novo Nordisk And Eli Lillys 100-Year Duel Enters Its Next Chapter Nordisk and Eli Lilly are set to reshape the oral GLP-1 market as patient demand grows and new therapies emerge. Learn more on LLY and NVO stocks here.
926,"What Might Stock Markets Do If The FOMC Cuts Rates By Only 25 Bps With the FOMC around the corner, get the latest on Fed rate cut expectations for September 2025, market risks, inflation trends, and labor data."
927,"Why I Sold Pfizer To Buy Novo Nordisk While Pfizers market cap and dividends are at risk, Novo has a strong competitive position in GLP-1 TAM. Read why I prefer NVO stock over PFE stock."
928,"How I Would Invest $100,000 In Todays Overpriced Market US stocks face high valuations and stagflation risks. Check out the strategies for investing, stock picking, and asset allocation in todays market."
929,"Novo Nordisk: The Market Is Giving Us A Free Lunch Novo Nordisks stock is severely oversold as the market overreacts to short-term news, which has created a rare buying opportunity. Learn more about NVO stock here."
930,How Trumps Drug Pricing Policies Could Trigger An Epic Pharma Collapse Explore how President Trumps drug pricing policy impacts pharma stocks like PFE & LLY. Learn investment strategies as regulatory risks rise. Click for more.
931,The Secret Blue-Chip Rally No One Knows About: 4 Amazing Ideas To Consider Is Wall Street in a bubble? Read about four stocks that could help investors looking at more market upside.
932,"Eli Lilly: New Orforglipron Data In Focus As Commercial Business Outperforms Eli Lillys strong Q2 results, raised guidance, and robust demand for tirzepatide reinforce confidence in its commercial momentum and market leadership. Learn more about LLY stock here."
933,"It Is Time To Buy Novo Nordisk Hand Over Fist Novo Nordisk A/S is a strong buy for 2024, with cutting-edge drug approvals, cost savings, and robust long-term growth potential. Click for my NVO stock update."
934,"Novo Nordisk A/S (NVO) R&D Investor Event Call (Transcript) Get the latest on Novo Nordisks R&D, obesity, and diabetes pipeline, including updates on"
935,"Novo Nordisk A/S - Special Call Novo Nordisk A/S - Special CallCompany ParticipantsMartin Lange - EVP of R&amp;D, CSO and Member of the Management BoardConference Call ParticipantsMartin..."
936,"Wall Street Breakfast Podcast: FedEx Delivers Earnings Surprise FedEx rallies after topping profit expectations, updating on business. Activist investor Biglari targets Cracker Barrel CEO. Novo Nordisk reduces team for obesity and diabetes education."
937,"Novo Nordisk: Dont Be Deterred By Outlook Downgrades Novo Nordisk A/Ss outlook downgrades are concerning, but strong growth potential and positive study results make NVO stock worth considering. Learn more about NVO stock here."
938,Eli Lilly: Orforglipron Sets Path Of Continued Revenue Growth In T2D And Obesity Discover why LLY stock is rated Buy as sales surge in diabetes & obesity drugs and new treatments drive future growth.
939,"Pfizer Buys Obesity Drug Developer Metsera: Buy Today And Benefit From CVRs Pfizer Inc. acquires Metsera, Inc. to re-enter the obesity drug market. Click for my look at PFZ and MTSR stock and where I see value in the weight loss sector."
940,Here Are 2 Defensive Positions That Are Worth A Look Now It is smart to start considering some more defensive value positions in the portfolio. Check out the insights on NVO and UPS stocks here.
941,"Pfizer Jumps Back into the Weight-Loss Race With $4.9B Acquisition Pfizer said it would buy a clinical stage biopharma company for up to $7 billion, as it eyes the lucrative weight-loss drug market currently dominated by Eli Lilly and Novo Nordisk."
942,"3 Dirt-Cheap Stocks to Buy Right Now These stocks share several common denominators, including attractive valuations."
943,"Pfizer: Metsera Acquisition Is The Missing Piece Of The Obesity Puzzle Pfizer Inc. acquires Metsera, Inc. for up to $7.5B, boosting its obesity pipeline with new therapies. Click for potential FDA action and the impact on PFE and MTSR."
944,"Scholar Rock, A Top 10% Stock, Dives After Catalent Issues Hamper SMA Drug Shares of Scholar Rock tumbled Tuesday after the FDA rejected the companys spinal muscular atrophy drug, citing concerns at a plant."
945,"CVS Health Drives Drug Affordability by Promoting Competition CVS strengthens Caremarks PBM edge with formulary shifts, new partnerships and cost-saving wins for clients."
946,"Pfizer joining GLP-1 race: How Novo & Eli Lilly compare Pfizer (PFE) is entering the weight-loss drug race with its acquisition of Metsera. BMO Capital Markets managing director of biopharma equity research Evan Seigerman Yahoo Finance Head of News Myles Udland on Market Domination to discuss how investors can play the GLP-1 trade in the pharmaceutical sector. To watch more expert insights and analysis on the latest market action, check out more Market Domination."
947,"Expanding GLP-1 horizons: Novo Nordisk leads MASH therapeutic race While only two therapies have so far gained approval, there is strong research and development activity."
948,Can oral GLP-1RAs deliver on the promise of accessible obesity care? Eli Lilly and Novo Nordisk are in a tight race to capture the lucrative oral obesity drug market – but how will their competing treatments reshape the landscape?
949,"Analysis: Innovents weight-loss drug highlights China challenge for Novo, Lilly SHANGHAI (Reuters) -Innovent Biologics newly launched weight-loss drug is making inroads in its home market of China, ramping up competition with its Western rivals as it pursues a marketing strategy that is gaining traction.  Xinermei, launched in July, is the third once-weekly injectable GLP-1 weight management therapy available in China after Novo Nordisks Wegovy and Eli Lillys Mounjaro.  Those were introduced in late 2024 and January 2025 respectively, several months after their own approvals, into a Chinese weight-loss drug market that is expected by analysts to be worth billions in the coming years."
950,"Indias Fortis to expand obesity clinics amid weight-loss therapy boom, CEO says NEW DELHI (Reuters) -Indias Fortis Healthcare plans to open more dedicated obesity clinics across its hospitals to meet surging demand for weight-loss drugs and therapies in the worlds most populous nation, its CEO told Reuters.  The India launch of popular weight-loss drugs such as Eli Lillys Mounjaro and Novo Nordisks Wegovy this year has heightened patient awareness in the nation projected to have the worlds second-largest population of obese people by 2050.  We are witnessing a sharp rise in patient interest and demand for structured guidance on weight management and newer obesity-related therapies, Fortis Managing Director and Chief Executive, Ashutosh Raghuvanshi, said in an interview earlier this month."
951,"Scholar Rock SMA drug rejected by FDA over manufacturing concerns The denial sets back a drug Scholar Rock hopes to become part of a new standard of care for spinal muscular atrophy, treatment for which has changed dramatically over the last decade."
952,"Novo Nordisk (NVO) Stock Sinks As Market Gains: Heres Why In the most recent trading session, Novo Nordisk (NVO) closed at $60.71, indicating a -1.12% shift from the previous trading day."
953,European Equities Traded in the US as American Depositary Receipts Rise Tuesday Trading European equities traded in the US as American depositary receipts were tracking higher Tuesday morn
954,This Hated Stock Suddenly Looks Like an Obesity Bargain Pfizer’s latest deal could make it the budget entry point to the weight-loss bonanza.
955,"US FDA declines to approve Scholar Rocks muscle weakness drug; shares fall (Reuters) -Scholar Rock said on Tuesday the U.S. health regulator has declined to approve its drug for a rare neuromuscular disease citing issues at a third-party manufacturing facility, sending the companys shares down 12% in premarket trading.  Scholar Rock is banking on apitegromab to drive its growth and profitability.  The drug is being tested as a treatment for spinal muscular atrophy and muscle preservation in obesity."
956,"Sector Update: Consumer Stocks Decline Late Afternoon Consumer stocks were lower late Monday afternoon, with the Consumer Staples Select Sector SPDR Fund"
957,"UBS slashes global GLP-1 sales estimate for 2030 on softer outlook Investing.com -- UBS has cut its global GLP-1 sales forecast for 2030 to $130 billion, down from over $150 billion, citing weaker-than-expected data from next-generation assets and compounded product disruptions in the US market."
958,"FDA Issues Complete Response Letter (CRL) for Apitegromab as a Treatment for Patients with Spinal Muscular Atrophy (SMA) Solely Related to Observations Identified at Catalent Indiana LLC Fill-Finish Facility CAMBRIDGE, Mass., September 23, 2025--Scholar Rock (NASDAQ: SRRK), a global biopharmaceutical company dedicated to dramatically improving the lives of children and adults with spinal muscular atrophy (SMA) and additional rare, severe and debilitating neuromuscular diseases by applying its leading platform in myostatin biology to advance musculoskeletal health, today announced that the U.S. Food and Drug Administration (FDA) has issued a Complete Response Letter (CRL) for the apitegromab Biologic"
959,"Hims & Hers: Navigating GLP Controversy With Aplomb, But Risks Warrant Hold Rating Get the latest analysis on Hims & Hers Health, Inc. stock with valuation insights, business risks, and forecasts. Click here to find out why HIMS is a Hold."
960,President Trumps 100% Tariff Threat: What It Means For Your Pharma Portfolio Explore how Trumps MFN pricing and 100% drug import tariffs impact pharma stocks.
961,"Hims & Hers: Growth Meets FDA Scrutiny And Tariff Risks Hims & Hers Health, Inc. stock may offer more upside amid digital health growth, despite FDA scrutiny and tariff risks. Click here to read why HIMS is a Buy."
962,"A New Prescription For Pain: Understanding Trumps 100% Pharma Tariff Discover how Trumpâs 100% drug tariff impacts NVO, SNY, and AZN stocks. Click for which pharma giants face the most riskâand the upside for savvy investors."
963,"Novo Nordisk: Wegovy Sales Soar, Trump Tariffs No Threat Novo Nordisks Q2 2025 sales surge as Wegovy demand grows, driven by new obesity drug data. Click here to read an analysis of NVO stock now."
964,Regeneron: Strong R&D Pipeline Drives Growth Outlook Regeneron remains a Strong Buy amid investor concerns and strong drug performances. Read here for more financial analysis of REGN stock.
965,"Eli Lilly: Strong Buy On Sustained Growth, Expanding Moat, And Pipeline Depth Eli Lillyâs valuation has compressed significantly from last yearâs highs, despite improving fundamentals. See why I rate LLY stock a Strong Buy."
966,"The Truth About Novo Nordisk: 4 Myths That Dont Hold Up Novo Nordisks Wegovy, especially at higher doses, rivals Eli Lillys Zepbound in weight loss. Read why NVO stock is a Strong Buy."
967,Regeneron: Growth Catalysts Incoming Regeneron Pharmaceuticals is seeing revenue growth in key products that is now offsetting declining revenue in its previous blockbuster drug. Read why REGN is a Buy.
968,"AbbVie: Wins Accumulating While We Wait For Next BD Steps AbbVies strong results, pipeline wins, and Rinvoq exclusivity boost its outlook. Read the latest analysis on ABBV stock here."
969,"3 Way-Too-Early Predictions For 2026 Markets continue to advance despite continuing concerns around valuations, inflation, and the deteriorating jobs market. Read what investors need to know."
970,"Structure Therapeutics: The Dark Horse In The Oral Obesity GLP-1 Arena Structure Therapeutics Inc. is a clinical-stage biotech focused on oral GLP-1 drugs for obesity, targeting a rapidly growing sector in pharma market. Learn more about GPCR stock here."
971,"SCHD ETF Alternative Strategy, CAGR Improves To 15.74% The 4-Factor Dividend Growth Portfolio delivers a 15.74% CAGR and rising dividends. Read here for an investment analysis of SCHD ETF."
972,Novo Nordisk Is Primed For A Post-Earnings Recovery (Earnings Preview) Novo Nordiskâs Q2 2025 shows strong growth despite competition. See more on NVOs key catalysts and price targets driving 12-month and long-term investment potential.
973,"Pharmaceutical Stocks: Valuations And Pipelines Are Only Beginning To Be Appreciated Discover why drug stocks like LLY, NVO, AZN & PFE could outperform in 2025 amid strong healthcare trends. Click for my picks."
974,"Novo Nordisk: The Bottom Is In Discover why NVO offers 20â30% upside with strong EPS growth, sector-leading drugs, and an attractive P/E."
975,"3 Reasons To Be Optimistic Around Biotech In Q4 Biotech is outperforming the S&P 500 and NASDAQ as M&A heats up and Q4 tailwinds emerge, signaling more upside ahead. Read more on the sector breakdown here."
976,"Wall Street Brunch: Hooray For DevDay Sam Altman will give the DevDay keynote. Government shutdown now seen lasting three weeks. Bitcoin top $125,000 for first time."
977,Novo Nordisk: CagriSema Sets Potential Obesity Drug Development Comeback Novo Nordisk A/S faces competition in obesity drug development space; pipeline innovations & long-term outlook. Read why NVO stock is downgraded to Buy.
978,East 72 Dynasty Trust Q3 2025 Quarterly Report The Dynasty Trust NAV increased by a modest 1.6% in the September quarter. Read more here.
979,"Novo Nordisk: Oral Wegovy Nears FDA Decision As GLP-1 Momentum Builds Novo Nordisk is well-positioned in the obesity drug market, with strong financials and anticipation for its oral Wegovy pill. See why NVO stock is a Buy now."
980,Wall Street Breakfast Podcast: Deals Dont Wait Til November Holiday shopping starts early with retailersâ competing deal events. Novo Nordisk cuts hit production line jobs at key US plant - report. AppLovin shares tumble following SEC probe report.
981,Novo Nordisk: A Profitable Investment In The Long Term Novo Nordisk is one of Europeâs largest companies and a global leader in the treatment of two major lifestyle diseases â diabetes and obesity. Read more here.
982,Market Chatter: Novo Nordisk CEO Poised to Take Risks in Weight-Loss Rivalry Novo Nordisk (NVO) Chief Executive Officer Mike Doustdar said he is poised to face calculated risks
983,Top Midday Stories: Ferrari Raises 2025 Guidance; Delta Shares Rise After Strong Q3 Results All three major US stock indexes were down in late-morning trading Thursday after Federal Reserve Ch
984,Novo Nordisk to Acquire Akero Therapeutics Inc. 2025-10-09. The following slide deck was published by Novo Nordisk A/S in conjunction with this event.
985,Novo Nordisks Akero Deal: Panic Buy Or Wise Decision? Heres My Take Novo Nordisk acquires Akero Therapeutics for $5.2B to boost its metabolic disease pipeline with EFX. Check out what this means to NVO and AKRO shareholders.
986,"Novo Nordisk A/S (NVO) M&A Call Transcript Novo Nordisk A/S (NVO) M&A Call October 9, 2025 8:00 AM EDTCompany ParticipantsJacob Martin Rode - Head of Investor RelationsMaziar Doustdar -..."
987,"Is Novo Nordisk Stock a Sell Despite its 10% Price Rally in a Month? NVOs 10% stock price rally masks deeper challenges as competition, restructuring and slower growth weigh on its outlook."
988,"Market Chatter: Gates Foundation, PAHO Eye Expanded Access to Weight-Loss Drugs in Lower-Income Countries The Gates Foundation and the Pan American Health Organization, or PAHO, are looking to expand access"
989,Why Akero Therapeutics Stock Trounced the Market on Thursday The biotech will soon have a new owner.
990,"Akero Therapeutics (AKRO) Jumps 16% on $5.2-Billion Novo Nordisk Merger We recently published 10 Big Names With Whopping Gains; 6 Jump All-Time Highs. Akero Therapeutics, Inc. (NASDAQ:AKRO) is one of the best performers on Thursday. Akero Therapeutics saw its share prices jump by 16.33 percent on Thursday to end at $54.08 apiece following announcements that it was set to merge with Novo Nordisk in a […]"
991,"Earnings, Fed Rates Mean Stocks Can Ignore the Shutdown. This Could Change That. Government shutdown hits day 10, U.S. begins Argentine rescue, Amazon Prime shoppers snapped up necessities, and more news to start your day."
992,"GoodRx: Novo Deal And TrumpRx Talks Point To Ebitda/FCF Upside GoodRx Holdings, Inc. seeks growth via Novo Nordisk and TrumpRx deals, boosting revenue per user. Click for more on investment insights and risks of GDRX stock."
993,Novo Nordisk Seeks to Expand Liver Disease Treatments in $5.2B Deal for Bay Area Biotech The acquisition comes as new CEO Mike Doustdar tries to revive once meteoric growth that has come crashing down to earth this year.
994,"Can Novo Nordisks Aggressive Deal-Making Offset Semaglutide Reliance? NVOs $4.7B acquisition of Akero Therapeutics adds a late-stage MASH therapy to its obesity-linked pipeline, advancing its expansion goal beyond semaglutide."
995,Why Shares in Viking Therapeutics Surged This Week The small-cap pharmaceutical company may be the next in line as takeover fever heats up.
996,Market Chatter: Novo Nordisk Halts Cell Therapy Work on Diabetes to Cut Costs Novo Nordisk (NVO) is winding down its cell therapy division that had been working on a potential cu
997,Novo Nordisk to Close Cell Therapy Division Amid Global Restructuring Move affects 250 jobs as new CEO Mike Doustdar streamlines operations
998,"Bristol Myers Squibb Buys Private Biotech for $1.5 Billion. The Deal Wave Keeps Going. The recent cavalcade of biotech deals continued Friday morning, when  Bristol Myers Squibb  said it had agreed to pay $1.5 billion to acquire Orbital Therapeutics, an early-stage, privately held biotech designing RNA-based medicines.  Its lead program, a potential treatment for autoimmune conditions called OTX-201, isn’t expected to enter human trials until next year.  The Orbital deal is Bristol’s largest since February 2024, when it closed a $4.1 billion acquisition of RayzeBio, a cancer-focused biotech."
999,"Global Protein Drugs Market to Reach $655.7 Billion by 2029 “BCC Research analyzes how innovation in biomanufacturing, ESG trends, and strategic investments are shaping the next frontier of protein-based therapeutics.”Boston, Oct. 10, 2025 (GLOBE NEWSWIRE) -- As demand for targeted, biologic-based treatments continues to grow, protein drugs are transforming how pharmaceutical companies address chronic, genetic, and life-threatening diseases. From monoclonal antibodies (mAbs) to peptide hormones and vaccines, global leaders such as AbbVie, Novo Nordisk an"
1000,"Sector Update: Health Care Stocks Decline Late Afternoon Health care stocks were lower late Friday afternoon, with the NYSE Health Care Index down 1.4% and t"
