169,Will the Cash Burn Reduction Strategy be a Game Changer for Plug Power? PLUG narrows losses and cuts its cash burn nearly in half as Project Quantum Leap aims to reshape its financial trajectory.
170,"1 Industrials Stock with Competitive Advantages and 2 to Ignore Whether you see them or not, industrials businesses play a crucial part in our daily activities. Unfortunately, this role also comes with a demand profile tethered to the ebbs and flows of the broader economy, and investors seem to be forecasting a downturn - over the past six months, the industry has pulled back by 9.4%. This drop was worse than the S&P 500’s 2.4% decline."
171,Plug Power Inc Files For Resale From Time To Time Of 55 Million Shares Of Common Stock Offered By Selling Stockholder Plug Power Inc: * PLUG POWER INC FILES FOR RESALE FROM TIME TO TIME OF 55MILLIONSHARES OF COMMON STOCK OFFERED BY SELLING STOCKHOLDER - SECFILINGFurther company coverage: ...
172,Why Plug Power Stock Popped Today Plug Power presents shareholders with an offer they cannot (afford to) refuse.
173,"Circle extends gains, Plug Power shareholder vote, Docusign sinks Yahoo Finance host Julie Hyman tracks todays top moving stocks and biggest market stories in this Market Minute. Circle (CRCL) stock continues to surge in its second trading day. Docusign (DOCU) is sinking despite a first quarter earnings and revenue beat after the company reported billings that missed analysts estimates. Plug Power (PLUG) stock is rising ahead of the companys key shareholder vote on a proposal to increase the number of its shares and to permit a reverse stock split to avoid being delisted from the Nasdaq Composite (^IXIC). Stay up to date on the latest market action, minute-by-minute, with Yahoo Finances Market Minute."
174,"Plug Power and Allied Green Expand Strategic Collaboration with New 2 GW Electrolyzer Deal in Uzbekistan Plug Power and Allied Green Leadership attending International Investment Forum to Execute the Agreement Allied Green Continues to Make Meaningful Progress in its Green Ammonia Plant in Australia with Plug to supply 3GW of Electrolyzer Capacity Bringing the total opportunity between partners to 5GW globally SLINGERLANDS, N.Y., June 09, 2025 (GLOBE NEWSWIRE) -- Plug Power Inc. (NASDAQ: PLUG), a global leader in comprehensive hydrogen solutions, today announced a significant expansion of its partn"
175,"Plug Powers Uzbekistan plant, Novo Nordisk activist investor Yahoo Finance host Madison Mills tracks todays top moving stocks and biggest market stories in this Market Minute, including Plug Powers (PLUG) $5.5 billion venture to build out a green chemical facility in Uzbekistan and activist investor Parvus Asset Management Novo Nordisk (NVO) reportedly building up a stake in the pharmaceutical giant. Stay up to date on the latest market action, minute-by-minute, with Yahoo Finances Market Minute."
176,Why Plug Power Stock Keeps Going Up A big insider buy helps fuel continued price rises for Plug stock.
177,"Plug Power CFO Paul Middleton Underscores Continued Confidence in Strategic Growth with Additional Share Purchase LATHAM, N.Y., June 09, 2025 (GLOBE NEWSWIRE) -- Plug Power Inc. (NASDAQ: PLUG), a global leader in comprehensive hydrogen solutions for the green hydrogen economy, today announced that Chief Financial Officer Paul Middleton has purchased an additional 650,000 shares of Plug’s common stock on the open market. On June 9, 2025, Middleton acquired 650,000 shares at an average price of $1.0339 per share. This latest investment follows a previous purchase earlier this month, reinforcing Mr. Middleton’"
178,Plug Power: Im Staying Unplugged From Ammonia Plug Powers recent rally is driven by new partnerships and insider buying. Read what justifies maintaining a Hold rating on PLUG stock.
179,"Plug Power Down 39% YTD: How Should Investors Play the Stock? PLUG is down 39% YTD as cash burn and weak margins weigh, but revenue recovery signs and long-term potential keep hopes alive."
180,Plug Power Wins a Big Deal. Time to Buy the Hydrogen Stock? Plug Power will supply its electrolyzers to a project in Uzbekistan.  This project would help support its long-term growth profile.  Bridging the gap until it reaches profitability remains a key issue for Plug Power.
181,"Plug Power’s Plummeting Stock Sees Big Buys From Chief Financial Officer Plug Power  Chief Financial Officer Paul Middleton just bought a large block of shares of the hydrogen-technology company, which looks set to fall by double digits for a fourth consecutive year.  Laws passed years ago under the Biden administration were supposed to help clean-energy companies like Plug Power, but a slow rollout of subsidies and weak demand  have taken their toll.  Earlier this month, the Trump administration’s Energy Department canceled more than $3.7 billion of grants for clean-energy and climate projects, hitting shares of Plug Power and its peers."
182,"Spotting Winners: Plug Power (NASDAQ:PLUG) And Renewable Energy Stocks In Q1 As the Q1 earnings season comes to a close, it’s time to take stock of this quarter’s best and worst performers in the renewable energy industry, including Plug Power (NASDAQ:PLUG) and its peers."
183,"3 Reasons to Sell PLUG and 1 Stock to Buy Instead What a brutal six months it’s been for Plug Power. The stock has dropped 47.4% and now trades at $1.29, rattling many shareholders. This was partly driven by its softer quarterly results and may have investors wondering how to approach the situation."
184,"Plug Power, Sabre, OneWater, Kura Sushi, and American Airlines Stocks Trade Up, What You Need To Know A number of stocks jumped in the afternoon session after the major indices rebounded (Nasdaq +1.5%, S&P 500 +1.0%) as reports pointed to easing tensions between Israel and Iran. The Wall Street Journal said senior Iranian officials had signaled a willingness to restart stalled nuclear talks, on the condition that Washington refrain from joining Israels ongoing strikes. This development triggered a significant decline in oil prices, easing inflation concerns. Also, it is possible some investors"
185,"Solar Stocks Plunge as Senate Bill Ends Key Tax Credits Early (Bloomberg) -- Shares of US solar companies fell sharply after Senate Republicans released a bill that would end clean energy tax credits earlier than expected, dashing hopes that major cuts passed by the House wouldn’t stick.Most Read from BloombergSecurity Concerns Hit Some of the World’s ‘Most Livable Cities’As Part of a $45 Billion Push, ICE Prepares for a Vast Expansion of Detention SpaceAs American Architects Gather in Boston, Retrofits Are All the RageHow E-Scooters Conquered (Most of) Eu"
186,"Solar stocks, Eli Lilly & Verve, PureCycle: Trending Tickers Enphase (ENPH), SolarEdge (SEDG), First Solar (FSLR), Sunrun (RUN), Plug Power (PLUG), and Array Technologies (ARRY) plunge after the Senate revealed its revisions to President Trumps tax bill, which included cuts to solar and wind energy tax credits. Eli Lilly (LLY) is set to acquire Verve Therapeutics (VERV), sending Verves stock skyrocketing. PureCycle Technologies (PCT) stock surges on the companys plans to grow its plastic recycling capacity to 1 billion pounds by 2030. To watch more expert insights and analysis on the latest market action, check out more Market Domination here."
187,Plug Power and Allied Green Deepen Their Strategic Partnership With The Electrolyzer Contract. Plug Power Inc. (NASDAQ:PLUG) is among the 13 Best Hydrogen and Fuel Cell Stocks to Buy According to Analysts. The firm and Allied Green Ammonia have announced a new 2 GW electrolyzer agreement for a $5.5 billion green chemical manufacturing facility in Uzbekistan at the Tashkent International Investment Forum. This extends the partners’ total commitment […]
188,"Plug Powers Electrolyzer Sales Jump in Q1: Can the Momentum Sustain? PLUGs electrolyzer revenues soar in Q1 2025, fueled by rising global demand for green hydrogen solutions."
189,"Cummins CEO’s Winning Mantra: Profitability and Renewable Power Jennifer Rumsey became CEO of  Cummins  in August 2022 amid historic industry turmoil.  Infatuated with electric trucks and hydrogen power, investors had bid up shares of  Nikola  and  Plug Power  which were suddenly worth about as much as Cummins, a profit machine with more than a century of history.  Rumsey has bold ambitions for Cummins’ renewable-technology business, Accelera, organized in 2023."
190,"Plug Power (PLUG) Dips More Than Broader Market: What You Should Know Plug Power (PLUG) closed the most recent trading day at $1.11, moving 2.63% from the previous trading session."
191,"Plug Executive Leadership to Participate in Investor Conferences in New York and London SLINGERLANDS, N.Y., June 24, 2025 (GLOBE NEWSWIRE) -- Plug Power Inc. (NASDAQ: PLUG), a global leader in end-to-end hydrogen solutions for the green hydrogen economy, today announced its participation in two upcoming investor conferences, reinforcing its commitment to ongoing engagement with the financial community. Plug executives will participate in one-on-one meetings and a fireside chat to discuss the Company’s strategic priorities and long-term growth plans: June 24, 2025 – J.P. Morgan Ener"
192,Why Plug Power Popped Today Is Plugs hype worth the stock price pop?
193,Are These 3 Bullish Signs Enough to Make Plug Power a Buy in June? Shares of Plug Power have soared some 32% over the past month.  Shares of fuel cell and hydrogen specialist Plug Power (NASDAQ: PLUG) are showing signs of recovering from the dismal performance they put up for most of 2025s first half.  Investors would be better advised to refrain from buying Plug stock.
194,"Plug Powers Equipment Revenues Decline: Is the Risk Priced In? PLUG sees legacy product sales slump, but a 582% jump in electrolyzers revenues and global contracts signal a green pivot."
195,"Plug Power (PLUG) Stock Sinks As Market Gains: What You Should Know Plug Power (PLUG) closed the most recent trading day at $1.16, moving 4.92% from the previous trading session."
196,"Wind, solar credits face shorter phase-out in new tax bill (Bloomberg) -- Key tax incentives for US wind and solar projects would face a more aggressive phase-out in the Senate’s latest version of President Donald Trump’s spending package. Most Read from BloombergPhiladelphia Transit System Votes to Cut Service by 45%, Hike FaresUS Renters Face Storm of Rising CostsSqueezed by Crowds, the Roads of Central Park Are Being ReimaginedSprawl Is Still Not the AnswerMapping the Architectural History of New York’s ChinatownThe tweak, which follows pushback by T"
197,Plug Power Inc.(NasdaqCM: PLUG) dropped from Russell Small Cap Comp Growth Index Plug Power Inc. dropped from Russell Small Cap Comp Growth Index...
198,Renewable energy shares mixed as U.S. Senate preserves some tax credits in Trump bill (Reuters) -Shares of U.S. renewable energy firms saw a mixed performance in early Monday trading after the U.S. Senate advanced President Donald Trumps sweeping tax-and-spending bill.  The final version preserved tax credits for solar leasing  —  an arrangement where a third-party owns and installs a solar panel system on a customers property for a fee to use the system and the electricity it generates.  Shares of solar panel maker First Solar rose 7.1% at $163.00 while battery firms Sunrun climbed 7.8% to $8.01 and Fluence Energy gained 3.1% to $6.33.
199,"Plug Power vs. Bloom Energy: Which Fuel Cell Stock Should You Bet On? BEs strong sales growth, rising EPS and expanding global partnerships give it an edge over struggling rival PLUG."
200,"Plug Power Stock Is Surging. Why Hydrogen Just Got a Boost From the Senate Bill. The Senate’s latest rewrite of the bill offers tax credits to the industry through to Jan. 1, 2028, two years longer than the previous version.  Shares of  Plug Power  the largest pure-play clean hydrogen company in the U.S., rose 10% in early trading.  Bloom Energy  which makes fuel cells that can run on hydrogen, was up 8.5%."
