284,2025-08-18,"The Top 5 Analyst Questions From Plug Power’s Q2 Earnings Call Plug Power’s second quarter results reflected ongoing operational improvements and strong end-market demand, particularly within its GenDrive, GenFuel, and GenEco platforms. While revenue outpaced Wall Street’s expectations, management pointed to substantial progress in gross margin improvement, citing the impact of Project Quantum Leap initiatives, cost reductions, and optimized service execution. CEO Andy Marsh acknowledged the company’s focus on operational discipline, noting, “Gross margins"
285,2025-08-18,"Plug Power: Margin Progress Offset By Weak Order Intake And Persistent Cash Burn - Sell While Plug Power achieved decent margin progress, weak order intake and high cash usage continue to threaten its viability. Read why PLUG stock is a Sell."
286,2025-08-19,"[Latest] Global Green Gas Market Size/Share Worth USD 2.81 Billion by 2034 at a 6.20% CAGR: Custom Market Insights (Analysis, Outlook, Leaders, Report, Trends, Forecast, Segmentation, Growth Rate, Value, SWOT Analysis) [220+ Pages Latest Report] According to a market research study published by Custom Market Insights, the demand analysis of Global Green Gas Market size & share revenue was valued at approximately USD 1.54 Billion in 2024 and is expected to reach USD 1.83 Billion in 2025 and is expected to reach around USD 2.81 Billion by 2034, at a CAGR of 6.20% between 2025 and 2034. The key market players listed in the report with their sales, revenues and strategies are Air Products and Chemicals Inc., ENGIE"
287,2025-08-20,Ballard Power: Developing A Viable Business Model Likely To Remain A Battle - Hold Ballard Power Systems Inc.s Q2 results lag expectations with weak orders and high cash burn. Click for how BLDP aims for positive cash flow by 2027.
288,2025-08-20,"Trump Trade: SoftBank makes Intel investment as Nvidia preps new chip Catch up on the top industries and stocks that were impacted, or were predicted to be impacted, by the comments, actions and policies of President Trump with this daily recap compiled by The Fly: INTEL STAKE: The Trump administration is in discussions to take a 10% in Intel by converting some or all of the company’s grants from the Chips and Science Act into equity, Mackenzie Hawkins, Ryan Gould and Josh Wingrove of Bloomberg reported on Monday, citing people familiar with the matter. Intel is s"
289,2025-08-20,"Energy Plug Technologies Corp. Completes First U.S. Sale Through Partnership with GGVentures of the Carolinas Vancouver, British Columbia--(Newsfile Corp. - August 20, 2025) - Energy Plug Technologies Corp. (CSE: PLUG) (OTCQB: PLGGF) (FSE: 6GQ) (Energy Plug or the Company) is pleased to announce its first sale in the U.S. market: a pilot order for three 209kWh Secure Energy Storage Systems (627 kWh total), valued at over C$290,000. The units will be deployed in the construction sector through our distribution partner, GGVentures of the Carolinas, LLC (GGV).The systems are expected to arrive ..."
290,2025-08-20,Why Is Wall Street So Bearish on Plug Power? Theres 1 Key Reason. Demand alone cant fuel the industry.
291,2025-08-20,"Bloom Energy, Redwire, Plug Power, Sunrun, and Astronics Stocks Trade Down, What You Need To Know A number of stocks fell in the afternoon session after investors took some profits off the table as markets awaited signals on future monetary policy from the Federal Reserves Jackson Hole symposium later in the week."
292,2025-08-20,"Plug Power Declines 22.1% YTD: Time to Hold the Stock or Exit? PLUG stock is down 22.1% YTD as cash burn, weak margins and slow installations weigh against long-term hydrogen growth."
293,2025-08-22,Plug Power Cuts Costs to Lift Margins: Will the Results be Sustainable? PLUG posts a revenue jump and narrower losses as cost cuts and efficiency gains fuel momentum in Q2 2025.
294,2025-08-23,"1 Reason Im Still Keeping an Eye on Plug Power Stock, Despite Recent Lows Data center power needs might just save Plug Power."
295,2025-08-24,"Plug Power Stock Is Cheap, but Does That Make It a Buy Now? This out-of-favor hydrogen stock could heat up over the next few years."
296,2025-08-24,Is Plug Power Stock a Millionaire Maker? The company has spent years laying the groundwork to capitalize on what could be a $300 billion or more global market by 2030.
297,2025-08-24,"1 Reason Im Still Holding On to Hope for Plug Power Stock Ive been skeptical of Plug Power stock, but recent changes could change my mind."
298,2025-08-25,"Did Plug Powers (PLUG) Cost Cuts and Margin Gains Just Shift Its Investment Narrative? Earlier this month, Plug Power Inc. announced its second quarter and six-month 2025 financial results, highlighting increased quarterly revenue to US$173.97 million and a narrowed net loss of US$227.1 million compared to the previous year. Plug Powers continued progress in cost reductions and its Quantum Leap margin improvement program reflect significant operational shifts as the company works to address persistent unprofitability in the hydrogen sector. Well examine how these ongoing..."
299,2025-08-27,Plug Powers Equipment Sales Rebound in Q2: Whats Behind It? PLUG posts 29% jump in equipment sales as soaring electrolyzer demand and fuel cell activity drive Q2 momentum.
300,2025-08-27,"[Latest] Global Electric Vehicle Range Extender Market Size/Share Worth USD 4.36 Billion by 2034 at a 5.8% CAGR: Custom Market Insights (Analysis, Outlook, Leaders, Report, Trends, Forecast, Segmentation, Growth Rate, Value, SWOT Analysis) [220+ Pages Latest Report] According to a market research study published by Custom Market Insights, the demand analysis of Global Electric Vehicle Range Extender Market size & share revenue was valued at approximately USD 2.49 Billion in 2024 and is expected to reach USD 2.62 Billion in 2025 and is expected to reach around USD 4.36 Billion by 2034, at a CAGR of 5.8% between 2025 and 2034. The key market players listed in the report with their sales, revenues and strategies are Magna Internation"
