201,2025-06-17,"Solar Stocks Plunge as Senate Bill Ends Key Tax Credits Early (Bloomberg) -- Shares of US solar companies fell sharply after Senate Republicans released a bill that would end clean energy tax credits earlier than expected, dashing hopes that major cuts passed by the House wouldn’t stick.Most Read from BloombergSecurity Concerns Hit Some of the World’s ‘Most Livable Cities’As Part of a $45 Billion Push, ICE Prepares for a Vast Expansion of Detention SpaceAs American Architects Gather in Boston, Retrofits Are All the RageHow E-Scooters Conquered (Most of) Eu"
202,2025-06-18,"Solar stocks, Eli Lilly & Verve, PureCycle: Trending Tickers Enphase (ENPH), SolarEdge (SEDG), First Solar (FSLR), Sunrun (RUN), Plug Power (PLUG), and Array Technologies (ARRY) plunge after the Senate revealed its revisions to President Trumps tax bill, which included cuts to solar and wind energy tax credits. Eli Lilly (LLY) is set to acquire Verve Therapeutics (VERV), sending Verves stock skyrocketing. PureCycle Technologies (PCT) stock surges on the companys plans to grow its plastic recycling capacity to 1 billion pounds by 2030. To watch more expert insights and analysis on the latest market action, check out more Market Domination here."
203,2025-06-19,Plug Power and Allied Green Deepen Their Strategic Partnership With The Electrolyzer Contract. Plug Power Inc. (NASDAQ:PLUG) is among the 13 Best Hydrogen and Fuel Cell Stocks to Buy According to Analysts. The firm and Allied Green Ammonia have announced a new 2 GW electrolyzer agreement for a $5.5 billion green chemical manufacturing facility in Uzbekistan at the Tashkent International Investment Forum. This extends the partners’ total commitment […]
204,2025-06-20,"Plug Powers Electrolyzer Sales Jump in Q1: Can the Momentum Sustain? PLUGs electrolyzer revenues soar in Q1 2025, fueled by rising global demand for green hydrogen solutions."
205,2025-06-20,"Cummins CEO’s Winning Mantra: Profitability and Renewable Power Jennifer Rumsey became CEO of  Cummins  in August 2022 amid historic industry turmoil.  Infatuated with electric trucks and hydrogen power, investors had bid up shares of  Nikola  and  Plug Power  which were suddenly worth about as much as Cummins, a profit machine with more than a century of history.  Rumsey has bold ambitions for Cummins’ renewable-technology business, Accelera, organized in 2023."
206,2025-06-21,"Plug Power (PLUG) Dips More Than Broader Market: What You Should Know Plug Power (PLUG) closed the most recent trading day at $1.11, moving 2.63% from the previous trading session."
207,2025-06-24,"Plug Executive Leadership to Participate in Investor Conferences in New York and London SLINGERLANDS, N.Y., June 24, 2025 (GLOBE NEWSWIRE) -- Plug Power Inc. (NASDAQ: PLUG), a global leader in end-to-end hydrogen solutions for the green hydrogen economy, today announced its participation in two upcoming investor conferences, reinforcing its commitment to ongoing engagement with the financial community. Plug executives will participate in one-on-one meetings and a fireside chat to discuss the Company’s strategic priorities and long-term growth plans: June 24, 2025 – J.P. Morgan Ener"
208,2025-06-25,Why Plug Power Popped Today Is Plugs hype worth the stock price pop?
209,2025-06-27,Are These 3 Bullish Signs Enough to Make Plug Power a Buy in June? Shares of Plug Power have soared some 32% over the past month.  Shares of fuel cell and hydrogen specialist Plug Power (NASDAQ: PLUG) are showing signs of recovering from the dismal performance they put up for most of 2025s first half.  Investors would be better advised to refrain from buying Plug stock.
210,2025-06-27,"Plug Powers Equipment Revenues Decline: Is the Risk Priced In? PLUG sees legacy product sales slump, but a 582% jump in electrolyzers revenues and global contracts signal a green pivot."
211,2025-06-28,"Plug Power (PLUG) Stock Sinks As Market Gains: What You Should Know Plug Power (PLUG) closed the most recent trading day at $1.16, moving 4.92% from the previous trading session."
212,2025-06-29,"Wind, solar credits face shorter phase-out in new tax bill (Bloomberg) -- Key tax incentives for US wind and solar projects would face a more aggressive phase-out in the Senate’s latest version of President Donald Trump’s spending package. Most Read from BloombergPhiladelphia Transit System Votes to Cut Service by 45%, Hike FaresUS Renters Face Storm of Rising CostsSqueezed by Crowds, the Roads of Central Park Are Being ReimaginedSprawl Is Still Not the AnswerMapping the Architectural History of New York’s ChinatownThe tweak, which follows pushback by T"
213,2025-06-30,Plug Power Inc.(NasdaqCM: PLUG) dropped from Russell Small Cap Comp Growth Index Plug Power Inc. dropped from Russell Small Cap Comp Growth Index...
214,2025-06-30,"5 Revealing Analyst Questions From Plug Power’s Q1 Earnings Call Plug Power’s first quarter results saw revenue growth and operational improvements, but the market reacted negatively to ongoing margin pressure and continued losses. Management attributed the quarter’s performance to renewed momentum in the material handling segment and successful commissioning of additional hydrogen production capacity. CEO Andy Marsh highlighted that Plug Power’s “Q1 cash burn was down nearly 50% year-over-year,” due to cost reduction initiatives and improved execution across"
215,2025-06-30,"Plug Power Stock Is Surging. Why Hydrogen Just Got a Boost From the Senate Bill. The Senate’s latest rewrite of the bill offers tax credits to the industry through to Jan. 1, 2028, two years longer than the previous version.  Shares of  Plug Power  the largest pure-play clean hydrogen company in the U.S., rose 10% in early trading.  Bloom Energy  which makes fuel cells that can run on hydrogen, was up 8.5%."
216,2025-06-30,"Plug Power vs. Bloom Energy: Which Fuel Cell Stock Should You Bet On? BEs strong sales growth, rising EPS and expanding global partnerships give it an edge over struggling rival PLUG."
217,2025-06-30,Renewable energy shares mixed as U.S. Senate preserves some tax credits in Trump bill (Reuters) -Shares of U.S. renewable energy firms saw a mixed performance in early Monday trading after the U.S. Senate advanced President Donald Trumps sweeping tax-and-spending bill.  The final version preserved tax credits for solar leasing  —  an arrangement where a third-party owns and installs a solar panel system on a customers property for a fee to use the system and the electricity it generates.  Shares of solar panel maker First Solar rose 7.1% at $163.00 while battery firms Sunrun climbed 7.8% to $8.01 and Fluence Energy gained 3.1% to $6.33.
218,2025-06-30,"Renewables Slide as Senate Bill Takes Aim at Clean Energy (Bloomberg) -- Republican lawmakers are debating a bill that ramps up President Donald Trump’s assault on wind and solar power, a worse-than-expected jolt to clean energy while providing aid for fossil fuels.Most Read from BloombergPhiladelphia Transit System Votes to Cut Service by 45%, Hike FaresSqueezed by Crowds, the Roads of Central Park Are Being ReimaginedSprawl Is Still Not the AnswerSao Paulo Pushes Out Favela Residents, Drug Users to Revive Its City CenterStruggling Downtowns Are Looki"
219,2025-07-01,"Is Plug Power Stock a Buy, Sell, or Hold for July 2025? With Plug Power staging a comeback lately, is the stock a buy this month?"
220,2025-07-01,Plug Power May Be Getting a Senate Lifeline. How Should You Play PLUG Stock Here? Plug Power stock rallies as the Senate extends hydrogen tax credits through the end of 2027. But there’s still reason to consider avoiding exposure to PLUG shares.
221,2025-07-02,Should You Buy Plug Power Stock While Its Below $3? The pure-play hydrogen power company might have a bright future.
222,2025-07-03,Plug Power Eyes Expansion in Green Energy Sector: Can It Deliver Growth? PLUG battles cash burn and weak sales but eyes a turnaround with major hydrogen plant investments and a $1.66B DOE loan.
223,2025-07-04,"Why Plug Power Stock Soared Today Plug Power stock gained ground in conjunction with a bullish day of trading for the broader market.  Plug Power (NASDAQ: PLUG) stock closed out Thursdays trading with big gains.  A better-than-expected jobs report and increasing optimism surrounding the broader macroeconomic backdrop for stocks helped support gains for the broader market, and Plug Power also had some good news for investors."
224,2025-07-07,"Up 45% in a Month, Should You Buy Plug Power Stock Here? This article examines whether investors should buy Plug Power stock following its more than 45% surge in a month."
225,2025-07-08,Why Plug Power Stock Surged 69% in June Is the worst over for Plug Power stock?
226,2025-07-08,"Transcript : Plug Power Inc. - Special Call Presentation Operator MessageOperator Hello, and welcome to todays Plug Power Investor Update Conference Call and Webcast. [Operator Instructions] As a reminder, this conference is being recorded...."
227,2025-07-09,Why Plug Power Stock Skyrocketed Today Plug Power is a leading hydrogen production company.  Plug and a partner have agreed to extend a partnership through 2030.  Prospective investors should confirm in upcoming quarterly reports if there are improvements in the companys financial health.
228,2025-07-09,"Plug Power Extends Strategic Hydrogen Supply Agreement with Multi-Year Contract and Improved Economics with Key Hydrogen Supplier New Deal Strengthens Domestic Hydrogen Supply, Reduces Cost Structure and Supports Continued Growth of Plug ApplicationsSLINGERLANDS, N.Y., July 09, 2025 (GLOBE NEWSWIRE) -- Plug Power Inc. (NASDAQ: PLUG), a global leader in comprehensive hydrogen solutions, today announced a new multi-year enhanced supply agreement with a leading U.S.-based industrial gas company and longtime hydrogen partner through 2030. The agreement extends the companies’ current strategic relationship through 2030, securin"
229,2025-07-09,Prediction: 2 Stocks That Will Be Worth More Than D-Wave Quantum 2 Years From Now QuantumScape and Plug Power might have more upside potential.
230,2025-07-10,"Why Plug Power Stock Is Soaring Today Plug Power announced a new deal that will provide the company with fuel at a reduced rate.  Plug Power continues to struggle with stagnant sales and significant cash burn.  The spike comes as the S&P 500 (SNPINDEX: ^GSPC) and Nasdaq Composite (NASDAQINDEX: ^IXIC) were up 0.4% and 0.6%, respectively."
231,2025-07-10,Plug Power Just Scored a Supply Agreement Win. How Should You Play PLUG Stock Here? Plug Power stock soars on a new supply agreement with a key U.S. industrial gas partner. H.C. Wainwright continues to see upside in PLUG shares to $3.
232,2025-07-10,"Stocks making big moves yesterday: Mirion, Penguin Solutions, Byrna, Plug Power, and Bloom Energy Check out the companies making headlines yesterday:"
233,2025-07-10,"Plug Power (PLUG) Spikes Up 25.3% on Renewed Hydrogen Supply Contract Plug Power Inc. (NASDAQ:PLUG) is one of the 10 Stocks Going Wild. Plug Power skyrocketed by 25.35 percent on Wednesday to end at $1.78 apiece following news that it deepened its partnership with a long-time US-based industrial gas company for the supply of liquid hydrogen through 2030. In a statement, Plug Power Inc. (NASDAQ:PLUG) said […]"
234,2025-07-11,"Plug Power Stock Down 38% in Past Six Months: What Should Investors Do? PLUG stock plunges 38% in six months amid falling hydrogen equipment sales and cash burn, despite long-term growth hopes."
235,2025-07-15,"PLUG NAMED EXCLUSIVE WHOLESALE PARTNER FOR RECURRENTS EV SELLING PLATFORM Plug, the only online wholesale auction platform designed specifically for used electric vehicles, has been named the exclusive wholesale partner for Recurrents consumer-facing Sell with Recurrent service. Sellers can now receive a guaranteed offer for their used EVs in less than an hour."
236,2025-07-15,"Energy Plug Technologies Corp. - Q2 2025 Corporate Update Vancouver, British Columbia--(Newsfile Corp. - July 15, 2025) - Energy Plug Technologies Corp. (CSE: PLUG) (OTCQB: PLGGF) (FSE: 6GQ) (Energy Plug, PLUG, or the Company), in partnership with Indigenous-owned Malahat Battery Technologies, continues its focus on delivering Canadian-designed, secure energy systems. With 2025 marking a pivotal year, the Company is targeting domestic and export markets with systems primarily built from Canadian components.Management Commentary:In Q1 2025, we ma"
237,2025-07-15,"Plug Power (PLUG) Stock Declines While Market Improves: Some Information for Investors Plug Power (PLUG) reached $1.57 at the closing of the latest trading day, reflecting a -3.09% change compared to its last close."
238,2025-07-15,"Why Plug Power (PLUG) Shares Are Sliding Today Shares of fuel cell technology Plug Power (NASDAQ:PLUG) fell 6.5% in the afternoon session after an analyst at B. Riley lowered their earnings estimates for the company. The research firm reduced its second-quarter 2025 earnings per share (EPS) forecast for Plug Power, anticipating a loss of ($0.15) per share, down from a previous estimate of a ($0.12) loss. This more pessimistic view on the companys upcoming earnings adds to persistent investor concerns surrounding Plug Powers financial healt"
239,2025-07-16,"Plug Power Eyes Reducing Cash Burn Rate: Can It Be a Game Changer? PLUGs Project Quantum Leap cuts cash burn rate nearly 50% in Q1 2025, aiming for $200M in annualized savings."
240,2025-07-17,Why Plug Power Stock Tumbled 30% in the First Half of 2025 Plug Power stock surged 69% in June but is down for the year overall so far. Whats brewing?
241,2025-07-18,"BC-Most Active Stocks Globavend Holdings Ltd. 65,364,488 0.0395"
242,2025-07-18,Why Shares of Plug Power Popped Today The European Commission plans on boosting spending for its Connected Europe Facility program.  A project in Germany is one example of Plug Powers presence in Europe.  Prospective investors would be better advised to wait for the companys upcoming financial report for better insight into the company.
243,2025-07-20,Plug Power (PLUG) Surges 8.5% as Fuel Cell Market Begins to Boom We recently published These 10 Stocks Surprisingly Lead Gains While Wall Street Naps. Plug Power Inc. (NASDAQ:PLUG) is one of this week’s top performers. Plug Power saw its share prices increase by 8.48 percent on Friday to finish at $1.79 apiece as investors took path from research studies that the fuel cell market is expected to expand […]
244,2025-07-21,Did Plug Power Stock Deserve Todays Price Pop? Plug stock still looks stuck.
245,2025-07-22,"As Analysts Sweeten on Hydrogen, Is Plug Power Stock a Buy? This article explores whether Plug Power stock is worth buying as analysts sweeten on the hydrogen industry."
246,2025-07-25,"Plug Powers Equipment Weakness Grows: Whats the Road Ahead? PLUG battles weak demand in core products, but a 3GW deal signed in January could ignite long-term green hydrogen growth."
247,2025-07-25,"Why Plug Power Stock Rocketed Higher This Morning and Then Fell Back to Earth When a fuel cell peer reports encouraging news, many investors inclination is to buy Plug Power stock."
248,2025-07-26,Speculative frenzy raises risk of stock market downturn: Goldman Sachs Goldman Sachs analysts are sounding the alarm on speculative trades. They could be signaling a market pullback ahead.
249,2025-07-27,"The Smartest Green Energy Stocks to Buy With $100 Right Now Nio, Plug Power, and Cameco could keep growing as the renewable market expands."
250,2025-07-28,"Plug Power vs. FuelCell Energy: Which Fuel Cell Stock has Greater Upside? PLUGs cost cuts, DOE loan boost and hydrogen expansion may give it the edge over FCELs rising expenses and debt."
251,2025-07-28,"Plug Power Insider Ups Holding By 33% During Year Looking at Plug Power Inc.s ( NASDAQ:PLUG ) insider transactions over the last year, we can see that insiders were net..."
252,2025-07-29,"Ballard Power: Waiting For New Leadership To Right The Ship - Hold Ballard Power Systems Inc. shares surged 70% on leadership changes and key orders. Despite hydrogen challenges, click for why BLDP stock is rated Hold."
253,2025-07-29,"Plug Power (PLUG) Stock Sinks As Market Gains: Heres Why Plug Power (PLUG) closed the most recent trading day at $1.77, moving 3.8% from the previous trading session."
254,2025-07-30,"Why Plug Power (PLUG) Dipped More Than Broader Market Today The latest trading day saw Plug Power (PLUG) settling at $1.59, representing a -10.17% change from its previous close."
255,2025-08-01,"Why Plug Power Stock Is Powering Down This Week For Plug Power stock this week, no news isnt proving to be good news."
256,2025-08-02,"Plug Power Inc. (PLUG) Secures $1.66B DOE Loan for Green Hydrogen Plants We recently compiled a list of the 10 Best Low Cost Stocks To Buy Under $50. Plug Power Inc. stands second on our list. Plug Power Inc. (NASDAQ:PLUG) is a key player in the clean energy space, developing hydrogen fuel cells and electrolyzer systems to support the decarbonization of transport, logistics, and industrial sectors. The […]"
257,2025-08-04,"Plug To Announce 2025 Second Quarter Results on August 11, 2025 SLINGERLANDS, N.Y., Aug. 04, 2025 (GLOBE NEWSWIRE) -- Plug Power Inc. (NASDAQ: PLUG), a global leader in comprehensive hydrogen solutions for the hydrogen economy, will announce its 2025 second quarter results on August 11, 2025. Join the call: Date: August 11, 2025Time: 4:30 PM ETToll-free: 877-407-9221 / +1 201-689-8597Direct webcast: https://event.webcasts.com/starthere.jsp?ei=1727352&tp_key=81848c6f90 The webcast can also be accessed directly from the Plug homepage (www.plugpower.com). A pla"
258,2025-08-06,Stay Ahead of the Game With Plug Power (PLUG) Q2 Earnings: Wall Streets Insights on Key Metrics Get a deeper insight into the potential performance of Plug Power (PLUG) for the quarter ended June 2025 by going beyond Wall Streets top-and-bottom-line estimates and examining the estimates for some of its key metrics.
259,2025-08-07,1 Reason Im Watching Plug Power Stock in 2025 A new initiative to increase profitability has me keeping an eye on this hydrogen and fuel cell specialist.
260,2025-08-08,"Can Plug Powers Expansion Into the Green Energy Sector Fuel Growth? PLUG ramps up green hydrogen projects with DOE backing and new JV, but high cash burn clouds near-term outlook."
261,2025-08-08,"Identiv, Inc. (INVE) Reports Q2 Loss, Lags Revenue Estimates Identiv (INVE) delivered earnings and revenue surprises of +16.13% and -1.18%, respectively, for the quarter ended June 2025. Do the numbers hold clues to what lies ahead for the stock?"
262,2025-08-09,"AMC, Cisco Set To Report Earnings As Investors Watch Out For Core CPI Stay informed with Seeking Alphas Wall Street Week Ahead - your guide to key market events, earnings, IPOs & economic reports shaping the week."
263,2025-08-09,"Circle earnings, CPI, comments from Feds Bostic: What to Watch Yahoo Finance Markets Reporter Josh Schafer takes a look at the top stories for investors to watch next week, starting Monday, Aug. 11. A fresh slate of earnings will be out, including from Oklo (OKLO) and Plug Power (PLUG) on Monday, Circle (CRCL) and CoreWeave (CRWV) on Tuesday, Brinker (EAT) and Cisco (CSCO) on Wednesday, and Deere & Company (DE) and Birkenstock (BIRK) on Thursday. Plenty of fresh economic data will be released, including the Consumer Price Index (CPI) and NFIB Small Business Optimism Indexon Tuesday, the Producer Price Index (PPI) on Thursday, and retail sales and preliminary consumer sentiment on Friday. Lots of Federal Reserve commentary is coming as well, with Atlanta Fed President Raphael Bostic delivering remarks on Wednesday and Richmond Fed President Tom Barkin speaking on Thursday. To watch more expert insights and analysis on the latest market action, check out more Asking for a Trend."
264,2025-08-10,Inflation in focus as Fed rate cut debate heats up: What to watch this week A fresh reading on inflation will greet investors as stocks have surged back to record highs despite fears of rising price increases and a slowing labor market.
265,2025-08-10,"Wall Street Week Ahead Stay updated on key inflation data, earnings reports, and market moves. Discover insights on AST SpaceMobile & key strategies."
266,2025-08-10,"Susquehanna Raises Plug Power (PLUG) Target, Maintains Caution on Sector Plug Power, Inc. (NASDAQ:PLUG) is one of the best battery tech stocks to buy right now. On July 21, The Fly reported that Susquehanna analyst Charles Minervino recently raised the price target for Plug Power, Inc. (NASDAQ:PLUG) from $1.00 to $1.80, but he kept a Neutral rating on the stock. This update came after the firm reviewed […]"
267,2025-08-10,Plug Power (PLUG) Q2 Earnings Report Preview: What To Look For Fuel cell technology Plug Power (NASDAQ:PLUG) will be announcing earnings results this Monday afternoon. Here’s what investors should know.
268,2025-08-11,"Dear Plug Power Stock Fans, Mark Your Calendars for August 11 Plug Power is set to report Q2 earnings amid resurging sentiment around hydrogen."
269,2025-08-12,"PLUG Q2 Deep Dive: Margin Recovery Efforts and Hydrogen Growth Take Center Stage Fuel cell technology Plug Power (NASDAQ:PLUG) announced better-than-expected revenue in Q2 CY2025, with sales up 21.4% year on year to $174 million. Its GAAP loss of $0.20 per share was 32.6% below analysts’ consensus estimates."
270,2025-08-12,"Plug Power Lifts Q2 Revenue 21% as Electrolyzer Sales Triple Plug Power posted strong Q2 2025 revenue growth and narrowed losses as its GenEco electrolyzer business surged, cost-cutting measures took hold, and U.S. hydrogen policy support boosted market momentum."
271,2025-08-12,"Plug Power Inc (PLUG) Q2 2025 Earnings Call Highlights: Revenue Surge and Margin Improvements ... Plug Power Inc (PLUG) reports a 21% revenue increase and significant margin improvements, while navigating ongoing profitability challenges and tariff impacts."
272,2025-08-12,"Compared to Estimates, Plug Power (PLUG) Q2 Earnings: A Look at Key Metrics Although the revenue and EPS for Plug Power (PLUG) give a sense of how its business performed in the quarter ended June 2025, it might be worth considering how some key metrics compare with Wall Street estimates and the year-ago numbers."
273,2025-08-12,"Plug Power: Q2 Earnings Snapshot SLINGERLANDS, N.Y. (AP) — Plug Power Inc. PLUG) on Monday reported a loss of $227.1 million in its second quarter. The Slingerlands, New York-based company said it had a loss of 20 cents per share."
274,2025-08-12,"Plug Power Second Quarter 2025 Highlights • Execution on Project Quantum Leap helps accelerate business salesgrowth and financial performance• Q2 revenue up 21% year-over-year, driven by broad hydrogen demand LATHAM, N.Y., Aug. 11, 2025 (GLOBE NEWSWIRE) -- Plug Power Inc. (NASDAQ: PLUG), a global leader in comprehensive hydrogen solutions for the hydrogen economy, today announced its financial results and operational milestones for the second quarter ended June 30, 2025. Revenue Growth and Run Rate Momentum Plug reported $174 million in"
275,2025-08-13,"Plug to Participate in the Canaccord Growth Conference SLINGERLANDS, N.Y., Aug. 13, 2025 (GLOBE NEWSWIRE) -- Plug Power Inc. (NASDAQ: PLUG), a global leader in comprehensive hydrogen solutions for the hydrogen economy, is participating today in the Canaccord Growth Conference in Boston, Massachusetts. Plug’s participation underscores its leadership in the hydrogen economy and its dedication to building strong connections with the financial community. Participants: Paul Middleton, CFO, and Roberto Friedlander, Vice President of Investor RelationsPres"
276,2025-08-13,What Plug Powers Latest Earnings Mean for Long-Term Investors Plug Power is making progress on its strategic plan.
277,2025-08-13,"Plug Power And Allied Green Expand Strategic Collaboration With New 2 GW Electrolyzer Deal In Uzbekistan Plug Power Inc. (NASDAQ:PLUG) is among the 11 Best Hydrogen Stocks to Invest in Now. Plug Power Inc. (NASDAQ:PLUG) and Allied Green Ammonia announced a new 2 GW electrolyzer agreement on June 9, 2025, for a $5.5 billion sustainable fuels project in Uzbekistan. The agreement was signed at the Tashkent International Investment Forum and extends […]"
278,2025-08-13,"Plug Power CEO Says His Company Is Square With Trump Administration The hydrogen producer’s stock fell Tuesday after disappointing earnings, but the CEO said his company has key support from President Donald Trump and Republicans in Congress."
279,2025-08-13,"ACHR, OKLO, PLUG: Here’s the Best Low-Risk, High-Reward Trade After Earnings Two of these three popular companies are at risk of completely fading out."
280,2025-08-14,"Why Did Bloom Energy Stock Pop Today? Bloom Energy is expensive, and its getting even more expensive for no good reason today."
281,2025-08-14,"Plug Power Targets $700M in Revenues in 2025: Can It Achieve the Goal? PLUG targets $700M in revenues in 2025, fueled by surging electrolyzer sales and expanding global hydrogen projects."
282,2025-08-15,"Plug Power Shares Sink, but Could the Stock Be Poised for a Rally Later This Year? Provisions in the One Big Beautiful Bill provide some hope for this hydrogen fuel cell manufacturer."
283,2025-08-16,"3 Dirt Cheap Stocks to Buy With $1,000 Right Now Plug Power, Opendoor, and SoFi look undervalued relative to their growth potential."
