772,2025-09-25,"Snowflake: Not For The Faint Of Heart Snowflake Inc. (SNOW) shows strong long-term potential, driven by AI and data analytics, but current valuation remains a major concern."
773,2025-09-25,"Databricks, OpenAI team up to deliver AI models for enterprise clients As part of the agreement, OpenAIs AI models will be built directly into Databricks cloud platform for enterprise data and analytics, as well as its flagship product, Agent Bricks, which helps customers create, test and scale AI apps and agents.  The partnership is expected to generate $100 million in revenue, Databricks said.  OpenAI has been expanding beyond Microsoft Azure, its long-standing cloud partner, to accelerate growth of its enterprise business and drive broader adoption of its AI tools among corporate customers."
774,2025-09-26,Snowflake (SNOW) Down 8.1% Since Last Earnings Report: Can It Rebound? Snowflake (SNOW) reported earnings 30 days ago. Whats next for the stock? We take a look at earnings estimates for some clues.
775,2025-09-26,"Dow Jones Futures Rise: Nvidia, Palantir Near Buy Points With Fed Inflation Due; Trump Sets New Tariffs Fed inflation data is due. Nvidia, Palantir are near buy points. President Trump OKd new tariffs and a TikTok deal."
776,2025-09-26,"Smart Companies Dont Just Endure — They Grow, Too Its not good enough for your company to just endure. It needs to grow. If you cant attract and retain customers continually, everything else is just noise."
777,2025-09-27,"Dow Jones Futures: Market Rallies Off Key Support, 5 Stocks Eye Buy Points; Tesla Deliveries Due The major indexes bounced late in the week. Palantir, DoorDash are near buy points. Tesla deliveries and jobs data loom."
778,2025-09-27,"Blend Achieves Snowflake Premier Partner Status, Unlocking Next Phase of Joint Innovation Blend today announced it has achieved Snowflake Premier Partner Status, a designation reserved for partners who demonstrate exceptional technical expertise and proven customer success on the Snowflake Data Cloud. This recognition enhances co-creating value for clients by combining Snowflakes innovation with Blends expertise to deliver faster outcomes, stronger solutions, and measurable business impact."
779,2025-09-29,"Data Storage Stocks Q2 Earnings Review: Snowflake (NYSE:SNOW) Shines As the Q2 earnings season wraps, let’s dig into this quarter’s best and worst performers in the data storage industry, including Snowflake (NYSE:SNOW) and its peers."
780,2025-09-29,"Agiloft and Spaulding Ridge Partner to Transform Contracting for CFOs and Global Enterprises Agiloft, a leader in data-first contract lifecycle management (CLM), today announced a strategic partnership with Spaulding Ridge, a global cloud advisory and implementation firm. The collaboration will deliver end-to-end CLM transformation services to help global enterprises modernize contracting, accelerate decision-making, and strengthen compliance."
781,2025-09-29,"Snowflake Names Stella Low as Chief Communications Officer No-Headquarters/BOZEMAN, Mont., September 29, 2025--Snowflake (NYSE: SNOW), the AI Data Cloud company, announced today that Stella Low is joining the company as Chief Communications Officer on October 6th. As part of the leadership team, Ms. Low will be responsible for Snowflake’s communications strategy, advising the company’s leadership as Snowflake continues to grow and scale as a technology leader."
782,2025-09-29,"Dow Jones Futures Rise With Tesla Deliveries, Jobs Report Due; 5 Stocks Eye Buy Points The major indexes bounced to end the week. Palantir, DoorDash are near buy points. Tesla deliveries, jobs date and a possible government shutdown loom."
783,2025-09-30,"UiPath shares surge on NVIDIA, OpenAI partnerships Investing.com -- UiPath shares jumped more than 22% in premarket trading after the automation software company announced major collaborations with NVIDIA and OpenAI, alongside other deals with Google and Snowflake."
784,2025-09-30,Why Shares of UiPath Are Soaring Today Announcing partnerships with artificial intelligence (AI) leaders has a funny way of stoking investors excitement.
785,2025-09-30,"Inovalon Launches New Data and Analytics Offering on Snowflake AI Data Cloud for Healthcare & Life Sciences BOWIE, Md., September 30, 2025--Inovalon’s continued partnership with Snowflake brings primary source data and analytics to the AI Data Cloud."
786,2025-09-30,"UiPath Announces Partnership with Snowflake to Unite Agentic Automation and Snowflake Cortex AI NEW YORK, September 30, 2025--UiPath announces partnership with Snowflake, uniting UiPath’s Agentic Automation platform with Snowflake Cortex AI."
787,2025-09-30,"Iterable Recognized as Leader in Snowflake’s Modern Marketing Data Stack Report SAN FRANCISCO, September 30, 2025--Iterable Recognized as Leader in Snowflake’s 2026 Modern Marketing Data Stack Report."
788,2025-10-01,"Ketch Highlighted in Snowflake’s Fourth Annual Modern Marketing Data Stack Report as One to Watch SAN FRANCISCO, September 30, 2025--Ketch, the Data Permissioning Platform for privacy-safe data activation, today announced that it has been recognized by Snowflake, the AI Data Cloud company, as One to Watch in The Modern Marketing Data Stack 2026: How Marketers Become Agents of Change in an AI-Driven World. Ketch was identified in the Privacy & Consent category for supporting first party data strategies with access to permissioned, privacy-safe data."
789,2025-10-01,"Sigma Highlighted in Snowflake’s Fourth Annual Modern Marketing Data Stack Report as Leader SAN FRANCISCO, September 30, 2025--Sigma, the industry-leading analytics platform with unique cloud data platform write-back capabilities, today announced that it has been recognized by Snowflake, the AI Data Cloud company, as a Business Intelligence leader in The Modern Marketing Data Stack 2026: How Marketers Become Agents of Change in an AI-Driven World report."
790,2025-10-01,"RudderStack Recognized as One to Watch in Snowflakes Modern Marketing Data Stack Report RudderStacktoday announced that it has been recognized by Snowflake, the AI Data Cloud company, as an Analytics & Measurement for Data Capture & Customer Analytics One to Watch in The Modern Marketing Data Stack 2026: How Marketers Become Agents of Change in an AI-Driven World. RudderStack was identified in Snowflakes report as one to watch in the Analytics & Measurement for Data Capture & Customer Analytics category."
791,2025-10-01,Why Did UiPath (PATH) Stock Jump on Tuesday? PATH Rockets Higher On Game-Changing AI Alliances With Tech Giants
792,2025-10-01,"OneTrust Recognized as Leader in Snowflakes Modern Marketing Data Stack Report OneTrust, the AI-ready governance platform, today announced that it has been recognized as a leader in the Privacy & Consent category in The Modern Marketing Data Stack 2026: How Marketers Become Agents of Change in an AI-Driven World, published by Snowflake, the AI Data Cloud company."
793,2025-10-01,"Domo Recognized in Snowflakes Fourth Annual Modern Marketing Data Stack Report as One to Watch Domo (Nasdaq: DOMO) today announced that it has been recognized as a Business Intelligence (BI) One to Watch in Snowflakes annual report, The Modern Marketing Data Stack 2026: How Marketers Become Agents of Change in an AI-Driven World."
794,2025-10-01,"Robinhood volumes, UiPath deals, Instacart: Trending Tickers Market Domination host Josh Lipton Yahoo Finance senior reporter Brooke DiPalma track several of the days top trending stock tickers, including Robinhood Markets (HOOD) sharing its latest trading volumes as it expands into prediction markets; UiPath (PATH) after announcing several partnerships with Nvidia (NVDA), OpenAI (OPAI.PVT), Snowflake (SNOW), and Alphabets Google Cloud (GOOG, GOOGL); and Instacart (CART) — which operates as Maplebear, Inc. — getting hit with a downgrade. To watch more expert insights and analysis on the latest market action, check out more Market Domination."
795,2025-10-01,"Acxiom Recognized in Snowflake’s Modern Marketing Data Stack Report for Identity & Onboarding and Collaboration CONWAY, Ark., September 30, 2025--Acxiom, the connected data and technology foundation for the world’s leading brands, announced today that it has been recognized by Snowflake, the AI Data Cloud company, as a Leader in Identity & Onboarding and One to Watch in Collaboration. This recognition comes in Snowflake’s report, The Modern Marketing Data Stack 2026: How Marketers Become Agents of Change in an AI-Driven World."
796,2025-10-01,"Hevo Data Recognized as One to Watch in Snowflakes Modern Marketing Data Stack Report Hevo Data today announced its recognition by Snowflake, the AI Data Cloud company, as One to Watch in the Data Integration category in The Modern Marketing Data Stack 2026: How Marketers Become Agents of Change in an AI-Driven World."
797,2025-10-01,"Tealium recognized in Snowflake’s Modern Marketing Data Stack for powering real-time engagement via bi-directional data flows Tealium and Snowflake empower joint customers to activate high-quality, privacy-compliant data in real time, fueling AI-driven analytics and marketing strategiesSan Diego, Sept. 30, 2025 (GLOBE NEWSWIRE) -- Tealium today announced that it has been recognized by Snowflake, the AI Data Cloud company, as a “One to Watch” in the Activation and Delivery for Owned Channels category of The Modern Marketing Data Stack 2026: How Marketers Become Agents of Change in an AI-Driven World. The fourth annual e"
798,2025-10-01,"MessageGears Recognized as One to Watch in Snowflake’s Modern Marketing Data Stack Report ATLANTA, September 30, 2025--MessageGears, the leading data activation and engagement platform for enterprise brands, today announced that it has been recognized as One to Watch in The Modern Marketing Data Stack 2026: How Marketers Become Agents of Change in an AI-Driven World launched by Snowflake, the AI Data Cloud company. MessageGears was identified in the report’s Activation & Delivery for Owned Channels category for its strengths in audience segmentation, cross-channel message creation"
799,2025-10-01,"GrowthLoop Recognized as One to Watch in Snowflakes 2026 Modern Marketing Data Stack Report GrowthLoop, a pioneer in AI-driven marketing acceleration, today announced its inclusion in the 2026 Modern Marketing Data Stack by Snowflake, the AI Data Cloud Company. Growthloop was named as One to Watch in the Activation and Delivery for Owned Channels category, spotlighting its innovative technology and growing influence within the modern marketing ecosystem."
800,2025-10-01,"Kipi.ai Delivers Marketing Mix Modeling and Analytics App on Snowflake AI Data Cloud NEW YORK & LONDON & MUMBAI, September 30, 2025--Kipi.ai Delivers Marketing Mix Modeling and Analytics App on Snowflake AI Data Cloud."
