701,2025-09-05,"“Watch The Upside Surprise” Snowflake Inc. (SNOW), Says Jim Cramer We recently published Jim Cramer Analyzed These 10 Stocks & Discussed Inflation. Snowflake Inc. (NYSE:SNOW) is one of the stocks Jim Cramer recently discussed. Snowflake Inc. (NYSE:SNOW) is a software company that enables businesses to consolidate and analyze data. Its shares have gained 46.6% year-to-date, primarily on the back of a strong 24% jump in […]"
702,2025-09-05,Snowflake Q2: The Best Way To Play Enterprise AI Discover why Snowflake Inc.s AI-driven strategy and strong Q2 results make it a top long-term investment. Click for more on SNOW stock prospects.
703,2025-09-05,"Subscription Shift: Can C3.ai Monetize Its AI Platform Effectively? AIs revenues slump highlights execution woes, but subscription growth, new deployments and customer wins keep its monetization push in focus."
704,2025-09-05,Snowflakes Latest Quarter Was Impressive. But Shares Are Overvalued. A fast-growing business doesnt always make a great stock.
705,2025-09-05,"The AI trade is divided: Here are some winners & losers Spear Invest founder and chief investment officer Ivana Delevska joins Market Domination with Josh Lipton to discuss the application-versus-infrastructure divide in the artificial intelligence (AI) trade and to explain which AI names she believes are poised to win and lose. To watch more expert insights and analysis on the latest market action, check out more Market Domination."
706,2025-09-05,"Snowflake vs. Alphabet: Which Cloud Analytics Stock Has an Edge Now? SNOW shines with rapid customer growth and AI-driven tools, but GOOGLs Google Cloud offers broader reach and steadier global scale."
707,2025-09-05,"CFOs On the Move: Week ending Sept. 5 GitLab’s finance chief leaves for Snowflake, the CFO of Elon Musk’s xAI departs after a few months and a former Nike exec is named CFO of Crocs."
708,2025-09-06,"It Wasnt A Typical Entry For Snowflake Stock But Our Exit Was Clear We might have used an unusual entry with Snowflake, but we didnt hesitate to cut it when it didnt act as expected."
709,2025-09-08,"Snowflake Inc. (SNOW) SPN Pulse Event Transcript Discover Snowflakes latest AI-driven innovations, partner strategies, and customer succes"
710,2025-09-08,Got $500? 2 Top Growth Stocks to Buy That Could Double Your Money AI is opening new opportunities for these tech leaders.
711,2025-09-09,"SailPoint keeping close eye on AI agents disciplines: CEO Identity security developer SailPoint (SAIL) came out with second quarter earnings results that beat estimates, reporting that annual recurring revenue grew by 28% and raising its full-year revenue guidance. SailPoint founder and CEO Mark McClain joins Yahoo Finance executive editor Brian Sozzi and senior reporter Allie Canal for a conversation on the companys earnings takeaways, the rapid deployment of AI service agents across Big Tech, SailPoints newest cybersecurity products, and its competitive relationship with CrowdStrike (CRWD). For more CEO commentary from the 2025 Goldman Sachs Communacopia and Technology Conference, catch Brian Sozzis full interviews with the chief executives from Verizon Communications (VZ) and Snowflake (SNOW). To watch more expert insights and analysis on the latest market action, check out more Opening Bid."
712,2025-09-09,"Brittany Snow Finds Her Perfect Fit: Introducing Lovesacs Snugg, Always Fits. Forever New. Award-winning actress Brittany Snow, star of LionsgateTV & Netflixs breakout series The Hunting Wives, fronts Lovesacs newest campaign for the launch of Snugg™. The Lovesac Company (Nasdaq: LOVE), the Designed For Life home furnishing and technology brand renowned for its innovation and for revolutionizing the industry with its category-shattering customizable, modular sectionals, tapped Snow to bring star power and modern style to the debut of Snugg, a groundbreaking couch line that delivers"
713,2025-09-09,"Gaylord Opryland to Debut Spectacular New Cirque Holiday Show During 42nd Annual a Country Christmas POMP, SNOW & CIRQUEumstance, An Immersive New Musical, Magic and Cirque Holiday Show, Delivers Dazzling Entertainment to Resorts Festive Christmas Celebration During Exclusive Nashville Residency NASHVILLE, TN / ACCESS Newswire / September 9, 2025 ..."
714,2025-09-09,Goldman Sachs analyst bets AI will give software companies a rebirth Goldman Sachs managing director Kash Rangan on why AI is driving a rebirth of software
715,2025-09-09,"Snowflake Inc. (SNOW) Presents At Goldman Sachs Communicopia + Technology Conference 2025 Transcript Discover Snowflakes AI-driven data platform vision, product innovations, and growth strategy from CEO Sridhar Ramaswamy at the 2025 Goldman Sachs Conference."
716,2025-09-09,"AI is in first inning and our funding has doubled: Verizon CEO Verizon Communications (VZ) CEO Hans Vestberg sits down with Yahoo Finance executive editor Brian Sozzi at the 2025 Goldman Sachs Communacopia and Technology Conference for a conversation about the growth in the telecommunication companys wireless and fiber optics businesses, the M&A (mergers and acquisitions) environment, convergence in the media landscape, and AI. Also catch Brian Sozzis full interview with Snowflake (SNOW) CEO Sridhar Ramaswamy. To watch more expert insights and analysis on the latest market action, check out more Asking for a Trend."
717,2025-09-09,"AI will be major force multiplier for software: Goldman Sachs From Goldman Sachs 2025 Communacopia and Technology Conference, Yahoo Finance executive editor Brian Sozzi speaks with Goldman Sachs US software equity research analyst Kash Rangan about the cooperative relationship between the AI and software industries, the stock narrative around major innovators like Salesforce (CRM), and CoreWeave, and his perspective on other artificial intelligence companies like CoreWeave (CRWV). Oracle (ORCL) is set to release fiscal first quarter earnings figures after the market close on Tuesday, September 9. Also catch Brian Sozzis full interview with Snowflake (SNOW) CEO Sridhar Ramaswamy. To watch more expert insights and analysis on the latest market action, check out more Market Domination Overtime."
718,2025-09-09,Snowflake CEO: Software companies will be profoundly impacted by AI Snowflake CEO Sridhar Ramaswamy offers up a warning to investors in the software space.
719,2025-09-09,"AI analytics platforms are wind in our sails: Snowflake CEO All the way from the 2025 Goldman Sachs Communacopia and Technology Conference, Snowflake (SNOW) CEO Sridhar Ramaswamy sits down with Yahoo Finance executive editor Brian Sozzi to talk extensively about the companys development and deployment of AI service products, the companys business growth, and the narratives around the next generation of artificial intelligence technology, especially coming out of countries like China. To watch more expert insights and analysis on the latest market action, check out more Market Domination."
720,2025-09-09,"September Doesn’t Need to Be Scary for Stocks. This Year Could Prove It. September has a fearsome reputation in the market, but it can be easy to dismiss concerns about monthly performance as superstitious or “astrological,” as Trivariate Research Founder Adam Parker puts it.  When it comes to  performance over the year, the index is a Capricorn, with January the winner historically."
721,2025-09-10,Should You Buy the Dip in This Lesser-Known AI Stock? GitLab shares slipped after its latest earnings release. Can this pullback be the perfect entry point into the AI stock?
722,2025-09-10,2 Leading Tech Stocks to Buy in 2025 These two stocks have been on a roll that could continue for years.
723,2025-09-10,"Coalesce Joins Snowflake for Snowflake World Tour 2025 Coalesce will showcase the real-world impact of data & AI innovation in 12 cities worldwideSAN FRANCISCO, Sept. 10, 2025 (GLOBE NEWSWIRE) -- Coalesce, the only data transformation and governance platform designed for the AI era, today announced its global participation in the Snowflake World Tour 2025 in 12 cities across the Americas, EMEA, and APJ. At seven tour stops, including Amsterdam, Berlin, Chicago, Dallas, New York City, Paris, and Sydney, Coalesce customers will showcase how they are d"
724,2025-09-10,"How Snowflake’s (SNOW) Raised Guidance and Strong Q2 Results Could Shape Its Growth Outlook Snowflake recently reported strong second-quarter financial results, coupled with an increase in product revenue guidance for fiscal 2026 and the third quarter, highlighting expectations for continued robust growth. This optimism was further reflected in management’s outlook, as Snowflake forecasted a significant year-over-year increase in product revenue, drawing increased attention to the company’s positioning in enterprise AI and data cloud adoption. Well now examine how Snowflake’s..."
725,2025-09-10,"OpenAI growing at wild pace, theres never enough compute: CFO Over 700 million people are actively using OpenAI products like ChatGPT each week, according to OpenAI CFO Sarah Friar, and the artificial intelligence developer is on track for $13 billion in revenue this year. Friar sits down with Yahoo Finance executive editor Brian Sozzi at the 2025 Goldman Sachs Communacopia and Technology Conference to discuss the AI firms exponential growth, the future of compute, and its Stargate initiative for broadening AI infrastructure, and the prospects of an IPO in the future. For more CEO commentary from the 2025 Goldman Sachs Communacopia and Technology Conference, catch Brian Sozzis full interviews with the chief executives from Verizon Communications (VZ) and Snowflake (SNOW). To watch more expert insights and analysis on the latest market action, check out more Market Domination Overtime."
726,2025-09-10,"Snowflake (SNOW): Buy, Sell, or Hold Post Q2 Earnings? The past six months have been a windfall for Snowflake’s shareholders. The company’s stock price has jumped 55.3%, hitting $229.20 per share. This was partly due to its solid quarterly results, and the run-up might have investors contemplating their next move."
727,2025-09-10,"Nvidia, Snowflake, Nebius and CoreWeave Surges as AI Deal Sparks Rally Microsoft Inks AI Deal With Nebius; Nvidia Secures China Licenses"
728,2025-09-10,"Gen Z flocks to Pinterest as AI enhances shopping experience: CEO Pinterest (PINS) CEO Bill Ready sits down with Yahoo Finance executive editor Brian Sozzi at the 2025 Goldman Sachs Communacopia and Technology Conference to talk about the social media platforms growth within user demographics like Gen Z and the sites adoption and deployment of AI tools to enhance online shopping experiences. For more CEO commentary from the 2025 Goldman Sachs Communacopia and Technology Conference, catch Brian Sozzis full interviews with the chief executives from Verizon Communications (VZ) and Snowflake (SNOW). To watch more expert insights and analysis on the latest market action, check out more Market Domination."
729,2025-09-10,"10 Top AI Stocks to Buy Now These 10 AI stocks offer exposure to every corner of the artificial intelligence revolution, from robotics to nuclear power."
730,2025-09-11,"Simu Liu Joins Elevate Festival 2025 Lineup as Agenda Goes Live TORONTO, September 11, 2025--Simu Liu - Canadian actor, advocate, and investor - will take the stage at Elevate Festival, Canada’s leading platform for startups, investors, and innovators, when it returns for its seventh year on October 7-9 in Toronto. Built on a foundation of entrepreneurship and innovation, Elevate has grown into the country’s national stage for technology, while keeping founders and the startup community at its core. In 2025, the festival will gather 10,000 attendees at a piv"
731,2025-09-11,"Snowflake Soars 18% in a Month: Should You Buy the Stock or Wait? SNOW stock benefits from strong AI partnerships and portfolio expansion, but a stretched valuation raises caution."
732,2025-09-11,"C3.ai Trades Near 52-Week Low: Right Time to Buy the Stock? The AI stock trades near its 52-week low as soft results, leadership changes and withdrawn guidance weigh on investor confidence."
733,2025-09-12,"Tracking George Soross 13F Portfolio - Q2 2025 Update Read here for an update on Soros Fund Managements Q2 2025 portfolio changes, top holdings, new stakes, and market strategies."
734,2025-09-13,"Got $5,000? 2 Tech Stocks to Buy and Hold for the Long Term Here are two profitable companies making money off the tech boom."
735,2025-09-15,"Fortune Ranks Snowflake as #1 on its Future 50™ 2025 List No-Headquarters/BOZEMAN, Mont., September 15, 2025--Snowflake (NYSE: SNOW), the AI Data Cloud company, today announced that Fortune awarded Snowflake the number one spot on its 2025 Fortune Future 50™ list. Fortune’s annual list recognizes publicly traded and venture-backed private companies for their resilience and potential for sustainable growth amid a volatile global economy. This marks the second time Snowflake has topped the list in three years."
736,2025-09-15,"Snowflake tops Fortune Future 50, new CFO highlights AI leadership The tech companys growth is fueled by the rise of AI in business."
737,2025-09-15,Here’s what sets apart the top companies most ready to thrive in the age of AI — and U.S. tech is leading the way Also: All the news and watercooler chat from Fortune.
738,2025-09-15,"1 Cash-Producing Stock to Consider Right Now and 2 We Turn Down While strong cash flow is a key indicator of stability, it doesn’t always translate to superior returns. Some cash-heavy businesses struggle with inefficient spending, slowing demand, or weak competitive positioning."
739,2025-09-16,"Introducing Pulumi Neo, the Industrys First AI-Powered Platform Engineer Infrastructure automation leader Pulumi, with over 3,700 customers, including Snowflake, Nvidia, and the BMW Group, today announced Pulumi Neo, the industrys first platform engineering AI agent purpose-built to manage infrastructure on any cloud—public, private, or hybrid—with enterprise-grade controls. Neo builds on Pulumis proven cloud engineering platform and flagship infrastructure as code (IaC) technology, which supports thousands of cloud providers and powers over one million downloads p"
740,2025-09-16,"Workday Introduces Workday Data Cloud to Unlock the Power of People and Money Data and Accelerate AI-Powered Innovation Workday Rising 2025 -- Workday, Inc. (NASDAQ: WDAY), the enterprise AI platform for managing people, money, and agents, today announced Workday Data Cloud, a new data layer that will help organizations unlock the strategic value of their HR and finance data by connecting it to their existing analytics platforms and operational systems. Customers will get rich, secure, real-time access to insights – turning workforce and financial information into action faster than ever."
741,2025-09-16,"Peraton Joins Forces with Snowflake to Fight Federal and State Fraud, Waste, and Abuse with Rapid FI RESTON, Va., September 16, 2025--Peraton announcing its collaboration with Snowflake to help the government combat FWA using Rapid FI."
742,2025-09-16,"Snowflake: Palantirs Growth At A Fraction Of The Price (Rating Upgrade) Discover why Snowflakes strong earnings, AI-driven growth, and analyst upgrade signal a 28% upside for SNOW stock."
743,2025-09-16,Sezzle: Incredible Buy Or Risky Business? Discover why Sezzle Inc. recent dip may offer a buying opportunity despite strong earnings and market leadership. Click for more on SEZL stock prospects.
744,2025-09-16,"Salesforces Data Cloud Adoption Jumps 140%: Will It Aid Sales Growth? A 140% surge in Data Cloud customers helps CRM deliver $10.25 billion in Q2 revenues, underscoring datas role in its growth push."
745,2025-09-17,"Analyst Explains Why She’s Buying Snowflake Inc (SNOW) – ‘It Was Just Too Tempting’ We recently published 10 Stock News You Should Pay Attention To. Snowflake Inc. (NYSE:SNOW) is one of the stocks to watch in September. Stephanie Link, CIO at Hightower, explained in a recent program on CNBC why she loaded up on Snowflake. The analyst cited Snowflake’s earnings growth and momentum due to AI and data centers […]"
746,2025-09-17,"What Catalysts Are Shifting the Narrative for Snowflake After Recent Analyst Upgrades Snowflakes consensus analyst price target has inched slightly higher, rising from $260.62 to $263.43 following the companys latest quarterly results. This modest increase reflects positive sentiment among analysts, as it is driven by robust revenue growth and expanding opportunities across Snowflakes platform. Stay with us to learn how you can stay on top of the evolving story behind this innovative data giant. What Wall Street Has Been Saying Following Snowflake’s latest quarterly report,..."
747,2025-09-17,"Suger Surges 17x to Process Over $6 Billion in Cloud Marketplace Transactions SAN FRANCISCO, September 16, 2025--Suger, the modern Cloud Go-to-Market platform, has processed over $6 billion in cloud marketplace transactions to date, a 17x year-over-year increase."
748,2025-09-17,"SNOWs Robust Portfolio Expands Client Base: Will the Trend Continue? Snowflakes expanding AI-driven portfolio, strong customer growth, and key partnerships fuel momentum despite tough competition."
749,2025-09-17,The AI Trade Has Stocks Near Highs Again. Some Tech Names Remain on the Sidelines This latest iteration of the AI hype train features massive rallies in stocks like  Oracle  and  Broadcom  Both surged after reporting quarterly results that specifically spelled out how artificial intelligence will drive sales and profit in the coming quarters.  While there could be some credence to that argument—particularly considering that an OpenAI investment helped boost Oracle—the market’s distinction between winners and losers during second-quarter earnings season has taken on a new dynamic.  Strategists at Goldman Sachs recently highlighted this trend in a note to clients.
750,2025-09-18,"Snowflake Named 2025 Strategic Partner of the Year by Morgan Stanley No-Headquarters/BOZEMAN, Mont., September 18, 2025--Snowflake (NYSE: SNOW), the AI Data Cloud company, today announced that it has been named Morgan Stanley’s 2025 Strategic Partner of the Year during the Firms 23rd Tech Week reception. The prestigious award recognizes Snowflakes transformative contributions in helping to power Morgan Stanleys data-driven initiatives and accelerating AI innovation across one of the worlds leading financial services firms."
751,2025-09-18,Use These Stock Chart Signals to Find Winning Options Trades Gavin McMaster explains how to screen for options trades using bearish and bullish engulfing candlestick patterns layered on top of options flow.
752,2025-09-18,"Can AI-Powered Tools Position MongoDB for Sustained Revenue Growth? MDBs AI-native platform, powered by Voyage AI and partnerships, is driving enterprise adoption and revenue expansion."
753,2025-09-20,"SNOW Rides on Enterprise AI Adoption: Can the Growth Continue? Snowflake posts strong growth as AI fuels new customer wins, rising product revenues, and deeper enterprise adoption."
754,2025-09-21,"Salesforce (CRM) Unveils AI-Driven Strategy to Boost Customer Satisfaction and Profitability Salesforce, Inc. (NYSE:CRM) ranks among the best fundamental stocks to buy right now. Salesforce, Inc. (NYSE:CRM) presented a strategy vision focused on business transformation and AI integration at the Goldman Sachs Communicopia + Technology Conference 2025 on September 9. Salesforce CEO Marc Benioff spoke about the company’s goals of employing AI-driven solutions to increase customer […]"
755,2025-09-21,"Snowflake: AI Driven Growth At Too Great A Price SNOW has reported robust FQ226 performance metrics, thanks to the customers higher consumption trends across its AI-native analytical platform."
756,2025-09-22,C3.ais Q1 Margin Squeeze Raises Questions on Path to Profitability AIs pivot to initial production deployments is reshaping growth prospects but straining margins and delaying its path to profitability.
757,2025-09-23,"MDB Shares Jump 39% YTD: Should You Add the Stock to Your Portfolio? MDB rides strong Atlas demand and early AI adoption to a 39% YTD gain, with margin gains pointing to more upside."
758,2025-09-23,"Piper Sandler Turns Less Bearish on Workday (WDAY) Following Workday Rising Workday, Inc. (NASDAQ:WDAY) is one of the Must-Watch AI Stocks on Wall Street. On September 17, Piper Sandler upgraded the stock to “Neutral” from Underweight and raised its price target to $235.00 from $220.00. The rating upgrade follows key announcements made at the company’s annual event, Workday Rising. Analysts led by Brent Bracelin said that they […]"
759,2025-09-23,AI Market Could Soar 6 Times by 2030: 2 Brilliant AI Stocks to Buy Now (Hint: Not Nvidia) Long-term investors should pick stakes in companies building global AI infrastructure and enterprise data ecosystems.
760,2025-09-23,"ValuEngine Weekly Market Summary And Commentary Every index followed regularly in this note performed well last week. The leader, as it has been most weeks in 2025, is QQQM, the Invesco Nasdaq 100 ETF. Read more here."
761,2025-09-23,"Sigma Joins Snowflake to Spearhead Open Semantic Interchange: Unlocking Data and AI Interoperability Across the Ecosystem SAN FRANCISCO, September 23, 2025--Sigma today announced it is joining Snowflake, the AI Data Cloud company, and other industry leaders to launch the Open Semantic Interchange (OSI), an open source initiative that creates a universal specification for all companies to standardize their fragmented data definitions with an open, vendor-neutral semantic model specification. OSI aims to enhance interoperability across various tools and platforms, offering enterprises a vendor-neutral specification t"
762,2025-09-24,"Snowflake leads push to standardize metadata for AI Fragmented definitions strain AI’s ability to ingest data. Snowflake, Salesforce and other partners are driving a joint effort to create open source standardizations."
763,2025-09-24,"SNOW Expands in Cloud Analytics: Is the Growth Thesis Strengthening? Snowflakes momentum in cloud analytics, strengthened by AI integration and key partnerships, is driving robust growth."
764,2025-09-24,"Workday Unveils Data Cloud with Zero-Copy Integration to Databricks, Salesforce, Snowflake for Real-Time Insights Workday Inc. (NASDAQ:WDAY) is one of the best innovative stocks to buy now. On September 16, Workday announced Workday Data Cloud, which is a new data layer designed to unlock the strategic value of organizations’ core HR and finance data by securely connecting it in real-time to their existing analytics and operational systems. The goal is […]"
765,2025-09-24,"GitLab names new interim CFO, CAO James Shen will receive an additional $10,000 in monthly compensation related to his appointment as GitLabs interim finance chief."
766,2025-09-24,"Denodo Users Gain 345% ROI, 3–4x Faster Time-to-Insight, and Other Advantages, When Deployed alongside a Data Lakehouse Study conducted by Veqtor8 finds delayed projects and $millions at risk when enterprises operate lakehouses without a logical data layerPALO ALTO, Calif., Sept. 24, 2025 (GLOBE NEWSWIRE) -- Denodo, a leader in data management, announced the availability of a new study conducted by independent analyst firm Veqtor8. The study compared the ROI of using the Denodo Platform alongside data lakehouses, such as those provided by Snowflake and Databricks, versus relying on lakehouses alone. The study fou"
767,2025-09-24,"Rattled by Trumps Chaotic H-1B Policy, US Firms Quietly Wait Out Changes The White House’s announcement Sept. 19 of a $100,000 fee sparked panic among employers and workers, particularly in the tech sector, which uses it to bring in trained engineers and programmers.  The initial frenzy has eased after officials clarified the fee wouldn’t apply to existing visa holders or renewals.  For businesses, one advantage of the wait-and-see approach is to avoid drawing the ire of the Trump administration, said Kathryn Wylde, chief executive officer of the Partnership for New York City."
768,2025-09-24,"Will Improving Margins Position MongoDB for Durable Growth Ahead? MDB aims for durable growth as Atlas momentum, AI-driven demand and scaling efficiency power future margin gains."
769,2025-09-24,"Simplement Announces Signals™ for Snowflake AI Data Cloud LAS VEGAS, September 24, 2025--Simplement announces Signals™ for SAP reporting in Snowflake, built on its Roundhouse platform of optimized real time ETL for SAP."
770,2025-09-24,"Is It Too Late to Consider Snowflake After the Recent Earnings Surge? Thinking about Snowflake stock has never been more interesting. Maybe you’ve watched its price rocket up an incredible 98.7% over the past year, or you’re wondering if the recent 41.9% year-to-date climb still leaves room for more runs, or if things are just getting overhyped. In just the last month, shares gained 13.6%, and even in the last week alone, Snowflake notched another 3.5%. Clearly, excitement is high and momentum is building. Part of that buzz comes from broader optimism around..."
771,2025-09-25,"Snowflake Announces Snowflake for Startups to Help Companies Build, Launch and Scale Enterprise-Grade AI Innovations MENLO PARK, Calif., September 24, 2025--Snowflake (NYSE: SNOW), the AI Data Cloud company, today unveiled Snowflake for Startups at the grand opening of its Silicon Valley AI (SVAI) Hub. An evolution of the Powered by Snowflake program, Snowflake for Startups serves as a launchpad to help founders build and scale enterprise-grade AI applications on Snowflake’s AI Data Cloud, delivering new product capabilities, strategic relationships with key venture capital firms and coworking opportunities."
