1,"U.S. Auto Regulator Investigating Teslas Self-Driving Tech After Fatal Accident By Don Nico Forbes Tesla is facing an investigation into its driving automation system after a car with Full Self-Driving engaged was involved in a fatal accident, according to National Highway..."
2,Billionaire Says Global Conditions Are Treacherous And Getting Worse: Our Approach JPMorgan Chase CEO Jamie Dimon emphasized tremendous geopolitical risks facing the economy and market. Find out what strategies to consider for your portfolio.
3,Will Incentives & High Input Costs Offset Teslas Q3 Delivery Growth? High production costs and aggressive price cuts across models are likely to have weighed on TSLAs third-quarter margins despite rising deliveries.
4,"Is Tesla, Inc. (TSLA) the Best High Growth Lithium Stock to Invest In? We recently compiled a list of 10 High Growth Lithium Stocks to Invest In. In this article, we will look at where Tesla, Inc. (NASDAQ:TSLA) ranks among high growth lithium stocks to invest in. Lithium Prices Drop but Demand Signals Long-Term Gains Rio Tinto announced its acquisition of U.S.-based Arcadium for $6.7 billion, positioning itself […]"
5,"iPhone 16 in China, Tesla probe, Intel-Altera: Stocks in Focus Apple (AAPL) iPhone 16 sales in China grew by 20% in its first three weeks on the market, according to Counterpoint Research data. The National Highway Traffic Safety Administration (NHTSA) is leading a probe into Teslas (TSLA) Full Self-Driving technology in its EVs following several crash reports. Tesla is currently expected to report its third quarter earnings results next week. Intel (INTC) aims to sell a minority stake in subsidiary chipmaker Altera Corporation. Seana Smith and Brad Smith report on these top trending stocks and stories. To watch more expert insights and analysis on the latest market action, check out more Morning Brief here. This post was written by Luke Carberry Mogan."
6,"Teslas $60 Billion Setback: The Cybercab No-Show The main attraction at Teslaâs We, Robot event was supposed to be the Cybercab, a two-seat, fully autonomous vehicle thatâs long been central to justifying Teslaâs gravity-defying valuation."
7,"Should You Buy Tesla Stock Before Oct. 23? Investing is never about one day, but one day can be exciting."
8,"If I Could Only Buy 1 Magnificent Seven Stock in October, This Would Be It Theres one Magnificent Seven stock that appears to be falling out of favor with investors, but I think its still a good buy."
9,"Tesla, Boeing, IBM, And General Electric Head Into The Earnings Confessional Stay informed on key market events with Seeking Alphas Wall Street Week Ahead."
10,"Stocks to watch next week: Tesla, Lloyds, LOréal, Coca-Cola and Unilever Earnings preview of key companies reporting next week and what to look out for."
11,Tesla Stock Falls After Lackluster Robotaxi Event: Time to Buy the Dip? The company has a lot of promises around AI and robotics. It is unclear whether they will be fulfilled.
12,"S&P 500 Earnings: Mega-Cap Tech Names Dont Report Until Halloween Week A big chunk of the S&P 500âs market cap and earnings weight will all get reported in a 72-hour time span at the end of October, just a week before the Presidential election."
13,"AI hearing aids, investing in womens sports: Asking for a Trend On todays episode of Asking for a Trend, Host Josh Lipton breaks down some of the top stories and themes of the trading week. Daymond John, FUBU and the Shark Group founder, and Brandon Sawalich, Starkey CEO, discuss how Starkey is using AI to revolutionize the hearing aid industry. John explains that he uses Starkey hearing aids, and explains, theyre way more than something that I just use to amplify hearing, which is probably the most important part. But now I can use them for so much more. Sawalich explains that Starkey is redefining hearing aids and eliminating the stigma of what hearing aids is. He continues, Its not about amplifying sound. You have a mini computer inside your ear where basically the ear is the new wrist, and helping people be the best selves they can be each and every day. The technology can be used for things like listening to music, sending messages, and translating languages. Sawalich even calls it your personal assistant. Womens sports have captured investors’ attention as WNBA viewership soars to a record high amid the WNBA Finals. Fortuna Investments CEO Justus Parmar breaks down why the venture capital firm is investing in women’s sports. Parmar outlines his view that sports is an emerging investment area with women’s sport representing an especially attractive investment opportunity. “Its a very unique asset class. So youve got the big four mens clubs. Those are kind of the blue-chip stocks of the portfolio. Youve got mens baseball, mens basketball, mens football, obviously, and NHL hockey… When it comes to womens sports, its much like a, I dont want to say a venture or a growth investment, but you know, some people think its underrepresented.” Finally, Josh Lipton breaks down what to watch next week, from Tesla (TSLA) earnings to fresh housing data. This post was written by Melanie Riehl"
14,"Tesla earnings, Fedspeak, home sales: What to Watch Next Week Tesla (TSLA) kicks off the earnings season for Magnificent Seven tech names next week. Other notable companies publishing their quarterly results include Coca-Cola (KO), Amazon (AMZN), and General Motors (GM) Federal Reserve Bank of Dallas President Lorie Logan and Philadelphia Fed President Patrick Harker are set to deliver commentary next week as well. On the housing front, US existing home sales and new home sales are also due out. To watch more expert insights and analysis on the latest market action, check out more Asking for a Trend here. This post was written by Luke Carberry Mogan."
15,"Goldman Sachs: Tesla, Inc. (NASDAQ:TSLA) Is A Stock With High Consensus ROE We recently looked at Goldman Sachs’ Stocks With Highest Consensus Returns: 42 Stocks With The Highest Consensus ROE. In this piece, we will look at where Tesla, Inc. (NASDAQ:TSLA) ranks in the list. As the fourth quarter of 2024 settles in, the narrative surrounding stocks on Wall Street is starting to shift. This is unsurprising […]"
16,Tesla Earnings Due Amid Model Y Refresh Buzz; BYD Reclaims Buy Zone Tesla earnings are due amid Model Y refresh buzz. TSLA stock has tumbled in October on Q3 deliveries and the robotaxi event. BYD stock is back in a buy zone.
17,"Heres Why Tesla (TSLA) Is a Great Buy the Bottom Stock Now After losing some value lately, a hammer chart pattern has been formed for Tesla (TSLA), indicating that the stock has found support. This, combined with an upward trend in earnings estimate revisions, could lead to a trend reversal for the stock in the near term."
18,"Tesla Stock Edges Lower Ahead of Earnings. It Needs a Big Beat. Tesla stock was trading between gains and losses in early trading ahead of the company’s highly anticipated quarterly earnings report due in the afternoon.  Coming into Wednesday’s trading, Tesla stock has dropped for four consecutive days, leaving shares down about 12.3% this year.  Investors wanted to see some stability in profit margins and didn’t get it."
19,"The Dow drops 250 points as McDonalds stock slumps with Tesla earnings up next The Dow Jones Industrial Average and other major indexes opened lower on Wednesday as the yield on the benchmark 10-year U.S. Treasury note continued its upward climb, reaching 4.23%—a level not seen since July. However, there was some relief for investors as oil prices eased, with West Texas Intermediate (WTI) futures trading around $70.65 per barrel."
20,"Rewey Asset Management Q3 2024 Investment Letter Our RAM Smid Composites 9.83% rise in 3Q24 and 18.53% year-to-date, outperformed our benchmark, the Russell 2500 Value index, which gained 9.63% in 3Q24 and up 11.27% YTD."
21,"Tesla Posts Surprise Gain in Quarterly Earnings, Sees Slight Growth in 2024 Deliveries Tesla Posts Surprise Gain in Quarterly Earnings, Sees Slight Growth in 2024 Deliveries"
22,"Tesla posts surprise $2.17 billion third-quarter profit, up 17.3% from a year ago DETROIT — Tesla’s third-quarter net income rose 17.3% compared with a year ago as its electric vehicle sales rose. The Austin, Texas, company said Wednesday that it made $2.17 billion from..."
23,"Justice Dept warns Musks super PAC over million dollar giveaways, CNN reports The U.S. Justice Department has sent a letter to Elon Musks super PAC warning that the billionaire Tesla CEOs $1 million giveaways may violate federal law, CNN reported on Wednesday, citing people..."
24,"Asia shares fall on US election anxiety; Tesla earnings provide some cheer Asian shares fell on Thursday, while the dollar held near three-month highs and U.S. yields rose as uncertainty over the U.S. election outcome kept markets on edge, though Teslas forecast-topping..."
25,Why Lucid Stock Fell Today Interest rates and the anticipation of big news from Tesla played roles in Lucid stocks moves Wednesday.
26,Tesla Surprises Wall Street With Strong Third-Quarter Results The robust performance comes after a tumultuous start to the year in which Tesla’s profit fell for two straight quarters.
27,"How Did Tesla Boost Its Profit Margins? Tesla blew past Wall Streets forecasts for profit margins.  “Our cost of goods sold per vehicle came down to its lowest level ever at about $35,100,” reads part of Tesla’s earnings release.  Tesla said its pickup produced positive gross profits for the first time in the third quarter."
28,"Tesla promises paid robotaxis next year, but significant hurdles remain Tesla CEO Elon Musk on Wednesday said the electric vehicle maker will roll out driverless ride-hailing services to the public in California and Texas next year, a bold claim likely to face significant regulatory and technical challenges.  We think that well be able to have driverless Teslas doing paid rides next year, Musk said on Teslas quarterly earnings call.  His statement doubled down and expanded on a pledge he made at Teslas robotaxi unveiling two weeks ago, where he said he expected to roll out unsupervised self-driving in certain Tesla vehicles in 2025."
29,"Tesla shares pop 12% in Frankfurt on strong sales forecast Teslas Frankfurt-listed shares rose 12% to a two-week high on Thursday, as a strong sales forecast cheered investors. CEO Elon Musk on Wednesday forecast vehicle sales would grow by..."
30,"Tesla: Sell The Rally, Autonomous Robots Do Not Justify Sky-High Valuation The underwhelming demonstrations at the âWe, Robotâ event have culminated in a mismatch between real progress and Tesla, Inc. stockâs sky-high valuation. Learn more on TSLA stock here."
31,"Tesla earnings: Are Full-Self Driving functions spurring demand? Tesla (TSLA) stock is climbing higher in extended-hours trading after reporting mixed third quarter earnings, missing revenue estimates ($25.18 billion vs. $25.43 billion expected) and posting adjusted earnings of $0.72 per share ($0.60 was expected). The EV maker stated it is on track for slight growth in EV deliveries for 2024, while projecting production on affordable EVs to begin in 2025. This just confirms what theyve been saying, which is were going to get affordable cars in the first half of next year, RBC Capital Markets Global Autos Analyst Tom Narayan tells Julie Hyman and Josh Lipton, adding: We all thought we were going to see something at the robotaxi event about this, but I think folks are just comforted to know that it is coming. Everything is on track on the more affordable cars. Narayan discusses Teslas earnings print and what it is forecasting about the electric automakers margins: They did do some discounting and theyre going to try to get that growth number for the full year. So Q4 youre going to see some price-cutting. But if they can still do a 17% margin, X credits, thats a pretty strong signal that... they can continue to hold on to margins. Tesla reported 462,890 EV deliveries, just below Wall Street consensus estimates 463,897. Narayan believes Teslas Full Self-Driving upgrades and pivots to autonomous driving could be boosting its demand. The services number was pretty high. So I do wonder if the services attach rate, especially FSD, might be making making an impact here. Folks could be thinking Im going to buy this car because of FSD, Narayan says. That may be catalyzing demand. And kind of even though the models are maybe a little long in the tooth... FSD is something, something special here that might be whats happening. To watch more expert insights and analysis on the latest market action, check out more Market Domination Overtime here. This post was written by Luke Carberry Mogan."
32,"Tesla Q3: Elon Musk Teaches The Market A Lesson Tesla, Inc.s strong Q3 earnings beat expectations, with impressive growth in free cash flow and margins. Read my updated look at TSLA stock prospects now."
33,"GM gets Wall Street love, Tesla gets a win, and the best and worst car deals: Autos news roundup GM is hanging a gangbusters 2024. Tesla finally stopped the bleeding. And we rundown the best and worst deals on new cars right now."
34,Decoding Tesla Inc (TSLA): A Strategic SWOT Insight Unveiling the Strengths and Challenges: A Deep Dive into Tesla Inc (TSLA) SWOT Analysis
35,"Nasdaq, S&P 500 Rise Amid Tesla Rally; Dow Falls Nasdaq, S&P 500 Rise Amid Tesla Rally; Dow Falls"
36,"Tesla Faces Major Risks In The Future Tesla faces growing risks due to Elon Musks political alignment, impacting its primary markets and consumer perception negatively. See why TSLA stock is a Sell."
37,"S&P 500 Gains and Losses Today: Tesla Stock Leads the Index Higher as Earnings Impress The S&P 500 added 0.2% on Thursday, Oct. 24, 2024, following strong quarterly results from Tesla and a slew of other corporate earnings releases."
38,"Heres a look at Musks contact with Putin and why it matters WASHINGTON — Elon Musk, the billionaire owner of major government contractor SpaceX and key ally of Republican presidential nominee Donald Trump, has been in regular contact with Russian President..."
39,"Pomerantz Law Firm Investigates Claims On Behalf of Investors of Tesla, Inc. - TSLA NEW YORK, Oct. 25, 2024 /PRNewswire/ -- Pomerantz LLP is investigating claims on behalf of investors of  Tesla, Inc.  . Such investors are advised to contact Danielle Peyton at..."
40,"These Stocks Are Moving the Most Today: Tesla, Capri, Western Digital, Spirit Airlines, Deckers, Coursera, and More Tesla stock moves lower after shares of the electric-vehicle maker surged 22% on Thursday, a judge grants the FTC request to block Capri’s merger with Tapestry, Western Digital swings to a quarterly profit, and Spirit Airlines plans to cut staff and sell 23 airplanes."
41,"Tesla Stock Rally Steamrolls Shorts, Erasing Year’s Gains in One Day (Bloomberg) -- Tesla Inc.’s blowout earnings caught everyone off guard.Most Read from BloombergBooming Cambridge Exposes England’s Widening Wealth GapRobotaxis Are No Friend of Public TransportationArgentina Drug Trafficking Hotspot Sees Murders PlungeThe Tartarian CandidateOman Sees an Urban Future Distinct From Dubai and Abu DhabiBut it was the bears who paid the price this week. The electric-vehicle maker’s results delivered a gut-punch to short-sellers — investors who make money by betting t"
42,Is Elon Musk Superhuman? Heres Why Nvidias Jensen Huang Thinks So After the Tesla Chiefs $2.5 Billion Feat Musk did something few people could pull off.
43,Tesla closes trading week convincingly in the green after impressive quarterly results Copyright © BusinessAMBE 2023Key takeawaysTesla shares gained about 25 percent during the last two trading days of the week. Investors reacted very enthusiastically to the quarterly report....
44,"ARK Invest Sells Tesla Shares Amid Record Rally, Nets $22 Million Profit for Cathie Wood Cathie Wood sells Tesla shares for $22 million gain after stocks 21.9% rally, marking strategic profit-taking"
45,"S&P 500 Posts First Weekly Drop Since Early September as Materials, Health Care Weigh S&P 500 Posts First Weekly Drop Since Early September as Materials, Health Care Weigh"
46,"VWs Scout Motors debuts 2 new EVs and a surprise range extender hybrid option The revived Scout Motors finally showed off its two upcoming electric adventure vehicles, along with a bonus surprise."
47,Is Teslas Stock Pop Sustainable? TSLA ETFs in Focus Teslas stock jumped post upbeat outlook and earnings beat. But cautious investors may wait until they see concrete signs of solid delivery growth before jumping into the stock.
48,"Chart of the Week: Taking a closer look at the Magnificent Seven This week, all members of the Magnificent Seven were back in the green after Teslas massive run Thursday. But looking closer into the year-to-date performance of the USs most valuable stocks highlights some things weve learned so far this year."
49,"Previewing Big Tech Earnings This week takes us into the heart of the Q3 earnings season, with the reporting docket stacked with 168 S&P 500 members and several of the Mag 7 companies."
50,Best Growth Stocks To Buy And Research Best Growth Stocks To Buy And Research
51,"Harris Or Trump? How The Next President Could Change The Game For Stocks, Taxes, And Inflation If Trump wins, the market might experience a boost due to expectations of deregulation and business-friendly policies."
52,Tesla’s Growth to Come From ‘Multiple New Models’. The Stock Is Down. Investors are still mulling over what Tesla CEO Elon Musk’s recent growth comments about 2025 mean for shares of the EV maker.
53,Trump Treasury Contender Pledges to Work With Musk to Slash Spending Trump Treasury Contender Pledges to Work With Musk to Slash Spending
54,"Elon Musk Admits Running Companies Hurts My Heart, But Sees No Other Option For Building The Future. I Never Wanted To Be CEO Elon Musk, known for his CEO roles at Tesla (NASDAQ:TSLA) and SpaceX and for his recent political engagements, has shared his thoughts on being a CEO many times. Despite his current status, Musk revealed that running companies is not something he ever aspired to. In a 2022 tweet, Musk wrote, Running companies hurts my heart but I dont see any other way to bring technology and design to fruition. I never wanted to be CEO – just wanted to work on product/technology. Bill Harris sounded like he"
55,"The Zacks Analyst Blog Meta, Tesla, Thermo Fisher Scientific and Food Comes From Meta, Tesla, Thermo Fisher Scientific and Food Comes From are included in this Analyst Blog."
56,"Did Tesla Just Turn the Profit Corner? In retrospect, last years misery may have been worth it."
57,"Elon Musk predicts more robots than humans by 2040 Tech billionaire CEO Elon Musk took the stage at the Saudia Arabia Future Investment Initiative conference, sharing his bold predictions for the future of autonomous vehicles. Musk stated that he expects unsupervised self-driving capabilities to be deployed in the US as soon as next year. Catalysts Anchor Seana Smith dives deeper into Musks remarks, addressing his outlook on Teslas (TSLA) cybertruck production, his plans for Starships to Mars, and his belief that there will be more robots than people worldwide by 2040. To watch more expert insights and analysis on the latest market action, check out more Catalysts here. This post was written by Angel Smith"
58,What happens as EU concludes investigation of Chinese-made EVs? The European Union formally approved imposing tariffs on Chinese-made electric vehicles on Tuesday after an investigation that has divided the bloc and prompted retaliation from Beijing. ...
59,Ford Stock Dives Below Key Level On Earnings. GM In Buy Range. Ford Stock Dives Below Key Level On Earnings. GM In Buy Range.
60,Where Will Tesla Be in 10 Years? This historically booming stock might not live up to the hype.
61,"Dow Jones Futures Fall, Techs Rise; Google, Reddit Jump But Caterpillar, Eli Lilly, AMD Tumble Dow Jones Futures Fall, Techs Rise; Google, Reddit Jump But Caterpillar, Eli Lilly, AMD Tumble"
62,Dogecoin enjoys bump after Elon Musk boosts the crypto at Trump rally Musks campaigning for Trump and references to an upcoming Department of Government Efficiency (D.O.G.E.) has pumped the cryptos price.
63,Has The Shyft Group (SHYF) Outpaced Other Auto-Tires-Trucks Stocks This Year? Here is how The Shyft Group (SHYF) and Tesla (TSLA) have performed compared to their sector so far this year.
64,"A lot rides on Big Tech earnings amid two busy weeks for markets With a slew of market-driving news set to greet investors over the next week, market strategists tell Yahoo Finance that what Big Tech earnings say about the fundamental story behind the stock market rally will matter most."
65,"Elon Musk says Trumps economic plans will cause temporary hardship and tank the stock market Elon Musk is the richest person on the planet right now. That’s probably part of why he’s fine with former President Donald Trump’s economic plans causing, in his words, “temporary hardship” in the pursuit of a healthier economy years down the road."
66,Truth Social parent company Trump Media now worth more than Elon Musk’s X as Election Day nears Truth Social stock market valuation is now greater than the estimated value of Elon Musk’s X as the the former presidents social media network soars ahead of Election Day.
67,How Kamala Harris is trying to use Elon Musk against Donald Trump Donald Trumps closeness to the worlds richest man could be used against him. At least thats what the top super-PAC supporting Kamala Harris thinks.
68,"Jim Cramer Rejects Fossil Fuel Naysayers: Bullish on Chevron (CVX) We recently published a list of Jim Cramer is Talking About These 10 Stocks. In this article, we are going to take a look at where Chevron Corp (NYSE:CVX) stands against other stocks Jim Cramer is talking about. Jim Cramer in a latest program on CNBC said that the market is narrowing again as he […]"
69,"Is Tesla, Inc. (TSLA) The Best EV Battery Stock To Buy in Late 2024? We recently published a list of the 8 Best EV Battery Stocks To Buy in Late 2024. In this article, we are going to take a look at where Tesla, Inc. (NASDAQ:TSLA) stands against other best EV battery stocks to buy in late 2024. Future of Lithium with M&A Activity and Regional Consolidation Trends While […]"
70,Stock Analysis: How To Find And Research The Best Stocks Stock Analysis: How To Find And Research The Best Stocks
71,"Zacks Earnings Trends Highlights: Tesla, Alphabet and Microsoft Tesla, Alphabet and Microsoft are part of the Zacks Earnings Trends article."
72,"Tesla’s robotaxi will make your commute worse. Elon Musk should focus on the less-hyped Robovan instead Robotaxi companies would argue that centralized vehicle routing algorithms can reduce deadheading, but its inevitable in any taxi system."
73,"5 Things Investors Should Not See In A Healthy Economy Digging into the economic readings, growth is much less impressive than it seems based on the headline numbers. We highlight five things investors shouldnt see in a healthy economy."
74,"Meta, Microsoft AI Spending Is Causing Market Jitters. Why the Investing Won’t Stop and 5 Other Things to Know Today. Super Micro’s troubles could be an opportunity for Dell and Hewlett Packard, Eli Lilly says copycat drug pharmacies didn’t affect Zepbound sales, more news to start your day."
75,"Mag 7 earnings underline the groups huge market influence Alphabet (GOOG, GOOGL) delivered an earnings beat, sending the stock higher and fueling confidence in the “Magnificent Seven” group. With Microsoft (MSFT), Meta Platforms (META), Amazon (AMZN), and Apple (AAPL) set to report this week, Capital Fund Management head of macro strategy Christian Dery joins Market Domination Hosts Julie Hyman and Josh Lipton to discuss the impact of the Magnificent Seven on the broader market. “These companies have gotten so large that on earnings events…youre getting these swings in market cap on the order of $2 [billion] to $400 billion,” Dery says, highlighting Nvidia (NVDA) and its impact on the S&P 500 (^GSPC) specifically. The chipmaker doesn’t report earnings until Nov. 20. As the Magnificent Seven companies report earnings, capital spending will likely be closely watched by investors as Big Tech companies invest billions into artificial intelligence (AI) infrastructure without a definitive timeline on AI monetization. The strategist says, “The reality is that the existing incumbents have to build out this technology because they cant risk falling behind their competitors,” but “We havent found the killer use case just yet, and the market is going to start to be more discerning in terms of [the] path to profitability scale. Theyre going to focus on CapEx and projections for CapEx.” For more on how Dery navigates investing in the Magnificent Seven, watch the video above. To watch more expert insights and analysis on the latest market action, check out more Market Domination here. This post was written by Naomi Buchanan."
76,"Elon Musk Reportedly Buying Up Huge Properties In Austin To House His 11 Kids And Their Mothers In Secret The richest man in the world, Elon Musk, is known for his ambitious plans, whether they involve manufacturing electric cars, launching rockets to space, or having large families. According to a recent report by The New York Times, Musk is now quietly setting up a family compound in Austin, Texas, with properties worth around $35 million. According to the Times, his expanding family — which includes his 11 children and two of their three mothers — could be housed in this compound. Dont Miss: The"
77,What the Election Means for Companies and Sectors What the Election Means for Companies and Sectors
