78,"Enphase Energy: Disappointing, But Not As Bad As It Seems Enphase Energy continues to focus on its business fundamentals, working with installers, expanding to new geographies and launching new products. Read more about recent earnings."
79,"How One Investor Made Retirement Happen With $61,600 In Annual Dividends Dividend investing is an approach to building wealth over the long term. By investing in companies that consistently pay dividends to their shareholders, investors can benefit from a steady stream of income while potentially growing their principal ..."
80,Catherine Woods Strategic Moves in Q3 2024: A Deep Dive into Zoom Video Communications ... Insights from ARK Investment Managements Latest 13F Filing
81,China EV Giant BYD Pops Into Buy Zone As Tesla Flashes Sell Signal China EV Giant BYD Pops Into Buy Zone As Tesla Flashes Sell Signal
82,"Chinas DeepRoute.ai raises $100 million as smart driving adoption speeds up Chinese autonomous driving technology developer DeepRoute.ai has raised $100 million from an automaker, the company said on Monday, as it looks to bolster mass adoption of its systems on vehicles..."
83,"Tesla Investors Confuse Valuation And Stock Price, Says Gary Black As Investor Sees Recovery In Stock Gary Black, managing partner at The Future Fund, shared his outlook on Tesla Inc (NASDAQ:TSLA), stressing that many TSLA investors still conflate valuation and stock price. What Happened: In response to Teslas electric vehicle price cuts in October ..."
84,"Teslas Oct China-made EV sales fall 5.3% y/y U.S. automaker Teslas sold 68,280 China-made electric vehicles in October, down 5.3% from a year earlier, data from the China Passenger Car Association showed on Monday. Deliveries of..."
85,"Shaqs Son Wanted A Tesla For Christmas After Getting Straight As – You Aint Getting No Tesla! You Better Get You A Charger, A V-6 At That On the Earn Your Leisure podcast in 2021, Shaquille ONeal shared a parenting philosophy thats equal parts tough love and humor. Even with a net worth of $500 million, Shaq isnt handing out Teslas to his kids on a whim. His rule? They have to earn it. We aint rich, Im rich, he famously told them, making it clear they need to work for what they want – especially his sons. He admits the girls get a bit of a pass, but his sons? Theyre expected to build their paths to success, with multiple d"
86,"Musk No Useful Idiot Under Trump 2.0: Strategy Risks -- Geopolitical and data analysis firm Strategy Risks says Teslas heavy exposure to China is a threat to the EV maker, as it tries to navigate an increasingly-adversarial relationship between..."
87,"Meet Musk’s Fixer, the Powerful Executive Reshaping Tesla Omead Afshar, known for his ability to mind-meld with the CEO, steps into the prominent role as the auto business confronts challenges."
88,"AI Robot Trader Dumped Microsoft, Amazon Stocks and Went Defensive. Here’s What It Bought. AI Robot Trader Dumped Microsoft, Amazon Stocks and Went Defensive. Here’s What It Bought."
89,"Europe falls but US hits new highs as Trump wins Londons FTSE 100 faded into the close on Wednesday as the early euphoria in local equity markets dissipated after Donald Trumps election triumph.The FTSE 100 index closed down 5.71 points, or..."
90,"Tracking Baillie Giffords 13F Portfolio - Q3 2024 Update Baillie Giffords diverse $134B portfolio sees stake increases in high-growth companies like Shopify, Sea Ltd., and Microsoft."
91,"Horizon Kinetics Q3 2024 Commentary For Horizon Kineticss Q3 2024 Commentary, it seemed like a fine idea to let the news lead the way and save us some work. Click here to read the full commentary."
92,"Top Stock Movers Now: Trump Media, Tesla, Palantir, and More Major U.S. indexes gained at midday Tuesday as investors awaited the results of the U.S. presidential election."
93,"Trump Has Fed’s Powell in His Sights. Why The Stock Rally Could Suffer, and 5 Other Things to Know Today. Trump Has Fed’s Powell in His Sights. Why The Stock Rally Could Suffer, and 5 Other Things to Know Today."
94,"Trump’s EV Hate Drives Ford, GM Gains Shares of  Ford Motor  and  General Motors  rose sharply Wednesday.  Ford stock was up stock was up 5.6% at $11.19 a share in midday trading, while the  and  gained 2.4% and 3.4%, respectively.  GM stock was up as much as 3% Wednesday, flirting with $54 a share."
95,"Tesla investors lose bid for new US trial over Musks 2018 tweets A U.S. appeals court on Wednesday upheld a jurys verdict clearing Tesla CEO Elon Musk and his company of liability over allegations they misled investors when the billionaire posted on social media in 2018 that he had funding secured to take the electric car company private.  The San Francisco-based 9th U.S. Circuit Court of Appeals rejected arguments by lawyers for Tesla investors that the instructions jurors received on the law from the judge presiding over the case before they delivered their verdict in February 2023 were flawed, warranting a new trial.  Lawyers for Tesla shareholders argued the jury instructions were confusing and impermissibly heightened their burden of proof by requiring them to establish Musk knowingly made false statements when he wrote his posts on Twitter, the platform now known as X following Musks $44 billion acquisition of it in 2022."
96,Big Tech stocks climb sharply after jump that followed election results Big Tech stocks climb sharply after jump that followed election results
97,Elon Musk bet big on Trump — and won. Will it pay off for Tesla? Tesla CEO Elon Musk’s embrace of President-elect Donald Trump is paying dividends for Tesla shareholders today.
98,"Tesla stock surges despite Trumps uncertain EV support Tesla (TSLA) stock is soaring after former President Donald Trumps victory in the 2024 U.S. presidential election. While CEO Elon Musk was a vocal supporter of Trump, the President-elect has not expressed the same enthusiasm for the electric vehicle industry. Its interesting because theres a lot of government help or regulation or incentive all pushing the electric vehicle transition, and Teslas absolutely benefited from that. But we also know that Donald Trump doesnt necessarily support that thinking, iSeeCars.com Executive Analyst Karl Brauer told Yahoo Finance. Brauer notes that a government-led transition to EVs is not a concept that Trump has embraced. He points to the broader EV market beyond Tesla, noting that other stocks in the sector are not experiencing the same rally as Tesla. Its interesting to see that people feel like Elons relationship with Donald Trump will overcome a potential shift in policy, he adds. Moving forward, Brauer believes that Trumps policy regarding EVs may hurt the sector, including Tesla. To watch more expert insights and analysis on the latest market action, check out more Wealth here. This post was written by Angel Smith"
99,Heard on the Street: Tesla at $1 Trillion Finally Clears Its Twitter Discount Tesla is a $1 trillion company again.  The EV maker’s stock jumped more than 8% Friday to put the company’s closing market cap over that threshold for the first time since April 2022.  Worries among Tesla investors about the boss’s growing list of distractions and controversial behavior online sparked a selloff on the stock--one that was even harsh enough to get Musk to reconsider his plans and try to get out of the deal.
100,US Equities Markets End Higher Friday as Consumer Sentiment Improves US Equities Markets End Higher Friday as Consumer Sentiment Improves
