551,"Tesla Fires Top Executive Omead Afshar as EV Sales Slump in U.S. and Europe Leadership shakeup comes amid Cybertruck struggles, declining deliveries, and rising pressure from Chinese rivals"
552,"Musk Confidant Afshar Leaves Tesla in Latest High-Level Exit (Bloomberg) -- Omead Afshar, a powerful executive at Tesla Inc. and one of Elon Musk’s closest confidants, has left the company, according to people familiar with the matter, the latest high-level departure during a volatile period for the electric vehicle maker.Most Read from BloombergPhiladelphia Transit System Votes to Cut Service by 45%, Hike FaresUS Renters Face Storm of Rising CostsSqueezed by Crowds, the Roads of Central Park Are Being ReimaginedMapping the Architectural History of New Yo"
553,"Tesla, Inc. (TSLA): It’s Okay For Robotaxis To Make Mistakes, Says Jim Cramer Tesla, Inc. (NASDAQ:TSLA) is one of the Jim Cramer Says Trump’s Angry At Everybody & Discusses These 11 Stocks. Tesla, Inc. (NASDAQ:TSLA) is another feature of Cramer’s morning show. Despite tumultuous share price performance in 2025, Cramer continued to assert before the firm’s recent share price gains that the stock had a lot of potential […]"
554,"Stock Market Week Ahead: Q2 Wrap With Tesla, June Jobs And A Big Deadline The stock market rides some momentum into the second half of the year. Tesla and other automakers report deliveries."
555,"Dow Jones Futures: Stock Market Hits Highs; Tesla Deliveries, Jobs Report On Tap Dow Jones futures will open Sunday evening, along with S&P 500 futures and Nasdaq futures. Tesla deliveries and the June jobs report are on tap this coming week. The stock market rally had a powerful week, with the S&P 500 and Nasdaq hitting record highs on Friday."
556,"Tesla Has Big Plans in China Tesla is expanding its operations in China by developing a grid-scale battery power plant and other advanced projects, moving beyond its traditional electric vehicle manufacturing."
557,"Weekly Picks: ? SUNs Insurance Dividends, NCH2s Hydrogen Exposure, and TSLAs Robotic Inflection Point Why Suncorp’s insurance-only pivot gives it room to grow revenues, why Thyssenkrupp Nucera can leverage its unique position for green hydrogen adoption, and why Tesla is reaching an AI and robotics inflection point"
558,"Trump Says Elon Musk Would Go Broke Without U.S. Subsidies U.S. President Donald Trump has reignited debate over government support for private enterprise, claiming that tech billionaire Elon Musk -- CEO of Tesla, SpaceX, and other ventures -- is heavily..."
559,"Teslas quarterly deliveries fall more sharply than analysts estimates Tesla reported asharper-than-expected fall in second-quarter deliveries onWednesday, as intense competition and backlash against CEO ElonMusks political stance hit global demand for its..."
560,"Taxes, energy, and healthcare: 3 ways Senates Trump megabill impacts the business world Senate leaders advanced President Trumps One Big Beautiful Bill on Tuesday in a vote that moved the legislation one step closer to becoming law."
561,"Tesla Stock Responds After EV Giant Delivers 384,122 EVs, Slightly Below Views Tesla reported second-quarter vehicle deliveries of 384,122, slightly below analyst consensus but not as low as some feared, before Wednesdays stock market open.  TSLA rose after the deliveries report.  The EV giant also released electric vehicle production numbers along with energy storage deployed data around 9 a.m. ET."
562,"Wall St edges down after ADP shock; focus on trade talks, payrolls data U.S. stocks nudged lower on Wednesdayas surprisingly weak U.S. private jobs data raised concernsabout the labor market, while investors closely watched tradenegotiations as President Donald Trumps..."
563,"Sector Update: Consumer Stocks Rise in Tuesday Afternoon Trading Consumer stocks were higher Tuesday afternoon, with the Consumer Staples Select Sector SPDR Fund (XL"
564,"TSLQ May Expose Traders To Substantial Downside Risk TSLQ offers 2x inverse TSLA exposure but carries decay, high fees, and trading risks, making it unsuitable for most investors. Learn why TSLQ ETF is a sell."
565,"NYLI Fiera SMID Growth Fund Q1 2025 Commentary Amidst a challenging equity backdrop NYLI Fiera SMID Growth Fund returned -10.85% (Class I), and slightly underperformed Russell 2500 Growth Index which returned -10.80%."
566,"Tesla Second Quarter 2025 Production, Deliveries & Deployments AUSTIN, Texas - In the second quarter, we produced over 410,000 vehicles, delivered over 384,000 vehicles and deployed 9.6 GWh of energy storage products.Thank you to all our customers, employees,..."
567,"Elon Musk has a one-word response to America Party polls Musk hints at launching America Party after tax bill passes, crypto markets and bettors react."
568,"Secret Super Stocks: If You Invested $1K in These 3 Companies 5 Years Ago, See What You’d Have Today Most people think you need to be rich to make big money in the stock market. But what if all it took was spotting the right stock at the right time and investing just $1,000? While you might try to..."
569,Elon Musk tells tech analyst Dan Ives to Shut up Elon Musk told Dan Ives to shut up after he made recommendations to Teslas board on X.
570,Magnificent Seven Stocks: Nvidia Rallies To Record Highs; Tesla Slides Magnificent Seven Stocks: Nvidia Rallies To Record Highs; Tesla Slides
571,"Dow Jones Futures: Stocks Quiet Amid Trump Tariffs; Elon Musk Tells Tesla Bull To Shut Up The major indexes were quiet, while copper prices spiked on Trump tariffs. Some leaders struggled, but AMD and some other AI plays thrived. Elon Musk told a longtime Tesla bull to shut up."
572,Stock Market Today: Dow Proves The Biggest Loser Of The Day; Nasdaq Closes Flat Stock Market Today: Dow Proves The Biggest Loser Of The Day; Nasdaq Closes Flat
573,"Microsoft Stock Has Outperformed in 2025. Can It Keep Going? With a YTD gain of 19%, Microsoft is outperforming the markets handsomely this year. However, at these levels, the stock’s risk-reward does not look too favorable, at least in the short term."
574,VistaShares CEO Found A Way To Get Yield Out Of Warren Buffett Investors want yield but worry about excess market volatility. Newcomer ETF issuer VistaShares may have found the answer.
575,"Tesla’s rule-breaking board expressing ‘almost a contempt for lawful and accepted procedure’, says governance expert Teslas AGM will occur four months later than required—not good enough, says Charles Elson: The law has to be equally and neutrally applied. There aren’t special exceptions."
576,"Social Buzz: Wallstreetbets Stocks Mixed Pre-Bell Friday; Strategy to Advance, Robinhood Markets to Decline The most-talked-about stocks in the Reddit subforum Wallstreetbets were mixed hours before Fridays"
577,"High Conviction Ideas With Next Gen Investors Rob IsbittsÂ talks to analysts Julia Ostian, Jack Bowman, and Kenio FontesÂ about their high conviction picks."
578,"1 Top Cryptocurrency to Buy Before It Soars 3,260%, According to Cathie Wood of ARK Invest Cathie Wood, CEO of ARK Invest, predicts Bitcoin could reach $3.8 million by 2030, driven by institutional and corporate adoption.  The trend of corporations adopting Bitcoin as a reserve asset is growing, led by Strategy, GameStop, and Trump Media.  Cathie Wood, the head of the technology-focused investment firm ARK Invest, doesnt shy away from making big bets and bold predictions."
579,"Tokenized stocks are the next big fintech buzzword. Are they an innovation or a regulatory loophole? Robinhood announced the launch of OpenAI tokens, sparking a debate over blockchain-wrapper stocks."
580,"Tesla stock needs Elon Musk magic, expert says Elon Musks announcement that he wants to launch a new third party has some Tesla (TSLA) investors and analysts upset. They dont want to see the CEO distracted by politics. In the video above, Tufts University Fletcher School of Law and Diplomacy adjunct associate professor Gautam Mukunda explains why Elon Musk magic is so important to the EV makers stock. To watch more expert insights and analysis on the latest market action, check out more Market Domination Overtime here."
581,"Teslas top North American sales executive leaves, WSJ reports Teslas (TSLA) top sales executive in North America, Troy Jones, has left the electric vehicle maker in the latest senior departure at the company, the Wall Street Journal reported on Tuesday, citing people familiar with the matter."
582,"Jim Cramer on Ouster: “I’m Going to Say No to Speculative” Ouster, Inc. (NASDAQ:OUST) is one of the stocks on Jim Cramer’s radar. During the lightning round, a caller asked what Cramer thinks of the company, and he commented: “Yeah, you know it’s a LiDAR company… and the LiDAR companies have been losing a fortune. I don’t think that there’s anything investible in, honestly, in autonomous, […]"
583,Want to Trade Amazon on a Crypto Exchange? The Price Might Be Off by 300% Digital tokens tracking popular stocks such as Apple deviate wildly from underlying prices and raise concerns about a lack of regulatory oversight.
584,"Compelling Buys, Stellar Tech Moves With The Financial Prophet Victor Dergunov, The Financial Prophet, on very interestingÂ market dynamics and stellar tech moves."
585,"Tesla Stock Drops as Another Top Executive Leaves Tesla  stock tumbled Tuesday following a report that said one of the company’s sales executives had departed.  With CEO Elon Musk spending more time at Tesla and less time in Washington, heads are starting to roll.  Shares of the EV maker traded as high as $321.20, pushing Tesla’s market value back above $1 trillion, but ended the day down 1.9%, closing at $310.78."
586,"BC-Most Active Stocks Globavend Holdings Ltd. 65,364,488 0.0395"
587,"Deepwaters Munster Sees Three-Year Bull Run in Tech Gene Munster, Deepwater Asset Management managing partner, previews Teslas and Alphabets earnings on Bloomberg The Close."
588,"Battery X Metals Announces Commercial Revenue Share Agreement for Next-Generation Lithium-Ion Battery Rebalancing Machine Following Estimated Driving Range Increase of ~255 km of Light-Duty Electric Vehicle Model with Severe Cell Imbalance, Restoring Battery Range to ~295 km in Preliminary Trial News Release Highlights: Battery X Metals Inc.s wholly-owned subsidiary, Battery X Rebalancing Technologies Inc., has entered into a Commercial Revenue Share Agreement with an arms length, independent Vancouver-based automotive service center specializing ..."
589,More Market Uncertainty Likely: Guard Your Wealth With These Two Covered Call ETFs Covered call ETFs offer attractive income and portfolio protection amid market uncertainty. Learn more about covered call ETFs like SPIN and GPIQ.
590,"5 Reasons You Might Regret Buying a Tesla While electric vehicles are the future of the automotive industry, not everyone is happy with their Tesla purchase."
591,"Lucid: Implications Of Uber Robotaxi Deal (Rating Upgrade) Lucid Group, Inc. joins forces with Uber for 20,000 Gravity SUVs, aiming for robotaxi growth. Click for my updated look at LCID stock and why Im upgrading it."
592,"Stock Market Today: Dow Ends Off The Days High, S&P Hits New Record; Tesla Does This As Earnings Loom (Live Coverage) The Dow Jones Industrial Average led the major indexes Tuesday. Homebuilder stocks rallied after two leaders posted positive earnings results."
593,"Tesla Earnings: Why Elon Musks Company Is From Mars, While GM Is From Earth Tesla is set to unveil quarterly results this afternoon and…hey, look, a squirrel!  When Tesla unveiled first-quarter results in April, for example, earnings per share trailed already reduced consensus estimates by 26%.  Operating profit was less than half what analysts expected."
594,"Women Climbed The Corporate Ladder—Then Watched The Alpha Males Take Over Again A resurgence of combative, masculine leadership among high-profile male CEOs is drawing criticism from female executives and equity advocates, according to Business Insider. The shift has prompted many women to leave traditional workplaces in favor of entrepreneurship and more inclusive company cultures. Alpha-Male CEOs Take the Stage The CEOs of major firms—including Meta Platforms (NASDAQ:META), Amazon.com (NASDAQ:AMZN), and Tesla (NASDAQ:TSLA)—have embraced a more aggressive leadership style"
595,"I Asked ChatGPT What Elon Musk’s ‘America Party’ Could Mean for the Economy — Here’s What It Said Could Elon Musk’s proposed America Party reshape fiscal policy and the economy? ChatGPT weighs in on debt, disruption and what it could mean for your money."
596,"Fidelity Blue Chip Growth Fund Q2 2025 Commentary For the quarter, the funds Retail Class shares gained 19.83%, outpacing the 17.84% advance of the benchmark, the Russell 1000Â® Growth Index."
597,"Teslas Q2 Earnings: Elon Musks Candor Locks In Fate Of Fading Autonomy Premium Teslas slump deepens as autonomy momentum fades. Explore the impact of tariffs, earnings slowdown, and what it means for TSLAs $300-range volatility."
598,"Teslas hope-based story fades: Future of robotaxi, cheaper EV Tesla (TSLA) missed on second quarter earnings. The company also revealed its cheaper electric vehicle (EV) model will enter volume production in late 2025, but investor patience is wearing thin. Yahoo Finance Senior Reporters Allie Canal, Pras Subramanian, and Josh Schafer break down why slowing core auto sales and vague timelines on robotaxis and artificial intelligence (AI) are dragging on the stock. To watch more expert insights and analysis on the latest market action, check out more Morning Brief here."
599,"Stocks to Watch Thursday: Tesla, T-Mobile, American Airlines, Broadcom ↘️ Tesla (TSLA): The EV maker reported a 16% drop in quarterly net income and said car sales continued to fall. Shares fell 9% in Thursday morning trading. ↗️ Alphabet (GOOGL): The Google and YouTube parent reported a jump in revenue driven by cloud growth and hiked its annual capital-expenditure forecast."
600,Trump Denies Wanting to Destroy Elon Musk’s Firms (Bloomberg) -- Donald Trump denied he was seeking to ruin the business empire of his onetime ally Elon Musk as retribution for their dispute over the US president’s signature tax law. Most Read from BloombergTrump Awards $1.26 Billion Contract to Build Biggest Immigrant Detention Center in USWhy the Federal Reserve’s Building Renovation Costs $2.5 BillionThe High Costs of Trump’s ‘Big Beautiful’ New Car Loan DeductionSalt Lake City Turns Winter Olympic Bid Into Statewide Bond Boom“Everyone is st
