401,Should You Buy Tesla Stock Before April 22? Tesla is slated to report first-quarter earnings later this month.
402,"Palantir, Crispr, and Other Stocks Cathie Wood Thinks Could Emerge Strong From a Recession The ARK Invest CEO says companies offering innovative solutions—like some of the top holdings in her funds—tend to gain traction in tough times."
403,"Tesla Stock Soars on Tariff Relief. It Wasn’t The Stock’s Best Day Ever. Tesla  stock soared on Wednesday after President Donald Trump paused his so-called reciprocal tariffs on countries other than China for 90 days.  It’s also a sharp reversal from the past week: Coming into Wednesday trading, Tesla stock had dived 21.5% since Trump had announced widespread tariffs on April 2.  Before the tariff news, Tesla shares got a bump from Benchmark analyst Mickey Legg, adding Tesla stock to “Benchmark’s Best Ideas” list."
404,China Raises Tariffs on the U.S. Again. Currencies Are a New Concern. China Raises Tariffs on the U.S. Again. Currencies Are a New Concern.
405,"BYD Stock Soars. Trade Wars Can Hae Unintended Consequences. The stock rose 7.2% in overseas trading.  Stock indexes were volatile after China announced 125% tariff rates on U.S. imports.  Tesla is no longer taking orders for its Model S, X, or Cybertruck in China, according to its website."
406,"10-yr Treasury, Tesla in China, Fastenal earnings: Market Minute Josh Lipton takes a look at the top stories investors are watching on todays Market Minute. US 10-year Treasury yields (^TNX) rise to their highest level since February. Tesla (TSLA) pulls the option to purchase US-made models from its China website. Fastenal Company (FAST) stock gains after reporting first quarter results. Stay up to date on the latest market action, minute-by-minute, with Yahoo Finances Market Minute."
407,7 Market Pros on Wall Street’s Wild Month 7 Market Pros on Wall Street’s Wild Month
408,"Elon Musks Brother Kimbal Blasts Trump: Celebrating Causing Chinas Stock Market To Go Down, By Causing Our Own Stock Market To Go Down? Kimbal Musk, Tesla (NASDAQ:TSLA) board member and brother of CEO Elon Musk, has gone public with sharp criticism of President Donald Trump’s trade policies, calling tariffs a “structural, permanent tax on the American consumer” and accusing Trump of celebrating economic self-sabotage. Kimbal Questions U.S. Strategy of Self-Inflicted Economic Harm “Mmm.. Celebrating causing China’s stock market to go down, by causing our own stock market to go down? Maybe this is why Trump brought back the R word"
409,Ford and GM Stocks Pop After Trump Says He’s Looking at Auto Tariff Pause Ford and GM Stocks Pop After Trump Says He’s Looking at Auto Tariff Pause
410,"Insights Into Tesla (TSLA) Q1: Wall Street Projections for Key Metrics Looking beyond Wall Streets top -and-bottom-line estimate forecasts for Tesla (TSLA), delve into some of its key metrics to gain a deeper insight into the companys potential performance for the quarter ended March 2025."
411,"Gerber: Musk Doesnt Care About Tesla Ross Gerber of Gerber Kawasaki says he doesnt like the way Elon Musk does things but still owns Tesla, expecting that something fixes itself at some point. He joins Ed Ludlow on Bloomberg Technology to discuss."
412,"Tesla’s (TSLA) Energy Segment Could Be the Next Growth Driver, While Investors Focus on EVs While Tesla (TSLA) is best known for revolutionizing the electric vehicle (EV) industry, its lesser-known energy segment is quietly gaining momentum. As investors fixate on vehicle deliveries and margins, Tesla’s energy division, including battery storage, solar solutions, and grid-scale power systems, could be the company’s next major growth engine. Tesla’s energy storage segment includes products like the Megapack and Powerwall to store electricity for use in homes, businesses, and utility-sca"
413,Dow Jones Dives 500 Points On UnitedHealth Crash; Trump Calls For Powells Exit Dow Jones Dives 500 Points On UnitedHealth Crash; Trump Calls For Powells Exit
414,Earnings Preview: Harley-Davidson (HOG) Q1 Earnings Expected to Decline Harley-Davidson (HOG) doesnt possess the right combination of the two key ingredients for a likely earnings beat in its upcoming report. Get prepared with the key expectations.
415,Lawsuit claims Tesla deliberately inflated odometer readings in its cars California suit alleges company attempted to shorten warranty periods.
416,"How to play the VIX, Tesla earnings using options Volatility and uncertainty are the two big themes in the markets right now. That can be seen by the 40% rise in the CBOE Volatility Index (^VIX) over the last month. In the video above, BayCrest Managing Director David Boole explains how to play the VIX and Teslas (TSLA) upcoming earnings. To watch more expert insights and analysis on the latest market action, check out more Market Domination Overtime here."
417,How Elon Musk reportedly staked Tesla’s future on robotaxis against the advice of his own senior management team The Information revealed Musk didn’t feel a compact EV was worthy of Tesla and opted for the Cybercab despite warnings it might not ever make money.
418,"Mag 7 earnings, Fedspeak, housing data: What to watch Next week, earnings from Tesla (TSLA) and Google (GOOGL, GOOG) parent Alphabet will take center stage. The Federal Reserve will be in focus with officials providing commentary following Fed Chairman Jerome Powells remarks on tariffs and inflation. Meanwhile, there will be fresh housing data, with new home sales expected to rise for the third straight month. To watch more expert insights and analysis on the latest market action, check out more Market Domination Overtime here."
419,"What Else We Learned on the Call Musk’s DOGE news stole the show, but there were other tidbits investors should pay attention to on the earnings call.  CFO Vaibhav Taneja quantified some of Tesla’s tariff headwinds.  “It’s expensive to bring it in from China right now,” said Musk."
420,Why the stock markets problem isnt only about tariffs Why the stock markets problem isnt only about tariffs
421,"Q1 earnings trends: Companies pulling outlooks due to tariff risks Pulling guidance has become a common theme of the first quarter earnings season, with Tesla (TSLA), Walmart (WMT), Delta (DAL), and others among the companies withdrawing their previous outlook. Other companies, like GE Vernova (GEV) and Norfolk Southern (NSC), reaffirmed guidance but acknowledged the cost of tariffs. Watch the video above to hear more from Julie Hyman and Roundhill Investments CEO Dave Mazza on Market Domination. To watch more expert insights and analysis on the latest market action, check out more Market Domination here."
422,Tesla Supplier STMicroelectronics Expects Lower Sales as Chip Industry Woes Persist Tesla Supplier STMicroelectronics Expects Lower Sales as Chip Industry Woes Persist
423,Analysts Expected Profit Growth This Year. Then Tesla Released Q1 Earnings And Things Changed. Analysts Expected Profit Growth This Year. Then Tesla Released Q1 Earnings And Things Changed.
424,Are Magnificent 7 stocks still worth the hype? Heres how readers voted Mag 7 earnings kick off and investors will be keen to see if they are still magnificent.
425,"1 Wall Street Analyst Thinks Tesla Stock Is Going to $325. Is It a Buy Around $250? A drop in revenue and earnings per share were therefore expected as well.  Automotive revenue declined by 20% and an operating margin that was once the envy of the automotive industry tumbled.  Vijay Rakesh with Mizuho Securities shaved $50 off that price target and now feels the stock is worth $325 per share, according to reports."
426,"Tesla Stocks 50% Crash: 1 Metric Suggests More Pain Is Ahead for the Electric Vehicle Giant Meanwhile, the companys margins continue to erode, and its losing market share in countries around the world.  As ever, CEO Elon Musk has grand ambitions for the future of Tesla.  Cybercabs, a new roadster, artificial intelligence (AI) projects, and even a Tesla Diner are in the works."
427,"BYD First-Quarter Profit Doubled on Strong EV Sales Chinese auto giant BYD continued to outpace Tesla in the first quarter, reporting a doubling in net profit on robust growth in its electric-vehicle business."
428,"Tesla in India, Saia Q1 miss, SoFi initiated by Citizens JMP Julie Hyman goes over some of the trading days top stories on this segment of Market Minute. Tesla (TSLA) stock jumps as the company refunded early Model 3 bookings in India, according to Bloomberg. The move raises speculation that Tesla is nearing an entry point into India. Saia (SAIA) stock slides after missing first quarter earnings and revenue targets, citing tough weather and macro headwinds. SoFi Technologies (SOFI) stock is rising after Citizens JMP initiated coverage on the stock with an Outperform rating and $17 price target. Stay up to date on the latest market action, minute-by-minute, with Yahoo Finances Market Minute."
429,"These Stocks Are Moving the Most Today: Tesla, Nvidia, Domino’s, Spirit AeroSystems, IBM, Novavax, and More Domino’s Pizza reports earnings, Nvidia faces stiff competition in China, and Spirit AeroSystems finalizes a deal to transfer some assets to Airbus."
430,"Tesla stock, Dominos Q1 earnings, WW International activist stake Yahoo Finance host Madison Mills tracks todays top moving stocks and biggest market stories in this Market Minute, including electric vehicle maker Tesla (TSLA), Dominos Pizza (DPZ), and WW International (WW). Stay up to date on the latest market action, minute-by-minute, with Yahoo Finances Market Minute."
431,"Elon Musk Taps Friends, Associates For Private Sales Of Business Empire Elon Musk Taps Friends, Associates For Private Sales Of Business Empire"
432,"S&P 493 earnings growth appears to be gaining as Mag 7 slows As earnings growth has slowed for the Magnificent Seven — the group of stocks comprised of Meta Platforms (META), Microsoft (MSFT), Alphabet (GOOGL, GOOG), Amazon (AMZN), Apple (AAPL), Nvidia (NVDA), Tesla (TSLA) — the rest of the S&P 493 has gained momentum and closed the gap with the leading tech giants. Yahoo Finance host Julie Hyman assesses forecasts anticipating the pick-up in S&P 493 performances. To watch more expert insights and analysis on the latest market action, check out more Asking for a Trend here."
433,"Tarnished Magnificent 7 stocks rebound faces test with earnings NEW YORK (Reuters) -The U.S. technology and growth stocks known as the Magnificent Seven have regained their footing somewhat after a steep slide, but a few weeks of growing valuations and a dimming earnings edge could make it harder for them to push Wall Street higher.  The stocks -- Apple, Microsoft, Nvidia, Alphabet, Amazon, Meta Platforms and Tesla -- have stumbled in 2025, dragging down the benchmark indexes they had lifted to record peaks the prior two years.  The highly valued shares had swooned as investor fears spiked about the economic fallout from President Donald Trumps tariffs."
434,"Waymo, Toyota Announce Partnership Exploring Personally Owned Vehicles Waymo, Toyota Announce Partnership Exploring Personally Owned Vehicles"
435,"Grand jury charges man with setting fire to Cybertruck at Arizona Tesla dealership A federal grand jury in Phoenix has returned a five-count indictment accusing a 35-year-old man of setting fire and destroying a Cybertruck at a Tesla dealership in Mesa, Ariz., the latest case..."
436,"Stocks shrug off recession alarms as Big Tech earnings blow off the roof U.S. markets rose Thursday morning, lifted by blockbuster earnings from Microsoft (MSFT) and Meta (META) that seemed strong enough to overshadow Wednesday’s unexpected GDP contraction. With Big Tech’s collective market cap nearing $10 trillion, investor sentiment looked ready to ride the rally — if Amazon (AMZN) and Apple (AAPL) can stick the landing after Thursday’s close."
437,ClearBridge Large Cap Growth ESG Portfolios Q1 2025 Commentary The mega cap growth trade stalled as the chaotic introduction of tariffs accompanied by fears of a slowing U.S. economy and higher inflation. Read more here.
438,U.S. stocks extend gains heading into midday U.S. stocks extend gains heading into midday
439,Tesla (TSLA) Sales Collapse in Europe as Backlash Against Musk Intensifies Political heat and stale lineup sour European momentum
440,"Teslas new car sales in Italy rise in April but still down 4% year to date Teslas new carregistrations in Italy were up in April for a second month in arow but were still down an overall 4% in the first four monthsof the year, data from the Transport Ministry showed on..."
441,"Inside Ford’s Kentucky Truck Plant, It’s About as American as Can Be Inside Ford’s Kentucky Truck Plant, It’s About as American as Can Be"
442,"Warren Buffet Is Stepping Down From Berkshire Hathaway After 60 Years. Plus, 4 Other Takeaways You May Have Missed. Warren Buffet Is Stepping Down From Berkshire Hathaway After 60 Years. Plus, 4 Other Takeaways You May Have Missed."
443,"Teslas Optimus Vs. XPengs Iron: The $5 Trillion Iron Man Showdown In the high-stakes world of humanoid robotics, two EV titans — Tesla Inc (NASDAQ:TSLA) and XPeng Inc (NYSE:XPEV) — are competitors transforming this sector. A CNBC report suggests that Morgan Stanley projects a $5 trillion global market for humanoid robots by 2050. Facts reveal that the race to dominate this new frontier is shaping up to be less “Fast & Furious,” more “Iron Man” vs. “Iron Man.” Optimus: Tesla’s FSD Tech-Powered Humanoid Tesla’s Optimus is the better-known name, touted by Elon Mu"
444,How students at Roaring Kitty’s high school became top stock pickers How students at Roaring Kitty’s high school became top stock pickers
445,"Theres A Partial Tesla-Musk Resolution: For Wall Street, Its Back To The Future Elon Musks actions have sparked controversies, but Wall Street remains bullish on Tesla, Inc. stock. Click here to find out why I rate TSLA stock a Buy."
446,"Tesla Launches Model Y Long Range Rear-Wheel Drive In The US; Prices It At $44,990- Website Tesla Inc: * TESLA LAUNCHES MODEL Y LONG RANGE REAR-WHEEL DRIVE IN THEUS;PRICES IT AT $44,990Source text:Further company coverage: ..."
447,"Lucid sticks to annual production forecast even as tariff woes hit automakers Lucid stuck to its 2025production forecast on Tuesday despite the threat of tariffsforcing many automakers to pull back targets, while the luxuryelectric-vehicle maker reported first-quarter..."
448,"Winners And Losers Of Q1: Winnebago (NYSE:WGO) Vs The Rest Of The Automobile Manufacturing Stocks The end of the earnings season is always a good time to take a step back and see who shined (and who not so much). Let’s take a look at how automobile manufacturing stocks fared in Q1, starting with Winnebago (NYSE:WGO)."
449,"Price tag of used electric cars drops more than 10 percent Copyright © BusinessAMBE 2023According to an analysis by the classified ads site AutoScout24, the average price of used electric cars dropped about 10 percent last quarter compared to a year..."
450,"I Think I Just Built a Slate Electric Truck for Under $20,000 -- and Tesla and Rivian Should Be Nervous Buyers shopping for a basic EV truck might prefer Slate over Tesla or Rivian."
