277,"Tick Tock: One Mans Loss Is Anothers Gain -- Buy On Meta Platforms Meta Platforms, Inc. is the stock to watch as TikTok faces a potential ban, with Instagram Reels poised to benefit from TikToks demise. Click for my META update."
278,Is Tesla Stock A Buy Or A Sell Amid Donald Trumps White House Return And Q4 Earnings? Is Tesla Stock A Buy Or A Sell Amid Donald Trumps White House Return And Q4 Earnings?
279,"Next Century Growth Investors Q4 2024 Commentary In the fourth quarter of 2024, equity markets were positive and large cap stocks generally outperformed small cap stocks. Read more here."
280,Exclusive: Cannabis groups combine to push for federal reforms under Trump Exclusive: Cannabis groups combine to push for federal reforms under Trump
281,"Big Tech ETF trades down as Tesla, Apple post sharp losses Big Tech ETF trades down as Tesla, Apple post sharp losses"
282,"Columbia Select Large Cap Value Fund Q4 2024 Commentary  Institutional Class shares of Columbia Select Large Cap Value Fund returned -2.51%
for the quarter ending December 31, 2024. Click here to read the full commentary. "
283,"Earnings Gains Anticipated In 7 S&P 500 Sectors, Led By Communication Services Seven of the S&P 500s 11 sectors are expected to achieve cumulative year-over-year growth in normalized earnings per share among their constituent companies in fourth quarter 2024 earnings"
284,"Why High-Yielding JEPQ Will Likely Beat The Nasdaq In 2025 Find out why JEPQ is poised to outperform the Nasdaq 100 in 2025, despite underperforming in recent years."
285,"Teslas Robotaxi Could Stumble Badly As Waymo Races Ahead In the last few months, Musk has mentioned that Tesla will finally launch its robotaxis in 2025. Read why I remain bearish on TSLA stock."
286,"Bullish Counterattack - Technical Bounce Or New Trend? Financial writer discusses market progress for bulls, mid cap growth stocks, Bitcoin, and Gold."
287,"Elon Musks gesture at inaugural event stirs controversy STORY: :: Elon Musks gesture to Trump supporters at post-inauguration rally stirs controversy :: January 20, 2025 :: Washington, D.C. The..."
288,"Trump raises prospects for a negotiated reset on US-China ties Donald Trump unexpectedly held off tariffs on China on his first day back at the White House and did not single it out as a threat, raising the prospect of a rapprochement as both sides look to gain..."
289,"Mastercard: Charging Ahead In Tech is our regular feature highlighting what people are talking about in the world of technology - everything from crypto and NFTs to smart cities and cybersecurity.In the U.S., theres a..."
290,"Baron Focused Growth Fund Q4 2024 Shareholder Letter Baron Focused Growth Fund advanced during the fourth quarter of 2024, outperforming its benchmark, the Russell 2500 Growth Index. Read more here."
291,"Assessing Tesla Through The Basics Of Game Theory Discover if Tesla, Inc.s first-mover advantage still holds true in todays market using the Stackelberg model and evaluate its valuation. Click for my TSLA update."
292,Meta: Why Ill Buy Aggressively On Any Pullback Meta Platforms investors celebrate another momentous year of outperforming the market. Click here to read an analysis of META stock now.
293,"Harding Loevner Global Equity Q4 2024 Report The Global Equity composite fell 0.86% gross of fees in the fourth quarter, in line with the 0.89% decline of the MSCI ACWI Index."
294,"Tesla to raise prices of all cars in Canada from Feb. 1, website shows Tesla will raise prices of all its cars in Canada from Feb. 1, according to notices on its Canadian website, with Model 3 prices going up by as much as C$9,000 . Model Y prices will..."
295,Riding Tesla Stocks Expected Trump Bump? Consider These Factors First. Riding Tesla Stocks Expected Trump Bump? Consider These Factors First.
296,"Dow Jones Futures: S&P 500 Hits High; New Tesla Model Y Launches In U.S., Europe Dow Jones Futures: S&P 500 Hits High; New Tesla Model Y Launches In U.S., Europe"
297,Tesla Just Raised Prices in a Key Market. What It Means for the Stock. Tesla Just Raised Prices in a Key Market. What It Means for the Stock.
298,TSLY: Better To Stay Away YieldMax TSLA Option Income Strategy ETF offers high yields but limits Teslaâs upside. Find out why TSLYâs risks outweigh its rewards for long-term investors.
299,"Tech Takes Spotlight In Busy Earnings Week As Apple, Microsoft, Meta Report Results Big tech names report earnings this week. Feds interest rate decision is to be announced on Wednesday. Stay updated on upcoming events with this newsletter."
300,"Tesla joins court challenges to EU tariffs on Chinese EVs Tesla has joined BMW and Chinese producers in filing a challenge at the Court of Justice of the European Union against EU tariffs on China-made electric vehicles, according to a filing on the courts..."
