201,"Tesla set to ride Trump tailwinds over next four years: Mizuho Investing.com -- Teslas swashbuckling rally isnt likely to cool anytime soon as loosing regulations will boost the EV makers autonomous businesses just as chief executive Elon Musks close relationship with President-elect Donald Trump paves the way for further growth over the next four years, Mizuho (NYSE:MFG) said in a recent note."
202,"Jim Cramer Says ‘After The Close Wednesday, It’s Mega MAGA Man, Musk and the Tesla, Inc. (TSLA) Show’ We recently compiled a list of the Jim Cramer’s Bold Predictions About These 15 Tech Stocks. In this article, we are going to take a look at where Tesla, Inc. (NASDAQ:TSLA) stands against the other tech stocks Jim Cramer recently talked about. Like all of us, Jim Cramer is always wondering what’s next for the stock market. […]"
203,"These Stocks Moved the Most Today: Nvidia, Tesla, Broadcom, Pfizer, EVgo, Teva, SolarEdge, Amentum, and More These Stocks Moved the Most Today: Nvidia, Tesla, Broadcom, Pfizer, EVgo, Teva, SolarEdge, Amentum, and More"
204,"Intellectual Property Challenges And Opportunities For Advanced Manufacturing In The Automotive Industry This article is based on an extended abstract published in the proceedings of the 63rd Annual Conference of Metallurgists by Marks & Clerk Managing Associate, Evangellos Vekris. In many industry..."
205,"Musk and Trump are viewed roughly the same by Americans, an AP-NORC poll finds Elon Musk, clad in tuxedo and black tie, took the stage at President-elect Donald Trumps Mar-a-Lago resort shortly after the election with all the swagger of the winning candidate himself.  Musks attachment to Trump has created an alliance between Americas most powerful politician and its richest businessman — and roughly the same percentages of Americans have favorable views of each, according to a new poll from the AP-NORC Center for Public Affairs Research.  Musk, whose net worth tops $400 billion, oversees six businesses while continuing to work closely with Trump: electric car manufacturer Tesla, the X social media platform, space technology company SpaceX, brain link company Neuralink, the startup xAI and tunneling operator The Boring Co."
206,"Trump win ‘not as positive as you’d think’ for Tesla, says Barclays Barclays says the post-election rally in shares of Tesla (TSLA) reflects a “sharp disconnect” between the stock and the company’s fundamentals. Technicals and options are playing an outsized role in the rally, the analyst tells investors in a research note. The firm believes Tesla shares are now best comped to crypto. There are little incremental positives to Tesla’s fundamentals from the election, but Elon Musk’s premium is now elevated, contends Barclays. The last six weeks “serve as a reminde"
207,"Tesla Stock Hits $1.5 Trillion Valuation as Elon Musk Becomes Worlds Richest Person Teslas market capitalization surged to a record $1.5 trillion, driving its stock to new all-time highs."
208,"Fairlead Strategies’ Katie Stockton: 3 Momentum Stocks You Shouldn’t Be Shorting Fairlead Strategies’ managing partner Katie Stockton was on Schwab Network commenting on three momentum stocks earlier today. The shares of Tesla (TSLA), Palantir (PLTR), and MicroStrategy (MSTR) have recently accelerated after already rising a great deal, Fairlead Strategies’ Katie Stockton said. As a result, their rallies should be respected, she explained. These names could rally […]"
209,I Much Prefer Owning The A+ Stellantis Valuation Over Teslas Failing Grade Stellantis offers value over Teslaâs inflated stock price. Learn why STLA is a buy and TSLA is headed for a price correction in 2025.
210,Stock Market Today: Dow Jones Looks To End Losing Streak; AI Name Ends Long Win Streak (Live Coverage) Stock Market Today: Dow Jones Looks To End Losing Streak; AI Name Ends Long Win Streak (Live Coverage)
211,"Tesla recall, Netflix-FIFA deal, Apple: Market Minute Yahoo Finance host Rachelle Akuffo tackles three of the top trending stories and stock tickers as part of todays Market Minute. Tesla (TSLA) has recalled nearly 700,000 of its EV, deploying a software update for its Cybertruck, Model 3, and Model Y vehicles. Netflix (NFLX) signs an exclusive streaming deal with FIFA to broadcast the 2027 and 2031 Womens World Cups. Apple (AAPL) is reportedly in talks with Chinese-owned Tencent (0700.HK, TCEHY) and TikTok parent ByteDance to integrate their AI models into iPhones in China. To watch more expert insights and analysis on the latest market action, check out more Wealth here. This post was written by Luke Carberry Mogan."
212,"Tracking Ron Barons BAMCO Portfolio - Q3 2024 Update Read more on BAMCOs Q3 2024 portfolio growth and focus on key securities like Tesla, Gartner, and more for long-term investment opportunities."
213,House Passes Funding Bill With Just Hours Left to Avert a Government Shutdown House Passes Funding Bill With Just Hours Left to Avert a Government Shutdown
214,"Meet the Supercharged Growth Stock Thats One of This Years Biggest Winners. The Company Could Hit $50 Trillion by 2034, According to 1 World-Renowned Analyst Nvidias long track record of innovation, strong secular tailwinds, and market leadership could drive its market cap to wild levels."
215,"The Investing Cult Fueling MicroStrategy’s Ascent: ‘Have Fun Staying Poor’ The rally has been propelled by a group of rabid followers who are mixing songs, pouring whisky and spending hundreds of hours researching the stock."
216,"Tesla (TSLA) and LiveOne Achieve 350,000 Subscribers, Enhancing In-Car Entertainment with AI We recently published a list of 10 Buzzing AI Stocks on Latest News and Ratings. In this article, we are going to take a look at where Tesla, Inc. (NASDAQ:TSLA) stands against other buzzing AI stocks on latest news and ratings. Predictions of artificial intelligence reaching human-level intelligence have been made for over 50 years. […]"
217,"Rockefeller Rich – Elon Musks Wealth Hits Rockefeller Rich Levels, Equivalent To A 1.6% Share Of The U.S. GDP Elon Musk, the richest person in the world, has reached a level of wealth that only one other individual in history has come close to – oil magnate John D. Rockefeller. Musk’s staggering net worth of $474 billion at the time of writing, or 1.61% of the U.S. GDP based on third-quarter data, is reminiscent of Rockefeller’s dominance when his fortune peaked at 1.5% of GDP. In other words, Musks wealth has surged into a realm not seen in contemporary times, much like Rockefeller’s unparalleled econ"
218,"Nvidias stock surges, but not by enough to get above its 50-day moving average Nvidias stock surges, but not by enough to get above its 50-day moving average"
219,Solana leads rises as large cryptocurrencies start mixed Solana leads rises as large cryptocurrencies start mixed
220,"Social Buzz: Wallstreetbets Stocks Mostly Higher Pre-Bell Monday; Advanced Micro Devices, Tesla to Advance The most-talked-about stocks in the Reddit subforum Wallstreetbets were mostly higher in the early h"
221,"Retail investors are optimistic, but realistic going into 2025 Retail investors are feeling bullish about the market (^DJI, ^IXIC, ^GSPC) in 2025, eToros fourth quarter Retail Investor Beat shows. eToro investment analyst Bret Kenwell joins Josh Lipton and Seana Smith on Market Domination to discuss how retail investors are thinking about the market headed into the new year. Kenwell says retail investors are optimistic but realistic for the new year. Theyre looking to gain more exposure to crypto in 2025. Theyre looking to gain more exposure to equities in 2025. But theyre also looking to raise some cash here, he says, later adding: I think theyre being prudent, but also, you know, keeping one foot in at least is so they keep getting taking advantage of, you know, more gains to come in 2025 if that is the case. The analyst reports that the survey found retail investors to prefer the financials sector and big-cap tech, including Magnificent Seven names and other artificial intelligence (AI) plays. To watch more expert insights and analysis on the latest market action, check out more Market Domination here. This post was written by Naomi Buchanan."
222,"Tesla, Meta and Broadcom Weights Shrink in Nasdaq 100 Rebalance (Bloomberg) -- Three of the world’s biggest companies have had their influence reduced in the Nasdaq 100 Index after the giant technology rally of 2024 swelled them to unprecedented size.Most Read from BloombergHo Chi Minh City Opens First Metro Line After Years of DelayThe Architects Who Built MiamiReviving a Little-Known Modernist Landmark in BuffaloNew York’s Congestion Pricing Plan Still Faces Legal HurdlesNew York City’s Historic Preservation Movement Is Having a Midlife CrisisTesla Inc., M"
223,"Tesla, Meta, and Broadcom Weights Reduced in Nasdaq 100 Rebalance The weights were reduced in the Nasdaq 100 Index to ensure balanced representation."
224,"Tesla or Rivian: Baird Picks the Superior EV Stock to Buy Events have been gathering speed since last month’s election, reminding us of Ferris Bueller’s classic line, “Life moves pretty fast. If you don’t stop and look around once in a while, you could miss it.” So let’s look around at the electric vehicle industry. EVs are likely to lose a substantial portion of their governmental support when the new Trump administration takes office, and that has both analysts and investors working to figure out how the sector landscape will take shape in the next f"
225,"Santa Rally Kicks Off On Wall Street: Stocks Gain, Tesla Soars, Bitcoin Hits $98,000 Wall Street kicked off the Santa Rally season on a positive note, with all major indices and sectors closing higher in a shortened session ahead of the Christmas holiday. The S&P 500 climbed 1%, extending its gains for a third consecutive session following last week’s volatile Federal Reserve meeting. The Dow Jones Industrial Average rose 0.9%, while the tech-heavy Nasdaq 100 gained 1.3%, nearly erasing last week’s losses. Consumer discretionary stocks, the top-performing sector of the year, led"
226,"Toyota: Stock Rises On ROE Target, Cant Wait For The New Hybrid 4Runner Toyota Motor (TM) shares surged due to its ambitious 2030 goals. Check out my thoughts on Toyotos ROE target and see why I believe TM stock is a Buy."
227,"Tesla: Nobody Ever Lost Money Taking A Profit (Rating Downgrade) Teslas stock is overbought despite bullish technical momentum, posing significant near-term downside risk. Click here to find out why I rate TSLA stock a Sell."
228,"Teslas Musk Uses Weight-Loss Drugs as Eli Lilly and Novo Nordisk Dominate the Market Musk revealed using Novo Nordisks Ozempic and Eli Lillys Mounjaro, highlighting their popularity for weight management."
229,"The Dow sinks 500 points as Nvidia and Tesla lead tech decline The Dow fell sharply on Friday, dropping more than 500 points as tech giants within the so-called “Magnificent Seven” saw significant declines."
230,The Top ETF of December & its Best-Performing Stocks WISE is the best-performing ETF of December. Lets find out which stocks made it a top performer.
231,"Is Tesla, Inc. (TSLA) A Good Car Stock To Invest In Now? We recently compiled a list of the 10 Best Car Stocks To Invest In Now. In this article, we are going to take a look at where Tesla, Inc. (NASDAQ:TSLA) stands against the other car stocks. The automotive industry has witnessed a constant churn of innovation over the last several decades, with car makers continuously providing […]"
232,"BYD Chalks Up New Record as It Narrows EV Sales Gap With Tesla (Bloomberg) -- China’s BYD Co. enjoyed a year-end surge to push total sales to 4.25 million passenger cars last year, narrowing its gap with Tesla Inc. as the two vie for the crown of top-selling electric-vehicle maker of 2024.Most Read from BloombergDetroit’s Michigan Central Is the Building Revival Story of 2024Burned Out Parents Need Better Public SpacesA Commuting Resolution for 2025: Ride Your Local Subway or BusThe Shenzhen-based carmaker, which stopped making vehicles entirely powered by"
233,1 person dies when Tesla Cybertruck catches fire and explodes outside Trumps Las Vegas hotel LAS VEGAS — One person died and seven others were injured Wednesday when a Tesla Cybertruck that appeared to be carrying fireworks caught fire and exploded outside President-elect Donald Trumps...
234,"One Dead After Cybertruck Explodes Outside Trump Hotel in Las Vegas Police said that a Tesla Cybertruck explosion outside of the Trump International Hotel in Las Vegas killed one person and injured seven others.  A Tesla Cybertruck loaded with canisters of gas and firework mortars exploded in front of Trump International Hotel in Las Vegas Wednesday, killing one person and injuring seven others, authorities said.  The Cybertruck pulled up to the hotel front doors around 8:40 a.m. local time, according to Sheriff Kevin McMahill of the Las Vegas Metropolitan Police Department."
235,"These Stocks Are Moving the Most Today: Tesla, Palantir, Nvidia, SoFi, NIO, and More Tesla stock rises ahead of fourth-quarter delivery numbers from the electric-vehicle maker, while Palantir and Nvidia shares rise to kick off the new trading year after spectacular gains in 2024."
236,"Tesla 4Q Deliveries Miss Estimates, Annual EV Sales Decline -- Tesla delivered 495,570 vehicles for the quarter ended Dec. 31, missing the roughly 512,277 analysts had projected, while annual vehicle sales dropped for the first time in more than a decade...."
237,"VONG: Time To Take Some Gains Vanguard Russell 1000 Growth Index Fund ETF holds 394 large- and mid-cap stocks, heavily concentrated in technology and top holdings. Explore more details here."
238,"The 1 Tech Stock That’s Actually a Bargain A new entrant in the Big Tech club of stocks means it’s time for a new name to describe tech’s largest companies.  What was once FANG, and then FAANG, FAMANG, and most recently Magnificent Seven, is now best labeled as BATMMAAN.  The new group consists of  Broadcom Apple Tesla Microsoft Meta Platforms Alphabet Amazon  and  Nvidia  All of them carry market values above $1 trillion."
239,"North American Morning Briefing : Tesla, Chip -2- 09:30/UK: Dec Narrow money and reserve balances 13:30/US: U.S. Weekly Export Sales 15:00/US: Dec ISM Report On Business Manufacturing PMI 15:00/US: Nov Metropolitan Area Employment and..."
240,Tech Declines After Tesla Sales Slip - Tech Roundup Shares of technology companies fell after a disappointing sales tally from Tesla. Tesla shares fell by more than 5% after Elon Musks car maker said it sold 1.79 million vehicles worldwide in...
241,"EV Struggles Hit Tesla: Sales Drop in 2024 as Rivals Close In and Margins Suffer Tesla faces EV demand challenges, falling sales prices, and rising competition, with 2024 deliveries below expectations"
242,Solar Stocks Get Boost From Record Tesla Energy Storage Deployments Solar stocks rallied Thursday after Tesla said it deployed a record amount of energy storage products during the fourth quarter.
243,"Rivian (RIVN) Surges on Deliveries Beat, Positive News on Production Outlook Rivian (RIVN) stock is rallying 19% this morning after the electric-vehicle maker reported that its fourth-quarter deliveries had exceeded the Street’s average estimate. Moreover, the automaker noted that a shortage of a part was no longer limiting its production capacity. Rivian’s higher-than-expected Q4 deliveries contrast favorably with those of Tesla (TSLA). Yesterday Elon Musk’s automaker […]"
244,"Consumer Discretionary, Technology Push US Equity Indexes Higher US equity indexes rose midday Friday as consumer discretionary and technology topped sector charts w"
245,Tesla Slips on Q4 Delivery Miss: ETFs in Focus Tesla misses estimates for Q4 deliveries and sees the first year-over-year decline in deliveries for 2024.
246,"2 AI Robotics Stocks to Buy Before They Soar 185% and 315%, According to Wall Street Experts Jensen Huang is the CEO of Nvidia (NASDAQ: NVDA), a company whose chips power the vast majority of artificial intelligence (AI) systems.  Elon Musk, CEO of Tesla (NASDAQ: TSLA), made a related prediction last year: I think by 2040, probably there are more humanoid robots than there are people.  With that in mind, Citigroup analysts estimate humanoid robot sales will hit $14 billion by 2030, $1.1 trillion by 2040, and $7 trillion by 2050."
247,"7 Investments To Avoid In 2024: The Reckoning At the beginning of this year, I wrote an article about which stocks to avoid in 2024. Check out how well I did with my predictions versus S&P 500."
248,"How To Read This Market As Nvidia, Meta Rise, But Tesla Skids How To Read This Market As Nvidia, Meta Rise, But Tesla Skids"
249,"Tesla: My Top Long Idea For 2025 Teslas valuation is justified by its advanced tech and diversified ecosystem, making it a top pick for 2025 with growth potential. Read my update on TSLA."
250,Dow Jones Futures Rise On Trump Tariff Plans; Nvidia Breaks Out With CEO Jensen Huang Due Dow Jones Futures Rise On Trump Tariff Plans; Nvidia Breaks Out With CEO Jensen Huang Due
251,"Elon Musk Nearly Sold Struggling Tesla To Google For $6 Billion – But When He No Longer Needed A Savior, The Deal Was Called Off According to a November Quartz article, Tesla is now worth more than GM, Ford, Toyota and almost every other car company combined. Hard to believe, right? Especially when you consider that back in 2013, Tesla was so broke that Elon Musk came close to selling it to Google. The deal? A tidy $6 billion up-front plus $5 billion for factory expansions. But in true Musk fashion, he pulled the plug at the last second – not out of arrogance but because Teslas fortunes reversed practically overnight. Do"
252,"Can Magnificent Seven ETFs Retain Their Glory in 2025? The Magnificent 7 stocks are likely to see slower earnings growth and price appreciation in 2025, but their dominance will be undeniable."
253,"Tesla upgraded, ServiceTitan initiated: Wall Streets top analyst calls Tesla upgraded, ServiceTitan initiated: Wall Streets top analyst calls"
254,"Tesla: Stock Surges Like Bitcoin Amid Deteriorating Fundamentals Financial writer analyzes Tesla, Inc.s performance, citing issues with declining deliveries, inflated valuation, and lack of growth. Click for this TSLA update."
255,"Salesforce, Workday, Tesla, American Airlines: Top analyst calls Seana Smith and Brad Smith examine the top analyst calls of the day, focusing on Salesforce (CRM), Workday (WDAY), Tesla (TSLA), and American Airlines (AAL). Guggenheim analysts downgrade Salesforce to Sell, citing challenges monetizing artificial intelligence and lack of innovation. They also upgrade Workday to Neutral, saying the company may be done with revenue reductions. JPMorgan reiterates its Underweight rating for Tesla based on the companys fourth quarter delivery miss and the potential removal of subsidies. On the other end of the spectrum, American Air gets three separate upgrades to Buy based partially on above-industry unit revenue growth. To watch more expert insights and analysis on the latest market action, check out more Morning Brief here. This post was written by Naomi Buchanan."
256,Big Tech ETF drops sharply in stock-market selloff as Treasury yields rise Big Tech ETF drops sharply in stock-market selloff as Treasury yields rise
257,Stock Market Today: Dow Jones Slips Ahead Of Fed Minutes; Nvidia Tests Key Level As Tesla Rises (Live Coverage) Stock Market Today: Dow Jones Slips Ahead Of Fed Minutes; Nvidia Tests Key Level As Tesla Rises (Live Coverage)
258,"These Stocks Moved the Most Today: Nvidia, Micron, Aurora Innovation, Tesla, Carvana, Moderna, Palantir, and More These Stocks Moved the Most Today: Nvidia, Micron, Aurora Innovation, Tesla, Carvana, Moderna, Palantir, and More"
259,"Las Vegas Cybertruck suspect used ChatGPT to plan blast, police say The suspected driver of the Tesla Cybertruck that exploded outside the Trump International Hotel in Las Vegas on New Years Day used popular chatbot ChatGPT to plan the blast, officials told reporters..."
260,"Why Tesla, Broadcom, and Rivian Fell Today as Treasury Yields Shot Higher Treasury yields continued to surge on sticky inflation data, dragging the market down today.  Tech and artificial intelligence (AI) stocks bore the brunt of the sell-off, as the Nasdaq Composite fell nearly 2%, more than the other major market indexes.  Shares of electric vehicle makers Tesla (NASDAQ: TSLA) and Rivian Automotive (NASDAQ: RIVN) fell roughly 4% and 5%, respectively."
261,"Complacency could be the biggest risk to investors in 2025 Allspring Global Investments senior portfolio manager Bryant VanCronkhite joins Brad Smith on Wealth to discuss his top investment outlooks and share the biggest market risks for 2025. VanCronkhite warns of investor complacency in 2025, particularly regarding the Magnificent Seven tech stocks. While acknowledging their tremendous returns, he cautions, Thats a risk because the market is broadening out right now. He explains, We dont want to pay as much of a multiple for companies that are growing slower, which is the Mag Seven, compared to the broader market, which is the Russell 2000 (^RUT) and the Russell mid-cap stocks. VanCronkhite advises investors to be strategic. That doesnt mean sell it; it doesnt mean leave. Just be careful about staying too long. Rotate down, he tells Yahoo Finance. Regarding sector opportunities, VanCronkhite expresses caution about the banking sector, describing it as nerve-racking despite market optimism. Instead, he points to materials and healthcare as sectors with attractive valuations that could outperform in 2025. To watch more expert insights and analysis on the latest market action, check out more Wealth here. This post was written by Angel Smith"
262,UK Tories Fail in Bid to Force Starmer to Hold Rape Gang Probe (Bloomberg) -- The UK’s opposition Conservative Party tried and failed to force Prime Minister Keir Starmer into holding a national inquiry into a scandal surrounding so-called child grooming gangs.Most Read from BloombergNYC Condo Owners May Bear Costs of Landmark Green Building LawNYC’s Subway Violence Deters Drive to Bring Workers Back to OfficeDutch Central Bank Restores Amsterdam’s ‘Ugliest Building’Can American Drivers Learn to Love Roundabouts?Can States Hit the Brakes on Runaway Roadbuil
263,"A Look Back at the US EV Market in 2024: What to Expect in 2025 U.S. EV sales surge to 1.3 million units in 2024, but with tax credits at risk, will 2025 sustain the momentum?"
264,"NIO Stock May Have Reached a Turning Point, but Risks Remain NIO (NIO) stock has lost almost half of its value over the past 12 months and remains quite volatile. The business remains loss-making, and its path to profitability isn’t clear, given the company’s fairly unstable trajectory and investment in new business units. Personally, I’m bearish on NIO stock. The sector is increasingly competitive and the smart money already appears to have moved to automation. I’m also uncertain about the future of battery-swapping technology. Let’s Start with NIO’s Pos"
265,"Elon Musk says DOGE’s $2 trillion target for federal spending cuts was just a best-case scenario Elon Musk initially pledged to cut some $2 trillion from the federal budget, alongside his DOGE partner, politician Vivek Ramaswamy."
266,Tesla in Turmoil: JPMorgan Cuts EPS Outlook by 36% Amid Mounting Challenges JPMorgan warns of Tesla headwinds as 2024 EPS projections and EBIT estimates sharply decline.
267,"DOGE sends representatives across US government, Washington Post reports U.S. President-elect Donald Trumps aides with the Department of Government Efficiency have spoken with staffers at more than a dozen federal agencies to begin preliminary interviews, The Washington..."
268,"Tesla: Morgan Stanley raises its target Morgan Stanley on Monday raised its price target for Tesla from $400 to $430, while renewing its overweight recommendation on the stock.According to the analyst, Wall Street is increasingly..."
269,Trump Tariffs: Advisers Mull Gradual Hikes To Avoid Inflation Spike Trump Tariffs: Advisers Mull Gradual Hikes To Avoid Inflation Spike
270,"Patient Capital Management Q4 2024 Commentary Patient Capital Managements Opportunity Equity Strategy surpassed the market to end up 26.5%, 150bps ahead of the S&P 500âs 25.0%. Click here to read the full fund letter."
271,7 Investments To Avoid In 2025 Seeking Alpha contributors highlight 2025 investment picks. See why this article challenges you to avoid certain investments that may underperform.
272,Im Selling Stocks Hand Over Fist I am raising cash by selling stocks with more potential for a negative year and selling covered calls on retained stocks. Read more to see my thoughts.
273,Trump USDOT nominee says Tesla safety probe will continue President-elect Donald Trumps nominee to head the Transportation Department said he would allow an ongoing government probe into Teslas advanced driver assistance system to continue. ...
274,SEC lawsuit against Elon Musk is a big political test for Trump administration SEC lawsuit against Elon Musk is a big political test for Trump administration
275,"Trumps US presidency return ushers in new era of volatile markets Donald Trumps inauguration on Monday could herald a more volatile period for markets, with the Republican seen moving quickly on a wide swath of issues including trade and immigration that are..."
276,"ValuEngines Top 10 Stocks For 2025 Since the methodology we used last year produced such a resilient portfolio, we repeated the process using ValuEngineâs data from the December 31, 2024 close. Read more here.."
