date,headline,source,summary
2025-03-11,Enphase Energy Launches Next-Generation IQ EV Charger across Europe,Yahoo,"FREMONT, Calif., March 11, 2025 (GLOBE NEWSWIRE) -- Enphase Energy, Inc. (NASDAQ: ENPH), a global energy technology company and the worlds leading supplier of microinverter-based solar and battery systems, today announced production shipments of its newest electric vehicle (EV) charger, the IQ® EV Charger 2, in 14 European markets. The IQ EV Charger 2 is a smart charger designed to work seamlessly with Enphase solar and battery systems or as a powerful standalone charger. With advanced energy m"
2025-03-12,Invesco Equally-Weighted S&P 500 Fund Q4 2024 Commentary,SeekingAlpha,The fundâs underweights and stock selection in the information technology and consumer discretionary sectors had the largest negative effect on relative return.
2025-03-14,Enphase Energy (ENPH) Stock Moves -0.8%: What You Should Know,Yahoo,"Enphase Energy (ENPH) closed at $58.01 in the latest trading session, marking a -0.8% move from the prior day."
2025-03-18,Enphase Energy Applauds New Rapid Shutdown Standard for Solar Installations in Brazil,Yahoo,"FREMONT, Calif., March 18, 2025 (GLOBE NEWSWIRE) -- Enphase Energy, Inc. (NASDAQ: ENPH), a global energy technology company and the worlds leading supplier of microinverter-based solar and battery systems, today commended the introduction of Brazils new fire safety standard, Brazilian Association of Technical Standards (ABNT) NBR 17193, which outlines stringent recommendations like rapid shutdown functionality requirements for solar installations in all buildings. The new standard emphasizes t"
2025-03-23,Is Enphase Energy (ENPH) The Best Alternative Energy Stock to Buy Now?,Yahoo,"We recently published a list of 11 Best Alternative Energy Stocks to Buy Now. In this article, we are going to take a look at where Enphase Energy, Inc. (NASDAQ:ENPH) stands against other best alternative energy stocks to buy now. The global energy market is going through a massive change as alternative energy sources are […]"
2025-03-25,ICLN: Stuck Between A Rock And A Hard Place,SeekingAlpha,"ICLN ETF faces challenges despite clean energy trends, with 48.5% losses since 2021."
2025-03-27,"Wingstop initiated, CarMax upgraded: Wall Street’s top analyst calls",Yahoo,"The most talked about and market moving research calls around Wall Street are now in one place. Here are today’s research calls that investors need to know, as compiled by The Fly. Top 5 Upgrades: Stephens upgraded CarMax (KMX) to Overweight from Equal Weight with a price target of $90, up from $86, ahead of the company’s Q4 report due on April 10. The firm cites valuation now being in-line with long-term averages, and an analysis of both real-time unit sales and credit metrics that give it comf"
2025-04-03,Is Enphase Energy (ENPH) One of the Best Climate Change Stocks to Buy Now?,Yahoo,"We recently published a list of 10 Best Climate Change Stocks to Buy Now. In this article, we will look at where Enphase Energy, Inc. (NASDAQ:ENPH) stands against other best climate change stocks to buy now. Investors are focusing on companies driving the transition to a low-carbon economy. Climate change stocks, as defined by the Climate […]"
2025-04-04,How to Find Strong Oils-Energy Stocks Slated for Positive Earnings Surprises,Yahoo,The Zacks Earnings ESP is a great way to find potential earnings surprises. Why investors should take advantage now.
2025-04-08,Teslas Energy & Storage Unit is Thriving: Is it the Only Bright Spot?,Yahoo,"TSLAs Energy & Storage unit, with 26% gross margin in 2024, stands as its most profitable segment and is its key strength amid broader company challenges."
2025-04-11,"Enphase, ASGN, Workiva, Zscaler, and Toast Shares Plummet, What You Need To Know",Yahoo,"A number of stocks fell in the afternoon session after stocks gave back some of the gains from the previous day as the White House clarified the tariffs on imports from China would add up to 145%, while the baseline 10% tariffs remained in place for some countries. This reminded markets that the global trade environment remained volatile, limiting the potential for sustained gains."
2025-04-15,Enphase Energy (ENPH) Earnings Expected to Grow: What to Know Ahead of Next Weeks Release,Yahoo,Enphase Energy (ENPH) possesses the right combination of the two key ingredients for a likely earnings beat in its upcoming report. Get prepared with the key expectations.
2025-04-18,Why Enphase Energy (ENPH) Outpaced the Stock Market Today,Yahoo,"In the latest trading session, Enphase Energy (ENPH) closed at $52.54, marking a +1.53% move from the previous day."
2025-04-21,Enphase (ENPH) Reports Earnings Tomorrow: What To Expect,Yahoo,Home energy technology company Enphase (NASDAQ:ENPH) will be reporting earnings tomorrow after market close. Here’s what investors should know.
2025-04-23,Enphase to absorb bulk of China tariff hit this year: CEO,Yahoo,"The U.S.-based battery and electrical equipment provider is working to reduce its China exposure amid tariff and domestic policy uncertainty, executives said Tuesday."
2025-04-23,"Enphase Energy, Inc. (ENPH) Q1 2025 Earnings Call Transcript",SeekingAlpha,"Enphase Energy, Inc. (NASDAQ:ENPH) Q1 2025 Earnings Conference Call April 22, 2025 4:30 PM ETCompany ParticipantsZach Freedman - Investor RelationsBadri..."
2025-04-23,"Enphase Energy, Inc. (ENPH): One of the Best Solar Energy Stocks to Buy According to Hedge Funds",Yahoo,"We recently published a list of the 11 Best Solar Energy Stocks to Buy According to Hedge Funds. In this article, we are going to take a look at where Enphase Energy, Inc. (NASDAQ:ENPH) stands against other best solar stocks. The overall energy industry has fallen by almost 8% since the beginning of the year, weighed […]"
2025-04-23,Enphase Energy: Q1 Earnings Snapshot,Yahoo,"The Fremont, California-based company said it had net income of 22 cents per share. Earnings, adjusted for one-time gains and costs, came to 68 cents per share. The results missed Wall Street expectations."
2025-04-24,"Top Stock Movers Now: Tesla, Boeing, Enphase, and More",Yahoo,U.S. stock indexes rallied at midday Wednesday as President Donald Trump said he has no intention of firing Federal Reserve Chair Jerome Powell and made further comments suggesting a de-escalation of the trade war with China.
2025-04-28,The Bottom Fishing Club - Shoals Technologies: American Made Solar Play,SeekingAlpha,"Shoals is a leader in wiring solar panels together, setting up energy-efficient battery storage designs. Read why Im bullish on SHLS stock."
2025-04-28,Enphase Energy Enters the Solar Market in Japan with IQ8 Microinverters,Yahoo,"FREMONT, Calif., April 28, 2025 (GLOBE NEWSWIRE) -- Enphase Energy, Inc. (NASDAQ: ENPH), a global energy technology company and the worlds leading supplier of microinverter-based solar and battery systems, today announced production shipments of IQ8™ Microinverters in Japan through a distribution agreement with ITOCHU Corporation (ITOCHU), one of the largest trading companies in the country. Starting April 1, 2025, Tokyo became the first Japanese city to mandate rooftop solar on all new homes b"
2025-04-28,"Enphase Energy, Inc. (ENPH): Among the Oversold Growth Stocks to Buy Now",Yahoo,"We recently published a list of 11 Oversold Growth Stocks to Buy Now. In this article, we are going to take a look at where Enphase Energy, Inc. (NASDAQ:ENPH) stands against other oversold growth stocks to buy now. The growth stocks, primarily proxied by high and consistent revenue growth, have shown sluggish performance in 2025 […]"
2025-05-05,"Insider Activity Picks Up at Tesla, Enphase, Morgan Stanley and Other Major Firms",Yahoo,Tesla Director Buys $1.03M in Stock as Insider Trades Heat Up
2025-05-05,"Enphase Energy to Hold 2025 Annual Meeting of Stockholders on May 14, 2025",Yahoo,"CEO Presentation to follow after Annual Meeting of Stockholders concludesFREMONT, Calif., May 05, 2025 (GLOBE NEWSWIRE) -- Enphase Energy, Inc. (NASDAQ: ENPH), a global energy technology company and the worlds leading supplier of microinverter-based solar and battery systems, today announced that it will be holding its 2025 Annual Meeting of Stockholders on May 14, 2025 at 9:00 a.m. Pacific Time. The meeting will be held at Enphase’s headquarters at 47281 Bayside Parkway, Fremont, CA 94538. Fur"
2025-05-07,Enphase Energy Launches IQ Balcony Solar System in Germany,Yahoo,"FREMONT, Calif., May 07, 2025 (GLOBE NEWSWIRE) -- Enphase Energy, Inc. (NASDAQ: ENPH), a global energy technology company and the worlds leading supplier of microinverter-based solar and battery systems, today announced the launch of the Enphase® IQ® Balcony Solar System in Germany. Designed for plug-and-play installation, the new system empowers apartment dwellers and homeowners with limited roof space to generate their own clean energy from balconies, patios, and small outdoor areas. Its als"
2025-05-10,Verra Mobility And 2 Other Stocks That May Be Priced Below Their Estimated Value,Yahoo,"Amid ongoing U.S.-China tariff talks and fluctuating market indices, investors are seeking opportunities in undervalued stocks that may offer potential value. In this environment, identifying stocks priced below their estimated worth can be a strategic move, especially as the market reacts to economic policies and global trade developments."
2025-05-13,1 of Wall Street’s Favorite Stock with Exciting Potential and 2 to Think Twice About,Yahoo,"Wall Street has set ambitious price targets for the stocks in this article. While this suggests attractive upside potential, it’s important to remain skeptical because analysts face institutional pressures that can sometimes lead to overly optimistic forecasts."
2025-05-18,Buy/Sell: Wall Street’s top 10 stock calls this week,Yahoo,"What has Wall Street been buzzing about this week? Here are the top 5 Buy calls and the top 5 Sell calls made by Wall Street’s best analysts during the week of May 12-16. Find all top-rated stocks by the best-rated analysts on TipRanks. Top 5 Buy Calls: 1. Wolfe upgrades Pinterest to Outperform on “reasonable” valuation Wolfe Research upgraded Pinterest (PINS) to Outperform from Peer Perform with a $40 price target. The firm says Q1 earnings and Q2 guidance gave Wolfe, which in mid-March had not"
2025-05-21,"Solar industry facing tax, tariff headwinds: This analyst weighs in",Yahoo,"The analyst team at Bank of America Securities currently has a Buy rating on First Solar (FSLR) and an Underperform rating on Enphase Energy (ENPH) as President Trumps tariffs and the contents of his tax bill add a few layers of uncertainty over the solar energy industry. BofA Securities Clean Energy Analyst Dimple Gosai comes on Market Domination to talk more about what the Trump administrations policies could mean for the industry, while discussing what First Solar and Enphase currently bring to the table. To watch more expert insights and analysis on the latest market action, check out more Market Domination here."
2025-05-21,ITC makes affirmative decision in Crystalline Silicon PV Cell investigations,Yahoo,"The U.S. International Trade Commission announced that it has made an affirmative determination in its final phase antidumping and countervailing duty investigations concerning Crystalline Silicon Photovoltaic Cells, Whether or Not Assembled Into Modules from Cambodia, Malaysia, Thailand, and Vietnam. Publicly traded companies in the space include Array Technologies (ARRY), Canadian Solar (CSIQ), Emeren (SOL), Enphase Energy (ENPH), FTC Solar (FTCI), First Solar (FSLR), JinkoSolar (JKS), Maxeon"
2025-05-22,Solar Companies Shares Slide After House Passes Trump Tax Bill,MarketWatch,Solar Companies Shares Slide After House Passes Trump Tax Bill
2025-05-22,Green Solar Energy: An IPO That Doesnt Promise Much,SeekingAlpha,"The IPO values Green Solar at very high multiples compared to industry peers, despite slow growth. Click here to read why GLSAs IPO a Sell."
2025-05-22,"Medicare audits, Advance Auto Parts, solar: Trending Tickers",Yahoo,"The US Centers for Medicare & Medicaid Services have announced Medicare Advantage audits on health insurers, with this news sending shares of Humana (HUM), UnitedHealth Group (UNH), and CVS Health (CVS) lower. Advance Auto Parts (AAP) stock skyrockets by over 40% on Thursday after the car parts retailer reaffirmed its full-year earnings guidance alongside its first quarter beat on estimates. Solar companies Sunrun (RUN), Enphase Energy (ENPH), and SolarEdge Technologies (SEDG) are taking a stock hit after the House advanced President Trumps tax bill to the Senate, the spending package outlining plans to eliminate clean energy tax credits. To watch more expert insights and analysis on the latest market action, check out more Catalysts here."
2025-05-23,Rooftop Solar Takes Gut Punch in House Tax Bill,Yahoo,"The bill sunsets renewable energy credits, as expected, but includes more stringent provisions and rollback dates that were seen as especially bleak for rooftop solar."
2025-05-24,Fate of $20 Billion US Home Solar Market Lies in GOP Senate Hands,Yahoo,"(Bloomberg) -- The troubled, $20 billion US residential solar market’s future rests on whether Senate Republicans will challenge their brethren in the House of Representatives and change provisions of the massive tax and spending bill that executives and analysts alike say would devastate the industry.Most Read from BloombergNY Private School Pleads for Donors to Stay Open After Declaring BankruptcyUAE’s AI University Aims to Become Stanford of the GulfNYC’s War on Trash Gets a Glam SquadCan Fra"
2025-05-24,Renewable Energy Stocks Crash as U.S. Advances Bill That Could Decimate the Industry,Yahoo,"Congress is pushing forward a bill that could upend the renewable energy industry.  Just as companies have ramped up production and renewable electricity generation in the U.S., those projects may become uneconomical.  The news was about as bad as it could get for renewable energy stocks this week as the U.S. House of Representatives early Thursday passed a bill that will repeal some of the most important subsidies for the industry if it becomes law."
2025-05-26,First Solar vs. Enphase: Which Solar Stock Is the Better Player in 2025?,Yahoo,"FSLR edges out ENPH in terms of fundamentals, but both face declining EPS estimates and weak stock performance, making them unfit for immediate investment."
2025-06-02,First Solar Stock Falls. Wall Street Is Split on Fate of Renewables.,MarketWatch,First Solar Stock Falls. Wall Street Is Split on Fate of Renewables.
2025-06-04,Enphase Energy IQ8 Commercial Microinverters Made with Domestic Content Selected for New Projects in the United States,Yahoo,"Projects in Florida, Rhode Island, and California will have a combined capacity of nearly 3 MW upon completionFREMONT, Calif., June 04, 2025 (GLOBE NEWSWIRE) -- Enphase Energy, Inc. (NASDAQ: ENPH), a global energy technology company and the worlds leading supplier of microinverter-based solar and battery systems, today announced that IQ8P-3P™ Commercial Microinverters made with domestic content were selected for significant commercial projects on a Florida school, an affordable housing complex"
2025-06-10,Megacap stocks aren’t all up in 2025. But this chart shows they’ve trounced the S&P 500’s smallest equities.,MarketWatch,Megacap stocks aren’t all up in 2025. But this chart shows they’ve trounced the S&P 500’s smallest equities.
2025-06-11,Three Stocks That May Be Trading Below Estimated Value In June 2025,Yahoo,"As the United States market continues to navigate the complexities of US-China trade talks, major indices like the S&P 500 and Nasdaq Composite have reached their highest levels since February. In this environment, identifying stocks that may be trading below their estimated value can present opportunities for investors looking to capitalize on potential market inefficiencies."
2025-06-16,3 Small-Cap Stocks Walking a Fine Line,Yahoo,"Many small-cap stocks have limited Wall Street coverage, giving savvy investors the chance to act before everyone else catches on. But the flip side is that these businesses have increased downside risk because they lack the scale and staying power of their larger competitors."
2025-06-17,"S&P 500 Futures Fall in Premarket Trading; Enphase Energy, First Solar Lag",MarketWatch,"S&P 500 Futures Fall in Premarket Trading; Enphase Energy, First Solar Lag"
2025-06-17,"Solar Stocks Down After Senate Proposes End to Wind, Solar Tax Credits",MarketWatch,"Solar Stocks Down After Senate Proposes End to Wind, Solar Tax Credits"
2025-06-18,KeyBanc cuts solar names to Underweight on ‘overwhelming’ overhang,Yahoo,"KeyBanc analyst Sophie Karp downgraded Sunrun (RUN), Enphase Energy (ENPH) and SolarEdge (SEDG) to Underweight from Sector Weight after Senate Republicans last night released a bill that would end tax credits for wind and solar earlier than for other sources. The new version of the bill would end incentives for wind and solar in 2028, though tax breaks for other sources of power including nuclear, hydropower and geothermal would be allowed to remain until being phased out in 2036. KeyBanc cites"
2025-06-18,Sector Update: Energy Stocks Climb Late Afternoon,Yahoo,Energy stocks gained late Tuesday afternoon with the NYSE Energy Sector Index adding 1.3% and the En
2025-06-18,Podcast: U.S. Stocks Slip as Israel-Iran Conflict Continues,Yahoo,President Trump called for Iran’s unconditional surrender and said he wouldn’t target the country’s leader “for now.” Plus: Verve Therapeutics shares soar after Eli Lilly agrees to acquire the gene-editing company.
2025-06-22,Policy Shift Cannot Stop First Solar’s (FSLR) Near-Term Momenum,Yahoo,"First Solar (FSLR) is one of the most compelling investment opportunities I see right now—and I’m a shareholder for two key reasons. First, the medium-term demand outlook is already well-defined, providing strong visibility. Second, with recent policy shifts from the “Big Beautiful Bill,” near-term demand could surge as developers rush to secure projects before tax credits begin phasing out in 2028. I view this as a high-alpha, 12-month cyclical play, with recent volatility being mere noise. The"
2025-06-26,Alger Russell Innovation Index Updates for Second Quarter 2025,Yahoo,"Fred Alger Management, LLC (Alger), a privately held growth equity investment manager, today announced the quarterly rebalancing of the Alger Russell Innovation Index (Index). Following the close of trading on Friday, June 27, 2025, the Index will be rebalanced, and the following changes will be effective."
2025-06-28,Enphase Energy (ENPH) Stock Dips While Market Gains: Key Facts,Yahoo,"In the most recent trading session, Enphase Energy (ENPH) closed at $40.88, indicating a -4.93% shift from the previous trading day."
2025-06-30,Renewable energy shares mixed as U.S. Senate preserves some tax credits in Trump bill,Yahoo,(Reuters) -Shares of U.S. renewable energy firms saw a mixed performance in early Monday trading after the U.S. Senate advanced President Donald Trumps sweeping tax-and-spending bill.  The final version preserved tax credits for solar leasing  —  an arrangement where a third-party owns and installs a solar panel system on a customers property for a fee to use the system and the electricity it generates.  Shares of solar panel maker First Solar rose 7.1% at $163.00 while battery firms Sunrun climbed 7.8% to $8.01 and Fluence Energy gained 3.1% to $6.33.
2025-06-30,"These Stocks Are Moving the Most Today: Enphase, Tesla, Juniper Networks, Wells Fargo, Palantir, and More",Yahoo,"Clean energy stocks Enphase Energy and Sunrun decline after the Senate’s latest version of the tax-and-spending megabill would phase out tax credits for large-scale wind and solar projects by the end of 2027, earlier than in previous versions of the legislation."
2025-06-30,"Stocks to Watch: Meta, Tesla, Wells Fargo, Boeing",Yahoo,"↗️ GMS (GMS): The building-products distributor will be bought for about $4.3 billion by Home Depot (HD), which won a bidding war over QXO (QXO). GMS shares jumped 12% early Monday. ↗️ Goldman Sachs (GS), Wells Fargo (WFC): Both stocks rallied in after the Federal Reserve said late Friday that America’s large banks cleared its annual stress test."
2025-07-01,Late tweaks to Trump tax bill create green power winners and losers,Yahoo,Renewable power shares whipsawed on Monday as new revisions to Donald Trump’s spending plan created a division of haves and have-nots in the...
2025-07-02,"Solar stocks jump, casino names surge, Ford Q2 sales increase",Yahoo,"Yahoo Finance anchor Josh Lipton covers the trading days top stories in this segment of Market Minute. Solar stocks Sunrun (RUN), SolarEdge (SEDG), and Enphase (ENPH) climb as President Trumps tax and spending bill clears the Senate. Casino stocks, including Las Vegas Sands (LVS), Wynn Resorts (WYNN), and MGM Resorts (MGM), surge after Macaus June gaming revenue beats expectations. Ford (F) stock gains after the company reported a 14.2% increase in second quarter US sales, driven by strong demand for trucks, hybrids, and SUVs. Stay up to date on the latest market action, minute-by-minute, with Yahoo Finances Market Minute."
2025-07-02,Enphase Energy Launches Next-Generation IQ EV Charger 2 In Australia and New Zealand,Yahoo,"FREMONT, Calif., July 02, 2025 (GLOBE NEWSWIRE) -- Enphase Energy, Inc. (NASDAQ: ENPH), a global energy technology company and the worlds leading supplier of microinverter-based solar and battery systems, today announced production shipments of its newest electric vehicle (EV) charger, the IQ® EV Charger 2, in Australia and New Zealand. The IQ EV Charger 2 is a smart charger built to work seamlessly with Enphase solar and battery systems or as a powerful standalone charger. With advanced energy"
2025-07-02,These 3 Stocks Have Been the Worst Performers in the S&P 500 This Year. Have They Bottomed Out?,Yahoo,"The S&P 500 has recovered from a tough start to 2025, but the stocks listed here are all down more than 35%.  Many stocks are now trading near their all-time highs, and so is the S&P 500, which is up around 5.5% through the first six months of the year.  The three biggest losers in the index at the halfway point of the year are Deckers Outdoor (NYSE: DECK), Enphase Energy (NASDAQ: ENPH), and UnitedHealth Group (NYSE: UNH)."
2025-07-03,"Obvious Losers, Unexpected Winners As Tax Bill Passes Senate",Yahoo,"Hydrogen, battery storage, coal (for steelmaking), and nuclear stocks rose on incentives, tax credit extensions, and domestic sourcing carveouts."
2025-07-04,Smart Money Buys the Solar Dip,Yahoo,"The Senate’s passage of the “Big Beautiful Bill” reduces solar tax credits through 2028, but provides a transition window."
2025-07-08,New Trump Order Adds to Pressure on Sunrun and Other Renewable-Energy Stocks,Yahoo,"Renewable-energy stocks fell, after President Trump issued an executive order calling for tight application of the eligibility rules for clean-energy tax credits.  Shares in solar-equipment maker First Solar fell about 5% in morning trading Tuesday, while Sunrun dropped 11%.  The tax-and-spending bill passed by Republicans last week made good on Trumps promise to withdraw President Joe Biden’s green tax credits."
2025-07-08,"These Stocks Are Moving the Most Today: Tesla, Amazon, Exxon, Sunrun, Enphase, SoFi, Datadog, and More",Yahoo,"Stocks traded mostly to the downside Tuesday after President Donald Trump extended the date when his so-called reciprocal tariffs would take effect to Aug. 1 from July 9.  Equities tumbled Monday following Trump’s posting of letters to 14 global trading partners, including Japan and South Korea, outlining tariff rates they would pay if they didn’t strike trade deals.  Tesla   was up 1.1% after the stock fell 6.8% on Monday."
2025-07-10,Equity Markets Higher After FOMC Minutes Show Divided Opinion on Rate Cuts,Yahoo,US benchmark equity indexes are on track to close higher on Wednesday after minutes of the Federal R
2025-07-10,"Enphase Energy Expands IQ EV Charger 2 in Europe with New Markets, Certifications, and Smart Meter Integration",Yahoo,"FREMONT, Calif., July 10, 2025 (GLOBE NEWSWIRE) -- Enphase Energy, Inc. (NASDAQ: ENPH), a global energy technology company and the worlds leading supplier of microinverter-based solar and battery systems, today announced that production shipments of its newest electric vehicle (EV) charger, the IQ® EV Charger 2, have expanded across Europe to now include Greece, Romania, Ireland, and Poland. The IQ EV Charger 2 is a smart charger designed to work seamlessly with Enphase solar and battery system"
2025-07-19,JPMorgan Downgrades Enphase Energy (ENPH) Stock to Neutral,Yahoo,"Enphase Energy, Inc. (NASDAQ:ENPH) is one of the Best Beaten Down Stocks to Buy Now. JPMorgan downgraded the company’s stock to “Neutral” from “Overweight” with a price objective of $37, down from the prior target of $64, as reported by The Fly. The firm has updated its US residential solar growth assumptions in an effort to reflect the […]"
2025-07-21,GEV or ENPH: Which Stock Leads the Green Energy Future?,Yahoo,"GE Vernova shines on momentum and contracts, while Enphase offers value and capital efficiency in the clean energy race."
