date,headline,source,summary
2025-07-23,"GE Vernova, Thermo Fisher, Enphase Energy: Trending Tickers",Yahoo,"GE Vernova (GEV) stock is surging after beating second quarter estimates and raising its full-year outlook. Thermo Fisher Scientific (TMO) topped expectations and boosted its profit guidance. The companys CFO highlighted easing US–China tensions but warned sector-specific tariff woes could return. Enphase Energy (ENPH) stock is plummeting despite a second quarter earnings beat, as the company forecasts weaker third quarter sales and continues to struggle with subsidy cuts and trade tensions. To watch more expert insights and analysis on the latest market action, check out more Market Catalysts here."
2025-07-24,Why Enphase (ENPH) Shares Are Sliding Today,Yahoo,Shares of home energy technology company Enphase (NASDAQ:ENPH) fell 14.5% in the afternoon session after the company provided a weaker-than-expected revenue forecast for the third quarter.
2025-07-29,"Enphase Energy Launches Next-Generation Battery System for Smarter, Simpler Home Power",Yahoo,"FREMONT, Calif., July 29, 2025 (GLOBE NEWSWIRE) -- Enphase Energy, Inc. (NASDAQ: ENPH), a global energy technology company and the worlds leading supplier of microinverter-based solar and battery systems, today announced the launch of the 4th-generation Enphase® Energy System, featuring the IQ® Battery 10C, IQ® Meter Collar, and the IQ® Combiner 6C. This next-generation system stands out for its smaller footprint, enhanced features, easier installation, and unmatched reliability. Watch a video"
2025-08-04,Could Enphase Energy And SolarEdge Technologies Become The Netflix Of Energy,SeekingAlpha,"Enphase and SolarEdge face short-term headwinds, but long-term structural tailwinds remain strong. Learn more about ENPH and SEDG stocks here."
2025-08-05,Enphase Energy Announces New Safe Harbor Agreement,Yahoo,"FREMONT, Calif., Aug. 05, 2025 (GLOBE NEWSWIRE) -- Enphase Energy, Inc. (NASDAQ: ENPH), a global energy technology company and the worlds leading supplier of microinverter-based solar and battery systems, today announced a new safe harbor agreement with a solar and battery financing company that offers third-party ownership (TPO) agreements to homeowners, including leases and power purchase agreements (PPAs). The safe harbor agreement covers Enphase’s U.S.-manufactured IQ8HC™ Microinverters (wi"
2025-08-05,Enphase Energy: A Best-In-Class Balance Sheet Positioned To Thrive As Rates Decline,SeekingAlpha,"Explore Enphase Energys solid balance sheet, earnings strength, and potential catalysts."
2025-08-06,Will Paramount Stay in the S&P 500? Here’s an Update On the Situation.,Yahoo,"Skydance Media is set to close on its deal to purchase a controlling interest in  Paramount Global  on Thursday raising questions about whether the company will remain in  S&P Dow Jones Indices hasn’t announced any replacement for Paramount, and it’s possible it will remain right where it is.  Many investors assumed that Paramount would be dropped from the index due to its small market capitalization, opening the way for potential additions like Robinhood Markets or AppLovin.  After the deal, the market value of Paramount, which owns CBS, a movie studio, a group of cable networks, and operates a streaming service, should be around $11 billion, half the current minimum for new entrants into the index of $22.7 billion."
2025-08-11,"This Strategy Turned $1,000 Into $90 Million… Here Are 3 Stocks It Now Recommends",Yahoo,"Tom Yeung here with your Sunday Digest. Over the past several months, I’ve introduced several quantitative systems designed to help you compete with even the most advanced Wall Street algorithms. Some of these tools rely on seasonal effects… InvestorPlace - Stock Market News, Stock Advice & Trading Tips Others rely on price action… But all of them require fundamental research to confirm their results. There are simply too many real-world variables for algorithms to process alone, which is why hu"
2025-08-13,Enphase Energy (NASDAQ:ENPH) Is Reinvesting At Lower Rates Of Return,Yahoo,"If we want to find a stock that could multiply over the long term, what are the underlying trends we should look for..."
2025-08-15,Clean Energy Stocks Have Jumped. Next Week Could Test the Rally.,Yahoo,President Donald Trump has called for the Treasury Department to impose more stringent rules on renewables projects. One analyst says that could come on Monday.
2025-08-16,Solar stocks surge after Treasury tightens clean energy tax credit rules,Yahoo,Investing.com -- Solar and renewable energy stocks rallied sharply Friday after the U.S. Treasury Department and IRS released new guidance on clean energy project construction requirements for tax credit qualification.
2025-08-20,$50 Million Safe Harbor Deal Bolsters Enphase’s Solar Growth Plans,Yahoo,"Enphase Energy Inc. (NASDAQ:ENPH) has signed a new safe harbor agreement with a solar and battery financing company, expected to generate about $50 million in revenue"
2025-08-20,Clean Energy ETFs Hit a 52-Week High: Heres Why,Yahoo,Clean energy ETFs like ICLN and CTEX surged to 52-week highs after U.S. tax credit guidance eased investor fears and fueled a solar stock rally.
2025-08-21,Enphase Energy Achieves Compliance for Europe’s New Cybersecurity Requirements on Wireless Devices,Yahoo,"FREMONT, Calif., Aug. 21, 2025 (GLOBE NEWSWIRE) -- Enphase Energy, Inc. (NASDAQ: ENPH), a global energy technology company and the worlds leading supplier of microinverter-based solar and battery systems, today announced that all Enphase products subject to the European Union’s Radio Equipment Directive (RED) Article 3.3 cybersecurity requirements are certified to be in compliance with the rules. The new requirements under Article 3.3 of the RED, effective Aug. 1, 2025, introduce a cybersecurit"
2025-08-22,"Top Stock Movers Now: Enphase Energy, Zoom, Intuit, and More",Yahoo,U.S. equities took off at midday as Fed Chair Jerome Powell indicated interest-rate cuts may be appropriate now.
2025-08-23,US Equity Indexes Jump as Powells Jackson Hole Speech Sends September Rate-Cut Bets Sharply Higher,Yahoo,US equity indexes soared as bets favoring monetary policy easing in September rose after a potential
2025-08-23,Why Sunrun (RUN) Stock Is Trading Up Today,Yahoo,"Shares of residential solar energy company Sunrun (NASDAQ:RUN) jumped 9.4% in the afternoon session after the broader market rallied as Federal Reserve Chair Jerome Powell suggested that interest rate cuts could be on the horizon. Federal Reserve Chair Jerome Powell hinted that policymakers could be considering interest rate cuts soon, which sent a wave of optimism through the market. This news particularly benefits companies like Sunrun, which operate in capital-intensive sectors. Lower interes"
2025-08-23,S&P 500 Gains and Losses Today: Index Surges as Expectations of a Rate Cut Climb,Yahoo,"The S&P 500 rose 1.5% on Friday, Aug. 22, 2025, as Federal Reserve Chair Jerome Powell said the central bank could begin trimming interest rates as soon as next month."
2025-08-23,Sector Update: Energy Stocks Rise Friday Afternoon,Yahoo,"Energy stocks were higher Friday afternoon, with the NYSE Energy Sector Index rising 1.8% and the En"
2025-08-25,Is Enphase Energys (ENPH) TPO Financing Push a Sign of Strength or a Strategic Shift?,Yahoo,"Enphase Energy recently announced a new safe harbor agreement with a major U.S. solar and battery financing provider, securing approximately US$50 million in revenue and broadening its role in the third-party residential solar ownership market. The agreement enables future projects to lock in current tax credit qualifications, highlighting the companys strong U.S. participation and ability to manage policy uncertainty in the TPO segment. Well explore how Enphases expanding financing..."
2025-09-02,"Enphase Energy Introduces Next-Generation Battery System For Smarter, Simpler Home Power",Yahoo,"Enphase Energy Inc. (NASDAQ:ENPH) is among the 11 Best Green Stocks to Buy According to Hedge Funds. Enphase Energy Inc. (NASDAQ:ENPH) has launched its fourth-generation Enphase® Energy System, which includes the IQ® Battery 10C, IQ® Meter Collar, and IQ® Combiner 6C. Shipments of the system are now in progress and promise greater energy density, simpler […]"
2025-09-06,"Robinhood, AppLovin Additions Lead S&P 500 Index Changes",Yahoo,Three companies will be joining the S&P 500 later this month.
2025-09-06,"AppLovin, Robinhood To Join S&P 500. The Stocks Are Jumping.",Yahoo,"AppLovin and Robinhood will join the S&P 500 index before the open on Sept. 22, S&P Global said. APP stock and HOOD jumped in late trading."
2025-09-08,"Robinhood, AppLovin, and Emcor Stocks Trade Higher on News of S&P 500 Inclusion",Yahoo,"Robinhood Markets, AppLovin, and Emcor Group shares gained on word they will be added to the S&P 500 prior to the start of trading Sept. 22."
2025-09-08,"Enphase Energy Opens U.S. Pre-Orders for IQ9 Commercial Microinverters with GaN, Built for 480 V Three-Phase Systems",Yahoo,"LAS VEGAS, Sept. 08, 2025 (GLOBE NEWSWIRE) -- Enphase Energy, Inc. (NASDAQ: ENPH), a global energy technology company and the worlds leading supplier of microinverter-based solar and battery systems, today opened U.S. pre-orders for the new IQ9N-3P™ Commercial Microinverter. This is Enphase’s first microinverter powered by advanced gallium nitride (GaN) technology and designed for three-phase 480Y/277 V (wye) grid configurations, without using external transformers. The IQ9N-3P Commercial Micro"
2025-09-09,Enphase Energy Unveils New IQ Bidirectional EV Charger Architecture for Home Backup and Grid Services,Yahoo,"FREMONT, Calif., Sept. 09, 2025 (GLOBE NEWSWIRE) -- Enphase Energy, Inc. (NASDAQ: ENPH), a global energy technology company and the worlds leading supplier of microinverter-based solar and battery systems, today unveiled its new IQ® Bidirectional EV Charger architecture for vehicle-to-home (V2H) and vehicle-to-grid (V2G) capability. The charger connects to the direct current (DC) port of the electric vehicle (EV) and lets homeowners charge their EV, power their home seamlessly during outages, a"
2025-09-09,Why Enphase (ENPH) Shares Are Trading Lower Today,Yahoo,"Shares of home energy technology company Enphase (NASDAQ:ENPH) fell 4.3% in the afternoon session after S&P Global announced the company will be dropped from the S&P 500 index. The change, part of a quarterly rebalancing, will take effect before the opening bell on September 22. Such a removal often triggers selling pressure from index funds that track the S&P 500, as they are required to sell their holdings to align with the indexs new composition. According to S&P Dow Jones Indices, Enphase h"
2025-09-09,Why SolarEdge (SEDG) Shares Are Plunging Today,Yahoo,"Shares of solar power systems company SolarEdge (NASDAQ:SEDG) fell 5.8% in the morning session after key competitor Enphase Energy (ENPH) announced the U.S. launch of a new, technologically advanced microinverter for the commercial solar market."
2025-09-09,Top Midday Stories: PNC Acquires FirstBank for $4.10 Billion; EchoStar Sells Spectrum Licenses to SpaceX for $17 Billion,Yahoo,"All three major US stock indexes were up in late-morning trading Monday, as investors looked ahead t"
2025-09-09,Why Is AppLovin (APP) Stock Rocketing Higher Today,Yahoo,Shares of mobile app technology company AppLovin (NASDAQ:APP) jumped 11.3% in the morning session after S&P Dow Jones Indices announced on Friday that the company will be added to the benchmark S&P 500 index.
2025-09-10,Stock Picks From Seeking Alphas August 2025 New Analysts,SeekingAlpha,Meet Seeking Alphas 26 new analysts and discover their top stock picks and strategies.
2025-09-18,"Enphase Energy Boosts Solargraf with New TPO Partner Integrations, Faster Proposals, Availability in Japan, and NREL Validation",Yahoo,"FREMONT, Calif., Sept. 18, 2025 (GLOBE NEWSWIRE) -- Enphase Energy, Inc. (NASDAQ: ENPH), a global energy technology company and the worlds leading supplier of microinverter-based solar and battery systems, today announced enhancements to its Solargraf® platform with new third-party ownership (TPO) financing integrations, faster proposals, and availability in Japan. Solargraf is an all-in-one digital proposal, design, and permitting tool that enables solar installers to create, manage, and close"
2025-09-19,Is Enphase Energy Stock Underperforming the Nasdaq?,Yahoo,"Enphase Energy has significantly underperformed the Nasdaq over the past year, and analysts are cautious about the stock’s prospects."
2025-09-22,"Enphase Energy, Inc. (ENPH) Opens Pre-Orders for Its Next-Generation IQ EV Charger 2",Yahoo,"With significant upside potential, Enphase Energy, Inc. (NASDAQ:ENPH) secures a spot on our list of the 11 Cheap Clean Energy Stocks to Buy Right Now. On September 10, 2025, Enphase Energy, Inc. (NASDAQ:ENPH) opened pre-orders for its next-generation IQ EV Charger 2. Shipments, meanwhile, are expected to begin by November. The smart charger integrates seamlessly […]"
2025-09-29,Is Enphase Energys (ENPH) Global Software Bet Redefining Its Edge in a Crowded Market?,Yahoo,"In September 2025, Enphase Energy was added to both the S&P 1000 and Russell Small Cap Comp Growth Index, following enhancements to its Solargraf platform, including new financing integrations and international expansion. Independent validation from the National Renewable Energy Laboratory and Solargrafs launch in Japan underscore Enphases push for global market relevance and digital innovation. Well explore how Enphases Solargraf platform enhancements shape the companys investment..."
2025-10-01,1 Profitable Stock with Exciting Potential and 2 We Find Risky,Yahoo,"Even if a company is profitable, it doesn’t always mean it’s a great investment. Some struggle to maintain growth, face looming threats, or fail to reinvest wisely, limiting their future potential."
2025-10-02,"Jefferies Raises Its Price Target for Enphase Energy Inc. (ENPH) to $41.00, Maintains Hold Rating",Yahoo,"Enphase Energy Inc. (NASDAQ:ENPH) is one of the 10 Most Promising Green Stocks According to Wall Street Analysts, supported by hedge fund interest and analyst-rated potential. On September 29, 2025, Jefferies raised its price target for Enphase Energy Inc. (NASDAQ:ENPH) from $36 to $41, keeping its Hold rating due to the company’s strengthening forecast for […]"
2025-10-02,Enphase Energy Announces Collaboration with Essent in the Netherlands,Yahoo,"FREMONT, Calif., Oct. 02, 2025 (GLOBE NEWSWIRE) -- Enphase Energy, Inc. (NASDAQ: ENPH), a global energy technology company and the worlds leading supplier of microinverter-based solar and battery systems, today announced a collaboration with Essent, one of the largest residential energy providers in the Netherlands. The collaboration enables eligible Enphase customers with solar to expand their systems with IQ® Batteries and participate in Essent’s Smart Steering program, designed to help house"
2025-10-03,Is Enphase Ready for a Turnaround After Q1 Earnings and Recent Stock Rebound?,Yahoo,"If you own or are eyeing shares in Enphase Energy, you probably know what it feels like to ride a roller coaster. The stock has tracked a path that has left investors alternately hopeful and cautious, with the past year showing a -64.4% slide, and the five-year picture still deeply in the red at -65.4%. Yet, more recently, there have been small signs of life, with a 3.4% gain over the past week and a modest 1.8% climb in the last month. It is enough to make any investor ask: is now the right..."
2025-10-06,"Enphase Energy Launches IQ Battery 5P with FlexPhase in India, Enabling Single-Phase and Three-Phase Backup for Homes and Small Businesses",Yahoo,"FREMONT, Calif., Oct. 06, 2025 (GLOBE NEWSWIRE) -- Enphase Energy, Inc. (NASDAQ: ENPH), a global energy technology company and the worlds leading supplier of microinverter-based solar and battery systems, today announced the launch of the IQ® Battery 5P™ with FlexPhase for customers in India. The system provides reliable backup power and supports both single-phase and three-phase applications, serving India’s growing residential and small commercial solar markets. Three-phase service is widely"
2025-10-07,Enphase: More Pain In 2026 - Structural Risks Remain,SeekingAlpha,"ENPH faces significant headwinds from U.S. policy changes, including the accelerated phasing out of key renewable tax credits starting in 2026. Read why ENPH is a Hold."
2025-10-07,Enphase Energy Announces Conference Call to Review Third Quarter 2025 Financial Results,Yahoo,"Tuesday, Oct. 28, 2025 at 4:30 p.m. Eastern TimeFREMONT, Calif., Oct. 07, 2025 (GLOBE NEWSWIRE) -- Enphase Energy, Inc. (NASDAQ: ENPH), a global energy technology company and the worlds leading supplier of microinverter-based solar and battery systems, announced today that it will host a conference call and webcast on Tuesday, Oct. 28, 2025 at 4:30 p.m. Eastern Time to discuss its third quarter 2025 financial results for the period ended Sept. 30, 2025. The live webcast can be accessed on the E"
2025-10-07,Enphase: Risk Growing As Tesla May Control The U.S. Solar Market By 2030,SeekingAlpha,"Enphase faces challenges from rising rates, policy shifts, and Teslaâs dominance in solar tech. Click here to read an analysis of ENPH stock now."
2025-10-10,Enphase Expands Smart Energy Management to Water Heaters in Europe,Yahoo,"Enphase Energy extends its IQ® Energy Management platform to include electric water heaters in Belgium, the Netherlands, and Switzerland."
2025-10-11,"Stanley Black & Decker, Enphase, and EVgo Shares Are Falling, What You Need To Know",Yahoo,A number of stocks fell in the afternoon session after the U.S. threatened to impose massive increases to tariffs on China in response to new export controls from Beijing.
