date,headline,source,summary
2024-10-18,Enphase Energy to Post Q3 Earnings: Whats in Store for the Stock?,Yahoo,ENPHs Q3 results are expected to reflect dismal top-line performance due to continued weak demand in the United States and Europe. Restructuring and impairment charges might have hurt earnings.
2024-10-18,"Is Enphase Energy, Inc. (ENPH) the Best High Growth Lithium Stock to Invest In?",Yahoo,"We recently compiled a list of 10 High Growth Lithium Stocks to Invest In. In this article, we will look at where Enphase Energy, Inc. (NASDAQ:ENPH) ranks among high growth lithium stocks to invest in. Lithium Prices Drop but Demand Signals Long-Term Gains Rio Tinto announced its acquisition of U.S.-based Arcadium for $6.7 billion, positioning […]"
2024-10-19,Heres Why Enphase Energy (ENPH) Gained But Lagged the Market Today,Yahoo,"Enphase Energy (ENPH) reachead $91.64 at the closing of the latest trading day, reflecting a +0.08% change compared to its last close."
2024-10-22,Tuesdays Earnings Slate,MarketWatch,Tuesdays Earnings Slate
2024-10-22,"Enphase reports weaker quarter, and this time its U.S. business is not the problem",MarketWatch,"Enphase reports weaker quarter, and this time its U.S. business is not the problem"
2024-10-23,"Social Buzz: Wallstreetbets Stocks Mostly Lower Premarket Wednesday; Enphase Energy, McDonalds to Decline",Yahoo,"Social Buzz: Wallstreetbets Stocks Mostly Lower Premarket Wednesday; Enphase Energy, McDonalds to Decline"
2024-10-23,"Top Stock Movers Now: Enphase Energy, AT&T, Coca-Cola, and More",Yahoo,U.S. equities lost ground at midday after several companies reported weaker-than-expected results and bond yields continued to rise.
2024-10-23,Enphase Energy Sales Plunge on Weak European Demand,Yahoo,"Enphase Energy was the biggest decliner in the S&P 500 Wednesday, a day after missing third-quarter profit and sales forecasts as demand in Europe slumped."
2024-10-23,Enphase Energy Reports Financial Results for the Third Quarter of 2024,Yahoo,"FREMONT, Calif., Oct. 22, 2024 (GLOBE NEWSWIRE) -- Enphase Energy, Inc. (NASDAQ: ENPH), a global energy technology company and the world’s leading supplier of microinverter-based solar and battery systems, announced today financial results for the third quarter of 2024, which included the summary below from its President and CEO, Badri Kothandaraman. We reported quarterly revenue of $380.9 million in the third quarter of 2024, along with 48.1% for non-GAAP gross margin. We shipped 1,731,768 micr"
2024-10-23,"Enphase Stock Dives After Earnings Miss. Sunrun, SolarEdge Hit as Sector Struggles.",Yahoo,"While the companys revenue in the U.S. increased from the previous quarter, it was hit by a decrease in Europe."
2024-10-23,Wall Street Lunch: Boeing Loses $6 Billion,SeekingAlpha,Is all the bad news priced in now for Boeing? (Stocks slump on chip weakness. Nvidia mea culpa.
2024-10-23,"McDonalds stock slips, Starbucks dips, and other movers",MarketWatch,"McDonalds stock slips, Starbucks dips, and other movers"
2024-10-23,"Enphase Stock Dives After Earnings—and Takes Sunrun, SolarEdge With It",MarketWatch,"Enphase Stock Dives After Earnings—and Takes Sunrun, SolarEdge With It"
2024-10-26,Why have solar stocks have been so volatile? One reason: The specter of  a Republican victory in November.,Yahoo,The Invesco Solar ETF (TAN) is down 28% since the start of 2024 amid a difficult year for solar. Investors are worried about the election and interest rates.
2024-10-27,"Jim Cramer on Enphase Energy, Inc. (ENPH): ‘I Don’t Want You To Sell It All The Way Down Here’",Yahoo,"We recently compiled a list of the Jim Cramer on Tesla and Other Stocks. In this article, we are going to take a look at where Enphase Energy, Inc. (NASDAQ:ENPH) stands against the other stocks Jim Cramer is talking about. Jim Cramer, host of Mad Money, emphasized the ongoing significance of fossil fuels in supporting technological […]"
2024-10-29,Enphase Energy price target lowered to $129 from $144 at Seaport Research,Yahoo,"Seaport Research lowered the firm’s price target on Enphase Energy (ENPH) to $129 from $144 and keeps a Buy rating on the shares. The company provided a surprisingly negative update on Europe, which the firm believes is due to the company struggling to navigate some of the regulatory/economic challenges for its core market trio and its inability to ramp new products/territory fast enough elsewhere to compensate, the analyst tells investors. The firm maintains its Buy rating on the stock, believi"
2024-10-30,"First Solars Q3 Earnings Miss Estimates, 24 Sales View Revised",Yahoo,"FSLRs third-quarter earnings and revenues miss the Zacks Consensus Estimate by 6.1% and 17%, respectively."
2024-11-05,Clean-Energy Stocks Rally as Poll Raises Hope for Harris Win,Yahoo,First Solar shares jumped on Monday morning. They also rallied after the Harris-Trump debate in September.
2024-11-06,Renewable-energy stocks tank after Trump wins White House,MarketWatch,Renewable-energy stocks tank after Trump wins White House
2024-11-06,Now Is an Opportune Time To Consider Enphase Stock,Yahoo,The company is reasonably and sustainably valued prior to 2025s solar power upcycle commencing
2024-11-06,Sharp drops in solar stocks translate to sizable paper gains for short sellers,MarketWatch,Sharp drops in solar stocks translate to sizable paper gains for short sellers
2024-11-07,"Trump win fuels stock rally: Nasdaq up 400 points, gold plunges",Yahoo,"Yahoo Finance Anchor Rachelle Akuffo breaks down the top market stories of the day. All major indexes are in the green as investors react positively to the results of the US presidential election. The Nasdaq Composite (^IXIC) is up a notable 400 points today. The race for control of the House of Representatives remains in focus. The Democrats have won 181 seats while the Republicans have 199 seats, with 55 seats yet to be called. However, the Republicans have secured a majority in the Senate. Meanwhile, gold (GC=F) prices are falling as investors shift away from the traditional safe-haven asset and embrace the Trump trade instead. Stocks in the green energy sector that were previously buoyed by the prospect of a Democratic victory are now plummeting in the wake of Trumps win. Another stock in the spotlight is Meta Platforms (META) as the Supreme Court is set to hear an appeal from the tech giant regarding a securities fraud lawsuit today. To watch more expert insights and analysis on the latest market action, check out more Wealth here. This post was written by Angel Smith"
2024-11-07,"SolarEdge Technologies: Weak Quarter, Disappointing Outlook - Sell",SeekingAlpha,SolarEdge Technologies reported another set of disappointing quarterly results. Find out why SEDG stock is a Sell.
2024-11-09,Enphase Energy to lay off 17% of workforce,Yahoo,"Enphase will also streamline its operations by focusing contract manufacturing in four existing locations – two in the United States, one in India and one in China.  The company will cease its contract manufacturing operations in Guadalajara, Mexico, it added."
2024-11-09,Enphase to lay off workers and end some operations in Mexico,MarketWatch,Enphase to lay off workers and end some operations in Mexico
2024-11-11,"Enphase Energy Unveils AI-Powered DIY Permitting Feature for Solargraf, Slashing Solar Permit Plan Creation Times by up to 95%",Yahoo,"FREMONT, Calif., Nov. 11, 2024 (GLOBE NEWSWIRE) -- Enphase Energy, Inc. (NASDAQ: ENPH), a global energy technology company and the worlds leading supplier of microinverter-based solar and battery systems, announced today a new do-it-yourself (DIY) permit plan feature on Solargraf®, its cloud-based design, proposal, and permitting software platform for solar installers in the United States. The DIY permitting feature uses artificial intelligence and machine learning to automate the complex solar"
2024-11-13,Solar Leader Enphase Energy Cutting 500 Jobs,Yahoo,"California-based Enphase Energy, a company known for its solar power and electric vehicle (EV) charging technology, announced it is laying off about 500 workers. The company in a Nov. 8 […]"
2024-11-15,The Trump Trade Is Putting Clean Energy Stocks On Sale,SeekingAlpha,The AI revolutions massive energy demands create additional growth opportunities for clean energy technologies. Click here for a detailed analysis.
2024-11-16,Trumps Election Caused a Sell-Off in Clean Energy Stocks. But Is It an Opportunity for These 2 Industry Leaders?,Yahoo,Trumps election has caused renewable and electric vehicle (EV) stocks to crash. But these industry leaders could be bargains.
2024-11-18,Enphase Energy Powers Up with US-Made IQ Batteries: Unlocking Bonus Tax Credits,Yahoo,"Enphase Energy, Inc. (NASDAQ:ENPH), a microinverter-based solar and battery system supplier, announced its first shipments of the U.S.-produced IQ Battery 5Ps. These new units are expected to help solar projects qualify for the Domestic Content Bonus Credit, a tax incentive under the Inflation Reduction Act (IRA) designed to boost domestic manufacturing and promote clean energy. The bonus credit targets commercial asset owners, including businesses installing solar systems and PPA/lease provider"
2024-11-19,"Emerens Q3 Earnings In Line With Estimates, Revenues Fall Y/Y",Yahoo,"SOLs third-quarter earnings align with the Zacks Consensus Estimate. However, the quarterly revenues miss the consensus estimate by 51%."
2024-11-29,Enphase Energy Unveils IQ PowerPack in the United States and Canada,Yahoo,"ENPH unveils its IQ PowerPack 1500, a portable energy system, which is now available for pre-order in the United States and Canada."
2024-11-30,What Moved Markets This Week,SeekingAlpha,Stay informed with the latest financial news in this Wall Street Breakfast podcast.
2024-12-03,S&P 500 Rises 5.7% In November To Log Best Month Of 2024,SeekingAlpha,The S&P 500 posted its best one-month performance in November as a post-election stock bump lifted markets broadly. Click to read.
2024-12-04,Biggest Winners And Losers Since The Election,SeekingAlpha,"Of the 13 biggest stock winners, most of them were already big winners leading up to the election, and all but four are currently up over 40% YTD. Click to read."
2024-12-05,Enphase Energy Announces Collaboration with Frank Energie in the Netherlands,Yahoo,"FREMONT, Calif., Dec. 05, 2024 (GLOBE NEWSWIRE) -- Enphase Energy, Inc. (NASDAQ: ENPH), a global energy technology company and the worlds leading supplier of microinverter-based solar and battery systems, announced today a collaboration with Frank Energie, an energy provider in the Netherlands. This strategic relationship will enable Frank Energie customers with Enphase solar and battery systems to participate in the grid imbalance energy marketplace in the Netherlands, which can help maximize"
2024-12-07,Why Enphase Energy (ENPH) Is Among the Best Wind Power and Solar Stocks to Invest in Now,Yahoo,"We recently published a list of 10 Best Wind Power and Solar Stocks To Invest In Now. In this article, we are going to take a look at where Enphase Energy, Inc. (NASDAQ:ENPH) stands against other best wind power and stocks to invest in now. According to a report by the World Economic Forum published […]"
2024-12-10,Equities Fall Intraday as Traders Await Official Inflation Data,Yahoo,US benchmark equity indexes were lower after midday Monday as markets evaluated an inflation survey
2024-12-10,Sector Update: Energy Stocks Rise in Monday Afternoon Trading,Yahoo,Energy stocks climbed Monday afternoon with the NYSE Energy Sector Index rising 1.1% and the Energy
2024-12-12,Enphase Energy (ENPH) Stock Drops Despite Market Gains: Important Facts to Note,Yahoo,"The latest trading day saw Enphase Energy (ENPH) settling at $74.23, representing a -0.3% change from its previous close."
2024-12-13,Canadian Solar to Supply 315 MWh Battery Energy Storage in Texas,Yahoo,CSIQ plans to deliver 315 MWh DC of battery storage solutions in Texas and sell up to 2 GWp of high-efficiency solar modules for various Sunraycer projects.
2024-12-17,Enphase: Ready To Shine Again,SeekingAlpha,Enphase dominates the microinverter segment and benefits from favorable long-term solar energy trends. See why I rate ENPH stock a strong buy.
2024-12-17,SolarEdge Stock Jumps After Goldman Double Upgrade. Solar Can Shine Again in 2025.,MarketWatch,SolarEdge Stock Jumps After Goldman Double Upgrade. Solar Can Shine Again in 2025.
2024-12-18,"Investor Notice: Robbins LLP Informs Stockholders of the Class Action Lawsuit Filed Against Enphase Energy, Inc.",Finnhub,"SAN DIEGO, Dec. 18, 2024 /PRNewswire/ -- Robbins LLP announces that a shareholder filed a class action on behalf of all investors who purchased or otherwise acquired Enphase Energy, Inc. securities..."
2024-12-21,Is SolarEdge At Its Final Edge?,SeekingAlpha,"Analyzing SolarEdges downfall in 2023-2024, its uncertain future, and whether it is still a viable investment option for investors."
2024-12-23,"Enphase Energy, Inc. (ENPH): A Bull Case Theory",Yahoo,"We came across a bullish thesis on Enphase Energy, Inc. (ENPH) on The Finance Corner’s Substack by Kostadin Ristovski, ACCA. In this article, we will summarize the bulls’ thesis on ENPH. Enphase Energy, Inc. (ENPH)’s share was trading at $71.45 as of Dec 20th. ENPH’s trailing and forward P/E were 155.33 and 20.53 respectively according to Yahoo […]"
2024-12-25,Why Enphase Energy (ENPH) Is One of the Best Solar Energy Stocks to Buy Now?,Yahoo,"We recently published a list of 10 Best Solar Energy Stocks To Buy Now. In this article, we are going to look at where Enphase Energy, Inc. (NASDAQ:ENPH) stands against other best solar energy stocks to buy now. During Joe Biden’s presidency, the U.S. solar industry experienced a significant boost, primarily driven by the Inflation […]"
2024-12-27,Emeren Divests 2.8 MWdc Solar Project in Maine to Altus Power,Yahoo,SOL announces the sale of a 2.8 MWdc solar project in Maine to Altus Power.
2024-12-29,Enphase: Top Contrarian Pick With Blood In The Streets,SeekingAlpha,"Enphase upgraded to strong buy - with technological edge over competitors and profitability in a tough solar market, strong growth is on the horizon."
2025-01-01,Why Enphase Energy (ENPH) Is One of the Best Environmental Stocks to Invest in Right Now?,Yahoo,"We recently published a list of the 10 Best Environmental Stocks To Invest In Right Now. In this article, we are going to take a look at where Enphase Energy, Inc. (NASDAQ:ENPH) stands against the other best environmental stocks to invest in right now. The United Nations Climate Change Conference (COP29), held in Baku, Azerbaijan, […]"
2025-01-02,"Enphase Energy, Inc. Sued for Securities Law Violations - Contact the DJS Law Group to Discuss Your Rights - ENPH",Finnhub,"LOS ANGELES, Jan. 2, 2025 /PRNewswire/ -- The DJS Law Group reminds investors of a class action lawsuit against Enphase Energy, Inc. for violations of the federal securities laws. ..."
2025-01-04,"Enphase Energy, Inc. (ENPH) Investors: February 11, 2025 Filing Deadline in Securities Class Action - Contact Kessler Topaz Meltzer & Check, LLP",Finnhub,"January 4, 2025 - The law firm of Kessler Topaz Meltzer & Check, LLP informs investors that the firm has filed a securities fraud class action lawsuit against Enphase Energy, Inc. on behalf of all..."
2025-01-04,Enphase Energy (ENPH) Advances But Underperforms Market: Key Facts,Yahoo,"In the most recent trading session, Enphase Energy (ENPH) closed at $72.15, indicating a +1.11% shift from the previous trading day."
2025-01-05,"ENPH Class Action Lawsuit Reminder: Kessler Topaz Meltzer & Check, LLP Reminds Enphase Energy, Inc. (ENPH) Investors that a Securities Fraud Class Action Lawsuit Has Been Filed",Finnhub,"RADNOR, Pa., Jan. 5, 2025 /PRNewswire/ -- The law firm of Kessler Topaz Meltzer & Check, LLP informs investors that the firm has filed a securities fraud class action lawsuit against Enphase Energy,..."
2025-01-06,"Trump Tariffs Shift? Trump Denies, But Nucor, Enphase, Ford, FCX Lead S&P 500 Rally",Yahoo,"President-elect Trump denied a report that his tariffs may focus on strategic industries. But the S&P 500, Nucor, FCX, Enphase and Ford rose."
2025-01-07,Enphase Energy IQ8 Microinverters Selected for Belgium Radioactive Waste Facility,Yahoo,"Enphase IQ8 Microinverters selected for safer AC system architecture, emphasis on cybersecurity, and superior reliability and performanceFREMONT, Calif., Jan. 07, 2025 (GLOBE NEWSWIRE) -- Enphase Energy, Inc. (NASDAQ: ENPH), a global energy technology company and the worlds leading supplier of microinverter-based solar and battery systems, today announced that IQ8™ Microinverters were selected for a 2.2 MW solar project at the Belgoprocess radioactive waste facility in Dessel, Belgium. Earth, a"
2025-01-08,"A Closer Look At Enphase Energy, Inc.s (NASDAQ:ENPH) Uninspiring ROE",Yahoo,"One of the best investments we can make is in our own knowledge and skill set. With that in mind, this article will..."
2025-01-11,"Jim Cramer on Enphase Energy, Inc. (ENPH): ‘I Think It’s Amazing That Enphase Was Only Down 48% For The Year’",Yahoo,"We recently compiled a list of the 10 S&P 500 Stocks on Jim Cramer’s Radar. In this article, we are going to take a look at where Enphase Energy, Inc. (NASDAQ:ENPH) stands against the other S&P 500 stocks. Jim Cramer, host of Mad Money, recently discussed the current state of the market and also discussed both […]"
2025-01-13,"Kessler Topaz Meltzer & Check, LLP Reminds Investors of Deadline for Securities Fraud Class Action Lawsuit Filed Against Enphase Energy, Inc.",Finnhub,"RADNOR, Pa., Jan. 13, 2025 /PRNewswire/ -- The law firm of Kessler Topaz Meltzer & Check, LLP informs investors that the firm has filed a securities fraud class action lawsuit against Enphase Energy,..."
2025-01-13,"Enphase Energy Introduces IQ Battery 5P with FlexPhase, Delivering Three-Phase Backup Power in Germany, Austria, and Switzerland",Finnhub,"FREMONT, Calif., Jan. 13, 2025 -- Enphase Energy, Inc. , a global energy technology company and the worlds leading supplier of microinverter-based solar and battery systems, today announced..."
2025-01-16,Enphase Energy : Which solar tax credits and incentives are available in 2025,Finnhub,State-level solar incentives State-level solar incentives may further help you reduce the costs of installing solar on your home or business. Though most states have incentives in place-though not...
2025-01-17,"Kirby McInerney LLP Urges Investors in Enphase Energy, Inc. (ENPH) to Inquire About Their Rights in Class Action Lawsuit",Finnhub,The law firm of Kirby McInerney LLP reminds investors that a class action lawsuit has been filed in the U.S. District Court for the Northern District of California on behalf of those who acquired...
2025-01-20,Enphase: Challenges Mount As Solar Industry Could Face More Headwinds In 2025,SeekingAlpha,Enphase operates in a landscape that seems to be negatively affected by policy regulators on both sides of the Atlantic. Read why ENPH stock is a Strong Sell.
2025-01-21,Enphase Energy Announces Conference Call to Review Fourth Quarter and Full Year 2024 Financial Results,Finnhub,"FREMONT, Calif., Jan. 21, 2025 -- Enphase Energy, Inc. , a global energy technology company and the worlds leading supplier of microinverter-based solar and battery systems, announced today that..."
2025-01-27,Enphase Energy Announces Technology Integration into Octopus Energy Smart Tariff Program in the United Kingdom,Finnhub,"FREMONT, Calif., Jan. 27, 2025 -- Enphase Energy, Inc. , a global energy technology company and the worlds leading supplier of microinverter-based solar and battery systems, announced today that..."
2025-02-03,Enphase: Buy When Others Question If Sunny Days Will Ever Reappear,SeekingAlpha,"Enphase Energys stock price is down 85%, but its fundamentals remain strong. Read why ENPH stock is a compelling buy with potential for recovery."
2025-02-05,Enphase Energy: Good Quarter But Limited Near-Term Catalysts - Hold (Rating Upgrade),SeekingAlpha,"Enphase Energys Q4 results exceeded expectations with strong cash flow, but disappointing Q1 guidance may keep shares range-bound. Read why ENPH stock is a Hold."
2025-02-05,"Enphase Energy, Inc. (ENPH) Q4 2024 Earnings Call Transcript",SeekingAlpha,"Enphase Energy, Inc. (NASDAQ:ENPH) Q4 2024 Earnings Conference Call February 4, 2024 4:30 PM ETCompany ParticipantsZach Freedman - IRBadri Kothandaraman -..."
2025-02-05,"Enphase Energy Shares Rise After 4Q Results, 1Q Outlook Beat Estimates",MarketWatch,"Enphase Energy Shares Rise After 4Q Results, 1Q Outlook Beat Estimates"
2025-02-05,"Enphase calls for better times ahead, but Europe is still a worry for solar-power company",MarketWatch,"Enphase calls for better times ahead, but Europe is still a worry for solar-power company"
2025-02-05,"Alphabet and AMD shares under pressure, and other movers",MarketWatch,"Alphabet and AMD shares under pressure, and other movers"
2025-02-07,3 Renewable-Energy Stocks That Could Thrive Under Trump,MarketWatch,3 Renewable-Energy Stocks That Could Thrive Under Trump
2025-02-07,Enphase Energy Inc. stock outperforms competitors on strong trading day,MarketWatch,Enphase Energy Inc. stock outperforms competitors on strong trading day
2025-02-13,Enphase Energy Inc. stock underperforms Wednesday when compared to competitors,MarketWatch,Enphase Energy Inc. stock underperforms Wednesday when compared to competitors
2025-02-14,Trump Anxiety Could Boost Sales at These Renewables Companies,MarketWatch,Trump Anxiety Could Boost Sales at These Renewables Companies
2025-02-20,SolarEdge Spikes 16% As Improved Margins Offset Wider Loss,Yahoo,SolarEdge Technologies missed earnings estimates as losses widened. But SEDG stock spikes as margins improve.
2025-02-21,"SolarEdge Technologies Q4 Loss Wider Than Expected, Revenues Down Y/Y",Yahoo,"SEDGs Q4 revenues of $196.2 million surpass the Zacks Consensus Estimate by 5.3%. However, the top line declines 37.9% from the year-ago quarters level."
2025-02-22,Enphase Energy Inc. stock outperforms competitors despite losses on the day,MarketWatch,Enphase Energy Inc. stock outperforms competitors despite losses on the day
2025-02-26,Enphase Energy Inc. stock underperforms Tuesday when compared to competitors,MarketWatch,Enphase Energy Inc. stock underperforms Tuesday when compared to competitors
2025-02-27,Enphase Energy (ENPH) Stock Slides as Market Rises: Facts to Know Before You Trade,Yahoo,"The latest trading day saw Enphase Energy (ENPH) settling at $63.71, representing a -1.73% change from its previous close."
2025-02-28,Enphase Energy Inc. stock underperforms Thursday when compared to competitors,MarketWatch,Enphase Energy Inc. stock underperforms Thursday when compared to competitors
2025-03-01,"Enphase Energy, Inc. (ENPH): Among the Worst Performing Solar Stocks to Buy Now",Yahoo,"We recently compiled a list of the 10 Worst Performing Solar Stocks to Buy Now. In this article, we are going to take a look at where Enphase Energy, Inc. (NASDAQ:ENPH) stands against the other solar stocks. Solar electricity is a renewable energy source that is produced by converting sunlight into usable power. This conversion occurs […]"
2025-03-02,"Why Enphase Energy, Inc. (ENPH) Went Down On Friday?",Yahoo,"We recently published a list of 10 Battered Stocks on Friday. In this article, we are going to take a look at where Enphase Energy, Inc. (NASDAQ:ENPH) stands against other battered stocks on Friday. The stock market ended the trading week in the green territory, with all major indices gaining more than 1 percent after […]"
2025-03-03,Enphase Energy Increases Deployments of Legacy NEM System Expansion Solution in California,Yahoo,"California utilities streamline approval process for legacy NEM system expansionsFREMONT, Calif., March 03, 2025 (GLOBE NEWSWIRE) -- Enphase Energy, Inc. (NASDAQ: ENPH), a global energy technology company and the worlds leading supplier of microinverter-based solar and battery systems, today announced increased deployments of its solution for expanding legacy net energy metering (NEM) solar energy systems in California as utilities streamline their approval process. Homeowners can now expand th"
2025-03-04,The 10 Stocks Hedge Funds Love—and Hate—the Most,Yahoo,BofA Securities compiled a list of least and most shorted stocks by hedge funds. They appear to be betting blue chips can keep delivering solid returns.
2025-03-05,"Technology Shares Inch Higher, Defying Selloff -- Tech Roundup",MarketWatch,"Technology Shares Inch Higher, Defying Selloff -- Tech Roundup"
2025-03-07,1 Small-Cap Stock with Solid Fundamentals and 2 to Turn Down,Yahoo,"Small-cap stocks can be incredibly lucrative investments because their lack of analyst coverage leads to frequent mispricings. However, these businesses (and their stock prices) often stay small because their subscale operations make it harder to expand their competitive moats."
2025-03-07,ClearBridge Sustainability Leaders Strategy Q4 2024 Commentary,SeekingAlpha,The ClearBridge Sustainability Leaders Strategy underperformed its Russell 3000 Index benchmark in the fourth quarter. Click here to read the full commentary. 
2025-03-10,Enphase: Great Disjoint In Execution & Sentiments - Pending Policy Clarity,SeekingAlpha,"Enphase has already lost most of its value since the December 2022 peak, effectively returning all of its 2021/ 2022 gains. Read my ENPH analysis."
2025-03-11,Why Clean-Energy Stocks Jumped as the S&P 500 Dropped,MarketWatch,Why Clean-Energy Stocks Jumped as the S&P 500 Dropped
