date,headline,source,summary
2025-01-10,Alzheimer’s Drugs Eyed by Investors Seeking Obesity-Like Gains,Yahoo,(Bloomberg) -- Investors seeking the next obesity-like market opportunity will be closely watching developments related to treatments for Alzheimer’s disease in 2025.Most Read from BloombergWhat Robotaxis Brought San FranciscoNYC Condo Owners May Bear Costs of Landmark Green Building LawNYC’s Subway Violence Deters Drive to Bring Workers Back to OfficeAmbitious High-Speed Rail Plans Advance in the Baltic RegionDutch Central Bank Restores Amsterdam’s ‘Ugliest Building’Companies including Biogen I
2025-01-10,"AI, vaccine distrust, & the future of healthcare: Novartis CEO",Yahoo,"Can science prevail against this more turbulent backdrop of the Trump administration? Yahoo Finance executive editor Brian Sozzi talks at length with Novartis (NVS) CEO Vas Narasimhan. Narasimhan has led the drug giant since 2018, doing deals that have expanded the company’s pipeline in areas like heart disease and cancer. Still, Narasimhan is feeling pressure to bring the investments to the bottom line to jumpstart a stock price that has lagged in the past year. For full episodes of Opening Bid, listen on your favorite podcast platform or watch on our website."
2025-01-13,Lilly to acquire Scorpion Therapeutics mutant-selective PI3Kα inhibitor program,Finnhub,"The acquisition will expand Lillys oncology pipeline with STX-478, the differentiated and potentially best-in-class, mutant-selective PI3Kα inhibitor currently in a Phase 1/2 clinical trialSTX-478..."
2025-01-14,Eli Lilly Cuts 4Q Sales Outlook After Sluggish Growth for Incretin Drugs,Finnhub,"By Owen Tucker-Smith Eli Lilly cut its outlook for fourth-quarter revenue as the market for drugs that increase insulin levels grew slower than expected, but the company sees healthy growth in..."
2025-01-15,Eli Lilly Stumbled But Weight-Loss Drugs Will Continue to Fuel Markets. Here’s Why and 5 Other Things to Know Today.,MarketWatch,Eli Lilly Stumbled But Weight-Loss Drugs Will Continue to Fuel Markets. Here’s Why and 5 Other Things to Know Today.
2025-01-15,"These Stocks Moved the Most Today: Palantir, Nvidia, Eli Lilly, Boeing, KB Home, Signet, Aehr, and More",MarketWatch,"These Stocks Moved the Most Today: Palantir, Nvidia, Eli Lilly, Boeing, KB Home, Signet, Aehr, and More"
2025-01-15,Wall Street Lunch: Microsoft Is The Agentic AI Favorite,SeekingAlpha,"Morgan Stanley CIO survey says Agentic AI is underappreciated. Wholesale inflation comes cool, but markets are wary. Meta to fire 5% of underperformers."
2025-01-16,Next Century Growth Investors Q4 2024 Commentary,SeekingAlpha,"In the fourth quarter of 2024, equity markets were positive and large cap stocks generally outperformed small cap stocks. Read more here."
2025-01-17,Heres How Donald Trump Could Shake Up Health Care — And Biotech Stocks,DowJones,Heres How Donald Trump Could Shake Up Health Care — And Biotech Stocks
2025-01-18,MoonLake Immunotherapeutics: Mid-2025 Sonelokimab HS Data Could Be Enhanced Upon,SeekingAlpha,MoonLake Immunotherapeutics is set to release results from both the phase 3 VELA-1 and VELA-2 studies in mid-2025. Click here to read why MLTX is a Strong Buy.
2025-01-20,Top 4 Immunology Stocks Poised For Growth In 2025,SeekingAlpha,"Discover the latest trends and developments in the global immunology drugs market, along with four promising stocks to watch for potential investments."
2025-01-21,Eli Lilly: Market Overreacted,SeekingAlpha,"Eli Lillys diverse portfolio shows broad growth, with significant contributions from oncology and other therapeutic areas. See why LLY stock is a Buy."
2025-01-24,Wall Street Breakfast Podcast: Allurion Soars On Balloon And GLP-1 Study Plans,SeekingAlpha,"Allurion stock soars on weight-loss therapy update. Stardust Power breaks ground on Oklahoma lithium refinery. OpenAI launches shopping agent Operator; Etsy, eBay tick higher."
2025-01-28,NIE: Quarterly Update On An Excellent Equity And Convertible Fund,SeekingAlpha,The Virtus Equity & Convertible Income Fund is attracting income-focused investors with its high yield and strong performance. Learn more on NIE CEF here.
2025-02-01,"Busy Earnings Season Continues With Alphabet, Disney, Palantir To Report Results",SeekingAlpha,Tech biggies continue to report earnings this week. A bunch of labor reports are to be released. EU inflation data will be released on Wednesday. See more here.
2025-02-05,"Lilly needs a plan to spur weight-loss drug sales, investors say",Finnhub,Eli Lilly investors and analysts said they want to hear details from the company on how exactly it plans to grow U.S. sales of popular weight-loss drug Zepbound after it last month forecast...
2025-02-05,Novo Nordisk Q4 Earnings: Outperformance Suggests Stock Price Comeback Starts Today,SeekingAlpha,"Novo Nordisk today announced 2024 earnings, reporting a 26% increase in annual sales to ~$40.56bn. Read why I upgrade NVO stock from hold to buy."
2025-02-06,Viking Therapeutics Plummeted 8% On Its Earnings Report. Heres Why.,DowJones,Viking Therapeutics Plummeted 8% On Its Earnings Report. Heres Why.
2025-02-06,Eli Lilly’s Disappointing Quarter Was Already Baked In,MarketWatch,Eli Lilly’s Disappointing Quarter Was Already Baked In
2025-02-06,Eli Lilly and Company (LLY) Q4 2024 Earnings Call Transcript,SeekingAlpha,"Eli Lilly and Company (NYSE:LLY) Q4 2024 Results Conference Call February 6, 2025 10:00 AM ETCompany ParticipantsMike Czapar - Senior Vice President of..."
2025-02-07,Health Care Climbs After Lilly Earnings - Health Care Roundup,MarketWatch,Health Care Climbs After Lilly Earnings - Health Care Roundup
2025-02-07,"Model Portfolio For Capital Appreciation, February 25",SeekingAlpha,"Discover top stock picks for capital appreciation and outperformance, with a focus on profits, dividends, and long-term viability."
2025-02-08,"Dividend Champion, Contender, And Challenger Highlights: Week Of February 9",SeekingAlpha,Stay informed on the latest dividend activity for top companies with this weekly summary. Read more here.
2025-02-13,West Pharma’s stock tanks 33% to lead S&P 500 decliners as guidance misses by a wide margin,MarketWatch,West Pharma’s stock tanks 33% to lead S&P 500 decliners as guidance misses by a wide margin
2025-02-17,Why Regenerons Price May Soon Break Out,SeekingAlpha,Regeneron Pharmaceuticals fourth quarter results beat my and Wall Street analysts expectations. See why REGN stock is a top pick for long-term investors.
2025-02-18,Tracking Stanley Druckenmillers Duquesne Family Office Portfolio - Q4 2024 Update,SeekingAlpha,"Discover the latest strategic moves of Duquesne Family Offices $3.72B portfolio, including new stakes, increased investments, and notable disposals."
2025-02-19,What Top-Performing Healthcare Funds Are Buying Now,MarketWatch,What Top-Performing Healthcare Funds Are Buying Now
2025-02-20,Aristotle Focus Growth Q4 2024 Commentary,SeekingAlpha,"For Q4 2024, Aristotle Atlanticâs Focus Growth Composite posted a total return of 5.05% gross of fees, underperforming the 7.07% total return of the Russell 1000 Growth Index."
2025-02-21,"Stock Markets Are Wowed By China’s AI. Alibaba, DeepSeek, Others Remain Risky Bets and 5 Other Things to Know Today.",MarketWatch,"Stock Markets Are Wowed By China’s AI. Alibaba, DeepSeek, Others Remain Risky Bets and 5 Other Things to Know Today."
2025-02-24,Pfizer Hires Top FDA Official Just Weeks After She Leaves Agency,MarketWatch,Pfizer Hires Top FDA Official Just Weeks After She Leaves Agency
2025-02-24,Hims & Hers Declines - How The GLP-1 Market Shift Affects Growth,SeekingAlpha,"Hims & Hers plans to launch a generic version of liraglutide, but its efficacy is significantly lower than semaglutide. See why HIMS stock is a Hold."
2025-02-25,"Eli Lilly Introduces New Weight Loss Drug Doses, Lowers Price Points",MarketWatch,"Eli Lilly Introduces New Weight Loss Drug Doses, Lowers Price Points"
2025-02-25,Hartford Healthcare Fund Q4 2024 Commentary,SeekingAlpha,The Hartford Healthcare Fund (I share) underperformed the S&P Composite 1500 Health Care Index during the quarter. Read more here.
2025-02-25,Hims & Hers: Why This Q4 Earnings Dip Is A Buying Opportunity,SeekingAlpha,"Hims & Hers dipped 19% post-Q4 earnings. Read here for HIMS stocks growth trends, margin concerns, and why this could be a strong long-term buying opportunity."
2025-02-26,Mercks Oncology Strength: Beating Wall Street Again,SeekingAlpha,"Mercks Q4 2024 results surpassed expectations, driven by strong oncology sales and growth in Keytruda. See why I think MRK may work for income investors."
2025-02-27,Nvidia and Trump Tariffs Are Competing for Market’s Attention. Why AI Is Winning and 5 Other Things to Know Today.,MarketWatch,Nvidia and Trump Tariffs Are Competing for Market’s Attention. Why AI Is Winning and 5 Other Things to Know Today.
2025-02-28,Behind Hims Stocks Roller-Coaster Ride As Weight-Loss Drugs Battle Heats Up,DowJones,Behind Hims Stocks Roller-Coaster Ride As Weight-Loss Drugs Battle Heats Up
2025-03-05,Johnson & Johnson and 4 Other Biopharmaceutical Stocks That Might Be Ready to Break Out,MarketWatch,Johnson & Johnson and 4 Other Biopharmaceutical Stocks That Might Be Ready to Break Out
2025-03-06,Hims & Hers Stock Is Due for a Crash Diet. The Weight-Loss Drug Surge Is Fading Fast.,MarketWatch,Hims & Hers Stock Is Due for a Crash Diet. The Weight-Loss Drug Surge Is Fading Fast.
2025-03-06,Fidelity Fund Q4 2024 Review,SeekingAlpha,"For the three months ending December 31, 2024, the funds Retail Class shares gained 1.53%, versus the 2.41% result of the benchmark S&P 500Â® index. Read more here."
2025-03-07,ClearBridge Global Growth Strategy Q4 2024 Commentary,SeekingAlpha,"During the fourth quarter, the ClearBridge Global Growth Strategy outperformed its MSCI ACWI benchmark. Click here to read the full commentary."
2025-03-07,"In Rotten Market, Top Funds Harvest Apple Stock — And 10 Others",DowJones,"In Rotten Market, Top Funds Harvest Apple Stock — And 10 Others"
2025-03-08,Hims & Hers to shut down dermatology business Apostrophe,Finnhub,"Hims & Hers Health would discontinue Apostrophe, its personalized acne treatments dermatology business, the company said on Friday. Apostrophe is being shut down to simplify its ..."
2025-03-10,Lillys EBGLYSS single monthly maintenance injection achieved completely clear skin at three years in half of patients with moderate-to-severe atopic dermatitis,Finnhub,INDIANAPOLIS - New results show Eli Lilly and Companys EBGLYSS achieved deep and sustained response for patients with moderate-to-severe atopic dermatitis at three years.These findings from the...
2025-03-10,Novo Nordisk Stock Drops on New Obesity Drug Findings. Eli Lilly Stands to Gain.,MarketWatch,Novo Nordisk Stock Drops on New Obesity Drug Findings. Eli Lilly Stands to Gain.
2025-03-12,Roche takes big step in weight-loss field with $5.3 billion deal. Novo Nordisk shares fall.,MarketWatch,Roche takes big step in weight-loss field with $5.3 billion deal. Novo Nordisk shares fall.
2025-03-13,Roche Inks The Largest Obesity Deal To Date With Zealand Pharma At $5.3 Billion,Yahoo,Roche and Zealand Pharma inked a $5.3 billion deal Wednesday to collaborate on a weight-loss drug in the amylin class.
2025-03-14,"Novo Nordisk: Stock Plunges, But It May Be Time To Load Up",SeekingAlpha,"Novo Nordisk faces formidable challenges from Eli Lilly and new rivals, but its first-mover advantage and expanded manufacturing capacity remain strong. Read more on NVO stock here."
2025-03-15,"Teslas problems, Eli Lillys weight loss pill, and egg prices surge: Business news roundup",Yahoo,Eli Lilly (LLY) believes its experimental weight-loss pill could make GLP-1 treatments more accessible worldwide.
2025-03-19,Eli Lilly (LLY) Stock Moves -0.27%: What You Should Know,Yahoo,"Eli Lilly (LLY) concluded the recent trading session at $822.51, signifying a -0.27% move from its prior days close."
2025-03-19,Novo Nordisk A/S (NVO) Traded Lower Due To Investor Disappointment Over Its New Drug In Obesity,Yahoo,"Burke Wealth Management, an investment management company, released its “Focused Growth Strategy” fourth quarter 2024 investor letter. A copy of the letter can be downloaded here. The market had another outstanding year in 2024, with the S&P 500 rising 25.0%. The strategy had an even better year, with net returns of 28.4%. Looking a bit […]"
2025-03-19,Is Eli Lilly and Company (LLY) the Best Diabetes Stock to Buy According to Billionaires?,Yahoo,"We recently published a list of 10 Best Diabetes Stocks To Buy According to Billionaires. In this article, we are going to take a look at where Eli Lilly and Company (NYSE:LLY) stands against other best diabetes stocks to buy according to billionaires. The Growing Market and Innovation in Continuous Glucose Monitoring (CGM) Technology The […]"
2025-03-21,3 of Goldman Sachs best investing tips for currently volatile markets,Yahoo,"Volatile times in markets require precision, Goldman Sachs reminds investors."
2025-03-22,"Accenture reports Q2 beat, Apple TV+ losing $1B annually: Morning Buzz",Yahoo,"The major indexes were fractionally higher near noon, continuing yesterday’s rally after the Federal Reserve held its benchmark interest rate steady on Wednesday, though Chair Jerome Powell noted there is “high uncertainty” about the potential impact of the Trump administration’s policies. Some solid housing data also allayed some worries about the U.S. economy potentially approaching a recession. Looking to commodities, gold prices have surged to new record highs, surpassing the $3,000 per ounc"
2025-03-23,Is Eli Lilly and Company (LLY) The Best Robinhood Stock to Buy According to Analysts?,Yahoo,"We recently published a list of 8 Best Robinhood Stocks to Buy According to Analysts. In this article, we are going to take a look at where Eli Lilly and Company (NYSE:LLY) stands against other best Robinhood stocks to buy according to analysts. Morgan Stanley Wealth Management has announced quarterly retail investor pulse survey results. The […]"
2025-03-24,Was Jim Cramer Right About Eli Lilly and Company (LLY)?,Yahoo,"We recently published a list of Was Jim Cramer Right About These 23 Stocks? In this article, we are going to take a look at where Eli Lilly and Company (NYSE:LLY) stands against other stocks that Jim Cramer discussed 12 months ago. In the most recent Mad Money episode, Jim Cramer shared his thoughts on […]"
2025-03-24,"J&J to Invest $55B in United States to Boost Manufacturing, R&D",Yahoo,JNJ announces plans to invest more than $55 billion over the next four years to expand its manufacturing footprint in the United States.
2025-03-27,Eli Lilly and Company (LLY): One of Two Sigma Investments’ Top Stock Picks,Yahoo,"We recently published a list of Top 10 Stocks to Buy According to Two Sigma Investments. In this article, we are going to take a look at where Eli Lilly and Company (NYSE:LLY) stands against other top stocks to buy according to Two Sigma Investments. Two Sigma Investments, LP, a New York City-based hedge fund, […]"
2025-03-27,Beyond GLP-1 Drugs: This Opportunity at Eli Lilly Could Surprise Everyone in 2025,Yahoo,"Mounjaro and Zepbound are Eli Lillys largest sources of growth, but there is much more to the company."
2025-03-31,Hartford Large Cap Growth ETF Q4 2024 Commentary,SeekingAlpha,The Hartford Large Cap Growth ETF outperformed the Russell 1000 Growth Index during the quarter. Read more here.
2025-04-01,Is Eli Lilly and Company (LLY) the Best Gene-Editing Stock to Buy?,Yahoo,"We recently published a list of 8 Best Gene-Editing Stocks to Buy. In this article, we are going to take a look at where Eli Lilly and Company (NYSE:LLY) stands against other best gene-editing stocks to buy. Gene editing is an advanced medical technique within gene therapy that involves precisely modifying an individual’s DNA to […]"
2025-04-02,Hims Dives After Its Lilly-Rivaling Obesity Plan Faces An Unexpected Hitch,Yahoo,Hims stock reversed lower Wednesday as analysts laid out low expectations for Him & Hers branded tirzepatide.
2025-04-02,Compounding Problems: Recent Decisions On Tirzepatide Highlight Interplay Between FDA Anti-Compounding Enforcement And Private Intellectual Property Rights,Finnhub,"Earlier this month, a federal district court denied the Outsourcing Facilities Associations preliminary injunction motion, which sought to preclude FDA from taking enforcement action against..."
2025-04-02,Trumps Pharma Tariffs Could Blow Up Global Drug Supply Chains,Yahoo,A 25% levy is looming--and Big Pharmas billion-dollar operations in Europe may be on the chopping block.
2025-04-03,How to Boost Your Portfolio with Top Medical Stocks Set to Beat Earnings,Yahoo,Finding stocks expected to beat quarterly earnings estimates becomes an easier task with our Zacks Earnings ESP.
2025-04-05,"Jim Cramer on Eli Lilly (LLY) – “Own Eli Lilly, Going to a Trillion Dollars!”",Yahoo,"We recently published a list of Jim Cramer’s Take on These 10 Stocks. In this article, we are going to take a look at where Eli Lilly and Company (NYSE:LLY) stands against other stocks that Jim Cramer discusses. On Wednesday, Jim Cramer, the host of Mad Money, shared his concerns about President Donald Trump’s approach […]"
2025-04-07,"These Stocks Are Moving the Most Today: Apple, Tesla, GM, JPMorgan, Nvidia, MicroStrategy, Alibaba, Lilly, and More",Yahoo,"Shares of Apple and Tesla tumble as both get their price targets cut by a longtime Wall Street bull, while bank stocks such as JPMorgan Chase fall on fears of a global recession."
2025-04-09,Eli Lilly CEO David Ricks Just Delivered Terrible News to Investors: Should You Sell the Stock?,Yahoo,"As everyone who follows equity markets knows, stocks are feeling the heat from President Donald Trumps macroeconomic policies.  On April 3, the president announced sweeping tariffs on goods imported into the U.S. from basically every country on planet Earth.  One of them is the pharmaceutical industry."
2025-04-11,"Top Research Reports for Eli Lilly, American Express & Thermo Fisher",Yahoo,"Todays Research Daily features new research reports on 16 major stocks, including Eli Lilly and Company (LLY), American Express Company (AXP) and Thermo Fisher Scientific Inc. (TMO), as well as two micro-cap stocks, Steel Partners Holdings L.P. (SPLP) and Oil-Dri Corporation of America (ODC)."
2025-04-15,Novartis (NVS) Unleashes $23BN Strategic Investment Masterstroke,Yahoo,"European drugmaker Novartis (NVS), best known for blockbuster drugs like Entresto, Cosentyx, and Kesimpta, just announced a major U.S. investment. The $200 billion pharma company intends to invest $23 billion in U.S.-based manufacturing to conduct research and development and produce all its major drugs stateside. Judging by Novartis’ stock performance in the days following the news, the market signaled its approval. Donald Trump is likely to be delighted, too. Novartis’ latest move is a reactiv"
2025-04-15,This Cholesterol Gene Medicine Could Work in 1 Shot. It Could Also Bring This Biotech Stock Back to Life.,Yahoo,A Verve Therapeutics treatment was found to cut cholesterol levels by more than half—with just one shot. The stock jumped Monday.
2025-04-17,Lillys pill helps diabetes patients lose 7.9% weight in crucial study,Yahoo,"The results exceeded Wall Street targets and pushed the U.S. drugmakers shares up 11% in premarket trading, while dragging down rival Novo Nordisk and obesity drug developer Viking Therapeutics.  Several companies are developing weight-loss pills, encouraged by estimates that sales of obesity treatments could hit $150 billion in the coming years.  Lilly, which has started stockpiling supplies of the pill, said it planned to file by the end of this year with global regulators for approval."
2025-04-17,"Lilly weight-loss pill works as well as Ozempic, shares surge",Finnhub,"Eli Lillys experimental pill worked as well as blockbuster drug Ozempic to lower weight and blood sugar in a trial of diabetes patients, and the company said it expects to seek regulatory approvals..."
2025-04-22,Novo shares down on Eli Lilly’s positive obesity pill data,Yahoo,"Investing.com -- Novo Nordisk (NYSE:NVO) shares sank more than 7% in Copenhagen after Eli Lilly (NYSE:LLY) released promising trial results for its experimental obesity pill, orforglipron, which showed weight loss and blood sugar control comparable to injectable treatments like Ozempic."
2025-04-23,Forget Zepbound: Eli Lilly Has Its Next Billion-Dollar Weight Loss Drug,Yahoo,"Eli Lilly (NYSE: LLY) has been growing its sales at a good clip over the past year.  This is partly thanks to Zepbound, a weight loss medicine thats already generating more than $1 billion in quarterly sales, although it was approved only in late 2023.  Zepbounds prospects still look bright, but some recent developments point to another weight loss drug that could become yet another powerful growth driver for Lilly."
2025-04-25,This REIT’s 7% Dividend Yield Looks Solid,MarketWatch,This REIT’s 7% Dividend Yield Looks Solid
2025-04-26,"Microsoft, Apple Set To Report Earnings As Markets Watch Out For Core PCE Price Index",SeekingAlpha,"Tech giants MSFT, AAPL, META & AMZN are set to report earnings this week. Investors also look out for major economic indicators due on Friday. See an update here."
2025-04-26,How tariffs impact pharma stocks,Yahoo,"Most companies are likely going to feel the impact of President Trumps tariffs. In the video above, BofA Securities senior pharma & biotech analyst Tim Anderson describes how tariffs will impact the pharmaceutical stocks he covers. He also explains why Eli Lilly (LLY) and Novo Nordisk (NVO) have a moat around them. To watch more expert insights and analysis on the latest market action, check out more Market Domination here."
2025-04-26,Say goodbye to cheap versions of Ozempic and Wegovy,Yahoo,"This week in Ozempic news: No more compounded GLP-1s, weight-loss pills are coming, and WeightWatchers is filing for bankruptcy."
2025-04-29,"Wegovy Today, Ozempic Tomorrow: Partnership With Novo Is Hims & Hers Comeback",SeekingAlpha,"Hims & Hers Health, Inc. teams up with Novo Nordisk to offer Wegovy at $599/month, slashing costs. Click for why this is a game-changing deal for HIMS stock."
2025-04-29,Hims & Hers’ stock rockets after teaming up with its rival Wegovy maker,MarketWatch,Hims & Hers’ stock rockets after teaming up with its rival Wegovy maker
2025-04-29,Eli Lilly Stock Gets a Double Downgrade. Where Weight-Loss Drugs Go From Here.,Yahoo,"The lower rating came from HSBC, which cited too much optimism around its new weight-loss pill, and the strength of Novo Nordisk’s Ozempic ."
2025-04-30,Myostatin inhibitors target muscle loss prevention to fill gap in GLP-1RA market,Yahoo,"Companies are developing myostatin inhibitors for GLP-1RA- related muscle loss, but some experts doubt their necessity."
2025-05-01,Apple and Amazon.com headline earnings,MarketWatch,Apple and Amazon.com headline earnings
2025-05-01,Eli Lilly Lowers 2025 Earnings Outlook Despite Stronger-Than-Expected First-Quarter Results,Yahoo,Eli Lilly (LLY) slashed its full-year earnings outlook on Thursday due to acquisition-related charge
2025-05-01,Eli Lilly and : 2025 Earnings Presentation,Finnhub,ELI LILLY AND COMPANY Q1 2025 EARNINGS CALL ...
2025-05-01,"Eli Lilly downplays CVS move to drop Zepbound coverage, shares plunge",Finnhub,"Eli Lilly on Thursdaydownplayed CVS Healths decision to drop the companysobesity drug Zepbound from some lists of medicines it covers forreimbursement, but shares of the drugmaker still fell more..."
2025-05-01,Eli Lilly and Company (LLY) Q1 2025 Earnings Call Transcript,SeekingAlpha,"Eli Lilly and Company (NYSE:LLY) Q1 2025 Results Conference Call May 1, 2025 10:00 AM ETCompany ParticipantsMike Czapar - Senior Vice President of Investor..."
2025-05-07,Eli Lilly (NYSE:LLY) Declares US$1.50 Second Quarter Dividend For 2025,Yahoo,"Eli Lilly (NYSE:LLY) experienced an 11% share price increase over the past month, largely influenced by the affirmation of a $1.50 per share dividend declared for the second quarter. The announcement of Q1 earnings, showing significant revenue growth to $12,729 million, and promising results from the SURPASS-3 trial for tirzepatide, contributed to investor optimism. Despite the broader markets marginal fluctuations amid concerns over tariffs and Fed decisions, Eli Lillys strong earnings..."
2025-05-09,Wall Street Brings the Bitcoin-Versus-Gold Clash to ETF Masses,Yahoo,"(Bloomberg) -- The culture clash between Bitcoin enthusiasts and gold bugs is about to be played out in the world of exchange-traded funds.Most Read from BloombergIs Trump’s Plan to Reopen the Notorious Alcatraz Prison Realistic?As Trump Reshapes Housing Policy, Renters Face Rollback of RightsVail to Borrow Muni Debt to Ease Ski Resort Town Housing CrunchNYC Warns of 17% Drop in Foreign Tourists Due to Trump PoliciesWhat’s Behind the Rise in Serious Injuries on New York City’s Streets?Tidal Fina"
2025-05-12,Eli Lilly and Company Announces Zepbound (Tirzepatide) Showed Superior Weight Loss over Wegovy (Semaglutide) in Complete Surmount-5 Results Published in the New England Journal of Medicine,Finnhub,"Eli Lilly and Company announced detailed results from SURMOUNT-5, a Phase 3b open-label clinical trial, evaluating the safety and efficacy of Zepbound , a dual GIP and GLP-1 receptor agonist, compared..."
