date,headline,source,summary
2025-05-13,Eli Lilly (NYSE:LLY) Announces Superior Weight Loss Results for Zepbound Over Wegovy,Yahoo,"Eli Lilly (NYSE:LLY) recently announced the impressive results of its SURMOUNT-5 trial, highlighting Zepbounds efficacy over Wegovy in weight management. This promising development was disclosed alongside its participation at the European Congress on Obesity and publication in The New England Journal of Medicine. Despite these headline-grabbing results, Eli Lillys stock movement remained flat over the last month, aligning with broader market trends, which also showed little change. The..."
2025-05-13,"Eli Lilly (LLY): Buy, Sell, or Hold Post Q1 Earnings?",Yahoo,"Eli Lilly trades at $759 per share and has stayed right on track with the overall market, losing 6.5% over the last six months while the S&P 500 is down 2.4%. This was partly driven by its softer quarterly results and may have investors wondering how to approach the situation."
2025-05-14,BlackRock Health Sciences Opportunities Fund Q1 2025 Commentary,SeekingAlpha,"BlackRock Health Sciences Opportunities Fund posted returns of 3.66% (Institutional shares) and 3.60% (Investor A shares, without sales charge) for the first quarter of 2025."
2025-05-15,"Transcript : Eli Lilly and Company Presents at BofA Securities 2025 Healthcare Conference, May-15-2025 08",Finnhub,"Presenter SpeechUnknown Analyst [Audio Gap] Health U.S. and international roles and we have Mike Czapar, whos Senior Vice President, Investor Relations and back in this role, weve been out of"
2025-05-16,Novo Nordisk CEO steps down in surprise move as market challenges weigh on obesity drugmaker,Yahoo,Novo Nordisk CEO Lars Fruergaard Jørgensen steps down from the Danish drug giant.
2025-05-17,Why UnitedHealth Is Down 50% In A Month And What Happens Next,SeekingAlpha,"UnitedHealth Group faces real PBM reform risks, but legal paths, financials, and market pricing suggest opportunity in uncertainty. Read why UNH stock is a buy."
2025-05-19,Hartford Large Cap Growth ETF Q1 2025 Commentary,SeekingAlpha,The Hartford Large Cap Growth ETF underperformed the Russell 1000 Growth Index during the quarter. Read more here.
2025-05-19,"Judge shuts down drugmakers’ 340B rebate plans, for now",Yahoo,A district court ruled that the HHS does have the power to review drug manufacturers’ plans to pay hospitals rebates instead of upfront discounts on 340B medications. But it left the door open to the controversial reforms.
2025-05-21,Novo Nordisk Places Bet on CEO Shake-Up to Reclaim Edge in Weight Loss Drug Race,Yahoo,"As its obesity medication Wegovy loses a sizable portion of the market to Eli Lilly and Company (NYSE:LLY)’s competing medicine, Zepbound, the Danish pharmaceutical behemoth Novo Nordisk A/S (NYSE:NVO) abruptly announced the resignation of veteran CEO Lars Fruergaard Jørgensenm last week. The stock has dropped by over 49% in the past year, wiping out over […]"
2025-05-23,Lilly announces details of presentations at 2025 American Society of Clinical Oncology (ASCO) Annual Meeting,Yahoo,"Eli Lilly and Company (NYSE: LLY) today announced that data from studies of imlunestrant, an investigational oral selective estrogen receptor degrader (SERD), olomorasib, an investigational KRAS G12C inhibitor, LY4170156, an investigational antibody-drug conjugate (ADC) targeting folate receptor alpha (FRα) and Verzenio® (abemaciclib; a CDK4/6 inhibitor) will be presented at the 2025 American Society of Clinical Oncology (ASCO) Annual Meeting, taking place May 30 - June 3 in Chicago."
2025-05-23,Health Rounds: Researchers identify best drugs for severe COVID,Finnhub,"A class of drugs known as Januskinase, or JAK, inhibitors, which work by slowing down theimmune system, should be the first-line therapy for patientshospitalized for COVID-19, researchers reported..."
2025-05-26,The Next Big Theme: May 2025,SeekingAlpha,Big Tech players will collectively spend over $300 billion on AI-focused infrastructure this year to support the growing demands of AI development.
2025-05-27,Lilly to expand its pain pipeline with acquisition of SiteOne Therapeutics,Yahoo,"Eli Lilly and Company (NYSE: LLY) and SiteOne Therapeutics, Inc. (SiteOne), a private biotechnology company developing small molecule inhibitors of sodium channels to treat pain and other neuronal hyperexcitability disorders, today announced a definitive agreement for Lilly to acquire SiteOne."
2025-05-28,Eli Lilly vs. AstraZeneca: Which Pharma Powerhouse is the Better Buy?,Yahoo,"Lilly dominates GLP-1 market but faces near-term headwinds, while AstraZeneca boasts steady growth, rising estimates and a higher dividend yield."
2025-05-30,3 American Growth Giants to Invest in for the Long Haul,Yahoo,"All generate strong profit margins, which can help them weather a challenging economy.  Many of the best growth stocks in the world are based out of the U.S. This is the land of both opportunity and innovation.  Warren Buffett has always been bullish on betting on the U.S. because hes a big believer in American business."
2025-06-03,Top 50 High-Quality Dividend Stocks For June 2025,SeekingAlpha,"Track 50 top dividend growth stocks with daily valuation updates. Discover upgrades like Ferrari & Accenture, outperforming SPY & SCHD in 2023."
2025-06-04,1 Underrated Reason to Buy This Market-Beating Stock,Yahoo,"Eli Lilly recently acquired a smaller biotech for its promising investigational pain medication.  The company generates strong sales from products outside of diabetes and obesity care.  Eli Lillys portfolio, both within and outside its core area, makes the stock attractive."
2025-06-04,Prediction: Eli Lilly Will Reach a $1 Trillion Valuation by 2027,Yahoo,"Eli Lilly has been experiencing strong growth lately due to its impressive GLP-1 drugs.  Eli Lilly (NYSE: LLY) has been a growth beast over the years and is now easily the most valuable healthcare company in the world, with a market cap of more than $650 billion.  Eli Lilly is the most likely healthcare stock to reach a $1 trillion valuation, and I believe it could hit that plateau by 2027."
2025-06-09,The biggest obesity deals of 2025 so far,Yahoo,Three pharma giants are snapping up new assets to find stronger footing in the quickly shifting weight loss market.
2025-06-11,Hims & Hers stock falls after Lilly rules out partnership,Yahoo,"Investing.com -- Hims & Hers Health Inc (NYSE:HIMS) stock fell 3.8% Tuesday after Eli Lilly and Company (NYSE:LLY) indicated it would not partner with telehealth firms selling copycat versions of weight-loss drugs, effectively ruling out a potential deal with Hims."
2025-06-11,Update: Market Chatter: Lilly to Only Work With Telehealth Companies That Dont Sell Copycat Zepbound,Yahoo,(Updates with Eli Lillys response to a request for comment in the third paragraph.) Eli Lilly (L
2025-06-12,Eli Lilly (NYSE:LLY) Collaborates With Juvena To Enhance Muscle Health Through AI Technology,Yahoo,"Eli Lilly (NYSE:LLY) announced a significant global licensing and research collaboration with Juvena Therapeutics to explore AI-driven drug candidates for muscle health. This innovative move, alongside other significant developments like the Cialis acquisition in Latin America, underscores the companys commitment to expanding its product portfolio and reaching new markets. Over the past month, Eli Lillys stock rose by nearly 10%, a performance that aligns with the broader upward trend of..."
2025-06-12,Promising Results Of Amylin Analogs In Obesity: Metsera Case Review,SeekingAlpha,"Metsera is advancing promising obesity treatments with amylin and GLP-1 analogs, eyeing competitive efficacy and buyout potential. Read why MTSR stock is a hold."
2025-06-14,Eli Lillys experimental obesity drug shows over 11% weight loss in early trial,Finnhub,"Eli Lillys experimentalobesity drug, eloralintide, helped some patients lose 11.5% oftheir body weight at 12 weeks in an early-stage study, aninvestor note by brokerage Cantor Fitzgerald showed on..."
2025-06-14,"Novo Nordisk Is Europe’s Most Valuable Company—Again. Eli Lilly, Watch Out.",Yahoo,"Novo Nordisk  the maker of Ozempic and Wegovy weight-loss drugs, just regained the title as Europe’s most valuable company after a year of decline that ultimately led to the firing of its CEO last month.  Novo’s market capitalization is now $367 billion, pushing it above German software giant  SAP’s  $363 billion.  On Friday, Novo stock was up as much as 2% in Denmark."
2025-06-17,Eli Lilly (LLY) Stock Dips While Market Gains: Key Facts,Yahoo,"In the closing of the recent trading day, Eli Lilly (LLY) stood at $807.58, denoting a -1.44% move from the preceding trading day."
2025-06-17,Why Novo Nordisk Stock Sank by Nearly 4% Today,Yahoo,"On top of that, an analyst cut his price target on the Denmark-based pharmaceutical company.  Novo Nordisk (NYSE: NVO) stock had a Monday to forget, as news from a top rival dampened sentiment on the Danish pharmaceutical company.  A price target cut from an analyst tracking the company only exacerbated the situation."
2025-06-18,"US judge upholds FDAs removal of Ozempic, Wegovy from drug shortage list",Finnhub,"A federal judge has rejected a bid by compounding pharmacies to allow them to continue making copies of Novo Nordisks blockbuster weight-loss drugs Ozempic and Wegovy, upholding the U.S. Food and..."
2025-06-21,Lilly expects orforglipron obesity results in third quarter,Yahoo,"(Reuters) -Eli Lilly said on Saturday its experimental pill orforglipron helped diabetics lose weight and lower their blood sugar, and the company aims to announce in the third quarter trial results for the drug in overweight and obese people without diabetes.  Lilly expects to submit the non-diabetes Phase 3 data to global regulatory agencies by the end of the year, said Ken Custer, head of cardiometabolic health at the company.  Lilly said it plans to file for regulatory approvals for orforglipron as a diabetes treatment in 2026."
2025-06-21,Crispr Therapeutics: Face The Harsh Reality Instead Of Waiting (Rating Downgrade),SeekingAlpha,"Crispr investors have had a year to put aside so far, with the stock down 25%. Read more on CRSPs execution risks, high valuation, and speculative pipeline raise concerns."
2025-06-24,HIMS Stock Crashes 30% in a Day: Time to Buy the Dip?,Yahoo,Hims & Hers stock crashes 30% on Monday after news of Novo Nordisk ending their partnership. Is HIMS now a compelling stock to buy?
2025-06-24,Eli Lilly seeks green light for weekly insulin after strong trial results,Yahoo,"While still an injectable, once-weekly dosing offers a simpler treatment regimen for patients."
2025-06-25,Victory RS Global Fund Q1 2025 Commentary,SeekingAlpha,"The Victory RS Global Fund returned -4.75% (Class A Shares at net asset value) for the period, while its benchmark, the MSCI All Country World Index (net), returned - 1.32%."
2025-06-25,"United States Insulin Pens Market Research Report 2025-2033, Advances in Technology, Favorable Reimbursement Policies, Increasing Awareness and Adoption",Yahoo,"The U.S. insulin pen market is set to grow from USD 4.2 billion in 2024 to USD 8.1 billion by 2033 at a 6.9% CAGR. Key growth drivers include advanced technology, increased awareness, and favorable reimbursement policies. Major players: Eli Lilly, Sanofi, Glooko, Medtronic, Novo Nordisk, Owen Mumford. U.S. Insulin Pens Market U.S. Insulin Pens Market Dublin, June 25, 2025 (GLOBE NEWSWIRE) -- The United States Insulin Pens Market Size, Insights, Competitive Landscape, and Forecast, 2025 - 2033"
2025-06-25,Essential Pharma strengthens Board with the appointment of Nicola Heffron as Non-Executive Director,Yahoo,"Essential Pharma strengthens Board with the appointment of Nicola Heffron as Non-Executive Director Egham, UK – 25 June 2025 – Essential Pharma (“Essential” or “the Company”), a global pharmaceutical company developing and delivering medicines for patients in niche populations, today announces the appointment of Nicola Heffron as a Non-Executive Director with immediate effect. Nicola has over 25 years of experience across the pharmaceutical and biotech industries, with a focus on rare diseases a"
2025-06-26,Eli Lilly: FDA expands Amyvid indication in the US,Finnhub,"Eli Lilly announces that the Food and Drug Administration has approved updated labeling for Amyvid , an injectable agent used in brain imaging to estimate the density of amyloid plaques in patients..."
2025-06-26,VKTX Initiates Phase 3 Study on Obesity Candidate VK2735,Yahoo,"Viking begins phase III VANQUISH program for VK2735, targeting weight loss in obese adults with or without type II diabetes."
2025-06-29,This Dirt Cheap Healthcare Stock Could Be a Hidden Artificial Intelligence (AI) Opportunity (Hint: Its Not Eli Lilly),Yahoo,Artificial intelligence (AI) has the potential to transform several different areas of the healthcare industry.
2025-07-02,Will AbbVies Acquisition Spree Aid Pipeline Growth?,Yahoo,ABBVs $2.1 billion Capstan deal and 20+ recent acquisitions sharpen its pipeline edge across immunology and beyond.
2025-07-03,Pfizer Trades Above 50-Day Average for a Month: Time to Buy?,Yahoo,"PFE trades above its 50-day average for over a month, signaling bullish momentum despite COVID revenue declines and patent risks."
2025-07-04,Lilly and Novo Are the Kings of Weight-Loss Drugs. The Companies Coming for Their Crowns.,Yahoo,"Both well-established and small, clinical-stage pharma companies are investing heavily to be able to someday compete with Lilly and Novo."
2025-07-07,Intellia Gains 29.8% in a Month: How Should You Play the Stock?,Yahoo,"NTLA stock surges 29.8% in a month, driven by gene therapy pipeline progress and growing investor attention."
2025-07-09,Eli Lilly (LLY) Announced Results for its Once-Weekly Insulin,Yahoo,"Eli Lilly and Company (NYSE:LLY) is one of the 10 Best Non-Tech Stocks to Buy and Hold For 3 Years. On June 22, Eli Lilly and Company (NYSE:LLY) announced new results for its once-weekly insulin, Efsitora alfa. The drug is being tested for adults with type 2 diabetes. The company released results for QWINT-1, QWINT-3, and […]"
2025-07-10,Big Pharma on the Clock as 200% Tariffs Loom,Yahoo,Drugmakers could get an 18-month window to boost U.S. factories or face massive import levies
2025-07-10,Eli Lilly (LLY) Beats Stock Market Upswing: What Investors Need to Know,Yahoo,"In the most recent trading session, Eli Lilly (LLY) closed at $786.92, indicating a +1.19% shift from the previous trading day."
2025-07-13,"Eli Lilly and Company (LLY): I Would “Love” If Trump Praised The Company, Says Jim Cramer",Yahoo,"We recently published 14 Stocks Jim Cramer Discussed As He Talked About Record Bitcoin Price. Eli Lilly and Company (NYSE:LLY) is one of the stocks Jim Cramer recently discussed. Eli Lilly and Company (NYSE:LLY) is one of the most frequently discussed pharmaceutical stocks on Cramer’s morning show. Over the course of this year, the CNBC […]"
2025-07-14,Obesity Drug Pipeline Analysis Report 2025 | Pfizer and Eli Lilly Lead the Charge in Cutting-Edge Obesity Research,Yahoo,"In 2022, over 1 billion people were affected by obesity, driving innovation in therapeutic advancements. Emerging treatments focus on appetite control and metabolic pathways, with pharmaceutical support bolstering development. The 2025 Obesity Drug Pipeline Report offers insights into recent breakthroughs, clinical trials, and regulatory trends, highlighting the shift toward personalized therapies and novel drug classes like peptides and RNA-based treatments. Key players include Pfizer and Eli L"
2025-07-14,"ProKidney Just Set a New 52-Week High. Should You Buy, Sell, or Hold PROK Stock Here?",Yahoo,"As ProKidney hits a fresh 52-week high, can it sustain momentum through late-stage trials, or should investors stay cautious amid the market’s mixed view?"
2025-07-15,Amgen: Great Starting Yield For This Wealth Compounder,SeekingAlpha,"Amgen combines patent protection, a robust pipeline, and strong execution for defensive investment."
2025-07-16,Tariffs Are Showing Up in Inflation. Why Trump Can’t Afford to Ditch Powell.,Yahoo,"House deals a blow to “Crypto Week,” ASML warns on 2026 growth, a promising Chinese weight-loss drug, and more news to start your day."
2025-07-23,Earnings Preview: What to Expect From Eli Lillys Report,Yahoo,"Eli Lilly is expected to release its fiscal second-quarter earnings next month, and analysts project a double-digit profit growth."
2025-07-23,Eli Lilly Advances Pipeline and Gene Focus With Verve Acquisition,Yahoo,"Eli Lilly and Company (NYSE:LLY) is one of the 13 Best Low Risk High Growth Stocks to Buy. Amid carrying on new studies, the company has agreed to acquire Verve Therapeutics. Eli Lilly and Company (NYSE:LLY) is a research-driven pharmaceutical leader headquartered in Indiana. With a 150-year history, the company carries on the business of […]"
2025-07-24,"West Pharma soars on profit forecast raise, lowered tariff impact estimate",Yahoo,"(Reuters) -West Pharmaceutical raised its annual profit forecast and trimmed its estimates for tariff impact on Thursday, sending the medical equipment makers shares up 24% in early trading.  West Pharma is deploying every available mitigation lever to offset the impact, but has not factored any potential tariffs related to future customer revenues into its current outlook, executives said in a call with analysts.  West Pharmas products are used by major pharmaceutical firms, including Eli Lilly and Novo Nordisk, in the administration of a wide range of therapies."
2025-07-25,Eli Lilly Wins CHMP Backing of Kisunla Alzheimers Drug,MarketWatch,Eli Lilly Wins CHMP Backing of Kisunla Alzheimers Drug
2025-07-27,Eli Lilly (LLY) Gains CHMP Approval for Donanemab in Alzheimers Treatment,Yahoo,"Eli Lilly (LLY) recently received a positive opinion from the Committee for Medicinal Products for Human Use (CHMP) for its Alzheimers drug donanemab, underscoring the companys advancements in a crucial therapeutic area. During the same period, LLY registered a 5% share price increase, notably outpacing the broader markets 1% rise over the past week. This uptrend in LLYs stock could be attributed to investors optimism about donanemabs potential impact. Additionally, the companys..."
2025-07-29,Eli Lilly and Company (LLY) Announces New Phase 3 Trial Results for Orforglipron,Yahoo,"Eli Lilly and Company (NYSE:LLY) is one of the Stocks With Huge Catalysts on the Horizon. On July 21, Eli Lilly and Company (NYSE:LLY) announced new Phase 3 trial results for Orforglipron, which is an oral drug for adults with type 2 diabetes. This comes as a breakthrough for the company as Orforglipron is the first […]"
2025-07-29,INCYs Q2 Earnings & Revenues Beat Estimates on Higher Product Sales,Yahoo,"Incyte reports better-than-expected second-quarter 2025 results, beating both earnings and revenue estimates, driven by strong Jakafi and Opzelura sales."
2025-07-30,Eli Lilly (LLY) Announces Positive Results For Jaypirca In Phase 3 Trial,Yahoo,"Eli Lilly (LLY) made headlines with positive results from the Phase 3 BRUIN CLL-314 clinical trial for Jaypirca, marking a significant advancement in treatment options for chronic lymphocytic leukemia. The companys 6% share price increase over the past week may have been influenced by investor optimism surrounding these findings, aligning with general market trends which saw the S&P 500 and Nasdaq reach new highs. While broader market dynamics favor strong corporate earnings and positive..."
2025-07-31,Eli Lilly Weight-Loss Drug Makes Cardio Advance. More Bad News for Novo Nordisk.,Yahoo,A Lilly study showed Mounjaro resulted in a lower risk of heart attacks and strokes in patients with diabetes compared with the older drug Trulicity.
2025-07-31,Eli Lilly (LLY) Reports Next Week: Wall Street Expects Earnings Growth,Yahoo,Lilly (LLY) possesses the right combination of the two key ingredients for a likely earnings beat in its upcoming report. Get prepared with the key expectations.
2025-07-31,"CVS Health Corporation (CVS) Is A Key Part Of Weight Loss Drug Distribution, Says Jim Cramer",Yahoo,We recently published 10 Stocks That Jim Cramer Talked About. CVS Health Corporation (NYSE:CVS) is one of the stocks Jim Cramer recently discussed. CVS Health Corporation (NYSE:CVS) is one of the largest pharmaceutical retailers in America. The shares have gained 36% year-to-date as the firm has enjoyed tailwinds from the struggles of its rival Walgreens. […]
2025-08-01,Trump pressures 17 pharma CEOs to cut US drug prices,Yahoo,"WASHINGTON (Reuters) -President Donald Trump sent letters to the leaders of 17 major pharmaceutical companies outlining how they should slash U.S. prescription drug prices to match those paid overseas, the White House said on Thursday.  Trump signed a sweeping executive order in May demanding drugmakers cut U.S. medicine prices to match those abroad, saying that if companies did not comply, the government could use rulemaking to bring prices down or pursue other measures, such as importing cheaper medicines from overseas.  Trump sent the letters to the chief executives of Eli Lilly, Sanofi, Regeneron, Merck & Co, Johnson & Johnson, and AstraZeneca, among others, the White House said."
2025-08-01,3 Dividend Healthcare Stocks to Buy Hand Over Fist Before They Double,Yahoo,These pharmaceutical giants are well worth a second look.
2025-08-04,"Tariff latest, Rate cuts and big earnings: Three Things",Yahoo,"Join Ramzan Karmali as he opens up the week with the three things you need to know ahead of US market open, taking a look at the impact of the damaging US jobs report, the Fed Reserve rates debate and upcoming earnings from major companies such as Palantir (PLTR), Disney (DIS) and Eli Lilly (LLY)."
2025-08-04,"Should You Buy, Sell or Hold Lilly Stock Ahead of Q2 Earnings?",Yahoo,"LLY eyes Q2 growth on Mounjaro and Zepbound momentum, but pricing pressure and rising competition test its edge."
2025-08-05,Novo Nordisk Stock Catches a Downgrade. The Eli Lilly Threat Is Just One Reason.,Yahoo,"Novo Nordisk stock was downgraded to Neutral from Buy by UBS analysts, who cited the threat posed by its U.S. rival."
2025-08-05,GLP-1 War: A Look At The Epic Pipeline Battle Between Novo Nordisk And Eli Lilly,SeekingAlpha,"Novo Nordisk remains a strong buy despite share price dip, thanks to its robust drug pipeline, massive market potential, and compelling long-term growth..."
2025-08-06,Novo Nordisk Stock Is Dropping After Earnings. It Got Worse.,Yahoo,The drugmaker released its second-quarter earnings report early Wednesday as it vowed to cut costs amid intensifying competition and a cratering stock price.
2025-08-06,Healthcare Stocks Have Been Beaten Up. The Case for Buying Now.,MarketWatch,Healthcare Stocks Have Been Beaten Up. The Case for Buying Now.
2025-08-07,ProQR Announces Second Quarter 2025 Operating and Financial Results,Yahoo,"Submitted CTA for lead program AX-0810, targeting NTCP for cholestatic diseasesAdvancing AX-2402 program toward clinical candidate selection, targeting MECP2 (R270X) for Rett SyndromeHosting fall Analyst and Investor Event (virtual), featuring detailed AX-0810 Phase 1 trial design and 2025 data expectations, plus updates across differentiated liver and CNS pipeline€ 119.8 million cash and cash equivalents as of end Q2 – providing runway into mid-2027, not including additional potential milestone"
2025-08-08,"Wall Street Wavers as Tariffs Take Effect, Earnings Cycle Continues",Yahoo,"Equities closed mixed Thursday as President Donald Trumps new tariffs took effect, while traders pa"
2025-08-08,Tariffs Be Damned. Stocks Flirt With a New Record High.,MarketWatch,Tariffs Be Damned. Stocks Flirt With a New Record High.
2025-08-09,Eli Lilly (LLY) Sees Revenue Surge With Innovative Treatments And Raised Earnings Guidance,Yahoo,"Eli Lilly (LLY) has recently launched SenderraCare+, a digital solution paired with its biologic treatment EBGLYSS, and announced positive outcomes from a Phase 3 trial for the weight management drug orforglipron. Despite these advancements, the companys stock fell 13% in the last quarter. The sharp price drop contrasts with a generally rising market environment, marked by gains in major indexes and record highs for gold. This decline could be weighed by legal challenges, despite robust..."
2025-08-13,Texas sues Eli Lilly for allegedly bribing providers to prescribe its medications,Yahoo,"WASHINGTON (Reuters) -Texas Attorney General Ken Paxton on Tuesday sued U.S. drugmaker Eli Lilly for allegedly bribing providers to prescribe its medications.  The attorney generals office said in a statement that the company bribed and illegally induced medical providers to prescribe its most profitable drugs, including the GLP-1 medications Mounjaro and Zepbound, used for weight loss and diabetes treatment.  Big Pharma compromised medical decision-making by engaging in an illegal kickback scheme, Attorney General Paxton said."
2025-08-14,4 trends among retail investors according to Robinhoods CIO,Yahoo,"Institutional investors are feeling more bullish, but where does overall retail investor sentiment sit? Robinhoods (HOOD) chief investment officer, Stephanie Guild, joins Market Domination to share some of the key trends shes noticed among retail traders, including Nvidia (NVDA) and Tesla (TSLA) being the most common stocks traded by bears and bulls alike. To watch more expert insights and analysis on the latest market action, check out more Market Domination."
