date,headline,source,summary
2025-05-02,Here’s what Wall Street is saying about Amazon ahead of earnings,Yahoo,"Amazon (AMZN) is scheduled to report results for its first quarter of 2025 after the market close on Thursday, May 1, with a conference call scheduled for 5:00 pm ET. Here’s what to watch for: EXPECTATIONS: During the company’s last earnings call, Amazon said it saw Q1 revenue $151.0B-$155.5B, and Q1 net sales between $151.0B and $155.5B, or to grow between 5% and 9% compared with the first quarter 2024. “This guidance anticipates an unusually large, unfavorable impact of approximately $2.1B, or"
2025-05-02,Judge in Meta case warns AI could obliterate market for original works,Finnhub,A skeptical federal judge in SanFrancisco on Thursday questioned Meta Platformsargument that it can legally use copyrighted works withoutpermission to train its artificial intelligence models. ...
2025-05-02,"Dow Jones Futures Rise As China Says Its Evaluating U.S. Trade Talks. Amazon, Apple Fall On Earnings.",DowJones,"Dow Jones Futures Rise As China Says Its Evaluating U.S. Trade Talks. Amazon, Apple Fall On Earnings."
2025-05-02,Roku Stock Drops as Outlook Raises Worry About Ad Spending,MarketWatch,Roku Stock Drops as Outlook Raises Worry About Ad Spending
2025-05-03,US exceptionalism trade is still in play: May investing tips,Yahoo,"Markets (^GSPC, ^IXIC, ^DJI) are shifting as investors weigh hot labor data and lingering inflation against long-term growth strategies. Andrew Briggs, CFP and Wealth Advisor at Steward Partners, shares why staying invested and reassessing exposure to the Magnificent Seven — the group of tech stocks comprised of Alphabet (GOOG, GOOGL), Apple (AAPL), Nvidia (NVDA), Tesla (TSLA), Amazon (AMZN), Meta Platforms (META), and Microsoft (MSFT) — may be key in navigating today’s uncertainty. To watch more expert insights and analysis on the latest market action, check out more Wealth here."
2025-05-05,"The influencer election that wasnt: amid Trump trauma, Australian voters logged off",Finnhub,"When Australian podcast hostNigel Marsh booked Prime Minister Anthony Albanese for aninterview on his show, Five of My Life, he expected a surge oflisteners due to his guests high profile and the..."
2025-05-06,Dont Get Caught In The Bull Trap,SeekingAlpha,"Understand market fundamentals, technical analysis, and Fed policy which impact the current market rally on SPX and Magnificent Seven. Read why Im not on-board with the stock upsurge."
2025-05-06,Baron Fifth Avenue Growth Fund Q1 2025 Shareholder Letter,SeekingAlpha,"Baron Fifth Avenue Growth Fund declined during the first quarter of 2025, underperforming its benchmark, the Russell 1000 Growth Index. Read more here."
2025-05-06,Meta’s AI Chatbot Reawakens Concerns About Data Tracking,Yahoo,Personalization generally comes at the cost of privacy.
2025-05-06,User Engagement & AI Fuel Blockbuster Q1 Results for META Platforms Stock,Yahoo,"I’ve been pounding the table on Meta Platforms (META) for years, writing several articles about why it’s a screaming buy. Following the stock’s steep sell-off last month as tariff-driven fears overwhelmed the market, I took advantage of the situation and continued adding to my long META position. Buying the dip was a great idea, as the social media giant’s Q1 earnings blew the doors off expectations last week, forcing analysts to scramble and reprice the stock. Yet, the core story hasn’t changed"
2025-05-06,Meta: Bull Case Remains Intact After Q1 Earnings,SeekingAlpha,"Metas AI investment signals growth, while ad recovery hinges on U.S.-China talks. Click here to find out why I rate META stock a Strong Buy."
2025-05-07,Zero In On Top-Rated Stocks And Hot IPOs. Heres How.,Yahoo,Use the IBD Stock Screener to quickly filter through thousands of companies to find stocks that meet your criteria.
2025-05-08,Stock Market Pain Tied To Tariff-Induced Volatility Has Just Begun,DowJones,Stock Market Pain Tied To Tariff-Induced Volatility Has Just Begun
2025-05-08,Recent Moves By Meta Stock Make A Bull Put Spread One Key Option,Yahoo,"A bull put spread is a defined risk strategy, so you always know the worst-case scenario in advance."
2025-05-08,US needs unified approach on AI companies competing with China,Yahoo,"American AI executives are speaking before lawmakers on Capitol Hill on Thursday about how the US can keep a competitive advantage against China. Among the CEOs include OpenAI CEO Sam Altman and Advanced Micro Devices (AMD) CEO Lisa Su. Chamber of Progress Founder and CEO Adam Kovacevich comes on Catalysts to speak more about how the second Trump administrations Federal Trade Commission (FTC) is approaching antitrust cases in Big Tech and the ongoing AI arms race with China. Additionally, Alphabet (GOOG, GOOGL) shares are slowly crawling back in Thursdays trading session after falling off yesterday on headlines that Apple (AAPL) plans to integrate AI search features into its Safari web browser, according to Apple senior vice president of services Eddy Cues testimony to US Department of Justice (DOJ) officials. To watch more expert insights and analysis on the latest market action, check out more Catalysts here."
2025-05-09,Metas AI Power Play: The Mastermind Returns to Shake Up the Game,Yahoo,Why Metas Strategic AI Play Could Be the Ultimate Power Move Against Alphabet and OpenAI
2025-05-09,Tell-all says Facebook used sinister tactics on vulnerable group,Yahoo,Whistleblower alleges that the social media giant exploited users emotions.
2025-05-10,Jim Cramer on Meta’s $72 Billion CapEx Forecast: Bold or Risky?,Yahoo,"We recently published a list of 10 Jim Cramer Stocks to Watch as US-China Prepare to Begin Talks. In this article, we are going to take a look at where Meta Platforms, Inc. (NASDAQ:META) stands against other stocks that Jim Cramer discussed. The optimism over US-China trade talks is increasing as the US Treasury Secretary […]"
2025-05-10,Cathie Wood Goes Bargain Hunting. 1 Dirt Cheap Artificial Intelligence (AI) Chip Stock She Just Bought (Hint: Its Not Nvidia),Yahoo,Cathie Wood has quietly been building a position in one of Nvidias chief rivals in the chip space.
2025-05-10,30 AI stocks that could surge up to 73% — and are loved by a bullish tech analyst,MarketWatch,30 AI stocks that could surge up to 73% — and are loved by a bullish tech analyst
2025-05-11,Invesco Global Core Equity Fund Q1 2025 Commentary,SeekingAlpha,Optimism that followed President Trumpâs election has given way to fear and uncertainty. Read more here.
2025-05-11,Invesco Summit Fund Q1 2025 Commentary,SeekingAlpha,"Equity markets reacted to uncertainty caused by tariff policy, US government upheaval and concerns about overspending on artificial intelligence."
2025-05-13,Tracking David Abrams Abrams Capital Management Portfolio - Q1 2025 Update,SeekingAlpha,"David Abrams Q3 portfolio highlights: reduced Meta & Energy Transfer, increased Lithia Motors & Somnigroup. Loar Holdings leads at 47%. See more here."
2025-05-15,BlackRock Large Cap Focus Growth Fund Q1 2025 Commentary,SeekingAlpha,"The fund posted returns ofÂ -10.98%Â (Institutional shares) andÂ -10.98%Â (Investor A shares, without sales charge) for the first quarter of 2025."
2025-05-15,"Silicon Valleys conference season kicks off amid AI, tariff trepidation",Yahoo,"Big Tech is gearing up for its annual conference season, with AI and chips top of mind."
2025-05-16,Meta’s Key AI Model Hit by Delay. What It Means for the Stock.,Yahoo,The stock fell 2.4% Thursday following a report that the Facebook parent is delaying its Behemoth AI model launch.
2025-05-16,Meta wants a judge to dismiss the FTCs antitrust case against it,Yahoo,"Meta (META) has filed a motion for judgment to wrap up its antitrust trial, claiming it doesn’t want to spend more of anyone’s time or money. Facebook’s parent company claims that the Federal Trade Commission has not provided any evidence of unlawful monopoly. If granted, the motion would end the trial."
2025-05-19,This could be another market surprise after the Moodys US credit rating downgrade,Yahoo,Why this veteran forecaster is worried about the outlook for corporate profits.
2025-05-21,Should You Forget Palantir Technologies and Buy These 3 Artificial Intelligence (AI) Stocks Right Now?,Yahoo,The red-hot AI software stock may not be the best place to park your money today. Here are some outstanding alternatives to consider.
2025-05-22,Magnificent 7 Shareholder Meetings On Tap: Taking Stock Of The Economy,SeekingAlpha,Major tech-related companies host Annual General Meetings in the weeks ahead.
2025-05-22,Arista Networks Poised For Durable Growth On Increased Capital Spend,SeekingAlpha,Arista Networks is poised for durable growth with robust hyperscaler capital spending and AI infrastructure investments. See why ANET stock is a strong buy.
2025-05-23,‘Tariff Man’ Is in a Bad Mood Ahead of the Memorial Day Weekend,MarketWatch,‘Tariff Man’ Is in a Bad Mood Ahead of the Memorial Day Weekend
2025-05-26,3 Top Growth Stocks to Buy in the Second Half of 2025,Yahoo,"Amazon could hold up better than many expect if steep tariffs remain in place.  Meta Platforms should benefit from multiple AI tailwinds.  Vertex Pharmaceuticals has two new drugs on the market, with more potentially on the way."
2025-05-27,Dow Jones Jumps 400 Points On Trump Tariff News; Nvidia Stock Eyes New Buy Point,DowJones,Dow Jones Jumps 400 Points On Trump Tariff News; Nvidia Stock Eyes New Buy Point
2025-05-27,"Billionaire Ole Andreas Halvorsen Just Bought Nvidia, Tesla, and Meta Platforms, but Dumped His Entire Stake in the Cheapest Magnificent Seven Stock",Yahoo,Viking Global Investors billionaire chief sold the most fundamentally attractive member of the Magnificent Seven in favor of a trio of foundational artificial intelligence (AI) stocks.
2025-05-29,"Billionaires Philippe Laffont, Chase Coleman, Terry Smith, and Stephen Mandel All Share the Same No. 1 Holding -- and Its Not Nvidia",Yahoo,"This Magnificent stock that all four prominent billionaires have as their top holding has surged 1,570% since its initial public offering."
2025-05-29,Apple is falling behind its Magnificent 7 rivals. Should it just be the Mag 6?,Yahoo,"The “Magnificent Seven” tech stocks led the market’s post-pandemic boom. But as Big Tech sprints into the AI future, one big name is falling dangerously behind: Apple (AAPL). Once an undisputed tech heavyweight, it risks becoming the least magnificent of them all."
2025-05-30,Meta Platforms Inc Declares Quarterly Cash Dividend Of $0.525 Per Share,Finnhub,Meta Platforms Inc: * META PLATFORMS INC - DECLARES QUARTERLY CASH DIVIDEND OF$0.525PER SHARESource text:Further company coverage: ...
2025-05-30,German digital ministry treads cautiously over online platform levy,Finnhub,"Germanys new digitalministry said any levy on online platforms would have to beinternationally coordinated and not result in higher prices forend consumers, in a sign on Friday of possible..."
2025-05-30,Weitz Partners III Opportunity Fund Q1 2025 Commentary,SeekingAlpha,"The Partners III Opportunity Fundâs Institutional Class returned -0.45% for the first quarter of 2025, comparing favorably to the Russell 3000 Indexâs return of -4.72%."
2025-05-30,Famous Investor Remains Very Upbeat on META Platforms (META),Yahoo,"Meta Platforms, Inc. (NASDAQ:META) and its CEO, Mark Zuckerberg, are “delivering” and “executing,” while the tech giant’s “fundamentals” are strong, Stephanie Link, who frequently appears on CNBC, said on the channel recently. Link is the Chief Investment Strategist at Hightower Advisors. Meta Platforms, Inc. (NASDAQ:META) Reported “Great” Q1 Results, Link Says The advertising behemoth delivered […]"
2025-05-30,Meta: Seamless Integration Of AI Services Can Change The Game,SeekingAlpha,"Discover how Metas AI investments drive ad growth, new monetization channels, and market leadership amid challenges. Click here to read my most recent analysis."
2025-06-01,Big Tech Is Back in S&P 500 Driver’s Seat as Profit Engines Hum,Yahoo,"(Bloomberg) -- The same technology giants that helped drag the S&P 500 to the brink of a bear market in April are giving the recovery in US equities some legs.Most Read from BloombergBillionaire Steve Cohen Wants NY to Expand Taxpayer-Backed FerryWhere the Wild Children’s Museums AreNow With Colorful Blocks, Tirana’s Pyramid Represents a Changing AlbaniaThe Economic Benefits of Paying Workers to MoveNYC Congestion Toll Brings In $216 Million in First Four MonthsNvidia Corp. put a bow on a better"
2025-06-02,Meta Aims to Fully Automate Ad Creation Using AI,Yahoo,Advertising powered by artificial intelligence is a core part of Chief Executive Mark Zuckerberg’s vision for the company’s future.
2025-06-03,Metas Oversight Board Overturned Meta In Three Out Of Four Cases Related To Images Of Partially Nude Indigenous Women,Finnhub,METAS OVERSIGHT BOARD: * METAS OVERSIGHT BOARD: OVERTURNED META IN THREE OUT OFFOURCASES RELATED TO IMAGES OF PARTIALLY NUDE INDIGENOUS WOMEN * METAS OVERSIGHT BOARD:...
2025-06-04,"Microsoft cuts hundreds of jobs after firing 6,000 in May",Yahoo,"(Bloomberg) -- Microsoft Corp. cut hundreds more jobs just weeks after its largest layoff in years, underscoring the tech industry’s efforts to trim costs even as it plows billions of dollars into artificial intelligence.Most Read from BloombergWhere the Wild Children’s Museums AreBillionaire Steve Cohen Wants NY to Expand Taxpayer-Backed FerryAt London’s New Design Museum, Visitors Get Hands-On AccessLA City Council Passes Budget That Trims Police, Fire SpendingThe Global Struggle to Build Safe"
2025-06-04,Why Venture Global Rocketed Higher Today,Yahoo,"Venture Global announced it had commenced work on its third LNG export facility.  In addition, a big nuclear energy deal signed today by Meta Platforms indicates strong electricity demand for AI data centers, with natural gas to also be part of the solution.  Shares of LNG export company Venture Global (NYSE: VG) rallied 18.7% on Tuesday, as of 12:56 p.m. ET."
2025-06-04,Communication-Services Companies Retreat -- Communications-Services Roundup,Finnhub,"The communications-services sector finished lower on Tuesday, dropping amid losses for heavyweights Alphabet-Googles parent-and Meta, the parent of Facebook and Whatsapp. Ribbon Communications, a..."
2025-06-04,Wall Street Lunch: Wedbush Launches AI-Focused ETF,SeekingAlpha,"Wedbush star tech analyst Dan Ives, known for his bullish AI thesis, see his namesake exchange-traded-fund launch today."
2025-06-05,Germanys Merz to face Trump in Oval Office on inaugural trip,Finnhub,"Germanys newchancellor, Friedrich Merz, will hold his first face-to-facetalks with U.S. President Donald Trump on Thursday in a highstakes meeting in the Oval Office as Europe seeks to stave..."
2025-06-06,"Meta Platforms, Inc. (META)’s Tells You How Cool Ryan Reynolds Is, Says Jim Cramer",Yahoo,"We recently published a list of Jim Cramer Discusses Melting Trade Tensions & These 12 Stocks. In this article, we are going to take a look at where Meta Platforms, Inc. (NASDAQ:META) stands against other stocks that Jim Cramer discusses. Meta Platforms, Inc. (NASDAQ:META) is another frequent feature of Cramer’s morning show. Throughout this year, […]"
2025-06-06,"Big Tech ETF rises sharply, driven by Tesla’s large rebound",MarketWatch,"Big Tech ETF rises sharply, driven by Tesla’s large rebound"
2025-06-08,Value Meets Growth: 3 Artificial Intelligence (AI) Stocks Even Warren Buffett Might Respect,Yahoo,"This social media company could leverage its data horde to become an AI leader.  Investors often view value stocks and growth stocks as mutually exclusive.  This is likely because growth stocks often trade at premium valuations, and value stocks tend to attract conservative investors, or those focused on income more than growth."
2025-06-09,What AI is already disrupting,Finnhub,"With the development of AI, there were many questions surrounding the disruption to usage and consumption brought about by this technology. Now that the evolution is underway, we offer an overview of..."
2025-06-10,5 Things to Know Before the Stock Market Opens,Yahoo,"News of the day for June 10, 2025"
2025-06-10,Russian MPs back new state messaging app to combat WhatsApp and Telegram,Finnhub,"Russian lawmakers on Tuesday votedfor the development of a state-backed messaging app that wouldbe closely integrated with government services, as Moscowstrives to reduce its dependency on..."
2025-06-10,QQQM: Taking A Deeper Look At This Nasdaq-100 ETF,SeekingAlpha,"The Invesco NASDAQ 100 ETF offers cost-efficient exposure to top innovative companies, especially in tech. Read more about QQQM ETF here."
2025-06-11,"Can This Unstoppable Stock Join Microsoft, Nvidia, Apple, Amazon, Alphabet, Meta Platforms, and Tesla in the $1 Trillion Club?",Yahoo,"Management believes a $1 trillion market cap is possible by 2030, which might be an aggressive stance.  In the past couple of decades, technology enterprises have become very influential to our society and economy.  The six most valuable companies are Microsoft, Nvidia, Apple, Amazon, Alphabet, and Meta Platforms (as of July 6)."
2025-06-11,"Circle In On The Next Palantir, Nvidia Or Hot IPO. Heres How.",Yahoo,Use the IBD Stock Screener to quickly filter through thousands of companies to find stocks that meet your criteria.
2025-06-11,"GitLab, SailPoint, Meta-Scale AI deal: Trending Tickers",Yahoo,"GitLab (GTLB) stock drops on Wednesday after the open-source platform issued disappointing second quarter guidance SailPoint (SAIL) shares surge by nearly 20% this morning after beating first quarter earnings estimates and lifting its guidance. Lastly, Meta Platforms (META) inked a deal to invest $14 billion into Scale AI (SCAI.PVT) while hiring its CEO Alexandr Wang, according to CNBC reports. To watch more expert insights and analysis on the latest market action, check out more Catalysts here."
2025-06-12,The AI Bubble: Advanced AI Faces A Complete Accuracy Collapse,SeekingAlpha,"Discover why Apple Inc.s study reveals critical challenges in advanced AI models, hinting at a Gen AI bubble burstâand its impact on the S&P. Click for more."
2025-06-12,"Oracle Sees ‘Dramatically Higher’ Sales, Boosting Cloud Momentum",Yahoo,"(Bloomberg) -- Oracle Corp. projected cloud infrastructure sales will jump more than 70% in the fiscal year that began this month, boosting shares in late trading on investor enthusiasm for the closely watched business.Most Read from BloombergShuttered NY College Has Alumni Fighting Over Its FutureTrump’s Military Parade Has Washington Bracing for Tanks and WeaponryNYC Renters Brace for Price Hikes After Broker-Fee BanNY Long Island Rail Service Resumes After Grand Central FireDo World’s Fairs S"
2025-06-12,"Pomerantz Law Firm Investigates Claims On Behalf of Investors of Meta Platforms, Inc. - META",Finnhub,"NEW YORK, June 12, 2025 /PRNewswire/ -- Pomerantz LLP is investigating claims on behalf of investors of Meta Platforms, Inc. . Such investors are advised to contact Danielle Peyton at..."
2025-06-13,The 28-year-old wunderkind Zuckerberg is betting $15bn on,Yahoo,"“Dear President Trump: America must win the AI war,” an eye-catching full-page advert in The Washington Post declared earlier this year."
2025-06-14,Tech Declines as AI Enthuasiasm Fades - Tech Roundup,Finnhub,Shares of technology companies fell as a resurgence of artificial-intelligence enthuasiasm faded. Adobe shares fell by roughly 5% after investors looked askance at the maker of design softwares...
2025-06-14,Stream On,SeekingAlpha,"This year, more people in the U.S. watched YouTube on TVs than on mobile devices - a first. YouTube is now the No. 1 distributor of TV content, according to Nielsen."
2025-06-16,"WhatsApp Launches Ads in Status Updates, Channel Subscriptions",Yahoo,WhatsApp is looking to integrate ads into the app (again).
2025-06-17,Meta brings ads to WhatsApp,Yahoo,"Ads will appear in the Updates tab, however chats and private messages will remain end-to-end encrypted and free from ads."
2025-06-17,Tracking Cliff Asness AQR Capital Management 13F Portfolio - Q1 2025 Update,SeekingAlpha,"AQR Capitals Q125 portfolio hits $97.07B, with top picks in AAPL, NVDA, & AMZN. Active portfolio adjustments show a quantitative, diversified approach. See more."
2025-06-19,Dealmaking in 2025: AI to the rescue,Yahoo,"Wall Streets hopes for a banner year dried up in April. But the mergers and acquisitions market doesnt look as bad as investors feared, thanks to AI."
2025-06-19,Amazon CEO Andy Jassy says company will cut jobs amid AI boom. Its already happening at Microsoft.,Yahoo,"Amazon CEO Andy Jassy said the company will reduce its workforce, and Microsoft is reportedly planning thousands of layoffs, just as the two companies invest billions in AI."
2025-06-20,Meta Platforms (META) Unveils Advanced AI Model Focused on Physical Reasoning,Yahoo,"Meta Platforms, Inc. (NASDAQ:META) is one of the best stocks to buy. On June 11, Meta rolled out V-JEPA 2, a refined AI model that strengthens the system’s capacity to understand and predict physical gestures. The newly introduced model empowers robots and intelligent agents with stronger situational awareness and predictive skills, crucial for fostering AI […]"
2025-06-21,RDVY: Outperforms Peers Despite Lower Dividend Yield,SeekingAlpha,"RDVY is a top choice for dividend growth investors. With strong criteria & tech exposure, it excels in returns. Click here to read my RDVY analysis."
2025-06-21,Character.AI taps Meta’s former VP of business products as CEO,Yahoo,Karandeep Anand comes to Character.AI with experience running advertising products that reached billions of users on Metas apps.
2025-06-22,"Palantir, Meta, OpenAI, And Thinking Machines Just Had Their Executives Sworn Into The US Army Reserve",Yahoo,"Four top tech executives have joined the U.S. Army Reserve as lieutenant colonels, skipping basic training and stepping directly into roles aimed at helping modernize the military. The initiative is part of a broader push by the Army to bring in private-sector innovation and reshape how the service approaches technology, talent, and modernization. Army Forms Detachment 201 To Bridge Tech And Defense The executives—Palantir (NYSE:PLTR) Chief Technology Officer Shyam Sankar, Meta (NASDAQ:META) CTO"
2025-06-24,I Predict This Magnificent Seven Stock Will Crush Expectations,Yahoo,Nvidia could sizzle as the other six stocks slump.
2025-06-24,Meta reportedly explored acquisition of AI video startup Runway,Yahoo,"Runway, a New York-based company, was valued at more than $3bn earlier this year."
2025-06-24,Meta’s Mark Zuckerberg Says the Technology They’re Developing Will ‘See What You See and Hear What You Hear’,Yahoo,"Mark Zuckerberg’s vision for Meta’s AI strategy centers on deeply personalized, conversational assistants — an approach shaped by his history of consumer-focused innovation and the company’s vast social data ecosystem."
2025-06-25,Innovid Named One of the First Ad Tech Partners for Meta’s Threads API Launch,Yahoo,"NEW YORK, June 25, 2025--Innovid was named as one of the first ad tech partners for Meta’s Threads API launch"
2025-06-25,"Mark Zuckerbergs AI Dreams Hit WhatsApp Speed Bump As OpenAI, Perplexity Challenge Meta On Its Own Turf: Report",Yahoo,"WhatsApp has emerged as a key arena for AI chatbot competition, reportedly posing a potential challenge to Meta Platforms Inc.‘s (NASDAQ:META) AI dominance. What Happened: WhatsApp, with over 3 billion global users, has become a prime platform for various AI chatbots, including those from OpenAI and Perplexity, alongside Meta’s own assistant, reported Business Insider. This intense competition could potentially hinder Meta AI’s goal of becoming the default choice for its billions of users. Trend"
2025-06-26,AI May Be Underhyped. Really.,Yahoo,"Earlier this month, a16z venture capitalist Marc Andreessen explained how one year ago, people could argue that AI models were fine at generating poetry and hip hop lyrics, but there were legitimate questions about whether the models could properly do math or code without frequent hallucinations and accuracy problems.  “Now they obviously can,” Andreessen said.  “The moment of certainty for me was the release of [OpenAI’s first reasoning model] o1,” Andreessen said in a podcast interview."
2025-06-26,The Magnificent 7 Is Splitting. Why Microsoft and Meta Are Top of the Heap.,Yahoo,"Both companies have bigger year-to-date gains than Nvidia, though the chipmaker has a larger market capitalization."
2025-06-27,3 Upcoming Catalysts That Could Propel Arista Networks (ANET) Higher,Yahoo,"Arista Networks Inc (NYSE:ANET) is one of the 10 AI Stocks Making Waves on Wall Street. On June 25, Evercore ISI analyst Amit Daryanani reiterated an “Outperform” rating on the stock with a $110.00 price target. The firm considers Meta’s two-layer scheduled fabric architecture for back-end networks to be a significant opportunity for Arista. It is expected […]"
2025-06-28,"Why Are Meta Platforms, Microsoft, and Nvidia Outperforming the Magnificent Seven and the S&P 500?",Yahoo,"Meta Platforms, Microsoft, and Nvidia are turning AI investments into concrete results.  Artificial intelligence has helped these companies grow their profit margins.  Meta Platforms (NASDAQ: META), Microsoft (NASDAQ: MSFT), and Nvidia (NASDAQ: NVDA) are knocking on the door of all-time highs, whereas the other four Magnificent Seven stocks -- Amazon, Alphabet, Tesla, and Apple -- are down year to date."
