date,headline,source,summary
2025-01-05,Stock Funds Rose 17.4% in 2024,Yahoo,"Large-cap growth funds led the pack, with a nearly 30% gain, as investors anticipated more cuts in interest rates."
2025-01-06,What to expect from CES 2025: Tech’s biggest show goes all in on AI,Yahoo,"CES 2025 will be all about AI, agents, and more."
2025-01-06,Nvidia: Expect Shares To Soar Higher On 2025s AI Spending Frenzy,SeekingAlpha,"Discover how Nvidia Corporations revenue soared in 2024, driven by hyperscaler investments in AI data centers, solidifying its dominance. Click for more on NVDA."
2025-01-07,"Meta Ends Fact-Checking on Facebook, Instagram in Free-Speech Pitch",DowJones,"Meta Ends Fact-Checking on Facebook, Instagram in Free-Speech Pitch"
2025-01-07,ClearBridge Large Cap Growth Strategy Q4 2024 Commentary,SeekingAlpha,"In a period of momentum-driven returns and bullish investor sentiment sparked by the re-election of Donald Trump, the more defensively positioned Strategy underperformed."
2025-01-07,Meta retracts AI-powered profiles on Instagram and Facebook,Yahoo,The move comes after the company faced backlash over user experience.
2025-01-07,Dow Jones Futures: Nvidia Surges Above Buy Point; Jensen Huang CES Speech In Focus,DowJones,Dow Jones Futures: Nvidia Surges Above Buy Point; Jensen Huang CES Speech In Focus
2025-01-07,"Meta ends fact-checking program, adds new members to board",Yahoo,"Meta CEO Mark Zuckerberg announced Tuesday morning that, in the United States, the company is ending its third party fact-checking program and switching to a Community Notes program instead. The move came just hours after Meta (META) announced it was adding 3 new members to its board: Dana White, John Elkann and Charlie Songhurst. Morning Brief anchors Brad Smith and Seana Smith discuss all the news in the video above.  To watch more expert insights and analysis on the latest market action, check out more Morning Brief here. This post was written by Stephanie Mikulich."
2025-01-07,Meta Ends Fact-Checking on Facebook and Instagram as CEO Zuckerberg Touts ‘Free Speech’,Yahoo,"Meta Platforms  will end fact-checking across all platforms, CEO Mark Zuckerberg announced Tuesday.  The fact-checking program, which began in December 2016, will be replaced on Facebook, Instagram, and Threads by a “Community Notes” feature.  Zuckerberg likened the new system to what can be found on X, where users can add context to posts and vote on whether the information is helpful."
2025-01-08,eBay: Meta Ruling Unlikely To Break Market Share Decline,SeekingAlpha,eBay Inc. faces market share losses as it prioritizes share buybacks over growth. Click here to find out why I rate EBAY stock a Hold.
2025-01-08,"As Facebook Pulls Back on Moderation, Investors Don’t Expect a Big Change",MarketWatch,"As Facebook Pulls Back on Moderation, Investors Don’t Expect a Big Change"
2025-01-08,EBay Stock Is Top S&P 500 Performer. What Meta Platforms Has to Do With That.,Yahoo,"Shares of  eBay  were trading sharply higher after the online marketplace said some of its listings can now be found on  Meta Platforms  ’ Facebook Marketplace.  “This week kicks off our collaboration, with a pilot of select eBay listings appearing on Facebook Marketplace in the US, Germany, and France,” eBay said in a statement Wednesday.  The announcement arrived after Meta last year was fined €797.72 million by the European Commission for breaching EU antitrust rules by tying Facebook Marketplace to Facebook and “by imposing unfair trading conditions on other online classified ads service providers.”"
2025-01-08,Lucky 21-Year-Old With $70K Portfolio From META And ETFs Asks: Am I Playing It Too Safe? Reddit Offers Polarized Advice,Yahoo,"Investing in the stock market requires skill and strategy, but some can also get lucky. Some investors win big by betting on individual stocks very early, like META, while others are more cautious and prefer to spread their money in index funds like ..."
2025-01-08,Most of the ‘Sweet 16’ stocks have dominated. They might do it again in 2025.,MarketWatch,Most of the ‘Sweet 16’ stocks have dominated. They might do it again in 2025.
2025-01-08,Facebook Moderation Move Is a Mistake. Why Zuckerberg Shouldn’t Copy Musk With Meta and 5 Other Things to Know Today.,MarketWatch,Facebook Moderation Move Is a Mistake. Why Zuckerberg Shouldn’t Copy Musk With Meta and 5 Other Things to Know Today.
2025-01-09,"Tesla, eBay on Facebook, bitcoin falling: Market Minute",Yahoo,"Yahoo Finance host Rachelle Akuffo examines several of the top trending stocks as part of this mornings Market Minute. Tesla (TSLA) could receive $1 billion from rival EV makers that need aid in meeting carbon emission standards in the European Union (EU). Meta Platforms (META) is testing out eBay (EBAY) listings on Facebook in select regions. Bitcoin (BTC-USD) falls below $95,000 on Wednesday with some Wall Street experts anticipating an even bigger drop in the cryptocurrencys price. To watch more expert insights and analysis on the latest market action, check out more Wealth here. This post was written by Luke Carberry Mogan."
2025-01-09,"Trending tickers: Nvidia, Costco, eBay, M&S and Tesco",Yahoo,The latest investor updates on stocks that are trending on Thursday.
2025-01-09,"Meta knew it used pirated books to train AI, authors say",Finnhub,"Meta Platforms used pirated versions of copyrighted books to train its artificial intelligence systems with approval from its CEO Mark Zuckerberg, a group of authors alleged in newly disclosed court..."
2025-01-10,Meta Platforms (META) Stock Slides as Market Rises: Facts to Know Before You Trade,Yahoo,"In the closing of the recent trading day, Meta Platforms (META) stood at $610.72, denoting a -1.16% change from the preceding trading day."
2025-01-10,Global Bonds Infected By Soaring U.S. Treasury Yields. The Fallout for Stock Markets and 5 Other Things to Know Today.,Yahoo,"L.A. wildfires projected to be costliest In California history, Musk lowers the bar on government spending cuts, and more news to start your day."
2025-01-14,"Stock Market Today: Dow Jones Up, Donald Trump Stock Rockets; Mark Zuckerberg Says This, Rocks Quantum Stocks (Live Coverage)",DowJones,"Stock Market Today: Dow Jones Up, Donald Trump Stock Rockets; Mark Zuckerberg Says This, Rocks Quantum Stocks (Live Coverage)"
2025-01-14,Zuckerberg Debuts ‘Real Mark’ in Push to Woo Trump,DowJones,Zuckerberg Debuts ‘Real Mark’ in Push to Woo Trump
2025-01-15,Meta Stock Could Surge More Than 20%. Why Chatbots Are a ‘Massive Windfall’.,MarketWatch,Meta Stock Could Surge More Than 20%. Why Chatbots Are a ‘Massive Windfall’.
2025-01-15,TikTok Ban: What To Know And Stocks To Watch With Deadline Looming,DowJones,TikTok Ban: What To Know And Stocks To Watch With Deadline Looming
2025-01-16,Dow Jones Futures Fall; Nvidia Chipmaker Taiwan Semiconductor Lifts Techs,DowJones,Dow Jones Futures Fall; Nvidia Chipmaker Taiwan Semiconductor Lifts Techs
2025-01-17,Zuckerberg On Apple With Joe Rogan: Should Investors Be Worried?,SeekingAlpha,"Financial writer discusses Warren Buffetts sales of Apple Inc., Zuckerbergs criticism, and the impact on AAPLs stock post-Trumps victory. Click for our updated."
2025-01-21,Google: Why Im Not Buying More Now (Downgrade),SeekingAlpha,"Financial writer discusses Alphabet Inc.s recent high stock surge, concerns about DoJ headwinds, and the need for stock consolidation."
2025-01-22,Big Tech ETF rises sharply as these megacap stocks help lift S&P 500,MarketWatch,Big Tech ETF rises sharply as these megacap stocks help lift S&P 500
2025-01-23,Meta: price target raised at Wedbush,Finnhub,"Wedbush reiterates its outperform rating on Meta Platforms, with a price target raised from $680 to $700, in the wake of revised estimates for the social networking giant ahead of its quarterly..."
2025-01-23,Metas Revised Pay-Or-Consent Model Criticized by European Consumer Group,Finnhub,"By Edith Hancock A consumer advocacy group has urged European Union regulators to take action against Meta Platforms over its pay-or-consent data-tracking model, alleging that the policy may..."
2025-01-24,Meta seeks urgent fix to AI chatbots confusion on name of US president,Finnhub,"The inability of Metas AI chatbot to identify the current president of the United States was elevated to urgent status by the Facebook owner this week, requiring a fast fix, a person familiar with..."
2025-01-27,Nvidia Stock: Dont Panic - DeepSeeks Is Actually A Plus (Rating Upgrade),SeekingAlpha,"Nvidia Corporation to âBuyâ despite the stocks 11% pre-market drop, viewing the dip as a buying opportunity amid market panic over DeepSeeks AI advancements. Read more here."
2025-01-28,"DeepSeek Threat Sends Tech Stocks Tumbling, And The Fed Will Be Watching",SeekingAlpha,Nasdaq100 could be set for its largest one-day fall since 2022 if the DeepSeek correction extends much further. We look at FX and Treasury yield implications should these falls be sustained.
2025-01-28,QGRO: Sophisticated Growth ETF With Average Return,SeekingAlpha,American Century U.S. Quality Growth ETF holds a portfolio of 199 stocks divided into pure growth and stable growth subsets. See why QGRO is a Hold.
2025-01-29,Why blocking Chinas DeepSeek from using US AI may be difficult,Finnhub,Top White House advisers this week expressed alarm that Chinas DeepSeek may have benefited from a method that allegedly piggybacks off the advances of U.S. rivals called distillation. ...
2025-01-30,Nvidia Stock Falls. What Microsoft and Meta Earnings Mean for the AI Chip Maker.,MarketWatch,Nvidia Stock Falls. What Microsoft and Meta Earnings Mean for the AI Chip Maker.
2025-01-30,Meta Reports Fourth Quarter and Full Year 2024 Results,Finnhub,"MENLO PARK, Calif., Jan. 29, 2025 /PRNewswire/ -- Meta Platforms, Inc. today reported financial results for the quarter and full year ended December 31, 2024. ..."
2025-01-31,"Wall Street Got DeepSeek All Wrong. Why It’s a Boon for Big Tech, Especially Nvidia.",MarketWatch,"Wall Street Got DeepSeek All Wrong. Why It’s a Boon for Big Tech, Especially Nvidia."
2025-01-31,The Quantum AI Bubble,SeekingAlpha,The year 2024 concluded with the emergence of a new speculative bubble centered on AI. How has this played out? Click here to find out.
2025-01-31,"Meta Stock In Play: This Butterfly Options Trade Could Pocket As Much As $1,817",DowJones,"Meta Stock In Play: This Butterfly Options Trade Could Pocket As Much As $1,817"
2025-01-31,"Nvidia Stock Edges Up. It’s Still Had a Terrible, Horrible, No-Good, Very Bad Week.",MarketWatch,"Nvidia Stock Edges Up. It’s Still Had a Terrible, Horrible, No-Good, Very Bad Week."
2025-01-31,"Stock Market Resilient Amid DeepSeek AI News, Big Earnings From Apple, Tesla, Microsoft: Weekly Review",DowJones,"Stock Market Resilient Amid DeepSeek AI News, Big Earnings From Apple, Tesla, Microsoft: Weekly Review"
2025-01-31,Nvidia: AI-Related Demand A Source Of Growth And Sustaining Bargaining Power,SeekingAlpha,We sold Nvidia in the first quarter and repurchased in the fourth quarter. Why did we sell and then add back? Click here to find out.
2025-02-01,The Stock Market Weathered Nvidia’s Plunge. It Couldn’t Withstand Renewed Tariff Threats.,MarketWatch,The Stock Market Weathered Nvidia’s Plunge. It Couldn’t Withstand Renewed Tariff Threats.
2025-02-01,GAM: A Value-Oriented Fund With A Strong Performance History,SeekingAlpha,General American Investors Company focuses on long-term growth with a buy-and-hold strategy. See why GAM stock offers value at a 12.59% discount to NAV.
2025-02-03,Meta: Top Value For Growth Investors,SeekingAlpha,"Meta Platforms reported strong Q4 earnings, driven by user growth and robust digital ad spending. Click here to find out why I rate META a Strong Buy."
2025-02-03,Metas Secret Weapon For 2025,SeekingAlpha,"Financial writer highlights METAs impressive growth, AI investments, and revenue increase, projecting bullish momentum for the future."
2025-02-04,"Zuckerberg Is Betting Big On AI, But Metas Stock Price Is High",SeekingAlpha,"Meta Platforms has shown impressive growth, with strong quarterly and full-year financial results. See why I maintain a Hold rating despite positive performance."
2025-02-04,"Trump Tariffs Target Loophole Utilized By Temu, Shein. Why That Matters For Meta.",DowJones,"Trump Tariffs Target Loophole Utilized By Temu, Shein. Why That Matters For Meta."
2025-02-04,Stocks That May Benefit From An AI Evolution This Year,SeekingAlpha,"Tech stocks are in focus as many of the bellwethers report results, but also because of the potential impact of DeepSeek on the AI sector. Morningstar Researchs David Sekera discusses."
2025-02-05,Shorting Palantir: Valuation Matters,SeekingAlpha,Julian Lin sharesÂ why were absolutely in a bubble once again and why hes short Palantir.
2025-02-05,Meta Leads Barrage Of Breakouts. Dont Miss This Slew Of Others.,DowJones,Meta Leads Barrage Of Breakouts. Dont Miss This Slew Of Others.
2025-02-05,Options Traders Bet the Rally in Big Tech Stocks Has More Room to Run,DowJones,Options Traders Bet the Rally in Big Tech Stocks Has More Room to Run
2025-02-05,Why Meta Is Getting All the AI Love—and Alphabet Isn’t,MarketWatch,Why Meta Is Getting All the AI Love—and Alphabet Isn’t
2025-02-05,The AI Spending Race Is Still On as Google Antes Up,DowJones,The AI Spending Race Is Still On as Google Antes Up
2025-02-06,Alibaba Said Its AI Outperformed DeepSeek: This Is Why The Stock Is A Buy,SeekingAlpha,Alibabas AI advancements and promising financial growth make it a compelling stock with significant upside potential. Read more about BABA stock here.
2025-02-06,Amazon Earnings Are Today. Why It’s All About AWS.,MarketWatch,Amazon Earnings Are Today. Why It’s All About AWS.
2025-02-06,Power Stocks Had Been on an AI Tear. Then Came DeepSeek.,DowJones,Power Stocks Had Been on an AI Tear. Then Came DeepSeek.
2025-02-07,Nvidia Stock Is Climbing. Amazon’s Earnings Were a Big Moment for the Chip Maker.,MarketWatch,Nvidia Stock Is Climbing. Amazon’s Earnings Were a Big Moment for the Chip Maker.
2025-02-07,"The Good—and Bad—in Apple, Amazon, and Other Big Tech Earnings",MarketWatch,"The Good—and Bad—in Apple, Amazon, and Other Big Tech Earnings"
2025-02-10,Tracking Ken Fishers Fisher Asset Management Portfolio - Q4 2024 Update,SeekingAlpha,"Kenneth Fishers 13F portfolio grows to $251B in Q4 2024, with top holdings in Apple, Nvidia, Microsoft, Amazon, and Alphabet. Read more here."
2025-02-10,3 Reasons DeepSeek Is Bullish for AI,MarketWatch,3 Reasons DeepSeek Is Bullish for AI
2025-02-11,"Dow Jones Futures Fall, Trump Imposes New Tariffs; Nvidia Faces This Critical Test At Key Level",DowJones,"Dow Jones Futures Fall, Trump Imposes New Tariffs; Nvidia Faces This Critical Test At Key Level"
2025-02-11,Meta Stock Has Soared During Trump Presidency. How Zuckerberg’s Leaving Mag 7 Rivals Behind and 5 Other Things to Know Today.,MarketWatch,Meta Stock Has Soared During Trump Presidency. How Zuckerberg’s Leaving Mag 7 Rivals Behind and 5 Other Things to Know Today.
2025-02-12,The AI Trade Is Far From Dead. TE Connectivity Goes All-In.,MarketWatch,The AI Trade Is Far From Dead. TE Connectivity Goes All-In.
2025-02-13,New Data Show Strong Chip Demand. Nvidia Stock Rises.,MarketWatch,New Data Show Strong Chip Demand. Nvidia Stock Rises.
2025-02-13,Microsoft: Altman Becoming A Headache Rather Than A Companion For Nadella,SeekingAlpha,"Microsoft faces a strong USD and OpenAI concerns, with Altman becoming more of a burden than a partner for Nadella. See why MSFT stock is a hold."
2025-02-13,"Big Tech ETF up sharply, beating S&P 500",MarketWatch,"Big Tech ETF up sharply, beating S&P 500"
2025-02-13,Reddit: A Chance To Load Up On The Dramatic Nosedive,SeekingAlpha,Redditâs DAUq miss was tied to a Google algorithm change. Read why RDDT stock is undervalued and positioned for growth in ad revenue and international users.
2025-02-14,The Dot-Com Bubble Burst 25 Years Ago. AI Could Be Next.,MarketWatch,The Dot-Com Bubble Burst 25 Years Ago. AI Could Be Next.
2025-02-14,S&P 500 struggles for record high as Big Tech stocks trade mixed,MarketWatch,S&P 500 struggles for record high as Big Tech stocks trade mixed
2025-02-17,Meta’s AI-Powered Ray-Bans Are Life-Enhancing for the Blind,DowJones,Meta’s AI-Powered Ray-Bans Are Life-Enhancing for the Blind
2025-02-18,Harding Loevner International Equity ADR Q4 2024 Report,SeekingAlpha,"For Q4 2024, Harding Loevner International Equity ADR composite fell 7.9%, gross, behind the 7.5% decline of the MSCI ACWI ex US Index. Click here to read more."
2025-02-20,FTC seeks info on Big Tech user bans,Finnhub,"The U.S. Federal Trade Commission isseeking information about tech platforms content policies andactions to ban users, FTC Chairman Andrew Ferguson announced onThursday, saying the practices may..."
2025-02-20,Berkshire Hathaway: Ditching The S&P 500 Was Wise (Rating Upgrade),SeekingAlpha,Berkshire Hathaway dumped S&P 500 funds amid high valuations and it remains a strong investment choice with better yield opportunities. See more here.
2025-02-21,JHML: Multi-Factor Vs. Single Factors,SeekingAlpha,John Hancock Multifactor Large Cap ETF uses a multifactor strategy but lags in returns. Learn why JHML underperforms compared to single factor ETFs.
2025-02-21,Madison Small Cap Fund Q4 2024 Investment Strategy Letter,SeekingAlpha,"The fourth quarter closed out a successful year for the Madison Small Cap Fund, delivering solid absolute and relative returns for the fourth quarter and the full year."
2025-02-21,Nvidia CEO Jensen Huang Says the DeepSeek Reaction Was Wrong. Here’s Why.,MarketWatch,Nvidia CEO Jensen Huang Says the DeepSeek Reaction Was Wrong. Here’s Why.
2025-02-21,Baron Global Advantage Fund Q4 2024 Shareholder Letter,SeekingAlpha,"Baron Global Advantage Fund advanced during the fourth quarter of 2024, outperforming its benchmark, the MSCI ACWI Index. Read more here."
2025-02-22,Allspring Core Bond Fund Q4 2024 Commentary,SeekingAlpha,The Bloomberg U.S. Aggregate Bond Index fell 3.06% for the fourth quarter of 2024. Click here to read the full commentary.
2025-02-22,Magnificent Meta Leads 5 Stocks Near Buy Points,DowJones,Magnificent Meta Leads 5 Stocks Near Buy Points
2025-02-22,IBD Stock Of The Day: Meta Tests Key Level After Record-Setting Rally Ends,DowJones,IBD Stock Of The Day: Meta Tests Key Level After Record-Setting Rally Ends
2025-02-25,States Consider App-Store Age-Verification Laws,DowJones,States Consider App-Store Age-Verification Laws
2025-02-25,"Big Tech ETF slumps, with steep slide in Tesla shares",MarketWatch,"Big Tech ETF slumps, with steep slide in Tesla shares"
2025-02-25,AT&T: Time To Take Money Off The Table,SeekingAlpha,AT&T has seen one of its best performances over the last few quarters. Read more to see what makes T stock a sell at the current price.
2025-02-25,Columbia Select Large Cap Equity Fund Q4 2024 Commentary,SeekingAlpha,"Columbia Select Large Cap Equity Fund Institutional Class shares returned 3.31% for
the three months ending 12/31/2024. Click here to read the full commentary."
2025-02-25,"Arista Networks: Sentiment, Not Fundamentals, Gave You This Buying Opportunity",SeekingAlpha,"Watch for Arista Networks to bottom near the high $80s, setting up for a potential rally in 2025 with a sentiment reset and strong business fundamentals. Learn more on ANET stock here."
2025-02-27,Magnificent 7s Stumble: When To Buy MAGS,SeekingAlpha,"Magnificent 7 stocks have seen notable declines, with Tesla being the most bearish, impacting the MAGS ETF. Click here to find out why MAGS ETF is a Hold."
2025-02-27,Meta Apologizes for Error That Flooded Instagram With Violent Content,DowJones,Meta Apologizes for Error That Flooded Instagram With Violent Content
2025-02-27,Aegis Value Fund H2 2024 Portfolio Managers Letter,SeekingAlpha,"The Aegis Value Fund rose 6.16% in H2 2024 to close the year with a 9.43% gain, outperforming the S&P SmallCap 600 Pure Value Index. Click here to read more."
2025-02-27,Tracking Terry Smiths Fundsmith 13F Portfolio - Q4 2024 Update,SeekingAlpha,"Read here for an update on Fundsmiths latest 13F portfolio shifts with reduced major stakes, new small positions, and notable disposals."
2025-02-28,Tracking Chase Colemans Tiger Global Portfolio - Q4 2024 Update,SeekingAlpha,"Tiger Globals 13F reveals a $26.46B portfolio with top holdings in Meta, Microsoft & Alphabet. Read here for an update on additions and decreases."
2025-03-03,"Its not just Magnificent Seven stocks that are falling. Bonds are selling off, too.",MarketWatch,"Its not just Magnificent Seven stocks that are falling. Bonds are selling off, too."
2025-03-03,AppLovin Bounces Back. More Cash Is Ready for Stock Buybacks.,MarketWatch,AppLovin Bounces Back. More Cash Is Ready for Stock Buybacks.
2025-03-04,Big Tech ETF deepens losses as tariff worries pressure U.S. stock market,MarketWatch,Big Tech ETF deepens losses as tariff worries pressure U.S. stock market
2025-03-04,Wall Street Lunch: Bye-Bye Bro Bubble,SeekingAlpha,"The âBro Bubbleâ has popped. Stocks have now wiped out all the gains since Election Day.
As tariffs go into effect, the trade war escalation is weighing heavily on global growth expectation."
2025-03-05,Tracking Dan Loebs Third Point Portfolio - Q4 2024 Update,SeekingAlpha,"Dan Loebs Third Point 13F reveals portfolio shifts, new stakes, and top holdings. Portfolio value slightly increased to $7.44B. Read more on the portfolio here."
2025-03-06,CDT Insider Sentiment February 2025: Tariff Paralysis,SeekingAlpha,"President Trump promised a radical approach to trade policy during his campaign, and he has delivered."
2025-03-06,Meta: The Only Magnificent 7 Stock Shining In 2025,SeekingAlpha,Meta Platforms keeps rallying in 2025 despite the uncertain environment and other Magnificent 7 stocks struggling. See why I rate META stock a strong buy.
2025-03-09,Wall Street Brunch: One Last Tariff-Free CPI,SeekingAlpha,A dovish consumer price index could cement a June Fed cut. Adobe set to report earnings. DOJ still wants to break up Google.
2025-03-10,Goehring & Rozencwajg Q4 2024 Natural Resource Market Commentary,SeekingAlpha,"Goehring & Rozencwajg released their latest market commentary, On Commodities, Carry Regimes and Changes to Global Monetary Systems recently. Click here to read more."
2025-03-11,Tracking Saudi Sovereign Wealth Funds 13F Portfolio - Q4 2024 Update,SeekingAlpha,"Saudi Arabias PIF increased its 13F portfolio value slightly to $26.77B, focusing on 26 significant stakes. Check out the portfolios holdings here."
2025-03-11,Tariff Chaos = Opportunity: 2 Stocks Worth Buying,SeekingAlpha,Read here for an analysis of two mega-cap stocks to buy amid market volatility caused by tariff policies. Learn tactical portfolio strategies for uncertain times.
2025-03-12,"Tesla Stock: Buying Opportunity Emerges (Technical Analysis, Rating Upgrade)",SeekingAlpha,"Discover why Tesla, Inc.s stock may be primed for a rebound! Explore bullish patterns, key support levels, and a strong buy outlook. Click for my TSLA update."
2025-03-12,"AppLovin Stock Has Hints of Google and Facebook, Says a Bull",MarketWatch,"AppLovin Stock Has Hints of Google and Facebook, Says a Bull"
2025-03-12,Invesco Summit Fund Q4 2024 Commentary,SeekingAlpha,"The fund outperformed its benchmark and peers for the final quarter and full year 2024, driven by positive stock selection."
2025-03-13,Trump says he will not change his mind on April 2 tariffs,Finnhub,U.S. President DonaldTrump said on Thursday that he was not going to change his mindon imposing sweeping reciprocal tariffs on all trading partnerson April 2. Weve been ripped off...
2025-03-13,Adobe Has Become A GARP Play (Rating Upgrade),SeekingAlpha,"Adobes GenAI tools like Firefly streamline marketing workflows, enhance collaboration, and ensure safety, driving growth in budget-tight times. Learn more on ADBE stock here."
2025-03-13,Pinterest Stock Sees Composite Rating Improve To 96,DowJones,Pinterest Stock Sees Composite Rating Improve To 96
2025-03-14,The Nasdaq Just Hit Correction Territory. Here Are 5 Stocks Youll Regret Not Buying Right Now.,Yahoo,"With the Nasdaq Composite in correction territory, investors should consider investing some cash in the stock market.  This year, its revenue is expected to reach $204 billion, clearly indicating that AI investments arent waning."
2025-03-14,Kristin Olson,MarketWatch,Kristin Olson
2025-03-15,"This is the Magnificent 7 stock to buy on the dip, strategist says",Yahoo,"The Magnificent Seven stocks havent been immune to the overall market decline. BMO Capital Markets Chief investment Strategist Brian Belski says theres one Mag 7 stock he would buy on the dip. Find out what it is in the video above. To watch more expert insights and analysis on the latest market action, check out more Catalysts here."
2025-03-16,Ameren: Improving Growth Prospects But Still Expensive,SeekingAlpha,"Despite a slight population decline in St. Louis since 2020, Amerens revenue and net income have shown steady growth. See why I remain neutral on AEE stock."
2025-03-16,Nasdaq Correction: 2 Magnificent Seven Stocks Down 19% and 21% Youll Regret Not Buying on the Dip,Yahoo,"The Nasdaq-100 is made up of 100 of the largest nonfinancial companies listed on the Nasdaq stock exchange.  Meta Platforms is the parent company of the Facebook, Instagram, and WhatsApp social networks, which serve over 3.3 billion people every day."
