date,headline,source,summary
2025-06-25,Amgen (AMGN) Falls 5.8% as Novo Nordisk Hammers Its Weight Loss Drug Trial,Yahoo,"Amgen Inc. (NASDAQ:AMGN) is one of the These 10 Stocks Took A Shocking Fall. Amgen Inc. extended its losing streak to a fourth straight day on Monday, dropping 5.84 percent to close at $272.44 apiece as investors sold off positions despite positive results from its weight loss drug trial, after Novo Nordisk—maker of the blockbuster Wegovy […]"
2025-06-25,Health Care Roundup: Market Talk,Yahoo,"NEWSPLUS  The latest Market Talks covering the Health Care sector. Published exclusively on Dow Jones Newswires at 4:20 ET, 12:20 ET and 16:50 ET.  0626 ET – Novo Nordisk’s decision to end its collaboration with Hims & Hers should be seen as a very clear statement of where it stands on compounding, UBS analyst Jo Walton writes."
2025-06-27,"Tesla exec. & Musk confidant reportedly ousted, US stocks rise",Yahoo,"John Hyland outlines some of the top stories on the trading day on this rendition of Yahoo Finances Market Minute. Micron (MU) shares fall despite reporting earnings results that beat estimates. Tesla (TSLA) executive Omead Afshar has left the company, according to Bloomberg, with Forbes reporting Afshar was fired. Novo Nordisk (NVO) announces a weight loss drug partnership with Weight Watchers, just after the pharma giant cut ties with Hims & Hers (HIMS). Stay up to date on the latest market action, minute-by-minute, with Yahoo Finances Market Minute"
2025-06-29,This Dirt Cheap Healthcare Stock Could Be a Hidden Artificial Intelligence (AI) Opportunity (Hint: Its Not Eli Lilly),Yahoo,Artificial intelligence (AI) has the potential to transform several different areas of the healthcare industry.
2025-07-01,Can Protagonist Take On Eli Lillys Next-Generation Obesity Treatment?,Yahoo,Protagonist Therapeutics is taking aim directly at Eli Lillys obesity treatment with a newly announced drug that uses the same mechanism.
2025-07-01,Hims & Hers Can Still Thrive Without GLP-1s,SeekingAlpha,"Hims & Hers thrives with telehealth growth, strong subscriber base, and expanding products, despite challenges like competition and regulatory scrutiny. Learn more on HIMS stock here."
2025-07-01,Dividend Yield Theory Says Merck Is A Buy,SeekingAlpha,"Merck & Co., Inc.s 4.09% dividend yield and robust pipeline signal strong growth potential. Click here to read an analysis of MRK stock now."
2025-07-02,2 Growth Stocks to Buy Hand Over Fist in July,Yahoo,These companies are poised to produce fireworks for your portfolio over the coming years.
2025-07-02,"Semaglutide Market Forecast Report 2025-2033 | Growth Accelerates Amid Rising Awareness, Regulatory Approvals, and Strong Pipeline Advancements",Yahoo,"The Semaglutide market is projected to expand from US$ 27.15 billion in 2024 to US$ 61.7 billion by 2033, with a CAGR of 9.55% from 2025. Driven by rising obesity and type 2 diabetes incidences, the market for semaglutide, a GLP-1 receptor agonist, is growing due to its efficacy in glycemic control and weight management. Brand names like Ozempic, Rybelsus, and Wegovy underscore its role in improving health outcomes. Increased awareness, approvals, and advanced delivery systems play pivotal roles"
2025-07-02,This GLP-1 Stocks Bad News Could Be a Big Win for Eli Lilly and Novo Nordisk,Yahoo,"Amgen recently released the full data from a trial involving its GLP-1 drug, MariTide.  More than one-quarter of the participants on the highest dosage of the drug had to stop taking it due to adverse side effects.  There are a lot of healthcare companies that are investing in GLP-1 weight loss drugs."
2025-07-04,Will Novo Nordisks Rare Disease Bets Reduce GLP-1 Reliance?,Yahoo,NVO is expanding into rare blood disorders like hemophilia to ease reliance on GLP-1 drugs Ozempic and Wegovy.
2025-07-06,Novo Nordisks Sell-Off Has Gone Too Far,SeekingAlpha,"Discover why Novo Nordisks current sell-off offers a strong buy opportunity. Backed by solid fundamentals, growth prospects, and valuation discounts."
2025-07-08,"Revived WeightWatchers Rallies, In Strongest Position In Years",Yahoo,Analyst initiates coverage of WeightWatchers with a buy rating after bankruptcy reemergence. IPO hot streak continues.
2025-07-09,"Alcohol Use Disorder Market Report 2025-2035 Featuring Clearmind Medicine, Purdue Pharma, Psyence Biomedical, Eli Lilly and Co, Tempero Bio,, Nxera Pharma, Novo Nordisk, Adial, Alkermes, Lundbeck",Yahoo,"The global alcohol use disorder market is experiencing significant growth, driven by increasing demand for innovative and personalized treatments, and the integration of digital health technologies. Advancements in pharmacotherapies and personalized medicine are offering more effective solutions, while telemedicine and online support expand treatment accessibility. Despite challenges like high costs and stigma, especially in developing regions, the market shows potential for further growth. Key"
2025-07-10,U.S. telehealth upstart plans to sell generic Ozempic in Canada as patent due to lapse,Yahoo,Hims & Hers Health says generic version should sell at significant discount
2025-07-10,"Top Research Reports for SAP, Novo Nordisk & Thermo Fisher",Yahoo,"SAP gains on cloud strength, NVO faces obesity setbacks, and TMO leans on AI and innovation amid macro headwinds."
2025-07-11,Smart Money Going in Senior Health: Key Stocks in Elderly Care,Yahoo,"RHHBY, NVO, EW and SYK are ramping up senior care innovation as aging populations reshape global healthcare demand."
2025-07-13,"Novo Nordisk A/S (NVO): “Canada’s A Backdoor,” Says Jim Cramer",Yahoo,We recently published 14 Stocks Jim Cramer Discussed As He Talked About Record Bitcoin Price. Novo Nordisk A/S (NYSE:NVO) is one of the stocks Jim Cramer recently discussed. Novo Nordisk A/S (NYSE:NVO) is a Danish pharmaceutical company that was one of the earliest movers in the weight loss drug market. The shares have lost 21% […]
2025-07-21,Eli Lilly: Competition Melts Away,SeekingAlpha,"Eli Lilly outpaces Novo in the GLP-1 market with Tirzepatide and emerging blockbusters, signaling future growth. Read more on my Strong Buy rating for LLY."
2025-07-22,Novo Nordisks Moat Is Deeper Than You Think,SeekingAlpha,"Novo Nordisk sees 65% obesity drug sales growth, forecasts $8.14â$9.59B FY25 free cash flow."
2025-07-25,Viking Therapeutics Q2: Confidently Continuing The Recovery,SeekingAlpha,"Viking Therapeutics has strong R&D, dual-track obesity drugs, and solid cash runway. Click here to read an analysis of VKTX stock now."
2025-07-29,Wall Street Lunch: UnitedHealth Shares Struggle Following Weak 2025 Outlook,SeekingAlpha,"UnitedHealth shares continue to struggle after the company issued a fresh outlook for 2025, indicating revenue and adjusted earnings below Street forecasts."
2025-07-31,The Fed Isnt Sure About The Economy Anymore,SeekingAlpha,"Explore the latest FOMC insights on US growth, inflation, and rate cut expectations. Discover why defensives remain key amid market gains."
2025-08-01,Eli Lilly: The Worst May Be Already Over (Earnings Preview),SeekingAlpha,"Eli Lilly stock is set to report Q2 2025 earnings on August 7, with consensus expecting $14.4 billion in revenue and $5.56 EPS, up 30-42% YoY. Read the full earnings preview here."
2025-08-04,Novo Nordisk Is Now A Better Value Play Than Eli Lilly With Solid Upside,SeekingAlpha,"Novo Nordisk is misunderstood by the market, creating a rare asymmetric value opportunity. Read why I rate NVO stock a Buy ahead of Q2 earnings."
2025-08-05,GLP-1 War: A Look At The Epic Pipeline Battle Between Novo Nordisk And Eli Lilly,SeekingAlpha,"Novo Nordisk remains a strong buy despite share price dip, thanks to its robust drug pipeline, massive market potential, and compelling long-term growth..."
2025-08-06,Novo Nordisk A/S (NVO) Q2 2025 Earnings Call Transcript,SeekingAlpha,"Novo Nordisk A/S (NVO) Q2 2025 Earnings Conference Call August 6, 2025 7:00 AM ETCompany ParticipantsDavid S."
2025-08-06,Why I Still Dont Think Amgen Is A Buy,SeekingAlpha,"Amgen delivered strong Q2 2025 results, beating expectations and raising full-year guidance, driven by robust growth in key products despite Enbrels decline."
2025-08-07,Hims & Hers: A High-Risk Bet,SeekingAlpha,"Hims & Hers Health is upgraded to a speculative Buy after a 20% drop, with growth potential in GLP-1 sales outweighing key risks. Click to read why HIMS is a Buy."
2025-08-11,Industry Analysis: Pharmaceuticals Like Novo Nordisk Offer Long-Term Opportunities,SeekingAlpha,"Despite current headwinds like tariffs and patent expirations, I see long-term opportunity in top-tier pharmaceutical stocks due to strong fundamentals and future AI benefits. Read more here"
2025-08-12,Eli Lilly: The Bears Have Spoken Loud And Clear (Upgrade),SeekingAlpha,Eli Lilly and Company faces valuation pressure after disappointing Orforglipron results. Discover why now isnt the time to buy. Click for my LLY update.
2025-08-19,Novo Nordisk: Negative Streak Finally Ended,SeekingAlpha,"Novo Nordisk explores growth with FDA approvals, global expansion, and pipeline innovation."
2025-08-19,Artisan Global Opportunities Fund Q2 2025 Commentary,SeekingAlpha,"Global markets turned in an impressive but volatile Q2, swinging from double-digit declines to double-digit gains. Click here to read more."
2025-08-19,Wall Street Lunch: SPAC King Returns With New Blank-Check Deal,SeekingAlpha,Venture capitalist Chamath Palihapitiya has filed to list a SPAC worth $250 million under the name of American Exceptionalism Acquisition Corp.
2025-08-20,Novo Nordisk to present Wegovy® and Ozempic® data showing life-saving cardiovascular benefits for people living with obesity and type 2 diabetes at the European Society of Cardiology Congress 2025,Yahoo,Data to highlight the impact of Wegovy® (semaglutide 2.4 mg) on atrial fibrillation – a common heart rhythm condition – in people living with obesity (SELECT study)Additional Rybelsus® and Ozempic® data demonstrate new cardiometabolic benefits (improvements in heart and metabolic health) in people living with type 2 diabetes (SOUL and STRIDE studies)New insights into the role of inflammation in cardiovascular disease on mortality and major cardiovascular events in people living with inflammation
2025-08-21,Serena Williams Is the Surprising New Face of Weight-Loss Drugs,Yahoo,"After years of GLP-1 ads spotlighting anonymous bellies and dancing commercial actors, telehealth firm Ro is ushering in weight-loss drugs’ celebrity-endorsement era."
2025-08-21,Danes gloomy about future as Ozempic maker slumps,Yahoo,A steep decline in Ozempic maker Novo Nordisk’s share price has sent consumer confidence in Denmark to a three-month low.
2025-08-23,"Viking: Still On Track, But The Compass Needs Recalibration",SeekingAlpha,"Vikings VK2735 shows promise in obesity treatment but faces tolerability concerns. Discover market impact, buyout potential, and investment insights."
2025-08-24,Novo Nordisk: Undervalued Pharma Heavyweight With Upside Potential,SeekingAlpha,Novo Nordisk is undervalued despite strong growth and market dominance.
2025-08-28,"Eli Lilly: In The Eye Of The Drug Pricing Storm - Expect Volatility, And Buy",SeekingAlpha,"Eli Lillys GLP-1 drugs fuel massive growth, with potential $60bn+ annual revenue. Check out why I remain bullish long term on LLY stock."
2025-08-28,"Despite Early Low Awareness, Physicians Forecast Swift Adoption of Novo Nordisk’s Wegovy in MASH, According to Spherix Global Insights",Yahoo,"US Gastroenterologists and hepatologists highlight strong interest in Wegovy for addressing the metabolic roots of MASH.EXTON, PA, Aug. 28, 2025 (GLOBE NEWSWIRE) -- The recent approval of Novo Nordisk’s Wegovy (semaglutide 2.4mg) as the second treatment for metabolic dysfunction-associated steatohepatitis (MASH) represents a critical step forward in a condition with a vast patient population and significant unmet need. Highly anticipated by the field, this milestone is expected to transform the"
2025-08-28,"Wall Street Lunch: Economy Is Slowing, But Still Clearly Growing",SeekingAlpha,"Lumber futuresÂ on edge of bear territory; Snowflake,Â HPÂ gaining post-earnings; U.S. GDP growthÂ revised higher."
2025-09-01,"Novo’s Wegovy Beats Lilly’s Zepbound for Heart Health, Study Finds. What It Means for Stocks.",Yahoo,The study adds to growing evidence suggesting that the heart-protective benefits seen with Wegovy are specific to semaglutide.
2025-09-02,Viking Therapeutics Loses 20% in a Month: How to Play the Stock,Yahoo,VKTX stock slumps after mixed obesity pill study results raise safety concerns and highlight fierce market competition.
2025-09-02,"Constellation Brands, Novo Nordisk, Klarna IPO: Trending Tickers",Yahoo,"Julie Hyman takes a closer look at some of the top stories Wall Street is watching, including Constellation Brands (STZ) lowered fiscal 2026 outlook, Novo Nordisks (NVO) Wegovy trial data, and more details on Klarnas (KLAR.PVT) initial public offering (IPO). To watch more expert insights and analysis on the latest market action, check out more Morning Brief."
2025-09-02,"Insulin Delivery Device Company Evaluation Report 2025 | Embecta, Novo Nordisk, and Ypsomed Lead with Innovative Injection and Digital Management Solutions",Yahoo,"The Insulin Delivery Devices Companies Quadrant presents a detailed analysis of the global insulin delivery devices market, spotlighting the top 25 companies like Embecta Corp, Novo Nordisk, and Ypsomed as quadrant leaders. This analytical report evaluates over 240 firms, assessing product innovations and market trends. The rise in diabetes prevalence, technological advances, and supportive policies fuel market growth, with insulin pens increasingly preferred for their convenience and accuracy."
2025-09-06,Novo Nordisk: Keep It Low So I Can Keep Accumulating (Rating Upgrade),SeekingAlpha,"Novo Nordisks Q2 growth, strong market share, and innovative drug pipeline make it a top stock pick. Click here to find out why NVO stock is a Strong Buy."
2025-09-10,Novo Nordisk: Priced Like Best Days Are Over (Upgrade),SeekingAlpha,"Novo Nordisk is deeply undervalued despite stellar fundamentals: 18% sales growth, a 29% OP jump, and a rock-solid balance sheet. See why NVO stock is a buy."
2025-09-10,"Synopsys China slowdown, Novo Nordisk job cuts, Chewy earnings",Yahoo,"Morning Brief host Julie Hyman examines three of Wednesdays trending stories: Synopsys (SNPS) stock falling after the company warned of a slowdown in China, Novo Nordisks (NVO) workforce cuts and lowered profit forecast, and Chewys (CHWY) weak second quarter profit despite its sales growth. To watch more expert insights and analysis on the latest market action, check out more Morning Brief."
2025-09-10,"NVS to Acquire TRML, Add Phase III Cardiovascular Drug to Pipeline",Yahoo,"Novartis is set to acquire Tourmaline Bio for $1.4B, adding late-stage anti-IL-6 candidate pacibekitug to its cardiovascular pipeline."
2025-09-11,"Novo Nordisk Tightens Its Belt, Cutting 9,000 Jobs And Its Profit Outlook",Yahoo,Novo Nordisk announced a sweeping transformation Wednesday as the drugmaker contends with knockoffs chipping away at its blockbuster drugs.
2025-09-11,"Rate of employers covering weight-loss drugs is flat, Cigna says",Yahoo,"(Reuters) -Cigna said on Wednesday the percentage of employers paying for obesity drugs has remained flat year-over-year, though the health insurer still sees an uptick in demand for the wildly popular treatments.  More than 50% of its Evernorth units clients, a group that includes large employers and health plans, cover the drugs for weight management, Chief Financial Officer Brian Evanko said at the Morgan Stanley Healthcare Conference.  Within Cigna Healthcare, its health benefits only segment, which caters more to smaller employers, only about 15% to 20% of clients offer coverage of the medications, he said."
2025-09-11,Dewpoint Therapeutics Closes Series D Financing to Advance First-in-Class Condensate Modulator (c-mod) into Clinical Development for Gastric Cancer,Yahoo,"Series D extends runway into 2027, advancing first-in-class c-mod DPTX3186 toward proof-of-concept in gastric cancer.Strong support from leading investors and global pharma partners continues to validate the innovative potential of Dewpoint’s platform. BOSTON, Sept. 10, 2025 (GLOBE NEWSWIRE) -- Dewpoint Therapeutics, the leading biotechnology company in transforming condensate biology into medicine, today announced the closing of its Series D financing to advance DPTX3186, a first-in-class conde"
2025-09-16,The Secret Blue-Chip Rally No One Knows About: 4 Amazing Ideas To Consider,SeekingAlpha,Is Wall Street in a bubble? Read about four stocks that could help investors looking at more market upside.
2025-09-18,It Is Time To Buy Novo Nordisk Hand Over Fist,SeekingAlpha,"Novo Nordisk A/S is a strong buy for 2024, with cutting-edge drug approvals, cost savings, and robust long-term growth potential. Click for my NVO stock update."
2025-09-19,Wall Street Breakfast Podcast: FedEx Delivers Earnings Surprise,SeekingAlpha,"FedEx rallies after topping profit expectations, updating on business. Activist investor Biglari targets Cracker Barrel CEO. Novo Nordisk reduces team for obesity and diabetes education."
2025-09-22,Pfizer Buys Obesity Drug Developer Metsera: Buy Today And Benefit From CVRs,SeekingAlpha,"Pfizer Inc. acquires Metsera, Inc. to re-enter the obesity drug market. Click for my look at PFZ and MTSR stock and where I see value in the weight loss sector."
2025-09-23,UBS slashes global GLP-1 sales estimate for 2030 on softer outlook,Yahoo,"Investing.com -- UBS has cut its global GLP-1 sales forecast for 2030 to $130 billion, down from over $150 billion, citing weaker-than-expected data from next-generation assets and compounded product disruptions in the US market."
2025-09-23,"Scholar Rock, A Top 10% Stock, Dives After Catalent Issues Hamper SMA Drug",Yahoo,"Shares of Scholar Rock tumbled Tuesday after the FDA rejected the companys spinal muscular atrophy drug, citing concerns at a plant."
2025-09-23,US FDA declines to approve Scholar Rocks muscle weakness drug; shares fall,Yahoo,"(Reuters) -Scholar Rock said on Tuesday the U.S. health regulator has declined to approve its drug for a rare neuromuscular disease citing issues at a third-party manufacturing facility, sending the companys shares down 12% in premarket trading.  Scholar Rock is banking on apitegromab to drive its growth and profitability.  The drug is being tested as a treatment for spinal muscular atrophy and muscle preservation in obesity."
2025-09-26,A New Prescription For Pain: Understanding Trumps 100% Pharma Tariff,SeekingAlpha,"Discover how Trumpâs 100% drug tariff impacts NVO, SNY, and AZN stocks. Click for which pharma giants face the most riskâand the upside for savvy investors."
2025-10-01,Regeneron: Growth Catalysts Incoming,SeekingAlpha,Regeneron Pharmaceuticals is seeing revenue growth in key products that is now offsetting declining revenue in its previous blockbuster drug. Read why REGN is a Buy.
2025-10-03,3 Way-Too-Early Predictions For 2026,SeekingAlpha,"Markets continue to advance despite continuing concerns around valuations, inflation, and the deteriorating jobs market. Read what investors need to know."
2025-10-03,AbbVie: Wins Accumulating While We Wait For Next BD Steps,SeekingAlpha,"AbbVies strong results, pipeline wins, and Rinvoq exclusivity boost its outlook. Read the latest analysis on ABBV stock here."
2025-10-03,"SCHD ETF Alternative Strategy, CAGR Improves To 15.74%",SeekingAlpha,The 4-Factor Dividend Growth Portfolio delivers a 15.74% CAGR and rising dividends. Read here for an investment analysis of SCHD ETF.
2025-10-03,Novo Nordisk Is Primed For A Post-Earnings Recovery (Earnings Preview),SeekingAlpha,Novo Nordiskâs Q2 2025 shows strong growth despite competition. See more on NVOs key catalysts and price targets driving 12-month and long-term investment potential.
2025-10-05,Wall Street Brunch: Hooray For DevDay,SeekingAlpha,"Sam Altman will give the DevDay keynote. Government shutdown now seen lasting three weeks. Bitcoin top $125,000 for first time."
2025-10-05,3 Reasons To Be Optimistic Around Biotech In Q4,SeekingAlpha,"Biotech is outperforming the S&P 500 and NASDAQ as M&A heats up and Q4 tailwinds emerge, signaling more upside ahead. Read more on the sector breakdown here."
2025-10-07,Wall Street Breakfast Podcast: Deals Dont Wait Til November,SeekingAlpha,Holiday shopping starts early with retailersâ competing deal events. Novo Nordisk cuts hit production line jobs at key US plant - report. AppLovin shares tumble following SEC probe report.
2025-10-07,Novo Nordisk: Oral Wegovy Nears FDA Decision As GLP-1 Momentum Builds,SeekingAlpha,"Novo Nordisk is well-positioned in the obesity drug market, with strong financials and anticipation for its oral Wegovy pill. See why NVO stock is a Buy now."
2025-10-07,Novo Nordisk: A Profitable Investment In The Long Term,SeekingAlpha,Novo Nordisk is one of Europeâs largest companies and a global leader in the treatment of two major lifestyle diseases â diabetes and obesity. Read more here.
2025-10-09,Market Chatter: Novo Nordisk CEO Poised to Take Risks in Weight-Loss Rivalry,Yahoo,Novo Nordisk (NVO) Chief Executive Officer Mike Doustdar said he is poised to face calculated risks
2025-10-09,Novo Nordisks Akero Deal: Panic Buy Or Wise Decision? Heres My Take,SeekingAlpha,Novo Nordisk acquires Akero Therapeutics for $5.2B to boost its metabolic disease pipeline with EFX. Check out what this means to NVO and AKRO shareholders.
2025-10-09,Is Novo Nordisk Stock a Sell Despite its 10% Price Rally in a Month?,Yahoo,"NVOs 10% stock price rally masks deeper challenges as competition, restructuring and slower growth weigh on its outlook."
2025-10-09,Novo Nordisk A/S (NVO) M&A Call Transcript,SeekingAlpha,"Novo Nordisk A/S (NVO) M&A Call October 9, 2025 8:00 AM EDTCompany ParticipantsJacob Martin Rode - Head of Investor RelationsMaziar Doustdar -..."
2025-10-10,"Earnings, Fed Rates Mean Stocks Can Ignore the Shutdown. This Could Change That.",Yahoo,"Government shutdown hits day 10, U.S. begins Argentine rescue, Amazon Prime shoppers snapped up necessities, and more news to start your day."
2025-10-10,Why Shares in Viking Therapeutics Surged This Week,Yahoo,The small-cap pharmaceutical company may be the next in line as takeover fever heats up.
2025-10-10,GoodRx: Novo Deal And TrumpRx Talks Point To Ebitda/FCF Upside,SeekingAlpha,"GoodRx Holdings, Inc. seeks growth via Novo Nordisk and TrumpRx deals, boosting revenue per user. Click for more on investment insights and risks of GDRX stock."
2025-10-10,Can Novo Nordisks Aggressive Deal-Making Offset Semaglutide Reliance?,Yahoo,"NVOs $4.7B acquisition of Akero Therapeutics adds a late-stage MASH therapy to its obesity-linked pipeline, advancing its expansion goal beyond semaglutide."
2025-10-11,Global Protein Drugs Market to Reach $655.7 Billion by 2029,Yahoo,"“BCC Research analyzes how innovation in biomanufacturing, ESG trends, and strategic investments are shaping the next frontier of protein-based therapeutics.”Boston, Oct. 10, 2025 (GLOBE NEWSWIRE) -- As demand for targeted, biologic-based treatments continues to grow, protein drugs are transforming how pharmaceutical companies address chronic, genetic, and life-threatening diseases. From monoclonal antibodies (mAbs) to peptide hormones and vaccines, global leaders such as AbbVie, Novo Nordisk an"
