date,headline,source,summary
2025-02-05,Wall Street Lunch: USPS U-Turn,SeekingAlpha,United States Postal Service announced that it will continue accepting all international inbound mail and packages from China and Hong Kong Posts
2025-02-07,"Eli Lilly Q4: Dont Miss Out On 2025 Gains, Theres Limited Space Left",SeekingAlpha,"Eli Lillys strong momentum in blockbuster therapies and promising pipeline signals future growth, but competition and pricing challenges loom. See more here."
2025-02-09,Fidelity Diversified International Fund Q4 2024 Review,SeekingAlpha,"For the fourth quarter, the funds Retail Class shares returnedÂ -7.11%, outpacing the -8.09% result of the benchmark, the MSCI EAFE Index. Read more here."
2025-02-11,Invesco International Diversified Fund Q4 2024 Commentary,SeekingAlpha,The fundâs underlying portfolios are biased toward quality companies with favorable long-term prospects.
2025-02-11,Invesco EQV European Equity Fund Q4 2024 Commentary,SeekingAlpha,Class A shares underperformed the MSCI Europe Index for the quarter. The leading detractors from relative return were stock selection in industrials and health care.
2025-02-13,Novo Nordisk: Dips Like These Come Once Every Few Years,SeekingAlpha,Novo Nordisk shares dropped due to CagriSema trial results but have long-term upside. Learn why NVO stock is a Strong Buy with promising growth in obesity care.
2025-02-13,Janus Henderson Global Life Sciences Fund Q4 2024 Commentary,SeekingAlpha,The Janus Henderson Global Life Sciences Fund returned -11.16% and the MSCI World Health Care IndexSM returned -11.40%. Click here to read the full commentary. 
2025-02-17,Parnassus Value Equity Fund Q4 And 2024 Annual Investment Commentary,SeekingAlpha,"The Parnassus Value Equity Fund returned -1.48% (net) for Q4 2024, outperforming the Russell 1000 Value Indexâs -1.98%. Click here to read the full commentary. "
2025-02-19,A Rip Van Winkle Portfolio: Invest In These Companies And Forget You Did It,SeekingAlpha,"Explore the Rip Van Winkle portfolio strategy: Long-term investments in top tech, health, and consumer staples for stability, growth, and reliable returns. Read what investors need to know."
2025-02-19,Hims & Hers Q4 Preview: Is The Super Bowl Ad Worth $5B In Market Cap? (Rating Downgrade),SeekingAlpha,Investors could be overestimating the contribution of Hims & Hers compounded GLP-1 medications to its top line. Read why I recommend HIMS stock a Hold.
2025-02-20,Harbor Diversified International All Cap Fund Q4 2024 Commentary,SeekingAlpha,"During Q4 2024, the Harbor Diversified International All Cap Fund returned -7.58%, performing broadly in line with its benchmark."
2025-02-24,Afraid Of Investing In Individual Stocks? Consider This ETF Trifecta,SeekingAlpha,I have been recently adding ETFs as these are also great for building wealth. Check out the ETF trifecta you should consider for your portfolio and why.
2025-02-25,Eli Lilly: Load Up Before It Leaves You Behind,SeekingAlpha,"Eli Lilly stock surges past $840, outperforming the S&P 500. Click here to learn why LLY stock is still undervalued and why now might be the time to invest."
2025-02-25,Wall Street Breakfast Podcast: Bitcoin Slips Below $90K As Crypto Stumbles,SeekingAlpha,"Bitcoin breaks below $90,000 as crypto selloff deepens. Apple, Indonesia reportedly agree on terms to end iPhone 16 ban. Drug compounders sue FDA over semaglutide status: report."
2025-02-25,Hims & Hers: Why This Q4 Earnings Dip Is A Buying Opportunity,SeekingAlpha,"Hims & Hers dipped 19% post-Q4 earnings. Read here for HIMS stocks growth trends, margin concerns, and why this could be a strong long-term buying opportunity."
2025-02-27,Tracking Terry Smiths Fundsmith 13F Portfolio - Q4 2024 Update,SeekingAlpha,"Read here for an update on Fundsmiths latest 13F portfolio shifts with reduced major stakes, new small positions, and notable disposals."
2025-02-28,Madrigal Pharmaceuticals: Rezdiffra First-Mover Advantage Gains Traction (Upgrade),SeekingAlpha,Madrigal Pharmaceuticals Rezdiffra had a strong launch with $103.3M in Q4 sales and solid liquidity. See why I have a positive outlook on MDGL stock.
2025-03-03,Carillon ClariVest International Stock Fund Q4 2024 Commentary,SeekingAlpha,"Carillon ClariVest International Stock Fund was most overweight the information technology and consumer discretionary sectors, and most underweight materials and financials."
2025-03-05,The Global Growth Engine: 2025 And Beyond,SeekingAlpha,"Going into 2025, the PGM remains strong, with the potential for other regions to start closing the gap with the United States. Click to read."
2025-03-07,Fidelity Magellan Fund Q4 2024 Review,SeekingAlpha,"For the final quarter of 2024, the fund gained 1.08%, trailing the 2.41% advance of the benchmark S&P 500Â® index. Read more here."
2025-03-08,Buy Two Ideal March Safer Dividend Dogs Of 34 Barrons 2025 Pro-Picks,SeekingAlpha,"My monthly update and commentary on the top dividend stock picks sourced from Barrons, March 2025 edition. Standout choices included AT&T (T). Read the full report here on Seeking Alpha."
2025-03-11,Fidelity International Growth Fund Q4 2024 Review,SeekingAlpha,"For the final quarter of 2024, the funds Retail Class shares returnedÂ -5.91%, outpacing the -9.08% result of the benchmark MSCI EAFE Growth Index (Net MA)."
2025-03-11,"Viking Therapeutics: Finally, Here Comes The Buying Opportunity (Upgrade)",SeekingAlpha,"Viking Therapeutics remains speculative despite progress in its clinical portfolio, notably the VK2735 program for obesity. Click here to read why VKTX is a Buy."
2025-03-12,Roche And Zealand Team Up To Develop Petrelintide,SeekingAlpha,"Roche & Zealand join forces on petrelintide, advancing obesity treatments with innovative amylin analogs. Find out why this deal is a win-win for RHHBY & ZLDPF."
2025-03-12,Tracking Renaissance Technologies 13F Portfolio - Q4 2024 Update,SeekingAlpha,"Renaissance Technologies 13F reveals shifts in a $67.6B portfolio with notable changes in Palantir, Novo Nordisk, and NVIDIA. Read a portfolio update here."
2025-03-14,BNY Mellon Appreciation Fund Q4 2024 Commentary,SeekingAlpha,The BNY Mellon Appreciation Fund underperformed the S&P 500 Index in the fourth quarter of 2024.Click here to read the full commentary. 
2025-03-17,"We Could Have A Clear Shot To 6,000, But Be Proactive",SeekingAlpha,"A potential rally to 6,000 is possible if retail sales are positive and the FOMC Meeting is dovish. Read why investors should focus on Fab 5."
2025-03-18,Wall Street Analysts Predict a 44.2% Upside in Novo Nordisk (NVO): Heres  What You Should Know,Yahoo,"The consensus price target hints at a 44.2% upside potential for Novo Nordisk (NVO). While empirical research shows that this sought-after metric is hardly effective, an upward trend in earnings estimate revisions could mean that the stock will witness an upside in the near term."
2025-03-19,Novo Nordisk A/S (NVO) Dropped as Trial Results Fell Short of Expectations,Yahoo,"Polen Capital, an investment management company, released its “Polen Global Growth Strategy” fourth-quarter 2024 investor letter. A copy of the letter can be downloaded here. Over the past two years, global equities (2023-2024) showed a historic +45% cumulative return as per the MSCI ACWI Index (the “Index”), emphasizing market unpredictability and the futility of macroeconomic […]"
2025-03-19,"Weekly Picks: ? Novo Nordisk’s breakout, Nike’s reinvention, and Rheinmetalls opportunity",Yahoo,"This week’s picks cover: Why Novo Nordisk will continue to dominate, how Nikes new DTC focus will restart growth, and why Rheinmetall is well positioned for Europes remilitarization."
2025-03-19,Novo Nordisk (NVO): Among the Best Diabetes Stocks to Buy According to Billionaires,Yahoo,"We recently published a list of 10 Best Diabetes Stocks To Buy According to Billionaires. In this article, we are going to take a look at where Novo Nordisk A/S (NYSE:NVO) stands against other best diabetes stocks to buy according to billionaires. The Growing Market and Innovation in Continuous Glucose Monitoring (CGM) Technology The WHO […]"
2025-03-20,Invesco Health Care Fund Q4 2024 Commentary,SeekingAlpha,"Stock selection in life science tools & services, pharmaceuticals and distributors detracted from relative performance, as did an overweight in health care facilities."
2025-03-24,Ariel International And Global Fudns Q4 2024 Commentary,SeekingAlpha,Ariels international strategies led their respective primary benchmarks for 2024 full year. Click here to read the full commentary. 
2025-03-30,Eli Lilly Vs. Novo Nordisk: Which Is The Better Bargain For Investors,SeekingAlpha,Eli Lilly and Novo Nordisk occupy leading positions in the obesity and diabetes markets. Find out which is the better bargain for investors.
2025-03-31,PGIM Jennison Global Opportunities Fund Q4 2024 Commentary,SeekingAlpha,"The PGIM Jennison Global Opportunities Fund returned -0.6%, holding up slightly better than the MSCI ACWI Index. Click here to read the full commentary. "
2025-03-31,PGIM Jennison Growth Fund Q4 2024 Commentary,SeekingAlpha,"The PGIM Jennison Growth Fund rose 6.5%, slightly underperforming the Russell 1000 Growth Index for Q4 2024. Click here to read the full commentary. "
2025-04-04,SCHD Alternative Strategy: Weathered March Better Than The S&P 500,SeekingAlpha,"The 4-factor dividend growth strategy is up 7% YTD in 2025, outperforming SCHD by 7.35%. Find out how itâs delivered a 16.97% CAGR since launch."
2025-04-07,Thornburg International Growth Fund Q4 2024 Commentary,SeekingAlpha,"In 4Q24 Thornburg International Growth Fund (I share class) returned -8.97%, -109 basis points behind the MSCI ACWI ex-U.S. Growth Index. Read more here."
2025-04-08,Thornburg Summit Fund Q4 2024 Commentary,SeekingAlpha,"In 4Q24 Thornburg Summit Fund (I share class) returned -1.82%, 82 basis points ahead of the Blended Index (60% MSCI ACWI Index and 40% Bloomberg Global Aggregate Index)."
2025-04-11,Harbor International Fund Q4 2024 Commentary,SeekingAlpha,"During the fourth quarter of 2024, The Harbor International Fund returned -8.22%, slightly underperforming its benchmark, the MSCI EAFE (ND) Index, which returned -8.11%."
2025-04-11,Harbor International Compounders ETF Q4 2024 Commentary,SeekingAlpha,"The Harbor International Compounders ETF returned -9.22% compared to the MSCI All Country World ex-US Index, which returned -7.60%."
2025-04-14,ClearBridge International Growth ACWI Ex-U.S. Strategy Q1 2025 Commentary,SeekingAlpha,"During the first quarter, the ClearBridge International Growth ACWI Ex-US Strategy outperformed its MSCI ACWI Ex-U.S. Index benchmark. Read more here."
2025-04-16,Viking Therapeutics: Trading The Volatility Of The Weight Loss Drug Market,SeekingAlpha,"Viking Therapeutics, Inc.s VK2735 has potential as a GLP-1 for obesity amid Pfizers exit, but competition and financing risks remain. Click to know why VKTX is a Buy."
2025-04-16,BGY: Underlying Fundamentals Can Be Improved,SeekingAlpha,BlackRock Enhanced International Dividend Trusts inconsistent earnings and distribution coverage make it unsuitable for long-term investors. See BGY is a Hold.
2025-04-17,“I Am a Buyer”: Jim Cramer Backs Novo Nordisk (NVO) After Its Sharp Decline,Yahoo,"We recently published a list of Jim Cramer Discussed These 12 Stocks Recently. In this article, we are going to take a look at where Novo Nordisk A/S (NYSE:NVO) stands against other stocks that Jim Cramer discussed recently. On Friday, Mad Money host Jim Cramer addressed growing concerns in the market as tensions between the […]"
2025-04-18,"Novo Nordisk Stock Drops on Eli Lilly Oral Weight-Loss Drug Success, Downgrade",Yahoo,U.S.-listed shares of Novo Nordisk plunged 7% in intraday trading Thursday after rival Eli Lilly reported positive oral weight-loss drug news and BMO cut its rating for the Danish drug developers stock.
2025-04-18,Novo Nordisk downgraded by BMO as Eli Lilly gains ground in weight-loss drug race,Yahoo,"Investing.com -- BMO Capital Markets downgraded Novo Nordisk (NYSE:NVO) to “Market Perform” from “Outperform” and cut its price target to $64, saying the Danish drugmaker’s early lead in the obesity drug market is being overtaken by rival Eli Lilly’s rapidly advancing pipeline."
2025-04-18,Eli Lilly jumps as results from weight-loss pill study rival competitor’s,Yahoo,"Shares of Eli Lilly (LLY) jumped on Thursday morning after the company announced topline Phase 3 results from ACHIEVE-1, evaluating the safety and efficacy of orforglipron compared to placebo in adults with type 2 diabetes and inadequate glycemic control with diet and exercise alone. Commenting on the news, Leerink said that the once-daily oral GLP-1 pill showed similar efficacy and safety relative to weekly injectable semaglutide, made by Novo Nordisk (NVO). PRIMARY ENDPOINT MET: Eli Lilly anno"
2025-04-22,Is Novo Nordisk A/S (NVO) The Top Falling Stock with Unusual Volume?,Yahoo,"We recently published a list of Top 20 Falling Stocks with Unusual Volume. In this article, we are going to take a look at where Novo Nordisk A/S (NYSE:NVO) stands against other top falling stocks with unusual volume. Uncertainty around tariffs and macroeconomic conditions has dented investor confidence, resulting in stock prices falling. While some […]"
2025-04-25,ClearBridge International Growth ADR ESG Portfolios Q1 2025 Commentary,SeekingAlpha,"Led by a sharp revival in Europe, international equities delivered strong gains in Q1 as increasing policy uncertainty in US spurred investors to look overseas for more predictable returns."
2025-04-25,Eli Lilly: Positioned For Robust Q1 As Orforglipron Enhances Long-Term Outlook,SeekingAlpha,"Eli Lillys Orforglipron shines in Phase III trials, potentially leading diabetes and obesity treatment by 2026. See what to expect from LLYs Q1 results."
2025-04-29,"Eli Lilly: Why Orforglipron Matters, A Lot",SeekingAlpha,"Eli Lilly and Companys orforglipron had good results in Type 2 diabetes trials, potentially becoming the first scalable oral obesity drug. Click for my LLY update."
2025-04-29,Growth Is Priced Out Of Novo Nordisk,SeekingAlpha,"Novo Nordisk A/S faces challenges in the obesity market, but new trials and innovations offer hope. Read more on NVO stock prospects."
2025-04-29,Hims & Hers Health: GLP-1 Deals De-Risk The Story,SeekingAlpha,"Hims & Hers Health partners with Novo Nordisk (NVO) to offer Wegovy, boosting weight-loss solutions. See why I remain ultra-bullish on HIMS stock."
2025-04-30,The Davenport Core Leaders Fund Q1 2025 Commentary,SeekingAlpha,"The Davenport Core Leaders Fund declined 3.48% in Q1 2025, although it did exceed its benchmark. Click here to read the full commentary. "
2025-05-01,Hims & Hers: Revolutionizing Healthcare,SeekingAlpha,"Hims & Hers is an increasingly profitable, vertically integrated telehealth platform with major tailwinds, positioning it as a long-term healthcare disruptor. Read more on HIMS stock here."
2025-05-02,"9 Dividend Aristocrats Potentially Set To Soar, No Matter What Happens Next",SeekingAlpha,"Discover 3 Dividend Aristocrat strategies: low-volatility, high-yield, and growth picks."
2025-05-03,"Ford, Disney, And AMD To Report Results Next Week",SeekingAlpha,"Marquee earnings releases this week include AMD, F, PLTR & NVO. Stay ahead of the market with Seeking Alphas Wall Street Week Ahead newsletter."
2025-05-06,Hims & Hers: Strong Q1 Masks Problematic Long-Term Value Proposition,SeekingAlpha,"Hims & Hers Health, Inc.s Q1 results show 111% growth, yet shares fell 8%. Click for a look at the impact of drug access, competition, and growth sustainability."
2025-05-08,Invesco EQV European Equity Fund Q1 2025 Commentary,SeekingAlpha,"Our actively managed, bottom-up stock selection drives the fundâs sector and country allocations."
2025-05-08,Hims & Hers: The Road To Blue Chip Status,SeekingAlpha,Hims & Hers achieved 136% YoY subscriber growth and unveiled ambitious 2030 goals. Discover how precision medicine drives their best quarter yet.
2025-05-09,Invesco International Diversified Fund Q1 2025 Commentary,SeekingAlpha,Invesco International Diversified Fund offers investors broad-based exposure to non-US equities by combining 4 portfolios that varied individual mandates regarding region & company size.
2025-05-12,Hims & Hers: Wegovy Deal Opens New Growth Chapter - Missed The Rally? Selling Puts Could Yield 30%,SeekingAlpha,"Hims & Hers rebounds with key partnerships and launches, achieving 111% YoY revenue growth. Learn more about HIMS stock here."
2025-05-17,Zealand: Promising Roche-Partnered Obesity Drug Developer - But Stock Is Pricey,SeekingAlpha,"Zealand Pharma A/S obesity drug pipeline, including petrelintide, shows promise but faces high risks. Click to explore ZLDPF market potential and challenges."
2025-05-21,BMO Capital Maintains Cautious Outlook on Novo Nordisk Amid CEO Transition,Yahoo,"On May 19, BMO Capital Markets reaffirmed its “Market Perform” rating and $64.00 price target for Novo Nordisk A/S (NYSE:NVO) following the announcement of a CEO transition. Analysts view the leadership change as a response to competitive pressures and shareholder demands, but warn that without a strategic shift, challenges may persist. On May 16, Novo […]"
2025-05-22,"New Novo Nordisk initiatives support patient access to authentic, FDA-approved Wegovy® as federal ban on mass compounding of semaglutide takes effect",Yahoo,"Today, as the US Food and Drug Administration (FDA) grace period for mass compounding of semaglutide expires, Novo Nordisk announced a series of initiatives to further support patient access to authentic, FDA-approved Wegovy® (semaglutide) injection 2.4 mg. As the companys efforts to safeguard patients from the dangers of illicit and illegal compounded semaglutide continues, a one-time offer for self-paying patients new to Wegovy® is now available for a limited time, through June 30, 2025."
2025-05-22,Wegovy and Zepbound costs capped at $200 in new Evernorth programme,Yahoo,The lower out-of-pocket costs come at a time of governmental scrutiny on prescription drug prices in the US.
2025-05-23,"Pharma Stock Roundup: NVO CEO Resigns, SNY to Buy VIGL & More",Yahoo,NVO CEO exits amid pressure. Sanofi is set to buy VIGL. Pfizer inks $1.25B 3SBio deal. FDA okays Roche eye drug for new indication. Merck starts key cancer study.
2025-05-23,Cigna Announced a New Agreement for Copay Caps on Eli Lilly and Novo Nordisk Weight Loss Drugs,Yahoo,"The Cigna Group (NYSE:CI)’s Evernorth division has announced a new deal with Novo Nordisk and Eli Lilly that will limit insured customers’ monthly out-of-pocket expenses for weight-loss drugs Zepbound and Wegovy to $200. Beginning in the second half of 2025, the program targets businesses that do not already cover these drugs because of their high […]"
2025-05-25,Why Hims & Hers Health Stock (HIMS) Is Too Hot to Handle,Yahoo,"Hims & Hers Health (HIMS) has captured significant market attention in 2025 with its dramatic stock swings, starting the year around $25, soaring above $70, dipping back near $25, and now rebounding past $52. Despite the volatility, the stock is up over 120% year-to-date, ranking it among the best-performing mid- to large-cap names, with a market valuation exceeding $13 billion. So, what’s behind this massive surge in value? Hims’ unmatched ability to capitalize on the booming demand for GLP-1 d"
2025-05-28,Jim Cramer Notes Eli Lilly (LLY) Stock is at a “Decent Level to Start a Position”,Yahoo,"We recently published a list of Jim Cramer Had These 21 Stocks on His Radar. In this article, we are going to take a look at where Eli Lilly and Company (NYSE:LLY) stands against other stocks that Jim Cramer discusses. A caller asked what Cramer’s thoughts on Eli Lilly and Company (NYSE:LLY) were, and he […]"
2025-05-30,Was Jim Cramer Right About Eli Lilly and Company (LLY)?,Yahoo,"We recently published a list of Did Jim Cramer Nail or Miss These 11 Stock Predictions? In this article, we are going to take a look at where Eli Lilly and Company (NYSE:LLY) stands against other stocks that Jim Cramer discusses. In that episode, a caller asked about Eli Lilly and Company (NYSE:LLY), particularly in […]"
2025-05-30,2 Beaten-Down Stocks to Buy on the Dip,Yahoo,"Novo Nordisk has strengths, including a deep pipeline, that should help it overcome recent obstacles.  Cava Groups results are excellent, and in the long run the restaurant chain still has strong potential.  Novo Nordisk (NYSE: NVO) and Cava Group (NYSE: CAVA) are excellent choices."
2025-05-31,Hims to cut 4% of workforce amid ban on weight-loss drug copies,Yahoo,"NEW YORK (Reuters) -Telehealth platform Hims & Hers said on Friday it will cut 68 employees, or about 4% of its workforce, as it adjusts to a U.S. ban on manufacturing mass copies of the weight-loss drug Wegovy.  A U.S. Food and Drug Administration ban on compounded copies of Wegovy, made by Novo Nordisk, took effect on May 22.  The company said it is seeking new opportunities for growth, including an agreement with Novo to help patients access Wegovy."
2025-06-04,1 Underrated Reason to Buy This Market-Beating Stock,Yahoo,"Eli Lilly recently acquired a smaller biotech for its promising investigational pain medication.  The company generates strong sales from products outside of diabetes and obesity care.  Eli Lillys portfolio, both within and outside its core area, makes the stock attractive."
2025-06-09,Obesity Newcomer Metsera Enters The Ring With A Punch — And A Big Stock Jump,Yahoo,Metsera stock surged Monday after the drugmaker unveiled solid results for a potential monthly shot to stoke weight loss.
2025-06-10,Analysis: Hims & Hers says its weight-loss business can grow as US market changes,Yahoo,"(Reuters) -Hims & Hers Health is betting that the cash-pay market for weight-loss drugs will drive up customer demand although some analysts see a need for the online website to adjust to changing competition in the U.S.  Hims has thrived in the market for cheaper compounded versions of highly in-demand weight-loss drugs, such as Novo Nordisks Wegovy.  This was allowed by the U.S. Food and Drug Administration when those drugs were in shortage."
2025-06-10,"Stocks to Watch Tuesday: Tesla, TSMC, Novo Nordisk",Yahoo,↗️ Tesla (TSLA): Shares of the electric-vehicle maker continued their rebound from the rout last week that was sparked by Elon Musks fallout with President Trump. The stock rose more than 1% . ↗️ Taiwan Semiconductor (TW:2330); (TSM): The worlds largest contract chip maker reported a 40% rise in revenue in May compared to a year earlier.
2025-06-10,Harbor International Compounders ETF Q1 2025 Commentary,SeekingAlpha,"During Q1, the Harbor International Compounders ETF returned 1.47% (at NAV), underperforming its benchmark, the MSCI All Country World ex-US Index, which returned 5.23%."
2025-06-11,NVO Stock Gains After Parvus Asset Management Builds Stake,Yahoo,Novo Nordisk jumps 5% as Parvus Asset Management builds a stake to sway CEO succession amid leadership shakeup and pipeline buzz.
2025-06-11,The cheap fat jabs sending big pharma into a frenzy,Yahoo,"For many Americans who tuned in to watch the Super Bowl earlier this year, it was a surprise to find themselves fat-shamed during the ad break."
2025-06-12,Promising Results Of Amylin Analogs In Obesity: Metsera Case Review,SeekingAlpha,"Metsera is advancing promising obesity treatments with amylin and GLP-1 analogs, eyeing competitive efficacy and buyout potential. Read why MTSR stock is a hold."
2025-06-13,Novo Nordisk regains crown as Europes most valuable company,Yahoo,"LONDON (Reuters) -Drugmaker Novo Nordisk (NVO) is once again Europes largest company by market capitalisation, rising above German software firm SAP on Friday."
2025-06-17,Novo Nordisk is losing Canadian patent protection on a blockbuster drug after not paying a small fee,Yahoo,"I’m sure someone’s lost their job, said the CEO of Sandoz, which has now filed to launch a generic GLP-1 in Canada next year."
2025-06-17,Fresenius Medical Care CEO Says Company Could Benefit From Obesity Drugs,Yahoo,EXCLUSIVE: The dialysis company believes the impact of the treatments on its own performance will be ‘neutral to positive’ rather than negative.
2025-06-18,"GSK Stock Rises Almost 22% in 6 Months: Time to Buy, Sell or Hold?",Yahoo,"GSK stock is up 21.5% in six months, fueled by strong Specialty Medicines growth and a promising pipeline despite vaccine headwinds."
2025-06-21,"Muscle-preserving drugs could generate over $30 billion in sales by 2035, TD Cowen says",Yahoo,"(Reuters) -Treatments designed to help patients preserve muscle while losing weight with popular obesity drugs by Eli Lilly and Novo Nordisk could generate more than $30 billion in sales by 2035, analysts at TD Cowen said on Friday.  About a dozen companies are racing to develop such therapies, most of which are being tested in combination with Lillys Zepbound or Novos Wegovy, both of which target the GLP-1 protein to help control appetite.  Investors are closely watching mid-stage data from Lillys muscle mass-preserving drug, bimagrumab, which is scheduled for presentation at a medical conference next week."
2025-06-23,Top Midday Stories: Oil Prices Rise Amid Rising Tensions in Middle East; Novo Nordisk Ends Collaboration With Hims & Hers,Yahoo,All three major US stock indexes were up in late-morning trading Monday after the US strikes on thre
2025-06-23,European Equities Close Lower in Monday Trading; Eurozone Manufacturing Remains in Expansion in June,Yahoo,"The European stock markets closed lower in Monday trading as The Stoxx Europe 600 lost 0.19%, German"
